"Status","Start Time","Stop Time","Duration in ms","Parent Suite","Suite","Sub Suite","Test Class","Test Method","Name","Description"
"passed","Thu Oct 17 10:45:30 UTC 2024","Thu Oct 17 10:45:34 UTC 2024","4116","","More Options Menu - Offline User: All permissions disabled","","","","should hide the kebab menu in Messages, People and Reports tabs",""
"passed","Thu Oct 17 10:52:58 UTC 2024","Thu Oct 17 10:53:23 UTC 2024","25597","","Privacy policy: for an offline user","","","","should show if the user policy changes",""
"passed","Thu Oct 17 10:46:31 UTC 2024","Thu Oct 17 10:46:33 UTC 2024","1589","","More Options Menu - Offline User - Delete permissions disabled: Report tab","","","","should enable the 'edit' and 'review' option and hide the 'export' and 'delete' options when the xml report is opened",""
"passed","Thu Oct 17 10:50:15 UTC 2024","Thu Oct 17 10:50:17 UTC 2024","2365","","bfcache: webapp","","","","should redirect to login page when session is expired",""
"passed","Thu Oct 17 10:52:23 UTC 2024","Thu Oct 17 10:52:49 UTC 2024","25638","","Privacy policy: for an offline user","","","","should show the correct privacy policy on login",""
"passed","Thu Oct 17 10:50:12 UTC 2024","Thu Oct 17 10:50:15 UTC 2024","2474","","bfcache: login page","","","","should redirect to the app page when session is valid",""
"passed","Thu Oct 17 10:44:45 UTC 2024","Thu Oct 17 10:44:46 UTC 2024","1234","","More Options Menu - Offline User: All permissions enabled: Contact tab","","","","should hide the 'export' and 'edit' options and disable the 'delete' option when no contact is opened",""
"passed","Thu Oct 17 10:44:50 UTC 2024","Thu Oct 17 10:44:52 UTC 2024","2423","","More Options Menu - Offline User: All permissions enabled: Report tab","","","","should hide the 'export' and 'edit' options and enable the 'delete' and 'review' options when the sms report is opened",""
"passed","Thu Oct 17 10:51:01 UTC 2024","Thu Oct 17 10:51:01 UTC 2024","76","","Navigation tests: Navigation view: as admin","","","","should display tab labels, when all tabs are enabled",""
"passed","Thu Oct 17 10:43:39 UTC 2024","Thu Oct 17 10:43:40 UTC 2024","1086","","MessageFormat","","","","should work with botched translations",""
"passed","Thu Oct 17 10:50:27 UTC 2024","Thu Oct 17 10:50:28 UTC 2024","1676","","Hamburger Menu tests","","","","should open User settings",""
"passed","Thu Oct 17 10:42:10 UTC 2024","Thu Oct 17 10:42:10 UTC 2024","187","","Login page funcionality tests: Locale","","","","should show locale selector on login page",""
"passed","Thu Oct 17 10:48:58 UTC 2024","Thu Oct 17 10:49:02 UTC 2024","4906","","User Test Cases ->: Invalid entries -> ","","","","TestCase for The password must be at least 8 characters long.",""
"passed","Thu Oct 17 10:44:03 UTC 2024","Thu Oct 17 10:44:04 UTC 2024","1426","","Bikram Sambat date display","","","","SMS report shows bsAggreDate type as date field correctly",""
"passed","Thu Oct 17 10:41:56 UTC 2024","Thu Oct 17 10:42:00 UTC 2024","4439","","Acessing the admin app","","","","should show access error when accessing as an offline user",""
"passed","Thu Oct 17 10:44:44 UTC 2024","Thu Oct 17 10:44:44 UTC 2024","703","","More Options Menu - Offline User: All permissions enabled: Message tab","","","","should hide the kebab menu.",""
"passed","Thu Oct 17 10:51:45 UTC 2024","Thu Oct 17 10:51:45 UTC 2024","531","","Navigation tests: Navigation view: as chw","","","","should not create feedback docs when loading missing reports or people",""
"passed","Thu Oct 17 10:43:38 UTC 2024","Thu Oct 17 10:43:39 UTC 2024","724","","MessageFormat","","","","should display plurals correctly",""
"passed","Thu Oct 17 10:52:10 UTC 2024","Thu Oct 17 10:52:12 UTC 2024","1090","","Old Navigation","","","","should navigate to the Reports section and open the first report listed",""
"passed","Thu Oct 17 10:48:27 UTC 2024","Thu Oct 17 10:48:31 UTC 2024","4073","","More Options Menu - Online User - Permissions enabled: Options displayed when there are messages, contacts and people created","","","","should enable the 'export' option and hide the 'edit' and 'delete' options in Contact tab when none of the contacts is opened.",""
"passed","Thu Oct 17 10:42:14 UTC 2024","Thu Oct 17 10:42:17 UTC 2024","2964","","Login page funcionality tests: Log out","","","","should show a warning before log out",""
"passed","Thu Oct 17 10:53:33 UTC 2024","Thu Oct 17 10:53:35 UTC 2024","2686","","Privacy policy: for an online user","","","","should show french policy on secondary login",""
"passed","Thu Oct 17 10:53:37 UTC 2024","Thu Oct 17 10:53:38 UTC 2024","1398","","Privacy policy: for an online user","","","","should show if the user policy changes",""
"passed","Thu Oct 17 10:50:18 UTC 2024","Thu Oct 17 10:50:20 UTC 2024","1776","","bfcache: admin app","","","","should redirect to login page when session is expired",""
"passed","Thu Oct 17 10:53:30 UTC 2024","Thu Oct 17 10:53:33 UTC 2024","2563","","Privacy policy: for an online user","","","","should not show on subsequent login",""
"passed","Thu Oct 17 10:48:24 UTC 2024","Thu Oct 17 10:48:25 UTC 2024","1067","","More Options Menu - Online User - Permissions enabled: Options displayed when there are messages, contacts and people created","","","","should enable the 'export', 'edit' and 'delete' options in Contact tab when a contact is opened.",""
"passed","Thu Oct 17 10:47:56 UTC 2024","Thu Oct 17 10:47:57 UTC 2024","1085","","More Options Menu - Online User - Permissions disabled: Edit permissions disabled","","","","should hide the 'edit' and 'delete' options and enable the 'export' option when a contact is opened",""
"passed","Thu Oct 17 10:48:39 UTC 2024","Thu Oct 17 10:48:45 UTC 2024","5346","","User Test Cases ->: Creating Users ->","","","","should add user with valid password",""
"passed","Thu Oct 17 10:42:53 UTC 2024","Thu Oct 17 10:42:55 UTC 2024","2635","","Token login","","","","should redirect the user to the app if already logged in",""
"passed","Thu Oct 17 10:47:57 UTC 2024","Thu Oct 17 10:47:58 UTC 2024","1236","","More Options Menu - Online User - Permissions disabled: Edit permissions disabled","","","","should hide the 'edit', 'delete' and 'review' options and enable the 'export' option when a report is opened",""
"passed","Thu Oct 17 10:48:51 UTC 2024","Thu Oct 17 10:48:57 UTC 2024","5990","","User Test Cases ->: Creating Users ->","","","","should hide and reveal password value, and add user with a revealed password",""
"passed","Thu Oct 17 10:41:54 UTC 2024","Thu Oct 17 10:41:55 UTC 2024","745","","Acessing the admin app","","","","should redirect to login when not logged in",""
"passed","Thu Oct 17 10:48:20 UTC 2024","Thu Oct 17 10:48:21 UTC 2024","1240","","More Options Menu - Online User - Permissions enabled: Options displayed when there are messages, contacts and people created","","","","should enable the 'export', 'review' and 'delete' options and hide the 'edit' option in Report tab when a NON XML report is opened.",""
"passed","Thu Oct 17 10:42:31 UTC 2024","Thu Oct 17 10:42:32 UTC 2024","471","","Login page funcionality tests: Log in","","","","should try to sign in and verify that credentials were incorrect",""
"passed","Thu Oct 17 10:47:42 UTC 2024","Thu Oct 17 10:47:44 UTC 2024","1636","","More Options Menu - Online User - Permissions disabled: Delete permissions disabled","","","","should hide the 'delete' option and enable the 'edit', 'export' and 'review' options when a report is opened",""
"passed","Thu Oct 17 10:48:45 UTC 2024","Thu Oct 17 10:48:51 UTC 2024","6751","","User Test Cases ->: Creating Users ->","","","","should add user with multiple places with permission",""
"passed","Thu Oct 17 10:52:12 UTC 2024","Thu Oct 17 10:52:13 UTC 2024","1431","","Old Navigation","","","","should navigate to the People section and open the created Health Center",""
"passed","Thu Oct 17 10:53:42 UTC 2024","Thu Oct 17 10:54:09 UTC 2024","26168","","Privacy policy: conflicts","","","","should not fail due to document conflict for new offline user",""
"passed","Thu Oct 17 10:44:15 UTC 2024","Thu Oct 17 10:44:26 UTC 2024","10460","","Adding new language","","","","should add new translations",""
"passed","Thu Oct 17 10:42:58 UTC 2024","Thu Oct 17 10:43:00 UTC 2024","1176","","Token login","","","","should display an error when token is expired",""
"passed","Thu Oct 17 10:47:05 UTC 2024","Thu Oct 17 10:47:05 UTC 2024","440","","More Options Menu - Offline User - Edit permissions disabled: Report tab","","","","should hide the kebab menu when the sms report is opened.",""
"passed","Thu Oct 17 10:42:56 UTC 2024","Thu Oct 17 10:42:57 UTC 2024","641","","Token login","","","","should display an error with incorrect url",""
"passed","Thu Oct 17 10:44:47 UTC 2024","Thu Oct 17 10:44:48 UTC 2024","1261","","More Options Menu - Offline User: All permissions enabled: Contact tab","","","","should hide the 'export' option and enable the 'edit' and 'delete' options when a contact is opened",""
"passed","Thu Oct 17 10:44:48 UTC 2024","Thu Oct 17 10:44:49 UTC 2024","1164","","More Options Menu - Offline User: All permissions enabled: Contact tab","","","","should hide the 'export' and 'edit' options and disable the 'delete' option when the offline user's place is selected",""
"passed","Thu Oct 17 10:49:42 UTC 2024","Thu Oct 17 10:49:46 UTC 2024","4756","","Bulk User Creation ->","","","","should show an upload summary with a successful upload and a failed upload",""
"passed","Thu Oct 17 10:50:58 UTC 2024","Thu Oct 17 10:50:59 UTC 2024","358","","Navigation tests: Navigation functionality","","","","should open Reports or History tab",""
"passed","Thu Oct 17 10:50:25 UTC 2024","Thu Oct 17 10:50:27 UTC 2024","1298","","Hamburger Menu tests","","","","should open About",""
"passed","Thu Oct 17 10:50:58 UTC 2024","Thu Oct 17 10:50:58 UTC 2024","796","","Navigation tests: Navigation functionality","","","","should open Messages tab",""
"passed","Thu Oct 17 10:43:07 UTC 2024","Thu Oct 17 10:43:16 UTC 2024","8624","","Enabling/disabling languages","","","","should disable a language and enable another",""
"passed","Thu Oct 17 10:50:04 UTC 2024","Thu Oct 17 10:50:06 UTC 2024","1944","","About page","","","","should open the about page",""
"passed","Thu Oct 17 10:44:26 UTC 2024","Thu Oct 17 10:44:36 UTC 2024","9778","","Adding new language","","","","should support deleting translations",""
"passed","Thu Oct 17 10:53:29 UTC 2024","Thu Oct 17 10:53:30 UTC 2024","798","","Privacy policy: for an online user","","","","should not show on refresh",""
"passed","Thu Oct 17 10:44:11 UTC 2024","Thu Oct 17 10:44:14 UTC 2024","2883","","Adding new language","","","","should show in enabled language list",""
"passed","Thu Oct 17 10:42:41 UTC 2024","Thu Oct 17 10:42:48 UTC 2024","7619","","should renew token","","","","Refresh page multiple times and verify token gets renewed",""
"passed","Thu Oct 17 10:50:58 UTC 2024","Thu Oct 17 10:50:58 UTC 2024","159","","Navigation tests: Navigation functionality","","","","should open tasks tab",""
"passed","Thu Oct 17 10:42:24 UTC 2024","Thu Oct 17 10:42:26 UTC 2024","2146","","Login page funcionality tests: Log in","","","","should display the ""session expired"" modal and redirect to login page",""
"passed","Thu Oct 17 10:52:09 UTC 2024","Thu Oct 17 10:52:10 UTC 2024","1298","","Old Navigation","","","","should navigate to the Task section and open the first task listed",""
"passed","Thu Oct 17 10:53:30 UTC 2024","Thu Oct 17 10:53:30 UTC 2024","120","","Privacy policy: for an online user","","","","should display when navigating to the privacy policy page",""
"passed","Thu Oct 17 10:50:06 UTC 2024","Thu Oct 17 10:50:08 UTC 2024","2617","","About page","","","","should display partners",""
"passed","Thu Oct 17 10:52:50 UTC 2024","Thu Oct 17 10:52:54 UTC 2024","3859","","Privacy policy: for an offline user","","","","should not show on subsequent login",""
"passed","Thu Oct 17 10:43:51 UTC 2024","Thu Oct 17 10:43:54 UTC 2024","3246","","Bikram Sambat date display","","","","enketo xpath extension function should display correct values when Nepali is not selected",""
"passed","Thu Oct 17 10:49:22 UTC 2024","Thu Oct 17 10:49:26 UTC 2024","3927","","User Test Cases ->: Invalid entries -> ","","","","should require username",""
"passed","Thu Oct 17 10:42:11 UTC 2024","Thu Oct 17 10:42:12 UTC 2024","341","","Login page funcionality tests: Locale","","","","should change locale to French",""
"passed","Thu Oct 17 10:48:05 UTC 2024","Thu Oct 17 10:48:07 UTC 2024","1343","","More Options Menu - Online User - Permissions enabled: Options displayed when there are no messages, contacts or people created","","","","should disable the 'export' option in Message tab",""
"passed","Thu Oct 17 10:47:41 UTC 2024","Thu Oct 17 10:47:42 UTC 2024","1232","","More Options Menu - Online User - Permissions disabled: Delete permissions disabled","","","","should hide the 'delete' option and enable the 'edit' and 'export' options when a contact is opened",""
"passed","Thu Oct 17 10:51:44 UTC 2024","Thu Oct 17 10:51:45 UTC 2024","92","","Navigation tests: Navigation view: as chw","","","","should display tab labels, when some tabs are enabled",""
"passed","Thu Oct 17 10:43:54 UTC 2024","Thu Oct 17 10:43:58 UTC 2024","4176","","Bikram Sambat date display","","","","enketo xpath extension function should display correct values when Nepali is selected",""
"passed","Thu Oct 17 10:46:54 UTC 2024","Thu Oct 17 10:47:05 UTC 2024","10973","","More Options Menu - Offline User - Edit permissions disabled: Contact tab","","","","should hide the kebab menu.",""
"passed","Thu Oct 17 10:52:06 UTC 2024","Thu Oct 17 10:52:09 UTC 2024","3618","","Old Navigation","","","","should navigate to the Messages section and open a sent message",""
"passed","Thu Oct 17 10:50:59 UTC 2024","Thu Oct 17 10:50:59 UTC 2024","178","","Navigation tests: Navigation functionality","","","","should open Contacts or Peoples tab",""
"passed","Thu Oct 17 10:49:17 UTC 2024","Thu Oct 17 10:49:22 UTC 2024","4919","","User Test Cases ->: Invalid entries -> ","","","","TestCase for required",""
"passed","Thu Oct 17 10:43:00 UTC 2024","Thu Oct 17 10:43:02 UTC 2024","1945","","Token login","","","","should log the user in when token is correct",""
"passed","Thu Oct 17 10:42:01 UTC 2024","Thu Oct 17 10:42:05 UTC 2024","3460","","Acessing the admin app","","","","should allow admins to access the page",""
"passed","Thu Oct 17 10:50:49 UTC 2024","Thu Oct 17 10:50:51 UTC 2024","2056","","Hamburger Menu tests","","","","should open Configuration app",""
"passed","Thu Oct 17 10:47:27 UTC 2024","Thu Oct 17 10:47:29 UTC 2024","2517","","More Options Menu - Online User - Permissions disabled: Export permissions disabled","","","","should hide the 'export' option and enable the 'edit', 'delete' and 'review' options when a report is opened",""
"passed","Thu Oct 17 10:42:33 UTC 2024","Thu Oct 17 10:42:35 UTC 2024","2112","","Login page funcionality tests: Log in","","","","should hide and reveal password value, and login with a revealed password",""
"passed","Thu Oct 17 10:47:26 UTC 2024","Thu Oct 17 10:47:27 UTC 2024","1226","","More Options Menu - Online User - Permissions disabled: Export permissions disabled","","","","should hide the 'export' option and enable the 'edit' and 'delete' options when a contact is opened",""
"passed","Thu Oct 17 10:53:28 UTC 2024","Thu Oct 17 10:53:29 UTC 2024","1072","","Privacy policy: for an online user","","","","should show the correct privacy policy on login",""
"passed","Thu Oct 17 10:42:13 UTC 2024","Thu Oct 17 10:42:13 UTC 2024","323","","Login page funcionality tests: Locale","","","","should change locale to Spanish",""
"passed","Thu Oct 17 10:48:08 UTC 2024","Thu Oct 17 10:48:09 UTC 2024","1107","","More Options Menu - Online User - Permissions enabled: Options displayed when there are no messages, contacts or people created","","","","should disable the 'export' option and hide the 'edit' and 'delete' options in Contact tab",""
"passed","Thu Oct 17 10:48:22 UTC 2024","Thu Oct 17 10:48:23 UTC 2024","1217","","More Options Menu - Online User - Permissions enabled: Options displayed when there are messages, contacts and people created","","","","should enable the 'export', 'review', 'edit' and 'delete' options in Report tab when a XML report is opened.",""
"passed","Thu Oct 17 10:49:53 UTC 2024","Thu Oct 17 10:49:59 UTC 2024","6657","","Create user meta db : ","","","","should allow a new user to read/write from meta db",""
"passed","Thu Oct 17 10:52:13 UTC 2024","Thu Oct 17 10:52:13 UTC 2024","272","","Old Navigation","","","","should navigate to the Targets section, and open a target aggregate",""
"passed","Thu Oct 17 10:42:18 UTC 2024","Thu Oct 17 10:42:20 UTC 2024","1481","","Login page funcionality tests: Log in","","","","should log in using username and password fields",""
"passed","Thu Oct 17 10:50:45 UTC 2024","Thu Oct 17 10:50:48 UTC 2024","2403","","Hamburger Menu tests","","","","should open Report bug",""
"passed","Thu Oct 17 10:48:17 UTC 2024","Thu Oct 17 10:48:19 UTC 2024","1558","","More Options Menu - Online User - Permissions enabled: Options displayed when there are messages, contacts and people created","","","","should enable the 'export' option in Message tab.",""
"passed","Thu Oct 17 10:46:31 UTC 2024","Thu Oct 17 10:46:31 UTC 2024","495","","More Options Menu - Offline User - Delete permissions disabled: Report tab","","","","should hide the kebab menu when the sms report is opened",""
"passed","Thu Oct 17 10:52:57 UTC 2024","Thu Oct 17 10:52:58 UTC 2024","570","","Privacy policy: for an offline user","","","","should show if the user changes their language",""
"passed","Thu Oct 17 10:49:28 UTC 2024","Thu Oct 17 10:49:35 UTC 2024","6116","","User Test Cases ->: Invalid entries -> ","","","","should require user to have permission for multiple places",""
"passed","Thu Oct 17 10:52:54 UTC 2024","Thu Oct 17 10:52:57 UTC 2024","3485","","Privacy policy: for an offline user","","","","should show french policy on secondary login",""
"passed","Thu Oct 17 10:53:35 UTC 2024","Thu Oct 17 10:53:37 UTC 2024","1231","","Privacy policy: for an online user","","","","should show if the user changes their language",""
"passed","Thu Oct 17 10:47:05 UTC 2024","Thu Oct 17 10:47:05 UTC 2024","326","","More Options Menu - Offline User - Edit permissions disabled: Report tab","","","","should hide the kebab menu when the xml report is opened.",""
"passed","Thu Oct 17 10:44:14 UTC 2024","Thu Oct 17 10:44:15 UTC 2024","1368","","Adding new language","","","","should be set as Default language ",""
"passed","Thu Oct 17 10:48:10 UTC 2024","Thu Oct 17 10:48:11 UTC 2024","1064","","More Options Menu - Online User - Permissions enabled: Options displayed when there are no messages, contacts or people created","","","","should disable the 'export' option and hide the 'edit' and 'delete' options in Report tab",""
"passed","Thu Oct 17 10:49:26 UTC 2024","Thu Oct 17 10:49:28 UTC 2024","2467","","User Test Cases ->: Invalid entries -> ","","","","should require place and contact for restricted user",""
"passed","Thu Oct 17 10:52:13 UTC 2024","Thu Oct 17 10:52:14 UTC 2024","887","","Old Navigation","","","","should successfully sync",""
"passed","Thu Oct 17 10:42:30 UTC 2024","Thu Oct 17 10:42:30 UTC 2024","442","","Login page funcionality tests: Log in","","","","should try to sign in with blank auth and verify that credentials were incorrect",""
"passed","Thu Oct 17 10:47:29 UTC 2024","Thu Oct 17 10:47:30 UTC 2024","349","","More Options Menu - Online User - Permissions disabled: Export permissions disabled","","","","should hide the kebab menu on the Message tab",""
"passed","Thu Oct 17 10:49:02 UTC 2024","Thu Oct 17 10:49:07 UTC 2024","4865","","User Test Cases ->: Invalid entries -> ","","","","TestCase for The password is too easy to guess.",""
"passed","Thu Oct 17 10:42:56 UTC 2024","Thu Oct 17 10:42:56 UTC 2024","403","","Token login","","","","should display an error when token login is disabled",""
"passed","Thu Oct 17 10:42:27 UTC 2024","Thu Oct 17 10:42:27 UTC 2024","498","","Login page funcionality tests: Log in","","","","should have a title",""
"passed","Thu Oct 17 10:44:53 UTC 2024","Thu Oct 17 10:44:54 UTC 2024","1413","","More Options Menu - Offline User: All permissions enabled: Report tab","","","","should hide the 'export' option and enable the 'edit', 'delete' and 'review' options when the xml report is opened",""
"passed","Thu Oct 17 10:43:21 UTC 2024","Thu Oct 17 10:43:30 UTC 2024","9011","","Testing Incorrect locale","","","","should work with incorrect locale",""
"passed","Thu Oct 17 10:42:28 UTC 2024","Thu Oct 17 10:42:29 UTC 2024","474","","Login page funcionality tests: Log in","","","","should try to sign in with blank password and verify that credentials were incorrect",""
"passed","Thu Oct 17 10:44:02 UTC 2024","Thu Oct 17 10:44:03 UTC 2024","936","","Bikram Sambat date display","","","","SMS report shows bsDate type as date field correctly",""
"passed","Thu Oct 17 10:52:50 UTC 2024","Thu Oct 17 10:52:50 UTC 2024","79","","Privacy policy: for an offline user","","","","should display when navigating to the privacy policy page",""
"passed","Thu Oct 17 10:42:21 UTC 2024","Thu Oct 17 10:42:23 UTC 2024","1521","","Login page funcionality tests: Log in","","","","should set correct cookies",""
"passed","Thu Oct 17 10:43:58 UTC 2024","Thu Oct 17 10:44:00 UTC 2024","1944","","Bikram Sambat date display","","","","should display report list dates converted to bikram sambat",""
"passed","Thu Oct 17 10:42:57 UTC 2024","Thu Oct 17 10:42:58 UTC 2024","598","","Token login","","","","should display an error when accessing with random strings",""
"passed","Thu Oct 17 10:50:59 UTC 2024","Thu Oct 17 10:50:59 UTC 2024","236","","Navigation tests: Navigation functionality","","","","should open Analytics tab",""
"passed","Thu Oct 17 10:46:20 UTC 2024","Thu Oct 17 10:46:31 UTC 2024","11294","","More Options Menu - Offline User - Delete permissions disabled: Contact Tab","","","","should enable the 'edit' option and hide the 'export' and 'delete' options when a contact is opened",""
"passed","Thu Oct 17 10:52:49 UTC 2024","Thu Oct 17 10:52:50 UTC 2024","585","","Privacy policy: for an offline user","","","","should not show on refresh",""
"passed","Thu Oct 17 10:44:00 UTC 2024","Thu Oct 17 10:44:02 UTC 2024","1222","","Bikram Sambat date display","","","","should convert contact summary dates to bikram sambat when language is Nepali",""
"passed","Thu Oct 17 10:49:07 UTC 2024","Thu Oct 17 10:49:12 UTC 2024","4878","","User Test Cases ->: Invalid entries -> ","","","","TestCase for Passwords must match",""
