"DESCRIPTION","DURATION IN MS","NAME","PARENT SUITE","START TIME","STATUS","STOP TIME","SUB SUITE","SUITE","TEST CLASS","TEST METHOD"
"","4109","should require user to have permission for multiple places","","Tue May 13 23:02:47 UTC 2025","passed","Tue May 13 23:02:51 UTC 2025","","User Test Cases ->: Invalid entries -> ","",""
"","1697","should hide the 'export' and 'edit' options and disable the 'delete' option when the offline user's place is selected","","Tue May 13 22:58:07 UTC 2025","passed","Tue May 13 22:58:09 UTC 2025","","More Options Menu - Offline User: All permissions enabled: Contact tab","",""
"","1627","should require place and contact for restricted user","","Tue May 13 23:02:45 UTC 2025","passed","Tue May 13 23:02:47 UTC 2025","","User Test Cases ->: Invalid entries -> ","",""
"","4285","should add user with valid password","","Tue May 13 23:02:12 UTC 2025","passed","Tue May 13 23:02:16 UTC 2025","","User Test Cases ->: Creating Users ->","",""
"","2845","should hide the 'export' option and enable the 'edit', 'delete' and 'review' options when the xml report is opened","","Tue May 13 22:58:14 UTC 2025","passed","Tue May 13 22:58:17 UTC 2025","","More Options Menu - Offline User: All permissions enabled: Report tab","",""
"","1113","should open Configuration app","","Tue May 13 23:04:07 UTC 2025","passed","Tue May 13 23:04:08 UTC 2025","","Hamburger Menu tests","",""
"","948","should work with botched translations","","Tue May 13 22:56:22 UTC 2025","passed","Tue May 13 22:56:23 UTC 2025","","MessageFormat","",""
"","2747","should log the user in when token is correct","","Tue May 13 22:55:41 UTC 2025","passed","Tue May 13 22:55:44 UTC 2025","","Token login","",""
"","1644","should display report list dates converted to bikram sambat","","Tue May 13 22:56:43 UTC 2025","passed","Tue May 13 22:56:44 UTC 2025","","Bikram Sambat date display","",""
"","1790","should log in using username and password fields","","Tue May 13 22:54:35 UTC 2025","passed","Tue May 13 22:54:37 UTC 2025","","Login page functionality tests: Log in","",""
"","2346","should hide the 'delete' option and enable the 'edit', 'export' and 'review' options when a report is opened","","Tue May 13 23:01:05 UTC 2025","passed","Tue May 13 23:01:07 UTC 2025","","More Options Menu - Online User - Permissions disabled: Delete permissions disabled","",""
"","4136","enketo xpath extension function should display correct values when Nepali is not selected","","Tue May 13 22:56:34 UTC 2025","passed","Tue May 13 22:56:38 UTC 2025","","Bikram Sambat date display","",""
"","3330","should show the correct privacy policy on login","","Tue May 13 23:05:54 UTC 2025","passed","Tue May 13 23:05:58 UTC 2025","","Privacy policy: for an offline user","",""
"","1476","should verify password and confirm password mismatch","","Tue May 13 22:55:09 UTC 2025","passed","Tue May 13 22:55:10 UTC 2025","","Login page functionality tests: Password Reset","",""
"","23862","should support deleting translations","","Tue May 13 22:57:28 UTC 2025","passed","Tue May 13 22:57:52 UTC 2025","","Adding new language","",""
"","1283","should show the correct privacy policy on login","","Tue May 13 23:06:17 UTC 2025","passed","Tue May 13 23:06:19 UTC 2025","","Privacy policy: for an online user","",""
"","2179","should navigate back to the login page when using either back button","","Tue May 13 23:05:44 UTC 2025","passed","Tue May 13 23:05:46 UTC 2025","","Privacy Policy Navigation for Unauthenticated Users","",""
"","763","should not show on refresh","","Tue May 13 23:06:19 UTC 2025","passed","Tue May 13 23:06:19 UTC 2025","","Privacy policy: for an online user","",""
"","3780","should not fail due to document conflict for new offline user","","Tue May 13 23:06:33 UTC 2025","passed","Tue May 13 23:06:36 UTC 2025","","Privacy policy: conflicts","",""
"","2902","should redirect to login page when session is expired","","Tue May 13 23:03:47 UTC 2025","passed","Tue May 13 23:03:50 UTC 2025","","bfcache: webapp","",""
"","1238","should verify all fields are missing","","Tue May 13 22:54:56 UTC 2025","passed","Tue May 13 22:54:57 UTC 2025","","Login page functionality tests: Password Reset","",""
"","7626","should allow a new user to read/write from meta db","","Tue May 13 23:03:08 UTC 2025","passed","Tue May 13 23:03:16 UTC 2025","","Create user meta db : ","",""
"","15989","should hide the kebab menu.","","Tue May 13 22:59:57 UTC 2025","passed","Tue May 13 23:00:13 UTC 2025","","More Options Menu - Offline User - Edit permissions disabled: Contact tab","",""
"","3612","should allow admins to access the page","","Tue May 13 22:54:18 UTC 2025","passed","Tue May 13 22:54:22 UTC 2025","","Acessing the admin app","",""
"","924","should disable the 'export' option in Message tab","","Tue May 13 23:01:34 UTC 2025","passed","Tue May 13 23:01:35 UTC 2025","","More Options Menu - Online User - Permissions enabled: Options displayed when there are no messages, contacts or people created","",""
"","79","should display tab labels, when some tabs are enabled","","Tue May 13 23:05:04 UTC 2025","passed","Tue May 13 23:05:04 UTC 2025","","Navigation tests: Navigation view: as chw","",""
"","485","should open Analytics tab","","Tue May 13 23:04:17 UTC 2025","passed","Tue May 13 23:04:17 UTC 2025","","Navigation tests: Navigation functionality","",""
"","3949","should show an upload summary with a successful upload and a failed upload","","Tue May 13 23:02:58 UTC 2025","passed","Tue May 13 23:03:02 UTC 2025","","Bulk User Creation ->","",""
"","1591","should verify current password is not correct","","Tue May 13 22:55:03 UTC 2025","passed","Tue May 13 22:55:05 UTC 2025","","Login page functionality tests: Password Reset","",""
"","8653","Refresh page multiple times and verify token gets renewed","","Tue May 13 22:55:21 UTC 2025","passed","Tue May 13 22:55:30 UTC 2025","","should renew token","",""
"","811","should display plurals correctly","","Tue May 13 22:56:21 UTC 2025","passed","Tue May 13 22:56:22 UTC 2025","","MessageFormat","",""
"","1219","should navigate to the Reports section and open the first report listed","","Tue May 13 23:05:33 UTC 2025","passed","Tue May 13 23:05:35 UTC 2025","","Old Navigation","",""
"","455","should have a title","","Tue May 13 22:54:44 UTC 2025","passed","Tue May 13 22:54:44 UTC 2025","","Login page functionality tests: Log in","",""
"","1414","should enable the 'export', 'edit' and 'delete' options in Contact tab when a contact is opened.","","Tue May 13 23:01:56 UTC 2025","passed","Tue May 13 23:01:58 UTC 2025","","More Options Menu - Online User - Permissions enabled: Options displayed when there are messages, contacts and people created","",""
"","506","should try to sign in with blank password and verify that credentials were incorrect","","Tue May 13 22:54:45 UTC 2025","passed","Tue May 13 22:54:46 UTC 2025","","Login page functionality tests: Log in","",""
"","411","should open About","","Tue May 13 23:04:03 UTC 2025","passed","Tue May 13 23:04:03 UTC 2025","","Hamburger Menu tests","",""
"","835","should hide the kebab menu.","","Tue May 13 22:58:01 UTC 2025","passed","Tue May 13 22:58:02 UTC 2025","","More Options Menu - Offline User: All permissions enabled: Message tab","",""
"","2324","should revisit completed trainings and load uncompleted trainings","","Tue May 13 23:03:37 UTC 2025","passed","Tue May 13 23:03:39 UTC 2025","","Training Materials Page","",""
"","2746","should show french policy on secondary login","","Tue May 13 23:06:23 UTC 2025","passed","Tue May 13 23:06:25 UTC 2025","","Privacy policy: for an online user","",""
"","1884","should hide the 'export' option and enable the 'edit' and 'delete' options when a contact is opened","","Tue May 13 22:58:05 UTC 2025","passed","Tue May 13 22:58:07 UTC 2025","","More Options Menu - Offline User: All permissions enabled: Contact tab","",""
"","633","should display an error when accessing with random strings","","Tue May 13 22:55:38 UTC 2025","passed","Tue May 13 22:55:39 UTC 2025","","Token login","",""
"","932","should not create feedback docs when loading missing reports or people","","Tue May 13 23:05:04 UTC 2025","passed","Tue May 13 23:05:05 UTC 2025","","Navigation tests: Navigation view: as chw","",""
"","452","should not show on refresh","","Tue May 13 23:05:58 UTC 2025","passed","Tue May 13 23:05:58 UTC 2025","","Privacy policy: for an offline user","",""
"","946","should navigate to the People section and open the created Health Center","","Tue May 13 23:05:35 UTC 2025","passed","Tue May 13 23:05:36 UTC 2025","","Old Navigation","",""
"","3375","should require username","","Tue May 13 23:02:42 UTC 2025","passed","Tue May 13 23:02:45 UTC 2025","","User Test Cases ->: Invalid entries -> ","",""
"","3351","should enable the 'edit' and 'review' option and hide the 'export' and 'delete' options when the xml report is opened","","Tue May 13 22:59:29 UTC 2025","passed","Tue May 13 22:59:32 UTC 2025","","More Options Menu - Offline User - Delete permissions disabled: Report tab","",""
"","4829","enketo xpath extension function should display correct values when Nepali is selected","","Tue May 13 22:56:38 UTC 2025","passed","Tue May 13 22:56:43 UTC 2025","","Bikram Sambat date display","",""
"","3022","should not show on subsequent login","","Tue May 13 23:06:20 UTC 2025","passed","Tue May 13 23:06:23 UTC 2025","","Privacy policy: for an online user","",""
"","3804","should not show on subsequent login","","Tue May 13 23:05:58 UTC 2025","passed","Tue May 13 23:06:02 UTC 2025","","Privacy policy: for an offline user","",""
"","579","should navigate to the Targets section, and open a target aggregate","","Tue May 13 23:05:36 UTC 2025","passed","Tue May 13 23:05:36 UTC 2025","","Old Navigation","",""
"","690","should open Messages tab","","Tue May 13 23:04:15 UTC 2025","passed","Tue May 13 23:04:15 UTC 2025","","Navigation tests: Navigation functionality","",""
"","493","should try to sign in and verify that credentials were incorrect","","Tue May 13 22:54:49 UTC 2025","passed","Tue May 13 22:54:49 UTC 2025","","Login page functionality tests: Log in","",""
"","404","should open tasks tab","","Tue May 13 23:04:15 UTC 2025","passed","Tue May 13 23:04:16 UTC 2025","","Navigation tests: Navigation functionality","",""
"","1721","should set correct cookies","","Tue May 13 22:54:38 UTC 2025","passed","Tue May 13 22:54:39 UTC 2025","","Login page functionality tests: Log in","",""
"","473","should try to sign in with blank auth and verify that credentials were incorrect","","Tue May 13 22:54:47 UTC 2025","passed","Tue May 13 22:54:47 UTC 2025","","Login page functionality tests: Log in","",""
"","3680","should show french policy on secondary login","","Tue May 13 23:06:02 UTC 2025","passed","Tue May 13 23:06:06 UTC 2025","","Privacy policy: for an offline user","",""
"","366","should change locale to French","","Tue May 13 22:54:28 UTC 2025","passed","Tue May 13 22:54:29 UTC 2025","","Login page functionality tests: Locale","",""
"","1086","should open Report bug","","Tue May 13 23:04:05 UTC 2025","passed","Tue May 13 23:04:06 UTC 2025","","Hamburger Menu tests","",""
"","418","should hide the kebab menu when the xml report is opened.","","Tue May 13 23:00:14 UTC 2025","passed","Tue May 13 23:00:14 UTC 2025","","More Options Menu - Offline User - Edit permissions disabled: Report tab","",""
"","2600","should show a warning before log out","","Tue May 13 22:54:31 UTC 2025","passed","Tue May 13 22:54:34 UTC 2025","","Login page functionality tests: Log out","",""
"","2485","should navigate to the Messages section and open a sent message","","Tue May 13 23:05:30 UTC 2025","passed","Tue May 13 23:05:32 UTC 2025","","Old Navigation","",""
"","102","should display tab labels, when all tabs are enabled","","Tue May 13 23:04:19 UTC 2025","passed","Tue May 13 23:04:19 UTC 2025","","Navigation tests: Navigation view: as admin","",""
"","402","should hide the kebab menu when the sms report is opened","","Tue May 13 22:59:29 UTC 2025","passed","Tue May 13 22:59:29 UTC 2025","","More Options Menu - Offline User - Delete permissions disabled: Report tab","",""
"","2928","should redirect to the app page when session is valid","","Tue May 13 23:03:43 UTC 2025","passed","Tue May 13 23:03:46 UTC 2025","","bfcache: login page","",""
"","1743","should hide the 'delete' option and enable the 'edit' and 'export' options when a contact is opened","","Tue May 13 23:01:03 UTC 2025","passed","Tue May 13 23:01:05 UTC 2025","","More Options Menu - Online User - Permissions disabled: Delete permissions disabled","",""
"","1431","should convert contact summary dates to bikram sambat when language is Nepali","","Tue May 13 22:56:44 UTC 2025","passed","Tue May 13 22:56:46 UTC 2025","","Bikram Sambat date display","",""
"","344","should change locale to Spanish","","Tue May 13 22:54:30 UTC 2025","passed","Tue May 13 22:54:30 UTC 2025","","Login page functionality tests: Locale","",""
"","2219","should hide and reveal password value, and login with a revealed password","","Tue May 13 22:54:50 UTC 2025","passed","Tue May 13 22:54:52 UTC 2025","","Login page functionality tests: Log in","",""
"","1412","should verify password strength","","Tue May 13 22:55:01 UTC 2025","passed","Tue May 13 22:55:02 UTC 2025","","Login page functionality tests: Password Reset","",""
"","1520","should verify current password cannot be same as new password","","Tue May 13 22:55:06 UTC 2025","passed","Tue May 13 22:55:08 UTC 2025","","Login page functionality tests: Password Reset","",""
"","4097","should enable the 'export' option and hide the 'edit' and 'delete' options in Contact tab when none of the contacts is opened.","","Tue May 13 23:01:59 UTC 2025","passed","Tue May 13 23:02:03 UTC 2025","","More Options Menu - Online User - Permissions enabled: Options displayed when there are messages, contacts and people created","",""
"","1895","should enable the 'export' option in Message tab.","","Tue May 13 23:01:47 UTC 2025","passed","Tue May 13 23:01:49 UTC 2025","","More Options Menu - Online User - Permissions enabled: Options displayed when there are messages, contacts and people created","",""
"","1857","should disable the 'export' option and hide the 'edit' and 'delete' options in Report tab","","Tue May 13 23:01:39 UTC 2025","passed","Tue May 13 23:01:41 UTC 2025","","More Options Menu - Online User - Permissions enabled: Options displayed when there are no messages, contacts or people created","",""
"","17112","should enable the 'edit' option and hide the 'export' and 'delete' options when a contact is opened","","Tue May 13 22:59:11 UTC 2025","passed","Tue May 13 22:59:29 UTC 2025","","More Options Menu - Offline User - Delete permissions disabled: Contact Tab","",""
"","4312","should hide and reveal password value, and add user with a revealed password","","Tue May 13 23:02:21 UTC 2025","passed","Tue May 13 23:02:25 UTC 2025","","User Test Cases ->: Creating Users ->","",""
"","928","should show if the user changes their language","","Tue May 13 23:06:25 UTC 2025","passed","Tue May 13 23:06:26 UTC 2025","","Privacy policy: for an online user","",""
"","26545","should add new translations","","Tue May 13 22:57:01 UTC 2025","passed","Tue May 13 22:57:28 UTC 2025","","Adding new language","",""
"","436","should hide the kebab menu when the sms report is opened.","","Tue May 13 23:00:13 UTC 2025","passed","Tue May 13 23:00:14 UTC 2025","","More Options Menu - Offline User - Edit permissions disabled: Report tab","",""
"","397","should hide the kebab menu on the Message tab","","Tue May 13 23:00:46 UTC 2025","passed","Tue May 13 23:00:46 UTC 2025","","More Options Menu - Online User - Permissions disabled: Export permissions disabled","",""
"","3650","should hide the 'export' and 'edit' options and enable the 'delete' and 'review' options when the sms report is opened","","Tue May 13 22:58:10 UTC 2025","passed","Tue May 13 22:58:13 UTC 2025","","More Options Menu - Offline User: All permissions enabled: Report tab","",""
"","84","should display when navigating to the privacy policy page","","Tue May 13 23:05:58 UTC 2025","passed","Tue May 13 23:05:58 UTC 2025","","Privacy policy: for an offline user","",""
"","116","should display when navigating to the privacy policy page","","Tue May 13 23:06:19 UTC 2025","passed","Tue May 13 23:06:20 UTC 2025","","Privacy policy: for an online user","",""
"","2174","should enable the 'export', 'review' and 'delete' options and hide the 'edit' option in Report tab when a NON XML report is opened.","","Tue May 13 23:01:50 UTC 2025","passed","Tue May 13 23:01:53 UTC 2025","","More Options Menu - Online User - Permissions enabled: Options displayed when there are messages, contacts and people created","",""
"","4866","should add user with multiple places with permission","","Tue May 13 23:02:16 UTC 2025","passed","Tue May 13 23:02:21 UTC 2025","","User Test Cases ->: Creating Users ->","",""
"","3475","should hide the kebab menu in Messages, People and Reports tabs","","Tue May 13 22:58:30 UTC 2025","passed","Tue May 13 22:58:34 UTC 2025","","More Options Menu - Offline User: All permissions disabled","",""
"","3069","should show if the user changes their language","","Tue May 13 23:06:06 UTC 2025","passed","Tue May 13 23:06:09 UTC 2025","","Privacy policy: for an offline user","",""
"","1669","should hide the 'export' option and enable the 'edit' and 'delete' options when a contact is opened","","Tue May 13 23:00:40 UTC 2025","passed","Tue May 13 23:00:41 UTC 2025","","More Options Menu - Online User - Permissions disabled: Export permissions disabled","",""
"","3192","TestCase for required","","Tue May 13 23:02:39 UTC 2025","passed","Tue May 13 23:02:42 UTC 2025","","User Test Cases ->: Invalid entries -> ","",""
"","998","should successfully sync","","Tue May 13 23:05:36 UTC 2025","passed","Tue May 13 23:05:37 UTC 2025","","Old Navigation","",""
"","1340","should disable the 'export' option and hide the 'edit' and 'delete' options in Contact tab","","Tue May 13 23:01:36 UTC 2025","passed","Tue May 13 23:01:38 UTC 2025","","More Options Menu - Online User - Permissions enabled: Options displayed when there are no messages, contacts or people created","",""
"","2220","should open the about page","","Tue May 13 23:03:20 UTC 2025","passed","Tue May 13 23:03:22 UTC 2025","","About page","",""
"","4975","should show access error when accessing as an offline user","","Tue May 13 22:54:12 UTC 2025","passed","Tue May 13 22:54:17 UTC 2025","","Acessing the admin app","",""
"","12373","should work with incorrect locale","","Tue May 13 22:56:01 UTC 2025","passed","Tue May 13 22:56:13 UTC 2025","","Testing Incorrect locale","",""
"","6993","should redirect to login page when session is expired","","Tue May 13 23:03:50 UTC 2025","passed","Tue May 13 23:03:57 UTC 2025","","bfcache: admin app","",""
"","1320","SMS report shows bsDate type as date field correctly","","Tue May 13 22:56:46 UTC 2025","passed","Tue May 13 22:56:47 UTC 2025","","Bikram Sambat date display","",""
"","3227","should show if the user policy changes","","Tue May 13 23:06:09 UTC 2025","passed","Tue May 13 23:06:12 UTC 2025","","Privacy policy: for an offline user","",""
"","2504","should show in enabled language list","","Tue May 13 22:56:57 UTC 2025","passed","Tue May 13 22:56:59 UTC 2025","","Adding new language","",""
"","430","should open Contacts or Peoples tab","","Tue May 13 23:04:16 UTC 2025","passed","Tue May 13 23:04:17 UTC 2025","","Navigation tests: Navigation functionality","",""
"","2842","should redirect the user to the app if already logged in","","Tue May 13 22:55:33 UTC 2025","passed","Tue May 13 22:55:36 UTC 2025","","Token login","",""
"","414","should display an error when token login is disabled","","Tue May 13 22:55:37 UTC 2025","passed","Tue May 13 22:55:37 UTC 2025","","Token login","",""
"","1419","SMS report shows bsAggreDate type as date field correctly","","Tue May 13 22:56:47 UTC 2025","passed","Tue May 13 22:56:49 UTC 2025","","Bikram Sambat date display","",""
"","7946","should disable a language and enable another","","Tue May 13 22:55:49 UTC 2025","passed","Tue May 13 22:55:57 UTC 2025","","Enabling/disabling languages","",""
"","1361","should hide the 'edit' and 'delete' options and enable the 'export' option when a contact is opened","","Tue May 13 23:01:24 UTC 2025","passed","Tue May 13 23:01:25 UTC 2025","","More Options Menu - Online User - Permissions disabled: Edit permissions disabled","",""
"","815","should redirect to login when not logged in","","Tue May 13 22:54:10 UTC 2025","passed","Tue May 13 22:54:11 UTC 2025","","Acessing the admin app","",""
"","1879","should enable the 'export', 'review', 'edit' and 'delete' options in Report tab when a XML report is opened.","","Tue May 13 23:01:54 UTC 2025","passed","Tue May 13 23:01:55 UTC 2025","","More Options Menu - Online User - Permissions enabled: Options displayed when there are messages, contacts and people created","",""
"","1365","should not display privacy policy page when the privacy policy is not enabled","","Tue May 13 23:05:42 UTC 2025","passed","Tue May 13 23:05:44 UTC 2025","","Privacy Policy Navigation for Unauthenticated Users","",""
"","2203","should display partners","","Tue May 13 23:03:22 UTC 2025","passed","Tue May 13 23:03:24 UTC 2025","","About page","",""
"","4475","should hide the 'export' option and enable the 'edit', 'delete' and 'review' options when a report is opened","","Tue May 13 23:00:41 UTC 2025","passed","Tue May 13 23:00:46 UTC 2025","","More Options Menu - Online User - Permissions disabled: Export permissions disabled","",""
"","1562","should verify confirm password is missing","","Tue May 13 22:54:58 UTC 2025","passed","Tue May 13 22:55:00 UTC 2025","","Login page functionality tests: Password Reset","",""
"","1954","should hide the 'edit', 'delete' and 'review' options and enable the 'export' option when a report is opened","","Tue May 13 23:01:25 UTC 2025","passed","Tue May 13 23:01:27 UTC 2025","","More Options Menu - Online User - Permissions disabled: Edit permissions disabled","",""
"","1701","should hide the 'export' and 'edit' options and disable the 'delete' option when no contact is opened","","Tue May 13 22:58:02 UTC 2025","passed","Tue May 13 22:58:04 UTC 2025","","More Options Menu - Offline User: All permissions enabled: Contact tab","",""
"","626","should open User settings","","Tue May 13 23:04:04 UTC 2025","passed","Tue May 13 23:04:04 UTC 2025","","Hamburger Menu tests","",""
"","2445","should display the ""session expired"" modal and redirect to login page","","Tue May 13 22:54:40 UTC 2025","passed","Tue May 13 22:54:43 UTC 2025","","Login page functionality tests: Log in","",""
"","606","should display an error with incorrect url","","Tue May 13 22:55:37 UTC 2025","passed","Tue May 13 22:55:38 UTC 2025","","Token login","",""
"","3620","should reset password successfully and redirect to webapp","","Tue May 13 22:55:11 UTC 2025","passed","Tue May 13 22:55:15 UTC 2025","","Login page functionality tests: Password Reset","",""
"","220","should show locale selector on login page","","Tue May 13 22:54:27 UTC 2025","passed","Tue May 13 22:54:27 UTC 2025","","Login page functionality tests: Locale","",""
"","3277","TestCase for The password must be at least 8 characters long.","","Tue May 13 23:02:25 UTC 2025","passed","Tue May 13 23:02:29 UTC 2025","","User Test Cases ->: Invalid entries -> ","",""
"","3320","TestCase for Passwords must match","","Tue May 13 23:02:32 UTC 2025","passed","Tue May 13 23:02:35 UTC 2025","","User Test Cases ->: Invalid entries -> ","",""
"","2120","should be set as Default language ","","Tue May 13 22:56:59 UTC 2025","passed","Tue May 13 22:57:01 UTC 2025","","Adding new language","",""
"","3289","TestCase for The password is too easy to guess.","","Tue May 13 23:02:29 UTC 2025","passed","Tue May 13 23:02:32 UTC 2025","","User Test Cases ->: Invalid entries -> ","",""
"","3282","should quit training in modal, and be able to complete it later in the Training Material page, verify completed trainings display in the list","","Tue May 13 23:03:33 UTC 2025","passed","Tue May 13 23:03:37 UTC 2025","","Training Materials Page","",""
"","1400","should display an error when token is expired","","Tue May 13 22:55:39 UTC 2025","passed","Tue May 13 22:55:41 UTC 2025","","Token login","",""
"","1187","should navigate to the Task section and open the first task listed","","Tue May 13 23:05:32 UTC 2025","passed","Tue May 13 23:05:33 UTC 2025","","Old Navigation","",""
"","545","should open Reports or History tab","","Tue May 13 23:04:16 UTC 2025","passed","Tue May 13 23:04:16 UTC 2025","","Navigation tests: Navigation functionality","",""
"","1437","should show if the user policy changes","","Tue May 13 23:06:26 UTC 2025","passed","Tue May 13 23:06:28 UTC 2025","","Privacy policy: for an online user","",""
