"DESCRIPTION","DURATION IN MS","NAME","PARENT SUITE","START TIME","STATUS","STOP TIME","SUB SUITE","SUITE","TEST CLASS","TEST METHOD"
"","3829","should allow admins to access the page","","Wed Jun 11 09:50:40 UTC 2025","passed","Wed Jun 11 09:50:44 UTC 2025","","Acessing the admin app","",""
"","1190","should open Report bug","","Wed Jun 11 10:05:38 UTC 2025","passed","Wed Jun 11 10:05:40 UTC 2025","","Hamburger Menu tests","",""
"","955","should navigate to the Reports section and open the first report listed","","Wed Jun 11 10:07:09 UTC 2025","passed","Wed Jun 11 10:07:10 UTC 2025","","Old Navigation","",""
"","781","should redirect to login when not logged in","","Wed Jun 11 09:50:32 UTC 2025","passed","Wed Jun 11 09:50:33 UTC 2025","","Acessing the admin app","",""
"","24024","should support deleting translations","","Wed Jun 11 09:58:45 UTC 2025","passed","Wed Jun 11 09:59:09 UTC 2025","","Adding new language","",""
"","1302","should show if the user policy changes","","Wed Jun 11 10:08:00 UTC 2025","passed","Wed Jun 11 10:08:01 UTC 2025","","Privacy policy: for an online user","",""
"","1407","should display an error when token is expired","","Wed Jun 11 09:52:15 UTC 2025","passed","Wed Jun 11 09:52:16 UTC 2025","","Token login","",""
"","4172","should redirect to the app page when session is valid","","Wed Jun 11 10:05:21 UTC 2025","passed","Wed Jun 11 10:05:25 UTC 2025","","bfcache: login page","",""
"","2203","should hide the 'export' and 'edit' options and disable the 'delete' option when no contact is opened","","Wed Jun 11 09:59:20 UTC 2025","passed","Wed Jun 11 09:59:22 UTC 2025","","More Options Menu - Offline User: All permissions enabled: Contact tab","",""
"","606","should hide the kebab menu when the sms report is opened","","Wed Jun 11 10:00:58 UTC 2025","passed","Wed Jun 11 10:00:59 UTC 2025","","More Options Menu - Offline User - Delete permissions disabled: Report tab","",""
"","462","should open Contacts or Peoples tab","","Wed Jun 11 10:05:50 UTC 2025","passed","Wed Jun 11 10:05:51 UTC 2025","","Navigation tests: Navigation functionality","",""
"","999","should change locale to Spanish","","Wed Jun 11 09:50:52 UTC 2025","passed","Wed Jun 11 09:50:53 UTC 2025","","Login page functionality tests: Locale","",""
"","16290","should hide the kebab menu.","","Wed Jun 11 10:01:32 UTC 2025","passed","Wed Jun 11 10:01:48 UTC 2025","","More Options Menu - Offline User - Edit permissions disabled: Contact tab","",""
"","938","should have a title","","Wed Jun 11 09:51:09 UTC 2025","passed","Wed Jun 11 09:51:10 UTC 2025","","Login page functionality tests: Log in","",""
"","4421","should add user with multiple places with permission","","Wed Jun 11 10:03:56 UTC 2025","passed","Wed Jun 11 10:04:01 UTC 2025","","User Test Cases ->: Creating Users ->","",""
"","1417","SMS report shows bsAggreDate type as date field correctly","","Wed Jun 11 09:53:18 UTC 2025","passed","Wed Jun 11 09:53:19 UTC 2025","","Bikram Sambat date display","",""
"","5022","should show access error when accessing as an offline user","","Wed Jun 11 09:50:34 UTC 2025","passed","Wed Jun 11 09:50:39 UTC 2025","","Acessing the admin app","",""
"","2031","should show in enabled language list","","Wed Jun 11 09:53:26 UTC 2025","passed","Wed Jun 11 09:53:28 UTC 2025","","Adding new language","",""
"","1841","should navigate to the Task section and open the first task listed","","Wed Jun 11 10:07:07 UTC 2025","passed","Wed Jun 11 10:07:09 UTC 2025","","Old Navigation","",""
"","1205","should show the correct privacy policy on login","","Wed Jun 11 10:07:50 UTC 2025","passed","Wed Jun 11 10:07:52 UTC 2025","","Privacy policy: for an online user","",""
"","2619","should hide and reveal password value, and login with a revealed password","","Wed Jun 11 09:51:19 UTC 2025","passed","Wed Jun 11 09:51:21 UTC 2025","","Login page functionality tests: Log in","",""
"","7631","should hide the 'export' option and enable the 'edit', 'delete' and 'review' options when the xml report is opened","","Wed Jun 11 09:59:37 UTC 2025","passed","Wed Jun 11 09:59:45 UTC 2025","","More Options Menu - Offline User: All permissions enabled: Report tab","",""
"","5933","should hide the 'export' and 'edit' options and enable the 'delete' and 'review' options when the sms report is opened","","Wed Jun 11 09:59:30 UTC 2025","passed","Wed Jun 11 09:59:36 UTC 2025","","More Options Menu - Offline User: All permissions enabled: Report tab","",""
"","2316","should set correct cookies","","Wed Jun 11 09:51:02 UTC 2025","passed","Wed Jun 11 09:51:04 UTC 2025","","Login page functionality tests: Log in","",""
"","3053","should require username","","Wed Jun 11 10:04:24 UTC 2025","passed","Wed Jun 11 10:04:27 UTC 2025","","User Test Cases ->: Invalid entries -> ","",""
"","2950","should open the about page","","Wed Jun 11 10:04:58 UTC 2025","passed","Wed Jun 11 10:05:01 UTC 2025","","About page","",""
"","573","should hide the kebab menu when the sms report is opened.","","Wed Jun 11 10:01:48 UTC 2025","passed","Wed Jun 11 10:01:49 UTC 2025","","More Options Menu - Offline User - Edit permissions disabled: Report tab","",""
"","3626","should reset password successfully and redirect to webapp","","Wed Jun 11 09:51:40 UTC 2025","passed","Wed Jun 11 09:51:44 UTC 2025","","Login page functionality tests: Password Reset","",""
"","4120","enketo xpath extension function should display correct values when Nepali is not selected","","Wed Jun 11 09:53:04 UTC 2025","passed","Wed Jun 11 09:53:08 UTC 2025","","Bikram Sambat date display","",""
"","3142","TestCase for Passwords must match","","Wed Jun 11 10:04:15 UTC 2025","passed","Wed Jun 11 10:04:18 UTC 2025","","User Test Cases ->: Invalid entries -> ","",""
"","4466","should enable the 'export' option and hide the 'edit' and 'delete' options in Contact tab when none of the contacts is opened.","","Wed Jun 11 10:03:39 UTC 2025","passed","Wed Jun 11 10:03:44 UTC 2025","","More Options Menu - Online User - Permissions enabled: Options displayed when there are messages, contacts and people created","",""
"","924","should successfully sync","","Wed Jun 11 10:07:12 UTC 2025","passed","Wed Jun 11 10:07:13 UTC 2025","","Old Navigation","",""
"","74474","should add new translations","","Wed Jun 11 09:57:30 UTC 2025","passed","Wed Jun 11 09:58:45 UTC 2025","","Adding new language","",""
"","3844","should show french policy on secondary login","","Wed Jun 11 10:07:35 UTC 2025","passed","Wed Jun 11 10:07:39 UTC 2025","","Privacy policy: for an offline user","",""
"","508","should not show on refresh","","Wed Jun 11 10:07:31 UTC 2025","passed","Wed Jun 11 10:07:31 UTC 2025","","Privacy policy: for an offline user","",""
"","17728","should enable the 'edit' option and hide the 'export' and 'delete' options when a contact is opened","","Wed Jun 11 10:00:41 UTC 2025","passed","Wed Jun 11 10:00:58 UTC 2025","","More Options Menu - Offline User - Delete permissions disabled: Contact Tab","",""
"","464","should open Analytics tab","","Wed Jun 11 10:05:51 UTC 2025","passed","Wed Jun 11 10:05:51 UTC 2025","","Navigation tests: Navigation functionality","",""
"","4097","should show if the user policy changes","","Wed Jun 11 10:07:40 UTC 2025","passed","Wed Jun 11 10:07:44 UTC 2025","","Privacy policy: for an offline user","",""
"","2114","should display partners","","Wed Jun 11 10:05:01 UTC 2025","passed","Wed Jun 11 10:05:03 UTC 2025","","About page","",""
"","1124","should try to sign in with blank auth and verify that credentials were incorrect","","Wed Jun 11 09:51:14 UTC 2025","passed","Wed Jun 11 09:51:15 UTC 2025","","Login page functionality tests: Log in","",""
"","2495","should redirect to login page when session is expired","","Wed Jun 11 10:05:26 UTC 2025","passed","Wed Jun 11 10:05:28 UTC 2025","","bfcache: webapp","",""
"","643","should display an error when accessing with random strings","","Wed Jun 11 09:52:14 UTC 2025","passed","Wed Jun 11 09:52:15 UTC 2025","","Token login","",""
"","180","should display tab labels, when some tabs are enabled","","Wed Jun 11 10:06:38 UTC 2025","passed","Wed Jun 11 10:06:38 UTC 2025","","Navigation tests: Navigation view: as chw","",""
"","2347","should log in using username and password fields","","Wed Jun 11 09:50:58 UTC 2025","passed","Wed Jun 11 09:51:01 UTC 2025","","Login page functionality tests: Log in","",""
"","7313","should allow a new user to read/write from meta db","","Wed Jun 11 10:04:48 UTC 2025","passed","Wed Jun 11 10:04:55 UTC 2025","","Create user meta db : ","",""
"","8206","should enable the 'edit' and 'review' option and hide the 'export' and 'delete' options when the xml report is opened","","Wed Jun 11 10:00:59 UTC 2025","passed","Wed Jun 11 10:01:07 UTC 2025","","More Options Menu - Offline User - Delete permissions disabled: Report tab","",""
"","3160","TestCase for The password must be at least 8 characters long.","","Wed Jun 11 10:04:08 UTC 2025","passed","Wed Jun 11 10:04:11 UTC 2025","","User Test Cases ->: Invalid entries -> ","",""
"","1330","should hide the kebab menu.","","Wed Jun 11 09:59:18 UTC 2025","passed","Wed Jun 11 09:59:19 UTC 2025","","More Options Menu - Offline User: All permissions enabled: Message tab","",""
"","1497","should require place and contact for restricted user","","Wed Jun 11 10:04:27 UTC 2025","passed","Wed Jun 11 10:04:29 UTC 2025","","User Test Cases ->: Invalid entries -> ","",""
"","1316","should try to sign in with blank password and verify that credentials were incorrect","","Wed Jun 11 09:51:11 UTC 2025","passed","Wed Jun 11 09:51:13 UTC 2025","","Login page functionality tests: Log in","",""
"","3120","should display the ""session expired"" modal and redirect to login page","","Wed Jun 11 09:51:05 UTC 2025","passed","Wed Jun 11 09:51:08 UTC 2025","","Login page functionality tests: Log in","",""
"","2580","should hide the 'edit', 'delete' and 'review' options and enable the 'export' option when a report is opened","","Wed Jun 11 10:03:02 UTC 2025","passed","Wed Jun 11 10:03:05 UTC 2025","","More Options Menu - Online User - Permissions disabled: Edit permissions disabled","",""
"","1952","should navigate back to the login page when using either back button","","Wed Jun 11 10:07:18 UTC 2025","passed","Wed Jun 11 10:07:20 UTC 2025","","Privacy Policy Navigation for Unauthenticated Users","",""
"","1021","should navigate to the People section and open the created Health Center","","Wed Jun 11 10:07:10 UTC 2025","passed","Wed Jun 11 10:07:11 UTC 2025","","Old Navigation","",""
"","1097","should show if the user changes their language","","Wed Jun 11 10:07:39 UTC 2025","passed","Wed Jun 11 10:07:40 UTC 2025","","Privacy policy: for an offline user","",""
"","241","should display when navigating to the privacy policy page","","Wed Jun 11 10:07:52 UTC 2025","passed","Wed Jun 11 10:07:52 UTC 2025","","Privacy policy: for an online user","",""
"","2429","should redirect to login page when session is expired","","Wed Jun 11 10:05:28 UTC 2025","passed","Wed Jun 11 10:05:31 UTC 2025","","bfcache: admin app","",""
"","11180","should work with incorrect locale","","Wed Jun 11 09:52:34 UTC 2025","passed","Wed Jun 11 09:52:45 UTC 2025","","Testing Incorrect locale","",""
"","1862","should hide the 'delete' option and enable the 'edit' and 'export' options when a contact is opened","","Wed Jun 11 10:02:39 UTC 2025","passed","Wed Jun 11 10:02:41 UTC 2025","","More Options Menu - Online User - Permissions disabled: Delete permissions disabled","",""
"","8708","Refresh page multiple times and verify token gets renewed","","Wed Jun 11 09:51:48 UTC 2025","passed","Wed Jun 11 09:51:57 UTC 2025","","should renew token","",""
"","687","should open Reports or History tab","","Wed Jun 11 10:05:49 UTC 2025","passed","Wed Jun 11 10:05:50 UTC 2025","","Navigation tests: Navigation functionality","",""
"","1544","should verify password and confirm password mismatch","","Wed Jun 11 09:51:38 UTC 2025","passed","Wed Jun 11 09:51:39 UTC 2025","","Login page functionality tests: Password Reset","",""
"","3368","should redirect the user to the app if already logged in","","Wed Jun 11 09:52:08 UTC 2025","passed","Wed Jun 11 09:52:12 UTC 2025","","Token login","",""
"","1527","should verify current password is not correct","","Wed Jun 11 09:51:33 UTC 2025","passed","Wed Jun 11 09:51:34 UTC 2025","","Login page functionality tests: Password Reset","",""
"","1214","should convert contact summary dates to bikram sambat when language is Nepali","","Wed Jun 11 09:53:15 UTC 2025","passed","Wed Jun 11 09:53:17 UTC 2025","","Bikram Sambat date display","",""
"","447","should open About","","Wed Jun 11 10:05:36 UTC 2025","passed","Wed Jun 11 10:05:37 UTC 2025","","Hamburger Menu tests","",""
"","7623","should disable a language and enable another","","Wed Jun 11 09:52:23 UTC 2025","passed","Wed Jun 11 09:52:31 UTC 2025","","Enabling/disabling languages","",""
"","542","should hide the kebab menu when the xml report is opened.","","Wed Jun 11 10:01:49 UTC 2025","passed","Wed Jun 11 10:01:49 UTC 2025","","More Options Menu - Offline User - Edit permissions disabled: Report tab","",""
"","4685","should hide the kebab menu in Messages, People and Reports tabs","","Wed Jun 11 09:59:58 UTC 2025","passed","Wed Jun 11 10:00:02 UTC 2025","","More Options Menu - Offline User: All permissions disabled","",""
"","2612","should log the user in when token is correct","","Wed Jun 11 09:52:17 UTC 2025","passed","Wed Jun 11 09:52:20 UTC 2025","","Token login","",""
"","1707","should hide the 'edit' and 'delete' options and enable the 'export' option when a contact is opened","","Wed Jun 11 10:03:01 UTC 2025","passed","Wed Jun 11 10:03:02 UTC 2025","","More Options Menu - Online User - Permissions disabled: Edit permissions disabled","",""
"","140","should show locale selector on login page","","Wed Jun 11 09:50:49 UTC 2025","passed","Wed Jun 11 09:50:49 UTC 2025","","Login page functionality tests: Locale","",""
"","2134","should hide the 'export' and 'edit' options and disable the 'delete' option when the offline user's place is selected","","Wed Jun 11 09:59:27 UTC 2025","passed","Wed Jun 11 09:59:29 UTC 2025","","More Options Menu - Offline User: All permissions enabled: Contact tab","",""
"","193","should display when navigating to the privacy policy page","","Wed Jun 11 10:07:31 UTC 2025","passed","Wed Jun 11 10:07:31 UTC 2025","","Privacy policy: for an offline user","",""
"","4054","should hide and reveal password value, and add user with a revealed password","","Wed Jun 11 10:04:01 UTC 2025","passed","Wed Jun 11 10:04:05 UTC 2025","","User Test Cases ->: Creating Users ->","",""
"","1511","should verify password strength","","Wed Jun 11 09:51:30 UTC 2025","passed","Wed Jun 11 09:51:32 UTC 2025","","Login page functionality tests: Password Reset","",""
"","2254","should enable the 'export', 'review', 'edit' and 'delete' options in Report tab when a XML report is opened.","","Wed Jun 11 10:03:33 UTC 2025","passed","Wed Jun 11 10:03:35 UTC 2025","","More Options Menu - Online User - Permissions enabled: Options displayed when there are messages, contacts and people created","",""
"","4114","should not show on subsequent login","","Wed Jun 11 10:07:31 UTC 2025","passed","Wed Jun 11 10:07:35 UTC 2025","","Privacy policy: for an offline user","",""
"","6452","should hide the 'export' option and enable the 'edit', 'delete' and 'review' options when a report is opened","","Wed Jun 11 10:02:16 UTC 2025","passed","Wed Jun 11 10:02:22 UTC 2025","","More Options Menu - Online User - Permissions disabled: Export permissions disabled","",""
"","3920","should show an upload summary with a successful upload and a failed upload","","Wed Jun 11 10:04:39 UTC 2025","passed","Wed Jun 11 10:04:43 UTC 2025","","Bulk User Creation ->","",""
"","1729","should verify confirm password is missing","","Wed Jun 11 09:51:27 UTC 2025","passed","Wed Jun 11 09:51:29 UTC 2025","","Login page functionality tests: Password Reset","",""
"","709","should navigate to the Targets section, and open a target aggregate","","Wed Jun 11 10:07:11 UTC 2025","passed","Wed Jun 11 10:07:12 UTC 2025","","Old Navigation","",""
"","3115","should navigate to the Messages section and open a sent message","","Wed Jun 11 10:07:04 UTC 2025","passed","Wed Jun 11 10:07:07 UTC 2025","","Old Navigation","",""
"","812","should open Messages tab","","Wed Jun 11 10:05:48 UTC 2025","passed","Wed Jun 11 10:05:49 UTC 2025","","Navigation tests: Navigation functionality","",""
"","2320","should disable the 'export' option and hide the 'edit' and 'delete' options in Report tab","","Wed Jun 11 10:03:17 UTC 2025","passed","Wed Jun 11 10:03:19 UTC 2025","","More Options Menu - Online User - Permissions enabled: Options displayed when there are no messages, contacts or people created","",""
"","3658","should add sso user","","Wed Jun 11 10:04:05 UTC 2025","passed","Wed Jun 11 10:04:08 UTC 2025","","User Test Cases ->: Creating Users ->","",""
"","3150","TestCase for required","","Wed Jun 11 10:04:21 UTC 2025","passed","Wed Jun 11 10:04:24 UTC 2025","","User Test Cases ->: Invalid entries -> ","",""
"","1446","SMS report shows bsDate type as date field correctly","","Wed Jun 11 09:53:17 UTC 2025","passed","Wed Jun 11 09:53:18 UTC 2025","","Bikram Sambat date display","",""
"","1879","should display report list dates converted to bikram sambat","","Wed Jun 11 09:53:13 UTC 2025","passed","Wed Jun 11 09:53:15 UTC 2025","","Bikram Sambat date display","",""
"","1588","should enable the 'export', 'edit' and 'delete' options in Contact tab when a contact is opened.","","Wed Jun 11 10:03:36 UTC 2025","passed","Wed Jun 11 10:03:38 UTC 2025","","More Options Menu - Online User - Permissions enabled: Options displayed when there are messages, contacts and people created","",""
"","1496","should verify current password cannot be same as new password","","Wed Jun 11 09:51:35 UTC 2025","passed","Wed Jun 11 09:51:37 UTC 2025","","Login page functionality tests: Password Reset","",""
"","985","should open Configuration app","","Wed Jun 11 10:05:41 UTC 2025","passed","Wed Jun 11 10:05:42 UTC 2025","","Hamburger Menu tests","",""
"","5112","enketo xpath extension function should display correct values when Nepali is selected","","Wed Jun 11 09:53:08 UTC 2025","passed","Wed Jun 11 09:53:13 UTC 2025","","Bikram Sambat date display","",""
"","1202","should not display privacy policy page when the privacy policy is not enabled","","Wed Jun 11 10:07:17 UTC 2025","passed","Wed Jun 11 10:07:18 UTC 2025","","Privacy Policy Navigation for Unauthenticated Users","",""
"","3194","should show the correct privacy policy on login","","Wed Jun 11 10:07:27 UTC 2025","passed","Wed Jun 11 10:07:31 UTC 2025","","Privacy policy: for an offline user","",""
"","3382","should not show on subsequent login","","Wed Jun 11 10:07:52 UTC 2025","passed","Wed Jun 11 10:07:56 UTC 2025","","Privacy policy: for an online user","",""
"","398","should display an error when token login is disabled","","Wed Jun 11 09:52:12 UTC 2025","passed","Wed Jun 11 09:52:13 UTC 2025","","Token login","",""
"","1172","should try to sign in and verify that credentials were incorrect","","Wed Jun 11 09:51:16 UTC 2025","passed","Wed Jun 11 09:51:17 UTC 2025","","Login page functionality tests: Log in","",""
"","1431","should disable the 'export' option and hide the 'edit' and 'delete' options in Contact tab","","Wed Jun 11 10:03:13 UTC 2025","passed","Wed Jun 11 10:03:15 UTC 2025","","More Options Menu - Online User - Permissions enabled: Options displayed when there are no messages, contacts or people created","",""
"","635","should not show on refresh","","Wed Jun 11 10:07:52 UTC 2025","passed","Wed Jun 11 10:07:52 UTC 2025","","Privacy policy: for an online user","",""
"","2750","should enable the 'export', 'review' and 'delete' options and hide the 'edit' option in Report tab when a NON XML report is opened.","","Wed Jun 11 10:03:29 UTC 2025","passed","Wed Jun 11 10:03:31 UTC 2025","","More Options Menu - Online User - Permissions enabled: Options displayed when there are messages, contacts and people created","",""
"","1912","should hide the 'export' option and enable the 'edit' and 'delete' options when a contact is opened","","Wed Jun 11 10:02:14 UTC 2025","passed","Wed Jun 11 10:02:16 UTC 2025","","More Options Menu - Online User - Permissions disabled: Export permissions disabled","",""
"","3823","should add user with valid password","","Wed Jun 11 10:03:52 UTC 2025","passed","Wed Jun 11 10:03:56 UTC 2025","","User Test Cases ->: Creating Users ->","",""
"","2754","should show a warning before log out","","Wed Jun 11 09:50:55 UTC 2025","passed","Wed Jun 11 09:50:57 UTC 2025","","Login page functionality tests: Log out","",""
"","584","should display an error with incorrect url","","Wed Jun 11 09:52:13 UTC 2025","passed","Wed Jun 11 09:52:13 UTC 2025","","Token login","",""
"","2193","should be set as Default language ","","Wed Jun 11 09:53:28 UTC 2025","passed","Wed Jun 11 09:53:30 UTC 2025","","Adding new language","",""
"","891","should show if the user changes their language","","Wed Jun 11 10:07:59 UTC 2025","passed","Wed Jun 11 10:08:00 UTC 2025","","Privacy policy: for an online user","",""
"","3108","TestCase for The password is too easy to guess.","","Wed Jun 11 10:04:11 UTC 2025","passed","Wed Jun 11 10:04:15 UTC 2025","","User Test Cases ->: Invalid entries -> ","",""
"","446","should hide the kebab menu on the Message tab","","Wed Jun 11 10:02:22 UTC 2025","passed","Wed Jun 11 10:02:23 UTC 2025","","More Options Menu - Online User - Permissions disabled: Export permissions disabled","",""
"","1118","should not create feedback docs when loading missing reports or people","","Wed Jun 11 10:06:38 UTC 2025","passed","Wed Jun 11 10:06:39 UTC 2025","","Navigation tests: Navigation view: as chw","",""
"","1820","should enable the 'export' option in Message tab.","","Wed Jun 11 10:03:26 UTC 2025","passed","Wed Jun 11 10:03:28 UTC 2025","","More Options Menu - Online User - Permissions enabled: Options displayed when there are messages, contacts and people created","",""
"","1434","should verify all fields are missing","","Wed Jun 11 09:51:25 UTC 2025","passed","Wed Jun 11 09:51:26 UTC 2025","","Login page functionality tests: Password Reset","",""
"","1052","should disable the 'export' option in Message tab","","Wed Jun 11 10:03:11 UTC 2025","passed","Wed Jun 11 10:03:12 UTC 2025","","More Options Menu - Online User - Permissions enabled: Options displayed when there are no messages, contacts or people created","",""
"","897","should display plurals correctly","","Wed Jun 11 09:52:52 UTC 2025","passed","Wed Jun 11 09:52:53 UTC 2025","","MessageFormat","",""
"","6153","should log in the sso user","","Wed Jun 11 09:51:59 UTC 2025","passed","Wed Jun 11 09:52:05 UTC 2025","","SSO Login","",""
"","976","should change locale to French","","Wed Jun 11 09:50:50 UTC 2025","passed","Wed Jun 11 09:50:51 UTC 2025","","Login page functionality tests: Locale","",""
"","622","should open User settings","","Wed Jun 11 10:05:37 UTC 2025","passed","Wed Jun 11 10:05:38 UTC 2025","","Hamburger Menu tests","",""
"","3239","should not fail due to document conflict for new offline user","","Wed Jun 11 10:08:07 UTC 2025","passed","Wed Jun 11 10:08:10 UTC 2025","","Privacy policy: conflicts","",""
"","3302","should show french policy on secondary login","","Wed Jun 11 10:07:56 UTC 2025","passed","Wed Jun 11 10:07:59 UTC 2025","","Privacy policy: for an online user","",""
"","2265","should hide the 'export' option and enable the 'edit' and 'delete' options when a contact is opened","","Wed Jun 11 09:59:23 UTC 2025","passed","Wed Jun 11 09:59:26 UTC 2025","","More Options Menu - Offline User: All permissions enabled: Contact tab","",""
"","2413","should revisit completed trainings and load uncompleted trainings","","Wed Jun 11 10:05:16 UTC 2025","passed","Wed Jun 11 10:05:18 UTC 2025","","Training Materials Page","",""
"","3283","should quit training in modal, and be able to complete it later in the Training Material page, verify completed trainings display in the list","","Wed Jun 11 10:05:12 UTC 2025","passed","Wed Jun 11 10:05:16 UTC 2025","","Training Materials Page","",""
"","414","should open tasks tab","","Wed Jun 11 10:05:49 UTC 2025","passed","Wed Jun 11 10:05:49 UTC 2025","","Navigation tests: Navigation functionality","",""
"","3885","should require user to have permission for multiple places","","Wed Jun 11 10:04:29 UTC 2025","passed","Wed Jun 11 10:04:32 UTC 2025","","User Test Cases ->: Invalid entries -> ","",""
"","2640","should hide the 'delete' option and enable the 'edit', 'export' and 'review' options when a report is opened","","Wed Jun 11 10:02:41 UTC 2025","passed","Wed Jun 11 10:02:44 UTC 2025","","More Options Menu - Online User - Permissions disabled: Delete permissions disabled","",""
"","1252","should work with botched translations","","Wed Jun 11 09:52:53 UTC 2025","passed","Wed Jun 11 09:52:54 UTC 2025","","MessageFormat","",""
"","75","should display tab labels, when all tabs are enabled","","Wed Jun 11 10:05:53 UTC 2025","passed","Wed Jun 11 10:05:53 UTC 2025","","Navigation tests: Navigation view: as admin","",""
