"DESCRIPTION","DURATION IN MS","NAME","PARENT SUITE","START TIME","STATUS","STOP TIME","SUB SUITE","SUITE","TEST CLASS","TEST METHOD"
"","1097","should navigate to the People section and open the created Health Center","","Thu Jul 03 15:44:08 UTC 2025","passed","Thu Jul 03 15:44:09 UTC 2025","","Old Navigation","",""
"","1372","should display an error when token is expired","","Thu Jul 03 15:34:06 UTC 2025","passed","Thu Jul 03 15:34:07 UTC 2025","","Token login","",""
"","3425","should quit training in modal, and be able to complete it later in the Training Material page, verify completed trainings display in the list","","Thu Jul 03 15:42:09 UTC 2025","passed","Thu Jul 03 15:42:12 UTC 2025","","Training Materials Page","",""
"","2681","should enable the 'export', 'review' and 'delete' options and hide the 'edit' option in Report tab when a NON XML report is opened.","","Thu Jul 03 15:40:23 UTC 2025","passed","Thu Jul 03 15:40:25 UTC 2025","","More Options Menu - Online User - Permissions enabled: Options displayed when there are messages, contacts and people created","",""
"","3107","TestCase for The password is too easy to guess.","","Thu Jul 03 15:41:06 UTC 2025","passed","Thu Jul 03 15:41:09 UTC 2025","","User Test Cases ->: Invalid entries -> ","",""
"","3498","should hide the 'delete' option and enable the 'edit', 'export' and 'review' options when a report is opened","","Thu Jul 03 15:39:34 UTC 2025","passed","Thu Jul 03 15:39:37 UTC 2025","","More Options Menu - Online User - Permissions disabled: Delete permissions disabled","",""
"","3091","should display the ""session expired"" modal and redirect to login page","","Thu Jul 03 15:32:56 UTC 2025","passed","Thu Jul 03 15:32:59 UTC 2025","","Login page functionality tests: Log in","",""
"","658","should open Reports or History tab","","Thu Jul 03 15:42:47 UTC 2025","passed","Thu Jul 03 15:42:47 UTC 2025","","Navigation tests: Navigation functionality","",""
"","2488","should redirect to login page when session is expired","","Thu Jul 03 15:42:23 UTC 2025","passed","Thu Jul 03 15:42:25 UTC 2025","","bfcache: webapp","",""
"","1009","should show if the user changes their language","","Thu Jul 03 15:44:38 UTC 2025","passed","Thu Jul 03 15:44:39 UTC 2025","","Privacy policy: for an offline user","",""
"","3979","should hide and reveal password value, and add user with a revealed password","","Thu Jul 03 15:40:55 UTC 2025","passed","Thu Jul 03 15:40:59 UTC 2025","","User Test Cases ->: Creating Users ->","",""
"","7813","should enable the 'edit' and 'review' option and hide the 'export' and 'delete' options when the xml report is opened","","Thu Jul 03 15:37:52 UTC 2025","passed","Thu Jul 03 15:37:59 UTC 2025","","More Options Menu - Offline User - Delete permissions disabled: Report tab","",""
"","1154","should open Report bug","","Thu Jul 03 15:42:35 UTC 2025","passed","Thu Jul 03 15:42:37 UTC 2025","","Hamburger Menu tests","",""
"","3641","should add sso user","","Thu Jul 03 15:40:59 UTC 2025","passed","Thu Jul 03 15:41:03 UTC 2025","","User Test Cases ->: Creating Users ->","",""
"","1443","should disable the 'export' option and hide the 'edit' and 'delete' options in Contact tab","","Thu Jul 03 15:40:07 UTC 2025","passed","Thu Jul 03 15:40:09 UTC 2025","","More Options Menu - Online User - Permissions enabled: Options displayed when there are no messages, contacts or people created","",""
"","408","should open tasks tab","","Thu Jul 03 15:42:46 UTC 2025","passed","Thu Jul 03 15:42:47 UTC 2025","","Navigation tests: Navigation functionality","",""
"","390","should hide the kebab menu on the Message tab","","Thu Jul 03 15:39:15 UTC 2025","passed","Thu Jul 03 15:39:15 UTC 2025","","More Options Menu - Online User - Permissions disabled: Export permissions disabled","",""
"","3000","should open the about page","","Thu Jul 03 15:41:54 UTC 2025","passed","Thu Jul 03 15:41:57 UTC 2025","","About page","",""
"","451","should open Analytics tab","","Thu Jul 03 15:42:48 UTC 2025","passed","Thu Jul 03 15:42:48 UTC 2025","","Navigation tests: Navigation functionality","",""
"","1200","should convert contact summary dates to bikram sambat when language is Nepali","","Thu Jul 03 15:35:10 UTC 2025","passed","Thu Jul 03 15:35:11 UTC 2025","","Bikram Sambat date display","",""
"","4099","should show an upload summary with a successful upload and a failed upload","","Thu Jul 03 15:41:34 UTC 2025","passed","Thu Jul 03 15:41:38 UTC 2025","","Bulk User Creation ->","",""
"","2431","should hide and reveal password value, and login with a revealed password","","Thu Jul 03 15:33:09 UTC 2025","passed","Thu Jul 03 15:33:12 UTC 2025","","Login page functionality tests: Log in","",""
"","1176","should try to sign in with blank auth and verify that credentials were incorrect","","Thu Jul 03 15:33:04 UTC 2025","passed","Thu Jul 03 15:33:05 UTC 2025","","Login page functionality tests: Log in","",""
"","2430","should hide the 'edit', 'delete' and 'review' options and enable the 'export' option when a report is opened","","Thu Jul 03 15:39:56 UTC 2025","passed","Thu Jul 03 15:39:58 UTC 2025","","More Options Menu - Online User - Permissions disabled: Edit permissions disabled","",""
"","23874","should support deleting translations","","Thu Jul 03 15:35:39 UTC 2025","passed","Thu Jul 03 15:36:03 UTC 2025","","Adding new language","",""
"","772","should redirect to login when not logged in","","Thu Jul 03 15:32:22 UTC 2025","passed","Thu Jul 03 15:32:22 UTC 2025","","Acessing the admin app","",""
"","7798","should disable a language and enable another","","Thu Jul 03 15:34:14 UTC 2025","passed","Thu Jul 03 15:34:22 UTC 2025","","Enabling/disabling languages","",""
"","1352","should show if the user policy changes","","Thu Jul 03 15:44:59 UTC 2025","passed","Thu Jul 03 15:45:00 UTC 2025","","Privacy policy: for an online user","",""
"","2321","should redirect to login page when session is expired","","Thu Jul 03 15:42:25 UTC 2025","passed","Thu Jul 03 15:42:28 UTC 2025","","bfcache: admin app","",""
"","1020","should open Configuration app","","Thu Jul 03 15:42:38 UTC 2025","passed","Thu Jul 03 15:42:39 UTC 2025","","Hamburger Menu tests","",""
"","16045","should hide the kebab menu.","","Thu Jul 03 15:38:24 UTC 2025","passed","Thu Jul 03 15:38:40 UTC 2025","","More Options Menu - Offline User - Edit permissions disabled: Contact tab","",""
"","2263","should enable the 'export', 'review', 'edit' and 'delete' options in Report tab when a XML report is opened.","","Thu Jul 03 15:40:27 UTC 2025","passed","Thu Jul 03 15:40:29 UTC 2025","","More Options Menu - Online User - Permissions enabled: Options displayed when there are messages, contacts and people created","",""
"","691","should navigate to the Targets section, and open a target aggregate","","Thu Jul 03 15:44:09 UTC 2025","passed","Thu Jul 03 15:44:09 UTC 2025","","Old Navigation","",""
"","1079","should try to sign in with blank password and verify that credentials were incorrect","","Thu Jul 03 15:33:02 UTC 2025","passed","Thu Jul 03 15:33:03 UTC 2025","","Login page functionality tests: Log in","",""
"","912","should open Messages tab","","Thu Jul 03 15:42:45 UTC 2025","passed","Thu Jul 03 15:42:46 UTC 2025","","Navigation tests: Navigation functionality","",""
"","4153","should not show on subsequent login","","Thu Jul 03 15:44:30 UTC 2025","passed","Thu Jul 03 15:44:34 UTC 2025","","Privacy policy: for an offline user","",""
"","1148","should work with botched translations","","Thu Jul 03 15:34:45 UTC 2025","passed","Thu Jul 03 15:34:46 UTC 2025","","MessageFormat","",""
"","5058","should show access error when accessing as an offline user","","Thu Jul 03 15:32:24 UTC 2025","passed","Thu Jul 03 15:32:29 UTC 2025","","Acessing the admin app","",""
"","1629","SMS report shows bsDate type as date field correctly","","Thu Jul 03 15:35:11 UTC 2025","passed","Thu Jul 03 15:35:13 UTC 2025","","Bikram Sambat date display","",""
"","6220","should hide the 'export' option and enable the 'edit', 'delete' and 'review' options when a report is opened","","Thu Jul 03 15:39:09 UTC 2025","passed","Thu Jul 03 15:39:15 UTC 2025","","More Options Menu - Online User - Permissions disabled: Export permissions disabled","",""
"","1435","SMS report shows bsAggreDate type as date field correctly","","Thu Jul 03 15:35:13 UTC 2025","passed","Thu Jul 03 15:35:14 UTC 2025","","Bikram Sambat date display","",""
"","1707","should verify confirm password is missing","","Thu Jul 03 15:33:18 UTC 2025","passed","Thu Jul 03 15:33:19 UTC 2025","","Login page functionality tests: Password Reset","",""
"","2386","should be set as Default language ","","Thu Jul 03 15:35:24 UTC 2025","passed","Thu Jul 03 15:35:26 UTC 2025","","Adding new language","",""
"","447","should open About","","Thu Jul 03 15:42:33 UTC 2025","passed","Thu Jul 03 15:42:34 UTC 2025","","Hamburger Menu tests","",""
"","2097","should hide the 'export' and 'edit' options and disable the 'delete' option when the offline user's place is selected","","Thu Jul 03 15:36:20 UTC 2025","passed","Thu Jul 03 15:36:22 UTC 2025","","More Options Menu - Offline User: All permissions enabled: Contact tab","",""
"","587","should hide the kebab menu when the xml report is opened.","","Thu Jul 03 15:38:41 UTC 2025","passed","Thu Jul 03 15:38:42 UTC 2025","","More Options Menu - Offline User - Edit permissions disabled: Report tab","",""
"","1968","should display report list dates converted to bikram sambat","","Thu Jul 03 15:35:08 UTC 2025","passed","Thu Jul 03 15:35:10 UTC 2025","","Bikram Sambat date display","",""
"","1019","should change locale to Spanish","","Thu Jul 03 15:32:43 UTC 2025","passed","Thu Jul 03 15:32:44 UTC 2025","","Login page functionality tests: Locale","",""
"","2394","should log in using username and password fields","","Thu Jul 03 15:32:49 UTC 2025","passed","Thu Jul 03 15:32:51 UTC 2025","","Login page functionality tests: Log in","",""
"","4060","should allow admins to access the page","","Thu Jul 03 15:32:30 UTC 2025","passed","Thu Jul 03 15:32:34 UTC 2025","","Acessing the admin app","",""
"","1094","should not create feedback docs when loading missing reports or people","","Thu Jul 03 15:43:36 UTC 2025","passed","Thu Jul 03 15:43:37 UTC 2025","","Navigation tests: Navigation view: as chw","",""
"","3130","TestCase for The password must be at least 8 characters long.","","Thu Jul 03 15:41:03 UTC 2025","passed","Thu Jul 03 15:41:06 UTC 2025","","User Test Cases ->: Invalid entries -> ","",""
"","2039","should hide the 'export' and 'edit' options and disable the 'delete' option when no contact is opened","","Thu Jul 03 15:36:13 UTC 2025","passed","Thu Jul 03 15:36:15 UTC 2025","","More Options Menu - Offline User: All permissions enabled: Contact tab","",""
"","5252","should log in the sso user","","Thu Jul 03 15:33:51 UTC 2025","passed","Thu Jul 03 15:33:56 UTC 2025","","SSO Login","",""
"","3250","should not fail due to document conflict for new offline user","","Thu Jul 03 15:45:06 UTC 2025","passed","Thu Jul 03 15:45:09 UTC 2025","","Privacy policy: conflicts","",""
"","2224","should display partners","","Thu Jul 03 15:41:57 UTC 2025","passed","Thu Jul 03 15:41:59 UTC 2025","","About page","",""
"","2800","should show a warning before log out","","Thu Jul 03 15:32:45 UTC 2025","passed","Thu Jul 03 15:32:48 UTC 2025","","Login page functionality tests: Log out","",""
"","2433","should set correct cookies","","Thu Jul 03 15:32:52 UTC 2025","passed","Thu Jul 03 15:32:55 UTC 2025","","Login page functionality tests: Log in","",""
"","4782","enketo xpath extension function should display correct values when Nepali is not selected","","Thu Jul 03 15:34:56 UTC 2025","passed","Thu Jul 03 15:35:01 UTC 2025","","Bikram Sambat date display","",""
"","3751","should redirect the user to the app if already logged in","","Thu Jul 03 15:33:59 UTC 2025","passed","Thu Jul 03 15:34:03 UTC 2025","","Token login","",""
"","17658","should enable the 'edit' option and hide the 'export' and 'delete' options when a contact is opened","","Thu Jul 03 15:37:33 UTC 2025","passed","Thu Jul 03 15:37:51 UTC 2025","","More Options Menu - Offline User - Delete permissions disabled: Contact Tab","",""
"","1660","should hide the 'edit' and 'delete' options and enable the 'export' option when a contact is opened","","Thu Jul 03 15:39:54 UTC 2025","passed","Thu Jul 03 15:39:56 UTC 2025","","More Options Menu - Online User - Permissions disabled: Edit permissions disabled","",""
"","155","should show locale selector on login page","","Thu Jul 03 15:32:39 UTC 2025","passed","Thu Jul 03 15:32:40 UTC 2025","","Login page functionality tests: Locale","",""
"","4451","should add user with multiple places with permission","","Thu Jul 03 15:40:51 UTC 2025","passed","Thu Jul 03 15:40:55 UTC 2025","","User Test Cases ->: Creating Users ->","",""
"","1349","should hide the kebab menu.","","Thu Jul 03 15:36:11 UTC 2025","passed","Thu Jul 03 15:36:12 UTC 2025","","More Options Menu - Offline User: All permissions enabled: Message tab","",""
"","3381","should show french policy on secondary login","","Thu Jul 03 15:44:54 UTC 2025","passed","Thu Jul 03 15:44:58 UTC 2025","","Privacy policy: for an online user","",""
"","212","should display when navigating to the privacy policy page","","Thu Jul 03 15:44:29 UTC 2025","passed","Thu Jul 03 15:44:30 UTC 2025","","Privacy policy: for an offline user","",""
"","2298","should disable the 'export' option and hide the 'edit' and 'delete' options in Report tab","","Thu Jul 03 15:40:10 UTC 2025","passed","Thu Jul 03 15:40:13 UTC 2025","","More Options Menu - Online User - Permissions enabled: Options displayed when there are no messages, contacts or people created","",""
"","7544","should allow a new user to read/write from meta db","","Thu Jul 03 15:41:44 UTC 2025","passed","Thu Jul 03 15:41:51 UTC 2025","","Create user meta db : ","",""
"","995","should navigate to the Reports section and open the first report listed","","Thu Jul 03 15:44:07 UTC 2025","passed","Thu Jul 03 15:44:08 UTC 2025","","Old Navigation","",""
"","4586","should hide the kebab menu in Messages, People and Reports tabs","","Thu Jul 03 15:36:50 UTC 2025","passed","Thu Jul 03 15:36:55 UTC 2025","","More Options Menu - Offline User: All permissions disabled","",""
"","589","should hide the kebab menu when the sms report is opened.","","Thu Jul 03 15:38:40 UTC 2025","passed","Thu Jul 03 15:38:41 UTC 2025","","More Options Menu - Offline User - Edit permissions disabled: Report tab","",""
"","2318","should hide the 'export' option and enable the 'edit' and 'delete' options when a contact is opened","","Thu Jul 03 15:36:16 UTC 2025","passed","Thu Jul 03 15:36:19 UTC 2025","","More Options Menu - Offline User: All permissions enabled: Contact tab","",""
"","1615","should enable the 'export', 'edit' and 'delete' options in Contact tab when a contact is opened.","","Thu Jul 03 15:40:31 UTC 2025","passed","Thu Jul 03 15:40:32 UTC 2025","","More Options Menu - Online User - Permissions enabled: Options displayed when there are messages, contacts and people created","",""
"","864","should have a title","","Thu Jul 03 15:33:00 UTC 2025","passed","Thu Jul 03 15:33:01 UTC 2025","","Login page functionality tests: Log in","",""
"","11462","should work with incorrect locale","","Thu Jul 03 15:34:25 UTC 2025","passed","Thu Jul 03 15:34:36 UTC 2025","","Testing Incorrect locale","",""
"","813","should display plurals correctly","","Thu Jul 03 15:34:44 UTC 2025","passed","Thu Jul 03 15:34:45 UTC 2025","","MessageFormat","",""
"","8964","Refresh page multiple times and verify token gets renewed","","Thu Jul 03 15:33:39 UTC 2025","passed","Thu Jul 03 15:33:48 UTC 2025","","should renew token","",""
"","628","should hide the kebab menu when the sms report is opened","","Thu Jul 03 15:37:51 UTC 2025","passed","Thu Jul 03 15:37:52 UTC 2025","","More Options Menu - Offline User - Delete permissions disabled: Report tab","",""
"","1173","should try to sign in and verify that credentials were incorrect","","Thu Jul 03 15:33:07 UTC 2025","passed","Thu Jul 03 15:33:08 UTC 2025","","Login page functionality tests: Log in","",""
"","3286","should show the correct privacy policy on login","","Thu Jul 03 15:44:26 UTC 2025","passed","Thu Jul 03 15:44:29 UTC 2025","","Privacy policy: for an offline user","",""
"","79","should display tab labels, when all tabs are enabled","","Thu Jul 03 15:42:50 UTC 2025","passed","Thu Jul 03 15:42:50 UTC 2025","","Navigation tests: Navigation view: as admin","",""
"","2623","should log the user in when token is correct","","Thu Jul 03 15:34:08 UTC 2025","passed","Thu Jul 03 15:34:11 UTC 2025","","Token login","",""
"","200","should display when navigating to the privacy policy page","","Thu Jul 03 15:44:51 UTC 2025","passed","Thu Jul 03 15:44:51 UTC 2025","","Privacy policy: for an online user","",""
"","4419","should enable the 'export' option and hide the 'edit' and 'delete' options in Contact tab when none of the contacts is opened.","","Thu Jul 03 15:40:34 UTC 2025","passed","Thu Jul 03 15:40:38 UTC 2025","","More Options Menu - Online User - Permissions enabled: Options displayed when there are messages, contacts and people created","",""
"","927","should successfully sync","","Thu Jul 03 15:44:09 UTC 2025","passed","Thu Jul 03 15:44:10 UTC 2025","","Old Navigation","",""
"","4298","should show if the user policy changes","","Thu Jul 03 15:44:39 UTC 2025","passed","Thu Jul 03 15:44:43 UTC 2025","","Privacy policy: for an offline user","",""
"","923","should show if the user changes their language","","Thu Jul 03 15:44:58 UTC 2025","passed","Thu Jul 03 15:44:59 UTC 2025","","Privacy policy: for an online user","",""
"","1455","should verify all fields are missing","","Thu Jul 03 15:33:15 UTC 2025","passed","Thu Jul 03 15:33:16 UTC 2025","","Login page functionality tests: Password Reset","",""
"","1611","should verify current password cannot be same as new password","","Thu Jul 03 15:33:26 UTC 2025","passed","Thu Jul 03 15:33:27 UTC 2025","","Login page functionality tests: Password Reset","",""
"","1959","should enable the 'export' option in Message tab.","","Thu Jul 03 15:40:20 UTC 2025","passed","Thu Jul 03 15:40:22 UTC 2025","","More Options Menu - Online User - Permissions enabled: Options displayed when there are messages, contacts and people created","",""
"","1573","should verify current password is not correct","","Thu Jul 03 15:33:23 UTC 2025","passed","Thu Jul 03 15:33:25 UTC 2025","","Login page functionality tests: Password Reset","",""
"","548","should not show on refresh","","Thu Jul 03 15:44:29 UTC 2025","passed","Thu Jul 03 15:44:29 UTC 2025","","Privacy policy: for an offline user","",""
"","470","should open Contacts or Peoples tab","","Thu Jul 03 15:42:47 UTC 2025","passed","Thu Jul 03 15:42:48 UTC 2025","","Navigation tests: Navigation functionality","",""
"","619","should open User settings","","Thu Jul 03 15:42:34 UTC 2025","passed","Thu Jul 03 15:42:35 UTC 2025","","Hamburger Menu tests","",""
"","2177","should show in enabled language list","","Thu Jul 03 15:35:22 UTC 2025","passed","Thu Jul 03 15:35:24 UTC 2025","","Adding new language","",""
"","5960","should hide the 'export' and 'edit' options and enable the 'delete' and 'review' options when the sms report is opened","","Thu Jul 03 15:36:23 UTC 2025","passed","Thu Jul 03 15:36:29 UTC 2025","","More Options Menu - Offline User: All permissions enabled: Report tab","",""
"","1527","should require place and contact for restricted user","","Thu Jul 03 15:41:22 UTC 2025","passed","Thu Jul 03 15:41:23 UTC 2025","","User Test Cases ->: Invalid entries -> ","",""
"","3933","should add user with valid password","","Thu Jul 03 15:40:47 UTC 2025","passed","Thu Jul 03 15:40:51 UTC 2025","","User Test Cases ->: Creating Users ->","",""
"","1599","should verify password and confirm password mismatch","","Thu Jul 03 15:33:28 UTC 2025","passed","Thu Jul 03 15:33:30 UTC 2025","","Login page functionality tests: Password Reset","",""
"","3293","should navigate to the Messages section and open a sent message","","Thu Jul 03 15:44:02 UTC 2025","passed","Thu Jul 03 15:44:05 UTC 2025","","Old Navigation","",""
"","3969","should show french policy on secondary login","","Thu Jul 03 15:44:34 UTC 2025","passed","Thu Jul 03 15:44:38 UTC 2025","","Privacy policy: for an offline user","",""
"","3390","should not show on subsequent login","","Thu Jul 03 15:44:51 UTC 2025","passed","Thu Jul 03 15:44:54 UTC 2025","","Privacy policy: for an online user","",""
"","3198","should require username","","Thu Jul 03 15:41:19 UTC 2025","passed","Thu Jul 03 15:41:22 UTC 2025","","User Test Cases ->: Invalid entries -> ","",""
"","4417","should redirect to the app page when session is valid","","Thu Jul 03 15:42:18 UTC 2025","passed","Thu Jul 03 15:42:22 UTC 2025","","bfcache: login page","",""
"","2027","should navigate back to the login page when using either back button","","Thu Jul 03 15:44:16 UTC 2025","passed","Thu Jul 03 15:44:18 UTC 2025","","Privacy Policy Navigation for Unauthenticated Users","",""
"","3729","should reset password successfully and redirect to webapp","","Thu Jul 03 15:33:31 UTC 2025","passed","Thu Jul 03 15:33:35 UTC 2025","","Login page functionality tests: Password Reset","",""
"","3116","TestCase for Passwords must match","","Thu Jul 03 15:41:09 UTC 2025","passed","Thu Jul 03 15:41:12 UTC 2025","","User Test Cases ->: Invalid entries -> ","",""
"","1897","should hide the 'delete' option and enable the 'edit' and 'export' options when a contact is opened","","Thu Jul 03 15:39:32 UTC 2025","passed","Thu Jul 03 15:39:34 UTC 2025","","More Options Menu - Online User - Permissions disabled: Delete permissions disabled","",""
"","1261","should not display privacy policy page when the privacy policy is not enabled","","Thu Jul 03 15:44:14 UTC 2025","passed","Thu Jul 03 15:44:16 UTC 2025","","Privacy Policy Navigation for Unauthenticated Users","",""
"","1275","should show the correct privacy policy on login","","Thu Jul 03 15:44:49 UTC 2025","passed","Thu Jul 03 15:44:50 UTC 2025","","Privacy policy: for an online user","",""
"","662","should display an error when accessing with random strings","","Thu Jul 03 15:34:05 UTC 2025","passed","Thu Jul 03 15:34:05 UTC 2025","","Token login","",""
"","1780","should hide the 'export' option and enable the 'edit' and 'delete' options when a contact is opened","","Thu Jul 03 15:39:07 UTC 2025","passed","Thu Jul 03 15:39:09 UTC 2025","","More Options Menu - Online User - Permissions disabled: Export permissions disabled","",""
"","3145","TestCase for required","","Thu Jul 03 15:41:16 UTC 2025","passed","Thu Jul 03 15:41:19 UTC 2025","","User Test Cases ->: Invalid entries -> ","",""
"","6190","should hide the 'export' option and enable the 'edit', 'delete' and 'review' options when the xml report is opened","","Thu Jul 03 15:36:31 UTC 2025","passed","Thu Jul 03 15:36:37 UTC 2025","","More Options Menu - Offline User: All permissions enabled: Report tab","",""
"","1029","should change locale to French","","Thu Jul 03 15:32:41 UTC 2025","passed","Thu Jul 03 15:32:42 UTC 2025","","Login page functionality tests: Locale","",""
"","6644","enketo xpath extension function should display correct values when Nepali is selected","","Thu Jul 03 15:35:01 UTC 2025","passed","Thu Jul 03 15:35:08 UTC 2025","","Bikram Sambat date display","",""
"","12343","should add new translations","","Thu Jul 03 15:35:26 UTC 2025","passed","Thu Jul 03 15:35:39 UTC 2025","","Adding new language","",""
"","181","should display tab labels, when some tabs are enabled","","Thu Jul 03 15:43:35 UTC 2025","passed","Thu Jul 03 15:43:36 UTC 2025","","Navigation tests: Navigation view: as chw","",""
"","594","should display an error with incorrect url","","Thu Jul 03 15:34:04 UTC 2025","passed","Thu Jul 03 15:34:04 UTC 2025","","Token login","",""
"","1766","should navigate to the Task section and open the first task listed","","Thu Jul 03 15:44:05 UTC 2025","passed","Thu Jul 03 15:44:07 UTC 2025","","Old Navigation","",""
"","704","should not show on refresh","","Thu Jul 03 15:44:50 UTC 2025","passed","Thu Jul 03 15:44:51 UTC 2025","","Privacy policy: for an online user","",""
"","1601","should verify password strength","","Thu Jul 03 15:33:20 UTC 2025","passed","Thu Jul 03 15:33:22 UTC 2025","","Login page functionality tests: Password Reset","",""
"","4109","should require user to have permission for multiple places","","Thu Jul 03 15:41:23 UTC 2025","passed","Thu Jul 03 15:41:27 UTC 2025","","User Test Cases ->: Invalid entries -> ","",""
"","2490","should revisit completed trainings and load uncompleted trainings","","Thu Jul 03 15:42:12 UTC 2025","passed","Thu Jul 03 15:42:15 UTC 2025","","Training Materials Page","",""
"","402","should display an error when token login is disabled","","Thu Jul 03 15:34:03 UTC 2025","passed","Thu Jul 03 15:34:03 UTC 2025","","Token login","",""
"","1231","should disable the 'export' option in Message tab","","Thu Jul 03 15:40:05 UTC 2025","passed","Thu Jul 03 15:40:06 UTC 2025","","More Options Menu - Online User - Permissions enabled: Options displayed when there are no messages, contacts or people created","",""
