"DESCRIPTION","DURATION IN MS","NAME","PARENT SUITE","START TIME","STATUS","STOP TIME","SUB SUITE","SUITE","TEST CLASS","TEST METHOD"
"","2202","should be set as Default language ","","Tue Jul 29 20:59:32 UTC 2025","passed","Tue Jul 29 20:59:34 UTC 2025","","Adding new language","",""
"","615","should display an error when accessing with random strings","","Tue Jul 29 20:56:29 UTC 2025","passed","Tue Jul 29 20:56:30 UTC 2025","","Token login","",""
"","1617","should hide the 'edit' and 'delete' options and enable the 'export' option when a contact is opened","","Tue Jul 29 21:05:57 UTC 2025","passed","Tue Jul 29 21:05:58 UTC 2025","","More Options Menu - Online User - Permissions disabled: Edit permissions disabled","",""
"","1270","should disable the 'export' option in Message tab","","Tue Jul 29 21:06:07 UTC 2025","passed","Tue Jul 29 21:06:09 UTC 2025","","More Options Menu - Online User - Permissions enabled: Options displayed when there are no messages, contacts or people created","",""
"","1036","should open Configuration app","","Tue Jul 29 21:08:58 UTC 2025","passed","Tue Jul 29 21:08:59 UTC 2025","","Hamburger Menu tests","",""
"","12858","should add new translations","","Tue Jul 29 20:59:34 UTC 2025","passed","Tue Jul 29 20:59:47 UTC 2025","","Adding new language","",""
"","3774","should add user with valid password","","Tue Jul 29 21:07:13 UTC 2025","passed","Tue Jul 29 21:07:16 UTC 2025","","User Test Cases ->: Creating Users ->","",""
"","17013","should hide the kebab menu.","","Tue Jul 29 21:04:26 UTC 2025","passed","Tue Jul 29 21:04:43 UTC 2025","","More Options Menu - Offline User - Edit permissions disabled: Contact tab","",""
"","3637","should reset password successfully and redirect to webapp","","Tue Jul 29 20:55:55 UTC 2025","passed","Tue Jul 29 20:55:59 UTC 2025","","Login page functionality tests: Password Reset","",""
"","3924","should redirect the user to the app if already logged in","","Tue Jul 29 20:56:23 UTC 2025","passed","Tue Jul 29 20:56:27 UTC 2025","","Token login","",""
"","214","should display when navigating to the privacy policy page","","Tue Jul 29 21:11:12 UTC 2025","passed","Tue Jul 29 21:11:12 UTC 2025","","Privacy policy: for an online user","",""
"","7431","should allow a new user to read/write from meta db","","Tue Jul 29 21:06:59 UTC 2025","passed","Tue Jul 29 21:07:06 UTC 2025","","Create user meta db : ","",""
"","3826","should allow admins to access the page","","Tue Jul 29 20:54:52 UTC 2025","passed","Tue Jul 29 20:54:56 UTC 2025","","Acessing the admin app","",""
"","3167","TestCase for Passwords must match","","Tue Jul 29 21:07:35 UTC 2025","passed","Tue Jul 29 21:07:38 UTC 2025","","User Test Cases ->: Invalid entries -> ","",""
"","6137","should enable the 'edit' and 'review' option and hide the 'export' and 'delete' options when the xml report is opened","","Tue Jul 29 21:03:38 UTC 2025","passed","Tue Jul 29 21:03:44 UTC 2025","","More Options Menu - Offline User - Delete permissions disabled: Report tab","",""
"","143","should show locale selector on login page","","Tue Jul 29 20:55:01 UTC 2025","passed","Tue Jul 29 20:55:01 UTC 2025","","Login page functionality tests: Locale","",""
"","1091","should not create feedback docs when loading missing reports or people","","Tue Jul 29 21:09:56 UTC 2025","passed","Tue Jul 29 21:09:57 UTC 2025","","Navigation tests: Navigation view: as chw","",""
"","3571","should show the correct privacy policy on login","","Tue Jul 29 21:10:46 UTC 2025","passed","Tue Jul 29 21:10:49 UTC 2025","","Privacy policy: for an offline user","",""
"","1436","SMS report shows bsDate type as date field correctly","","Tue Jul 29 20:59:19 UTC 2025","passed","Tue Jul 29 20:59:21 UTC 2025","","Bikram Sambat date display","",""
"","387","should hide the kebab menu on the Message tab","","Tue Jul 29 21:05:17 UTC 2025","passed","Tue Jul 29 21:05:18 UTC 2025","","More Options Menu - Online User - Permissions disabled: Export permissions disabled","",""
"","2273","should redirect to login page when session is expired","","Tue Jul 29 21:08:45 UTC 2025","passed","Tue Jul 29 21:08:48 UTC 2025","","bfcache: admin app","",""
"","663","should open Reports or History tab","","Tue Jul 29 21:09:07 UTC 2025","passed","Tue Jul 29 21:09:08 UTC 2025","","Navigation tests: Navigation functionality","",""
"","952","should show if the user changes their language","","Tue Jul 29 21:10:58 UTC 2025","passed","Tue Jul 29 21:10:59 UTC 2025","","Privacy policy: for an offline user","",""
"","643","should open User settings","","Tue Jul 29 21:08:54 UTC 2025","passed","Tue Jul 29 21:08:55 UTC 2025","","Hamburger Menu tests","",""
"","959","should show if the user changes their language","","Tue Jul 29 21:11:19 UTC 2025","passed","Tue Jul 29 21:11:20 UTC 2025","","Privacy policy: for an online user","",""
"","2623","should hide and reveal password value, and login with a revealed password","","Tue Jul 29 20:55:32 UTC 2025","passed","Tue Jul 29 20:55:35 UTC 2025","","Login page functionality tests: Log in","",""
"","4521","should redirect to the app page when session is valid","","Tue Jul 29 21:08:38 UTC 2025","passed","Tue Jul 29 21:08:42 UTC 2025","","bfcache: login page","",""
"","1913","should hide the 'export' option and enable the 'edit' and 'delete' options when a contact is opened","","Tue Jul 29 21:05:10 UTC 2025","passed","Tue Jul 29 21:05:11 UTC 2025","","More Options Menu - Online User - Permissions disabled: Export permissions disabled","",""
"","559","should hide the kebab menu when the sms report is opened","","Tue Jul 29 21:03:38 UTC 2025","passed","Tue Jul 29 21:03:38 UTC 2025","","More Options Menu - Offline User - Delete permissions disabled: Report tab","",""
"","623","should display an error with incorrect url","","Tue Jul 29 20:56:28 UTC 2025","passed","Tue Jul 29 20:56:29 UTC 2025","","Token login","",""
"","1267","should not display privacy policy page when the privacy policy is not enabled","","Tue Jul 29 21:10:35 UTC 2025","passed","Tue Jul 29 21:10:36 UTC 2025","","Privacy Policy Navigation for Unauthenticated Users","",""
"","2369","should hide the 'edit', 'delete' and 'review' options and enable the 'export' option when a report is opened","","Tue Jul 29 21:05:58 UTC 2025","passed","Tue Jul 29 21:06:01 UTC 2025","","More Options Menu - Online User - Permissions disabled: Edit permissions disabled","",""
"","579","should hide the kebab menu when the sms report is opened.","","Tue Jul 29 21:04:43 UTC 2025","passed","Tue Jul 29 21:04:43 UTC 2025","","More Options Menu - Offline User - Edit permissions disabled: Report tab","",""
"","940","should navigate to the Reports section and open the first report listed","","Tue Jul 29 21:10:27 UTC 2025","passed","Tue Jul 29 21:10:28 UTC 2025","","Old Navigation","",""
"","1469","should verify all fields are missing","","Tue Jul 29 20:55:39 UTC 2025","passed","Tue Jul 29 20:55:40 UTC 2025","","Login page functionality tests: Password Reset","",""
"","441","should display an error when token login is disabled","","Tue Jul 29 20:56:28 UTC 2025","passed","Tue Jul 29 20:56:28 UTC 2025","","Token login","",""
"","4447","should add user with multiple places with permission","","Tue Jul 29 21:07:16 UTC 2025","passed","Tue Jul 29 21:07:21 UTC 2025","","User Test Cases ->: Creating Users ->","",""
"","719","should not show on refresh","","Tue Jul 29 21:11:11 UTC 2025","passed","Tue Jul 29 21:11:12 UTC 2025","","Privacy policy: for an online user","",""
"","75","should display tab labels, when all tabs are enabled","","Tue Jul 29 21:09:11 UTC 2025","passed","Tue Jul 29 21:09:11 UTC 2025","","Navigation tests: Navigation view: as admin","",""
"","183","should display tab labels, when some tabs are enabled","","Tue Jul 29 21:09:56 UTC 2025","passed","Tue Jul 29 21:09:56 UTC 2025","","Navigation tests: Navigation view: as chw","",""
"","542","should not show on refresh","","Tue Jul 29 21:10:49 UTC 2025","passed","Tue Jul 29 21:10:50 UTC 2025","","Privacy policy: for an offline user","",""
"","3949","should require user to have permission for multiple places","","Tue Jul 29 21:07:49 UTC 2025","passed","Tue Jul 29 21:07:53 UTC 2025","","User Test Cases ->: Invalid entries -> ","",""
"","3156","should open the about page","","Tue Jul 29 21:08:15 UTC 2025","passed","Tue Jul 29 21:08:18 UTC 2025","","About page","",""
"","1476","should require place and contact for restricted user","","Tue Jul 29 21:07:48 UTC 2025","passed","Tue Jul 29 21:07:49 UTC 2025","","User Test Cases ->: Invalid entries -> ","",""
"","750","should navigate to the Targets section, and open a target aggregate","","Tue Jul 29 21:10:29 UTC 2025","passed","Tue Jul 29 21:10:30 UTC 2025","","Old Navigation","",""
"","3159","should require username","","Tue Jul 29 21:07:45 UTC 2025","passed","Tue Jul 29 21:07:48 UTC 2025","","User Test Cases ->: Invalid entries -> ","",""
"","1010","should change locale to French","","Tue Jul 29 20:55:02 UTC 2025","passed","Tue Jul 29 20:55:04 UTC 2025","","Login page functionality tests: Locale","",""
"","3538","should not fail due to document conflict for new offline user","","Tue Jul 29 21:11:27 UTC 2025","passed","Tue Jul 29 21:11:31 UTC 2025","","Privacy policy: conflicts","",""
"","1215","should try to sign in with blank auth and verify that credentials were incorrect","","Tue Jul 29 20:55:27 UTC 2025","passed","Tue Jul 29 20:55:28 UTC 2025","","Login page functionality tests: Log in","",""
"","1350","should show the correct privacy policy on login","","Tue Jul 29 21:11:09 UTC 2025","passed","Tue Jul 29 21:11:11 UTC 2025","","Privacy policy: for an online user","",""
"","1304","should render user details","","Tue Jul 29 21:08:09 UTC 2025","passed","Tue Jul 29 21:08:10 UTC 2025","","User Test Cases ->: Editing User ->","",""
"","3409","should quit training in modal, and be able to complete it later in the Training Material page, verify completed trainings display in the list","","Tue Jul 29 21:08:29 UTC 2025","passed","Tue Jul 29 21:08:32 UTC 2025","","Training Materials Page","",""
"","1877","should hide the 'export' option and enable the 'edit' and 'delete' options when a contact is opened","","Tue Jul 29 21:00:29 UTC 2025","passed","Tue Jul 29 21:00:30 UTC 2025","","More Options Menu - Offline User: All permissions enabled: Contact tab","",""
"","10483","should work with incorrect locale","","Tue Jul 29 20:58:35 UTC 2025","passed","Tue Jul 29 20:58:46 UTC 2025","","Testing Incorrect locale","",""
"","1584","should verify current password cannot be same as new password","","Tue Jul 29 20:55:49 UTC 2025","passed","Tue Jul 29 20:55:51 UTC 2025","","Login page functionality tests: Password Reset","",""
"","2073","should hide the 'export' and 'edit' options and disable the 'delete' option when the offline user's place is selected","","Tue Jul 29 21:00:32 UTC 2025","passed","Tue Jul 29 21:00:34 UTC 2025","","More Options Menu - Offline User: All permissions enabled: Contact tab","",""
"","1583","should verify current password is not correct","","Tue Jul 29 20:55:47 UTC 2025","passed","Tue Jul 29 20:55:48 UTC 2025","","Login page functionality tests: Password Reset","",""
"","1060","should work with botched translations","","Tue Jul 29 20:58:54 UTC 2025","passed","Tue Jul 29 20:58:55 UTC 2025","","MessageFormat","",""
"","2797","should show a warning before log out","","Tue Jul 29 20:55:07 UTC 2025","passed","Tue Jul 29 20:55:10 UTC 2025","","Login page functionality tests: Log out","",""
"","3726","should add sso user","","Tue Jul 29 21:07:25 UTC 2025","passed","Tue Jul 29 21:07:29 UTC 2025","","User Test Cases ->: Creating Users ->","",""
"","1006","should have a title","","Tue Jul 29 20:55:22 UTC 2025","passed","Tue Jul 29 20:55:23 UTC 2025","","Login page functionality tests: Log in","",""
"","4465","should show if the user policy changes","","Tue Jul 29 21:10:59 UTC 2025","passed","Tue Jul 29 21:11:04 UTC 2025","","Privacy policy: for an offline user","",""
"","1452","should display an error when token is expired","","Tue Jul 29 20:56:30 UTC 2025","passed","Tue Jul 29 20:56:32 UTC 2025","","Token login","",""
"","4025","should hide the kebab menu in Messages, People and Reports tabs","","Tue Jul 29 21:01:07 UTC 2025","passed","Tue Jul 29 21:01:11 UTC 2025","","More Options Menu - Offline User: All permissions disabled","",""
"","3221","TestCase for The password must be at least 8 characters long.","","Tue Jul 29 21:07:29 UTC 2025","passed","Tue Jul 29 21:07:32 UTC 2025","","User Test Cases ->: Invalid entries -> ","",""
"","3659","should show french policy on secondary login","","Tue Jul 29 21:11:16 UTC 2025","passed","Tue Jul 29 21:11:19 UTC 2025","","Privacy policy: for an online user","",""
"","3805","should not show on subsequent login","","Tue Jul 29 21:11:12 UTC 2025","passed","Tue Jul 29 21:11:16 UTC 2025","","Privacy policy: for an online user","",""
"","4224","should show an upload summary with a successful upload and a failed upload","","Tue Jul 29 21:06:49 UTC 2025","passed","Tue Jul 29 21:06:53 UTC 2025","","Bulk User Creation ->","",""
"","2166","should hide the 'export' and 'edit' options and disable the 'delete' option when no contact is opened","","Tue Jul 29 21:00:22 UTC 2025","passed","Tue Jul 29 21:00:24 UTC 2025","","More Options Menu - Offline User: All permissions enabled: Contact tab","",""
"","1192","should open Report bug","","Tue Jul 29 21:08:55 UTC 2025","passed","Tue Jul 29 21:08:57 UTC 2025","","Hamburger Menu tests","",""
"","2366","should log in using username and password fields","","Tue Jul 29 20:55:11 UTC 2025","passed","Tue Jul 29 20:55:13 UTC 2025","","Login page functionality tests: Log in","",""
"","459","should open Analytics tab","","Tue Jul 29 21:09:08 UTC 2025","passed","Tue Jul 29 21:09:09 UTC 2025","","Navigation tests: Navigation functionality","",""
"","761","should redirect to login when not logged in","","Tue Jul 29 20:54:44 UTC 2025","passed","Tue Jul 29 20:54:45 UTC 2025","","Acessing the admin app","",""
"","4550","enketo xpath extension function should display correct values when Nepali is not selected","","Tue Jul 29 20:59:06 UTC 2025","passed","Tue Jul 29 20:59:10 UTC 2025","","Bikram Sambat date display","",""
"","4172","should not show on subsequent login","","Tue Jul 29 21:10:50 UTC 2025","passed","Tue Jul 29 21:10:54 UTC 2025","","Privacy policy: for an offline user","",""
"","1","should enable the 'edit' option and hide the 'export' and 'delete' options when a contact is opened","","Tue Jul 29 21:03:38 UTC 2025","broken","Tue Jul 29 21:03:38 UTC 2025","","More Options Menu - Offline User - Delete permissions disabled: Contact Tab","",""
"","1619","should verify confirm password is missing","","Tue Jul 29 20:55:41 UTC 2025","passed","Tue Jul 29 20:55:43 UTC 2025","","Login page functionality tests: Password Reset","",""
"","9106","Refresh page multiple times and verify token gets renewed","","Tue Jul 29 20:56:03 UTC 2025","passed","Tue Jul 29 20:56:12 UTC 2025","","should renew token","",""
"","2662","should enable the 'export', 'review' and 'delete' options and hide the 'edit' option in Report tab when a NON XML report is opened.","","Tue Jul 29 21:06:26 UTC 2025","passed","Tue Jul 29 21:06:28 UTC 2025","","More Options Menu - Online User - Permissions enabled: Options displayed when there are messages, contacts and people created","",""
"","5821","should hide the 'export' and 'edit' options and enable the 'delete' and 'review' options when the sms report is opened","","Tue Jul 29 21:00:35 UTC 2025","passed","Tue Jul 29 21:00:41 UTC 2025","","More Options Menu - Offline User: All permissions enabled: Report tab","",""
"","2512","should set correct cookies","","Tue Jul 29 20:55:14 UTC 2025","passed","Tue Jul 29 20:55:17 UTC 2025","","Login page functionality tests: Log in","",""
"","2398","should revisit completed trainings and load uncompleted trainings","","Tue Jul 29 21:08:32 UTC 2025","passed","Tue Jul 29 21:08:35 UTC 2025","","Training Materials Page","",""
"","6053","enketo xpath extension function should display correct values when Nepali is selected","","Tue Jul 29 20:59:10 UTC 2025","passed","Tue Jul 29 20:59:16 UTC 2025","","Bikram Sambat date display","",""
"","23901","should support deleting translations","","Tue Jul 29 20:59:47 UTC 2025","passed","Tue Jul 29 21:00:11 UTC 2025","","Adding new language","",""
"","1030","should navigate to the People section and open the created Health Center","","Tue Jul 29 21:10:28 UTC 2025","passed","Tue Jul 29 21:10:29 UTC 2025","","Old Navigation","",""
"","2010","should navigate back to the login page when using either back button","","Tue Jul 29 21:10:36 UTC 2025","passed","Tue Jul 29 21:10:38 UTC 2025","","Privacy Policy Navigation for Unauthenticated Users","",""
"","1853","should display report list dates converted to bikram sambat","","Tue Jul 29 20:59:16 UTC 2025","passed","Tue Jul 29 20:59:18 UTC 2025","","Bikram Sambat date display","",""
"","2270","should enable the 'export', 'review', 'edit' and 'delete' options in Report tab when a XML report is opened.","","Tue Jul 29 21:06:30 UTC 2025","passed","Tue Jul 29 21:06:32 UTC 2025","","More Options Menu - Online User - Permissions enabled: Options displayed when there are messages, contacts and people created","",""
"","1342","should hide the kebab menu.","","Tue Jul 29 21:00:20 UTC 2025","passed","Tue Jul 29 21:00:21 UTC 2025","","More Options Menu - Offline User: All permissions enabled: Message tab","",""
"","2506","should redirect to login page when session is expired","","Tue Jul 29 21:08:43 UTC 2025","passed","Tue Jul 29 21:08:45 UTC 2025","","bfcache: webapp","",""
"","1563","should enable the 'export', 'edit' and 'delete' options in Contact tab when a contact is opened.","","Tue Jul 29 21:06:33 UTC 2025","passed","Tue Jul 29 21:06:35 UTC 2025","","More Options Menu - Online User - Permissions enabled: Options displayed when there are messages, contacts and people created","",""
"","2007","should enable the 'export' option in Message tab.","","Tue Jul 29 21:06:22 UTC 2025","passed","Tue Jul 29 21:06:24 UTC 2025","","More Options Menu - Online User - Permissions enabled: Options displayed when there are messages, contacts and people created","",""
"","1860","should hide the 'delete' option and enable the 'edit' and 'export' options when a contact is opened","","Tue Jul 29 21:05:35 UTC 2025","passed","Tue Jul 29 21:05:36 UTC 2025","","More Options Menu - Online User - Permissions disabled: Delete permissions disabled","",""
"","1171","should convert contact summary dates to bikram sambat when language is Nepali","","Tue Jul 29 20:59:18 UTC 2025","passed","Tue Jul 29 20:59:19 UTC 2025","","Bikram Sambat date display","",""
"","1343","should try to sign in with blank password and verify that credentials were incorrect","","Tue Jul 29 20:55:25 UTC 2025","passed","Tue Jul 29 20:55:26 UTC 2025","","Login page functionality tests: Log in","",""
"","203","should display when navigating to the privacy policy page","","Tue Jul 29 21:10:50 UTC 2025","passed","Tue Jul 29 21:10:50 UTC 2025","","Privacy policy: for an offline user","",""
"","4950","should show access error when accessing as an offline user","","Tue Jul 29 20:54:46 UTC 2025","passed","Tue Jul 29 20:54:51 UTC 2025","","Acessing the admin app","",""
"","1484","should disable the 'export' option and hide the 'edit' and 'delete' options in Contact tab","","Tue Jul 29 21:06:10 UTC 2025","passed","Tue Jul 29 21:06:11 UTC 2025","","More Options Menu - Online User - Permissions enabled: Options displayed when there are no messages, contacts or people created","",""
"","4116","should hide and reveal password value, and add user with a revealed password","","Tue Jul 29 21:07:21 UTC 2025","passed","Tue Jul 29 21:07:25 UTC 2025","","User Test Cases ->: Creating Users ->","",""
"","3715","should hide the 'delete' option and enable the 'edit', 'export' and 'review' options when a report is opened","","Tue Jul 29 21:05:36 UTC 2025","passed","Tue Jul 29 21:05:40 UTC 2025","","More Options Menu - Online User - Permissions disabled: Delete permissions disabled","",""
"","1081","should open Messages tab","","Tue Jul 29 21:09:06 UTC 2025","passed","Tue Jul 29 21:09:07 UTC 2025","","Navigation tests: Navigation functionality","",""
"","825","should display plurals correctly","","Tue Jul 29 20:58:53 UTC 2025","passed","Tue Jul 29 20:58:54 UTC 2025","","MessageFormat","",""
"","1854","should navigate to the Task section and open the first task listed","","Tue Jul 29 21:10:25 UTC 2025","passed","Tue Jul 29 21:10:27 UTC 2025","","Old Navigation","",""
"","2571","should log the user in when token is correct","","Tue Jul 29 20:56:33 UTC 2025","passed","Tue Jul 29 20:56:35 UTC 2025","","Token login","",""
"","465","should open About","","Tue Jul 29 21:08:53 UTC 2025","passed","Tue Jul 29 21:08:54 UTC 2025","","Hamburger Menu tests","",""
"","408","should open tasks tab","","Tue Jul 29 21:09:07 UTC 2025","passed","Tue Jul 29 21:09:07 UTC 2025","","Navigation tests: Navigation functionality","",""
"","6051","should hide the 'export' option and enable the 'edit', 'delete' and 'review' options when a report is opened","","Tue Jul 29 21:05:11 UTC 2025","passed","Tue Jul 29 21:05:17 UTC 2025","","More Options Menu - Online User - Permissions disabled: Export permissions disabled","",""
"","8297","should disable a language and enable another","","Tue Jul 29 20:56:39 UTC 2025","passed","Tue Jul 29 20:56:47 UTC 2025","","Enabling/disabling languages","",""
"","3969","should show french policy on secondary login","","Tue Jul 29 21:10:54 UTC 2025","passed","Tue Jul 29 21:10:58 UTC 2025","","Privacy policy: for an offline user","",""
"","515","should hide the kebab menu when the xml report is opened.","","Tue Jul 29 21:04:43 UTC 2025","passed","Tue Jul 29 21:04:44 UTC 2025","","More Options Menu - Offline User - Edit permissions disabled: Report tab","",""
"","3170","TestCase for The password is too easy to guess.","","Tue Jul 29 21:07:32 UTC 2025","passed","Tue Jul 29 21:07:35 UTC 2025","","User Test Cases ->: Invalid entries -> ","",""
"","1411","should try to sign in and verify that credentials were incorrect","","Tue Jul 29 20:55:30 UTC 2025","passed","Tue Jul 29 20:55:31 UTC 2025","","Login page functionality tests: Log in","",""
"","5351","should log in the sso user","","Tue Jul 29 20:56:15 UTC 2025","passed","Tue Jul 29 20:56:20 UTC 2025","","SSO Login","",""
"","978","should change locale to Spanish","","Tue Jul 29 20:55:05 UTC 2025","passed","Tue Jul 29 20:55:06 UTC 2025","","Login page functionality tests: Locale","",""
"","1323","should show if the user policy changes","","Tue Jul 29 21:11:20 UTC 2025","passed","Tue Jul 29 21:11:22 UTC 2025","","Privacy policy: for an online user","",""
"","3263","should display the ""session expired"" modal and redirect to login page","","Tue Jul 29 20:55:18 UTC 2025","passed","Tue Jul 29 20:55:21 UTC 2025","","Login page functionality tests: Log in","",""
"","1601","should verify password strength","","Tue Jul 29 20:55:44 UTC 2025","passed","Tue Jul 29 20:55:46 UTC 2025","","Login page functionality tests: Password Reset","",""
"","1480","SMS report shows bsAggreDate type as date field correctly","","Tue Jul 29 20:59:21 UTC 2025","passed","Tue Jul 29 20:59:22 UTC 2025","","Bikram Sambat date display","",""
"","4536","should enable the 'export' option and hide the 'edit' and 'delete' options in Contact tab when none of the contacts is opened.","","Tue Jul 29 21:06:36 UTC 2025","passed","Tue Jul 29 21:06:41 UTC 2025","","More Options Menu - Online User - Permissions enabled: Options displayed when there are messages, contacts and people created","",""
"","2260","should show in enabled language list","","Tue Jul 29 20:59:30 UTC 2025","passed","Tue Jul 29 20:59:32 UTC 2025","","Adding new language","",""
"","5604","should hide the 'export' option and enable the 'edit', 'delete' and 'review' options when the xml report is opened","","Tue Jul 29 21:00:42 UTC 2025","passed","Tue Jul 29 21:00:48 UTC 2025","","More Options Menu - Offline User: All permissions enabled: Report tab","",""
"","3220","TestCase for required","","Tue Jul 29 21:07:41 UTC 2025","passed","Tue Jul 29 21:07:45 UTC 2025","","User Test Cases ->: Invalid entries -> ","",""
"","2358","should disable the 'export' option and hide the 'edit' and 'delete' options in Report tab","","Tue Jul 29 21:06:13 UTC 2025","passed","Tue Jul 29 21:06:15 UTC 2025","","More Options Menu - Online User - Permissions enabled: Options displayed when there are no messages, contacts or people created","",""
"","1652","should verify password and confirm password mismatch","","Tue Jul 29 20:55:52 UTC 2025","passed","Tue Jul 29 20:55:54 UTC 2025","","Login page functionality tests: Password Reset","",""
"","2054","should display partners","","Tue Jul 29 21:08:18 UTC 2025","passed","Tue Jul 29 21:08:20 UTC 2025","","About page","",""
"","879","should successfully sync","","Tue Jul 29 21:10:30 UTC 2025","passed","Tue Jul 29 21:10:31 UTC 2025","","Old Navigation","",""
"","430","should open Contacts or Peoples tab","","Tue Jul 29 21:09:08 UTC 2025","passed","Tue Jul 29 21:09:08 UTC 2025","","Navigation tests: Navigation functionality","",""
"","3245","should navigate to the Messages section and open a sent message","","Tue Jul 29 21:10:22 UTC 2025","passed","Tue Jul 29 21:10:25 UTC 2025","","Old Navigation","",""
