"DESCRIPTION","DURATION IN MS","NAME","PARENT SUITE","START TIME","STATUS","STOP TIME","SUB SUITE","SUITE","TEST CLASS","TEST METHOD"
"","1200","should open Report bug","Hamburger Menu tests","Thu Oct 23 23:09:45 UTC 2025","passed","Thu Oct 23 23:09:46 UTC 2025","","","",""
"","860","should navigate to the Targets section, and open a target aggregate","Old Navigation","Thu Oct 23 23:11:19 UTC 2025","passed","Thu Oct 23 23:11:20 UTC 2025","","","",""
"","518","should hide the kebab menu when the xml report is opened.","More Options Menu - Offline User - Edit permissions disabled","Thu Oct 23 23:05:27 UTC 2025","passed","Thu Oct 23 23:05:28 UTC 2025","","Report tab","",""
"","995","should show if the user changes their language","Privacy policy","Thu Oct 23 23:11:49 UTC 2025","passed","Thu Oct 23 23:11:50 UTC 2025","","for an offline user","",""
"","437","should hide the kebab menu on the Message tab","More Options Menu - Online User - Permissions disabled","Thu Oct 23 23:06:02 UTC 2025","passed","Thu Oct 23 23:06:02 UTC 2025","","Export permissions disabled","",""
"","456","should open Analytics tab","Navigation tests","Thu Oct 23 23:09:58 UTC 2025","passed","Thu Oct 23 23:09:58 UTC 2025","","Navigation functionality","",""
"","2345","should redirect to login page when session is expired","bfcache","Thu Oct 23 23:09:33 UTC 2025","passed","Thu Oct 23 23:09:35 UTC 2025","","webapp","",""
"","816","should display plurals correctly","MessageFormat","Thu Oct 23 23:01:31 UTC 2025","passed","Thu Oct 23 23:01:31 UTC 2025","","","",""
"","2682","should enable the 'export', 'review' and 'delete' options and hide the 'edit' option in Report tab when a NON XML report is opened.","More Options Menu - Online User - Permissions enabled","Thu Oct 23 23:07:10 UTC 2025","passed","Thu Oct 23 23:07:13 UTC 2025","","Options displayed when there are messages, contacts and people created","",""
"","4357","should enable the 'export' option and hide the 'edit' and 'delete' options in Contact tab when none of the contacts is opened.","More Options Menu - Online User - Permissions enabled","Thu Oct 23 23:07:21 UTC 2025","passed","Thu Oct 23 23:07:25 UTC 2025","","Options displayed when there are messages, contacts and people created","",""
"","12962","should add new translations","Adding new language","Thu Oct 23 23:02:13 UTC 2025","passed","Thu Oct 23 23:02:26 UTC 2025","","","",""
"","4335","should show if the user policy changes","Privacy policy","Thu Oct 23 23:11:50 UTC 2025","passed","Thu Oct 23 23:11:54 UTC 2025","","for an offline user","",""
"","1205","should convert contact summary dates to bikram sambat when language is Nepali","Bikram Sambat date display","Thu Oct 23 23:01:56 UTC 2025","passed","Thu Oct 23 23:01:57 UTC 2025","","","",""
"","1407","should render user details","User Test Cases ->","Thu Oct 23 23:08:59 UTC 2025","passed","Thu Oct 23 23:09:00 UTC 2025","","Editing User ->","",""
"","3178","should open the about page","About page","Thu Oct 23 23:09:05 UTC 2025","passed","Thu Oct 23 23:09:08 UTC 2025","","","",""
"","1527","should verify current password cannot be same as new password","Login page functionality tests","Thu Oct 23 23:00:12 UTC 2025","passed","Thu Oct 23 23:00:14 UTC 2025","","Password Reset","",""
"","1184","should navigate to the Reports section and open the first report listed","Old Navigation","Thu Oct 23 23:11:17 UTC 2025","passed","Thu Oct 23 23:11:18 UTC 2025","","","",""
"","1557","should verify password strength","Login page functionality tests","Thu Oct 23 23:00:07 UTC 2025","passed","Thu Oct 23 23:00:08 UTC 2025","","Password Reset","",""
"","456","should display an error when token login is disabled","Token login","Thu Oct 23 23:00:50 UTC 2025","passed","Thu Oct 23 23:00:50 UTC 2025","","","",""
"","1352","should verify all fields are missing","Login page functionality tests","Thu Oct 23 23:00:02 UTC 2025","passed","Thu Oct 23 23:00:03 UTC 2025","","Password Reset","",""
"","81","should display tab labels, when all tabs are enabled","Navigation tests","Thu Oct 23 23:10:00 UTC 2025","passed","Thu Oct 23 23:10:00 UTC 2025","as admin","Navigation view","",""
"","722","should display an error with incorrect url","Token login","Thu Oct 23 23:00:50 UTC 2025","passed","Thu Oct 23 23:00:51 UTC 2025","","","",""
"","11485","should work with incorrect locale","Testing Incorrect locale","Thu Oct 23 23:01:11 UTC 2025","passed","Thu Oct 23 23:01:23 UTC 2025","","","",""
"","1975","should navigate back to the login page when using either back button","Privacy Policy Navigation for Unauthenticated Users","Thu Oct 23 23:11:27 UTC 2025","passed","Thu Oct 23 23:11:29 UTC 2025","","","",""
"","3681","TestCase for The password must be at least 8 characters long.","User Test Cases ->","Thu Oct 23 23:08:16 UTC 2025","passed","Thu Oct 23 23:08:20 UTC 2025","","Invalid entries -> ","",""
"","953","should change locale to Spanish","Login page functionality tests","Thu Oct 23 22:59:30 UTC 2025","passed","Thu Oct 23 22:59:31 UTC 2025","","Locale","",""
"","1024","should show if the user changes their language","Privacy policy","Thu Oct 23 23:12:09 UTC 2025","passed","Thu Oct 23 23:12:10 UTC 2025","","for an online user","",""
"","1864","should hide the 'delete' option and enable the 'edit' and 'export' options when a contact is opened","More Options Menu - Online User - Permissions disabled","Thu Oct 23 23:06:19 UTC 2025","passed","Thu Oct 23 23:06:21 UTC 2025","","Delete permissions disabled","",""
"","7647","should allow a new user to read/write from meta db","Create user meta db : ","Thu Oct 23 23:07:44 UTC 2025","passed","Thu Oct 23 23:07:51 UTC 2025","","","",""
"","1247","should show if the user policy changes","Privacy policy","Thu Oct 23 23:12:10 UTC 2025","passed","Thu Oct 23 23:12:11 UTC 2025","","for an online user","",""
"","4309","should redirect to the app page when session is valid","bfcache","Thu Oct 23 23:09:28 UTC 2025","passed","Thu Oct 23 23:09:33 UTC 2025","","login page","",""
"","2715","should show a warning before log out","Login page functionality tests","Thu Oct 23 22:59:32 UTC 2025","passed","Thu Oct 23 22:59:35 UTC 2025","","Log out","",""
"","1196","should change locale to French","Login page functionality tests","Thu Oct 23 22:59:28 UTC 2025","passed","Thu Oct 23 22:59:29 UTC 2025","","Locale","",""
"","2114","should hide the 'export' and 'edit' options and disable the 'delete' option when the offline user's place is selected","More Options Menu - Offline User","Thu Oct 23 23:03:07 UTC 2025","passed","Thu Oct 23 23:03:09 UTC 2025","Contact tab","All permissions enabled","",""
"","612","should hide the kebab menu when the sms report is opened","More Options Menu - Offline User - Delete permissions disabled","Thu Oct 23 23:04:37 UTC 2025","passed","Thu Oct 23 23:04:37 UTC 2025","","Report tab","",""
"","1888","should hide the 'export' option and enable the 'edit' and 'delete' options when a contact is opened","More Options Menu - Online User - Permissions disabled","Thu Oct 23 23:05:53 UTC 2025","passed","Thu Oct 23 23:05:55 UTC 2025","","Export permissions disabled","",""
"","3358","should hide the 'delete' option and enable the 'edit', 'export' and 'review' options when a report is opened","More Options Menu - Online User - Permissions disabled","Thu Oct 23 23:06:21 UTC 2025","passed","Thu Oct 23 23:06:24 UTC 2025","","Delete permissions disabled","",""
"","6657","enketo xpath extension function should display correct values when Nepali is selected","Bikram Sambat date display","Thu Oct 23 23:01:47 UTC 2025","passed","Thu Oct 23 23:01:54 UTC 2025","","","",""
"","4478","should add user with valid password","User Test Cases ->","Thu Oct 23 23:07:58 UTC 2025","passed","Thu Oct 23 23:08:03 UTC 2025","","Creating Users ->","",""
"","3921","should not show on subsequent login","Privacy policy","Thu Oct 23 23:11:41 UTC 2025","passed","Thu Oct 23 23:11:45 UTC 2025","","for an offline user","",""
"","3052","should display the ""session expired"" modal and redirect to login page","Login page functionality tests","Thu Oct 23 22:59:42 UTC 2025","passed","Thu Oct 23 22:59:45 UTC 2025","","Log in","",""
"","5621","should log in the sso user","SSO Login","Thu Oct 23 23:00:37 UTC 2025","passed","Thu Oct 23 23:00:42 UTC 2025","","","",""
"","2700","should log the user in when token is correct","Token login","Thu Oct 23 23:00:55 UTC 2025","passed","Thu Oct 23 23:00:58 UTC 2025","","","",""
"","583","should hide the kebab menu when the sms report is opened.","More Options Menu - Offline User - Edit permissions disabled","Thu Oct 23 23:05:27 UTC 2025","passed","Thu Oct 23 23:05:27 UTC 2025","","Report tab","",""
"","2370","should log in using username and password fields","Login page functionality tests","Thu Oct 23 22:59:36 UTC 2025","passed","Thu Oct 23 22:59:38 UTC 2025","","Log in","",""
"","765","should redirect to login when not logged in","Acessing the admin app","Thu Oct 23 22:59:09 UTC 2025","passed","Thu Oct 23 22:59:10 UTC 2025","","","",""
"","2376","should not fail due to document conflict for new offline user","Privacy policy","Thu Oct 23 23:12:18 UTC 2025","passed","Thu Oct 23 23:12:20 UTC 2025","","conflicts","",""
"","821","should have a title","Login page functionality tests","Thu Oct 23 22:59:46 UTC 2025","passed","Thu Oct 23 22:59:47 UTC 2025","","Log in","",""
"","3624","should reset password successfully and redirect to webapp","Login page functionality tests","Thu Oct 23 23:00:17 UTC 2025","passed","Thu Oct 23 23:00:21 UTC 2025","","Password Reset","",""
"","3310","TestCase for required","User Test Cases ->","Thu Oct 23 23:08:30 UTC 2025","passed","Thu Oct 23 23:08:34 UTC 2025","","Invalid entries -> ","",""
"","3396","should quit training in modal, and be able to complete it later in the Training Material page, verify completed trainings display in the list","Training Materials Page","Thu Oct 23 23:09:20 UTC 2025","passed","Thu Oct 23 23:09:23 UTC 2025","","","",""
"","6399","should hide the 'export' and 'edit' options and enable the 'delete' and 'review' options when the sms report is opened","More Options Menu - Offline User","Thu Oct 23 23:03:10 UTC 2025","passed","Thu Oct 23 23:03:16 UTC 2025","Report tab","All permissions enabled","",""
"","3381","should not show on subsequent login","Privacy policy","Thu Oct 23 23:12:02 UTC 2025","passed","Thu Oct 23 23:12:05 UTC 2025","","for an online user","",""
"","435","should open About","Hamburger Menu tests","Thu Oct 23 23:09:43 UTC 2025","passed","Thu Oct 23 23:09:43 UTC 2025","","","",""
"","1695","SMS report shows bsAggreDate type as date field correctly","Bikram Sambat date display","Thu Oct 23 23:01:59 UTC 2025","passed","Thu Oct 23 23:02:00 UTC 2025","","","",""
"","2353","should show the correct privacy policy on login","Privacy policy","Thu Oct 23 23:11:38 UTC 2025","passed","Thu Oct 23 23:11:40 UTC 2025","","for an offline user","",""
"","8134","should enable the 'edit' and 'review' option and hide the 'export' and 'delete' options when the xml report is opened","More Options Menu - Offline User - Delete permissions disabled","Thu Oct 23 23:04:37 UTC 2025","passed","Thu Oct 23 23:04:45 UTC 2025","","Report tab","",""
"","684","should open Reports or History tab","Navigation tests","Thu Oct 23 23:09:57 UTC 2025","passed","Thu Oct 23 23:09:57 UTC 2025","","Navigation functionality","",""
"","150","should show locale selector on login page","Login page functionality tests","Thu Oct 23 22:59:27 UTC 2025","passed","Thu Oct 23 22:59:27 UTC 2025","","Locale","",""
"","1031","should open Configuration app","Hamburger Menu tests","Thu Oct 23 23:09:48 UTC 2025","passed","Thu Oct 23 23:09:49 UTC 2025","","","",""
"","628","should open User settings","Hamburger Menu tests","Thu Oct 23 23:09:44 UTC 2025","passed","Thu Oct 23 23:09:45 UTC 2025","","","",""
"","3497","TestCase for The password is too easy to guess.","User Test Cases ->","Thu Oct 23 23:08:20 UTC 2025","passed","Thu Oct 23 23:08:23 UTC 2025","","Invalid entries -> ","",""
"","3969","should redirect the user to the app if already logged in","Token login","Thu Oct 23 23:00:45 UTC 2025","passed","Thu Oct 23 23:00:49 UTC 2025","","","",""
"","3480","TestCase for Passwords must match","User Test Cases ->","Thu Oct 23 23:08:23 UTC 2025","passed","Thu Oct 23 23:08:27 UTC 2025","","Invalid entries -> ","",""
"","1297","should try to sign in and verify that credentials were incorrect","Login page functionality tests","Thu Oct 23 22:59:52 UTC 2025","passed","Thu Oct 23 22:59:54 UTC 2025","","Log in","",""
"","4445","should require user to have permission for multiple places","User Test Cases ->","Thu Oct 23 23:08:39 UTC 2025","passed","Thu Oct 23 23:08:43 UTC 2025","","Invalid entries -> ","",""
"","431","should open tasks tab","Navigation tests","Thu Oct 23 23:09:56 UTC 2025","passed","Thu Oct 23 23:09:57 UTC 2025","","Navigation functionality","",""
"","2227","should display partners","About page","Thu Oct 23 23:09:08 UTC 2025","passed","Thu Oct 23 23:09:10 UTC 2025","","","",""
"","1525","should verify current password is not correct","Login page functionality tests","Thu Oct 23 23:00:10 UTC 2025","passed","Thu Oct 23 23:00:11 UTC 2025","","Password Reset","",""
"","2074","should hide the 'export' and 'edit' options and disable the 'delete' option when no contact is opened","More Options Menu - Offline User","Thu Oct 23 23:03:00 UTC 2025","passed","Thu Oct 23 23:03:02 UTC 2025","Contact tab","All permissions enabled","",""
"","1092","should try to sign in with blank password and verify that credentials were incorrect","Login page functionality tests","Thu Oct 23 22:59:48 UTC 2025","passed","Thu Oct 23 22:59:49 UTC 2025","","Log in","",""
"","1963","should display report list dates converted to bikram sambat","Bikram Sambat date display","Thu Oct 23 23:01:54 UTC 2025","passed","Thu Oct 23 23:01:56 UTC 2025","","","",""
"","3368","should show french policy on secondary login","Privacy policy","Thu Oct 23 23:12:05 UTC 2025","passed","Thu Oct 23 23:12:09 UTC 2025","","for an online user","",""
"","23867","should support deleting translations","Adding new language","Thu Oct 23 23:02:26 UTC 2025","passed","Thu Oct 23 23:02:49 UTC 2025","","","",""
"","4655","should hide the kebab menu in Messages, People and Reports tabs","More Options Menu - Offline User","Thu Oct 23 23:03:36 UTC 2025","passed","Thu Oct 23 23:03:40 UTC 2025","","All permissions disabled","",""
"","2333","should hide the 'export' option and enable the 'edit' and 'delete' options when a contact is opened","More Options Menu - Offline User","Thu Oct 23 23:03:03 UTC 2025","passed","Thu Oct 23 23:03:05 UTC 2025","Contact tab","All permissions enabled","",""
"","2397","should revisit completed trainings and load uncompleted trainings","Training Materials Page","Thu Oct 23 23:09:23 UTC 2025","passed","Thu Oct 23 23:09:25 UTC 2025","","","",""
"","17584","should enable the 'edit' option and hide the 'export' and 'delete' options when a contact is opened","More Options Menu - Offline User - Delete permissions disabled","Thu Oct 23 23:04:19 UTC 2025","passed","Thu Oct 23 23:04:37 UTC 2025","","Contact Tab","",""
"","1505","should verify password and confirm password mismatch","Login page functionality tests","Thu Oct 23 23:00:15 UTC 2025","passed","Thu Oct 23 23:00:16 UTC 2025","","Password Reset","",""
"","4269","should add sso user","User Test Cases ->","Thu Oct 23 23:08:12 UTC 2025","passed","Thu Oct 23 23:08:16 UTC 2025","","Creating Users ->","",""
"","4560","enketo xpath extension function should display correct values when Nepali is not selected","Bikram Sambat date display","Thu Oct 23 23:01:43 UTC 2025","passed","Thu Oct 23 23:01:47 UTC 2025","","","",""
"","722","should display an error when accessing with random strings","Token login","Thu Oct 23 23:00:52 UTC 2025","passed","Thu Oct 23 23:00:52 UTC 2025","","","",""
"","2533","should hide the 'edit', 'delete' and 'review' options and enable the 'export' option when a report is opened","More Options Menu - Online User - Permissions disabled","Thu Oct 23 23:06:43 UTC 2025","passed","Thu Oct 23 23:06:45 UTC 2025","","Edit permissions disabled","",""
"","180","should display tab labels, when some tabs are enabled","Navigation tests","Thu Oct 23 23:10:45 UTC 2025","passed","Thu Oct 23 23:10:45 UTC 2025","as chw","Navigation view","",""
"","4286","should hide and reveal password value, and add user with a revealed password","User Test Cases ->","Thu Oct 23 23:08:08 UTC 2025","passed","Thu Oct 23 23:08:12 UTC 2025","","Creating Users ->","",""
"","453","should open Contacts or Peoples tab","Navigation tests","Thu Oct 23 23:09:57 UTC 2025","passed","Thu Oct 23 23:09:58 UTC 2025","","Navigation functionality","",""
"","1296","should navigate to the People section and open the created Health Center","Old Navigation","Thu Oct 23 23:11:18 UTC 2025","passed","Thu Oct 23 23:11:19 UTC 2025","","","",""
"","194","should display when navigating to the privacy policy page","Privacy policy","Thu Oct 23 23:11:41 UTC 2025","passed","Thu Oct 23 23:11:41 UTC 2025","","for an offline user","",""
"","16217","should hide the kebab menu.","More Options Menu - Offline User - Edit permissions disabled","Thu Oct 23 23:05:11 UTC 2025","passed","Thu Oct 23 23:05:27 UTC 2025","","Contact tab","",""
"","1445","should disable the 'export' option and hide the 'edit' and 'delete' options in Contact tab","More Options Menu - Online User - Permissions enabled","Thu Oct 23 23:06:54 UTC 2025","passed","Thu Oct 23 23:06:56 UTC 2025","","Options displayed when there are no messages, contacts or people created","",""
"","1161","should not display privacy policy page when the privacy policy is not enabled","Privacy Policy Navigation for Unauthenticated Users","Thu Oct 23 23:11:26 UTC 2025","passed","Thu Oct 23 23:11:27 UTC 2025","","","",""
"","279","should show the correct privacy policy on login","Privacy policy","Thu Oct 23 23:12:01 UTC 2025","passed","Thu Oct 23 23:12:01 UTC 2025","","for an online user","",""
"","1022","should successfully sync","Old Navigation","Thu Oct 23 23:11:20 UTC 2025","passed","Thu Oct 23 23:11:21 UTC 2025","","","",""
"","4129","should show an upload summary with a successful upload and a failed upload","Bulk User Creation ->","Thu Oct 23 23:07:34 UTC 2025","passed","Thu Oct 23 23:07:38 UTC 2025","","","",""
"","1290","should disable the 'export' option in Message tab","More Options Menu - Online User - Permissions enabled","Thu Oct 23 23:06:52 UTC 2025","passed","Thu Oct 23 23:06:53 UTC 2025","","Options displayed when there are no messages, contacts or people created","",""
"","7527","should disable a language and enable another","Enabling/disabling languages","Thu Oct 23 23:01:01 UTC 2025","passed","Thu Oct 23 23:01:09 UTC 2025","","","",""
"","2195","should redirect to login page when session is expired","bfcache","Thu Oct 23 23:09:36 UTC 2025","passed","Thu Oct 23 23:09:38 UTC 2025","","admin app","",""
"","1155","should try to sign in with blank auth and verify that credentials were incorrect","Login page functionality tests","Thu Oct 23 22:59:50 UTC 2025","passed","Thu Oct 23 22:59:51 UTC 2025","","Log in","",""
"","3160","should navigate to the Messages section and open a sent message","Old Navigation","Thu Oct 23 23:11:12 UTC 2025","passed","Thu Oct 23 23:11:15 UTC 2025","","","",""
"","530","should not show on refresh","Privacy policy","Thu Oct 23 23:11:40 UTC 2025","passed","Thu Oct 23 23:11:41 UTC 2025","","for an offline user","",""
"","771","should not show on refresh","Privacy policy","Thu Oct 23 23:12:01 UTC 2025","passed","Thu Oct 23 23:12:02 UTC 2025","","for an online user","",""
"","1491","should require place and contact for restricted user","User Test Cases ->","Thu Oct 23 23:08:37 UTC 2025","passed","Thu Oct 23 23:08:39 UTC 2025","","Invalid entries -> ","",""
"","2343","should set correct cookies","Login page functionality tests","Thu Oct 23 22:59:39 UTC 2025","passed","Thu Oct 23 22:59:41 UTC 2025","","Log in","",""
"","1037","should work with botched translations","MessageFormat","Thu Oct 23 23:01:31 UTC 2025","passed","Thu Oct 23 23:01:32 UTC 2025","","","",""
"","1497","should display an error when token is expired","Token login","Thu Oct 23 23:00:53 UTC 2025","passed","Thu Oct 23 23:00:54 UTC 2025","","","",""
"","9012","Refresh page multiple times and verify token gets renewed","should renew token","Thu Oct 23 23:00:25 UTC 2025","passed","Thu Oct 23 23:00:34 UTC 2025","","","",""
"","3335","should require username","User Test Cases ->","Thu Oct 23 23:08:34 UTC 2025","passed","Thu Oct 23 23:08:37 UTC 2025","","Invalid entries -> ","",""
"","1669","should hide the 'edit' and 'delete' options and enable the 'export' option when a contact is opened","More Options Menu - Online User - Permissions disabled","Thu Oct 23 23:06:41 UTC 2025","passed","Thu Oct 23 23:06:43 UTC 2025","","Edit permissions disabled","",""
"","4948","should show access error when accessing as an offline user","Acessing the admin app","Thu Oct 23 22:59:11 UTC 2025","passed","Thu Oct 23 22:59:16 UTC 2025","","","",""
"","1510","SMS report shows bsDate type as date field correctly","Bikram Sambat date display","Thu Oct 23 23:01:57 UTC 2025","passed","Thu Oct 23 23:01:59 UTC 2025","","","",""
"","943","should open Messages tab","Navigation tests","Thu Oct 23 23:09:55 UTC 2025","passed","Thu Oct 23 23:09:56 UTC 2025","","Navigation functionality","",""
"","1280","should hide the kebab menu.","More Options Menu - Offline User","Thu Oct 23 23:02:58 UTC 2025","passed","Thu Oct 23 23:02:59 UTC 2025","Message tab","All permissions enabled","",""
"","5228","should hide the 'export' option and enable the 'edit', 'delete' and 'review' options when the xml report is opened","More Options Menu - Offline User","Thu Oct 23 23:03:18 UTC 2025","passed","Thu Oct 23 23:03:23 UTC 2025","Report tab","All permissions enabled","",""
"","2938","should hide and reveal password value, and login with a revealed password","Login page functionality tests","Thu Oct 23 22:59:55 UTC 2025","passed","Thu Oct 23 22:59:58 UTC 2025","","Log in","",""
"","2309","should disable the 'export' option and hide the 'edit' and 'delete' options in Report tab","More Options Menu - Online User - Permissions enabled","Thu Oct 23 23:06:58 UTC 2025","passed","Thu Oct 23 23:07:00 UTC 2025","","Options displayed when there are no messages, contacts or people created","",""
"","2237","should navigate to the Task section and open the first task listed","Old Navigation","Thu Oct 23 23:11:15 UTC 2025","passed","Thu Oct 23 23:11:17 UTC 2025","","","",""
"","1084","should not create feedback docs when loading missing reports or people","Navigation tests","Thu Oct 23 23:10:45 UTC 2025","passed","Thu Oct 23 23:10:46 UTC 2025","as chw","Navigation view","",""
"","1593","should verify confirm password is missing","Login page functionality tests","Thu Oct 23 23:00:04 UTC 2025","passed","Thu Oct 23 23:00:06 UTC 2025","","Password Reset","",""
"","6409","should hide the 'export' option and enable the 'edit', 'delete' and 'review' options when a report is opened","More Options Menu - Online User - Permissions disabled","Thu Oct 23 23:05:55 UTC 2025","passed","Thu Oct 23 23:06:02 UTC 2025","","Export permissions disabled","",""
"","1972","should show in enabled language list","Adding new language","Thu Oct 23 23:02:08 UTC 2025","passed","Thu Oct 23 23:02:10 UTC 2025","","","",""
"","2530","should be set as Default language ","Adding new language","Thu Oct 23 23:02:10 UTC 2025","passed","Thu Oct 23 23:02:13 UTC 2025","","","",""
"","1512","should enable the 'export', 'edit' and 'delete' options in Contact tab when a contact is opened.","More Options Menu - Online User - Permissions enabled","Thu Oct 23 23:07:18 UTC 2025","passed","Thu Oct 23 23:07:19 UTC 2025","","Options displayed when there are messages, contacts and people created","",""
"","3901","should show french policy on secondary login","Privacy policy","Thu Oct 23 23:11:45 UTC 2025","passed","Thu Oct 23 23:11:49 UTC 2025","","for an offline user","",""
"","5146","should add user with multiple places with permission","User Test Cases ->","Thu Oct 23 23:08:03 UTC 2025","passed","Thu Oct 23 23:08:08 UTC 2025","","Creating Users ->","",""
"","1908","should enable the 'export' option in Message tab.","More Options Menu - Online User - Permissions enabled","Thu Oct 23 23:07:07 UTC 2025","passed","Thu Oct 23 23:07:09 UTC 2025","","Options displayed when there are messages, contacts and people created","",""
"","4220","should allow admins to access the page","Acessing the admin app","Thu Oct 23 22:59:17 UTC 2025","passed","Thu Oct 23 22:59:21 UTC 2025","","","",""
"","197","should display when navigating to the privacy policy page","Privacy policy","Thu Oct 23 23:12:02 UTC 2025","passed","Thu Oct 23 23:12:02 UTC 2025","","for an online user","",""
"","2211","should enable the 'export', 'review', 'edit' and 'delete' options in Report tab when a XML report is opened.","More Options Menu - Online User - Permissions enabled","Thu Oct 23 23:07:14 UTC 2025","passed","Thu Oct 23 23:07:16 UTC 2025","","Options displayed when there are messages, contacts and people created","",""
