"DESCRIPTION","DURATION IN MS","NAME","PARENT SUITE","START TIME","STATUS","STOP TIME","SUB SUITE","SUITE","TEST CLASS","TEST METHOD"
"","3647","should enable the 'edit' and 'review' option and hide the 'export' and 'delete' options when the xml report is opened","","Fri May 09 09:16:23 UTC 2025","passed","Fri May 09 09:16:27 UTC 2025","","More Options Menu - Offline User - Delete permissions disabled: Report tab","",""
"","2588","should hide and reveal password value, and login with a revealed password","","Fri May 09 09:12:22 UTC 2025","passed","Fri May 09 09:12:24 UTC 2025","","Login page functionality tests: Log in","",""
"","365","should navigate to the Targets section, and open a target aggregate","","Fri May 09 09:21:45 UTC 2025","passed","Fri May 09 09:21:45 UTC 2025","","Old Navigation","",""
"","2299","should redirect to login page when session is expired","","Fri May 09 09:19:58 UTC 2025","passed","Fri May 09 09:20:00 UTC 2025","","bfcache: webapp","",""
"","2524","should hide the 'export' option and enable the 'edit' and 'delete' options when a contact is opened","","Fri May 09 09:15:19 UTC 2025","passed","Fri May 09 09:15:21 UTC 2025","","More Options Menu - Offline User: All permissions enabled: Contact tab","",""
"","584","should hide the kebab menu when the sms report is opened","","Fri May 09 09:16:23 UTC 2025","passed","Fri May 09 09:16:23 UTC 2025","","More Options Menu - Offline User - Delete permissions disabled: Report tab","",""
"","2921","should show in enabled language list","","Fri May 09 09:14:17 UTC 2025","passed","Fri May 09 09:14:20 UTC 2025","","Adding new language","",""
"","2021","should navigate to the People section and open the created Health Center","","Fri May 09 09:21:43 UTC 2025","passed","Fri May 09 09:21:45 UTC 2025","","Old Navigation","",""
"","198","should open Contacts or Peoples tab","","Fri May 09 09:20:27 UTC 2025","passed","Fri May 09 09:20:27 UTC 2025","","Navigation tests: Navigation functionality","",""
"","2200","should open User settings","","Fri May 09 09:20:10 UTC 2025","passed","Fri May 09 09:20:12 UTC 2025","","Hamburger Menu tests","",""
"","2955","should open Configuration app","","Fri May 09 09:20:17 UTC 2025","passed","Fri May 09 09:20:20 UTC 2025","","Hamburger Menu tests","",""
"","1933","should enable the 'export', 'edit' and 'delete' options in Contact tab when a contact is opened.","","Fri May 09 09:17:51 UTC 2025","passed","Fri May 09 09:17:53 UTC 2025","","More Options Menu - Online User - Permissions enabled: Options displayed when there are messages, contacts and people created","",""
"","4286","should require username","","Fri May 09 09:18:47 UTC 2025","passed","Fri May 09 09:18:51 UTC 2025","","User Test Cases ->: Invalid entries -> ","",""
"","3181","should show a warning before log out","","Fri May 09 09:11:59 UTC 2025","passed","Fri May 09 09:12:02 UTC 2025","","Login page functionality tests: Log out","",""
"","1225","should convert contact summary dates to bikram sambat when language is Nepali","","Fri May 09 09:14:06 UTC 2025","passed","Fri May 09 09:14:07 UTC 2025","","Bikram Sambat date display","",""
"","826","should not show on refresh","","Fri May 09 09:22:26 UTC 2025","passed","Fri May 09 09:22:27 UTC 2025","","Privacy policy: for an online user","",""
"","2661","should display the ""session expired"" modal and redirect to login page","","Fri May 09 09:12:10 UTC 2025","passed","Fri May 09 09:12:12 UTC 2025","","Login page functionality tests: Log in","",""
"","1838","should navigate back to the login page when using either back button","","Fri May 09 09:21:51 UTC 2025","passed","Fri May 09 09:21:53 UTC 2025","","Privacy Policy Navigation for Unauthenticated Users","",""
"","3715","should reset password successfully and redirect to webapp","","Fri May 09 09:12:43 UTC 2025","passed","Fri May 09 09:12:47 UTC 2025","","Login page functionality tests: Password Reset","",""
"","1865","should require place and contact for restricted user","","Fri May 09 09:18:51 UTC 2025","passed","Fri May 09 09:18:53 UTC 2025","","User Test Cases ->: Invalid entries -> ","",""
"","1281","should show the correct privacy policy on login","","Fri May 09 09:22:25 UTC 2025","passed","Fri May 09 09:22:26 UTC 2025","","Privacy policy: for an online user","",""
"","5979","should add user with multiple places with permission","","Fri May 09 09:18:14 UTC 2025","passed","Fri May 09 09:18:20 UTC 2025","","User Test Cases ->: Creating Users ->","",""
"","1459","SMS report shows bsAggreDate type as date field correctly","","Fri May 09 09:14:09 UTC 2025","passed","Fri May 09 09:14:11 UTC 2025","","Bikram Sambat date display","",""
"","309","should display an error when token login is disabled","","Fri May 09 09:13:06 UTC 2025","passed","Fri May 09 09:13:06 UTC 2025","","Token login","",""
"","4461","should show if the user policy changes","","Fri May 09 09:22:15 UTC 2025","passed","Fri May 09 09:22:19 UTC 2025","","Privacy policy: for an offline user","",""
"","2155","should display partners","","Fri May 09 09:19:30 UTC 2025","passed","Fri May 09 09:19:32 UTC 2025","","About page","",""
"","525","should display an error when accessing with random strings","","Fri May 09 09:13:07 UTC 2025","passed","Fri May 09 09:13:08 UTC 2025","","Token login","",""
"","5483","should require user to have permission for multiple places","","Fri May 09 09:18:53 UTC 2025","passed","Fri May 09 09:18:58 UTC 2025","","User Test Cases ->: Invalid entries -> ","",""
"","512","should hide the kebab menu when the xml report is opened.","","Fri May 09 09:16:48 UTC 2025","passed","Fri May 09 09:16:49 UTC 2025","","More Options Menu - Offline User - Edit permissions disabled: Report tab","",""
"","1722","SMS report shows bsDate type as date field correctly","","Fri May 09 09:14:07 UTC 2025","passed","Fri May 09 09:14:09 UTC 2025","","Bikram Sambat date display","",""
"","10616","should work with incorrect locale","","Fri May 09 09:13:27 UTC 2025","passed","Fri May 09 09:13:38 UTC 2025","","Testing Incorrect locale","",""
"","200","should open Analytics tab","","Fri May 09 09:20:27 UTC 2025","passed","Fri May 09 09:20:28 UTC 2025","","Navigation tests: Navigation functionality","",""
"","4651","should show the correct privacy policy on login","","Fri May 09 09:22:00 UTC 2025","passed","Fri May 09 09:22:05 UTC 2025","","Privacy policy: for an offline user","",""
"","4289","should hide the 'export' option and enable the 'edit', 'delete' and 'review' options when a report is opened","","Fri May 09 09:17:01 UTC 2025","passed","Fri May 09 09:17:05 UTC 2025","","More Options Menu - Online User - Permissions disabled: Export permissions disabled","",""
"","2583","should hide the 'export' and 'edit' options and disable the 'delete' option when the offline user's place is selected","","Fri May 09 09:15:22 UTC 2025","passed","Fri May 09 09:15:25 UTC 2025","","More Options Menu - Offline User: All permissions enabled: Contact tab","",""
"","1732","should hide the 'edit' and 'delete' options and enable the 'export' option when a contact is opened","","Fri May 09 09:17:14 UTC 2025","passed","Fri May 09 09:17:16 UTC 2025","","More Options Menu - Online User - Permissions disabled: Edit permissions disabled","",""
"","1388","should display report list dates converted to bikram sambat","","Fri May 09 09:14:05 UTC 2025","passed","Fri May 09 09:14:06 UTC 2025","","Bikram Sambat date display","",""
"","2919","should hide the 'delete' option and enable the 'edit', 'export' and 'review' options when a report is opened","","Fri May 09 09:17:09 UTC 2025","passed","Fri May 09 09:17:12 UTC 2025","","More Options Menu - Online User - Permissions disabled: Delete permissions disabled","",""
"","2737","should hide the 'edit', 'delete' and 'review' options and enable the 'export' option when a report is opened","","Fri May 09 09:17:16 UTC 2025","passed","Fri May 09 09:17:19 UTC 2025","","More Options Menu - Online User - Permissions disabled: Edit permissions disabled","",""
"","1046","should work with botched translations","","Fri May 09 09:13:46 UTC 2025","passed","Fri May 09 09:13:47 UTC 2025","","MessageFormat","",""
"","1412","should successfully sync","","Fri May 09 09:21:45 UTC 2025","passed","Fri May 09 09:21:46 UTC 2025","","Old Navigation","",""
"","184","should display when navigating to the privacy policy page","","Fri May 09 09:22:06 UTC 2025","passed","Fri May 09 09:22:06 UTC 2025","","Privacy policy: for an offline user","",""
"","2406","should log the user in when token is correct","","Fri May 09 09:13:10 UTC 2025","passed","Fri May 09 09:13:13 UTC 2025","","Token login","",""
"","2859","should enable the 'export', 'review', 'edit' and 'delete' options in Report tab when a XML report is opened.","","Fri May 09 09:17:47 UTC 2025","passed","Fri May 09 09:17:50 UTC 2025","","More Options Menu - Online User - Permissions enabled: Options displayed when there are messages, contacts and people created","",""
"","2067","should hide the 'export' option and enable the 'edit' and 'delete' options when a contact is opened","","Fri May 09 09:16:59 UTC 2025","passed","Fri May 09 09:17:01 UTC 2025","","More Options Menu - Online User - Permissions disabled: Export permissions disabled","",""
"","3843","should not show on subsequent login","","Fri May 09 09:22:06 UTC 2025","passed","Fri May 09 09:22:10 UTC 2025","","Privacy policy: for an offline user","",""
"","5670","should add user with valid password","","Fri May 09 09:18:08 UTC 2025","passed","Fri May 09 09:18:14 UTC 2025","","User Test Cases ->: Creating Users ->","",""
"","1654","should enable the 'export' option in Message tab.","","Fri May 09 09:17:40 UTC 2025","passed","Fri May 09 09:17:41 UTC 2025","","More Options Menu - Online User - Permissions enabled: Options displayed when there are messages, contacts and people created","",""
"","2361","should hide the 'export' and 'edit' options and disable the 'delete' option when no contact is opened","","Fri May 09 09:15:15 UTC 2025","passed","Fri May 09 09:15:18 UTC 2025","","More Options Menu - Offline User: All permissions enabled: Contact tab","",""
"","3379","should show french policy on secondary login","","Fri May 09 09:22:31 UTC 2025","passed","Fri May 09 09:22:34 UTC 2025","","Privacy policy: for an online user","",""
"","583","should display when navigating to the privacy policy page","","Fri May 09 09:22:27 UTC 2025","passed","Fri May 09 09:22:28 UTC 2025","","Privacy policy: for an online user","",""
"","3623","should redirect to the app page when session is valid","","Fri May 09 09:19:54 UTC 2025","passed","Fri May 09 09:19:58 UTC 2025","","bfcache: login page","",""
"","3880","should navigate to the Messages section and open a sent message","","Fri May 09 09:21:36 UTC 2025","passed","Fri May 09 09:21:40 UTC 2025","","Old Navigation","",""
"","145","should open tasks tab","","Fri May 09 09:20:27 UTC 2025","passed","Fri May 09 09:20:27 UTC 2025","","Navigation tests: Navigation functionality","",""
"","3159","should be set as Default language ","","Fri May 09 09:14:20 UTC 2025","passed","Fri May 09 09:14:23 UTC 2025","","Adding new language","",""
"","8462","should support deleting translations","","Fri May 09 09:14:56 UTC 2025","passed","Fri May 09 09:15:04 UTC 2025","","Adding new language","",""
"","4935","should hide the 'export' and 'edit' options and enable the 'delete' and 'review' options when the sms report is opened","","Fri May 09 09:15:26 UTC 2025","passed","Fri May 09 09:15:31 UTC 2025","","More Options Menu - Offline User: All permissions enabled: Report tab","",""
"","1355","should show if the user policy changes","","Fri May 09 09:22:35 UTC 2025","passed","Fri May 09 09:22:37 UTC 2025","","Privacy policy: for an online user","",""
"","520","should hide the kebab menu when the sms report is opened.","","Fri May 09 09:16:48 UTC 2025","passed","Fri May 09 09:16:48 UTC 2025","","More Options Menu - Offline User - Edit permissions disabled: Report tab","",""
"","1044","should change locale to French","","Fri May 09 09:11:54 UTC 2025","passed","Fri May 09 09:11:56 UTC 2025","","Login page functionality tests: Locale","",""
"","3247","should hide the 'export' option and enable the 'edit', 'delete' and 'review' options when the xml report is opened","","Fri May 09 09:15:32 UTC 2025","passed","Fri May 09 09:15:35 UTC 2025","","More Options Menu - Offline User: All permissions enabled: Report tab","",""
"","4353","TestCase for The password is too easy to guess.","","Fri May 09 09:18:29 UTC 2025","passed","Fri May 09 09:18:34 UTC 2025","","User Test Cases ->: Invalid entries -> ","",""
"","5730","should revisit completed trainings and load uncompleted trainings","","Fri May 09 09:19:45 UTC 2025","passed","Fri May 09 09:19:51 UTC 2025","","Training Materials Page","",""
"","1629","should open About","","Fri May 09 09:20:08 UTC 2025","passed","Fri May 09 09:20:09 UTC 2025","","Hamburger Menu tests","",""
"","1337","should display an error when token is expired","","Fri May 09 09:13:08 UTC 2025","passed","Fri May 09 09:13:10 UTC 2025","","Token login","",""
"","1087","should show if the user changes their language","","Fri May 09 09:22:14 UTC 2025","passed","Fri May 09 09:22:15 UTC 2025","","Privacy policy: for an offline user","",""
"","3368","should not show on subsequent login","","Fri May 09 09:22:28 UTC 2025","passed","Fri May 09 09:22:31 UTC 2025","","Privacy policy: for an online user","",""
"","1495","should verify password and confirm password mismatch","","Fri May 09 09:12:41 UTC 2025","passed","Fri May 09 09:12:42 UTC 2025","","Login page functionality tests: Password Reset","",""
"","1190","should try to sign in and verify that credentials were incorrect","","Fri May 09 09:12:19 UTC 2025","passed","Fri May 09 09:12:20 UTC 2025","","Login page functionality tests: Log in","",""
"","5164","should show access error when accessing as an offline user","","Fri May 09 09:11:37 UTC 2025","passed","Fri May 09 09:11:43 UTC 2025","","Acessing the admin app","",""
"","4332","enketo xpath extension function should display correct values when Nepali is selected","","Fri May 09 09:14:01 UTC 2025","passed","Fri May 09 09:14:05 UTC 2025","","Bikram Sambat date display","",""
"","2234","should disable the 'export' option and hide the 'edit' and 'delete' options in Report tab","","Fri May 09 09:17:30 UTC 2025","passed","Fri May 09 09:17:32 UTC 2025","","More Options Menu - Online User - Permissions enabled: Options displayed when there are no messages, contacts or people created","",""
"","1092","should try to sign in with blank password and verify that credentials were incorrect","","Fri May 09 09:12:15 UTC 2025","passed","Fri May 09 09:12:16 UTC 2025","","Login page functionality tests: Log in","",""
"","8488","Refresh page multiple times and verify token gets renewed","","Fri May 09 09:12:51 UTC 2025","passed","Fri May 09 09:13:00 UTC 2025","","should renew token","",""
"","3928","should show french policy on secondary login","","Fri May 09 09:22:10 UTC 2025","passed","Fri May 09 09:22:14 UTC 2025","","Privacy policy: for an offline user","",""
"","1165","should display plurals correctly","","Fri May 09 09:13:44 UTC 2025","passed","Fri May 09 09:13:46 UTC 2025","","MessageFormat","",""
"","5458","should show an upload summary with a successful upload and a failed upload","","Fri May 09 09:19:04 UTC 2025","passed","Fri May 09 09:19:10 UTC 2025","","Bulk User Creation ->","",""
"","1043","should change locale to Spanish","","Fri May 09 09:11:57 UTC 2025","passed","Fri May 09 09:11:58 UTC 2025","","Login page functionality tests: Locale","",""
"","4676","should not fail due to document conflict for new offline user","","Fri May 09 09:22:42 UTC 2025","passed","Fri May 09 09:22:47 UTC 2025","","Privacy policy: conflicts","",""
"","3456","enketo xpath extension function should display correct values when Nepali is not selected","","Fri May 09 09:13:57 UTC 2025","passed","Fri May 09 09:14:01 UTC 2025","","Bikram Sambat date display","",""
"","76","should display tab labels, when all tabs are enabled","","Fri May 09 09:20:29 UTC 2025","passed","Fri May 09 09:20:30 UTC 2025","","Navigation tests: Navigation view: as admin","",""
"","1133","should try to sign in with blank auth and verify that credentials were incorrect","","Fri May 09 09:12:17 UTC 2025","passed","Fri May 09 09:12:18 UTC 2025","","Login page functionality tests: Log in","",""
"","852","should have a title","","Fri May 09 09:12:13 UTC 2025","passed","Fri May 09 09:12:14 UTC 2025","","Login page functionality tests: Log in","",""
"","139","should show locale selector on login page","","Fri May 09 09:11:53 UTC 2025","passed","Fri May 09 09:11:53 UTC 2025","","Login page functionality tests: Locale","",""
"","2604","should open the about page","","Fri May 09 09:19:27 UTC 2025","passed","Fri May 09 09:19:30 UTC 2025","","About page","",""
"","8374","should disable a language and enable another","","Fri May 09 09:13:16 UTC 2025","passed","Fri May 09 09:13:24 UTC 2025","","Enabling/disabling languages","",""
"","4302","TestCase for The password must be at least 8 characters long.","","Fri May 09 09:18:25 UTC 2025","passed","Fri May 09 09:18:29 UTC 2025","","User Test Cases ->: Invalid entries -> ","",""
"","5674","should hide the kebab menu in Messages, People and Reports tabs","","Fri May 09 09:15:49 UTC 2025","passed","Fri May 09 09:15:55 UTC 2025","","More Options Menu - Offline User: All permissions disabled","",""
"","1562","should verify confirm password is missing","","Fri May 09 09:12:30 UTC 2025","passed","Fri May 09 09:12:32 UTC 2025","","Login page functionality tests: Password Reset","",""
"","5698","should enable the 'export' option and hide the 'edit' and 'delete' options in Contact tab when none of the contacts is opened.","","Fri May 09 09:17:54 UTC 2025","passed","Fri May 09 09:18:00 UTC 2025","","More Options Menu - Online User - Permissions enabled: Options displayed when there are messages, contacts and people created","",""
"","1416","should navigate to the Task section and open the first task listed","","Fri May 09 09:21:40 UTC 2025","passed","Fri May 09 09:21:41 UTC 2025","","Old Navigation","",""
"","3228","should enable the 'export', 'review' and 'delete' options and hide the 'edit' option in Report tab when a NON XML report is opened.","","Fri May 09 09:17:42 UTC 2025","passed","Fri May 09 09:17:45 UTC 2025","","More Options Menu - Online User - Permissions enabled: Options displayed when there are messages, contacts and people created","",""
"","2031","should hide the 'delete' option and enable the 'edit' and 'export' options when a contact is opened","","Fri May 09 09:17:07 UTC 2025","passed","Fri May 09 09:17:09 UTC 2025","","More Options Menu - Online User - Permissions disabled: Delete permissions disabled","",""
"","4286","TestCase for Passwords must match","","Fri May 09 09:18:34 UTC 2025","passed","Fri May 09 09:18:38 UTC 2025","","User Test Cases ->: Invalid entries -> ","",""
"","1133","should open Messages tab","","Fri May 09 09:20:26 UTC 2025","passed","Fri May 09 09:20:27 UTC 2025","","Navigation tests: Navigation functionality","",""
"","1639","should verify current password is not correct","","Fri May 09 09:12:36 UTC 2025","passed","Fri May 09 09:12:37 UTC 2025","","Login page functionality tests: Password Reset","",""
"","4306","TestCase for required","","Fri May 09 09:18:42 UTC 2025","passed","Fri May 09 09:18:47 UTC 2025","","User Test Cases ->: Invalid entries -> ","",""
"","178","should display tab labels, when some tabs are enabled","","Fri May 09 09:21:14 UTC 2025","passed","Fri May 09 09:21:15 UTC 2025","","Navigation tests: Navigation view: as chw","",""
"","1432","should hide the kebab menu.","","Fri May 09 09:15:13 UTC 2025","passed","Fri May 09 09:15:15 UTC 2025","","More Options Menu - Offline User: All permissions enabled: Message tab","",""
"","363","should hide the kebab menu on the Message tab","","Fri May 09 09:17:05 UTC 2025","passed","Fri May 09 09:17:05 UTC 2025","","More Options Menu - Online User - Permissions disabled: Export permissions disabled","",""
"","363","should open Reports or History tab","","Fri May 09 09:20:27 UTC 2025","passed","Fri May 09 09:20:27 UTC 2025","","Navigation tests: Navigation functionality","",""
"","1039","should show if the user changes their language","","Fri May 09 09:22:34 UTC 2025","passed","Fri May 09 09:22:35 UTC 2025","","Privacy policy: for an online user","",""
"","3299","should open Report bug","","Fri May 09 09:20:12 UTC 2025","passed","Fri May 09 09:20:16 UTC 2025","","Hamburger Menu tests","",""
"","11226","should add new translations","","Fri May 09 09:14:44 UTC 2025","passed","Fri May 09 09:14:56 UTC 2025","","Adding new language","",""
"","1506","should disable the 'export' option in Message tab","","Fri May 09 09:17:24 UTC 2025","passed","Fri May 09 09:17:26 UTC 2025","","More Options Menu - Online User - Permissions enabled: Options displayed when there are no messages, contacts or people created","",""
"","2995","should enable the 'edit' option and hide the 'export' and 'delete' options when a contact is opened","","Fri May 09 09:16:20 UTC 2025","passed","Fri May 09 09:16:23 UTC 2025","","More Options Menu - Offline User - Delete permissions disabled: Contact Tab","",""
"","2263","should set correct cookies","","Fri May 09 09:12:06 UTC 2025","passed","Fri May 09 09:12:09 UTC 2025","","Login page functionality tests: Log in","",""
"","510","should display an error with incorrect url","","Fri May 09 09:13:06 UTC 2025","passed","Fri May 09 09:13:07 UTC 2025","","Token login","",""
"","4866","should allow admins to access the page","","Fri May 09 09:11:44 UTC 2025","passed","Fri May 09 09:11:49 UTC 2025","","Acessing the admin app","",""
"","1116","should not display privacy policy page when the privacy policy is not enabled","","Fri May 09 09:21:50 UTC 2025","passed","Fri May 09 09:21:51 UTC 2025","","Privacy Policy Navigation for Unauthenticated Users","",""
"","1266","should disable the 'export' option and hide the 'edit' and 'delete' options in Contact tab","","Fri May 09 09:17:27 UTC 2025","passed","Fri May 09 09:17:28 UTC 2025","","More Options Menu - Online User - Permissions enabled: Options displayed when there are no messages, contacts or people created","",""
"","700","should redirect to login when not logged in","","Fri May 09 09:11:36 UTC 2025","passed","Fri May 09 09:11:36 UTC 2025","","Acessing the admin app","",""
"","2398","should redirect to login page when session is expired","","Fri May 09 09:20:01 UTC 2025","passed","Fri May 09 09:20:03 UTC 2025","","bfcache: admin app","",""
"","9263","should allow a new user to read/write from meta db","","Fri May 09 09:19:15 UTC 2025","passed","Fri May 09 09:19:24 UTC 2025","","Create user meta db : ","",""
"","5330","should hide and reveal password value, and add user with a revealed password","","Fri May 09 09:18:20 UTC 2025","passed","Fri May 09 09:18:25 UTC 2025","","User Test Cases ->: Creating Users ->","",""
"","1724","should verify all fields are missing","","Fri May 09 09:12:28 UTC 2025","passed","Fri May 09 09:12:29 UTC 2025","","Login page functionality tests: Password Reset","",""
"","1533","should not create feedback docs when loading missing reports or people","","Fri May 09 09:21:15 UTC 2025","passed","Fri May 09 09:21:16 UTC 2025","","Navigation tests: Navigation view: as chw","",""
"","3411","should redirect the user to the app if already logged in","","Fri May 09 09:13:02 UTC 2025","passed","Fri May 09 09:13:05 UTC 2025","","Token login","",""
"","1521","should navigate to the Reports section and open the first report listed","","Fri May 09 09:21:41 UTC 2025","passed","Fri May 09 09:21:43 UTC 2025","","Old Navigation","",""
"","1528","should verify password strength","","Fri May 09 09:12:33 UTC 2025","passed","Fri May 09 09:12:35 UTC 2025","","Login page functionality tests: Password Reset","",""
"","4988","should quit training in modal, and be able to complete it later in the Training Material page, verify completed trainings display in the list","","Fri May 09 09:19:40 UTC 2025","passed","Fri May 09 09:19:45 UTC 2025","","Training Materials Page","",""
"","1094","should not show on refresh","","Fri May 09 09:22:05 UTC 2025","passed","Fri May 09 09:22:06 UTC 2025","","Privacy policy: for an offline user","",""
"","1530","should verify current password cannot be same as new password","","Fri May 09 09:12:38 UTC 2025","passed","Fri May 09 09:12:40 UTC 2025","","Login page functionality tests: Password Reset","",""
"","2403","should log in using username and password fields","","Fri May 09 09:12:03 UTC 2025","passed","Fri May 09 09:12:05 UTC 2025","","Login page functionality tests: Log in","",""
"","1582","should hide the kebab menu.","","Fri May 09 09:16:46 UTC 2025","passed","Fri May 09 09:16:48 UTC 2025","","More Options Menu - Offline User - Edit permissions disabled: Contact tab","",""
