"Status","Start Time","Stop Time","Duration in ms","Parent Suite","Suite","Sub Suite","Test Class","Test Method","Name","Description"
"passed","Wed Oct 09 15:04:31 UTC 2024","Wed Oct 09 15:04:32 UTC 2024","613","","Training Cards","","","","should not display completed training",""
"passed","Wed Oct 09 15:02:23 UTC 2024","Wed Oct 09 15:02:27 UTC 2024","4516","","RepeatForm: Repeat form with count input","","","","should display the initial form and its repeated content in English",""
"passed","Wed Oct 09 15:03:22 UTC 2024","Wed Oct 09 15:03:28 UTC 2024","5594","","Submit Photo Upload form","","","","submit and edit (with changes)",""
"passed","Wed Oct 09 14:54:47 UTC 2024","Wed Oct 09 14:54:52 UTC 2024","5109","","DB Object Widget","","","","should display only the contacts from the parent contact",""
"passed","Wed Oct 09 15:02:32 UTC 2024","Wed Oct 09 15:02:37 UTC 2024","4689","","RepeatForm: Repeat form with repeat button","","","","should display the initial form and its repeated content in English",""
"passed","Wed Oct 09 15:04:41 UTC 2024","Wed Oct 09 15:04:42 UTC 2024","964","","Unauthorized form","","","","should display unauthorized error message in reports tab when form expression does not match",""
"passed","Wed Oct 09 15:02:59 UTC 2024","Wed Oct 09 15:03:02 UTC 2024","3200","","Submit Enketo form","","","","submits on reports tab",""
"passed","Wed Oct 09 15:04:00 UTC 2024","Wed Oct 09 15:04:28 UTC 2024","28699","","Training Cards","","","","should display training after privacy policy",""
"passed","Wed Oct 09 15:00:04 UTC 2024","Wed Oct 09 15:00:22 UTC 2024","18214","","Pregnancy danger sign follow-up form","","","","should submit and edit Pregnancy danger sign follow-up form with changes",""
"passed","Wed Oct 09 15:03:39 UTC 2024","Wed Oct 09 15:03:45 UTC 2024","6257","","Submit Z-Score form","","","","saves z-score values",""
"passed","Wed Oct 09 15:03:34 UTC 2024","Wed Oct 09 15:03:39 UTC 2024","5270","","Submit Z-Score form","","","","Autofills zscore fields with correct values",""
"passed","Wed Oct 09 14:55:01 UTC 2024","Wed Oct 09 14:56:03 UTC 2024","62792","","Submit a death report","","","","should create and edit a death, verify the report created and the tile from the Targets section.",""
"passed","Wed Oct 09 14:59:42 UTC 2024","Wed Oct 09 14:59:55 UTC 2024","13288","","Pregnancy danger sign follow-up form","","","","Submit and validate Pregnancy danger sign follow-up form and keeps the report minified",""
"passed","Wed Oct 09 14:56:17 UTC 2024","Wed Oct 09 14:56:23 UTC 2024","6723","","Edit report with attachment","","","","should save edits",""
"passed","Wed Oct 09 14:53:59 UTC 2024","Wed Oct 09 14:54:06 UTC 2024","6576","","Contact summary","","","","should load all reports",""
"passed","Wed Oct 09 14:59:55 UTC 2024","Wed Oct 09 15:00:04 UTC 2024","8578","","Pregnancy danger sign follow-up form","","","","should submit and edit Pregnancy danger sign follow-up form (no changes)",""
"passed","Wed Oct 09 15:01:54 UTC 2024","Wed Oct 09 15:02:08 UTC 2024","14407","","Pregnancy registration","","","","should submit a new pregnancy, validate that the pregnancy card was displayed with the correct information, validate that all tasks related with the high risk pregnancy were created, validate that the report related the pregnancy was created, and validate that the counters for the active pregnancies and the new pregnancies were updated.",""
"passed","Wed Oct 09 15:04:42 UTC 2024","Wed Oct 09 15:05:18 UTC 2024","35731","","Unauthorized form","","","","should display unauthorized error message in contacts tab when user does not have form permission",""
"passed","Wed Oct 09 14:54:16 UTC 2024","Wed Oct 09 14:54:47 UTC 2024","30917","","DB Object Widget","","","","should load contacts in non-relevant inputs group and from calculations",""
"passed","Wed Oct 09 14:57:05 UTC 2024","Wed Oct 09 14:57:09 UTC 2024","3966","","Phone widget","","","","can use duplicate phone number when editing contact with same number",""
"passed","Wed Oct 09 14:56:38 UTC 2024","Wed Oct 09 14:56:44 UTC 2024","6191","","Enketo Widgets","","","","should submit Enketo Widgets form - Report's tab",""
"passed","Wed Oct 09 15:03:54 UTC 2024","Wed Oct 09 15:03:56 UTC 2024","1890","","Training Cards","","","","should cancel training and not save it as completed",""
"passed","Wed Oct 09 14:58:50 UTC 2024","Wed Oct 09 14:59:35 UTC 2024","45021","","Contact Delivery Form","","","","open, submit and edit default delivery form",""
"passed","Wed Oct 09 14:57:17 UTC 2024","Wed Oct 09 14:57:41 UTC 2024","24437","","Contact Delivery Form","","","","Complete a delivery: Process a delivery with a live child and facility birth, verify that the past pregnancy card is present and the report was created,verify that the child registered during birth is created and displayed the proper information,verify that the targets page is updated",""
"passed","Wed Oct 09 14:56:31 UTC 2024","Wed Oct 09 14:56:38 UTC 2024","6773","","Enketo Widgets","","","","should submit Enketo Widgets form - People's tab",""
"passed","Wed Oct 09 14:57:41 UTC 2024","Wed Oct 09 14:58:50 UTC 2024","68249","","Contact Delivery Form","","","","open, submit and edit (no changes) default delivery form",""
"passed","Wed Oct 09 14:56:50 UTC 2024","Wed Oct 09 14:56:55 UTC 2024","4366","","Extension lib xpath function","","","","calculate average",""
"passed","Wed Oct 09 14:53:28 UTC 2024","Wed Oct 09 14:53:39 UTC 2024","10723","","Family form","","","","Submit Add Family form",""
"passed","Wed Oct 09 15:04:28 UTC 2024","Wed Oct 09 15:04:31 UTC 2024","2943","","Training Cards","","","","should display training after reload and complete training",""
"passed","Wed Oct 09 15:06:56 UTC 2024","Wed Oct 09 15:07:48 UTC 2024","52382","","Submit an undo death report","","","","should submit an undo death report, verify that it was registered successfully and verify that the counter for the Deaths, in the targets section, was set to 0.",""
"passed","Wed Oct 09 14:57:01 UTC 2024","Wed Oct 09 14:57:05 UTC 2024","3805","","Phone widget","","","","duplicate phone numbers violate constraint when configured in app form",""
"passed","Wed Oct 09 15:03:56 UTC 2024","Wed Oct 09 15:04:00 UTC 2024","4016","","Training Cards","","","","should display training after it was canceled and the training doc was updated",""
"passed","Wed Oct 09 15:00:31 UTC 2024","Wed Oct 09 15:00:45 UTC 2024","14712","","Health Facility ANC Reminder task","","","","should submit the health facility ANC reminder task",""
"passed","Wed Oct 09 15:05:18 UTC 2024","Wed Oct 09 15:05:56 UTC 2024","38729","","Unauthorized form","","","","should not display unauthorized error message in contacts tab when user has the form permission",""
"passed","Wed Oct 09 15:03:05 UTC 2024","Wed Oct 09 15:03:07 UTC 2024","2385","","Submit Enketo form","","","","cancelling form with no input does not trigger confirmation dialog",""
"passed","Wed Oct 09 15:03:16 UTC 2024","Wed Oct 09 15:03:22 UTC 2024","5999","","Submit Photo Upload form","","","","submit and edit (no changes)",""
"passed","Wed Oct 09 15:00:54 UTC 2024","Wed Oct 09 15:01:44 UTC 2024","50349","","Pregnancy Visit","","","","should submit a pregnancy visit and validate that the report was created successfully.",""
"passed","Wed Oct 09 15:03:07 UTC 2024","Wed Oct 09 15:03:11 UTC 2024","3718","","Submit Enketo form","","","","cancelling form with input triggers confirmation dialog box",""
"passed","Wed Oct 09 15:02:37 UTC 2024","Wed Oct 09 15:02:42 UTC 2024","5380","","RepeatForm: Repeat form with select","","","","should display the initial form and its repeated content in the default language",""
"passed","Wed Oct 09 15:02:48 UTC 2024","Wed Oct 09 15:02:53 UTC 2024","5114","","Countdown timer widget","","","","interact with timer and submit",""
"passed","Wed Oct 09 15:02:15 UTC 2024","Wed Oct 09 15:02:23 UTC 2024","7407","","RepeatForm: Repeat form with count input","","","","should display the initial form and its repeated content in Nepali",""
"passed","Wed Oct 09 15:03:02 UTC 2024","Wed Oct 09 15:03:05 UTC 2024","2771","","Submit Enketo form","","","","allows forms with required notes to be submitted",""
"passed","Wed Oct 09 14:56:10 UTC 2024","Wed Oct 09 14:56:17 UTC 2024","6826","","Edit report with attachment","","","","should remove attachment when saving",""
"passed","Wed Oct 09 15:02:27 UTC 2024","Wed Oct 09 15:02:32 UTC 2024","4617","","RepeatForm: Repeat form with repeat button","","","","should display the initial form and its repeated content in Swahili",""
