"DESCRIPTION","DURATION IN MS","NAME","PARENT SUITE","START TIME","STATUS","STOP TIME","SUB SUITE","SUITE","TEST CLASS","TEST METHOD"
"","7247","should submit Enketo Widgets form - People's tab","","Mon Jul 14 14:04:43 UTC 2025","passed","Mon Jul 14 14:04:50 UTC 2025","","Enketo Widgets","",""
"","5222","should display only the contacts from the parent contact","","Mon Jul 14 14:03:43 UTC 2025","passed","Mon Jul 14 14:03:49 UTC 2025","","DB Object Widget","",""
"","1734","should hide form based on summary","","Mon Jul 14 14:14:19 UTC 2025","passed","Mon Jul 14 14:14:21 UTC 2025","","user contact summary in forms","",""
"","7066","should show form based on summary","","Mon Jul 14 14:14:21 UTC 2025","passed","Mon Jul 14 14:14:28 UTC 2025","","user contact summary in forms","",""
"","11565","should submit an undo death report, verify that it was registered successfully and verify that the counter for the Deaths, in the targets section, was set to 0.","","Mon Jul 14 14:13:55 UTC 2025","passed","Mon Jul 14 14:14:07 UTC 2025","","Submit an undo death report","",""
"","67010","open, submit and edit (no changes) default delivery form","","Mon Jul 14 14:05:58 UTC 2025","passed","Mon Jul 14 14:07:05 UTC 2025","","Contact Delivery Form","",""
"","2002","should not display training after it was canceled and the training doc was updated","","Mon Jul 14 14:12:56 UTC 2025","passed","Mon Jul 14 14:12:58 UTC 2025","","Training Cards","",""
"","5854","should display the initial form and its repeated content in English","","Mon Jul 14 14:11:11 UTC 2025","passed","Mon Jul 14 14:11:17 UTC 2025","","RepeatForm: Repeat form with repeat button","",""
"","7408","should display unauthorized error message in contacts tab when user does not have form permission","","Mon Jul 14 14:13:20 UTC 2025","passed","Mon Jul 14 14:13:27 UTC 2025","","Unauthorized form","",""
"","6446","should display the initial form and its repeated content in Swahili","","Mon Jul 14 14:11:05 UTC 2025","passed","Mon Jul 14 14:11:11 UTC 2025","","RepeatForm: Repeat form with repeat button","",""
"","54985","open, submit and edit default delivery form","","Mon Jul 14 14:07:05 UTC 2025","passed","Mon Jul 14 14:08:00 UTC 2025","","Contact Delivery Form","",""
"","5175","cancelling form with input triggers confirmation dialog box","","Mon Jul 14 14:11:56 UTC 2025","passed","Mon Jul 14 14:12:01 UTC 2025","","Submit Enketo form","",""
"","14417","should submit a new pregnancy, validate that the pregnancy card was displayed with the correct information, validate that all tasks related with the high risk pregnancy were created, validate that the report related the pregnancy was created, and validate that the counters for the active pregnancies and the new pregnancies were updated.","","Mon Jul 14 14:10:23 UTC 2025","passed","Mon Jul 14 14:10:38 UTC 2025","","Pregnancy registration","",""
"","5609","should save edits","","Mon Jul 14 14:04:29 UTC 2025","passed","Mon Jul 14 14:04:34 UTC 2025","","Edit report with attachment","",""
"","10415","Submit Add Family form","","Mon Jul 14 14:02:37 UTC 2025","passed","Mon Jul 14 14:02:47 UTC 2025","","Family form","",""
"","8378","should submit and edit Pregnancy danger sign follow-up form (no changes)","","Mon Jul 14 14:08:19 UTC 2025","passed","Mon Jul 14 14:08:27 UTC 2025","","Pregnancy danger sign follow-up form","",""
"","6657","saves z-score values","","Mon Jul 14 14:12:32 UTC 2025","passed","Mon Jul 14 14:12:39 UTC 2025","","Submit Z-Score form","",""
"","6300","submit and edit (with changes)","","Mon Jul 14 14:12:13 UTC 2025","passed","Mon Jul 14 14:12:20 UTC 2025","","Submit Photo Upload form","",""
"","4033","allows forms with required notes to be submitted","","Mon Jul 14 14:11:48 UTC 2025","passed","Mon Jul 14 14:11:52 UTC 2025","","Submit Enketo form","",""
"","5910","should display the initial form and its repeated content in English","","Mon Jul 14 14:10:59 UTC 2025","passed","Mon Jul 14 14:11:05 UTC 2025","","RepeatForm: Repeat form with count input","",""
"","8648","should provide user contact summary to form context","","Mon Jul 14 14:14:28 UTC 2025","passed","Mon Jul 14 14:14:36 UTC 2025","","user contact summary in forms","",""
"","3101","should display confirm message before navigating to different page","","Mon Jul 14 14:12:50 UTC 2025","passed","Mon Jul 14 14:12:53 UTC 2025","","Training Cards","",""
"","787","should display unauthorized error message in reports tab when form expression does not match","","Mon Jul 14 14:13:19 UTC 2025","passed","Mon Jul 14 14:13:20 UTC 2025","","Unauthorized form","",""
"","7593","should submit Enketo Widgets form - Report's tab","","Mon Jul 14 14:04:50 UTC 2025","passed","Mon Jul 14 14:04:58 UTC 2025","","Enketo Widgets","",""
"","6693","should display training after privacy policy","","Mon Jul 14 14:12:58 UTC 2025","passed","Mon Jul 14 14:13:05 UTC 2025","","Training Cards","",""
"","18424","should create and edit a death, verify the report created and the tile from the Targets section.","","Mon Jul 14 14:03:58 UTC 2025","passed","Mon Jul 14 14:04:17 UTC 2025","","Submit a death report","",""
"","1501","should cancel training and not save it as completed","","Mon Jul 14 14:12:48 UTC 2025","passed","Mon Jul 14 14:12:50 UTC 2025","","Training Cards","",""
"","869","should not display completed training","","Mon Jul 14 14:13:09 UTC 2025","passed","Mon Jul 14 14:13:09 UTC 2025","","Training Cards","",""
"","6103","interact with timer and submit","","Mon Jul 14 14:11:31 UTC 2025","passed","Mon Jul 14 14:11:37 UTC 2025","","Countdown timer widget","",""
"","8834","should display the initial form and its repeated content in Nepali","","Mon Jul 14 14:10:50 UTC 2025","passed","Mon Jul 14 14:10:59 UTC 2025","","RepeatForm: Repeat form with count input","",""
"","6137","Autofills zscore fields with correct values","","Mon Jul 14 14:12:26 UTC 2025","passed","Mon Jul 14 14:12:32 UTC 2025","","Submit Z-Score form","",""
"","23365","Complete a delivery: Process a delivery with a live child and facility birth, verify that the past pregnancy card is present and the report was created,verify that the child registered during birth is created and displayed the proper information,verify that the targets page is updated","","Mon Jul 14 14:05:34 UTC 2025","passed","Mon Jul 14 14:05:58 UTC 2025","","Contact Delivery Form","",""
"","6042","submit and edit (no changes)","","Mon Jul 14 14:12:07 UTC 2025","passed","Mon Jul 14 14:12:13 UTC 2025","","Submit Photo Upload form","",""
"","3214","should display confirm message when browser back button is clicked","","Mon Jul 14 14:12:53 UTC 2025","passed","Mon Jul 14 14:12:56 UTC 2025","","Training Cards","",""
"","4293","should remove attachment when saving","","Mon Jul 14 14:04:24 UTC 2025","passed","Mon Jul 14 14:04:29 UTC 2025","","Edit report with attachment","",""
"","5880","calculate average","","Mon Jul 14 14:05:04 UTC 2025","passed","Mon Jul 14 14:05:10 UTC 2025","","Extension lib xpath function","",""
"","8667","should load contacts in non-relevant inputs group and from calculations","","Mon Jul 14 14:03:35 UTC 2025","passed","Mon Jul 14 14:03:43 UTC 2025","","DB Object Widget","",""
"","3550","should display training after reload and complete training","","Mon Jul 14 14:13:05 UTC 2025","passed","Mon Jul 14 14:13:09 UTC 2025","","Training Cards","",""
"","13788","should submit the health facility ANC reminder task","","Mon Jul 14 14:08:54 UTC 2025","passed","Mon Jul 14 14:09:08 UTC 2025","","Health Facility ANC Reminder task","",""
"","6780","should not display unauthorized error message in contacts tab when user has the form permission","","Mon Jul 14 14:13:27 UTC 2025","passed","Mon Jul 14 14:13:34 UTC 2025","","Unauthorized form","",""
"","50212","should submit a pregnancy visit and validate that the report was created successfully.","","Mon Jul 14 14:09:18 UTC 2025","passed","Mon Jul 14 14:10:08 UTC 2025","","Pregnancy Visit","",""
"","10965","Submit and validate Pregnancy danger sign follow-up form and keeps the report minified","","Mon Jul 14 14:08:08 UTC 2025","passed","Mon Jul 14 14:08:19 UTC 2025","","Pregnancy danger sign follow-up form","",""
"","4168","submits on reports tab","","Mon Jul 14 14:11:44 UTC 2025","passed","Mon Jul 14 14:11:48 UTC 2025","","Submit Enketo form","",""
"","9171","should load all reports","","Mon Jul 14 14:03:14 UTC 2025","passed","Mon Jul 14 14:03:23 UTC 2025","","Contact summary","",""
"","4013","cancelling form with no input does not trigger confirmation dialog","","Mon Jul 14 14:11:52 UTC 2025","passed","Mon Jul 14 14:11:56 UTC 2025","","Submit Enketo form","",""
"","5001","duplicate phone numbers violate constraint when configured in app form","","Mon Jul 14 14:05:18 UTC 2025","passed","Mon Jul 14 14:05:23 UTC 2025","","Phone widget","",""
"","2774","can use duplicate phone number when editing contact with same number","","Mon Jul 14 14:05:23 UTC 2025","passed","Mon Jul 14 14:05:25 UTC 2025","","Phone widget","",""
"","6622","should display the initial form and its repeated content in the default language","","Mon Jul 14 14:11:17 UTC 2025","passed","Mon Jul 14 14:11:24 UTC 2025","","RepeatForm: Repeat form with select","",""
"","16950","should submit and edit Pregnancy danger sign follow-up form with changes","","Mon Jul 14 14:08:27 UTC 2025","passed","Mon Jul 14 14:08:44 UTC 2025","","Pregnancy danger sign follow-up form","",""
