"DESCRIPTION","DURATION IN MS","NAME","PARENT SUITE","START TIME","STATUS","STOP TIME","SUB SUITE","SUITE","TEST CLASS","TEST METHOD"
"","48369","should submit a pregnancy visit and validate that the report was created successfully.","","Wed Sep 24 22:25:44 UTC 2025","passed","Wed Sep 24 22:26:33 UTC 2025","","Pregnancy Visit","",""
"","5738","submit and edit (no changes)","","Wed Sep 24 22:28:26 UTC 2025","passed","Wed Sep 24 22:28:32 UTC 2025","","Submit Photo Upload form","",""
"","5673","interact with timer and submit","","Wed Sep 24 22:27:51 UTC 2025","passed","Wed Sep 24 22:27:57 UTC 2025","","Countdown timer widget","",""
"","8137","should display the initial form and its repeated content in Nepali","","Wed Sep 24 22:27:14 UTC 2025","passed","Wed Sep 24 22:27:22 UTC 2025","","RepeatForm: Repeat form with count input","",""
"","8599","should provide user contact summary to form context","","Wed Sep 24 22:30:42 UTC 2025","passed","Wed Sep 24 22:30:51 UTC 2025","","user contact summary in forms","",""
"","2930","should display confirm message before navigating to different page","","Wed Sep 24 22:29:06 UTC 2025","passed","Wed Sep 24 22:29:09 UTC 2025","","Training Cards","",""
"","1884","should not display training after it was canceled and the training doc was updated","","Wed Sep 24 22:29:12 UTC 2025","passed","Wed Sep 24 22:29:13 UTC 2025","","Training Cards","",""
"","7148","should show form based on summary","","Wed Sep 24 22:30:35 UTC 2025","passed","Wed Sep 24 22:30:42 UTC 2025","","user contact summary in forms","",""
"","6453","should display only the contacts from the parent contact","","Wed Sep 24 22:20:13 UTC 2025","passed","Wed Sep 24 22:20:20 UTC 2025","","DB Object Widget: Logged in as an offline user","",""
"","19246","should create and edit a death, verify the report created and the tile from the Targets section.","","Wed Sep 24 22:20:31 UTC 2025","passed","Wed Sep 24 22:20:50 UTC 2025","","Submit a death report","",""
"","8246","should submit and edit Pregnancy danger sign follow-up form (no changes)","","Wed Sep 24 22:24:45 UTC 2025","passed","Wed Sep 24 22:24:54 UTC 2025","","Pregnancy danger sign follow-up form","",""
"","65744","open, submit and edit (no changes) default delivery form","","Wed Sep 24 22:22:28 UTC 2025","passed","Wed Sep 24 22:23:34 UTC 2025","","Contact Delivery Form","",""
"","5796","Autofills zscore fields with correct values","","Wed Sep 24 22:28:43 UTC 2025","passed","Wed Sep 24 22:28:49 UTC 2025","","Submit Z-Score form","",""
"","816","should not display completed training","","Wed Sep 24 22:29:24 UTC 2025","passed","Wed Sep 24 22:29:25 UTC 2025","","Training Cards","",""
"","13518","should submit a new pregnancy, validate that the pregnancy card was displayed with the correct information, validate that all tasks related with the high risk pregnancy were created, validate that the report related the pregnancy was created, and validate that the counters for the active pregnancies and the new pregnancies were updated.","","Wed Sep 24 22:26:48 UTC 2025","passed","Wed Sep 24 22:27:01 UTC 2025","","Pregnancy registration","",""
"","5392","should save edits","","Wed Sep 24 22:21:02 UTC 2025","passed","Wed Sep 24 22:21:07 UTC 2025","","Edit report with attachment","",""
"","5827","should display the initial form and its repeated content in Swahili","","Wed Sep 24 22:27:27 UTC 2025","passed","Wed Sep 24 22:27:33 UTC 2025","","RepeatForm: Repeat form with repeat button","",""
"","12198","should submit an undo death report, verify that it was registered successfully and verify that the counter for the Deaths, in the targets section, was set to 0.","","Wed Sep 24 22:30:10 UTC 2025","passed","Wed Sep 24 22:30:22 UTC 2025","","Submit an undo death report","",""
"","5232","should display the initial form and its repeated content in English","","Wed Sep 24 22:27:33 UTC 2025","passed","Wed Sep 24 22:27:39 UTC 2025","","RepeatForm: Repeat form with repeat button","",""
"","2647","can use duplicate phone number when editing contact with same number","","Wed Sep 24 22:21:54 UTC 2025","passed","Wed Sep 24 22:21:57 UTC 2025","","Phone widget","",""
"","7473","should load contacts in non-relevant inputs group and from calculations","","Wed Sep 24 22:20:06 UTC 2025","passed","Wed Sep 24 22:20:13 UTC 2025","","DB Object Widget: Logged in as an offline user","",""
"","5028","cancelling form with input triggers confirmation dialog box","","Wed Sep 24 22:28:15 UTC 2025","passed","Wed Sep 24 22:28:20 UTC 2025","","Submit Enketo form","",""
"","5619","calculate average","","Wed Sep 24 22:21:37 UTC 2025","passed","Wed Sep 24 22:21:42 UTC 2025","","Extension lib xpath function","",""
"","6990","should not display unauthorized error message in contacts tab when user has the form permission","","Wed Sep 24 22:29:43 UTC 2025","passed","Wed Sep 24 22:29:49 UTC 2025","","Unauthorized form","",""
"","7558","should display unauthorized error message in contacts tab when user does not have form permission","","Wed Sep 24 22:29:35 UTC 2025","passed","Wed Sep 24 22:29:42 UTC 2025","","Unauthorized form","",""
"","7496","should submit Enketo Widgets form - Report's tab","","Wed Sep 24 22:21:23 UTC 2025","passed","Wed Sep 24 22:21:31 UTC 2025","","Enketo Widgets","",""
"","4042","submits on reports tab","","Wed Sep 24 22:28:03 UTC 2025","passed","Wed Sep 24 22:28:07 UTC 2025","","Submit Enketo form","",""
"","22864","Complete a delivery: Process a delivery with a live child and facility birth, verify that the past pregnancy card is present and the report was created,verify that the child registered during birth is created and displayed the proper information,verify that the targets page is updated","","Wed Sep 24 22:22:05 UTC 2025","passed","Wed Sep 24 22:22:28 UTC 2025","","Contact Delivery Form","",""
"","4204","should remove attachment when saving","","Wed Sep 24 22:20:58 UTC 2025","passed","Wed Sep 24 22:21:02 UTC 2025","","Edit report with attachment","",""
"","5390","should display the initial form and its repeated content in English","","Wed Sep 24 22:27:22 UTC 2025","passed","Wed Sep 24 22:27:27 UTC 2025","","RepeatForm: Repeat form with count input","",""
"","4170","should load contacts in non-relevant inputs group and from calculations","","Wed Sep 24 22:19:50 UTC 2025","passed","Wed Sep 24 22:19:55 UTC 2025","","DB Object Widget: Logged in as an online user","",""
"","17025","should submit and edit Pregnancy danger sign follow-up form with changes","","Wed Sep 24 22:24:54 UTC 2025","passed","Wed Sep 24 22:25:11 UTC 2025","","Pregnancy danger sign follow-up form","",""
"","5939","should display the initial form and its repeated content in the default language","","Wed Sep 24 22:27:39 UTC 2025","passed","Wed Sep 24 22:27:44 UTC 2025","","RepeatForm: Repeat form with select","",""
"","1649","should hide form based on summary","","Wed Sep 24 22:30:34 UTC 2025","passed","Wed Sep 24 22:30:35 UTC 2025","","user contact summary in forms","",""
"","7322","should display training after privacy policy","","Wed Sep 24 22:29:13 UTC 2025","passed","Wed Sep 24 22:29:21 UTC 2025","","Training Cards","",""
"","732","should display unauthorized error message in reports tab when form expression does not match","","Wed Sep 24 22:29:34 UTC 2025","passed","Wed Sep 24 22:29:35 UTC 2025","","Unauthorized form","",""
"","1467","should cancel training and not save it as completed","","Wed Sep 24 22:29:05 UTC 2025","passed","Wed Sep 24 22:29:06 UTC 2025","","Training Cards","",""
"","4777","duplicate phone numbers violate constraint when configured in app form","","Wed Sep 24 22:21:49 UTC 2025","passed","Wed Sep 24 22:21:54 UTC 2025","","Phone widget","",""
"","2480","should display confirm message when browser back button is clicked","","Wed Sep 24 22:29:09 UTC 2025","passed","Wed Sep 24 22:29:12 UTC 2025","","Training Cards","",""
"","6415","saves z-score values","","Wed Sep 24 22:28:49 UTC 2025","passed","Wed Sep 24 22:28:56 UTC 2025","","Submit Z-Score form","",""
"","3882","allows forms with required notes to be submitted","","Wed Sep 24 22:28:07 UTC 2025","passed","Wed Sep 24 22:28:11 UTC 2025","","Submit Enketo form","",""
"","10027","Submit Add Family form","","Wed Sep 24 22:18:51 UTC 2025","passed","Wed Sep 24 22:19:01 UTC 2025","","Family form","",""
"","7293","should submit Enketo Widgets form - People's tab","","Wed Sep 24 22:21:16 UTC 2025","passed","Wed Sep 24 22:21:23 UTC 2025","","Enketo Widgets","",""
"","5821","submit and edit (with changes)","","Wed Sep 24 22:28:32 UTC 2025","passed","Wed Sep 24 22:28:38 UTC 2025","","Submit Photo Upload form","",""
"","9621","should load all reports","","Wed Sep 24 22:19:29 UTC 2025","passed","Wed Sep 24 22:19:38 UTC 2025","","Contact summary","",""
"","4002","cancelling form with no input does not trigger confirmation dialog","","Wed Sep 24 22:28:11 UTC 2025","passed","Wed Sep 24 22:28:15 UTC 2025","","Submit Enketo form","",""
"","53147","open, submit and edit default delivery form","","Wed Sep 24 22:23:34 UTC 2025","passed","Wed Sep 24 22:24:27 UTC 2025","","Contact Delivery Form","",""
"","6892","should display only the contacts from the parent contact","","Wed Sep 24 22:19:55 UTC 2025","passed","Wed Sep 24 22:20:02 UTC 2025","","DB Object Widget: Logged in as an online user","",""
"","3377","should display training after reload and complete training","","Wed Sep 24 22:29:21 UTC 2025","passed","Wed Sep 24 22:29:24 UTC 2025","","Training Cards","",""
"","10858","Submit and validate Pregnancy danger sign follow-up form and keeps the report minified","","Wed Sep 24 22:24:35 UTC 2025","passed","Wed Sep 24 22:24:45 UTC 2025","","Pregnancy danger sign follow-up form","",""
"","13888","should submit the health facility ANC reminder task","","Wed Sep 24 22:25:21 UTC 2025","passed","Wed Sep 24 22:25:34 UTC 2025","","Health Facility ANC Reminder task","",""
