"DESCRIPTION","DURATION IN MS","NAME","PARENT SUITE","START TIME","STATUS","STOP TIME","SUB SUITE","SUITE","TEST CLASS","TEST METHOD"
"","1684","should filter resources, service-worker, forms, translations, branding, partners docs","","Tue Aug 05 10:03:32 UTC 2025","passed","Tue Aug 05 10:03:33 UTC 2025","","db-sync","",""
"","21772","should download new forms and update forms","","Tue Aug 05 10:07:58 UTC 2025","passed","Tue Aug 05 10:08:19 UTC 2025","","ongoing replication","",""
"","2042","should be able to sync documents down","","Tue Aug 05 10:03:16 UTC 2025","passed","Tue Aug 05 10:03:18 UTC 2025","","Database access for new roles","",""
"","2797","should not filter allowed docs","","Tue Aug 05 10:03:27 UTC 2025","passed","Tue Aug 05 10:03:30 UTC 2025","","db-sync","",""
"","8582","should record telemetry for contact searches from the select2 component","","Tue Aug 05 10:12:49 UTC 2025","passed","Tue Aug 05 10:12:58 UTC 2025","","Telemetry: search matches telemetry","",""
"","23089","should stop creating feedback docs once the db has over 1000 feedback docs","","Tue Aug 05 10:04:02 UTC 2025","passed","Tue Aug 05 10:04:25 UTC 2025","","Feedback docs","",""
"","44269","purging runs when using chtScriptApi","","Tue Aug 05 10:11:36 UTC 2025","passed","Tue Aug 05 10:12:20 UTC 2025","","purge","",""
"","4319","should replicate meta db up","","Tue Aug 05 10:03:37 UTC 2025","passed","Tue Aug 05 10:03:41 UTC 2025","","db-sync: meta db replication","",""
"","5334","should record telemetry for contact searches","","Tue Aug 05 10:12:40 UTC 2025","passed","Tue Aug 05 10:12:45 UTC 2025","","Telemetry: search matches telemetry","",""
"","62018","purging runs on sync","","Tue Aug 05 10:10:28 UTC 2025","passed","Tue Aug 05 10:11:30 UTC 2025","","purge","",""
"","20582","should support ""disconnects""","","Tue Aug 05 10:05:55 UTC 2025","passed","Tue Aug 05 10:06:16 UTC 2025","","initial-replication","",""
"","25880","should handle conflicts","","Tue Aug 05 10:09:39 UTC 2025","passed","Tue Aug 05 10:10:05 UTC 2025","","ongoing replication","",""
"","49558","should log user in","","Tue Aug 05 10:05:04 UTC 2025","passed","Tue Aug 05 10:05:54 UTC 2025","","initial-replication","",""
"","3859","should record telemetry for reports searches","","Tue Aug 05 10:12:45 UTC 2025","passed","Tue Aug 05 10:12:49 UTC 2025","","Telemetry: search matches telemetry","",""
"","12929","should download settings updates","","Tue Aug 05 10:09:16 UTC 2025","passed","Tue Aug 05 10:09:29 UTC 2025","","ongoing replication","",""
"","9761","should handle updates to existing documents","","Tue Aug 05 10:07:39 UTC 2025","passed","Tue Aug 05 10:07:49 UTC 2025","","ongoing replication","",""
"","2070","should filter ddocs","","Tue Aug 05 10:03:35 UTC 2025","passed","Tue Aug 05 10:03:37 UTC 2025","","db-sync","",""
"","6123","should replicate meta db down","","Tue Aug 05 10:03:41 UTC 2025","passed","Tue Aug 05 10:03:48 UTC 2025","","db-sync: meta db replication","",""
"","2524","user with custom role should be able to log in","","Tue Aug 05 10:03:10 UTC 2025","passed","Tue Aug 05 10:03:13 UTC 2025","","Database access for new roles","",""
"","2948","should be able to sync documents up","","Tue Aug 05 10:03:13 UTC 2025","passed","Tue Aug 05 10:03:16 UTC 2025","","Database access for new roles","",""
"","1779","should filter locally purged docs","","Tue Aug 05 10:03:33 UTC 2025","passed","Tue Aug 05 10:03:35 UTC 2025","","db-sync","",""
"","20182","should handle deletes","","Tue Aug 05 10:08:52 UTC 2025","passed","Tue Aug 05 10:09:12 UTC 2025","","ongoing replication","",""
"","19541","should download new documents ","","Tue Aug 05 10:07:00 UTC 2025","passed","Tue Aug 05 10:07:19 UTC 2025","","ongoing replication","",""
"","2792","should create and sync a feedback doc","","Tue Aug 05 10:03:59 UTC 2025","passed","Tue Aug 05 10:04:02 UTC 2025","","Feedback docs","",""
"","1592","should not filter deletes","","Tue Aug 05 10:03:30 UTC 2025","passed","Tue Aug 05 10:03:32 UTC 2025","","db-sync","",""
"","4519","should record telemetry","","Tue Aug 05 10:12:36 UTC 2025","passed","Tue Aug 05 10:12:40 UTC 2025","","Telemetry","",""
"","24224","should download new languages and language updates","","Tue Aug 05 10:08:23 UTC 2025","passed","Tue Aug 05 10:08:47 UTC 2025","","ongoing replication","",""
