"Status","Start Time","Stop Time","Duration in ms","Parent Suite","Suite","Sub Suite","Test Class","Test Method","Name","Description"
"passed","Tue Aug 13 12:51:52 UTC 2024","Tue Aug 13 12:51:59 UTC 2024","6809","","ongoing replication","","","","should handle updates to existing documents",""
"passed","Tue Aug 13 12:51:29 UTC 2024","Tue Aug 13 12:51:44 UTC 2024","14770","","ongoing replication","","","","should download new documents ",""
"passed","Tue Aug 13 12:52:25 UTC 2024","Tue Aug 13 12:52:46 UTC 2024","20331","","ongoing replication","","","","should download new languages and language updates",""
"passed","Tue Aug 13 12:48:12 UTC 2024","Tue Aug 13 12:48:17 UTC 2024","4997","","db-sync: meta db replication","","","","should replicate meta db down",""
"passed","Tue Aug 13 12:48:03 UTC 2024","Tue Aug 13 12:48:05 UTC 2024","1954","","db-sync","","","","should filter resources, service-worker, forms, translations, branding, partners docs",""
"passed","Tue Aug 13 12:48:00 UTC 2024","Tue Aug 13 12:48:02 UTC 2024","2128","","db-sync","","","","should not filter allowed docs",""
"passed","Tue Aug 13 12:49:39 UTC 2024","Tue Aug 13 12:50:22 UTC 2024","42442","","initial-replication","","","","should log user in",""
"passed","Tue Aug 13 12:56:18 UTC 2024","Tue Aug 13 12:56:20 UTC 2024","2237","","Telemetry","","","","should record telemetry",""
"passed","Tue Aug 13 12:52:54 UTC 2024","Tue Aug 13 12:53:05 UTC 2024","11202","","ongoing replication","","","","should handle deletes",""
"passed","Tue Aug 13 12:53:24 UTC 2024","Tue Aug 13 12:53:32 UTC 2024","7353","","ongoing replication","","","","should handle conflicts",""
"passed","Tue Aug 13 12:54:11 UTC 2024","Tue Aug 13 12:55:15 UTC 2024","63893","","purge","","","","purging runs on sync",""
"passed","Tue Aug 13 12:52:07 UTC 2024","Tue Aug 13 12:52:17 UTC 2024","10237","","ongoing replication","","","","should download new forms and update forms",""
"passed","Tue Aug 13 12:50:23 UTC 2024","Tue Aug 13 12:50:46 UTC 2024","22779","","initial-replication","","","","should support ""disconnects""",""
"passed","Tue Aug 13 12:47:50 UTC 2024","Tue Aug 13 12:47:51 UTC 2024","1348","","Database access for new roles","","","","should be able to sync documents down",""
"passed","Tue Aug 13 12:47:48 UTC 2024","Tue Aug 13 12:47:50 UTC 2024","1624","","Database access for new roles","","","","should be able to sync documents up",""
"passed","Tue Aug 13 12:47:46 UTC 2024","Tue Aug 13 12:47:48 UTC 2024","2642","","Database access for new roles","","","","user with custom role should be able to log in",""
"passed","Tue Aug 13 12:48:05 UTC 2024","Tue Aug 13 12:48:07 UTC 2024","1828","","db-sync","","","","should filter locally purged docs",""
"passed","Tue Aug 13 12:53:14 UTC 2024","Tue Aug 13 12:53:21 UTC 2024","7415","","ongoing replication","","","","should download settings updates",""
"passed","Tue Aug 13 12:48:27 UTC 2024","Tue Aug 13 12:48:54 UTC 2024","26585","","feedback docs","","","","should stop creating feedback docs once the db has over 1000 feedback docs",""
"passed","Tue Aug 13 12:48:25 UTC 2024","Tue Aug 13 12:48:27 UTC 2024","1694","","feedback docs","","","","should create and sync a feedback doc",""
"passed","Tue Aug 13 12:48:10 UTC 2024","Tue Aug 13 12:48:12 UTC 2024","2182","","db-sync: meta db replication","","","","should replicate meta db up",""
"passed","Tue Aug 13 12:48:02 UTC 2024","Tue Aug 13 12:48:03 UTC 2024","1312","","db-sync","","","","should not filter deletes",""
"passed","Tue Aug 13 12:48:07 UTC 2024","Tue Aug 13 12:48:10 UTC 2024","3040","","db-sync","","","","should filter ddocs",""
"passed","Tue Aug 13 12:55:21 UTC 2024","Tue Aug 13 12:56:05 UTC 2024","43636","","purge","","","","purging runs when using chtScriptApi",""
