"Status","Start Time","Stop Time","Duration in ms","Parent Suite","Suite","Sub Suite","Test Class","Test Method","Name","Description"
"passed","Fri Sep 13 09:52:43 UTC 2024","Fri Sep 13 09:52:45 UTC 2024","1592","","Database access for new roles","","","","should be able to sync documents up",""
"passed","Fri Sep 13 09:55:15 UTC 2024","Fri Sep 13 09:55:39 UTC 2024","24461","","initial-replication","","","","should support ""disconnects""",""
"passed","Fri Sep 13 10:02:03 UTC 2024","Fri Sep 13 10:02:06 UTC 2024","2222","","Telemetry","","","","should record telemetry",""
"passed","Fri Sep 13 09:57:52 UTC 2024","Fri Sep 13 09:58:04 UTC 2024","12008","","ongoing replication","","","","should handle deletes",""
"passed","Fri Sep 13 09:56:50 UTC 2024","Fri Sep 13 09:56:56 UTC 2024","6366","","ongoing replication","","","","should handle updates to existing documents",""
"passed","Fri Sep 13 09:57:24 UTC 2024","Fri Sep 13 09:57:44 UTC 2024","20097","","ongoing replication","","","","should download new languages and language updates",""
"passed","Fri Sep 13 09:53:00 UTC 2024","Fri Sep 13 09:53:02 UTC 2024","1494","","db-sync","","","","should filter locally purged docs",""
"passed","Fri Sep 13 09:53:20 UTC 2024","Fri Sep 13 09:53:25 UTC 2024","4249","","Feedback docs","","","","should create and sync a feedback doc",""
"passed","Fri Sep 13 09:52:55 UTC 2024","Fri Sep 13 09:52:57 UTC 2024","2472","","db-sync","","","","should not filter allowed docs",""
"passed","Fri Sep 13 09:59:03 UTC 2024","Fri Sep 13 09:59:19 UTC 2024","16134","","ongoing replication","","","","should handle conflicts",""
"passed","Fri Sep 13 09:52:58 UTC 2024","Fri Sep 13 09:53:00 UTC 2024","2100","","db-sync","","","","should filter resources, service-worker, forms, translations, branding, partners docs",""
"passed","Fri Sep 13 09:53:02 UTC 2024","Fri Sep 13 09:53:05 UTC 2024","2835","","db-sync","","","","should filter ddocs",""
"passed","Fri Sep 13 09:53:05 UTC 2024","Fri Sep 13 09:53:07 UTC 2024","2317","","db-sync: meta db replication","","","","should replicate meta db up",""
"passed","Fri Sep 13 09:52:57 UTC 2024","Fri Sep 13 09:52:58 UTC 2024","914","","db-sync","","","","should not filter deletes",""
"passed","Fri Sep 13 10:01:04 UTC 2024","Fri Sep 13 10:01:50 UTC 2024","45656","","purge","","","","purging runs when using chtScriptApi",""
"passed","Fri Sep 13 09:53:07 UTC 2024","Fri Sep 13 09:53:12 UTC 2024","5300","","db-sync: meta db replication","","","","should replicate meta db down",""
"passed","Fri Sep 13 09:57:05 UTC 2024","Fri Sep 13 09:57:16 UTC 2024","11040","","ongoing replication","","","","should download new forms and update forms",""
"passed","Fri Sep 13 09:58:13 UTC 2024","Fri Sep 13 09:58:20 UTC 2024","6921","","ongoing replication","","","","should download settings updates",""
"passed","Fri Sep 13 09:52:45 UTC 2024","Fri Sep 13 09:52:46 UTC 2024","1399","","Database access for new roles","","","","should be able to sync documents down",""
"passed","Fri Sep 13 09:54:26 UTC 2024","Fri Sep 13 09:55:14 UTC 2024","48004","","initial-replication","","","","should log user in",""
"passed","Fri Sep 13 09:59:50 UTC 2024","Fri Sep 13 10:00:59 UTC 2024","68317","","purge","","","","purging runs on sync",""
"passed","Fri Sep 13 09:53:25 UTC 2024","Fri Sep 13 09:53:52 UTC 2024","26882","","Feedback docs","","","","should stop creating feedback docs once the db has over 1000 feedback docs",""
"passed","Fri Sep 13 09:56:25 UTC 2024","Fri Sep 13 09:56:42 UTC 2024","16781","","ongoing replication","","","","should download new documents ",""
"passed","Fri Sep 13 09:52:41 UTC 2024","Fri Sep 13 09:52:43 UTC 2024","1810","","Database access for new roles","","","","user with custom role should be able to log in",""
