"Status","Start Time","Stop Time","Duration in ms","Parent Suite","Suite","Sub Suite","Test Class","Test Method","Name","Description"
"passed","Sun Aug 06 22:01:11 UTC 2023","Sun Aug 06 22:01:12 UTC 2023","1424","","db-sync","","db-sync","should not filter deletes","should not filter deletes",""
"passed","Sun Aug 06 22:07:00 UTC 2023","Sun Aug 06 22:07:37 UTC 2023","37675","","ongoing replication","","ongoing replication","should download settings updates","should download settings updates",""
"passed","Sun Aug 06 22:01:17 UTC 2023","Sun Aug 06 22:01:20 UTC 2023","2359","","db-sync: meta db replication","","db-sync: meta db replication","should replicate meta db up","should replicate meta db up",""
"passed","Sun Aug 06 22:09:11 UTC 2023","Sun Aug 06 22:10:15 UTC 2023","64098","","purge","","purge","purging runs when using chtScriptApi","purging runs when using chtScriptApi",""
"passed","Sun Aug 06 22:01:31 UTC 2023","Sun Aug 06 22:02:40 UTC 2023","68565","","initial-replication","","initial-replication","should log user in","should log user in",""
"passed","Sun Aug 06 22:07:56 UTC 2023","Sun Aug 06 22:09:11 UTC 2023","75064","","purge","","purge","purging runs on sync","purging runs on sync",""
"passed","Sun Aug 06 22:07:37 UTC 2023","Sun Aug 06 22:07:46 UTC 2023","8636","","ongoing replication","","ongoing replication","should handle conflicts","should handle conflicts",""
"passed","Sun Aug 06 22:10:23 UTC 2023","Sun Aug 06 22:10:30 UTC 2023","7572","","Telemetry","","Telemetry","should record telemetry","should record telemetry",""
"passed","Sun Aug 06 22:01:04 UTC 2023","Sun Aug 06 22:01:11 UTC 2023","7026","","db-sync","","db-sync","should not filter allowed docs","should not filter allowed docs",""
"passed","Sun Aug 06 22:05:46 UTC 2023","Sun Aug 06 22:07:00 UTC 2023","73801","","ongoing replication","","ongoing replication","should handle deletes","should handle deletes",""
"passed","Sun Aug 06 22:04:39 UTC 2023","Sun Aug 06 22:04:50 UTC 2023","10282","","ongoing replication","","ongoing replication","should download new forms and update forms","should download new forms and update forms",""
"passed","Sun Aug 06 22:04:01 UTC 2023","Sun Aug 06 22:04:33 UTC 2023","31779","","ongoing replication","","ongoing replication","should download new documents ","should download new documents ",""
"passed","Sun Aug 06 22:01:20 UTC 2023","Sun Aug 06 22:01:25 UTC 2023","5199","","db-sync: meta db replication","","db-sync: meta db replication","should replicate meta db down","should replicate meta db down",""
"passed","Sun Aug 06 22:01:15 UTC 2023","Sun Aug 06 22:01:17 UTC 2023","2543","","db-sync","","db-sync","should filter ddocs","should filter ddocs",""
"passed","Sun Aug 06 22:01:12 UTC 2023","Sun Aug 06 22:01:14 UTC 2023","1294","","db-sync","","db-sync","should filter resources, service-worker, forms, translations, branding, partners docs","should filter resources, service-worker, forms, translations, branding, partners docs",""
"passed","Sun Aug 06 22:04:50 UTC 2023","Sun Aug 06 22:05:46 UTC 2023","56160","","ongoing replication","","ongoing replication","should download new languages and language updates","should download new languages and language updates",""
"passed","Sun Aug 06 22:02:40 UTC 2023","Sun Aug 06 22:03:13 UTC 2023","33398","","initial-replication","","initial-replication","should support ""disconnects""","should support ""disconnects""",""
"passed","Sun Aug 06 22:01:14 UTC 2023","Sun Aug 06 22:01:15 UTC 2023","927","","db-sync","","db-sync","should filter locally purged docs","should filter locally purged docs",""
"passed","Sun Aug 06 22:04:33 UTC 2023","Sun Aug 06 22:04:39 UTC 2023","6093","","ongoing replication","","ongoing replication","should handle updates to existing documents","should handle updates to existing documents",""
