"Status","Start Time","Stop Time","Duration in ms","Parent Suite","Suite","Sub Suite","Test Class","Test Method","Name","Description"
"passed","Mon Sep 02 08:54:10 UTC 2024","Mon Sep 02 08:54:21 UTC 2024","11028","","ongoing replication","","","","should download new forms and update forms",""
"passed","Mon Sep 02 08:55:17 UTC 2024","Mon Sep 02 08:55:25 UTC 2024","8057","","ongoing replication","","","","should download settings updates",""
"passed","Mon Sep 02 08:49:52 UTC 2024","Mon Sep 02 08:49:54 UTC 2024","2293","","Database access for new roles","","","","user with custom role should be able to log in",""
"passed","Mon Sep 02 08:50:11 UTC 2024","Mon Sep 02 08:50:13 UTC 2024","1859","","db-sync","","","","should filter locally purged docs",""
"passed","Mon Sep 02 08:59:12 UTC 2024","Mon Sep 02 08:59:14 UTC 2024","2229","","Telemetry","","","","should record telemetry",""
"passed","Mon Sep 02 08:50:15 UTC 2024","Mon Sep 02 08:50:18 UTC 2024","2284","","db-sync: meta db replication","","","","should replicate meta db up",""
"passed","Mon Sep 02 08:50:32 UTC 2024","Mon Sep 02 08:50:33 UTC 2024","1736","","Feedback docs","","","","should create and sync a feedback doc",""
"passed","Mon Sep 02 08:50:18 UTC 2024","Mon Sep 02 08:50:23 UTC 2024","5125","","db-sync: meta db replication","","","","should replicate meta db down",""
"passed","Mon Sep 02 08:49:54 UTC 2024","Mon Sep 02 08:49:56 UTC 2024","1693","","Database access for new roles","","","","should be able to sync documents up",""
"passed","Mon Sep 02 08:49:56 UTC 2024","Mon Sep 02 08:49:57 UTC 2024","1463","","Database access for new roles","","","","should be able to sync documents down",""
"passed","Mon Sep 02 08:56:54 UTC 2024","Mon Sep 02 08:58:05 UTC 2024","71235","","purge","","","","purging runs on sync",""
"passed","Mon Sep 02 08:54:29 UTC 2024","Mon Sep 02 08:54:48 UTC 2024","19076","","ongoing replication","","","","should download new languages and language updates",""
"passed","Mon Sep 02 08:50:33 UTC 2024","Mon Sep 02 08:51:02 UTC 2024","28925","","Feedback docs","","","","should stop creating feedback docs once the db has over 1000 feedback docs",""
"passed","Mon Sep 02 08:53:56 UTC 2024","Mon Sep 02 08:54:02 UTC 2024","6023","","ongoing replication","","","","should handle updates to existing documents",""
"passed","Mon Sep 02 08:58:11 UTC 2024","Mon Sep 02 08:58:58 UTC 2024","47054","","purge","","","","purging runs when using chtScriptApi",""
"passed","Mon Sep 02 08:50:13 UTC 2024","Mon Sep 02 08:50:15 UTC 2024","2569","","db-sync","","","","should filter ddocs",""
"passed","Mon Sep 02 08:53:32 UTC 2024","Mon Sep 02 08:53:48 UTC 2024","15819","","ongoing replication","","","","should download new documents ",""
"passed","Mon Sep 02 08:56:08 UTC 2024","Mon Sep 02 08:56:25 UTC 2024","16686","","ongoing replication","","","","should handle conflicts",""
"passed","Mon Sep 02 08:52:25 UTC 2024","Mon Sep 02 08:52:50 UTC 2024","24482","","initial-replication","","","","should support ""disconnects""",""
"passed","Mon Sep 02 08:50:09 UTC 2024","Mon Sep 02 08:50:11 UTC 2024","1914","","db-sync","","","","should filter resources, service-worker, forms, translations, branding, partners docs",""
"passed","Mon Sep 02 08:50:08 UTC 2024","Mon Sep 02 08:50:09 UTC 2024","729","","db-sync","","","","should not filter deletes",""
"passed","Mon Sep 02 08:51:40 UTC 2024","Mon Sep 02 08:52:24 UTC 2024","43825","","initial-replication","","","","should log user in",""
"passed","Mon Sep 02 08:50:06 UTC 2024","Mon Sep 02 08:50:08 UTC 2024","2260","","db-sync","","","","should not filter allowed docs",""
"passed","Mon Sep 02 08:54:57 UTC 2024","Mon Sep 02 08:55:09 UTC 2024","12179","","ongoing replication","","","","should handle deletes",""
