"Status","Start Time","Stop Time","Duration in ms","Parent Suite","Suite","Sub Suite","Test Class","Test Method","Name","Description"
"passed","Mon Apr 15 11:22:11 UTC 2024","Mon Apr 15 11:22:14 UTC 2024","2496","","Family form","","","","""before all"" hook for Family form",""
"passed","Mon Apr 15 11:23:01 UTC 2024","Mon Apr 15 11:23:05 UTC 2024","4527","","Edit report with attachment","","","","should save edits",""
"passed","Mon Apr 15 11:25:18 UTC 2024","Mon Apr 15 11:25:19 UTC 2024","910","","Pregnancy danger sign follow-up form","","","","""before each"" hook for Pregnancy danger sign follow-up form",""
"passed","Mon Apr 15 11:27:33 UTC 2024","Mon Apr 15 11:27:34 UTC 2024","1095","","Submit Enketo form","","","","cancelling form with no input does not trigger confirmation dialog",""
"passed","Mon Apr 15 11:28:19 UTC 2024","Mon Apr 15 11:28:21 UTC 2024","2698","","Training Cards","","","","should display training after privacy policy",""
"passed","Mon Apr 15 11:23:09 UTC 2024","Mon Apr 15 11:23:13 UTC 2024","3922","","Enketo Widgets","","","","""before all"" hook for Enketo Widgets",""
"passed","Mon Apr 15 11:27:46 UTC 2024","Mon Apr 15 11:27:50 UTC 2024","3565","","Submit Photo Upload form","","","","submit and edit (with changes)",""
"passed","Mon Apr 15 11:22:56 UTC 2024","Mon Apr 15 11:23:01 UTC 2024","4632","","Edit report with attachment","","","","should remove attachment when saving",""
"passed","Mon Apr 15 11:27:57 UTC 2024","Mon Apr 15 11:28:01 UTC 2024","4389","","Submit Z-Score form","","","","Autofills zscore fields with correct values",""
"passed","Mon Apr 15 11:28:23 UTC 2024","Mon Apr 15 11:28:23 UTC 2024","416","","Training Cards","","","","should not display completed training",""
"passed","Mon Apr 15 11:28:15 UTC 2024","Mon Apr 15 11:28:16 UTC 2024","1001","","Training Cards","","","","should cancel training and not save it as completed",""
"passed","Mon Apr 15 11:25:36 UTC 2024","Mon Apr 15 11:25:40 UTC 2024","4171","","Health Facility ANC Reminder task","","","","""before all"" hook for Health Facility ANC Reminder task",""
"passed","Mon Apr 15 11:27:31 UTC 2024","Mon Apr 15 11:27:33 UTC 2024","1541","","Submit Enketo form","","","","allows forms with required notes to be submitted",""
"passed","Mon Apr 15 11:27:02 UTC 2024","Mon Apr 15 11:27:04 UTC 2024","2215","","RepeatForm: Repeat form with count input","","","","should display the initial form and its repeated content in English",""
"passed","Mon Apr 15 11:27:27 UTC 2024","Mon Apr 15 11:27:29 UTC 2024","2709","","Submit Enketo form","","","","""before all"" hook for Submit Enketo form",""
"passed","Mon Apr 15 11:23:13 UTC 2024","Mon Apr 15 11:23:19 UTC 2024","5709","","Enketo Widgets","","","","should submit Enketo Widgets form - People's tab",""
"passed","Mon Apr 15 11:28:44 UTC 2024","Mon Apr 15 11:28:58 UTC 2024","13553","","Submit an undo death report","","","","""before all"" hook for Submit an undo death report",""
"passed","Mon Apr 15 11:22:14 UTC 2024","Mon Apr 15 11:22:21 UTC 2024","7351","","Family form","","","","Submit Add Family form",""
"passed","Mon Apr 15 11:25:59 UTC 2024","Mon Apr 15 11:26:29 UTC 2024","29980","","Pregnancy Visit","","","","should submit a pregnancy visit and validate that the report was created successfully.",""
"passed","Mon Apr 15 11:27:54 UTC 2024","Mon Apr 15 11:27:57 UTC 2024","2505","","Submit Z-Score form","","","","""before all"" hook for Submit Z-Score form",""
"passed","Mon Apr 15 11:27:04 UTC 2024","Mon Apr 15 11:27:04 UTC 2024","209","","RepeatForm: Repeat form with count input","","","","""after each"" hook for RepeatForm",""
"passed","Mon Apr 15 11:28:33 UTC 2024","Mon Apr 15 11:28:36 UTC 2024","2956","","Unauthorized form","","","","should display unauthorized error message in contacts tab when user does not have form permission",""
"passed","Mon Apr 15 11:23:28 UTC 2024","Mon Apr 15 11:23:31 UTC 2024","3887","","Extension lib xpath function","","","","""before all"" hook for Extension lib xpath function",""
"passed","Mon Apr 15 11:25:05 UTC 2024","Mon Apr 15 11:25:13 UTC 2024","7237","","Pregnancy danger sign follow-up form","","","","Submit and validate Pregnancy danger sign follow-up form and keeps the report minified",""
"passed","Mon Apr 15 11:28:33 UTC 2024","Mon Apr 15 11:28:33 UTC 2024","653","","Unauthorized form","","","","should display unauthorized error message in reports tab when form expression does not match",""
"passed","Mon Apr 15 11:22:29 UTC 2024","Mon Apr 15 11:22:32 UTC 2024","3303","","DB Object Widget","","","","should display only the contacts from the parent contact",""
"passed","Mon Apr 15 11:22:40 UTC 2024","Mon Apr 15 11:22:48 UTC 2024","8239","","Submit a death report","","","","should create and edit a death, verify the report created and the tile from the Targets section.",""
"passed","Mon Apr 15 11:22:25 UTC 2024","Mon Apr 15 11:22:29 UTC 2024","3919","","DB Object Widget","","","","""before all"" hook for DB Object Widget",""
"passed","Mon Apr 15 11:24:01 UTC 2024","Mon Apr 15 11:24:30 UTC 2024","29090","","Contact Delivery Form","","","","open, submit and edit (no changes) default delivery form",""
"passed","Mon Apr 15 11:25:04 UTC 2024","Mon Apr 15 11:25:05 UTC 2024","1787","","Pregnancy danger sign follow-up form","","","","""before all"" hook for Pregnancy danger sign follow-up form",""
"passed","Mon Apr 15 11:27:46 UTC 2024","Mon Apr 15 11:27:48 UTC 2024","1564","","Submit Photo Upload form","","","","""before each"" hook for Submit Photo Upload form",""
"passed","Mon Apr 15 11:26:38 UTC 2024","Mon Apr 15 11:26:49 UTC 2024","10646","","Pregnancy registration","","","","should submit a new pregnancy, validate that the pregnancy card was displayed with the correct information, validate that all tasks related with the high risk pregnancy were created, validate that the report related the pregnancy was created, and validate that the counters for the active pregnancies and the new pregnancies were updated.",""
"passed","Mon Apr 15 11:27:29 UTC 2024","Mon Apr 15 11:27:31 UTC 2024","1934","","Submit Enketo form","","","","submits on reports tab",""
"passed","Mon Apr 15 11:28:39 UTC 2024","Mon Apr 15 11:28:39 UTC 2024","155","","Unauthorized form","","","","""after each"" hook for Unauthorized form",""
"passed","Mon Apr 15 11:23:45 UTC 2024","Mon Apr 15 11:24:01 UTC 2024","16028","","Contact Delivery Form","","","","Complete a delivery: Process a delivery with a live child and facility birth, verify that the past pregnancy card is present and the report was created,verify that the child registered during birth is created and displayed the proper information,verify that the targets page is updated",""
"passed","Mon Apr 15 11:26:55 UTC 2024","Mon Apr 15 11:26:58 UTC 2024","3281","","RepeatForm","","","","""before all"" hook for RepeatForm",""
"passed","Mon Apr 15 11:27:09 UTC 2024","Mon Apr 15 11:27:12 UTC 2024","2563","","RepeatForm: Repeat form with select","","","","should display the initial form and its repeated content in the default language",""
"passed","Mon Apr 15 11:27:12 UTC 2024","Mon Apr 15 11:27:12 UTC 2024","204","","RepeatForm: Repeat form with select","","","","""after each"" hook for RepeatForm",""
"passed","Mon Apr 15 11:26:58 UTC 2024","Mon Apr 15 11:27:02 UTC 2024","3402","","RepeatForm: Repeat form with count input","","","","should display the initial form and its repeated content in Nepali",""
"passed","Mon Apr 15 11:27:42 UTC 2024","Mon Apr 15 11:27:46 UTC 2024","3865","","Submit Photo Upload form","","","","submit and edit (no changes)",""
"passed","Mon Apr 15 11:25:13 UTC 2024","Mon Apr 15 11:25:18 UTC 2024","5553","","Pregnancy danger sign follow-up form","","","","should submit and edit Pregnancy danger sign follow-up form (no changes)",""
"passed","Mon Apr 15 11:26:35 UTC 2024","Mon Apr 15 11:26:38 UTC 2024","3637","","Pregnancy registration","","","","""before all"" hook for Pregnancy registration",""
"passed","Mon Apr 15 11:25:40 UTC 2024","Mon Apr 15 11:25:50 UTC 2024","9390","","Health Facility ANC Reminder task","","","","should submit the health facility ANC reminder task",""
"passed","Mon Apr 15 11:27:07 UTC 2024","Mon Apr 15 11:27:09 UTC 2024","2091","","RepeatForm: Repeat form with repeat button","","","","should display the initial form and its repeated content in English",""
"passed","Mon Apr 15 11:27:40 UTC 2024","Mon Apr 15 11:27:42 UTC 2024","2412","","Submit Photo Upload form","","","","""before all"" hook for Submit Photo Upload form",""
"passed","Mon Apr 15 11:28:01 UTC 2024","Mon Apr 15 11:28:05 UTC 2024","4246","","Submit Z-Score form","","","","saves z-score values",""
"passed","Mon Apr 15 11:28:16 UTC 2024","Mon Apr 15 11:28:19 UTC 2024","2819","","Training Cards","","","","should display training after it was canceled and the training doc was updated",""
"passed","Mon Apr 15 11:25:18 UTC 2024","Mon Apr 15 11:25:31 UTC 2024","12951","","Pregnancy danger sign follow-up form","","","","should submit and edit Pregnancy danger sign follow-up form with changes",""
"passed","Mon Apr 15 11:25:55 UTC 2024","Mon Apr 15 11:25:59 UTC 2024","3452","","Pregnancy Visit","","","","""before all"" hook for Pregnancy Visit",""
"passed","Mon Apr 15 11:24:30 UTC 2024","Mon Apr 15 11:24:57 UTC 2024","27151","","Contact Delivery Form","","","","open, submit and edit default delivery form",""
"passed","Mon Apr 15 11:22:53 UTC 2024","Mon Apr 15 11:22:56 UTC 2024","2909","","Edit report with attachment","","","","""before all"" hook for Edit report with attachment",""
"passed","Mon Apr 15 11:27:04 UTC 2024","Mon Apr 15 11:27:07 UTC 2024","2350","","RepeatForm: Repeat form with repeat button","","","","should display the initial form and its repeated content in Swahili",""
"passed","Mon Apr 15 11:27:19 UTC 2024","Mon Apr 15 11:27:23 UTC 2024","3761","","Countdown timer widget","","","","interact with timer and submit",""
"passed","Mon Apr 15 11:28:58 UTC 2024","Mon Apr 15 11:29:08 UTC 2024","10235","","Submit an undo death report","","","","should submit an undo death report, verify that it was registered successfully and verify that the counter for the Deaths, in the targets section, was set to 0.",""
"passed","Mon Apr 15 11:27:09 UTC 2024","Mon Apr 15 11:27:09 UTC 2024","204","","RepeatForm: Repeat form with repeat button","","","","""after each"" hook for RepeatForm",""
"passed","Mon Apr 15 11:22:37 UTC 2024","Mon Apr 15 11:22:40 UTC 2024","3122","","Submit a death report","","","","""before all"" hook for Submit a death report",""
"passed","Mon Apr 15 11:27:34 UTC 2024","Mon Apr 15 11:27:36 UTC 2024","1740","","Submit Enketo form","","","","cancelling form with input triggers confirmation dialog box",""
"passed","Mon Apr 15 11:28:21 UTC 2024","Mon Apr 15 11:28:23 UTC 2024","1780","","Training Cards","","","","should display training after reload and complete training",""
"passed","Mon Apr 15 11:27:16 UTC 2024","Mon Apr 15 11:27:19 UTC 2024","2497","","Countdown timer widget","","","","""before all"" hook for Countdown timer widget",""
"passed","Mon Apr 15 11:23:31 UTC 2024","Mon Apr 15 11:23:35 UTC 2024","3580","","Extension lib xpath function","","","","calculate average",""
"passed","Mon Apr 15 11:28:28 UTC 2024","Mon Apr 15 11:28:33 UTC 2024","4319","","Unauthorized form","","","","""before all"" hook for Unauthorized form",""
"passed","Mon Apr 15 11:28:36 UTC 2024","Mon Apr 15 11:28:39 UTC 2024","2807","","Unauthorized form","","","","should not display unauthorized error message in contacts tab when user has the form permission",""
"passed","Mon Apr 15 11:23:41 UTC 2024","Mon Apr 15 11:23:45 UTC 2024","3777","","Contact Delivery Form","","","","""before all"" hook for Contact Delivery Form",""
"passed","Mon Apr 15 11:23:19 UTC 2024","Mon Apr 15 11:23:23 UTC 2024","4149","","Enketo Widgets","","","","should submit Enketo Widgets form - Report's tab",""
"passed","Mon Apr 15 11:28:10 UTC 2024","Mon Apr 15 11:28:15 UTC 2024","4966","","Training Cards","","","","""before all"" hook for Training Cards",""
