"Status","Start Time","Stop Time","Duration in ms","Parent Suite","Suite","Sub Suite","Test Class","Test Method","Name","Description"
"passed","Wed Jun 05 07:18:46 UTC 2024","Wed Jun 05 07:18:50 UTC 2024","3723","","Submit Photo Upload form","","","","submit and edit (no changes)",""
"passed","Wed Jun 05 07:18:02 UTC 2024","Wed Jun 05 07:18:05 UTC 2024","3313","","RepeatForm","","","","""before all"" hook for RepeatForm",""
"passed","Wed Jun 05 07:16:34 UTC 2024","Wed Jun 05 07:16:34 UTC 2024","817","","Pregnancy danger sign follow-up form","","","","""before each"" hook for Pregnancy danger sign follow-up form",""
"passed","Wed Jun 05 07:18:31 UTC 2024","Wed Jun 05 07:18:34 UTC 2024","2554","","Submit Enketo form","","","","""before all"" hook for Submit Enketo form",""
"passed","Wed Jun 05 07:13:55 UTC 2024","Wed Jun 05 07:13:58 UTC 2024","3096","","Submit a death report","","","","""before all"" hook for Submit a death report",""
"passed","Wed Jun 05 07:19:25 UTC 2024","Wed Jun 05 07:19:25 UTC 2024","464","","Training Cards","","","","should not display completed training",""
"passed","Wed Jun 05 07:17:11 UTC 2024","Wed Jun 05 07:17:37 UTC 2024","25989","","Pregnancy Visit","","","","should submit a pregnancy visit and validate that the report was created successfully.",""
"passed","Wed Jun 05 07:13:48 UTC 2024","Wed Jun 05 07:13:51 UTC 2024","3268","","DB Object Widget","","","","should display only the contacts from the parent contact",""
"passed","Wed Jun 05 07:18:05 UTC 2024","Wed Jun 05 07:18:08 UTC 2024","3173","","RepeatForm: Repeat form with count input","","","","should display the initial form and its repeated content in Nepali",""
"passed","Wed Jun 05 07:19:40 UTC 2024","Wed Jun 05 07:19:40 UTC 2024","154","","Unauthorized form","","","","""after each"" hook for Unauthorized form",""
"passed","Wed Jun 05 07:18:16 UTC 2024","Wed Jun 05 07:18:16 UTC 2024","22","","RepeatForm: Repeat form with select","","","","""after each"" hook for RepeatForm",""
"passed","Wed Jun 05 07:15:46 UTC 2024","Wed Jun 05 07:16:12 UTC 2024","26496","","Contact Delivery Form","","","","open, submit and edit default delivery form",""
"passed","Wed Jun 05 07:19:45 UTC 2024","Wed Jun 05 07:19:57 UTC 2024","12322","","Submit an undo death report","","","","""before all"" hook for Submit an undo death report",""
"passed","Wed Jun 05 07:19:35 UTC 2024","Wed Jun 05 07:19:37 UTC 2024","2859","","Unauthorized form","","","","should display unauthorized error message in contacts tab when user does not have form permission",""
"passed","Wed Jun 05 07:16:54 UTC 2024","Wed Jun 05 07:17:02 UTC 2024","7917","","Health Facility ANC Reminder task","","","","should submit the health facility ANC reminder task",""
"passed","Wed Jun 05 07:17:07 UTC 2024","Wed Jun 05 07:17:11 UTC 2024","3557","","Pregnancy Visit","","","","""before all"" hook for Pregnancy Visit",""
"passed","Wed Jun 05 07:14:15 UTC 2024","Wed Jun 05 07:14:20 UTC 2024","4593","","Edit report with attachment","","","","should remove attachment when saving",""
"passed","Wed Jun 05 07:18:38 UTC 2024","Wed Jun 05 07:18:40 UTC 2024","1685","","Submit Enketo form","","","","cancelling form with input triggers confirmation dialog box",""
"passed","Wed Jun 05 07:18:10 UTC 2024","Wed Jun 05 07:18:12 UTC 2024","1865","","RepeatForm: Repeat form with repeat button","","","","should display the initial form and its repeated content in Swahili",""
"passed","Wed Jun 05 07:18:50 UTC 2024","Wed Jun 05 07:18:51 UTC 2024","1521","","Submit Photo Upload form","","","","""before each"" hook for Submit Photo Upload form",""
"passed","Wed Jun 05 07:19:57 UTC 2024","Wed Jun 05 07:20:07 UTC 2024","9860","","Submit an undo death report","","","","should submit an undo death report, verify that it was registered successfully and verify that the counter for the Deaths, in the targets section, was set to 0.",""
"passed","Wed Jun 05 07:18:24 UTC 2024","Wed Jun 05 07:18:27 UTC 2024","3568","","Countdown timer widget","","","","interact with timer and submit",""
"passed","Wed Jun 05 07:15:03 UTC 2024","Wed Jun 05 07:15:18 UTC 2024","15281","","Contact Delivery Form","","","","Complete a delivery: Process a delivery with a live child and facility birth, verify that the past pregnancy card is present and the report was created,verify that the child registered during birth is created and displayed the proper information,verify that the targets page is updated",""
"passed","Wed Jun 05 07:14:47 UTC 2024","Wed Jun 05 07:14:51 UTC 2024","3930","","Extension lib xpath function","","","","""before all"" hook for Extension lib xpath function",""
"passed","Wed Jun 05 07:18:34 UTC 2024","Wed Jun 05 07:18:36 UTC 2024","1823","","Submit Enketo form","","","","submits on reports tab",""
"passed","Wed Jun 05 07:14:12 UTC 2024","Wed Jun 05 07:14:15 UTC 2024","3039","","Edit report with attachment","","","","""before all"" hook for Edit report with attachment",""
"passed","Wed Jun 05 07:19:18 UTC 2024","Wed Jun 05 07:19:20 UTC 2024","2419","","Training Cards","","","","should display training after it was canceled and the training doc was updated",""
"passed","Wed Jun 05 07:15:18 UTC 2024","Wed Jun 05 07:15:46 UTC 2024","27698","","Contact Delivery Form","","","","open, submit and edit (no changes) default delivery form",""
"passed","Wed Jun 05 07:14:32 UTC 2024","Wed Jun 05 07:14:38 UTC 2024","5727","","Enketo Widgets","","","","should submit Enketo Widgets form - People's tab",""
"passed","Wed Jun 05 07:19:38 UTC 2024","Wed Jun 05 07:19:40 UTC 2024","2339","","Unauthorized form","","","","should not display unauthorized error message in contacts tab when user has the form permission",""
"passed","Wed Jun 05 07:19:30 UTC 2024","Wed Jun 05 07:19:34 UTC 2024","3986","","Unauthorized form","","","","""before all"" hook for Unauthorized form",""
"passed","Wed Jun 05 07:18:37 UTC 2024","Wed Jun 05 07:18:38 UTC 2024","1028","","Submit Enketo form","","","","cancelling form with no input does not trigger confirmation dialog",""
"passed","Wed Jun 05 07:19:17 UTC 2024","Wed Jun 05 07:19:18 UTC 2024","999","","Training Cards","","","","should cancel training and not save it as completed",""
"passed","Wed Jun 05 07:18:36 UTC 2024","Wed Jun 05 07:18:37 UTC 2024","1473","","Submit Enketo form","","","","allows forms with required notes to be submitted",""
"passed","Wed Jun 05 07:13:58 UTC 2024","Wed Jun 05 07:14:07 UTC 2024","8470","","Submit a death report","","","","should create and edit a death, verify the report created and the tile from the Targets section.",""
"passed","Wed Jun 05 07:18:58 UTC 2024","Wed Jun 05 07:19:00 UTC 2024","2418","","Submit Z-Score form","","","","""before all"" hook for Submit Z-Score form",""
"passed","Wed Jun 05 07:18:12 UTC 2024","Wed Jun 05 07:18:14 UTC 2024","1681","","RepeatForm: Repeat form with repeat button","","","","should display the initial form and its repeated content in English",""
"passed","Wed Jun 05 07:14:59 UTC 2024","Wed Jun 05 07:15:03 UTC 2024","3610","","Contact Delivery Form","","","","""before all"" hook for Contact Delivery Form",""
"passed","Wed Jun 05 07:19:04 UTC 2024","Wed Jun 05 07:19:08 UTC 2024","4101","","Submit Z-Score form","","","","saves z-score values",""
"passed","Wed Jun 05 07:13:29 UTC 2024","Wed Jun 05 07:13:32 UTC 2024","2685","","Family form","","","","""before all"" hook for Family form",""
"passed","Wed Jun 05 07:14:38 UTC 2024","Wed Jun 05 07:14:42 UTC 2024","4293","","Enketo Widgets","","","","should submit Enketo Widgets form - Report's tab",""
"passed","Wed Jun 05 07:14:51 UTC 2024","Wed Jun 05 07:14:54 UTC 2024","3353","","Extension lib xpath function","","","","calculate average",""
"passed","Wed Jun 05 07:16:34 UTC 2024","Wed Jun 05 07:16:45 UTC 2024","11537","","Pregnancy danger sign follow-up form","","","","should submit and edit Pregnancy danger sign follow-up form with changes",""
"passed","Wed Jun 05 07:19:12 UTC 2024","Wed Jun 05 07:19:17 UTC 2024","4489","","Training Cards","","","","""before all"" hook for Training Cards",""
"passed","Wed Jun 05 07:16:18 UTC 2024","Wed Jun 05 07:16:20 UTC 2024","1829","","Pregnancy danger sign follow-up form","","","","""before all"" hook for Pregnancy danger sign follow-up form",""
"passed","Wed Jun 05 07:18:14 UTC 2024","Wed Jun 05 07:18:16 UTC 2024","2358","","RepeatForm: Repeat form with select","","","","should display the initial form and its repeated content in the default language",""
"passed","Wed Jun 05 07:19:23 UTC 2024","Wed Jun 05 07:19:25 UTC 2024","2086","","Training Cards","","","","should display training after reload and complete training",""
"passed","Wed Jun 05 07:17:42 UTC 2024","Wed Jun 05 07:17:46 UTC 2024","3620","","Pregnancy registration","","","","""before all"" hook for Pregnancy registration",""
"passed","Wed Jun 05 07:16:20 UTC 2024","Wed Jun 05 07:16:28 UTC 2024","7886","","Pregnancy danger sign follow-up form","","","","Submit and validate Pregnancy danger sign follow-up form and keeps the report minified",""
"passed","Wed Jun 05 07:16:28 UTC 2024","Wed Jun 05 07:16:34 UTC 2024","5443","","Pregnancy danger sign follow-up form","","","","should submit and edit Pregnancy danger sign follow-up form (no changes)",""
"passed","Wed Jun 05 07:14:20 UTC 2024","Wed Jun 05 07:14:24 UTC 2024","4053","","Edit report with attachment","","","","should save edits",""
"passed","Wed Jun 05 07:18:44 UTC 2024","Wed Jun 05 07:18:46 UTC 2024","2309","","Submit Photo Upload form","","","","""before all"" hook for Submit Photo Upload form",""
"passed","Wed Jun 05 07:19:00 UTC 2024","Wed Jun 05 07:19:04 UTC 2024","4179","","Submit Z-Score form","","","","Autofills zscore fields with correct values",""
"passed","Wed Jun 05 07:18:50 UTC 2024","Wed Jun 05 07:18:53 UTC 2024","3464","","Submit Photo Upload form","","","","submit and edit (with changes)",""
"passed","Wed Jun 05 07:18:21 UTC 2024","Wed Jun 05 07:18:24 UTC 2024","2388","","Countdown timer widget","","","","""before all"" hook for Countdown timer widget",""
"passed","Wed Jun 05 07:18:10 UTC 2024","Wed Jun 05 07:18:10 UTC 2024","220","","RepeatForm: Repeat form with count input","","","","""after each"" hook for RepeatForm",""
"passed","Wed Jun 05 07:19:34 UTC 2024","Wed Jun 05 07:19:35 UTC 2024","646","","Unauthorized form","","","","should display unauthorized error message in reports tab when form expression does not match",""
"passed","Wed Jun 05 07:13:44 UTC 2024","Wed Jun 05 07:13:48 UTC 2024","3906","","DB Object Widget","","","","""before all"" hook for DB Object Widget",""
"passed","Wed Jun 05 07:18:08 UTC 2024","Wed Jun 05 07:18:10 UTC 2024","1754","","RepeatForm: Repeat form with count input","","","","should display the initial form and its repeated content in English",""
"passed","Wed Jun 05 07:18:14 UTC 2024","Wed Jun 05 07:18:14 UTC 2024","24","","RepeatForm: Repeat form with repeat button","","","","""after each"" hook for RepeatForm",""
"passed","Wed Jun 05 07:13:32 UTC 2024","Wed Jun 05 07:13:40 UTC 2024","7932","","Family form","","","","Submit Add Family form",""
"passed","Wed Jun 05 07:17:46 UTC 2024","Wed Jun 05 07:17:55 UTC 2024","9350","","Pregnancy registration","","","","should submit a new pregnancy, validate that the pregnancy card was displayed with the correct information, validate that all tasks related with the high risk pregnancy were created, validate that the report related the pregnancy was created, and validate that the counters for the active pregnancies and the new pregnancies were updated.",""
"passed","Wed Jun 05 07:14:28 UTC 2024","Wed Jun 05 07:14:32 UTC 2024","3998","","Enketo Widgets","","","","""before all"" hook for Enketo Widgets",""
"passed","Wed Jun 05 07:19:20 UTC 2024","Wed Jun 05 07:19:23 UTC 2024","2226","","Training Cards","","","","should display training after privacy policy",""
"passed","Wed Jun 05 07:16:50 UTC 2024","Wed Jun 05 07:16:54 UTC 2024","4027","","Health Facility ANC Reminder task","","","","""before all"" hook for Health Facility ANC Reminder task",""
