"Status","Start Time","Stop Time","Duration in ms","Parent Suite","Suite","Sub Suite","Test Class","Test Method","Name","Description"
"passed","Fri Feb 23 14:30:24 UTC 2024","Fri Feb 23 14:30:24 UTC 2024","231","","RepeatForm: Repeat form with repeat button","","","","""after each"" hook for RepeatForm",""
"passed","Fri Feb 23 14:31:34 UTC 2024","Fri Feb 23 14:31:34 UTC 2024","411","","Training Cards","","","","should not display completed training",""
"passed","Fri Feb 23 14:30:20 UTC 2024","Fri Feb 23 14:30:22 UTC 2024","1998","","RepeatForm: Repeat form with repeat button","","","","should display the initial form and its repeated content in Swahili",""
"passed","Fri Feb 23 14:31:46 UTC 2024","Fri Feb 23 14:31:49 UTC 2024","2755","","Unauthorized form","","","","should not display unauthorized error message in contacts tab when user has the form permission",""
"passed","Fri Feb 23 14:31:09 UTC 2024","Fri Feb 23 14:31:13 UTC 2024","4181","","Submit Z-Score form","","","","Autofills zscore fields with correct values",""
"passed","Fri Feb 23 14:30:24 UTC 2024","Fri Feb 23 14:30:26 UTC 2024","2276","","RepeatForm: Repeat form with select","","","","should display the initial form and its repeated content in the default language",""
"passed","Fri Feb 23 14:27:23 UTC 2024","Fri Feb 23 14:27:51 UTC 2024","28389","","Contact Delivery Form","","","","open, submit and edit (no changes) default delivery form",""
"passed","Fri Feb 23 14:27:07 UTC 2024","Fri Feb 23 14:27:23 UTC 2024","15676","","Contact Delivery Form","","","","Complete a delivery: Process a delivery with a live child and facility birth, verify that the past pregnancy card is present and the report was created,verify that the child registered during birth is created and displayed the proper information,verify that the targets page is updated",""
"passed","Fri Feb 23 14:29:53 UTC 2024","Fri Feb 23 14:29:56 UTC 2024","3479","","Pregnancy registration","","","","""before all"" hook for Pregnancy registration",""
"passed","Fri Feb 23 14:30:22 UTC 2024","Fri Feb 23 14:30:24 UTC 2024","1966","","RepeatForm: Repeat form with repeat button","","","","should display the initial form and its repeated content in English",""
"passed","Fri Feb 23 14:26:34 UTC 2024","Fri Feb 23 14:26:38 UTC 2024","3922","","Enketo Widgets","","","","""before all"" hook for Enketo Widgets",""
"passed","Fri Feb 23 14:31:43 UTC 2024","Fri Feb 23 14:31:46 UTC 2024","2865","","Unauthorized form","","","","should display unauthorized error message in contacts tab when user does not have form permission",""
"passed","Fri Feb 23 14:32:06 UTC 2024","Fri Feb 23 14:32:15 UTC 2024","9710","","Submit an undo death report","","","","should submit an undo death report, verify that it was registered successfully and verify that the counter for the Deaths, in the targets section, was set to 0.",""
"passed","Fri Feb 23 14:25:38 UTC 2024","Fri Feb 23 14:25:45 UTC 2024","7783","","Family form","","","","Submit Add Family form",""
"passed","Fri Feb 23 14:30:18 UTC 2024","Fri Feb 23 14:30:20 UTC 2024","1945","","RepeatForm: Repeat form with count input","","","","should display the initial form and its repeated content in English",""
"passed","Fri Feb 23 14:25:53 UTC 2024","Fri Feb 23 14:25:57 UTC 2024","3298","","DB Object Widget","","","","should display only the contacts from the parent contact",""
"passed","Fri Feb 23 14:30:20 UTC 2024","Fri Feb 23 14:30:20 UTC 2024","196","","RepeatForm: Repeat form with count input","","","","""after each"" hook for RepeatForm",""
"passed","Fri Feb 23 14:26:52 UTC 2024","Fri Feb 23 14:26:56 UTC 2024","4107","","Extension lib xpath function","","","","""before all"" hook for Extension lib xpath function",""
"passed","Fri Feb 23 14:29:56 UTC 2024","Fri Feb 23 14:30:06 UTC 2024","9586","","Pregnancy registration","","","","should submit a new pregnancy, validate that the pregnancy card was displayed with the correct information, validate that all tasks related with the high risk pregnancy were created, validate that the report related the pregnancy was created, and validate that the counters for the active pregnancies and the new pregnancies were updated.",""
"passed","Fri Feb 23 14:31:39 UTC 2024","Fri Feb 23 14:31:43 UTC 2024","4031","","Unauthorized form","","","","""before all"" hook for Unauthorized form",""
"passed","Fri Feb 23 14:31:22 UTC 2024","Fri Feb 23 14:31:26 UTC 2024","4291","","Training Cards","","","","""before all"" hook for Training Cards",""
"passed","Fri Feb 23 14:28:26 UTC 2024","Fri Feb 23 14:28:34 UTC 2024","7452","","Pregnancy danger sign follow-up form","","","","Submit and validate Pregnancy danger sign follow-up form and keeps the report minified",""
"passed","Fri Feb 23 14:29:16 UTC 2024","Fri Feb 23 14:29:19 UTC 2024","3550","","Pregnancy Visit","","","","""before all"" hook for Pregnancy Visit",""
"passed","Fri Feb 23 14:26:17 UTC 2024","Fri Feb 23 14:26:20 UTC 2024","2776","","Edit report with attachment","","","","""before all"" hook for Edit report with attachment",""
"passed","Fri Feb 23 14:26:20 UTC 2024","Fri Feb 23 14:26:25 UTC 2024","4801","","Edit report with attachment","","","","should remove attachment when saving",""
"passed","Fri Feb 23 14:31:13 UTC 2024","Fri Feb 23 14:31:17 UTC 2024","4185","","Submit Z-Score form","","","","saves z-score values",""
"passed","Fri Feb 23 14:30:53 UTC 2024","Fri Feb 23 14:30:55 UTC 2024","2302","","Submit Photo Upload form","","","","""before all"" hook for Submit Photo Upload form",""
"passed","Fri Feb 23 14:26:04 UTC 2024","Fri Feb 23 14:26:12 UTC 2024","8268","","Submit a death report","","","","should create and edit a death, verify the report created and the tile from the Targets section.",""
"passed","Fri Feb 23 14:31:43 UTC 2024","Fri Feb 23 14:31:43 UTC 2024","645","","Unauthorized form","","","","should display unauthorized error message in reports tab when form expression does not match",""
"passed","Fri Feb 23 14:26:38 UTC 2024","Fri Feb 23 14:26:43 UTC 2024","5735","","Enketo Widgets","","","","should submit Enketo Widgets form - People's tab",""
"passed","Fri Feb 23 14:26:56 UTC 2024","Fri Feb 23 14:26:59 UTC 2024","3019","","Extension lib xpath function","","","","calculate average",""
"passed","Fri Feb 23 14:30:44 UTC 2024","Fri Feb 23 14:30:46 UTC 2024","1518","","Submit Enketo form","","","","allows forms with required notes to be submitted",""
"passed","Fri Feb 23 14:31:53 UTC 2024","Fri Feb 23 14:32:06 UTC 2024","12312","","Submit an undo death report","","","","""before all"" hook for Submit an undo death report",""
"passed","Fri Feb 23 14:30:46 UTC 2024","Fri Feb 23 14:30:47 UTC 2024","1034","","Submit Enketo form","","","","cancelling form with no input does not trigger confirmation dialog",""
"passed","Fri Feb 23 14:30:31 UTC 2024","Fri Feb 23 14:30:33 UTC 2024","2307","","Countdown timer widget","","","","""before all"" hook for Countdown timer widget",""
"passed","Fri Feb 23 14:30:55 UTC 2024","Fri Feb 23 14:30:59 UTC 2024","3683","","Submit Photo Upload form","","","","submit and edit (no changes)",""
"passed","Fri Feb 23 14:27:51 UTC 2024","Fri Feb 23 14:28:18 UTC 2024","26594","","Contact Delivery Form","","","","open, submit and edit default delivery form",""
"passed","Fri Feb 23 14:25:35 UTC 2024","Fri Feb 23 14:25:38 UTC 2024","2485","","Family form","","","","""before all"" hook for Family form",""
"passed","Fri Feb 23 14:29:00 UTC 2024","Fri Feb 23 14:29:09 UTC 2024","9532","","Health Facility ANC Reminder task","","","","should submit the health facility ANC reminder task",""
"passed","Fri Feb 23 14:30:11 UTC 2024","Fri Feb 23 14:30:14 UTC 2024","3226","","RepeatForm","","","","""before all"" hook for RepeatForm",""
"passed","Fri Feb 23 14:31:32 UTC 2024","Fri Feb 23 14:31:34 UTC 2024","1677","","Training Cards","","","","should display training after reload and complete training",""
"passed","Fri Feb 23 14:29:19 UTC 2024","Fri Feb 23 14:29:47 UTC 2024","27593","","Pregnancy Visit","","","","should submit a pregnancy visit and validate that the report was created successfully.",""
"passed","Fri Feb 23 14:30:14 UTC 2024","Fri Feb 23 14:30:17 UTC 2024","2921","","RepeatForm: Repeat form with count input","","","","should display the initial form and its repeated content in Nepali",""
"passed","Fri Feb 23 14:28:24 UTC 2024","Fri Feb 23 14:28:26 UTC 2024","1847","","Pregnancy danger sign follow-up form","","","","""before all"" hook for Pregnancy danger sign follow-up form",""
"passed","Fri Feb 23 14:26:01 UTC 2024","Fri Feb 23 14:26:04 UTC 2024","3093","","Submit a death report","","","","""before all"" hook for Submit a death report",""
"passed","Fri Feb 23 14:31:27 UTC 2024","Fri Feb 23 14:31:30 UTC 2024","2445","","Training Cards","","","","should display training after it was canceled and the training doc was updated",""
"passed","Fri Feb 23 14:30:26 UTC 2024","Fri Feb 23 14:30:27 UTC 2024","224","","RepeatForm: Repeat form with select","","","","""after each"" hook for RepeatForm",""
"passed","Fri Feb 23 14:25:49 UTC 2024","Fri Feb 23 14:25:53 UTC 2024","3944","","DB Object Widget","","","","""before all"" hook for DB Object Widget",""
"passed","Fri Feb 23 14:28:39 UTC 2024","Fri Feb 23 14:28:51 UTC 2024","11666","","Pregnancy danger sign follow-up form","","","","should submit and edit Pregnancy danger sign follow-up form with changes",""
"passed","Fri Feb 23 14:26:43 UTC 2024","Fri Feb 23 14:26:48 UTC 2024","4268","","Enketo Widgets","","","","should submit Enketo Widgets form - Report's tab",""
"passed","Fri Feb 23 14:30:42 UTC 2024","Fri Feb 23 14:30:44 UTC 2024","1881","","Submit Enketo form","","","","submits on reports tab",""
"passed","Fri Feb 23 14:30:33 UTC 2024","Fri Feb 23 14:30:36 UTC 2024","2276","","Countdown timer widget","","","","interact with timer and submit",""
"passed","Fri Feb 23 14:27:04 UTC 2024","Fri Feb 23 14:27:07 UTC 2024","3388","","Contact Delivery Form","","","","""before all"" hook for Contact Delivery Form",""
"passed","Fri Feb 23 14:31:49 UTC 2024","Fri Feb 23 14:31:49 UTC 2024","152","","Unauthorized form","","","","""after each"" hook for Unauthorized form",""
"passed","Fri Feb 23 14:31:26 UTC 2024","Fri Feb 23 14:31:27 UTC 2024","1415","","Training Cards","","","","should cancel training and not save it as completed",""
"passed","Fri Feb 23 14:30:40 UTC 2024","Fri Feb 23 14:30:42 UTC 2024","2525","","Submit Enketo form","","","","""before all"" hook for Submit Enketo form",""
"passed","Fri Feb 23 14:28:34 UTC 2024","Fri Feb 23 14:28:39 UTC 2024","5476","","Pregnancy danger sign follow-up form","","","","should submit and edit Pregnancy danger sign follow-up form (no changes)",""
"passed","Fri Feb 23 14:26:25 UTC 2024","Fri Feb 23 14:26:30 UTC 2024","4881","","Edit report with attachment","","","","should save edits",""
"passed","Fri Feb 23 14:31:30 UTC 2024","Fri Feb 23 14:31:32 UTC 2024","2240","","Training Cards","","","","should display training after privacy policy",""
"passed","Fri Feb 23 14:30:59 UTC 2024","Fri Feb 23 14:31:01 UTC 2024","1519","","Submit Photo Upload form","","","","""before each"" hook for Submit Photo Upload form",""
"passed","Fri Feb 23 14:28:39 UTC 2024","Fri Feb 23 14:28:40 UTC 2024","882","","Pregnancy danger sign follow-up form","","","","""before each"" hook for Pregnancy danger sign follow-up form",""
"passed","Fri Feb 23 14:31:07 UTC 2024","Fri Feb 23 14:31:09 UTC 2024","2423","","Submit Z-Score form","","","","""before all"" hook for Submit Z-Score form",""
"passed","Fri Feb 23 14:30:59 UTC 2024","Fri Feb 23 14:31:02 UTC 2024","3475","","Submit Photo Upload form","","","","submit and edit (with changes)",""
"passed","Fri Feb 23 14:30:47 UTC 2024","Fri Feb 23 14:30:49 UTC 2024","2202","","Submit Enketo form","","","","cancelling form with input triggers confirmation dialog box",""
"passed","Fri Feb 23 14:28:56 UTC 2024","Fri Feb 23 14:29:00 UTC 2024","4049","","Health Facility ANC Reminder task","","","","""before all"" hook for Health Facility ANC Reminder task",""
