"DESCRIPTION","DURATION IN MS","NAME","PARENT SUITE","START TIME","STATUS","STOP TIME","SUB SUITE","SUITE","TEST CLASS","TEST METHOD"
"","1399","should cancel training and not save it as completed","","Tue Sep 23 10:09:18 UTC 2025","passed","Tue Sep 23 10:09:19 UTC 2025","","Training Cards","",""
"","4228","submits on reports tab","","Tue Sep 23 10:08:15 UTC 2025","passed","Tue Sep 23 10:08:19 UTC 2025","","Submit Enketo form","",""
"","7548","should load contacts in non-relevant inputs group and from calculations","","Tue Sep 23 10:00:43 UTC 2025","passed","Tue Sep 23 10:00:51 UTC 2025","","DB Object Widget: Logged in as an offline user","",""
"","6149","should display the initial form and its repeated content in Nepali","","Tue Sep 23 10:07:30 UTC 2025","passed","Tue Sep 23 10:07:37 UTC 2025","","RepeatForm: Repeat form with count input","",""
"","5600","should display training after privacy policy","","Tue Sep 23 10:09:26 UTC 2025","passed","Tue Sep 23 10:09:31 UTC 2025","","Training Cards","",""
"","44000","should submit a pregnancy visit and validate that the report was created successfully.","","Tue Sep 23 10:06:05 UTC 2025","passed","Tue Sep 23 10:06:49 UTC 2025","","Pregnancy Visit","",""
"","10501","should submit an undo death report, verify that it was registered successfully and verify that the counter for the Deaths, in the targets section, was set to 0.","","Tue Sep 23 10:10:17 UTC 2025","passed","Tue Sep 23 10:10:28 UTC 2025","","Submit an undo death report","",""
"","4406","should remove attachment when saving","","Tue Sep 23 10:01:33 UTC 2025","passed","Tue Sep 23 10:01:38 UTC 2025","","Edit report with attachment","",""
"","6602","Autofills zscore fields with correct values","","Tue Sep 23 10:08:55 UTC 2025","passed","Tue Sep 23 10:09:02 UTC 2025","","Submit Z-Score form","",""
"","4288","should display the initial form and its repeated content in English","","Tue Sep 23 10:07:37 UTC 2025","passed","Tue Sep 23 10:07:41 UTC 2025","","RepeatForm: Repeat form with count input","",""
"","10018","Submit Add Family form","","Tue Sep 23 09:59:31 UTC 2025","passed","Tue Sep 23 09:59:41 UTC 2025","","Family form","",""
"","5436","calculate average","","Tue Sep 23 10:02:14 UTC 2025","passed","Tue Sep 23 10:02:20 UTC 2025","","Extension lib xpath function","",""
"","5698","interact with timer and submit","","Tue Sep 23 10:08:02 UTC 2025","passed","Tue Sep 23 10:08:08 UTC 2025","","Countdown timer widget","",""
"","7052","should submit Enketo Widgets form - People's tab","","Tue Sep 23 10:01:52 UTC 2025","passed","Tue Sep 23 10:01:59 UTC 2025","","Enketo Widgets","",""
"","798","should not display completed training","","Tue Sep 23 10:09:34 UTC 2025","passed","Tue Sep 23 10:09:35 UTC 2025","","Training Cards","",""
"","2137","should display confirm message before navigating to different page","","Tue Sep 23 10:09:19 UTC 2025","passed","Tue Sep 23 10:09:22 UTC 2025","","Training Cards","",""
"","21618","Complete a delivery: Process a delivery with a live child and facility birth, verify that the past pregnancy card is present and the report was created,verify that the child registered during birth is created and displayed the proper information,verify that the targets page is updated","","Tue Sep 23 10:02:44 UTC 2025","passed","Tue Sep 23 10:03:05 UTC 2025","","Contact Delivery Form","",""
"","588","should display unauthorized error message in reports tab when form expression does not match","","Tue Sep 23 10:09:44 UTC 2025","passed","Tue Sep 23 10:09:45 UTC 2025","","Unauthorized form","",""
"","6110","should display unauthorized error message in contacts tab when user does not have form permission","","Tue Sep 23 10:09:45 UTC 2025","passed","Tue Sep 23 10:09:51 UTC 2025","","Unauthorized form","",""
"","7292","should submit Enketo Widgets form - Report's tab","","Tue Sep 23 10:01:59 UTC 2025","passed","Tue Sep 23 10:02:06 UTC 2025","","Enketo Widgets","",""
"","5514","should not display unauthorized error message in contacts tab when user has the form permission","","Tue Sep 23 10:09:51 UTC 2025","passed","Tue Sep 23 10:09:57 UTC 2025","","Unauthorized form","",""
"","3958","cancelling form with input triggers confirmation dialog box","","Tue Sep 23 10:08:26 UTC 2025","passed","Tue Sep 23 10:08:30 UTC 2025","","Submit Enketo form","",""
"","1706","should not display training after it was canceled and the training doc was updated","","Tue Sep 23 10:09:24 UTC 2025","passed","Tue Sep 23 10:09:26 UTC 2025","","Training Cards","",""
"","4962","should display the initial form and its repeated content in the default language","","Tue Sep 23 10:07:50 UTC 2025","passed","Tue Sep 23 10:07:55 UTC 2025","","RepeatForm: Repeat form with select","",""
"","8206","should submit and edit Pregnancy danger sign follow-up form (no changes)","","Tue Sep 23 10:05:06 UTC 2025","passed","Tue Sep 23 10:05:14 UTC 2025","","Pregnancy danger sign follow-up form","",""
"","7333","should show form based on summary","","Tue Sep 23 10:10:42 UTC 2025","passed","Tue Sep 23 10:10:49 UTC 2025","","user contact summary in forms","",""
"","4813","should display the initial form and its repeated content in Swahili","","Tue Sep 23 10:07:41 UTC 2025","passed","Tue Sep 23 10:07:46 UTC 2025","","RepeatForm: Repeat form with repeat button","",""
"","4152","should display the initial form and its repeated content in English","","Tue Sep 23 10:07:46 UTC 2025","passed","Tue Sep 23 10:07:50 UTC 2025","","RepeatForm: Repeat form with repeat button","",""
"","46089","open, submit and edit default delivery form","","Tue Sep 23 10:04:00 UTC 2025","passed","Tue Sep 23 10:04:46 UTC 2025","","Contact Delivery Form","",""
"","16286","should create and edit a death, verify the report created and the tile from the Targets section.","","Tue Sep 23 10:01:09 UTC 2025","passed","Tue Sep 23 10:01:25 UTC 2025","","Submit a death report","",""
"","3702","allows forms with required notes to be submitted","","Tue Sep 23 10:08:19 UTC 2025","passed","Tue Sep 23 10:08:23 UTC 2025","","Submit Enketo form","",""
"","5653","submit and edit (no changes)","","Tue Sep 23 10:08:37 UTC 2025","passed","Tue Sep 23 10:08:43 UTC 2025","","Submit Photo Upload form","",""
"","5117","should save edits","","Tue Sep 23 10:01:38 UTC 2025","passed","Tue Sep 23 10:01:43 UTC 2025","","Edit report with attachment","",""
"","5752","submit and edit (with changes)","","Tue Sep 23 10:08:43 UTC 2025","passed","Tue Sep 23 10:08:49 UTC 2025","","Submit Photo Upload form","",""
"","13819","should submit a new pregnancy, validate that the pregnancy card was displayed with the correct information, validate that all tasks related with the high risk pregnancy were created, validate that the report related the pregnancy was created, and validate that the counters for the active pregnancies and the new pregnancies were updated.","","Tue Sep 23 10:07:04 UTC 2025","passed","Tue Sep 23 10:07:17 UTC 2025","","Pregnancy registration","",""
"","10926","Submit and validate Pregnancy danger sign follow-up form and keeps the report minified","","Tue Sep 23 10:04:55 UTC 2025","passed","Tue Sep 23 10:05:06 UTC 2025","","Pregnancy danger sign follow-up form","",""
"","6348","saves z-score values","","Tue Sep 23 10:09:02 UTC 2025","passed","Tue Sep 23 10:09:08 UTC 2025","","Submit Z-Score form","",""
"","3662","cancelling form with no input does not trigger confirmation dialog","","Tue Sep 23 10:08:23 UTC 2025","passed","Tue Sep 23 10:08:26 UTC 2025","","Submit Enketo form","",""
"","14011","should submit the health facility ANC reminder task","","Tue Sep 23 10:05:41 UTC 2025","passed","Tue Sep 23 10:05:55 UTC 2025","","Health Facility ANC Reminder task","",""
"","3126","should display training after reload and complete training","","Tue Sep 23 10:09:31 UTC 2025","passed","Tue Sep 23 10:09:34 UTC 2025","","Training Cards","",""
"","6858","should provide user contact summary to form context","","Tue Sep 23 10:10:49 UTC 2025","passed","Tue Sep 23 10:10:56 UTC 2025","","user contact summary in forms","",""
"","6294","should display only the contacts from the parent contact","","Tue Sep 23 10:00:51 UTC 2025","passed","Tue Sep 23 10:00:57 UTC 2025","","DB Object Widget: Logged in as an offline user","",""
"","6564","should display only the contacts from the parent contact","","Tue Sep 23 10:00:33 UTC 2025","passed","Tue Sep 23 10:00:40 UTC 2025","","DB Object Widget: Logged in as an online user","",""
"","5033","duplicate phone numbers violate constraint when configured in app form","","Tue Sep 23 10:02:27 UTC 2025","passed","Tue Sep 23 10:02:32 UTC 2025","","Phone widget","",""
"","2210","should display confirm message when browser back button is clicked","","Tue Sep 23 10:09:22 UTC 2025","passed","Tue Sep 23 10:09:24 UTC 2025","","Training Cards","",""
"","4004","should load contacts in non-relevant inputs group and from calculations","","Tue Sep 23 10:00:29 UTC 2025","passed","Tue Sep 23 10:00:33 UTC 2025","","DB Object Widget: Logged in as an online user","",""
"","9781","should load all reports","","Tue Sep 23 10:00:06 UTC 2025","passed","Tue Sep 23 10:00:16 UTC 2025","","Contact summary","",""
"","2599","can use duplicate phone number when editing contact with same number","","Tue Sep 23 10:02:32 UTC 2025","passed","Tue Sep 23 10:02:35 UTC 2025","","Phone widget","",""
"","54556","open, submit and edit (no changes) default delivery form","","Tue Sep 23 10:03:05 UTC 2025","passed","Tue Sep 23 10:04:00 UTC 2025","","Contact Delivery Form","",""
"","1586","should hide form based on summary","","Tue Sep 23 10:10:40 UTC 2025","passed","Tue Sep 23 10:10:42 UTC 2025","","user contact summary in forms","",""
"","16950","should submit and edit Pregnancy danger sign follow-up form with changes","","Tue Sep 23 10:05:14 UTC 2025","passed","Tue Sep 23 10:05:31 UTC 2025","","Pregnancy danger sign follow-up form","",""
