"Epic","Feature","Story","FAILED","BROKEN","PASSED","SKIPPED","UNKNOWN"
"","audit log","","0","0","3","0","0"
"","Create user for contacts: user replace: for an offline user","","0","0","10","0","0"
"","Create user when adding contact","","0","0","11","0","0"
"","Muting: for an offline user","","0","0","12","0","0"
"","Service worker cache","","0","0","10","0","0"
"","manifest.json","","0","0","3","0","0"
"","Muting","","0","0","2","0","0"
"","Muting: for an online user","","0","0","4","0","0"
"","Create user for contacts: user replace","","0","0","3","0","0"
"","Create user for contacts","","0","0","1","0","0"
