"Epic","Feature","Story","FAILED","BROKEN","PASSED","SKIPPED","UNKNOWN"
"","Create user for contacts: user replace: for an offline user","","0","0","8","0","0"
"","manifest.json","","0","0","2","0","0"
"","audit log","","0","0","3","0","0"
"","Muting: for an offline user","","0","0","0","9","0"
"","Create user when adding contact","","0","0","8","0","0"
"","Service worker cache","","0","0","7","0","0"
"","Create user for contacts: user replace","","0","0","1","0","0"
"","Muting: for an online user","","0","0","0","1","0"
