"DESCRIPTION","DURATION IN MS","NAME","PARENT SUITE","START TIME","STATUS","STOP TIME","SUB SUITE","SUITE","TEST CLASS","TEST METHOD"
"","1381","should navigate to the Task section and open the first task listed","","Tue Aug 05 19:49:51 UTC 2025","passed","Tue Aug 05 19:49:52 UTC 2025","","Old Navigation","",""
"","442","should have a title","","Tue Aug 05 19:50:57 UTC 2025","passed","Tue Aug 05 19:50:58 UTC 2025","","Login page functionality tests: Log in","",""
"","1391","should cancel training and not save it as completed","","Tue Aug 05 19:52:49 UTC 2025","passed","Tue Aug 05 19:52:50 UTC 2025","","Training Cards","",""
"","903","should not create feedback docs when loading missing reports or people","","Tue Aug 05 19:52:25 UTC 2025","passed","Tue Aug 05 19:52:26 UTC 2025","","Navigation tests: Navigation view: as chw","",""
"","2389","should load reports list when navigating from a report that was opened from reports tab","","Tue Aug 05 19:49:21 UTC 2025","passed","Tue Aug 05 19:49:24 UTC 2025","","Navigation","",""
"","2990","should display training after reload and complete training","","Tue Aug 05 19:53:01 UTC 2025","passed","Tue Aug 05 19:53:04 UTC 2025","","Training Cards","",""
"","1728","should set correct cookies","","Tue Aug 05 19:50:51 UTC 2025","passed","Tue Aug 05 19:50:52 UTC 2025","","Login page functionality tests: Log in","",""
"","499","should open Reports or History tab","","Tue Aug 05 19:51:37 UTC 2025","passed","Tue Aug 05 19:51:38 UTC 2025","","Navigation tests: Navigation functionality","",""
"","1630","should verify confirm password is missing","","Tue Aug 05 19:51:12 UTC 2025","passed","Tue Aug 05 19:51:13 UTC 2025","","Login page functionality tests: Password Reset","",""
"","406","should open Contacts or Peoples tab","","Tue Aug 05 19:51:38 UTC 2025","passed","Tue Aug 05 19:51:38 UTC 2025","","Navigation tests: Navigation functionality","",""
"","66","should display tab labels, when all tabs are enabled","","Tue Aug 05 19:51:40 UTC 2025","passed","Tue Aug 05 19:51:40 UTC 2025","","Navigation tests: Navigation view: as admin","",""
"","506","should try to sign in and verify that credentials were incorrect","","Tue Aug 05 19:51:02 UTC 2025","passed","Tue Aug 05 19:51:03 UTC 2025","","Login page functionality tests: Log in","",""
"","3627","should hide the 'export' and 'edit' options and enable the 'delete' and 'review' options when the sms report is opened","","Tue Aug 05 19:49:02 UTC 2025","passed","Tue Aug 05 19:49:05 UTC 2025","","More Options Menu - Offline User: Report tab","",""
"","1469","should verify password strength","","Tue Aug 05 19:51:15 UTC 2025","passed","Tue Aug 05 19:51:16 UTC 2025","","Login page functionality tests: Password Reset","",""
"","1144","should successfully sync","","Tue Aug 05 19:49:55 UTC 2025","passed","Tue Aug 05 19:49:56 UTC 2025","","Old Navigation","",""
"","2148","should display confirm message before navigating to different page","","Tue Aug 05 19:52:50 UTC 2025","passed","Tue Aug 05 19:52:52 UTC 2025","","Training Cards","",""
"","2184","should navigate to the Messages section and open a sent message","","Tue Aug 05 19:49:49 UTC 2025","passed","Tue Aug 05 19:49:51 UTC 2025","","Old Navigation","",""
"","69","should display tab labels, when some tabs are enabled","","Tue Aug 05 19:52:25 UTC 2025","passed","Tue Aug 05 19:52:25 UTC 2025","","Navigation tests: Navigation view: as chw","",""
"","761","should not display completed training","","Tue Aug 05 19:53:04 UTC 2025","passed","Tue Aug 05 19:53:05 UTC 2025","","Training Cards","",""
"","1378","should verify password and confirm password mismatch","","Tue Aug 05 19:51:22 UTC 2025","passed","Tue Aug 05 19:51:24 UTC 2025","","Login page functionality tests: Password Reset","",""
"","2460","should navigate back to list view and return results when searching by case_id","","Tue Aug 05 19:50:22 UTC 2025","passed","Tue Aug 05 19:50:24 UTC 2025","","Search Reports","",""
"","398","should open tasks tab","","Tue Aug 05 19:51:37 UTC 2025","passed","Tue Aug 05 19:51:37 UTC 2025","","Navigation tests: Navigation functionality","",""
"","2553","should display the ""session expired"" modal and redirect to login page","","Tue Aug 05 19:50:54 UTC 2025","passed","Tue Aug 05 19:50:56 UTC 2025","","Login page functionality tests: Log in","",""
"","2176","should display confirm message when browser back button is clicked","","Tue Aug 05 19:52:52 UTC 2025","passed","Tue Aug 05 19:52:55 UTC 2025","","Training Cards","",""
"","7586","Should delete contact","","Tue Aug 05 19:48:30 UTC 2025","passed","Tue Aug 05 19:48:38 UTC 2025","","Delete Contacts","",""
"","4164","should not display the browser compatibility modal for updated Chrome version","","Tue Aug 05 19:48:19 UTC 2025","passed","Tue Aug 05 19:48:23 UTC 2025","","Browser Compatibility Modal","",""
"","2506","should hide the 'export' option and enable the 'edit', 'delete' and 'review' options when the xml report is opened","","Tue Aug 05 19:49:05 UTC 2025","passed","Tue Aug 05 19:49:08 UTC 2025","","More Options Menu - Offline User: Report tab","",""
"","337","should change locale to Spanish","","Tue Aug 05 19:50:43 UTC 2025","passed","Tue Aug 05 19:50:43 UTC 2025","","Login page functionality tests: Locale","",""
"","903","should navigate to the Reports section and open the first report listed","","Tue Aug 05 19:49:52 UTC 2025","passed","Tue Aug 05 19:49:53 UTC 2025","","Old Navigation","",""
"","3077","Telemetry script is not blocked by Content Security Policy","","Tue Aug 05 19:48:42 UTC 2025","passed","Tue Aug 05 19:48:45 UTC 2025","","Content Security Policy","",""
"","1762","should not display training after it was canceled and the training doc was updated","","Tue Aug 05 19:52:55 UTC 2025","passed","Tue Aug 05 19:52:56 UTC 2025","","Training Cards","",""
"","386","should hide the kebab menu.","","Tue Aug 05 19:48:55 UTC 2025","passed","Tue Aug 05 19:48:55 UTC 2025","","More Options Menu - Offline User: Message tab","",""
"","446","should open Analytics tab","","Tue Aug 05 19:51:38 UTC 2025","passed","Tue Aug 05 19:51:39 UTC 2025","","Navigation tests: Navigation functionality","",""
"","2974","should hide the 'export' and 'edit' options and disable the 'delete' option when the offline user's place is selected","","Tue Aug 05 19:48:59 UTC 2025","passed","Tue Aug 05 19:49:02 UTC 2025","","More Options Menu - Offline User: Contact tab","",""
"","355","should change locale to French","","Tue Aug 05 19:50:41 UTC 2025","passed","Tue Aug 05 19:50:41 UTC 2025","","Login page functionality tests: Locale","",""
"","535","should navigate to the Targets section, and open a target aggregate","","Tue Aug 05 19:49:54 UTC 2025","passed","Tue Aug 05 19:49:55 UTC 2025","","Old Navigation","",""
"","1537","should open a selected report and a no selected report","","Tue Aug 05 19:50:09 UTC 2025","passed","Tue Aug 05 19:50:11 UTC 2025","","Bulk delete reports","",""
"","198","should show locale selector on login page","","Tue Aug 05 19:50:40 UTC 2025","passed","Tue Aug 05 19:50:40 UTC 2025","","Login page functionality tests: Locale","",""
"","2332","should return results matching the search term and then return all data when clearing search","","Tue Aug 05 19:50:20 UTC 2025","passed","Tue Aug 05 19:50:22 UTC 2025","","Search Reports","",""
"","3450","should hide the 'export' option and enable the 'edit' and 'delete' options when a contact is opened","","Tue Aug 05 19:48:55 UTC 2025","passed","Tue Aug 05 19:48:59 UTC 2025","","More Options Menu - Offline User: Contact tab","",""
"","765","should open Messages tab","","Tue Aug 05 19:51:36 UTC 2025","passed","Tue Aug 05 19:51:37 UTC 2025","","Navigation tests: Navigation functionality","",""
"","1166","should verify all fields are missing","","Tue Aug 05 19:51:09 UTC 2025","passed","Tue Aug 05 19:51:11 UTC 2025","","Login page functionality tests: Password Reset","",""
"","1439","should verify current password is not correct","","Tue Aug 05 19:51:17 UTC 2025","passed","Tue Aug 05 19:51:19 UTC 2025","","Login page functionality tests: Password Reset","",""
"","491","should try to sign in with blank password and verify that credentials were incorrect","","Tue Aug 05 19:50:59 UTC 2025","passed","Tue Aug 05 19:50:59 UTC 2025","","Login page functionality tests: Log in","",""
"","2685","should show a warning before log out","","Tue Aug 05 19:50:44 UTC 2025","passed","Tue Aug 05 19:50:47 UTC 2025","","Login page functionality tests: Log out","",""
"","3147","should hide and reveal password value, and login with a revealed password","","Tue Aug 05 19:51:03 UTC 2025","passed","Tue Aug 05 19:51:06 UTC 2025","","Login page functionality tests: Log in","",""
"","900","should display option to send message","","Tue Aug 05 19:50:34 UTC 2025","passed","Tue Aug 05 19:50:35 UTC 2025","","Report - Send message action","",""
"","3049","should load reports list when navigating from a report that was opened from a contact page","","Tue Aug 05 19:49:18 UTC 2025","passed","Tue Aug 05 19:49:21 UTC 2025","","Navigation","",""
"","2912","should display the browser compatibility modal for outdated Chrome version","","Tue Aug 05 19:48:23 UTC 2025","passed","Tue Aug 05 19:48:26 UTC 2025","","Browser Compatibility Modal","",""
"","7215","Should delete report","","Tue Aug 05 19:52:31 UTC 2025","passed","Tue Aug 05 19:52:38 UTC 2025","","Delete Reports","",""
"","843","should navigate to the People section and open the created Health Center","","Tue Aug 05 19:49:53 UTC 2025","passed","Tue Aug 05 19:49:54 UTC 2025","","Old Navigation","",""
"","1769","should log in using username and password fields","","Tue Aug 05 19:50:48 UTC 2025","passed","Tue Aug 05 19:50:50 UTC 2025","","Login page functionality tests: Log in","",""
"","1433","should verify current password cannot be same as new password","","Tue Aug 05 19:51:20 UTC 2025","passed","Tue Aug 05 19:51:21 UTC 2025","","Login page functionality tests: Password Reset","",""
"","4899","should display training after privacy policy","","Tue Aug 05 19:52:56 UTC 2025","passed","Tue Aug 05 19:53:01 UTC 2025","","Training Cards","",""
"","3397","should reset password successfully and redirect to webapp","","Tue Aug 05 19:51:25 UTC 2025","passed","Tue Aug 05 19:51:28 UTC 2025","","Login page functionality tests: Password Reset","",""
"","2893","should select, deselect and delete only selected reports","","Tue Aug 05 19:50:06 UTC 2025","passed","Tue Aug 05 19:50:09 UTC 2025","","Bulk delete reports","",""
"","496","should try to sign in with blank auth and verify that credentials were incorrect","","Tue Aug 05 19:51:01 UTC 2025","passed","Tue Aug 05 19:51:01 UTC 2025","","Login page functionality tests: Log in","",""
