"DESCRIPTION","DURATION IN MS","NAME","PARENT SUITE","START TIME","STATUS","STOP TIME","SUB SUITE","SUITE","TEST CLASS","TEST METHOD"
"","1227","should successfully sync","","Tue Aug 05 10:04:52 UTC 2025","passed","Tue Aug 05 10:04:54 UTC 2025","","Old Navigation","",""
"","397","should open tasks tab","","Tue Aug 05 10:06:34 UTC 2025","passed","Tue Aug 05 10:06:35 UTC 2025","","Navigation tests: Navigation functionality","",""
"","1381","should verify password strength","","Tue Aug 05 10:06:12 UTC 2025","passed","Tue Aug 05 10:06:13 UTC 2025","","Login page functionality tests: Password Reset","",""
"","7023","Should delete report","","Tue Aug 05 10:07:29 UTC 2025","passed","Tue Aug 05 10:07:36 UTC 2025","","Delete Reports","",""
"","3836","should not display the browser compatibility modal for updated Chrome version","","Tue Aug 05 10:03:19 UTC 2025","passed","Tue Aug 05 10:03:22 UTC 2025","","Browser Compatibility Modal","",""
"","1412","should cancel training and not save it as completed","","Tue Aug 05 10:07:46 UTC 2025","passed","Tue Aug 05 10:07:48 UTC 2025","","Training Cards","",""
"","2487","should display the ""session expired"" modal and redirect to login page","","Tue Aug 05 10:05:51 UTC 2025","passed","Tue Aug 05 10:05:54 UTC 2025","","Login page functionality tests: Log in","",""
"","94","should display tab labels, when all tabs are enabled","","Tue Aug 05 10:06:38 UTC 2025","passed","Tue Aug 05 10:06:38 UTC 2025","","Navigation tests: Navigation view: as admin","",""
"","498","should try to sign in with blank auth and verify that credentials were incorrect","","Tue Aug 05 10:05:58 UTC 2025","passed","Tue Aug 05 10:05:59 UTC 2025","","Login page functionality tests: Log in","",""
"","1818","should set correct cookies","","Tue Aug 05 10:05:48 UTC 2025","passed","Tue Aug 05 10:05:50 UTC 2025","","Login page functionality tests: Log in","",""
"","911","should display option to send message","","Tue Aug 05 10:05:31 UTC 2025","passed","Tue Aug 05 10:05:32 UTC 2025","","Report - Send message action","",""
"","6479","Should delete contact","","Tue Aug 05 10:03:30 UTC 2025","passed","Tue Aug 05 10:03:36 UTC 2025","","Delete Contacts","",""
"","2221","should hide and reveal password value, and login with a revealed password","","Tue Aug 05 10:06:01 UTC 2025","passed","Tue Aug 05 10:06:04 UTC 2025","","Login page functionality tests: Log in","",""
"","4674","should display training after privacy policy","","Tue Aug 05 10:07:54 UTC 2025","passed","Tue Aug 05 10:07:58 UTC 2025","","Training Cards","",""
"","2841","should select, deselect and delete only selected reports","","Tue Aug 05 10:05:04 UTC 2025","passed","Tue Aug 05 10:05:07 UTC 2025","","Bulk delete reports","",""
"","3108","should display training after reload and complete training","","Tue Aug 05 10:07:58 UTC 2025","passed","Tue Aug 05 10:08:02 UTC 2025","","Training Cards","",""
"","473","should open Analytics tab","","Tue Aug 05 10:06:36 UTC 2025","passed","Tue Aug 05 10:06:36 UTC 2025","","Navigation tests: Navigation functionality","",""
"","660","should navigate to the Reports section and open the first report listed","","Tue Aug 05 10:04:50 UTC 2025","passed","Tue Aug 05 10:04:51 UTC 2025","","Old Navigation","",""
"","1783","should not display training after it was canceled and the training doc was updated","","Tue Aug 05 10:07:52 UTC 2025","passed","Tue Aug 05 10:07:54 UTC 2025","","Training Cards","",""
"","178","should show locale selector on login page","","Tue Aug 05 10:05:37 UTC 2025","passed","Tue Aug 05 10:05:37 UTC 2025","","Login page functionality tests: Locale","",""
"","4270","should hide the 'export' and 'edit' options and enable the 'delete' and 'review' options when the sms report is opened","","Tue Aug 05 10:03:59 UTC 2025","passed","Tue Aug 05 10:04:03 UTC 2025","","More Options Menu - Offline User: Report tab","",""
"","405","should open Contacts or Peoples tab","","Tue Aug 05 10:06:35 UTC 2025","passed","Tue Aug 05 10:06:36 UTC 2025","","Navigation tests: Navigation functionality","",""
"","987","should not create feedback docs when loading missing reports or people","","Tue Aug 05 10:07:22 UTC 2025","passed","Tue Aug 05 10:07:23 UTC 2025","","Navigation tests: Navigation view: as chw","",""
"","2780","should display the browser compatibility modal for outdated Chrome version","","Tue Aug 05 10:03:23 UTC 2025","passed","Tue Aug 05 10:03:25 UTC 2025","","Browser Compatibility Modal","",""
"","3378","should hide the 'export' and 'edit' options and disable the 'delete' option when the offline user's place is selected","","Tue Aug 05 10:03:55 UTC 2025","passed","Tue Aug 05 10:03:59 UTC 2025","","More Options Menu - Offline User: Contact tab","",""
"","2230","should return results matching the search term and then return all data when clearing search","","Tue Aug 05 10:05:17 UTC 2025","passed","Tue Aug 05 10:05:19 UTC 2025","","Search Reports","",""
"","3055","should load reports list when navigating from a report that was opened from a contact page","","Tue Aug 05 10:04:16 UTC 2025","passed","Tue Aug 05 10:04:19 UTC 2025","","Navigation","",""
"","2457","should navigate back to list view and return results when searching by case_id","","Tue Aug 05 10:05:19 UTC 2025","passed","Tue Aug 05 10:05:22 UTC 2025","","Search Reports","",""
"","2145","should load reports list when navigating from a report that was opened from reports tab","","Tue Aug 05 10:04:19 UTC 2025","passed","Tue Aug 05 10:04:22 UTC 2025","","Navigation","",""
"","846","should navigate to the People section and open the created Health Center","","Tue Aug 05 10:04:51 UTC 2025","passed","Tue Aug 05 10:04:52 UTC 2025","","Old Navigation","",""
"","1462","should verify current password is not correct","","Tue Aug 05 10:06:15 UTC 2025","passed","Tue Aug 05 10:06:16 UTC 2025","","Login page functionality tests: Password Reset","",""
"","486","should try to sign in with blank password and verify that credentials were incorrect","","Tue Aug 05 10:05:56 UTC 2025","passed","Tue Aug 05 10:05:57 UTC 2025","","Login page functionality tests: Log in","",""
"","361","should change locale to French","","Tue Aug 05 10:05:38 UTC 2025","passed","Tue Aug 05 10:05:39 UTC 2025","","Login page functionality tests: Locale","",""
"","668","should open Messages tab","","Tue Aug 05 10:06:34 UTC 2025","passed","Tue Aug 05 10:06:34 UTC 2025","","Navigation tests: Navigation functionality","",""
"","2672","should show a warning before log out","","Tue Aug 05 10:05:41 UTC 2025","passed","Tue Aug 05 10:05:44 UTC 2025","","Login page functionality tests: Log out","",""
"","349","should change locale to Spanish","","Tue Aug 05 10:05:40 UTC 2025","passed","Tue Aug 05 10:05:40 UTC 2025","","Login page functionality tests: Locale","",""
"","2136","should display confirm message before navigating to different page","","Tue Aug 05 10:07:48 UTC 2025","passed","Tue Aug 05 10:07:50 UTC 2025","","Training Cards","",""
"","73","should display tab labels, when some tabs are enabled","","Tue Aug 05 10:07:22 UTC 2025","passed","Tue Aug 05 10:07:22 UTC 2025","","Navigation tests: Navigation view: as chw","",""
"","2244","should navigate to the Messages section and open a sent message","","Tue Aug 05 10:04:47 UTC 2025","passed","Tue Aug 05 10:04:49 UTC 2025","","Old Navigation","",""
"","1455","should open a selected report and a no selected report","","Tue Aug 05 10:05:07 UTC 2025","passed","Tue Aug 05 10:05:08 UTC 2025","","Bulk delete reports","",""
"","2545","should hide the 'export' option and enable the 'edit', 'delete' and 'review' options when the xml report is opened","","Tue Aug 05 10:04:03 UTC 2025","passed","Tue Aug 05 10:04:05 UTC 2025","","More Options Menu - Offline User: Report tab","",""
"","1448","should verify confirm password is missing","","Tue Aug 05 10:06:10 UTC 2025","passed","Tue Aug 05 10:06:11 UTC 2025","","Login page functionality tests: Password Reset","",""
"","1398","should verify current password cannot be same as new password","","Tue Aug 05 10:06:17 UTC 2025","passed","Tue Aug 05 10:06:19 UTC 2025","","Login page functionality tests: Password Reset","",""
"","1422","should verify password and confirm password mismatch","","Tue Aug 05 10:06:20 UTC 2025","passed","Tue Aug 05 10:06:21 UTC 2025","","Login page functionality tests: Password Reset","",""
"","3243","should hide the 'export' option and enable the 'edit' and 'delete' options when a contact is opened","","Tue Aug 05 10:03:52 UTC 2025","passed","Tue Aug 05 10:03:55 UTC 2025","","More Options Menu - Offline User: Contact tab","",""
"","722","should not display completed training","","Tue Aug 05 10:08:02 UTC 2025","passed","Tue Aug 05 10:08:02 UTC 2025","","Training Cards","",""
"","1376","should navigate to the Task section and open the first task listed","","Tue Aug 05 10:04:49 UTC 2025","passed","Tue Aug 05 10:04:50 UTC 2025","","Old Navigation","",""
"","2900","Telemetry script is not blocked by Content Security Policy","","Tue Aug 05 10:03:41 UTC 2025","passed","Tue Aug 05 10:03:44 UTC 2025","","Content Security Policy","",""
"","533","should navigate to the Targets section, and open a target aggregate","","Tue Aug 05 10:04:52 UTC 2025","passed","Tue Aug 05 10:04:52 UTC 2025","","Old Navigation","",""
"","447","should have a title","","Tue Aug 05 10:05:55 UTC 2025","passed","Tue Aug 05 10:05:55 UTC 2025","","Login page functionality tests: Log in","",""
"","1159","should verify all fields are missing","","Tue Aug 05 10:06:07 UTC 2025","passed","Tue Aug 05 10:06:08 UTC 2025","","Login page functionality tests: Password Reset","",""
"","3288","should reset password successfully and redirect to webapp","","Tue Aug 05 10:06:22 UTC 2025","passed","Tue Aug 05 10:06:26 UTC 2025","","Login page functionality tests: Password Reset","",""
"","498","should try to sign in and verify that credentials were incorrect","","Tue Aug 05 10:06:00 UTC 2025","passed","Tue Aug 05 10:06:00 UTC 2025","","Login page functionality tests: Log in","",""
"","292","should hide the kebab menu.","","Tue Aug 05 10:03:52 UTC 2025","passed","Tue Aug 05 10:03:52 UTC 2025","","More Options Menu - Offline User: Message tab","",""
"","2208","should display confirm message when browser back button is clicked","","Tue Aug 05 10:07:50 UTC 2025","passed","Tue Aug 05 10:07:52 UTC 2025","","Training Cards","",""
"","1892","should log in using username and password fields","","Tue Aug 05 10:05:45 UTC 2025","passed","Tue Aug 05 10:05:47 UTC 2025","","Login page functionality tests: Log in","",""
"","496","should open Reports or History tab","","Tue Aug 05 10:06:35 UTC 2025","passed","Tue Aug 05 10:06:35 UTC 2025","","Navigation tests: Navigation functionality","",""
