"DESCRIPTION","DURATION IN MS","NAME","PARENT SUITE","START TIME","STATUS","STOP TIME","SUB SUITE","SUITE","TEST CLASS","TEST METHOD"
"","1489","should verify password strength","","Mon Jul 14 14:05:16 UTC 2025","passed","Mon Jul 14 14:05:18 UTC 2025","","Login page functionality tests: Password Reset","",""
"","1531","should verify password and confirm password mismatch","","Mon Jul 14 14:05:25 UTC 2025","passed","Mon Jul 14 14:05:26 UTC 2025","","Login page functionality tests: Password Reset","",""
"","362","should change locale to Spanish","","Mon Jul 14 14:04:40 UTC 2025","passed","Mon Jul 14 14:04:40 UTC 2025","","Login page functionality tests: Locale","",""
"","3615","should reset password successfully and redirect to webapp","","Mon Jul 14 14:05:27 UTC 2025","passed","Mon Jul 14 14:05:31 UTC 2025","","Login page functionality tests: Password Reset","",""
"","378","should change locale to French","","Mon Jul 14 14:04:38 UTC 2025","passed","Mon Jul 14 14:04:38 UTC 2025","","Login page functionality tests: Locale","",""
"","1491","should cancel training and not save it as completed","","Mon Jul 14 14:06:55 UTC 2025","passed","Mon Jul 14 14:06:56 UTC 2025","","Training Cards","",""
"","7801","Should delete report","","Mon Jul 14 14:06:36 UTC 2025","passed","Mon Jul 14 14:06:44 UTC 2025","","Delete Reports","",""
"","947","should display option to send message","","Mon Jul 14 14:04:30 UTC 2025","passed","Mon Jul 14 14:04:31 UTC 2025","","Report - Send message action","",""
"","2666","should hide the 'export' option and enable the 'edit', 'delete' and 'review' options when the xml report is opened","","Mon Jul 14 14:02:58 UTC 2025","passed","Mon Jul 14 14:03:00 UTC 2025","","More Options Menu - Offline User: Report tab","",""
"","551","should try to sign in and verify that credentials were incorrect","","Mon Jul 14 14:05:02 UTC 2025","passed","Mon Jul 14 14:05:03 UTC 2025","","Login page functionality tests: Log in","",""
"","560","should navigate to the Targets section, and open a target aggregate","","Mon Jul 14 14:03:48 UTC 2025","passed","Mon Jul 14 14:03:49 UTC 2025","","Old Navigation","",""
"","2181","should set correct cookies","","Mon Jul 14 14:04:49 UTC 2025","passed","Mon Jul 14 14:04:51 UTC 2025","","Login page functionality tests: Log in","",""
"","3056","should show a warning before log out","","Mon Jul 14 14:04:41 UTC 2025","passed","Mon Jul 14 14:04:44 UTC 2025","","Login page functionality tests: Log out","",""
"","1556","should verify current password is not correct","","Mon Jul 14 14:05:19 UTC 2025","passed","Mon Jul 14 14:05:20 UTC 2025","","Login page functionality tests: Password Reset","",""
"","2362","should display confirm message before navigating to different page","","Mon Jul 14 14:06:56 UTC 2025","passed","Mon Jul 14 14:06:59 UTC 2025","","Training Cards","",""
"","2133","should log in using username and password fields","","Mon Jul 14 14:04:46 UTC 2025","passed","Mon Jul 14 14:04:48 UTC 2025","","Login page functionality tests: Log in","",""
"","3389","should display the browser compatibility modal for outdated Chrome version","","Mon Jul 14 14:02:14 UTC 2025","passed","Mon Jul 14 14:02:18 UTC 2025","","Browser Compatibility Modal","",""
"","2286","should display confirm message when browser back button is clicked","","Mon Jul 14 14:06:59 UTC 2025","passed","Mon Jul 14 14:07:01 UTC 2025","","Training Cards","",""
"","1622","should open a selected report and a no selected report","","Mon Jul 14 14:04:04 UTC 2025","passed","Mon Jul 14 14:04:06 UTC 2025","","Bulk delete reports","",""
"","2437","should return results matching the search term and then return all data when clearing search","","Mon Jul 14 14:04:15 UTC 2025","passed","Mon Jul 14 14:04:17 UTC 2025","","Search Reports","",""
"","1607","should verify current password cannot be same as new password","","Mon Jul 14 14:05:22 UTC 2025","passed","Mon Jul 14 14:05:23 UTC 2025","","Login page functionality tests: Password Reset","",""
"","4701","should not display the browser compatibility modal for updated Chrome version","","Mon Jul 14 14:02:09 UTC 2025","passed","Mon Jul 14 14:02:14 UTC 2025","","Browser Compatibility Modal","",""
"","181","should show locale selector on login page","","Mon Jul 14 14:04:36 UTC 2025","passed","Mon Jul 14 14:04:37 UTC 2025","","Login page functionality tests: Locale","",""
"","3641","should hide the 'export' and 'edit' options and disable the 'delete' option when the offline user's place is selected","","Mon Jul 14 14:02:50 UTC 2025","passed","Mon Jul 14 14:02:54 UTC 2025","","More Options Menu - Offline User: Contact tab","",""
"","3462","should hide the 'export' option and enable the 'edit' and 'delete' options when a contact is opened","","Mon Jul 14 14:02:47 UTC 2025","passed","Mon Jul 14 14:02:50 UTC 2025","","More Options Menu - Offline User: Contact tab","",""
"","964","should not create feedback docs when loading missing reports or people","","Mon Jul 14 14:06:29 UTC 2025","passed","Mon Jul 14 14:06:30 UTC 2025","","Navigation tests: Navigation view: as chw","",""
"","5142","should display training after privacy policy","","Mon Jul 14 14:07:03 UTC 2025","passed","Mon Jul 14 14:07:08 UTC 2025","","Training Cards","",""
"","881","should navigate to the People section and open the created Health Center","","Mon Jul 14 14:03:47 UTC 2025","passed","Mon Jul 14 14:03:48 UTC 2025","","Old Navigation","",""
"","3945","should hide the 'export' and 'edit' options and enable the 'delete' and 'review' options when the sms report is opened","","Mon Jul 14 14:02:54 UTC 2025","passed","Mon Jul 14 14:02:58 UTC 2025","","More Options Menu - Offline User: Report tab","",""
"","1426","should navigate to the Task section and open the first task listed","","Mon Jul 14 14:03:45 UTC 2025","passed","Mon Jul 14 14:03:47 UTC 2025","","Old Navigation","",""
"","477","should open Analytics tab","","Mon Jul 14 14:05:42 UTC 2025","passed","Mon Jul 14 14:05:42 UTC 2025","","Navigation tests: Navigation functionality","",""
"","6991","Should delete contact","","Mon Jul 14 14:02:23 UTC 2025","passed","Mon Jul 14 14:02:30 UTC 2025","","Delete Contacts","",""
"","2870","should select, deselect and delete only selected reports","","Mon Jul 14 14:04:01 UTC 2025","passed","Mon Jul 14 14:04:04 UTC 2025","","Bulk delete reports","",""
"","540","should open Reports or History tab","","Mon Jul 14 14:05:41 UTC 2025","passed","Mon Jul 14 14:05:41 UTC 2025","","Navigation tests: Navigation functionality","",""
"","558","should try to sign in with blank auth and verify that credentials were incorrect","","Mon Jul 14 14:05:00 UTC 2025","passed","Mon Jul 14 14:05:01 UTC 2025","","Login page functionality tests: Log in","",""
"","3375","should display training after reload and complete training","","Mon Jul 14 14:07:08 UTC 2025","passed","Mon Jul 14 14:07:11 UTC 2025","","Training Cards","",""
"","2680","should hide and reveal password value, and login with a revealed password","","Mon Jul 14 14:05:04 UTC 2025","passed","Mon Jul 14 14:05:07 UTC 2025","","Login page functionality tests: Log in","",""
"","1221","should successfully sync","","Mon Jul 14 14:03:49 UTC 2025","passed","Mon Jul 14 14:03:50 UTC 2025","","Old Navigation","",""
"","932","should navigate to the Reports section and open the first report listed","","Mon Jul 14 14:03:47 UTC 2025","passed","Mon Jul 14 14:03:47 UTC 2025","","Old Navigation","",""
"","78","should display tab labels, when all tabs are enabled","","Mon Jul 14 14:05:44 UTC 2025","passed","Mon Jul 14 14:05:44 UTC 2025","","Navigation tests: Navigation view: as admin","",""
"","2590","should navigate back to list view and return results when searching by case_id","","Mon Jul 14 14:04:17 UTC 2025","passed","Mon Jul 14 14:04:20 UTC 2025","","Search Reports","",""
"","423","should open Contacts or Peoples tab","","Mon Jul 14 14:05:41 UTC 2025","passed","Mon Jul 14 14:05:42 UTC 2025","","Navigation tests: Navigation functionality","",""
"","1626","should verify confirm password is missing","","Mon Jul 14 14:05:13 UTC 2025","passed","Mon Jul 14 14:05:15 UTC 2025","","Login page functionality tests: Password Reset","",""
"","812","should not display completed training","","Mon Jul 14 14:07:11 UTC 2025","passed","Mon Jul 14 14:07:12 UTC 2025","","Training Cards","",""
"","3533","should load reports list when navigating from a report that was opened from a contact page","","Mon Jul 14 14:03:11 UTC 2025","passed","Mon Jul 14 14:03:15 UTC 2025","","Navigation","",""
"","82","should display tab labels, when some tabs are enabled","","Mon Jul 14 14:06:29 UTC 2025","passed","Mon Jul 14 14:06:29 UTC 2025","","Navigation tests: Navigation view: as chw","",""
"","3295","Telemetry script is not blocked by Content Security Policy","","Mon Jul 14 14:02:34 UTC 2025","passed","Mon Jul 14 14:02:38 UTC 2025","","Content Security Policy","",""
"","789","should open Messages tab","","Mon Jul 14 14:05:40 UTC 2025","passed","Mon Jul 14 14:05:40 UTC 2025","","Navigation tests: Navigation functionality","",""
"","352","should hide the kebab menu.","","Mon Jul 14 14:02:46 UTC 2025","passed","Mon Jul 14 14:02:47 UTC 2025","","More Options Menu - Offline User: Message tab","",""
"","2877","should display the ""session expired"" modal and redirect to login page","","Mon Jul 14 14:04:52 UTC 2025","passed","Mon Jul 14 14:04:55 UTC 2025","","Login page functionality tests: Log in","",""
"","555","should try to sign in with blank password and verify that credentials were incorrect","","Mon Jul 14 14:04:58 UTC 2025","passed","Mon Jul 14 14:04:59 UTC 2025","","Login page functionality tests: Log in","",""
"","410","should open tasks tab","","Mon Jul 14 14:05:40 UTC 2025","passed","Mon Jul 14 14:05:41 UTC 2025","","Navigation tests: Navigation functionality","",""
"","1935","should not display training after it was canceled and the training doc was updated","","Mon Jul 14 14:07:01 UTC 2025","passed","Mon Jul 14 14:07:03 UTC 2025","","Training Cards","",""
"","508","should have a title","","Mon Jul 14 14:04:57 UTC 2025","passed","Mon Jul 14 14:04:57 UTC 2025","","Login page functionality tests: Log in","",""
"","1270","should verify all fields are missing","","Mon Jul 14 14:05:11 UTC 2025","passed","Mon Jul 14 14:05:12 UTC 2025","","Login page functionality tests: Password Reset","",""
"","2347","should navigate to the Messages section and open a sent message","","Mon Jul 14 14:03:43 UTC 2025","passed","Mon Jul 14 14:03:45 UTC 2025","","Old Navigation","",""
"","2328","should load reports list when navigating from a report that was opened from reports tab","","Mon Jul 14 14:03:15 UTC 2025","passed","Mon Jul 14 14:03:17 UTC 2025","","Navigation","",""
