"DESCRIPTION","DURATION IN MS","NAME","PARENT SUITE","START TIME","STATUS","STOP TIME","SUB SUITE","SUITE","TEST CLASS","TEST METHOD"
"","3383","should hide the 'export' option and enable the 'edit' and 'delete' options when a contact is opened","","Wed Jun 11 09:51:00 UTC 2025","passed","Wed Jun 11 09:51:04 UTC 2025","","More Options Menu - Offline User: Contact tab","",""
"","3074","should display the browser compatibility modal for outdated Chrome version","","Wed Jun 11 09:50:30 UTC 2025","passed","Wed Jun 11 09:50:33 UTC 2025","","Browser Compatibility Modal","",""
"","2402","should load reports list when navigating from a report that was opened from reports tab","","Wed Jun 11 09:51:27 UTC 2025","passed","Wed Jun 11 09:51:29 UTC 2025","","Navigation","",""
"","890","should navigate to the People section and open the created Health Center","","Wed Jun 11 09:51:59 UTC 2025","passed","Wed Jun 11 09:52:00 UTC 2025","","Old Navigation","",""
"","2418","should return results matching the search term and then return all data when clearing search","","Wed Jun 11 09:52:26 UTC 2025","passed","Wed Jun 11 09:52:28 UTC 2025","","Search Reports","",""
"","2919","Telemetry script is not blocked by Content Security Policy","","Wed Jun 11 09:50:48 UTC 2025","passed","Wed Jun 11 09:50:51 UTC 2025","","Content Security Policy","",""
"","1189","should verify all fields are missing","","Wed Jun 11 09:53:15 UTC 2025","passed","Wed Jun 11 09:53:16 UTC 2025","","Login page functionality tests: Password Reset","",""
"","1433","should verify password and confirm password mismatch","","Wed Jun 11 09:53:27 UTC 2025","passed","Wed Jun 11 09:53:29 UTC 2025","","Login page functionality tests: Password Reset","",""
"","931","should not create feedback docs when loading missing reports or people","","Wed Jun 11 09:54:30 UTC 2025","passed","Wed Jun 11 09:54:31 UTC 2025","","Navigation tests: Navigation view: as chw","",""
"","336","should change locale to Spanish","","Wed Jun 11 09:52:48 UTC 2025","passed","Wed Jun 11 09:52:49 UTC 2025","","Login page functionality tests: Locale","",""
"","5252","should display training after privacy policy","","Wed Jun 11 09:55:02 UTC 2025","passed","Wed Jun 11 09:55:07 UTC 2025","","Training Cards","",""
"","80","should display tab labels, when some tabs are enabled","","Wed Jun 11 09:54:30 UTC 2025","passed","Wed Jun 11 09:54:30 UTC 2025","","Navigation tests: Navigation view: as chw","",""
"","2224","should hide and reveal password value, and login with a revealed password","","Wed Jun 11 09:53:09 UTC 2025","passed","Wed Jun 11 09:53:11 UTC 2025","","Login page functionality tests: Log in","",""
"","702","should open Messages tab","","Wed Jun 11 09:53:41 UTC 2025","passed","Wed Jun 11 09:53:42 UTC 2025","","Navigation tests: Navigation functionality","",""
"","2158","should display confirm message before navigating to different page","","Wed Jun 11 09:54:55 UTC 2025","passed","Wed Jun 11 09:54:58 UTC 2025","","Training Cards","",""
"","6906","Should delete report","","Wed Jun 11 09:54:37 UTC 2025","passed","Wed Jun 11 09:54:44 UTC 2025","","Delete Reports","",""
"","2542","should display the ""session expired"" modal and redirect to login page","","Wed Jun 11 09:52:59 UTC 2025","passed","Wed Jun 11 09:53:02 UTC 2025","","Login page functionality tests: Log in","",""
"","490","should try to sign in and verify that credentials were incorrect","","Wed Jun 11 09:53:08 UTC 2025","passed","Wed Jun 11 09:53:08 UTC 2025","","Login page functionality tests: Log in","",""
"","417","should open Contacts or Peoples tab","","Wed Jun 11 09:53:43 UTC 2025","passed","Wed Jun 11 09:53:43 UTC 2025","","Navigation tests: Navigation functionality","",""
"","178","should show locale selector on login page","","Wed Jun 11 09:52:46 UTC 2025","passed","Wed Jun 11 09:52:46 UTC 2025","","Login page functionality tests: Locale","",""
"","854","should display option to send message","","Wed Jun 11 09:52:40 UTC 2025","passed","Wed Jun 11 09:52:41 UTC 2025","","Report - Send message action","",""
"","2657","should show a warning before log out","","Wed Jun 11 09:52:50 UTC 2025","passed","Wed Jun 11 09:52:53 UTC 2025","","Login page functionality tests: Log out","",""
"","2345","should display confirm message when browser back button is clicked","","Wed Jun 11 09:54:58 UTC 2025","passed","Wed Jun 11 09:55:00 UTC 2025","","Training Cards","",""
"","630","should navigate to the Targets section, and open a target aggregate","","Wed Jun 11 09:52:00 UTC 2025","passed","Wed Jun 11 09:52:00 UTC 2025","","Old Navigation","",""
"","73","should display tab labels, when all tabs are enabled","","Wed Jun 11 09:53:46 UTC 2025","passed","Wed Jun 11 09:53:46 UTC 2025","","Navigation tests: Navigation view: as admin","",""
"","3466","should reset password successfully and redirect to webapp","","Wed Jun 11 09:53:30 UTC 2025","passed","Wed Jun 11 09:53:33 UTC 2025","","Login page functionality tests: Password Reset","",""
"","403","should try to sign in with blank auth and verify that credentials were incorrect","","Wed Jun 11 09:53:06 UTC 2025","passed","Wed Jun 11 09:53:07 UTC 2025","","Login page functionality tests: Log in","",""
"","1680","should set correct cookies","","Wed Jun 11 09:52:57 UTC 2025","passed","Wed Jun 11 09:52:58 UTC 2025","","Login page functionality tests: Log in","",""
"","1367","should verify password strength","","Wed Jun 11 09:53:20 UTC 2025","passed","Wed Jun 11 09:53:21 UTC 2025","","Login page functionality tests: Password Reset","",""
"","1865","should not display training after it was canceled and the training doc was updated","","Wed Jun 11 09:55:00 UTC 2025","passed","Wed Jun 11 09:55:02 UTC 2025","","Training Cards","",""
"","6962","Should delete contact","","Wed Jun 11 09:50:37 UTC 2025","passed","Wed Jun 11 09:50:44 UTC 2025","","Delete Contacts","",""
"","945","should navigate to the Reports section and open the first report listed","","Wed Jun 11 09:51:58 UTC 2025","passed","Wed Jun 11 09:51:59 UTC 2025","","Old Navigation","",""
"","403","should open tasks tab","","Wed Jun 11 09:53:42 UTC 2025","passed","Wed Jun 11 09:53:43 UTC 2025","","Navigation tests: Navigation functionality","",""
"","511","should open Analytics tab","","Wed Jun 11 09:53:43 UTC 2025","passed","Wed Jun 11 09:53:44 UTC 2025","","Navigation tests: Navigation functionality","",""
"","3739","should hide the 'export' and 'edit' options and enable the 'delete' and 'review' options when the sms report is opened","","Wed Jun 11 09:51:07 UTC 2025","passed","Wed Jun 11 09:51:10 UTC 2025","","More Options Menu - Offline User: Report tab","",""
"","2199","should navigate to the Messages section and open a sent message","","Wed Jun 11 09:51:54 UTC 2025","passed","Wed Jun 11 09:51:56 UTC 2025","","Old Navigation","",""
"","2582","should hide the 'export' option and enable the 'edit', 'delete' and 'review' options when the xml report is opened","","Wed Jun 11 09:51:10 UTC 2025","passed","Wed Jun 11 09:51:13 UTC 2025","","More Options Menu - Offline User: Report tab","",""
"","2527","should navigate back to list view and return results when searching by case_id","","Wed Jun 11 09:52:28 UTC 2025","passed","Wed Jun 11 09:52:31 UTC 2025","","Search Reports","",""
"","2924","should hide the 'export' and 'edit' options and disable the 'delete' option when the offline user's place is selected","","Wed Jun 11 09:51:04 UTC 2025","passed","Wed Jun 11 09:51:07 UTC 2025","","More Options Menu - Offline User: Contact tab","",""
"","530","should open Reports or History tab","","Wed Jun 11 09:53:43 UTC 2025","passed","Wed Jun 11 09:53:43 UTC 2025","","Navigation tests: Navigation functionality","",""
"","1429","should verify current password cannot be same as new password","","Wed Jun 11 09:53:25 UTC 2025","passed","Wed Jun 11 09:53:26 UTC 2025","","Login page functionality tests: Password Reset","",""
"","3914","should not display the browser compatibility modal for updated Chrome version","","Wed Jun 11 09:50:25 UTC 2025","passed","Wed Jun 11 09:50:29 UTC 2025","","Browser Compatibility Modal","",""
"","1433","should cancel training and not save it as completed","","Wed Jun 11 09:54:54 UTC 2025","passed","Wed Jun 11 09:54:55 UTC 2025","","Training Cards","",""
"","739","should not display completed training","","Wed Jun 11 09:55:10 UTC 2025","passed","Wed Jun 11 09:55:11 UTC 2025","","Training Cards","",""
"","461","should try to sign in with blank password and verify that credentials were incorrect","","Wed Jun 11 09:53:05 UTC 2025","passed","Wed Jun 11 09:53:05 UTC 2025","","Login page functionality tests: Log in","",""
"","1686","should verify confirm password is missing","","Wed Jun 11 09:53:17 UTC 2025","passed","Wed Jun 11 09:53:19 UTC 2025","","Login page functionality tests: Password Reset","",""
"","403","should hide the kebab menu.","","Wed Jun 11 09:51:00 UTC 2025","passed","Wed Jun 11 09:51:00 UTC 2025","","More Options Menu - Offline User: Message tab","",""
"","1601","should open a selected report and a no selected report","","Wed Jun 11 09:52:15 UTC 2025","passed","Wed Jun 11 09:52:16 UTC 2025","","Bulk delete reports","",""
"","3107","should load reports list when navigating from a report that was opened from a contact page","","Wed Jun 11 09:51:23 UTC 2025","passed","Wed Jun 11 09:51:27 UTC 2025","","Navigation","",""
"","1733","should log in using username and password fields","","Wed Jun 11 09:52:54 UTC 2025","passed","Wed Jun 11 09:52:55 UTC 2025","","Login page functionality tests: Log in","",""
"","363","should change locale to French","","Wed Jun 11 09:52:47 UTC 2025","passed","Wed Jun 11 09:52:47 UTC 2025","","Login page functionality tests: Locale","",""
"","1331","should navigate to the Task section and open the first task listed","","Wed Jun 11 09:51:56 UTC 2025","passed","Wed Jun 11 09:51:58 UTC 2025","","Old Navigation","",""
"","1327","should successfully sync","","Wed Jun 11 09:52:00 UTC 2025","passed","Wed Jun 11 09:52:01 UTC 2025","","Old Navigation","",""
"","1397","should verify current password is not correct","","Wed Jun 11 09:53:22 UTC 2025","passed","Wed Jun 11 09:53:24 UTC 2025","","Login page functionality tests: Password Reset","",""
"","519","should have a title","","Wed Jun 11 09:53:03 UTC 2025","passed","Wed Jun 11 09:53:03 UTC 2025","","Login page functionality tests: Log in","",""
"","3187","should display training after reload and complete training","","Wed Jun 11 09:55:07 UTC 2025","passed","Wed Jun 11 09:55:10 UTC 2025","","Training Cards","",""
"","2927","should select, deselect and delete only selected reports","","Wed Jun 11 09:52:12 UTC 2025","passed","Wed Jun 11 09:52:15 UTC 2025","","Bulk delete reports","",""
