"DESCRIPTION","DURATION IN MS","NAME","PARENT SUITE","START TIME","STATUS","STOP TIME","SUB SUITE","SUITE","TEST CLASS","TEST METHOD"
"","195","should open Analytics tab","","Fri Feb 14 20:17:48 UTC 2025","passed","Fri Feb 14 20:17:48 UTC 2025","","Navigation tests: Navigation functionality","",""
"","499","should try to sign in with blank password and verify that credentials were incorrect","","Fri Feb 14 20:17:11 UTC 2025","passed","Fri Feb 14 20:17:11 UTC 2025","","Login page functionality tests: Log in","",""
"","607","should not display completed training","","Fri Feb 14 20:19:16 UTC 2025","passed","Fri Feb 14 20:19:16 UTC 2025","","Training Cards","",""
"","1330","should cancel training and not save it as completed","","Fri Feb 14 20:18:58 UTC 2025","passed","Fri Feb 14 20:18:59 UTC 2025","","Training Cards","",""
"","1512","should set correct cookies","","Fri Feb 14 20:17:03 UTC 2025","passed","Fri Feb 14 20:17:05 UTC 2025","","Login page functionality tests: Log in","",""
"","1354","should display option to send message","","Fri Feb 14 20:16:46 UTC 2025","passed","Fri Feb 14 20:16:47 UTC 2025","","Report - Send message action","",""
"","1340","should verify password strength","","Fri Feb 14 20:17:25 UTC 2025","passed","Fri Feb 14 20:17:27 UTC 2025","","Login page functionality tests: Password Reset","",""
"","1381","should verify all fields are missing","","Fri Feb 14 20:17:21 UTC 2025","passed","Fri Feb 14 20:17:22 UTC 2025","","Login page functionality tests: Password Reset","",""
"","2136","should open a selected report and a no selected report","","Fri Feb 14 20:16:20 UTC 2025","passed","Fri Feb 14 20:16:22 UTC 2025","","Bulk delete reports","",""
"","2971","should navigate back to list view and return results when searching by case_id","","Fri Feb 14 20:16:34 UTC 2025","passed","Fri Feb 14 20:16:37 UTC 2025","","Search Reports","",""
"","3189","should load reports list when navigating from a report that was opened from a contact page","","Fri Feb 14 20:15:33 UTC 2025","passed","Fri Feb 14 20:15:37 UTC 2025","","Navigation","",""
"","351","should hide the kebab menu.","","Fri Feb 14 20:15:09 UTC 2025","passed","Fri Feb 14 20:15:10 UTC 2025","","More Options Menu - Offline User: Message tab","",""
"","7887","Should delete contact","","Fri Feb 14 20:14:46 UTC 2025","passed","Fri Feb 14 20:14:54 UTC 2025","","Delete Contacts","",""
"","478","should try to sign in and verify that credentials were incorrect","","Fri Feb 14 20:17:14 UTC 2025","passed","Fri Feb 14 20:17:14 UTC 2025","","Login page functionality tests: Log in","",""
"","1311","should verify password and confirm password mismatch","","Fri Feb 14 20:17:33 UTC 2025","passed","Fri Feb 14 20:17:34 UTC 2025","","Login page functionality tests: Password Reset","",""
"","2004","should display confirm message before navigating to different page","","Fri Feb 14 20:18:59 UTC 2025","passed","Fri Feb 14 20:19:01 UTC 2025","","Training Cards","",""
"","378","should change locale to French","","Fri Feb 14 20:16:53 UTC 2025","passed","Fri Feb 14 20:16:54 UTC 2025","","Login page functionality tests: Locale","",""
"","1419","should verify current password cannot be same as new password","","Fri Feb 14 20:17:30 UTC 2025","passed","Fri Feb 14 20:17:32 UTC 2025","","Login page functionality tests: Password Reset","",""
"","4138","should hide the 'export' option and enable the 'edit' and 'delete' options when a contact is opened","","Fri Feb 14 20:15:10 UTC 2025","passed","Fri Feb 14 20:15:14 UTC 2025","","More Options Menu - Offline User: Contact tab","",""
"","2888","Telemetry script is not blocked by Content Security Policy","","Fri Feb 14 20:14:58 UTC 2025","passed","Fri Feb 14 20:15:01 UTC 2025","","Content Security Policy","",""
"","2149","should display the ""session expired"" modal and redirect to login page","","Fri Feb 14 20:17:06 UTC 2025","passed","Fri Feb 14 20:17:08 UTC 2025","","Login page functionality tests: Log in","",""
"","3161","should select, deselect and delete only selected reports","","Fri Feb 14 20:16:17 UTC 2025","passed","Fri Feb 14 20:16:20 UTC 2025","","Bulk delete reports","",""
"","3479","should not display training after it was canceled and the training doc was updated","","Fri Feb 14 20:19:03 UTC 2025","passed","Fri Feb 14 20:19:07 UTC 2025","","Training Cards","",""
"","3177","should display training after reload and complete training","","Fri Feb 14 20:19:12 UTC 2025","passed","Fri Feb 14 20:19:16 UTC 2025","","Training Cards","",""
"","3325","should hide the 'export' and 'edit' options and disable the 'delete' option when the offline user's place is selected","","Fri Feb 14 20:15:14 UTC 2025","passed","Fri Feb 14 20:15:17 UTC 2025","","More Options Menu - Offline User: Contact tab","",""
"","375","should change locale to Spanish","","Fri Feb 14 20:16:55 UTC 2025","passed","Fri Feb 14 20:16:55 UTC 2025","","Login page functionality tests: Locale","",""
"","838","should navigate to the Reports section and open the first report listed","","Fri Feb 14 20:16:03 UTC 2025","passed","Fri Feb 14 20:16:04 UTC 2025","","Old Navigation","",""
"","3302","should show a warning before log out","","Fri Feb 14 20:16:56 UTC 2025","passed","Fri Feb 14 20:17:00 UTC 2025","","Login page functionality tests: Log out","",""
"","1480","should log in using username and password fields","","Fri Feb 14 20:17:01 UTC 2025","passed","Fri Feb 14 20:17:02 UTC 2025","","Login page functionality tests: Log in","",""
"","2024","should hide and reveal password value, and login with a revealed password","","Fri Feb 14 20:17:15 UTC 2025","passed","Fri Feb 14 20:17:17 UTC 2025","","Login page functionality tests: Log in","",""
"","1331","should navigate to the Task section and open the first task listed","","Fri Feb 14 20:16:02 UTC 2025","passed","Fri Feb 14 20:16:03 UTC 2025","","Old Navigation","",""
"","3135","should return results matching the search term and then return all data when clearing search","","Fri Feb 14 20:16:31 UTC 2025","passed","Fri Feb 14 20:16:34 UTC 2025","","Search Reports","",""
"","1386","should verify current password is not correct","","Fri Feb 14 20:17:28 UTC 2025","passed","Fri Feb 14 20:17:29 UTC 2025","","Login page functionality tests: Password Reset","",""
"","2204","should hide the 'export' option and enable the 'edit', 'delete' and 'review' options when the xml report is opened","","Fri Feb 14 20:15:21 UTC 2025","passed","Fri Feb 14 20:15:23 UTC 2025","","More Options Menu - Offline User: Report tab","",""
"","262","should open tasks tab","","Fri Feb 14 20:17:47 UTC 2025","passed","Fri Feb 14 20:17:47 UTC 2025","","Navigation tests: Navigation functionality","",""
"","2283","should load reports list when navigating from a report that was opened from reports tab","","Fri Feb 14 20:15:37 UTC 2025","passed","Fri Feb 14 20:15:39 UTC 2025","","Navigation","",""
"","164","should open Contacts or Peoples tab","","Fri Feb 14 20:17:48 UTC 2025","passed","Fri Feb 14 20:17:48 UTC 2025","","Navigation tests: Navigation functionality","",""
"","77","should display tab labels, when some tabs are enabled","","Fri Feb 14 20:18:34 UTC 2025","passed","Fri Feb 14 20:18:34 UTC 2025","","Navigation tests: Navigation view: as chw","",""
"","3553","should reset password successfully and redirect to webapp","","Fri Feb 14 20:17:35 UTC 2025","passed","Fri Feb 14 20:17:39 UTC 2025","","Login page functionality tests: Password Reset","",""
"","7337","Should delete report","","Fri Feb 14 20:18:40 UTC 2025","passed","Fri Feb 14 20:18:47 UTC 2025","","Delete Reports","",""
"","2686","should display the browser compatibility modal for outdated Chrome version","","Fri Feb 14 20:14:39 UTC 2025","passed","Fri Feb 14 20:14:41 UTC 2025","","Browser Compatibility Modal","",""
"","448","should not create feedback docs when loading missing reports or people","","Fri Feb 14 20:18:34 UTC 2025","passed","Fri Feb 14 20:18:35 UTC 2025","","Navigation tests: Navigation view: as chw","",""
"","113","should display tab labels, when all tabs are enabled","","Fri Feb 14 20:17:49 UTC 2025","passed","Fri Feb 14 20:17:49 UTC 2025","","Navigation tests: Navigation view: as admin","",""
"","5878","should display training after privacy policy","","Fri Feb 14 20:19:07 UTC 2025","passed","Fri Feb 14 20:19:12 UTC 2025","","Training Cards","",""
"","3511","should hide the 'export' and 'edit' options and enable the 'delete' and 'review' options when the sms report is opened","","Fri Feb 14 20:15:17 UTC 2025","passed","Fri Feb 14 20:15:21 UTC 2025","","More Options Menu - Offline User: Report tab","",""
"","730","should open Messages tab","","Fri Feb 14 20:17:46 UTC 2025","passed","Fri Feb 14 20:17:47 UTC 2025","","Navigation tests: Navigation functionality","",""
"","1159","should successfully sync","","Fri Feb 14 20:16:06 UTC 2025","passed","Fri Feb 14 20:16:07 UTC 2025","","Old Navigation","",""
"","199","should show locale selector on login page","","Fri Feb 14 20:16:52 UTC 2025","passed","Fri Feb 14 20:16:52 UTC 2025","","Login page functionality tests: Locale","",""
"","254","should open Reports or History tab","","Fri Feb 14 20:17:47 UTC 2025","passed","Fri Feb 14 20:17:48 UTC 2025","","Navigation tests: Navigation functionality","",""
"","1435","should verify confirm password is missing","","Fri Feb 14 20:17:23 UTC 2025","passed","Fri Feb 14 20:17:24 UTC 2025","","Login page functionality tests: Password Reset","",""
"","313","should navigate to the Targets section, and open a target aggregate","","Fri Feb 14 20:16:06 UTC 2025","passed","Fri Feb 14 20:16:06 UTC 2025","","Old Navigation","",""
"","471","should try to sign in with blank auth and verify that credentials were incorrect","","Fri Feb 14 20:17:12 UTC 2025","passed","Fri Feb 14 20:17:13 UTC 2025","","Login page functionality tests: Log in","",""
"","2659","should navigate to the Messages section and open a sent message","","Fri Feb 14 20:15:59 UTC 2025","passed","Fri Feb 14 20:16:02 UTC 2025","","Old Navigation","",""
"","497","should have a title","","Fri Feb 14 20:17:09 UTC 2025","passed","Fri Feb 14 20:17:09 UTC 2025","","Login page functionality tests: Log in","",""
"","1730","should navigate to the People section and open the created Health Center","","Fri Feb 14 20:16:04 UTC 2025","passed","Fri Feb 14 20:16:06 UTC 2025","","Old Navigation","",""
"","3687","should not display the browser compatibility modal for updated Chrome version","","Fri Feb 14 20:14:35 UTC 2025","passed","Fri Feb 14 20:14:38 UTC 2025","","Browser Compatibility Modal","",""
"","2068","should display confirm message when browser back button is clicked","","Fri Feb 14 20:19:01 UTC 2025","passed","Fri Feb 14 20:19:03 UTC 2025","","Training Cards","",""
