"DESCRIPTION","DURATION IN MS","NAME","PARENT SUITE","START TIME","STATUS","STOP TIME","SUB SUITE","SUITE","TEST CLASS","TEST METHOD"
"","467","should open Contacts or Peoples tab","","Fri May 30 11:00:28 UTC 2025","passed","Fri May 30 11:00:29 UTC 2025","","Navigation tests: Navigation functionality","",""
"","1737","should verify password strength","","Fri May 30 11:00:04 UTC 2025","passed","Fri May 30 11:00:06 UTC 2025","","Login page functionality tests: Password Reset","",""
"","1537","should verify confirm password is missing","","Fri May 30 11:00:01 UTC 2025","passed","Fri May 30 11:00:03 UTC 2025","","Login page functionality tests: Password Reset","",""
"","682","should open Messages tab","","Fri May 30 11:00:26 UTC 2025","passed","Fri May 30 11:00:27 UTC 2025","","Navigation tests: Navigation functionality","",""
"","199","should show locale selector on login page","","Fri May 30 10:59:29 UTC 2025","passed","Fri May 30 10:59:30 UTC 2025","","Login page functionality tests: Locale","",""
"","3122","should select, deselect and delete only selected reports","","Fri May 30 10:58:54 UTC 2025","passed","Fri May 30 10:58:57 UTC 2025","","Bulk delete reports","",""
"","2608","should navigate back to list view and return results when searching by case_id","","Fri May 30 10:59:11 UTC 2025","passed","Fri May 30 10:59:13 UTC 2025","","Search Reports","",""
"","1503","should verify password and confirm password mismatch","","Fri May 30 11:00:12 UTC 2025","passed","Fri May 30 11:00:14 UTC 2025","","Login page functionality tests: Password Reset","",""
"","512","should try to sign in with blank password and verify that credentials were incorrect","","Fri May 30 10:59:48 UTC 2025","passed","Fri May 30 10:59:49 UTC 2025","","Login page functionality tests: Log in","",""
"","3815","should hide the 'export' option and enable the 'edit' and 'delete' options when a contact is opened","","Fri May 30 10:57:41 UTC 2025","passed","Fri May 30 10:57:45 UTC 2025","","More Options Menu - Offline User: Contact tab","",""
"","1277","should successfully sync","","Fri May 30 10:58:42 UTC 2025","passed","Fri May 30 10:58:44 UTC 2025","","Old Navigation","",""
"","81","should display tab labels, when some tabs are enabled","","Fri May 30 11:01:16 UTC 2025","passed","Fri May 30 11:01:16 UTC 2025","","Navigation tests: Navigation view: as chw","",""
"","530","should open Reports or History tab","","Fri May 30 11:00:28 UTC 2025","passed","Fri May 30 11:00:28 UTC 2025","","Navigation tests: Navigation functionality","",""
"","583","should have a title","","Fri May 30 10:59:47 UTC 2025","passed","Fri May 30 10:59:47 UTC 2025","","Login page functionality tests: Log in","",""
"","1437","should cancel training and not save it as completed","","Fri May 30 11:01:39 UTC 2025","passed","Fri May 30 11:01:41 UTC 2025","","Training Cards","",""
"","2277","should navigate to the Messages section and open a sent message","","Fri May 30 10:58:36 UTC 2025","passed","Fri May 30 10:58:38 UTC 2025","","Old Navigation","",""
"","76","should display tab labels, when all tabs are enabled","","Fri May 30 11:00:31 UTC 2025","passed","Fri May 30 11:00:31 UTC 2025","","Navigation tests: Navigation view: as admin","",""
"","3289","should load reports list when navigating from a report that was opened from a contact page","","Fri May 30 10:58:05 UTC 2025","passed","Fri May 30 10:58:08 UTC 2025","","Navigation","",""
"","2172","should display confirm message before navigating to different page","","Fri May 30 11:01:41 UTC 2025","passed","Fri May 30 11:01:43 UTC 2025","","Training Cards","",""
"","1481","should verify current password cannot be same as new password","","Fri May 30 11:00:10 UTC 2025","passed","Fri May 30 11:00:11 UTC 2025","","Login page functionality tests: Password Reset","",""
"","419","should open tasks tab","","Fri May 30 11:00:27 UTC 2025","passed","Fri May 30 11:00:28 UTC 2025","","Navigation tests: Navigation functionality","",""
"","1740","should not display training after it was canceled and the training doc was updated","","Fri May 30 11:01:45 UTC 2025","passed","Fri May 30 11:01:47 UTC 2025","","Training Cards","",""
"","1237","should verify all fields are missing","","Fri May 30 10:59:59 UTC 2025","passed","Fri May 30 11:00:00 UTC 2025","","Login page functionality tests: Password Reset","",""
"","959","should display option to send message","","Fri May 30 10:59:23 UTC 2025","passed","Fri May 30 10:59:24 UTC 2025","","Report - Send message action","",""
"","842","should navigate to the Reports section and open the first report listed","","Fri May 30 10:58:40 UTC 2025","passed","Fri May 30 10:58:41 UTC 2025","","Old Navigation","",""
"","497","should try to sign in with blank auth and verify that credentials were incorrect","","Fri May 30 10:59:50 UTC 2025","passed","Fri May 30 10:59:50 UTC 2025","","Login page functionality tests: Log in","",""
"","3071","should hide the 'export' and 'edit' options and disable the 'delete' option when the offline user's place is selected","","Fri May 30 10:57:45 UTC 2025","passed","Fri May 30 10:57:48 UTC 2025","","More Options Menu - Offline User: Contact tab","",""
"","3606","should reset password successfully and redirect to webapp","","Fri May 30 11:00:15 UTC 2025","passed","Fri May 30 11:00:18 UTC 2025","","Login page functionality tests: Password Reset","",""
"","1808","should set correct cookies","","Fri May 30 10:59:40 UTC 2025","passed","Fri May 30 10:59:42 UTC 2025","","Login page functionality tests: Log in","",""
"","1704","should open a selected report and a no selected report","","Fri May 30 10:58:57 UTC 2025","passed","Fri May 30 10:58:59 UTC 2025","","Bulk delete reports","",""
"","3223","should display training after reload and complete training","","Fri May 30 11:01:52 UTC 2025","passed","Fri May 30 11:01:56 UTC 2025","","Training Cards","",""
"","751","should not display completed training","","Fri May 30 11:01:56 UTC 2025","passed","Fri May 30 11:01:56 UTC 2025","","Training Cards","",""
"","5401","should display training after privacy policy","","Fri May 30 11:01:47 UTC 2025","passed","Fri May 30 11:01:52 UTC 2025","","Training Cards","",""
"","2358","should load reports list when navigating from a report that was opened from reports tab","","Fri May 30 10:58:08 UTC 2025","passed","Fri May 30 10:58:11 UTC 2025","","Navigation","",""
"","1471","should verify current password is not correct","","Fri May 30 11:00:07 UTC 2025","passed","Fri May 30 11:00:08 UTC 2025","","Login page functionality tests: Password Reset","",""
"","2510","should hide the 'export' option and enable the 'edit', 'delete' and 'review' options when the xml report is opened","","Fri May 30 10:57:52 UTC 2025","passed","Fri May 30 10:57:54 UTC 2025","","More Options Menu - Offline User: Report tab","",""
"","2591","should display the ""session expired"" modal and redirect to login page","","Fri May 30 10:59:43 UTC 2025","passed","Fri May 30 10:59:46 UTC 2025","","Login page functionality tests: Log in","",""
"","343","should hide the kebab menu.","","Fri May 30 10:57:41 UTC 2025","passed","Fri May 30 10:57:41 UTC 2025","","More Options Menu - Offline User: Message tab","",""
"","6560","Should delete contact","","Fri May 30 10:57:17 UTC 2025","passed","Fri May 30 10:57:24 UTC 2025","","Delete Contacts","",""
"","2337","should display confirm message when browser back button is clicked","","Fri May 30 11:01:43 UTC 2025","passed","Fri May 30 11:01:45 UTC 2025","","Training Cards","",""
"","573","should navigate to the Targets section, and open a target aggregate","","Fri May 30 10:58:42 UTC 2025","passed","Fri May 30 10:58:42 UTC 2025","","Old Navigation","",""
"","882","should navigate to the People section and open the created Health Center","","Fri May 30 10:58:41 UTC 2025","passed","Fri May 30 10:58:42 UTC 2025","","Old Navigation","",""
"","2373","should hide and reveal password value, and login with a revealed password","","Fri May 30 10:59:53 UTC 2025","passed","Fri May 30 10:59:55 UTC 2025","","Login page functionality tests: Log in","",""
"","286","should change locale to Spanish","","Fri May 30 10:59:32 UTC 2025","passed","Fri May 30 10:59:33 UTC 2025","","Login page functionality tests: Locale","",""
"","491","should try to sign in and verify that credentials were incorrect","","Fri May 30 10:59:51 UTC 2025","passed","Fri May 30 10:59:52 UTC 2025","","Login page functionality tests: Log in","",""
"","2465","should return results matching the search term and then return all data when clearing search","","Fri May 30 10:59:08 UTC 2025","passed","Fri May 30 10:59:11 UTC 2025","","Search Reports","",""
"","3798","should hide the 'export' and 'edit' options and enable the 'delete' and 'review' options when the sms report is opened","","Fri May 30 10:57:48 UTC 2025","passed","Fri May 30 10:57:52 UTC 2025","","More Options Menu - Offline User: Report tab","",""
"","1750","should log in using username and password fields","","Fri May 30 10:59:37 UTC 2025","passed","Fri May 30 10:59:39 UTC 2025","","Login page functionality tests: Log in","",""
"","2986","should display the browser compatibility modal for outdated Chrome version","","Fri May 30 10:57:10 UTC 2025","passed","Fri May 30 10:57:13 UTC 2025","","Browser Compatibility Modal","",""
"","4099","should not display the browser compatibility modal for updated Chrome version","","Fri May 30 10:57:06 UTC 2025","passed","Fri May 30 10:57:10 UTC 2025","","Browser Compatibility Modal","",""
"","310","should change locale to French","","Fri May 30 10:59:31 UTC 2025","passed","Fri May 30 10:59:31 UTC 2025","","Login page functionality tests: Locale","",""
"","3299","Telemetry script is not blocked by Content Security Policy","","Fri May 30 10:57:28 UTC 2025","passed","Fri May 30 10:57:32 UTC 2025","","Content Security Policy","",""
"","946","should not create feedback docs when loading missing reports or people","","Fri May 30 11:01:16 UTC 2025","passed","Fri May 30 11:01:17 UTC 2025","","Navigation tests: Navigation view: as chw","",""
"","485","should open Analytics tab","","Fri May 30 11:00:29 UTC 2025","passed","Fri May 30 11:00:29 UTC 2025","","Navigation tests: Navigation functionality","",""
"","1585","should navigate to the Task section and open the first task listed","","Fri May 30 10:58:38 UTC 2025","passed","Fri May 30 10:58:40 UTC 2025","","Old Navigation","",""
"","2594","should show a warning before log out","","Fri May 30 10:59:34 UTC 2025","passed","Fri May 30 10:59:36 UTC 2025","","Login page functionality tests: Log out","",""
"","7160","Should delete report","","Fri May 30 11:01:22 UTC 2025","passed","Fri May 30 11:01:29 UTC 2025","","Delete Reports","",""
