"DESCRIPTION","DURATION IN MS","NAME","PARENT SUITE","START TIME","STATUS","STOP TIME","SUB SUITE","SUITE","TEST CLASS","TEST METHOD"
"","1502","should log in using username and password fields","","Tue Mar 04 02:02:46 UTC 2025","passed","Tue Mar 04 02:02:48 UTC 2025","","Login page functionality tests: Log in","",""
"","1375","should navigate to the Task section and open the first task listed","","Tue Mar 04 02:01:47 UTC 2025","passed","Tue Mar 04 02:01:48 UTC 2025","","Old Navigation","",""
"","3576","should not display training after it was canceled and the training doc was updated","","Tue Mar 04 02:04:50 UTC 2025","passed","Tue Mar 04 02:04:54 UTC 2025","","Training Cards","",""
"","3104","should navigate to the Messages section and open a sent message","","Tue Mar 04 02:01:44 UTC 2025","passed","Tue Mar 04 02:01:47 UTC 2025","","Old Navigation","",""
"","1582","should navigate to the People section and open the created Health Center","","Tue Mar 04 02:01:49 UTC 2025","passed","Tue Mar 04 02:01:50 UTC 2025","","Old Navigation","",""
"","1744","should verify password strength","","Tue Mar 04 02:03:12 UTC 2025","passed","Tue Mar 04 02:03:14 UTC 2025","","Login page functionality tests: Password Reset","",""
"","3250","should select, deselect and delete only selected reports","","Tue Mar 04 02:02:02 UTC 2025","passed","Tue Mar 04 02:02:05 UTC 2025","","Bulk delete reports","",""
"","309","should change locale to French","","Tue Mar 04 02:02:38 UTC 2025","passed","Tue Mar 04 02:02:39 UTC 2025","","Login page functionality tests: Locale","",""
"","1128","should successfully sync","","Tue Mar 04 02:01:51 UTC 2025","passed","Tue Mar 04 02:01:52 UTC 2025","","Old Navigation","",""
"","471","should not create feedback docs when loading missing reports or people","","Tue Mar 04 02:04:22 UTC 2025","passed","Tue Mar 04 02:04:22 UTC 2025","","Navigation tests: Navigation view: as chw","",""
"","179","should open Contacts or Peoples tab","","Tue Mar 04 02:03:35 UTC 2025","passed","Tue Mar 04 02:03:35 UTC 2025","","Navigation tests: Navigation functionality","",""
"","509","should try to sign in and verify that credentials were incorrect","","Tue Mar 04 02:03:00 UTC 2025","passed","Tue Mar 04 02:03:00 UTC 2025","","Login page functionality tests: Log in","",""
"","579","should not display completed training","","Tue Mar 04 02:05:03 UTC 2025","passed","Tue Mar 04 02:05:04 UTC 2025","","Training Cards","",""
"","3541","should not display the browser compatibility modal for updated Chrome version","","Tue Mar 04 02:00:18 UTC 2025","passed","Tue Mar 04 02:00:21 UTC 2025","","Browser Compatibility Modal","",""
"","481","should have a title","","Tue Mar 04 02:02:55 UTC 2025","passed","Tue Mar 04 02:02:55 UTC 2025","","Login page functionality tests: Log in","",""
"","2415","should load reports list when navigating from a report that was opened from reports tab","","Tue Mar 04 02:01:21 UTC 2025","passed","Tue Mar 04 02:01:23 UTC 2025","","Navigation","",""
"","503","should try to sign in with blank password and verify that credentials were incorrect","","Tue Mar 04 02:02:56 UTC 2025","passed","Tue Mar 04 02:02:57 UTC 2025","","Login page functionality tests: Log in","",""
"","2092","should hide and reveal password value, and login with a revealed password","","Tue Mar 04 02:03:01 UTC 2025","passed","Tue Mar 04 02:03:03 UTC 2025","","Login page functionality tests: Log in","",""
"","8738","Should delete contact","","Tue Mar 04 02:00:30 UTC 2025","passed","Tue Mar 04 02:00:38 UTC 2025","","Delete Contacts","",""
"","1439","should verify current password cannot be same as new password","","Tue Mar 04 02:03:17 UTC 2025","passed","Tue Mar 04 02:03:19 UTC 2025","","Login page functionality tests: Password Reset","",""
"","1357","should verify password and confirm password mismatch","","Tue Mar 04 02:03:20 UTC 2025","passed","Tue Mar 04 02:03:21 UTC 2025","","Login page functionality tests: Password Reset","",""
"","539","should try to sign in with blank auth and verify that credentials were incorrect","","Tue Mar 04 02:02:58 UTC 2025","passed","Tue Mar 04 02:02:59 UTC 2025","","Login page functionality tests: Log in","",""
"","212","should open Analytics tab","","Tue Mar 04 02:03:35 UTC 2025","passed","Tue Mar 04 02:03:35 UTC 2025","","Navigation tests: Navigation functionality","",""
"","986","should open Messages tab","","Tue Mar 04 02:03:34 UTC 2025","passed","Tue Mar 04 02:03:35 UTC 2025","","Navigation tests: Navigation functionality","",""
"","145","should open tasks tab","","Tue Mar 04 02:03:35 UTC 2025","passed","Tue Mar 04 02:03:35 UTC 2025","","Navigation tests: Navigation functionality","",""
"","3325","should display the browser compatibility modal for outdated Chrome version","","Tue Mar 04 02:00:22 UTC 2025","passed","Tue Mar 04 02:00:25 UTC 2025","","Browser Compatibility Modal","",""
"","3284","should load reports list when navigating from a report that was opened from a contact page","","Tue Mar 04 02:01:18 UTC 2025","passed","Tue Mar 04 02:01:21 UTC 2025","","Navigation","",""
"","2360","should hide the 'export' option and enable the 'edit', 'delete' and 'review' options when the xml report is opened","","Tue Mar 04 02:01:05 UTC 2025","passed","Tue Mar 04 02:01:07 UTC 2025","","More Options Menu - Offline User: Report tab","",""
"","129","should display tab labels, when all tabs are enabled","","Tue Mar 04 02:03:37 UTC 2025","passed","Tue Mar 04 02:03:37 UTC 2025","","Navigation tests: Navigation view: as admin","",""
"","314","should hide the kebab menu.","","Tue Mar 04 02:00:54 UTC 2025","passed","Tue Mar 04 02:00:54 UTC 2025","","More Options Menu - Offline User: Message tab","",""
"","4041","should show a warning before log out","","Tue Mar 04 02:02:41 UTC 2025","passed","Tue Mar 04 02:02:45 UTC 2025","","Login page functionality tests: Log out","",""
"","213","should show locale selector on login page","","Tue Mar 04 02:02:37 UTC 2025","passed","Tue Mar 04 02:02:37 UTC 2025","","Login page functionality tests: Locale","",""
"","265","should open Reports or History tab","","Tue Mar 04 02:03:35 UTC 2025","passed","Tue Mar 04 02:03:35 UTC 2025","","Navigation tests: Navigation functionality","",""
"","293","should navigate to the Targets section, and open a target aggregate","","Tue Mar 04 02:01:50 UTC 2025","passed","Tue Mar 04 02:01:51 UTC 2025","","Old Navigation","",""
"","1393","should display option to send message","","Tue Mar 04 02:02:31 UTC 2025","passed","Tue Mar 04 02:02:32 UTC 2025","","Report - Send message action","",""
"","1391","should cancel training and not save it as completed","","Tue Mar 04 02:04:45 UTC 2025","passed","Tue Mar 04 02:04:46 UTC 2025","","Training Cards","",""
"","2244","should display the ""session expired"" modal and redirect to login page","","Tue Mar 04 02:02:51 UTC 2025","passed","Tue Mar 04 02:02:54 UTC 2025","","Login page functionality tests: Log in","",""
"","357","should change locale to Spanish","","Tue Mar 04 02:02:40 UTC 2025","passed","Tue Mar 04 02:02:40 UTC 2025","","Login page functionality tests: Locale","",""
"","1800","should open a selected report and a no selected report","","Tue Mar 04 02:02:05 UTC 2025","passed","Tue Mar 04 02:02:07 UTC 2025","","Bulk delete reports","",""
"","6117","should display training after privacy policy","","Tue Mar 04 02:04:54 UTC 2025","passed","Tue Mar 04 02:05:00 UTC 2025","","Training Cards","",""
"","1452","should verify current password is not correct","","Tue Mar 04 02:03:15 UTC 2025","passed","Tue Mar 04 02:03:16 UTC 2025","","Login page functionality tests: Password Reset","",""
"","3725","should hide the 'export' and 'edit' options and enable the 'delete' and 'review' options when the sms report is opened","","Tue Mar 04 02:01:01 UTC 2025","passed","Tue Mar 04 02:01:05 UTC 2025","","More Options Menu - Offline User: Report tab","",""
"","4157","should hide the 'export' option and enable the 'edit' and 'delete' options when a contact is opened","","Tue Mar 04 02:00:54 UTC 2025","passed","Tue Mar 04 02:00:58 UTC 2025","","More Options Menu - Offline User: Contact tab","",""
"","1429","should verify confirm password is missing","","Tue Mar 04 02:03:09 UTC 2025","passed","Tue Mar 04 02:03:11 UTC 2025","","Login page functionality tests: Password Reset","",""
"","1484","should set correct cookies","","Tue Mar 04 02:02:49 UTC 2025","passed","Tue Mar 04 02:02:50 UTC 2025","","Login page functionality tests: Log in","",""
"","3548","should reset password successfully and redirect to webapp","","Tue Mar 04 02:03:22 UTC 2025","passed","Tue Mar 04 02:03:26 UTC 2025","","Login page functionality tests: Password Reset","",""
"","1443","should verify all fields are missing","","Tue Mar 04 02:03:07 UTC 2025","passed","Tue Mar 04 02:03:08 UTC 2025","","Login page functionality tests: Password Reset","",""
"","7244","Should delete report","","Tue Mar 04 02:04:28 UTC 2025","passed","Tue Mar 04 02:04:35 UTC 2025","","Delete Reports","",""
"","1640","should display confirm message before navigating to different page","","Tue Mar 04 02:04:46 UTC 2025","passed","Tue Mar 04 02:04:48 UTC 2025","","Training Cards","",""
"","2978","should navigate back to list view and return results when searching by case_id","","Tue Mar 04 02:02:19 UTC 2025","passed","Tue Mar 04 02:02:21 UTC 2025","","Search Reports","",""
"","3202","should display training after reload and complete training","","Tue Mar 04 02:05:00 UTC 2025","passed","Tue Mar 04 02:05:03 UTC 2025","","Training Cards","",""
"","2735","should hide the 'export' and 'edit' options and disable the 'delete' option when the offline user's place is selected","","Tue Mar 04 02:00:58 UTC 2025","passed","Tue Mar 04 02:01:01 UTC 2025","","More Options Menu - Offline User: Contact tab","",""
"","74","should display tab labels, when some tabs are enabled","","Tue Mar 04 02:04:22 UTC 2025","passed","Tue Mar 04 02:04:22 UTC 2025","","Navigation tests: Navigation view: as chw","",""
"","2848","Telemetry script is not blocked by Content Security Policy","","Tue Mar 04 02:00:43 UTC 2025","passed","Tue Mar 04 02:00:46 UTC 2025","","Content Security Policy","",""
"","3484","should return results matching the search term and then return all data when clearing search","","Tue Mar 04 02:02:15 UTC 2025","passed","Tue Mar 04 02:02:19 UTC 2025","","Search Reports","",""
"","2135","should display confirm message when browser back button is clicked","","Tue Mar 04 02:04:48 UTC 2025","passed","Tue Mar 04 02:04:50 UTC 2025","","Training Cards","",""
"","733","should navigate to the Reports section and open the first report listed","","Tue Mar 04 02:01:48 UTC 2025","passed","Tue Mar 04 02:01:49 UTC 2025","","Old Navigation","",""
