"DESCRIPTION","DURATION IN MS","NAME","PARENT SUITE","START TIME","STATUS","STOP TIME","SUB SUITE","SUITE","TEST CLASS","TEST METHOD"
"","372","should change locale to French","","Wed Jun 04 16:52:58 UTC 2025","passed","Wed Jun 04 16:52:58 UTC 2025","","Login page functionality tests: Locale","",""
"","2789","should show a warning before log out","","Wed Jun 04 16:53:01 UTC 2025","passed","Wed Jun 04 16:53:03 UTC 2025","","Login page functionality tests: Log out","",""
"","3049","should hide the 'export' and 'edit' options and disable the 'delete' option when the offline user's place is selected","","Wed Jun 04 16:51:14 UTC 2025","passed","Wed Jun 04 16:51:17 UTC 2025","","More Options Menu - Offline User: Contact tab","",""
"","731","should open Messages tab","","Wed Jun 04 16:53:52 UTC 2025","passed","Wed Jun 04 16:53:53 UTC 2025","","Navigation tests: Navigation functionality","",""
"","925","should navigate to the People section and open the created Health Center","","Wed Jun 04 16:52:09 UTC 2025","passed","Wed Jun 04 16:52:10 UTC 2025","","Old Navigation","",""
"","82","should display tab labels, when some tabs are enabled","","Wed Jun 04 16:54:41 UTC 2025","passed","Wed Jun 04 16:54:41 UTC 2025","","Navigation tests: Navigation view: as chw","",""
"","3205","should display training after reload and complete training","","Wed Jun 04 16:55:18 UTC 2025","passed","Wed Jun 04 16:55:21 UTC 2025","","Training Cards","",""
"","5188","should display training after privacy policy","","Wed Jun 04 16:55:13 UTC 2025","passed","Wed Jun 04 16:55:18 UTC 2025","","Training Cards","",""
"","89","should display tab labels, when all tabs are enabled","","Wed Jun 04 16:53:56 UTC 2025","passed","Wed Jun 04 16:53:56 UTC 2025","","Navigation tests: Navigation view: as admin","",""
"","915","should navigate to the Reports section and open the first report listed","","Wed Jun 04 16:52:08 UTC 2025","passed","Wed Jun 04 16:52:09 UTC 2025","","Old Navigation","",""
"","2445","should return results matching the search term and then return all data when clearing search","","Wed Jun 04 16:52:36 UTC 2025","passed","Wed Jun 04 16:52:39 UTC 2025","","Search Reports","",""
"","2141","should display confirm message before navigating to different page","","Wed Jun 04 16:55:07 UTC 2025","passed","Wed Jun 04 16:55:09 UTC 2025","","Training Cards","",""
"","3017","should display the browser compatibility modal for outdated Chrome version","","Wed Jun 04 16:50:39 UTC 2025","passed","Wed Jun 04 16:50:42 UTC 2025","","Browser Compatibility Modal","",""
"","342","should change locale to Spanish","","Wed Jun 04 16:52:59 UTC 2025","passed","Wed Jun 04 16:53:00 UTC 2025","","Login page functionality tests: Locale","",""
"","1459","should verify current password is not correct","","Wed Jun 04 16:53:33 UTC 2025","passed","Wed Jun 04 16:53:35 UTC 2025","","Login page functionality tests: Password Reset","",""
"","2259","should navigate to the Messages section and open a sent message","","Wed Jun 04 16:52:05 UTC 2025","passed","Wed Jun 04 16:52:07 UTC 2025","","Old Navigation","",""
"","2555","should hide the 'export' option and enable the 'edit', 'delete' and 'review' options when the xml report is opened","","Wed Jun 04 16:51:21 UTC 2025","passed","Wed Jun 04 16:51:23 UTC 2025","","More Options Menu - Offline User: Report tab","",""
"","1767","should set correct cookies","","Wed Jun 04 16:53:07 UTC 2025","passed","Wed Jun 04 16:53:09 UTC 2025","","Login page functionality tests: Log in","",""
"","3163","Telemetry script is not blocked by Content Security Policy","","Wed Jun 04 16:50:58 UTC 2025","passed","Wed Jun 04 16:51:01 UTC 2025","","Content Security Policy","",""
"","614","should navigate to the Targets section, and open a target aggregate","","Wed Jun 04 16:52:10 UTC 2025","passed","Wed Jun 04 16:52:11 UTC 2025","","Old Navigation","",""
"","2544","should navigate back to list view and return results when searching by case_id","","Wed Jun 04 16:52:39 UTC 2025","passed","Wed Jun 04 16:52:41 UTC 2025","","Search Reports","",""
"","353","should hide the kebab menu.","","Wed Jun 04 16:51:10 UTC 2025","passed","Wed Jun 04 16:51:10 UTC 2025","","More Options Menu - Offline User: Message tab","",""
"","2251","should hide and reveal password value, and login with a revealed password","","Wed Jun 04 16:53:20 UTC 2025","passed","Wed Jun 04 16:53:22 UTC 2025","","Login page functionality tests: Log in","",""
"","1585","should open a selected report and a no selected report","","Wed Jun 04 16:52:26 UTC 2025","passed","Wed Jun 04 16:52:27 UTC 2025","","Bulk delete reports","",""
"","1452","should verify current password cannot be same as new password","","Wed Jun 04 16:53:36 UTC 2025","passed","Wed Jun 04 16:53:37 UTC 2025","","Login page functionality tests: Password Reset","",""
"","1740","should verify confirm password is missing","","Wed Jun 04 16:53:28 UTC 2025","passed","Wed Jun 04 16:53:30 UTC 2025","","Login page functionality tests: Password Reset","",""
"","2231","should load reports list when navigating from a report that was opened from reports tab","","Wed Jun 04 16:51:37 UTC 2025","passed","Wed Jun 04 16:51:39 UTC 2025","","Navigation","",""
"","3785","should hide the 'export' and 'edit' options and enable the 'delete' and 'review' options when the sms report is opened","","Wed Jun 04 16:51:17 UTC 2025","passed","Wed Jun 04 16:51:21 UTC 2025","","More Options Menu - Offline User: Report tab","",""
"","512","should try to sign in with blank password and verify that credentials were incorrect","","Wed Jun 04 16:53:15 UTC 2025","passed","Wed Jun 04 16:53:16 UTC 2025","","Login page functionality tests: Log in","",""
"","752","should not display completed training","","Wed Jun 04 16:55:21 UTC 2025","passed","Wed Jun 04 16:55:22 UTC 2025","","Training Cards","",""
"","1794","should not display training after it was canceled and the training doc was updated","","Wed Jun 04 16:55:11 UTC 2025","passed","Wed Jun 04 16:55:13 UTC 2025","","Training Cards","",""
"","2964","should select, deselect and delete only selected reports","","Wed Jun 04 16:52:23 UTC 2025","passed","Wed Jun 04 16:52:26 UTC 2025","","Bulk delete reports","",""
"","1395","should verify password and confirm password mismatch","","Wed Jun 04 16:53:38 UTC 2025","passed","Wed Jun 04 16:53:40 UTC 2025","","Login page functionality tests: Password Reset","",""
"","4000","should hide the 'export' option and enable the 'edit' and 'delete' options when a contact is opened","","Wed Jun 04 16:51:10 UTC 2025","passed","Wed Jun 04 16:51:14 UTC 2025","","More Options Menu - Offline User: Contact tab","",""
"","1224","should verify all fields are missing","","Wed Jun 04 16:53:26 UTC 2025","passed","Wed Jun 04 16:53:27 UTC 2025","","Login page functionality tests: Password Reset","",""
"","191","should show locale selector on login page","","Wed Jun 04 16:52:56 UTC 2025","passed","Wed Jun 04 16:52:57 UTC 2025","","Login page functionality tests: Locale","",""
"","467","should have a title","","Wed Jun 04 16:53:14 UTC 2025","passed","Wed Jun 04 16:53:14 UTC 2025","","Login page functionality tests: Log in","",""
"","928","should display option to send message","","Wed Jun 04 16:52:51 UTC 2025","passed","Wed Jun 04 16:52:51 UTC 2025","","Report - Send message action","",""
"","7064","Should delete report","","Wed Jun 04 16:54:48 UTC 2025","passed","Wed Jun 04 16:54:55 UTC 2025","","Delete Reports","",""
"","1773","should log in using username and password fields","","Wed Jun 04 16:53:04 UTC 2025","passed","Wed Jun 04 16:53:06 UTC 2025","","Login page functionality tests: Log in","",""
"","3411","should load reports list when navigating from a report that was opened from a contact page","","Wed Jun 04 16:51:34 UTC 2025","passed","Wed Jun 04 16:51:37 UTC 2025","","Navigation","",""
"","508","should try to sign in and verify that credentials were incorrect","","Wed Jun 04 16:53:18 UTC 2025","passed","Wed Jun 04 16:53:19 UTC 2025","","Login page functionality tests: Log in","",""
"","2435","should display confirm message when browser back button is clicked","","Wed Jun 04 16:55:09 UTC 2025","passed","Wed Jun 04 16:55:11 UTC 2025","","Training Cards","",""
"","1465","should cancel training and not save it as completed","","Wed Jun 04 16:55:05 UTC 2025","passed","Wed Jun 04 16:55:07 UTC 2025","","Training Cards","",""
"","3472","should reset password successfully and redirect to webapp","","Wed Jun 04 16:53:41 UTC 2025","passed","Wed Jun 04 16:53:44 UTC 2025","","Login page functionality tests: Password Reset","",""
"","1481","should verify password strength","","Wed Jun 04 16:53:31 UTC 2025","passed","Wed Jun 04 16:53:32 UTC 2025","","Login page functionality tests: Password Reset","",""
"","937","should not create feedback docs when loading missing reports or people","","Wed Jun 04 16:54:41 UTC 2025","passed","Wed Jun 04 16:54:42 UTC 2025","","Navigation tests: Navigation view: as chw","",""
"","3960","should not display the browser compatibility modal for updated Chrome version","","Wed Jun 04 16:50:35 UTC 2025","passed","Wed Jun 04 16:50:39 UTC 2025","","Browser Compatibility Modal","",""
"","512","should open Analytics tab","","Wed Jun 04 16:53:54 UTC 2025","passed","Wed Jun 04 16:53:55 UTC 2025","","Navigation tests: Navigation functionality","",""
"","419","should open Contacts or Peoples tab","","Wed Jun 04 16:53:54 UTC 2025","passed","Wed Jun 04 16:53:54 UTC 2025","","Navigation tests: Navigation functionality","",""
"","7121","Should delete contact","","Wed Jun 04 16:50:47 UTC 2025","passed","Wed Jun 04 16:50:54 UTC 2025","","Delete Contacts","",""
"","1382","should navigate to the Task section and open the first task listed","","Wed Jun 04 16:52:07 UTC 2025","passed","Wed Jun 04 16:52:08 UTC 2025","","Old Navigation","",""
"","539","should open Reports or History tab","","Wed Jun 04 16:53:53 UTC 2025","passed","Wed Jun 04 16:53:54 UTC 2025","","Navigation tests: Navigation functionality","",""
"","2593","should display the ""session expired"" modal and redirect to login page","","Wed Jun 04 16:53:10 UTC 2025","passed","Wed Jun 04 16:53:13 UTC 2025","","Login page functionality tests: Log in","",""
"","417","should open tasks tab","","Wed Jun 04 16:53:53 UTC 2025","passed","Wed Jun 04 16:53:53 UTC 2025","","Navigation tests: Navigation functionality","",""
"","484","should try to sign in with blank auth and verify that credentials were incorrect","","Wed Jun 04 16:53:17 UTC 2025","passed","Wed Jun 04 16:53:17 UTC 2025","","Login page functionality tests: Log in","",""
"","1272","should successfully sync","","Wed Jun 04 16:52:11 UTC 2025","passed","Wed Jun 04 16:52:12 UTC 2025","","Old Navigation","",""
