"DESCRIPTION","DURATION IN MS","NAME","PARENT SUITE","START TIME","STATUS","STOP TIME","SUB SUITE","SUITE","TEST CLASS","TEST METHOD"
"","2116","should open a selected report and a no selected report","","Wed Mar 26 21:34:05 UTC 2025","passed","Wed Mar 26 21:34:08 UTC 2025","","Bulk delete reports","",""
"","1846","should hide and reveal password value, and login with a revealed password","","Wed Mar 26 21:34:58 UTC 2025","passed","Wed Mar 26 21:34:59 UTC 2025","","Login page functionality tests: Log in","",""
"","2458","should navigate to the Messages section and open a sent message","","Wed Mar 26 21:33:45 UTC 2025","passed","Wed Mar 26 21:33:48 UTC 2025","","Old Navigation","",""
"","3558","should hide the 'export' and 'edit' options and enable the 'delete' and 'review' options when the sms report is opened","","Wed Mar 26 21:33:04 UTC 2025","passed","Wed Mar 26 21:33:07 UTC 2025","","More Options Menu - Offline User: Report tab","",""
"","567","should not display completed training","","Wed Mar 26 21:36:53 UTC 2025","passed","Wed Mar 26 21:36:53 UTC 2025","","Training Cards","",""
"","3311","should hide the 'export' option and enable the 'edit' and 'delete' options when a contact is opened","","Wed Mar 26 21:32:57 UTC 2025","passed","Wed Mar 26 21:33:01 UTC 2025","","More Options Menu - Offline User: Contact tab","",""
"","131","should open tasks tab","","Wed Mar 26 21:35:28 UTC 2025","passed","Wed Mar 26 21:35:28 UTC 2025","","Navigation tests: Navigation functionality","",""
"","1323","should display option to send message","","Wed Mar 26 21:34:30 UTC 2025","passed","Wed Mar 26 21:34:31 UTC 2025","","Report - Send message action","",""
"","238","should open Reports or History tab","","Wed Mar 26 21:35:28 UTC 2025","passed","Wed Mar 26 21:35:28 UTC 2025","","Navigation tests: Navigation functionality","",""
"","1275","should cancel training and not save it as completed","","Wed Mar 26 21:36:36 UTC 2025","passed","Wed Mar 26 21:36:37 UTC 2025","","Training Cards","",""
"","1334","should navigate to the Task section and open the first task listed","","Wed Mar 26 21:33:48 UTC 2025","passed","Wed Mar 26 21:33:49 UTC 2025","","Old Navigation","",""
"","1338","should verify all fields are missing","","Wed Mar 26 21:35:03 UTC 2025","passed","Wed Mar 26 21:35:04 UTC 2025","","Login page functionality tests: Password Reset","",""
"","181","should open Analytics tab","","Wed Mar 26 21:35:28 UTC 2025","passed","Wed Mar 26 21:35:28 UTC 2025","","Navigation tests: Navigation functionality","",""
"","952","should successfully sync","","Wed Mar 26 21:33:52 UTC 2025","passed","Wed Mar 26 21:33:53 UTC 2025","","Old Navigation","",""
"","1983","should display confirm message before navigating to different page","","Wed Mar 26 21:36:37 UTC 2025","passed","Wed Mar 26 21:36:39 UTC 2025","","Training Cards","",""
"","1234","should verify password strength","","Wed Mar 26 21:35:07 UTC 2025","passed","Wed Mar 26 21:35:09 UTC 2025","","Login page functionality tests: Password Reset","",""
"","1310","should set correct cookies","","Wed Mar 26 21:34:47 UTC 2025","passed","Wed Mar 26 21:34:48 UTC 2025","","Login page functionality tests: Log in","",""
"","1513","should navigate to the People section and open the created Health Center","","Wed Mar 26 21:33:50 UTC 2025","passed","Wed Mar 26 21:33:51 UTC 2025","","Old Navigation","",""
"","448","should try to sign in and verify that credentials were incorrect","","Wed Mar 26 21:34:56 UTC 2025","passed","Wed Mar 26 21:34:57 UTC 2025","","Login page functionality tests: Log in","",""
"","254","should navigate to the Targets section, and open a target aggregate","","Wed Mar 26 21:33:51 UTC 2025","passed","Wed Mar 26 21:33:52 UTC 2025","","Old Navigation","",""
"","3410","should not display training after it was canceled and the training doc was updated","","Wed Mar 26 21:36:41 UTC 2025","passed","Wed Mar 26 21:36:44 UTC 2025","","Training Cards","",""
"","2324","should load reports list when navigating from a report that was opened from reports tab","","Wed Mar 26 21:33:23 UTC 2025","passed","Wed Mar 26 21:33:26 UTC 2025","","Navigation","",""
"","370","should change locale to French","","Wed Mar 26 21:34:37 UTC 2025","passed","Wed Mar 26 21:34:37 UTC 2025","","Login page functionality tests: Locale","",""
"","448","should have a title","","Wed Mar 26 21:34:52 UTC 2025","passed","Wed Mar 26 21:34:52 UTC 2025","","Login page functionality tests: Log in","",""
"","2904","should navigate back to list view and return results when searching by case_id","","Wed Mar 26 21:34:18 UTC 2025","passed","Wed Mar 26 21:34:21 UTC 2025","","Search Reports","",""
"","3435","should reset password successfully and redirect to webapp","","Wed Mar 26 21:35:16 UTC 2025","passed","Wed Mar 26 21:35:20 UTC 2025","","Login page functionality tests: Password Reset","",""
"","2908","should hide the 'export' and 'edit' options and disable the 'delete' option when the offline user's place is selected","","Wed Mar 26 21:33:01 UTC 2025","passed","Wed Mar 26 21:33:04 UTC 2025","","More Options Menu - Offline User: Contact tab","",""
"","5441","should display training after privacy policy","","Wed Mar 26 21:36:44 UTC 2025","passed","Wed Mar 26 21:36:50 UTC 2025","","Training Cards","",""
"","1331","should verify confirm password is missing","","Wed Mar 26 21:35:05 UTC 2025","passed","Wed Mar 26 21:35:06 UTC 2025","","Login page functionality tests: Password Reset","",""
"","1352","should verify current password cannot be same as new password","","Wed Mar 26 21:35:12 UTC 2025","passed","Wed Mar 26 21:35:13 UTC 2025","","Login page functionality tests: Password Reset","",""
"","2769","should display training after reload and complete training","","Wed Mar 26 21:36:50 UTC 2025","passed","Wed Mar 26 21:36:53 UTC 2025","","Training Cards","",""
"","1213","should verify password and confirm password mismatch","","Wed Mar 26 21:35:14 UTC 2025","passed","Wed Mar 26 21:35:15 UTC 2025","","Login page functionality tests: Password Reset","",""
"","1242","should verify current password is not correct","","Wed Mar 26 21:35:10 UTC 2025","passed","Wed Mar 26 21:35:11 UTC 2025","","Login page functionality tests: Password Reset","",""
"","70","should display tab labels, when some tabs are enabled","","Wed Mar 26 21:36:14 UTC 2025","passed","Wed Mar 26 21:36:14 UTC 2025","","Navigation tests: Navigation view: as chw","",""
"","3310","should not display the browser compatibility modal for updated Chrome version","","Wed Mar 26 21:32:25 UTC 2025","passed","Wed Mar 26 21:32:28 UTC 2025","","Browser Compatibility Modal","",""
"","3191","should load reports list when navigating from a report that was opened from a contact page","","Wed Mar 26 21:33:20 UTC 2025","passed","Wed Mar 26 21:33:23 UTC 2025","","Navigation","",""
"","2085","should display confirm message when browser back button is clicked","","Wed Mar 26 21:36:39 UTC 2025","passed","Wed Mar 26 21:36:41 UTC 2025","","Training Cards","",""
"","269","should hide the kebab menu.","","Wed Mar 26 21:32:57 UTC 2025","passed","Wed Mar 26 21:32:57 UTC 2025","","More Options Menu - Offline User: Message tab","",""
"","119","should display tab labels, when all tabs are enabled","","Wed Mar 26 21:35:29 UTC 2025","passed","Wed Mar 26 21:35:30 UTC 2025","","Navigation tests: Navigation view: as admin","",""
"","3539","should select, deselect and delete only selected reports","","Wed Mar 26 21:34:02 UTC 2025","passed","Wed Mar 26 21:34:05 UTC 2025","","Bulk delete reports","",""
"","3690","should show a warning before log out","","Wed Mar 26 21:34:39 UTC 2025","passed","Wed Mar 26 21:34:43 UTC 2025","","Login page functionality tests: Log out","",""
"","916","should navigate to the Reports section and open the first report listed","","Wed Mar 26 21:33:49 UTC 2025","passed","Wed Mar 26 21:33:50 UTC 2025","","Old Navigation","",""
"","435","should try to sign in with blank password and verify that credentials were incorrect","","Wed Mar 26 21:34:53 UTC 2025","passed","Wed Mar 26 21:34:54 UTC 2025","","Login page functionality tests: Log in","",""
"","183","should show locale selector on login page","","Wed Mar 26 21:34:36 UTC 2025","passed","Wed Mar 26 21:34:36 UTC 2025","","Login page functionality tests: Locale","",""
"","6779","Should delete report","","Wed Mar 26 21:36:19 UTC 2025","passed","Wed Mar 26 21:36:26 UTC 2025","","Delete Reports","",""
"","7718","Should delete contact","","Wed Mar 26 21:32:36 UTC 2025","passed","Wed Mar 26 21:32:43 UTC 2025","","Delete Contacts","",""
"","3089","should display the browser compatibility modal for outdated Chrome version","","Wed Mar 26 21:32:29 UTC 2025","passed","Wed Mar 26 21:32:32 UTC 2025","","Browser Compatibility Modal","",""
"","318","should change locale to Spanish","","Wed Mar 26 21:34:38 UTC 2025","passed","Wed Mar 26 21:34:39 UTC 2025","","Login page functionality tests: Locale","",""
"","2539","should hide the 'export' option and enable the 'edit', 'delete' and 'review' options when the xml report is opened","","Wed Mar 26 21:33:07 UTC 2025","passed","Wed Mar 26 21:33:10 UTC 2025","","More Options Menu - Offline User: Report tab","",""
"","3145","should return results matching the search term and then return all data when clearing search","","Wed Mar 26 21:34:15 UTC 2025","passed","Wed Mar 26 21:34:18 UTC 2025","","Search Reports","",""
"","1955","should display the ""session expired"" modal and redirect to login page","","Wed Mar 26 21:34:49 UTC 2025","passed","Wed Mar 26 21:34:51 UTC 2025","","Login page functionality tests: Log in","",""
"","1355","should log in using username and password fields","","Wed Mar 26 21:34:44 UTC 2025","passed","Wed Mar 26 21:34:46 UTC 2025","","Login page functionality tests: Log in","",""
"","492","should not create feedback docs when loading missing reports or people","","Wed Mar 26 21:36:14 UTC 2025","passed","Wed Mar 26 21:36:14 UTC 2025","","Navigation tests: Navigation view: as chw","",""
"","183","should open Contacts or Peoples tab","","Wed Mar 26 21:35:28 UTC 2025","passed","Wed Mar 26 21:35:28 UTC 2025","","Navigation tests: Navigation functionality","",""
"","432","should try to sign in with blank auth and verify that credentials were incorrect","","Wed Mar 26 21:34:55 UTC 2025","passed","Wed Mar 26 21:34:55 UTC 2025","","Login page functionality tests: Log in","",""
"","2204","Telemetry script is not blocked by Content Security Policy","","Wed Mar 26 21:32:47 UTC 2025","passed","Wed Mar 26 21:32:50 UTC 2025","","Content Security Policy","",""
"","888","should open Messages tab","","Wed Mar 26 21:35:27 UTC 2025","passed","Wed Mar 26 21:35:28 UTC 2025","","Navigation tests: Navigation functionality","",""
