"Status","Start Time","Stop Time","Duration in ms","Parent Suite","Suite","Sub Suite","Test Class","Test Method","Name","Description"
"passed","Sat Nov 16 14:55:26 UTC 2024","Sat Nov 16 14:55:26 UTC 2024","159","","Navigation tests: Navigation functionality","","","","should open Contacts or Peoples tab",""
"passed","Sat Nov 16 14:54:55 UTC 2024","Sat Nov 16 14:54:55 UTC 2024","327","","Login page funcionality tests: Locale","","","","should change locale to French",""
"passed","Sat Nov 16 14:56:36 UTC 2024","Sat Nov 16 14:56:38 UTC 2024","2110","","Training Cards","","","","should display confirm message before navigating to different page",""
"passed","Sat Nov 16 14:54:21 UTC 2024","Sat Nov 16 14:54:22 UTC 2024","1735","","Bulk delete reports","","","","should open a selected report and a no selected report",""
"passed","Sat Nov 16 14:53:25 UTC 2024","Sat Nov 16 14:53:27 UTC 2024","2292","","More Options Menu - Offline User: Report tab","","","","should hide the 'export' option and enable the 'edit', 'delete' and 'review' options when the xml report is opened",""
"passed","Sat Nov 16 14:55:10 UTC 2024","Sat Nov 16 14:55:10 UTC 2024","456","","Login page funcionality tests: Log in","","","","should have a title",""
"passed","Sat Nov 16 14:54:58 UTC 2024","Sat Nov 16 14:55:01 UTC 2024","3035","","Login page funcionality tests: Log out","","","","should show a warning before log out",""
"passed","Sat Nov 16 14:56:12 UTC 2024","Sat Nov 16 14:56:12 UTC 2024","571","","Navigation tests: Navigation view: as chw","","","","should not create feedback docs when loading missing reports or people",""
"passed","Sat Nov 16 14:56:17 UTC 2024","Sat Nov 16 14:56:24 UTC 2024","6821","","Delete Reports","","","","Should delete report",""
"passed","Sat Nov 16 14:54:54 UTC 2024","Sat Nov 16 14:54:54 UTC 2024","176","","Login page funcionality tests: Locale","","","","should show locale selector on login page",""
"passed","Sat Nov 16 14:56:38 UTC 2024","Sat Nov 16 14:56:40 UTC 2024","2105","","Training Cards","","","","should display confirm message when browser back button is clicked",""
"passed","Sat Nov 16 14:52:37 UTC 2024","Sat Nov 16 14:52:40 UTC 2024","3321","","Browser Compatibility Modal","","","","should not display the browser compatibility modal for updated Chrome version",""
"passed","Sat Nov 16 14:55:26 UTC 2024","Sat Nov 16 14:55:26 UTC 2024","143","","Navigation tests: Navigation functionality","","","","should open tasks tab",""
"passed","Sat Nov 16 14:54:03 UTC 2024","Sat Nov 16 14:54:04 UTC 2024","985","","Old Navigation","","","","should navigate to the Reports section and open the first report listed",""
"passed","Sat Nov 16 14:55:16 UTC 2024","Sat Nov 16 14:55:18 UTC 2024","1899","","Login page funcionality tests: Log in","","","","should hide and reveal password value, and login with a revealed password",""
"passed","Sat Nov 16 14:54:06 UTC 2024","Sat Nov 16 14:54:08 UTC 2024","1530","","Old Navigation","","","","should successfully sync",""
"passed","Sat Nov 16 14:56:12 UTC 2024","Sat Nov 16 14:56:12 UTC 2024","70","","Navigation tests: Navigation view: as chw","","","","should display tab labels, when some tabs are enabled",""
"passed","Sat Nov 16 14:55:27 UTC 2024","Sat Nov 16 14:55:28 UTC 2024","123","","Navigation tests: Navigation view: as admin","","","","should display tab labels, when all tabs are enabled",""
"passed","Sat Nov 16 14:55:14 UTC 2024","Sat Nov 16 14:55:15 UTC 2024","494","","Login page funcionality tests: Log in","","","","should try to sign in and verify that credentials were incorrect",""
"passed","Sat Nov 16 14:55:26 UTC 2024","Sat Nov 16 14:55:26 UTC 2024","192","","Navigation tests: Navigation functionality","","","","should open Analytics tab",""
"passed","Sat Nov 16 14:54:35 UTC 2024","Sat Nov 16 14:54:38 UTC 2024","3152","","Search Reports","","","","should navigate back to list view and return results when searching by case_id",""
"passed","Sat Nov 16 14:54:31 UTC 2024","Sat Nov 16 14:54:35 UTC 2024","3425","","Search Reports","","","","should return results matching the search term and then return all data when clearing search",""
"passed","Sat Nov 16 14:55:13 UTC 2024","Sat Nov 16 14:55:13 UTC 2024","430","","Login page funcionality tests: Log in","","","","should try to sign in with blank auth and verify that credentials were incorrect",""
"passed","Sat Nov 16 14:53:38 UTC 2024","Sat Nov 16 14:53:41 UTC 2024","3364","","Navigation","","","","should load reports list when navigating from a report that was opened from a contact page",""
"passed","Sat Nov 16 14:55:11 UTC 2024","Sat Nov 16 14:55:12 UTC 2024","438","","Login page funcionality tests: Log in","","","","should try to sign in with blank password and verify that credentials were incorrect",""
"passed","Sat Nov 16 14:53:11 UTC 2024","Sat Nov 16 14:53:18 UTC 2024","6206","","More Options Menu - Offline User: Contact tab","","","","should hide the 'export' option and enable the 'edit' and 'delete' options when a contact is opened",""
"passed","Sat Nov 16 14:54:04 UTC 2024","Sat Nov 16 14:54:06 UTC 2024","1534","","Old Navigation","","","","should navigate to the People section and open the created Health Center",""
"passed","Sat Nov 16 14:55:07 UTC 2024","Sat Nov 16 14:55:09 UTC 2024","2031","","Login page funcionality tests: Log in","","","","should display the ""session expired"" modal and redirect to login page",""
"passed","Sat Nov 16 14:53:18 UTC 2024","Sat Nov 16 14:53:21 UTC 2024","3227","","More Options Menu - Offline User: Contact tab","","","","should hide the 'export' and 'edit' options and disable the 'delete' option when the offline user's place is selected",""
"passed","Sat Nov 16 14:55:24 UTC 2024","Sat Nov 16 14:55:26 UTC 2024","1143","","Navigation tests: Navigation functionality","","","","should open Messages tab",""
"passed","Sat Nov 16 14:56:52 UTC 2024","Sat Nov 16 14:56:52 UTC 2024","554","","Training Cards","","","","should not display completed training",""
"passed","Sat Nov 16 14:54:02 UTC 2024","Sat Nov 16 14:54:03 UTC 2024","1364","","Old Navigation","","","","should navigate to the Task section and open the first task listed",""
"passed","Sat Nov 16 14:53:41 UTC 2024","Sat Nov 16 14:53:44 UTC 2024","2442","","Navigation","","","","should load reports list when navigating from a report that was opened from reports tab",""
"passed","Sat Nov 16 14:54:47 UTC 2024","Sat Nov 16 14:54:49 UTC 2024","1482","","Report - Send message action","","","","should display option to send message",""
"passed","Sat Nov 16 14:53:11 UTC 2024","Sat Nov 16 14:53:11 UTC 2024","297","","More Options Menu - Offline User: Message tab","","","","should hide the kebab menu.",""
"passed","Sat Nov 16 14:56:43 UTC 2024","Sat Nov 16 14:56:49 UTC 2024","5484","","Training Cards","","","","should display training after privacy policy",""
"passed","Sat Nov 16 14:52:49 UTC 2024","Sat Nov 16 14:52:57 UTC 2024","8214","","Delete Contacts","","","","Should delete contact",""
"passed","Sat Nov 16 14:53:59 UTC 2024","Sat Nov 16 14:54:02 UTC 2024","3004","","Old Navigation","","","","should navigate to the Messages section and open a sent message",""
"passed","Sat Nov 16 14:54:06 UTC 2024","Sat Nov 16 14:54:06 UTC 2024","313","","Old Navigation","","","","should navigate to the Targets section, and open a target aggregate",""
"passed","Sat Nov 16 14:55:02 UTC 2024","Sat Nov 16 14:55:03 UTC 2024","1455","","Login page funcionality tests: Log in","","","","should log in using username and password fields",""
"passed","Sat Nov 16 14:53:21 UTC 2024","Sat Nov 16 14:53:25 UTC 2024","3782","","More Options Menu - Offline User: Report tab","","","","should hide the 'export' and 'edit' options and enable the 'delete' and 'review' options when the sms report is opened",""
"passed","Sat Nov 16 14:52:41 UTC 2024","Sat Nov 16 14:52:44 UTC 2024","3171","","Browser Compatibility Modal","","","","should display the browser compatibility modal for outdated Chrome version",""
"passed","Sat Nov 16 14:54:17 UTC 2024","Sat Nov 16 14:54:21 UTC 2024","3759","","Bulk delete reports","","","","should select, deselect and delete only selected reports",""
"passed","Sat Nov 16 14:56:34 UTC 2024","Sat Nov 16 14:56:36 UTC 2024","1461","","Training Cards","","","","should cancel training and not save it as completed",""
"passed","Sat Nov 16 14:54:56 UTC 2024","Sat Nov 16 14:54:57 UTC 2024","343","","Login page funcionality tests: Locale","","","","should change locale to Spanish",""
"passed","Sat Nov 16 14:56:40 UTC 2024","Sat Nov 16 14:56:43 UTC 2024","3259","","Training Cards","","","","should not display training after it was canceled and the training doc was updated",""
"passed","Sat Nov 16 14:53:01 UTC 2024","Sat Nov 16 14:53:04 UTC 2024","2734","","Content Security Policy","","","","Telemetry script is not blocked by Content Security Policy",""
"passed","Sat Nov 16 14:56:49 UTC 2024","Sat Nov 16 14:56:52 UTC 2024","3136","","Training Cards","","","","should display training after reload and complete training",""
"passed","Sat Nov 16 14:55:26 UTC 2024","Sat Nov 16 14:55:26 UTC 2024","333","","Navigation tests: Navigation functionality","","","","should open Reports or History tab",""
"passed","Sat Nov 16 14:55:04 UTC 2024","Sat Nov 16 14:55:06 UTC 2024","1486","","Login page funcionality tests: Log in","","","","should set correct cookies",""
