"Status","Start Time","Stop Time","Duration in ms","Parent Suite","Suite","Sub Suite","Test Class","Test Method","Name","Description"
"passed","Fri Oct 18 12:00:49 UTC 2024","Fri Oct 18 12:00:49 UTC 2024","171","","Navigation tests: Navigation functionality","","","","should open Contacts or Peoples tab",""
"passed","Fri Oct 18 12:02:03 UTC 2024","Fri Oct 18 12:02:06 UTC 2024","3175","","Training Cards","","","","should not display training after it was canceled and the training doc was updated",""
"passed","Fri Oct 18 12:01:57 UTC 2024","Fri Oct 18 12:01:59 UTC 2024","1448","","Training Cards","","","","should cancel training and not save it as completed",""
"passed","Fri Oct 18 12:00:25 UTC 2024","Fri Oct 18 12:00:26 UTC 2024","1394","","Login page funcionality tests: Log in","","","","should log in using username and password fields",""
"passed","Fri Oct 18 11:59:39 UTC 2024","Fri Oct 18 11:59:42 UTC 2024","3156","","Bulk delete reports","","","","should select, deselect and delete only selected reports",""
"passed","Fri Oct 18 12:00:20 UTC 2024","Fri Oct 18 12:00:23 UTC 2024","3037","","Login page funcionality tests: Log out","","","","should show a warning before log out",""
"passed","Fri Oct 18 12:00:27 UTC 2024","Fri Oct 18 12:00:29 UTC 2024","1457","","Login page funcionality tests: Log in","","","","should set correct cookies",""
"passed","Fri Oct 18 12:00:10 UTC 2024","Fri Oct 18 12:00:11 UTC 2024","1428","","Report - Send message action","","","","should display option to send message",""
"passed","Fri Oct 18 12:00:37 UTC 2024","Fri Oct 18 12:00:38 UTC 2024","487","","Login page funcionality tests: Log in","","","","should try to sign in and verify that credentials were incorrect",""
"passed","Fri Oct 18 11:58:37 UTC 2024","Fri Oct 18 11:58:39 UTC 2024","2103","","More Options Menu - Offline User: Contact tab","","","","should hide the 'export' and 'edit' options and disable the 'delete' option when the offline user's place is selected",""
"passed","Fri Oct 18 11:58:34 UTC 2024","Fri Oct 18 11:58:34 UTC 2024","530","","More Options Menu - Offline User: Message tab","","","","should hide the kebab menu.",""
"passed","Fri Oct 18 12:00:16 UTC 2024","Fri Oct 18 12:00:17 UTC 2024","165","","Login page funcionality tests: Locale","","","","should show locale selector on login page",""
"passed","Fri Oct 18 11:58:39 UTC 2024","Fri Oct 18 11:58:41 UTC 2024","2369","","More Options Menu - Offline User: Report tab","","","","should hide the 'export' and 'edit' options and enable the 'delete' and 'review' options when the sms report is opened",""
"passed","Fri Oct 18 11:59:57 UTC 2024","Fri Oct 18 12:00:00 UTC 2024","2942","","Search Reports","","","","should navigate back to list view and return results when searching by case_id",""
"passed","Fri Oct 18 12:00:33 UTC 2024","Fri Oct 18 12:00:33 UTC 2024","476","","Login page funcionality tests: Log in","","","","should have a title",""
"passed","Fri Oct 18 12:00:30 UTC 2024","Fri Oct 18 12:00:32 UTC 2024","2124","","Login page funcionality tests: Log in","","","","should display the ""session expired"" modal and redirect to login page",""
"passed","Fri Oct 18 12:00:49 UTC 2024","Fri Oct 18 12:00:49 UTC 2024","148","","Navigation tests: Navigation functionality","","","","should open tasks tab",""
"passed","Fri Oct 18 11:58:57 UTC 2024","Fri Oct 18 11:58:59 UTC 2024","2348","","Navigation","","","","should load reports list when navigating from a report that was opened from reports tab",""
"passed","Fri Oct 18 12:00:49 UTC 2024","Fri Oct 18 12:00:50 UTC 2024","217","","Navigation tests: Navigation functionality","","","","should open Analytics tab",""
"passed","Fri Oct 18 11:58:53 UTC 2024","Fri Oct 18 11:58:57 UTC 2024","3321","","Navigation","","","","should load reports list when navigating from a report that was opened from a contact page",""
"passed","Fri Oct 18 12:00:48 UTC 2024","Fri Oct 18 12:00:49 UTC 2024","1135","","Navigation tests: Navigation functionality","","","","should open Messages tab",""
"passed","Fri Oct 18 12:01:35 UTC 2024","Fri Oct 18 12:01:35 UTC 2024","541","","Navigation tests: Navigation view: as chw","","","","should not create feedback docs when loading missing reports or people",""
"passed","Fri Oct 18 11:59:25 UTC 2024","Fri Oct 18 11:59:26 UTC 2024","1098","","Old Navigation","","","","should navigate to the Reports section and open the first report listed",""
"passed","Fri Oct 18 12:01:59 UTC 2024","Fri Oct 18 12:02:01 UTC 2024","2064","","Training Cards","","","","should display confirm message before navigating to different page",""
"passed","Fri Oct 18 12:00:36 UTC 2024","Fri Oct 18 12:00:36 UTC 2024","461","","Login page funcionality tests: Log in","","","","should try to sign in with blank auth and verify that credentials were incorrect",""
"passed","Fri Oct 18 11:59:53 UTC 2024","Fri Oct 18 11:59:57 UTC 2024","3531","","Search Reports","","","","should return results matching the search term and then return all data when clearing search",""
"passed","Fri Oct 18 12:02:33 UTC 2024","Fri Oct 18 12:02:36 UTC 2024","3111","","Training Cards","","","","should display training after reload and complete training",""
"passed","Fri Oct 18 12:00:51 UTC 2024","Fri Oct 18 12:00:51 UTC 2024","75","","Navigation tests: Navigation view: as admin","","","","should display tab labels, when all tabs are enabled",""
"passed","Fri Oct 18 11:58:23 UTC 2024","Fri Oct 18 11:58:26 UTC 2024","2448","","Content Security Policy","","","","Telemetry script is not blocked by Content Security Policy",""
"passed","Fri Oct 18 11:59:26 UTC 2024","Fri Oct 18 11:59:27 UTC 2024","1592","","Old Navigation","","","","should navigate to the People section and open the created Health Center",""
"passed","Fri Oct 18 12:02:36 UTC 2024","Fri Oct 18 12:02:37 UTC 2024","520","","Training Cards","","","","should not display completed training",""
"passed","Fri Oct 18 11:58:03 UTC 2024","Fri Oct 18 11:58:06 UTC 2024","2775","","Browser Compatibility Modal","","","","should display the browser compatibility modal for outdated Chrome version",""
"passed","Fri Oct 18 11:59:27 UTC 2024","Fri Oct 18 11:59:28 UTC 2024","331","","Old Navigation","","","","should navigate to the Targets section, and open a target aggregate",""
"passed","Fri Oct 18 12:02:01 UTC 2024","Fri Oct 18 12:02:03 UTC 2024","1911","","Training Cards","","","","should display confirm message when browser back button is clicked",""
"passed","Fri Oct 18 11:57:59 UTC 2024","Fri Oct 18 11:58:03 UTC 2024","3539","","Browser Compatibility Modal","","","","should not display the browser compatibility modal for updated Chrome version",""
"passed","Fri Oct 18 12:00:18 UTC 2024","Fri Oct 18 12:00:18 UTC 2024","317","","Login page funcionality tests: Locale","","","","should change locale to French",""
"passed","Fri Oct 18 12:01:34 UTC 2024","Fri Oct 18 12:01:35 UTC 2024","99","","Navigation tests: Navigation view: as chw","","","","should display tab labels, when some tabs are enabled",""
"passed","Fri Oct 18 12:01:41 UTC 2024","Fri Oct 18 12:01:47 UTC 2024","6796","","Delete Reports","","","","Should delete report",""
"passed","Fri Oct 18 11:58:34 UTC 2024","Fri Oct 18 11:58:37 UTC 2024","2806","","More Options Menu - Offline User: Contact tab","","","","should hide the 'export' option and enable the 'edit' and 'delete' options when a contact is opened",""
"passed","Fri Oct 18 12:00:49 UTC 2024","Fri Oct 18 12:00:49 UTC 2024","264","","Navigation tests: Navigation functionality","","","","should open Reports or History tab",""
"passed","Fri Oct 18 12:02:06 UTC 2024","Fri Oct 18 12:02:33 UTC 2024","27513","","Training Cards","","","","should display training after privacy policy",""
"passed","Fri Oct 18 11:59:23 UTC 2024","Fri Oct 18 11:59:25 UTC 2024","1328","","Old Navigation","","","","should navigate to the Task section and open the first task listed",""
"passed","Fri Oct 18 12:00:34 UTC 2024","Fri Oct 18 12:00:35 UTC 2024","453","","Login page funcionality tests: Log in","","","","should try to sign in with blank password and verify that credentials were incorrect",""
"passed","Fri Oct 18 11:58:10 UTC 2024","Fri Oct 18 11:58:18 UTC 2024","7906","","Delete Contacts","","","","Should delete contact",""
"passed","Fri Oct 18 12:00:39 UTC 2024","Fri Oct 18 12:00:41 UTC 2024","2018","","Login page funcionality tests: Log in","","","","should hide and reveal password value, and login with a revealed password",""
"passed","Fri Oct 18 11:58:41 UTC 2024","Fri Oct 18 11:58:43 UTC 2024","1049","","More Options Menu - Offline User: Report tab","","","","should hide the 'export' option and enable the 'edit', 'delete' and 'review' options when the xml report is opened",""
"passed","Fri Oct 18 12:00:19 UTC 2024","Fri Oct 18 12:00:19 UTC 2024","250","","Login page funcionality tests: Locale","","","","should change locale to Spanish",""
"passed","Fri Oct 18 11:59:20 UTC 2024","Fri Oct 18 11:59:23 UTC 2024","3119","","Old Navigation","","","","should navigate to the Messages section and open a sent message",""
"passed","Fri Oct 18 11:59:28 UTC 2024","Fri Oct 18 11:59:29 UTC 2024","1584","","Old Navigation","","","","should successfully sync",""
"passed","Fri Oct 18 11:59:42 UTC 2024","Fri Oct 18 11:59:44 UTC 2024","1658","","Bulk delete reports","","","","should open a selected report and a no selected report",""
