"Status","Start Time","Stop Time","Duration in ms","Parent Suite","Suite","Sub Suite","Test Class","Test Method","Name","Description"
"passed","Mon Nov 11 15:27:10 UTC 2024","Mon Nov 11 15:27:10 UTC 2024","830","","Navigation tests: Navigation functionality","","","","should open Messages tab",""
"passed","Mon Nov 11 15:26:01 UTC 2024","Mon Nov 11 15:26:05 UTC 2024","3652","","Bulk delete reports","","","","should select, deselect and delete only selected reports",""
"passed","Mon Nov 11 15:28:24 UTC 2024","Mon Nov 11 15:28:27 UTC 2024","3175","","Training Cards","","","","should not display training after it was canceled and the training doc was updated",""
"passed","Mon Nov 11 15:28:27 UTC 2024","Mon Nov 11 15:28:33 UTC 2024","5629","","Training Cards","","","","should display training after privacy policy",""
"passed","Mon Nov 11 15:26:33 UTC 2024","Mon Nov 11 15:26:34 UTC 2024","1392","","Report - Send message action","","","","should display option to send message",""
"passed","Mon Nov 11 15:26:43 UTC 2024","Mon Nov 11 15:26:46 UTC 2024","2982","","Login page funcionality tests: Log out","","","","should show a warning before log out",""
"passed","Mon Nov 11 15:25:22 UTC 2024","Mon Nov 11 15:25:25 UTC 2024","3164","","Navigation","","","","should load reports list when navigating from a report that was opened from a contact page",""
"passed","Mon Nov 11 15:27:01 UTC 2024","Mon Nov 11 15:27:03 UTC 2024","1943","","Login page funcionality tests: Log in","","","","should hide and reveal password value, and login with a revealed password",""
"passed","Mon Nov 11 15:26:49 UTC 2024","Mon Nov 11 15:26:51 UTC 2024","2209","","Login page funcionality tests: Log in","","","","should set correct cookies",""
"passed","Mon Nov 11 15:26:19 UTC 2024","Mon Nov 11 15:26:23 UTC 2024","3152","","Search Reports","","","","should navigate back to list view and return results when searching by case_id",""
"passed","Mon Nov 11 15:26:42 UTC 2024","Mon Nov 11 15:26:42 UTC 2024","318","","Login page funcionality tests: Locale","","","","should change locale to Spanish",""
"passed","Mon Nov 11 15:28:20 UTC 2024","Mon Nov 11 15:28:22 UTC 2024","2080","","Training Cards","","","","should display confirm message before navigating to different page",""
"passed","Mon Nov 11 15:25:44 UTC 2024","Mon Nov 11 15:25:47 UTC 2024","2658","","Old Navigation","","","","should navigate to the Messages section and open a sent message",""
"passed","Mon Nov 11 15:26:05 UTC 2024","Mon Nov 11 15:26:07 UTC 2024","1699","","Bulk delete reports","","","","should open a selected report and a no selected report",""
"passed","Mon Nov 11 15:26:39 UTC 2024","Mon Nov 11 15:26:39 UTC 2024","187","","Login page funcionality tests: Locale","","","","should show locale selector on login page",""
"passed","Mon Nov 11 15:27:00 UTC 2024","Mon Nov 11 15:27:00 UTC 2024","453","","Login page funcionality tests: Log in","","","","should try to sign in and verify that credentials were incorrect",""
"passed","Mon Nov 11 15:28:33 UTC 2024","Mon Nov 11 15:28:36 UTC 2024","3118","","Training Cards","","","","should display training after reload and complete training",""
"passed","Mon Nov 11 15:27:12 UTC 2024","Mon Nov 11 15:27:12 UTC 2024","124","","Navigation tests: Navigation view: as admin","","","","should display tab labels, when all tabs are enabled",""
"passed","Mon Nov 11 15:26:40 UTC 2024","Mon Nov 11 15:26:41 UTC 2024","329","","Login page funcionality tests: Locale","","","","should change locale to French",""
"passed","Mon Nov 11 15:25:08 UTC 2024","Mon Nov 11 15:25:10 UTC 2024","1904","","More Options Menu - Offline User: Report tab","","","","should hide the 'export' and 'edit' options and enable the 'delete' and 'review' options when the sms report is opened",""
"passed","Mon Nov 11 15:27:11 UTC 2024","Mon Nov 11 15:27:11 UTC 2024","170","","Navigation tests: Navigation functionality","","","","should open Contacts or Peoples tab",""
"passed","Mon Nov 11 15:25:25 UTC 2024","Mon Nov 11 15:25:27 UTC 2024","2151","","Navigation","","","","should load reports list when navigating from a report that was opened from reports tab",""
"passed","Mon Nov 11 15:25:51 UTC 2024","Mon Nov 11 15:25:52 UTC 2024","1036","","Old Navigation","","","","should successfully sync",""
"passed","Mon Nov 11 15:28:02 UTC 2024","Mon Nov 11 15:28:09 UTC 2024","6764","","Delete Reports","","","","Should delete report",""
"passed","Mon Nov 11 15:26:55 UTC 2024","Mon Nov 11 15:26:56 UTC 2024","440","","Login page funcionality tests: Log in","","","","should have a title",""
"passed","Mon Nov 11 15:28:19 UTC 2024","Mon Nov 11 15:28:20 UTC 2024","1388","","Training Cards","","","","should cancel training and not save it as completed",""
"passed","Mon Nov 11 15:26:57 UTC 2024","Mon Nov 11 15:26:57 UTC 2024","437","","Login page funcionality tests: Log in","","","","should try to sign in with blank password and verify that credentials were incorrect",""
"passed","Mon Nov 11 15:25:10 UTC 2024","Mon Nov 11 15:25:11 UTC 2024","1043","","More Options Menu - Offline User: Report tab","","","","should hide the 'export' option and enable the 'edit', 'delete' and 'review' options when the xml report is opened",""
"passed","Mon Nov 11 15:25:47 UTC 2024","Mon Nov 11 15:25:48 UTC 2024","1326","","Old Navigation","","","","should navigate to the Task section and open the first task listed",""
"passed","Mon Nov 11 15:26:58 UTC 2024","Mon Nov 11 15:26:58 UTC 2024","417","","Login page funcionality tests: Log in","","","","should try to sign in with blank auth and verify that credentials were incorrect",""
"passed","Mon Nov 11 15:25:06 UTC 2024","Mon Nov 11 15:25:08 UTC 2024","2709","","More Options Menu - Offline User: Contact tab","","","","should hide the 'export' and 'edit' options and disable the 'delete' option when the offline user's place is selected",""
"passed","Mon Nov 11 15:28:22 UTC 2024","Mon Nov 11 15:28:24 UTC 2024","2160","","Training Cards","","","","should display confirm message when browser back button is clicked",""
"passed","Mon Nov 11 15:24:31 UTC 2024","Mon Nov 11 15:24:34 UTC 2024","3129","","Browser Compatibility Modal","","","","should display the browser compatibility modal for outdated Chrome version",""
"passed","Mon Nov 11 15:24:51 UTC 2024","Mon Nov 11 15:24:53 UTC 2024","2365","","Content Security Policy","","","","Telemetry script is not blocked by Content Security Policy",""
"passed","Mon Nov 11 15:25:49 UTC 2024","Mon Nov 11 15:25:51 UTC 2024","1514","","Old Navigation","","","","should navigate to the People section and open the created Health Center",""
"passed","Mon Nov 11 15:25:00 UTC 2024","Mon Nov 11 15:25:01 UTC 2024","285","","More Options Menu - Offline User: Message tab","","","","should hide the kebab menu.",""
"passed","Mon Nov 11 15:25:51 UTC 2024","Mon Nov 11 15:25:51 UTC 2024","268","","Old Navigation","","","","should navigate to the Targets section, and open a target aggregate",""
"passed","Mon Nov 11 15:25:01 UTC 2024","Mon Nov 11 15:25:06 UTC 2024","4993","","More Options Menu - Offline User: Contact tab","","","","should hide the 'export' option and enable the 'edit' and 'delete' options when a contact is opened",""
"passed","Mon Nov 11 15:27:11 UTC 2024","Mon Nov 11 15:27:11 UTC 2024","210","","Navigation tests: Navigation functionality","","","","should open Analytics tab",""
"passed","Mon Nov 11 15:26:47 UTC 2024","Mon Nov 11 15:26:48 UTC 2024","1393","","Login page funcionality tests: Log in","","","","should log in using username and password fields",""
"passed","Mon Nov 11 15:27:56 UTC 2024","Mon Nov 11 15:27:56 UTC 2024","107","","Navigation tests: Navigation view: as chw","","","","should display tab labels, when some tabs are enabled",""
"passed","Mon Nov 11 15:25:48 UTC 2024","Mon Nov 11 15:25:49 UTC 2024","943","","Old Navigation","","","","should navigate to the Reports section and open the first report listed",""
"passed","Mon Nov 11 15:24:27 UTC 2024","Mon Nov 11 15:24:31 UTC 2024","3692","","Browser Compatibility Modal","","","","should not display the browser compatibility modal for updated Chrome version",""
"passed","Mon Nov 11 15:26:52 UTC 2024","Mon Nov 11 15:26:54 UTC 2024","2049","","Login page funcionality tests: Log in","","","","should display the ""session expired"" modal and redirect to login page",""
"passed","Mon Nov 11 15:27:56 UTC 2024","Mon Nov 11 15:27:57 UTC 2024","433","","Navigation tests: Navigation view: as chw","","","","should not create feedback docs when loading missing reports or people",""
"passed","Mon Nov 11 15:27:10 UTC 2024","Mon Nov 11 15:27:11 UTC 2024","201","","Navigation tests: Navigation functionality","","","","should open tasks tab",""
"passed","Mon Nov 11 15:27:11 UTC 2024","Mon Nov 11 15:27:11 UTC 2024","254","","Navigation tests: Navigation functionality","","","","should open Reports or History tab",""
"passed","Mon Nov 11 15:26:16 UTC 2024","Mon Nov 11 15:26:19 UTC 2024","3437","","Search Reports","","","","should return results matching the search term and then return all data when clearing search",""
"passed","Mon Nov 11 15:28:36 UTC 2024","Mon Nov 11 15:28:37 UTC 2024","559","","Training Cards","","","","should not display completed training",""
"passed","Mon Nov 11 15:24:38 UTC 2024","Mon Nov 11 15:24:46 UTC 2024","8054","","Delete Contacts","","","","Should delete contact",""
