"DESCRIPTION","DURATION IN MS","NAME","PARENT SUITE","START TIME","STATUS","STOP TIME","SUB SUITE","SUITE","TEST CLASS","TEST METHOD"
"","753","should returns list and updates state","","Thu Sep 18 13:27:06 UTC 2025","passed","Thu Sep 18 13:27:07 UTC 2025","","sms-gateway api: api returns list of pending WO messages","",""
"","2872","should send a message to a raw phone number","","Thu Sep 18 13:28:57 UTC 2025","passed","Thu Sep 18 13:28:59 UTC 2025","","Send message","",""
"","2269","should create a report using patient name","","Thu Sep 18 13:06:32 UTC 2025","passed","Thu Sep 18 13:06:35 UTC 2025","","Reports Subject","",""
"","618","should have no results when searching by non-existent field value","","Thu Sep 18 13:04:46 UTC 2025","passed","Thu Sep 18 13:04:47 UTC 2025","","Contact Search: Logged in as an offline user","",""
"","3002","should save target document on first calculation","","Thu Sep 18 13:08:32 UTC 2025","passed","Thu Sep 18 13:08:35 UTC 2025","","Target accuracy","",""
"","2777","should open task with expression","","Thu Sep 18 13:12:02 UTC 2025","passed","Thu Sep 18 13:12:05 UTC 2025","","Tasks tab breadcrumbs: for chw","",""
"","1525","should return results matching the search term and then return all data when clearing search","","Thu Sep 18 13:07:28 UTC 2025","passed","Thu Sep 18 13:07:29 UTC 2025","","Reports Search: Logged in as an offline user","",""
"","976","should call endpoint with set credentials","","Thu Sep 18 13:28:06 UTC 2025","passed","Thu Sep 18 13:28:07 UTC 2025","","RapidPro SMS Gateway: Webapp originating messages and state updates","",""
"","11765","the LHS button should show the appropriate label when multiple places exist at the current level","","Thu Sep 18 12:56:20 UTC 2025","passed","Thu Sep 18 12:56:32 UTC 2025","","Creating custom places","",""
"","2682","should delete the primary contact of health facility","","Thu Sep 18 13:03:52 UTC 2025","passed","Thu Sep 18 13:03:55 UTC 2025","","Create new lineage structure ","",""
"","3110","should update SMS statuses","","Thu Sep 18 13:26:39 UTC 2025","passed","Thu Sep 18 13:26:42 UTC 2025","","Africas Talking api: Webapp submits new GT sms messages","",""
"","3413","should send a message using FAB at people's tab","","Thu Sep 18 13:29:09 UTC 2025","passed","Thu Sep 18 13:29:12 UTC 2025","","Send message","",""
"","7284","should display correct due dates with taskDaysOverdue setting","","Thu Sep 18 13:11:22 UTC 2025","passed","Thu Sep 18 13:11:29 UTC 2025","","Task list due dates","",""
"","2747","should have unique results for when multiple fields match the same search text","","Thu Sep 18 13:07:22 UTC 2025","passed","Thu Sep 18 13:07:25 UTC 2025","","Reports Search: Logged in as an online user","",""
"","2075","should create a report which has an unknown sender with no phone number","","Thu Sep 18 13:06:48 UTC 2025","passed","Thu Sep 18 13:06:50 UTC 2025","","Reports Subject","",""
"","2413","should reply to an existing message and add a new recipient - contact with a phone number ","","Thu Sep 18 13:29:06 UTC 2025","passed","Thu Sep 18 13:29:09 UTC 2025","","Send message","",""
"","7853","should poll for state updates and consume queue","","Thu Sep 18 13:28:19 UTC 2025","passed","Thu Sep 18 13:28:27 UTC 2025","","RapidPro SMS Gateway: Webapp originating messages and state updates","",""
"","2443","should create a report using doc id","","Thu Sep 18 13:06:27 UTC 2025","passed","Thu Sep 18 13:06:29 UTC 2025","","Reports Subject","",""
"","30745","should filter aggregates by place and period","","Thu Sep 18 13:10:29 UTC 2025","passed","Thu Sep 18 13:11:00 UTC 2025","","Target aggregates: User with one or more places assigned: Offline user with multiple places associated","",""
"","651","search by NON empty string should display results which contains match and clears search","","Thu Sep 18 13:04:44 UTC 2025","passed","Thu Sep 18 13:04:45 UTC 2025","","Contact Search: Logged in as an offline user","",""
"","2371","should display messages with updated breadcrumbs for offline user","","Thu Sep 18 13:27:37 UTC 2025","passed","Thu Sep 18 13:27:40 UTC 2025","","Message Tab - Sender Data","",""
"","2274","should create a report using missing required patient name","","Thu Sep 18 13:06:35 UTC 2025","passed","Thu Sep 18 13:06:37 UTC 2025","","Reports Subject","",""
"","1403","should open task from the same group","","Thu Sep 18 13:12:30 UTC 2025","passed","Thu Sep 18 13:12:31 UTC 2025","","Tasks group landing page: for chw","",""
"","2126","should create a report which has an unknown sender and a known subject","","Thu Sep 18 13:06:45 UTC 2025","passed","Thu Sep 18 13:06:47 UTC 2025","","Reports Subject","",""
"","1122","should reply to an existing message - contact with a phone number","","Thu Sep 18 13:29:03 UTC 2025","passed","Thu Sep 18 13:29:04 UTC 2025","","Send message","",""
"","2396","should reply to an existing message and add a new recipient - raw phone number ","","Thu Sep 18 13:29:04 UTC 2025","passed","Thu Sep 18 13:29:06 UTC 2025","","Send message","",""
"","4511","should not show page when there are no more household tasks","","Thu Sep 18 13:12:38 UTC 2025","passed","Thu Sep 18 13:12:42 UTC 2025","","Tasks group landing page: for chw","",""
"","6273","should edit the name of the Family","","Thu Sep 18 13:04:03 UTC 2025","passed","Thu Sep 18 13:04:09 UTC 2025","","Create new lineage structure ","",""
