"DESCRIPTION","DURATION IN MS","NAME","PARENT SUITE","START TIME","STATUS","STOP TIME","SUB SUITE","SUITE","TEST CLASS","TEST METHOD"
"","365","should fail with no incoming key configured","","Thu Jul 17 13:58:10 UTC 2025","passed","Thu Jul 17 13:58:10 UTC 2025","","RapidPro SMS Gateway: Webapp Terminating messages","",""
"","1028","should reply to an existing message - raw phone number","","Thu Jul 17 13:59:21 UTC 2025","passed","Thu Jul 17 13:59:22 UTC 2025","","Send message","",""
"","3502","should send messages to all the contacts, under a place, that have a primary phone number assigned","","Thu Jul 17 13:59:13 UTC 2025","passed","Thu Jul 17 13:59:16 UTC 2025","","Send message","",""
"","1794","should not display task landing page after task completion","","Thu Jul 17 13:54:15 UTC 2025","passed","Thu Jul 17 13:54:17 UTC 2025","","Tasks group landing page: for supervisor","",""
"","11108","should add a task when CHW completes a task successfully, and that task creates another task","","Thu Jul 17 13:54:40 UTC 2025","passed","Thu Jul 17 13:54:51 UTC 2025","","Tasks","",""
"","14945","should sync and update the offline user's home place","","Thu Jul 17 13:42:54 UTC 2025","passed","Thu Jul 17 13:43:09 UTC 2025","","Edit ","",""
"","8853","should display correct due dates with taskDaysOverdue setting and simple translation","","Thu Jul 17 13:52:51 UTC 2025","passed","Thu Jul 17 13:53:00 UTC 2025","","Task list due dates","",""
"","10218","should handle rate limiting when polling","","Thu Jul 17 13:58:50 UTC 2025","passed","Thu Jul 17 13:59:01 UTC 2025","","RapidPro SMS Gateway: Webapp originating messages and state updates","",""
"","7966","should edit a person with a phone number","","Thu Jul 17 13:45:06 UTC 2025","passed","Thu Jul 17 13:45:14 UTC 2025","","Create new lineage structure ","",""
"","2267","should create a report which has an unknown sender and a known subject","","Thu Jul 17 13:48:17 UTC 2025","passed","Thu Jul 17 13:48:20 UTC 2025","","Reports Subject","",""
"","1610","should not call RapidPro endpoint when credentials are not set","","Thu Jul 17 13:58:24 UTC 2025","passed","Thu Jul 17 13:58:25 UTC 2025","","RapidPro SMS Gateway: Webapp originating messages and state updates","",""
"","3603","should have tasks","","Thu Jul 17 13:54:11 UTC 2025","passed","Thu Jul 17 13:54:15 UTC 2025","","Tasks group landing page: for supervisor","",""
"","7293","should edit the name of the CHW area","","Thu Jul 17 13:45:25 UTC 2025","passed","Thu Jul 17 13:45:33 UTC 2025","","Create new lineage structure ","",""
"","11637","should update a contact, delete the same contact then unassign primary contact from facility","","Thu Jul 17 13:42:42 UTC 2025","passed","Thu Jul 17 13:42:54 UTC 2025","","Edit ","",""
"","9289","should show the multi person actions with the correct label","","Thu Jul 17 13:38:03 UTC 2025","passed","Thu Jul 17 13:38:12 UTC 2025","","Creating custom places","",""
"","3588","should display reports with updated breadcrumbs for offline user","","Thu Jul 17 13:46:30 UTC 2025","passed","Thu Jul 17 13:46:33 UTC 2025","","Reports tab breadcrumbs","",""
"","1774","should handle old format of the rules-state-store","","Thu Jul 17 13:50:23 UTC 2025","passed","Thu Jul 17 13:50:24 UTC 2025","","Target accuracy","",""
"","9109","should remove task from list when CHW completes a task successfully","","Thu Jul 17 13:54:30 UTC 2025","passed","Thu Jul 17 13:54:40 UTC 2025","","Tasks","",""
"","1334","should display an error when there are aggregates but no home place","","Thu Jul 17 13:50:34 UTC 2025","passed","Thu Jul 17 13:50:35 UTC 2025","","Target aggregates: DB admin","",""
"","1585","should shows content","","Thu Jul 17 13:57:21 UTC 2025","passed","Thu Jul 17 13:57:22 UTC 2025","","sms-gateway api: Gateway submits new WT sms messages","",""
"","3811","should not remove facility from breadcrumbs when offline user has many facilities associated","","Thu Jul 17 13:46:25 UTC 2025","passed","Thu Jul 17 13:46:29 UTC 2025","","Reports tab breadcrumbs","",""
"","3118","should keep updating until record is in final state","","Thu Jul 17 13:58:36 UTC 2025","passed","Thu Jul 17 13:58:40 UTC 2025","","RapidPro SMS Gateway: Webapp originating messages and state updates","",""
"","322","should fail when message was not created","","Thu Jul 17 13:58:14 UTC 2025","passed","Thu Jul 17 13:58:14 UTC 2025","","RapidPro SMS Gateway: Webapp Terminating messages","",""
"","7165","should edit a name of the health facility","","Thu Jul 17 13:45:14 UTC 2025","passed","Thu Jul 17 13:45:22 UTC 2025","","Create new lineage structure ","",""
"","1678","should shows content","","Thu Jul 17 13:56:51 UTC 2025","passed","Thu Jul 17 13:56:53 UTC 2025","","Africas Talking api: Gateway submits new WT sms messages","",""
"","3314","should filter by status","","Thu Jul 17 13:49:11 UTC 2025","passed","Thu Jul 17 13:49:15 UTC 2025","","Reports Sidebar Filter","",""
"","8519","should show the single add person button with the correct label","","Thu Jul 17 13:37:52 UTC 2025","passed","Thu Jul 17 13:38:00 UTC 2025","","Creating custom places","",""
"","252","should fail with malformed authentication","","Thu Jul 17 13:58:13 UTC 2025","passed","Thu Jul 17 13:58:13 UTC 2025","","RapidPro SMS Gateway: Webapp Terminating messages","",""
"","5685","should not save target document when editing counted contact","","Thu Jul 17 13:49:54 UTC 2025","passed","Thu Jul 17 13:49:59 UTC 2025","","Target accuracy","",""
"","18371","should display correct data","","Thu Jul 17 13:50:52 UTC 2025","passed","Thu Jul 17 13:51:10 UTC 2025","","Target aggregates: User with one or more places assigned: Online user with one place associated","",""
"","3095","should disable content","","Thu Jul 17 13:51:39 UTC 2025","passed","Thu Jul 17 13:51:43 UTC 2025","","Target aggregates: User with one or more places assigned: Offline user with multiple places associated","",""
"","2407","should create a report using unknown place_id","","Thu Jul 17 13:48:15 UTC 2025","passed","Thu Jul 17 13:48:17 UTC 2025","","Reports Subject","",""
"","2375","should create a report using place_id with a place_uuid","","Thu Jul 17 13:48:10 UTC 2025","passed","Thu Jul 17 13:48:12 UTC 2025","","Reports Subject","",""
"","20717","should not show tasks when permission is disabled","","Thu Jul 17 13:40:07 UTC 2025","passed","Thu Jul 17 13:40:28 UTC 2025","","Contact details page.: Permissions to show reports and tasks","",""
"","2383","should reply to an existing message and add a new recipient - contact with a phone number ","","Thu Jul 17 13:59:26 UTC 2025","passed","Thu Jul 17 13:59:28 UTC 2025","","Send message","",""
"","2754","should return results when searching by case_id","","Thu Jul 17 13:48:44 UTC 2025","passed","Thu Jul 17 13:48:46 UTC 2025","","Reports Search","",""
"","2486","should create a report using doc id","","Thu Jul 17 13:47:59 UTC 2025","passed","Thu Jul 17 13:48:01 UTC 2025","","Reports Subject","",""
"","9473","should launch an edit contact form when edit_id is provided in content","","Thu Jul 17 13:56:31 UTC 2025","passed","Thu Jul 17 13:56:40 UTC 2025","","Tasks: contact tasks","",""
"","12468","should route to contact-detail on list item click and display contact summary target card","","Thu Jul 17 13:51:13 UTC 2025","passed","Thu Jul 17 13:51:26 UTC 2025","","Target aggregates: User with one or more places assigned: Online user with one place associated","",""
"","3284","should create messages","","Thu Jul 17 13:58:15 UTC 2025","passed","Thu Jul 17 13:58:18 UTC 2025","","RapidPro SMS Gateway: Webapp Terminating messages","",""
"","6878","should download export file","","Thu Jul 17 13:43:14 UTC 2025","passed","Thu Jul 17 13:43:21 UTC 2025","","Export Contacts ","",""
"","2925","should display modal when clicking on a task from another group","","Thu Jul 17 13:53:54 UTC 2025","passed","Thu Jul 17 13:53:57 UTC 2025","","Tasks group landing page: for chw","",""
"","5441","should filter by date","","Thu Jul 17 13:48:55 UTC 2025","passed","Thu Jul 17 13:49:00 UTC 2025","","Reports Sidebar Filter","",""
"","875","should returns list and updates state","","Thu Jul 17 13:57:23 UTC 2025","passed","Thu Jul 17 13:57:24 UTC 2025","","sms-gateway api: api returns list of pending WO messages","",""
"","1421","should create case ID","","Thu Jul 17 13:47:22 UTC 2025","passed","Thu Jul 17 13:47:23 UTC 2025","","Generating short codes","",""
"","2493","should reply to an existing message and add a new recipient - raw phone number ","","Thu Jul 17 13:59:23 UTC 2025","passed","Thu Jul 17 13:59:26 UTC 2025","","Send message","",""
"","7206","should save target document when targets change","","Thu Jul 17 13:49:47 UTC 2025","passed","Thu Jul 17 13:49:54 UTC 2025","","Target accuracy","",""
"","5994","should display correct message when no target found","","Thu Jul 17 13:36:41 UTC 2025","passed","Thu Jul 17 13:36:47 UTC 2025","","Targets","",""
"","5101","should not show page when there are no more household tasks","","Thu Jul 17 13:54:00 UTC 2025","passed","Thu Jul 17 13:54:05 UTC 2025","","Tasks group landing page: for chw","",""
"","2381","should send a message to a raw phone number","","Thu Jul 17 13:59:16 UTC 2025","passed","Thu Jul 17 13:59:19 UTC 2025","","Send message","",""
"","2223","should create a report which has an unknown sender with no phone number","","Thu Jul 17 13:48:20 UTC 2025","passed","Thu Jul 17 13:48:22 UTC 2025","","Reports Subject","",""
"","2477","should create a report using unknown patient_id ","","Thu Jul 17 13:48:02 UTC 2025","passed","Thu Jul 17 13:48:04 UTC 2025","","Reports Subject","",""
"","3054","should save target document on first calculation","","Thu Jul 17 13:49:44 UTC 2025","passed","Thu Jul 17 13:49:47 UTC 2025","","Target accuracy","",""
"","2507","should return results matching the search term and then return all data when clearing search","","Thu Jul 17 13:48:41 UTC 2025","passed","Thu Jul 17 13:48:44 UTC 2025","","Reports Search","",""
"","1650","should call endpoint with set credentials","","Thu Jul 17 13:58:26 UTC 2025","passed","Thu Jul 17 13:58:28 UTC 2025","","RapidPro SMS Gateway: Webapp originating messages and state updates","",""
"","4235","should select, deselect and delete only selected reports","","Thu Jul 17 13:46:44 UTC 2025","passed","Thu Jul 17 13:46:48 UTC 2025","","Bulk delete reports","",""
"","9320","should show custom places in their own list","","Thu Jul 17 13:38:14 UTC 2025","passed","Thu Jul 17 13:38:23 UTC 2025","","Creating custom places","",""
"","32932","should filter aggregates by place and period","","Thu Jul 17 13:51:47 UTC 2025","passed","Thu Jul 17 13:52:20 UTC 2025","","Target aggregates: User with one or more places assigned: Offline user with multiple places associated","",""
"","1249","should shows content","","Thu Jul 17 13:57:22 UTC 2025","passed","Thu Jul 17 13:57:23 UTC 2025","","sms-gateway api: Gateway submits WT sms status updates","",""
"","3369","should send a message using FAB at people's tab","","Thu Jul 17 13:59:28 UTC 2025","passed","Thu Jul 17 13:59:31 UTC 2025","","Send message","",""
"","125","should show contact summary that has the full context for reports > 50 validate that the pregnancy card is always displayed","","Thu Jul 17 13:39:08 UTC 2025","passed","Thu Jul 17 13:39:08 UTC 2025","","Contact details page.: Permissions to show reports and tasks","",""
"","8558","should mute a contact using the defined mute_forms (death_report).","","Thu Jul 17 13:44:17 UTC 2025","passed","Thu Jul 17 13:44:25 UTC 2025","","Mute/Unmute contacts using a specific form - ","",""
"","2635","should not display modal when clicking list task from same group","","Thu Jul 17 13:53:57 UTC 2025","passed","Thu Jul 17 13:54:00 UTC 2025","","Tasks group landing page: for chw","",""
"","2833","should display messages with updated breadcrumbs for offline user","","Thu Jul 17 13:57:56 UTC 2025","passed","Thu Jul 17 13:57:59 UTC 2025","","Message Tab - Sender Data","",""
"","3950","should display correct tasks with breadcrumbs for chw","","Thu Jul 17 13:53:20 UTC 2025","passed","Thu Jul 17 13:53:24 UTC 2025","","Tasks tab breadcrumbs: for chw","",""
"","10272","should create person under area should only see children","","Thu Jul 17 13:45:49 UTC 2025","passed","Thu Jul 17 13:45:59 UTC 2025","","Create Person Under Area, ","",""
"","3591","should display correct message when targets are disabled","","Thu Jul 17 13:36:47 UTC 2025","passed","Thu Jul 17 13:36:51 UTC 2025","","Targets","",""
"","21920","Should show error message for bad config","","Thu Jul 17 13:55:54 UTC 2025","passed","Thu Jul 17 13:56:16 UTC 2025","","Tasks","",""
"","963","should have tasks","","Thu Jul 17 13:53:49 UTC 2025","passed","Thu Jul 17 13:53:50 UTC 2025","","Tasks group landing page: for chw","",""
"","2596","should shows content","","Thu Jul 17 13:56:53 UTC 2025","passed","Thu Jul 17 13:56:56 UTC 2025","","Africas Talking api: Gateway submits WT sms status updates","",""
"","8770","should not save target document when adding report for counted contact","","Thu Jul 17 13:49:59 UTC 2025","passed","Thu Jul 17 13:50:08 UTC 2025","","Target accuracy","",""
"","9184","the RHS button show the appropriate label when multiple places exist at the current level","","Thu Jul 17 13:37:40 UTC 2025","passed","Thu Jul 17 13:37:49 UTC 2025","","Creating custom places","",""
"","6045","should save target document when deleting counted contact","","Thu Jul 17 13:50:08 UTC 2025","passed","Thu Jul 17 13:50:14 UTC 2025","","Target accuracy","",""
"","2291","should send a message to a contact with a phone number","","Thu Jul 17 13:59:19 UTC 2025","passed","Thu Jul 17 13:59:21 UTC 2025","","Send message","",""
"","7128","should show a popup when trying to submit a non-unmuting form against a muted contact","","Thu Jul 17 13:44:33 UTC 2025","passed","Thu Jul 17 13:44:40 UTC 2025","","Mute/Unmute contacts using a specific form - ","",""
"","1965","should display targets from default config","","Thu Jul 17 13:36:39 UTC 2025","passed","Thu Jul 17 13:36:41 UTC 2025","","Targets","",""
"","9512","should display no data when no targets are uploaded","","Thu Jul 17 13:50:41 UTC 2025","passed","Thu Jul 17 13:50:50 UTC 2025","","Target aggregates: User with one or more places assigned: Online user with one place associated","",""
"","11540","the LHS button should show the appropriate label when multiple places exist at the current level","","Thu Jul 17 13:37:16 UTC 2025","passed","Thu Jul 17 13:37:27 UTC 2025","","Creating custom places","",""
"","769","search by NON empty string should display results with contains match and clears search","","Thu Jul 17 13:46:09 UTC 2025","passed","Thu Jul 17 13:46:09 UTC 2025","","Contact Search","",""
"","1252","should reply to an existing message - contact with a phone number","","Thu Jul 17 13:59:22 UTC 2025","passed","Thu Jul 17 13:59:23 UTC 2025","","Send message","",""
"","4491","should create new household","","Thu Jul 17 13:44:57 UTC 2025","passed","Thu Jul 17 13:45:01 UTC 2025","","Create new lineage structure ","",""
"","8176","should save target doc once when getting many changes through replication","","Thu Jul 17 13:50:14 UTC 2025","passed","Thu Jul 17 13:50:22 UTC 2025","","Target accuracy","",""
"","7946","should display correct due dates with taskDaysOverdue setting","","Thu Jul 17 13:52:43 UTC 2025","passed","Thu Jul 17 13:52:51 UTC 2025","","Task list due dates","",""
"","4486","should create new area","","Thu Jul 17 13:44:52 UTC 2025","passed","Thu Jul 17 13:44:56 UTC 2025","","Create new lineage structure ","",""
"","6478","should load multiple pages of contacts","","Thu Jul 17 13:43:57 UTC 2025","passed","Thu Jul 17 13:44:03 UTC 2025","","Infinite scrolling","",""
"","1757","should not poll messages for docs that are in pending or scheduled states or lack gateway ref ","","Thu Jul 17 13:58:34 UTC 2025","passed","Thu Jul 17 13:58:35 UTC 2025","","RapidPro SMS Gateway: Webapp originating messages and state updates","",""
"","58486","should not show reports when permission is disabled","","Thu Jul 17 13:39:08 UTC 2025","passed","Thu Jul 17 13:40:07 UTC 2025","","Contact details page.: Permissions to show reports and tasks","",""
"","3809","should create new person","","Thu Jul 17 13:45:02 UTC 2025","passed","Thu Jul 17 13:45:06 UTC 2025","","Create new lineage structure ","",""
"","1457","should show new household and new person create option","","Thu Jul 17 13:43:31 UTC 2025","passed","Thu Jul 17 13:43:33 UTC 2025","","FAB actions","",""
"","8260","should load multiple pages of reports","","Thu Jul 17 13:47:35 UTC 2025","passed","Thu Jul 17 13:47:43 UTC 2025","","Infinite scrolling","",""
"","4455","should filter by user associated place when the permission to default filter is enabled","","Thu Jul 17 13:49:16 UTC 2025","passed","Thu Jul 17 13:49:20 UTC 2025","","Reports Sidebar Filter","",""
"","3687","should filter by place","","Thu Jul 17 13:49:07 UTC 2025","passed","Thu Jul 17 13:49:10 UTC 2025","","Reports Sidebar Filter","",""
"","3768","should display reports with breadcrumbs for online user","","Thu Jul 17 13:46:20 UTC 2025","passed","Thu Jul 17 13:46:24 UTC 2025","","Reports tab breadcrumbs","",""
"","2634","Send SMS without patient_id and report created under person","","Thu Jul 17 13:57:32 UTC 2025","passed","Thu Jul 17 13:57:35 UTC 2025","","Link SMS to patient without passing id","",""
"","8934","should display targets of current user on home place","","Thu Jul 17 13:51:28 UTC 2025","passed","Thu Jul 17 13:51:37 UTC 2025","","Target aggregates: User with one or more places assigned: Online user with one place associated","",""
"","2873","should create a report using patient_id","","Thu Jul 17 13:47:56 UTC 2025","passed","Thu Jul 17 13:47:59 UTC 2025","","Reports Subject","",""
"","2285","should create a report using place_id with a shortcode","","Thu Jul 17 13:48:12 UTC 2025","passed","Thu Jul 17 13:48:15 UTC 2025","","Reports Subject","",""
"","650","should display an empty list when there are no aggregates","","Thu Jul 17 13:50:33 UTC 2025","passed","Thu Jul 17 13:50:34 UTC 2025","","Target aggregates: DB admin","",""
"","735","search should clear RHS selected contact","","Thu Jul 17 13:46:09 UTC 2025","passed","Thu Jul 17 13:46:10 UTC 2025","","Contact Search","",""
"","6398","detects duplicates from a custom duplicate expression","","Thu Jul 17 13:42:12 UTC 2025","passed","Thu Jul 17 13:42:18 UTC 2025","","Duplicate contact detection","",""
"","5914","detects duplicates when editing a contact - navigates to duplicate contact","","Thu Jul 17 13:42:04 UTC 2025","passed","Thu Jul 17 13:42:10 UTC 2025","","Duplicate contact detection","",""
"","1587","should display correct tasks with breadcrumbs for supervisor","","Thu Jul 17 13:53:30 UTC 2025","passed","Thu Jul 17 13:53:32 UTC 2025","","Tasks tab breadcrumbs: for supervisor","",""
"","6197","detects duplicates when creating top-level place - allows acknowledging","","Thu Jul 17 13:41:48 UTC 2025","passed","Thu Jul 17 13:41:54 UTC 2025","","Duplicate contact detection","",""
"","74","should only create one target doc","","Thu Jul 17 13:50:22 UTC 2025","passed","Thu Jul 17 13:50:23 UTC 2025","","Target accuracy","",""
"","1918","should display only the targets sections and show the correct message when target aggregates are disabled","","Thu Jul 17 13:51:44 UTC 2025","passed","Thu Jul 17 13:51:46 UTC 2025","","Target aggregates: User with one or more places assigned: Offline user with multiple places associated","",""
"","2544","should show fab when user only has can_create_people permission","","Thu Jul 17 13:43:40 UTC 2025","passed","Thu Jul 17 13:43:43 UTC 2025","","FAB actions","",""
"","4134","should edit district","","Thu Jul 17 13:38:39 UTC 2025","passed","Thu Jul 17 13:38:43 UTC 2025","","Add new district tests : ","",""
"","10635","the LHS button should show the appropriate label when only one action","","Thu Jul 17 13:37:02 UTC 2025","passed","Thu Jul 17 13:37:13 UTC 2025","","Creating custom places","",""
"","1458","should open task from the same group","","Thu Jul 17 13:53:53 UTC 2025","passed","Thu Jul 17 13:53:54 UTC 2025","","Tasks group landing page: for chw","",""
"","4174","should not remove facility from breadcrumbs when offline user has many facilities associated","","Thu Jul 17 13:53:15 UTC 2025","passed","Thu Jul 17 13:53:19 UTC 2025","","Tasks tab breadcrumbs: for chw","",""
"","4820","should not remove facility from breadcrumbs when offline user has many facilities associated","","Thu Jul 17 13:57:51 UTC 2025","passed","Thu Jul 17 13:57:55 UTC 2025","","Message Tab - Sender Data","",""
"","1493","should set correct states from broadcast api","","Thu Jul 17 13:58:28 UTC 2025","passed","Thu Jul 17 13:58:30 UTC 2025","","RapidPro SMS Gateway: Webapp originating messages and state updates","",""
"","302","should fail with no authentication provided","","Thu Jul 17 13:58:11 UTC 2025","passed","Thu Jul 17 13:58:11 UTC 2025","","RapidPro SMS Gateway: Webapp Terminating messages","",""
"","4640","should add new district with a new person","","Thu Jul 17 13:38:34 UTC 2025","passed","Thu Jul 17 13:38:38 UTC 2025","","Add new district tests : ","",""
"","3468","should show fab when user only has can_create_places permission","","Thu Jul 17 13:43:34 UTC 2025","passed","Thu Jul 17 13:43:38 UTC 2025","","FAB actions","",""
"","5935","should show error message for bad config","","Thu Jul 17 13:36:51 UTC 2025","passed","Thu Jul 17 13:36:57 UTC 2025","","Targets","",""
"","2918","should delete the primary contact of health facility","","Thu Jul 17 13:45:22 UTC 2025","passed","Thu Jul 17 13:45:25 UTC 2025","","Create new lineage structure ","",""
"","2524","should open task with expression","","Thu Jul 17 13:53:25 UTC 2025","passed","Thu Jul 17 13:53:27 UTC 2025","","Tasks tab breadcrumbs: for chw","",""
"","2789","should download export file","","Thu Jul 17 13:57:09 UTC 2025","passed","Thu Jul 17 13:57:12 UTC 2025","","Export Messages","",""
"","4131","should edit district with contact_type","","Thu Jul 17 13:38:44 UTC 2025","passed","Thu Jul 17 13:38:48 UTC 2025","","Add new district tests : ","",""
"","8870","should display correct due dates with default settings","","Thu Jul 17 13:52:34 UTC 2025","passed","Thu Jul 17 13:52:43 UTC 2025","","Task list due dates","",""
"","63821","should load multiple pages of tasks on infinite scrolling","","Thu Jul 17 13:54:51 UTC 2025","passed","Thu Jul 17 13:55:54 UTC 2025","","Tasks","",""
"","5415","does not detect duplicates when expression is disabled","","Thu Jul 17 13:42:20 UTC 2025","passed","Thu Jul 17 13:42:25 UTC 2025","","Duplicate contact detection","",""
"","6243","changes to a loaded or list report should be reflected in the UI ","","Thu Jul 17 13:48:22 UTC 2025","passed","Thu Jul 17 13:48:29 UTC 2025","","Reports Subject","",""
"","2327","should update the states correctly from messages api","","Thu Jul 17 13:58:30 UTC 2025","passed","Thu Jul 17 13:58:33 UTC 2025","","RapidPro SMS Gateway: Webapp originating messages and state updates","",""
"","7056","detects duplicates when creating person - clears dupes when form updated","","Thu Jul 17 13:41:56 UTC 2025","passed","Thu Jul 17 13:42:03 UTC 2025","","Duplicate contact detection","",""
"","1401","should generate SMS report correctly when lacking patient_id","","Thu Jul 17 13:49:31 UTC 2025","passed","Thu Jul 17 13:49:32 UTC 2025","","Reports tab messages","",""
"","369","should fail with incorrect authentication","","Thu Jul 17 13:58:12 UTC 2025","passed","Thu Jul 17 13:58:13 UTC 2025","","RapidPro SMS Gateway: Webapp Terminating messages","",""
"","3041","should display tasks group landing page after task completion","","Thu Jul 17 13:53:50 UTC 2025","passed","Thu Jul 17 13:53:53 UTC 2025","","Tasks group landing page: for chw","",""
"","6848","should edit the name of the Family","","Thu Jul 17 13:45:33 UTC 2025","passed","Thu Jul 17 13:45:40 UTC 2025","","Create new lineage structure ","",""
"","11813","should add user with multiple places with permission","","Thu Jul 17 13:41:28 UTC 2025","passed","Thu Jul 17 13:41:40 UTC 2025","","User Test Cases -> Creating Users ->","",""
"","8781","the RHS button should show the action with custom label","","Thu Jul 17 13:37:29 UTC 2025","passed","Thu Jul 17 13:37:38 UTC 2025","","Creating custom places","",""
"","3989","should create reports","","Thu Jul 17 13:58:19 UTC 2025","passed","Thu Jul 17 13:58:23 UTC 2025","","RapidPro SMS Gateway: Webapp Terminating messages","",""
"","2816","should display conversation with link and navigate to contact","","Thu Jul 17 13:58:00 UTC 2025","passed","Thu Jul 17 13:58:03 UTC 2025","","Message Tab - Sender Data","",""
"","3302","should create new health center","","Thu Jul 17 13:44:48 UTC 2025","passed","Thu Jul 17 13:44:51 UTC 2025","","Create new lineage structure ","",""
"","2711","should update SMS statuses","","Thu Jul 17 13:56:56 UTC 2025","passed","Thu Jul 17 13:56:58 UTC 2025","","Africas Talking api: Webapp submits new GT sms messages","",""
"","5125","should show reports and tasks when permissions are enabled","","Thu Jul 17 13:39:03 UTC 2025","passed","Thu Jul 17 13:39:08 UTC 2025","","Contact details page.: Permissions to show reports and tasks","",""
"","5437","can add duplicate contact that is not a sibling","","Thu Jul 17 13:42:27 UTC 2025","passed","Thu Jul 17 13:42:32 UTC 2025","","Duplicate contact detection","",""
"","3542","should filter by form","","Thu Jul 17 13:49:02 UTC 2025","passed","Thu Jul 17 13:49:05 UTC 2025","","Reports Sidebar Filter","",""
"","7697","Should delete report","","Thu Jul 17 13:46:52 UTC 2025","passed","Thu Jul 17 13:47:00 UTC 2025","","Delete Reports","",""
"","5354","should display messages with breadcrumbs for online user","","Thu Jul 17 13:57:44 UTC 2025","passed","Thu Jul 17 13:57:50 UTC 2025","","Message Tab - Sender Data","",""
