"DESCRIPTION","DURATION IN MS","NAME","PARENT SUITE","START TIME","STATUS","STOP TIME","SUB SUITE","SUITE","TEST CLASS","TEST METHOD"
"","2334","should not show page when submitting task for contact with no leaf type place in lineage","","Thu Sep 18 13:12:42 UTC 2025","passed","Thu Sep 18 13:12:45 UTC 2025","","Tasks group landing page: for chw","",""
"","4711","should load multiple pages of contacts","","Thu Sep 18 13:02:32 UTC 2025","passed","Thu Sep 18 13:02:37 UTC 2025","","Infinite scrolling","",""
"","13490","should sync and update the offline user's home place","","Thu Sep 18 13:01:33 UTC 2025","passed","Thu Sep 18 13:01:47 UTC 2025","","Edit ","",""
"","1475","should shows content","","Thu Sep 18 13:27:04 UTC 2025","passed","Thu Sep 18 13:27:05 UTC 2025","","sms-gateway api: Gateway submits new WT sms messages","",""
"","6874","should edit the name of the CHW area","","Thu Sep 18 13:03:56 UTC 2025","passed","Thu Sep 18 13:04:02 UTC 2025","","Create new lineage structure ","",""
"","2893","should be able to do an exact match search by a field and then return all data when clearing search","","Thu Sep 18 13:07:17 UTC 2025","passed","Thu Sep 18 13:07:19 UTC 2025","","Reports Search: Logged in as an online user","",""
"","3608","should create new person","","Thu Sep 18 13:03:34 UTC 2025","passed","Thu Sep 18 13:03:37 UTC 2025","","Create new lineage structure ","",""
"","2263","should return results matching the search term and then return all data when clearing search","","Thu Sep 18 13:07:10 UTC 2025","passed","Thu Sep 18 13:07:12 UTC 2025","","Reports Search: Logged in as an online user","",""
"","33223","Should show error message for bad config","","Thu Sep 18 13:25:26 UTC 2025","passed","Thu Sep 18 13:26:00 UTC 2025","","Tasks","",""
"","8107","should show custom places in their own list","","Thu Sep 18 12:57:16 UTC 2025","passed","Thu Sep 18 12:57:24 UTC 2025","","Creating custom places","",""
"","1786","should have no results when searching by non-existent field value","","Thu Sep 18 13:07:33 UTC 2025","passed","Thu Sep 18 13:07:34 UTC 2025","","Reports Search: Logged in as an offline user","",""
"","5861","should display correct message when no target found","","Thu Sep 18 12:55:47 UTC 2025","passed","Thu Sep 18 12:55:53 UTC 2025","","Targets","",""
"","6821","should edit a name of the health facility","","Thu Sep 18 13:03:45 UTC 2025","passed","Thu Sep 18 13:03:52 UTC 2025","","Create new lineage structure ","",""
"","8028","should show the single add person button with the correct label","","Thu Sep 18 12:56:55 UTC 2025","passed","Thu Sep 18 12:57:03 UTC 2025","","Creating custom places","",""
"","3982","should add new district with a new person","","Thu Sep 18 12:57:34 UTC 2025","passed","Thu Sep 18 12:57:38 UTC 2025","","Add new district tests : ","",""
"","6879","should edit a person with a phone number","","Thu Sep 18 13:03:38 UTC 2025","passed","Thu Sep 18 13:03:45 UTC 2025","","Create new lineage structure ","",""
"","617","should have no results when searching by non-existent field value","","Thu Sep 18 13:04:40 UTC 2025","passed","Thu Sep 18 13:04:41 UTC 2025","","Contact Search: Logged in as an online user","",""
"","3421","should disable content","","Thu Sep 18 13:10:21 UTC 2025","passed","Thu Sep 18 13:10:25 UTC 2025","","Target aggregates: User with one or more places assigned: Offline user with multiple places associated","",""
"","3053","should create new health center","","Thu Sep 18 13:03:21 UTC 2025","passed","Thu Sep 18 13:03:24 UTC 2025","","Create new lineage structure ","",""
"","2179","should show fab when user only has can_create_people permission","","Thu Sep 18 13:02:17 UTC 2025","passed","Thu Sep 18 13:02:19 UTC 2025","","FAB actions","",""
"","2267","should create a report using unknown patient_id ","","Thu Sep 18 13:06:30 UTC 2025","passed","Thu Sep 18 13:06:32 UTC 2025","","Reports Subject","",""
"","1690","should display targets from default config","","Thu Sep 18 12:55:45 UTC 2025","passed","Thu Sep 18 12:55:47 UTC 2025","","Targets","",""
"","3889","should display correct tasks with breadcrumbs for chw","","Thu Sep 18 13:11:57 UTC 2025","passed","Thu Sep 18 13:12:01 UTC 2025","","Tasks tab breadcrumbs: for chw","",""
"","3857","should create reports","","Thu Sep 18 13:27:59 UTC 2025","passed","Thu Sep 18 13:28:02 UTC 2025","","RapidPro SMS Gateway: Webapp Terminating messages","",""
"","637","should display an empty list when there are no aggregates","","Thu Sep 18 13:09:20 UTC 2025","passed","Thu Sep 18 13:09:21 UTC 2025","","Target aggregates: DB admin","",""
"","6438","should download export file","","Thu Sep 18 13:01:52 UTC 2025","passed","Thu Sep 18 13:01:59 UTC 2025","","Export Contacts ","",""
"","2884","should keep updating until record is in final state","","Thu Sep 18 13:28:16 UTC 2025","passed","Thu Sep 18 13:28:19 UTC 2025","","RapidPro SMS Gateway: Webapp originating messages and state updates","",""
"","1742","should not poll messages for docs that are in pending or scheduled states or lack gateway ref ","","Thu Sep 18 13:28:13 UTC 2025","passed","Thu Sep 18 13:28:15 UTC 2025","","RapidPro SMS Gateway: Webapp originating messages and state updates","",""
"","2289","should create a report which does not have a subject","","Thu Sep 18 13:06:56 UTC 2025","passed","Thu Sep 18 13:06:59 UTC 2025","","Reports Subject","",""
"","650","should have unique results for when multiple fields match the same search text","","Thu Sep 18 13:04:41 UTC 2025","passed","Thu Sep 18 13:04:41 UTC 2025","","Contact Search: Logged in as an online user","",""
"","1650","should display correct tasks with breadcrumbs for supervisor","","Thu Sep 18 13:12:07 UTC 2025","passed","Thu Sep 18 13:12:09 UTC 2025","","Tasks tab breadcrumbs: for supervisor","",""
"","9200","should mute a contact using the defined mute_forms (death_report).","","Thu Sep 18 13:02:49 UTC 2025","passed","Thu Sep 18 13:02:58 UTC 2025","","Mute/Unmute contacts using a specific form - ","",""
"","8691","should show the multi person actions with the correct label","","Thu Sep 18 12:57:05 UTC 2025","passed","Thu Sep 18 12:57:14 UTC 2025","","Creating custom places","",""
"","120097","should load multiple pages of tasks on infinite scrolling","","Thu Sep 18 13:23:26 UTC 2025","broken","Thu Sep 18 13:25:26 UTC 2025","","Tasks","",""
"","1864","should have unique results for when multiple fields match the same search text","","Thu Sep 18 13:07:34 UTC 2025","passed","Thu Sep 18 13:07:36 UTC 2025","","Reports Search: Logged in as an offline user","",""
"","1510","should return results when searching by case_id","","Thu Sep 18 13:07:29 UTC 2025","passed","Thu Sep 18 13:07:31 UTC 2025","","Reports Search: Logged in as an offline user","",""
"","8730","should display correct due dates with default settings","","Thu Sep 18 13:11:13 UTC 2025","passed","Thu Sep 18 13:11:22 UTC 2025","","Task list due dates","",""
"","8646","should display correct due dates with taskDaysOverdue setting and simple translation","","Thu Sep 18 13:11:29 UTC 2025","passed","Thu Sep 18 13:11:38 UTC 2025","","Task list due dates","",""
"","8766","the RHS button show the appropriate label when multiple places exist at the current level","","Thu Sep 18 12:56:44 UTC 2025","passed","Thu Sep 18 12:56:53 UTC 2025","","Creating custom places","",""
"","3452","should display reports with breadcrumbs for online user","","Thu Sep 18 13:04:57 UTC 2025","passed","Thu Sep 18 13:05:01 UTC 2025","","Reports tab breadcrumbs","",""
"","1441","should shows content","","Thu Sep 18 13:26:35 UTC 2025","passed","Thu Sep 18 13:26:37 UTC 2025","","Africas Talking api: Gateway submits new WT sms messages","",""
"","4794","should show reports and tasks when permissions are enabled","","Thu Sep 18 12:58:01 UTC 2025","passed","Thu Sep 18 12:58:06 UTC 2025","","Contact details page.: Permissions to show reports and tasks","",""
"","696","search by NON empty string should display results which contains match and clears search","","Thu Sep 18 13:04:38 UTC 2025","passed","Thu Sep 18 13:04:39 UTC 2025","","Contact Search: Logged in as an online user","",""
"","9244","should create person under area should only see children","","Thu Sep 18 13:04:18 UTC 2025","passed","Thu Sep 18 13:04:27 UTC 2025","","Create Person Under Area, ","",""
"","2497","should create a report using place_id with a shortcode","","Thu Sep 18 13:06:40 UTC 2025","passed","Thu Sep 18 13:06:42 UTC 2025","","Reports Subject","",""
"","3382","should filter by place","","Thu Sep 18 13:07:57 UTC 2025","passed","Thu Sep 18 13:08:01 UTC 2025","","Reports Sidebar Filter","",""
"","2298","should return results when searching by case_id","","Thu Sep 18 13:07:14 UTC 2025","passed","Thu Sep 18 13:07:17 UTC 2025","","Reports Search: Logged in as an online user","",""
"","5043","can add duplicate contact that is not a sibling","","Thu Sep 18 13:01:09 UTC 2025","passed","Thu Sep 18 13:01:14 UTC 2025","","Duplicate contact detection","",""
"","9014","should remove task from list when CHW completes a task successfully","","Thu Sep 18 13:13:06 UTC 2025","passed","Thu Sep 18 13:13:15 UTC 2025","","Tasks","",""
"","1317","should generate SMS report correctly when lacking patient_id","","Thu Sep 18 13:08:20 UTC 2025","passed","Thu Sep 18 13:08:21 UTC 2025","","Reports tab messages","",""
"","5573","detects duplicates when creating top-level place - allows acknowledging","","Thu Sep 18 13:00:33 UTC 2025","passed","Thu Sep 18 13:00:39 UTC 2025","","Duplicate contact detection","",""
"","1675","should handle old format of the rules-state-store","","Thu Sep 18 13:09:10 UTC 2025","passed","Thu Sep 18 13:09:12 UTC 2025","","Target accuracy","",""
"","7848","should display targets of current user on home place","","Thu Sep 18 13:10:11 UTC 2025","passed","Thu Sep 18 13:10:19 UTC 2025","","Target aggregates: User with one or more places assigned: Online user with one place associated","",""
"","115","should show contact summary that has the full context for reports > 50 validate that the pregnancy card is always displayed","","Thu Sep 18 12:58:06 UTC 2025","passed","Thu Sep 18 12:58:06 UTC 2025","","Contact details page.: Permissions to show reports and tasks","",""
"","424","should fail with no incoming key configured","","Thu Sep 18 13:27:50 UTC 2025","passed","Thu Sep 18 13:27:50 UTC 2025","","RapidPro SMS Gateway: Webapp Terminating messages","",""
"","2524","Send SMS without patient_id and report created under person","","Thu Sep 18 13:27:14 UTC 2025","passed","Thu Sep 18 13:27:17 UTC 2025","","Link SMS to patient without passing id","",""
"","8095","should unmute a contact using the defined unmute_forms (undo_death_report).","","Thu Sep 18 13:02:58 UTC 2025","passed","Thu Sep 18 13:03:06 UTC 2025","","Mute/Unmute contacts using a specific form - ","",""
"","8497","should display no data when no targets are uploaded","","Thu Sep 18 13:09:27 UTC 2025","passed","Thu Sep 18 13:09:35 UTC 2025","","Target aggregates: User with one or more places assigned: Online user with one place associated","",""
"","1311","should display an error when there are aggregates but no home place","","Thu Sep 18 13:09:21 UTC 2025","passed","Thu Sep 18 13:09:22 UTC 2025","","Target aggregates: DB admin","",""
"","3952","should filter by form","","Thu Sep 18 13:07:52 UTC 2025","passed","Thu Sep 18 13:07:56 UTC 2025","","Reports Sidebar Filter","",""
"","3967","should not remove facility from breadcrumbs when offline user has many facilities associated","","Thu Sep 18 13:11:52 UTC 2025","passed","Thu Sep 18 13:11:56 UTC 2025","","Tasks tab breadcrumbs: for chw","",""
"","3657","should have tasks","","Thu Sep 18 13:12:48 UTC 2025","passed","Thu Sep 18 13:12:51 UTC 2025","","Tasks group landing page: for supervisor","",""
"","8410","the RHS button should show the action with custom label","","Thu Sep 18 12:56:34 UTC 2025","passed","Thu Sep 18 12:56:42 UTC 2025","","Creating custom places","",""
"","3379","should send messages to all the contacts, under a place, that have a primary phone number assigned","","Thu Sep 18 13:28:51 UTC 2025","passed","Thu Sep 18 13:28:54 UTC 2025","","Send message","",""
"","1233","should reply to an existing message - raw phone number","","Thu Sep 18 13:29:02 UTC 2025","passed","Thu Sep 18 13:29:03 UTC 2025","","Send message","",""
"","345","should fail when message was not created","","Thu Sep 18 13:27:54 UTC 2025","passed","Thu Sep 18 13:27:54 UTC 2025","","RapidPro SMS Gateway: Webapp Terminating messages","",""
"","653","search should clear RHS selected contact","","Thu Sep 18 13:04:39 UTC 2025","passed","Thu Sep 18 13:04:39 UTC 2025","","Contact Search: Logged in as an online user","",""
"","5782","should save target document when deleting counted contact","","Thu Sep 18 13:08:57 UTC 2025","passed","Thu Sep 18 13:09:03 UTC 2025","","Target accuracy","",""
"","970","should have tasks","","Thu Sep 18 13:12:26 UTC 2025","passed","Thu Sep 18 13:12:27 UTC 2025","","Tasks group landing page: for chw","",""
"","308","should fail with malformed authentication","","Thu Sep 18 13:27:53 UTC 2025","passed","Thu Sep 18 13:27:53 UTC 2025","","RapidPro SMS Gateway: Webapp Terminating messages","",""
"","6261","should show error message for bad config","","Thu Sep 18 12:55:57 UTC 2025","passed","Thu Sep 18 12:56:03 UTC 2025","","Targets","",""
"","17500","should display correct data","","Thu Sep 18 13:09:37 UTC 2025","passed","Thu Sep 18 13:09:54 UTC 2025","","Target aggregates: User with one or more places assigned: Online user with one place associated","",""
"","2689","should display conversation with link and navigate to contact","","Thu Sep 18 13:27:40 UTC 2025","passed","Thu Sep 18 13:27:43 UTC 2025","","Message Tab - Sender Data","",""
"","3886","should select, deselect and delete only selected reports","","Thu Sep 18 13:05:19 UTC 2025","passed","Thu Sep 18 13:05:22 UTC 2025","","Bulk delete reports","",""
"","7299","should save target document when targets change","","Thu Sep 18 13:08:35 UTC 2025","passed","Thu Sep 18 13:08:43 UTC 2025","","Target accuracy","",""
"","2777","should update the states correctly from messages api","","Thu Sep 18 13:28:10 UTC 2025","passed","Thu Sep 18 13:28:12 UTC 2025","","RapidPro SMS Gateway: Webapp originating messages and state updates","",""
"","15366","should launch an add contact form when type is provided in content","","Thu Sep 18 13:26:00 UTC 2025","passed","Thu Sep 18 13:26:15 UTC 2025","","Tasks: contact tasks","",""
"","6710","should show a popup when trying to submit a non-unmuting form against a muted contact","","Thu Sep 18 13:03:06 UTC 2025","passed","Thu Sep 18 13:03:13 UTC 2025","","Mute/Unmute contacts using a specific form - ","",""
"","5944","changes to a loaded or list report should be reflected in the UI ","","Thu Sep 18 13:06:50 UTC 2025","passed","Thu Sep 18 13:06:56 UTC 2025","","Reports Subject","",""
"","2981","should create messages","","Thu Sep 18 13:27:55 UTC 2025","passed","Thu Sep 18 13:27:58 UTC 2025","","RapidPro SMS Gateway: Webapp Terminating messages","",""
"","7115","should save target doc once when getting many changes through replication","","Thu Sep 18 13:09:03 UTC 2025","passed","Thu Sep 18 13:09:10 UTC 2025","","Target accuracy","",""
"","3530","should not display modal when clicking list task from same group","","Thu Sep 18 13:12:34 UTC 2025","passed","Thu Sep 18 13:12:38 UTC 2025","","Tasks group landing page: for chw","",""
"","602","should have unique results for when multiple fields match the same search text","","Thu Sep 18 13:04:47 UTC 2025","passed","Thu Sep 18 13:04:47 UTC 2025","","Contact Search: Logged in as an offline user","",""
"","9539","the LHS button should show the appropriate label when only one action","","Thu Sep 18 12:56:08 UTC 2025","passed","Thu Sep 18 12:56:17 UTC 2025","","Creating custom places","",""
"","10394","should update a contact, delete the same contact then unassign primary contact from facility","","Thu Sep 18 13:01:23 UTC 2025","passed","Thu Sep 18 13:01:33 UTC 2025","","Edit ","",""
"","6931","should download export file","","Thu Sep 18 13:05:39 UTC 2025","passed","Thu Sep 18 13:05:46 UTC 2025","","Export Reports","",""
"","3781","should filter by status","","Thu Sep 18 13:08:02 UTC 2025","passed","Thu Sep 18 13:08:06 UTC 2025","","Reports Sidebar Filter","",""
"","9949","should launch an edit contact form when edit_id is provided in content","","Thu Sep 18 13:26:15 UTC 2025","passed","Thu Sep 18 13:26:25 UTC 2025","","Tasks: contact tasks","",""
"","547","search should clear RHS selected contact","","Thu Sep 18 13:04:45 UTC 2025","passed","Thu Sep 18 13:04:46 UTC 2025","","Contact Search: Logged in as an offline user","",""
"","1660","should not display task landing page after task completion","","Thu Sep 18 13:12:51 UTC 2025","passed","Thu Sep 18 13:12:53 UTC 2025","","Tasks group landing page: for supervisor","",""
"","1869","should be able to do an exact match search by a field and then return all data when clearing search","","Thu Sep 18 13:07:31 UTC 2025","passed","Thu Sep 18 13:07:33 UTC 2025","","Reports Search: Logged in as an offline user","",""
"","631","should be able to do exact match searching by a field","","Thu Sep 18 13:04:46 UTC 2025","passed","Thu Sep 18 13:04:46 UTC 2025","","Contact Search: Logged in as an offline user","",""
"","431","should fail with no authentication provided","","Thu Sep 18 13:27:51 UTC 2025","passed","Thu Sep 18 13:27:51 UTC 2025","","RapidPro SMS Gateway: Webapp Terminating messages","",""
"","7064","Should delete report","","Thu Sep 18 13:05:27 UTC 2025","passed","Thu Sep 18 13:05:34 UTC 2025","","Delete Reports","",""
"","5693","detects duplicates from a custom duplicate expression","","Thu Sep 18 13:00:56 UTC 2025","passed","Thu Sep 18 13:01:01 UTC 2025","","Duplicate contact detection","",""
"","1445","should set correct states from broadcast api","","Thu Sep 18 13:28:07 UTC 2025","passed","Thu Sep 18 13:28:09 UTC 2025","","RapidPro SMS Gateway: Webapp originating messages and state updates","",""
"","390","should fail with incorrect authentication","","Thu Sep 18 13:27:52 UTC 2025","passed","Thu Sep 18 13:27:52 UTC 2025","","RapidPro SMS Gateway: Webapp Terminating messages","",""
"","4800","does not detect duplicates when expression is disabled","","Thu Sep 18 13:01:03 UTC 2025","passed","Thu Sep 18 13:01:08 UTC 2025","","Duplicate contact detection","",""
"","1429","should show new household and new person create option","","Thu Sep 18 13:02:08 UTC 2025","passed","Thu Sep 18 13:02:10 UTC 2025","","FAB actions","",""
"","4010","should edit district","","Thu Sep 18 12:57:38 UTC 2025","passed","Thu Sep 18 12:57:42 UTC 2025","","Add new district tests : ","",""
"","2200","should create a report using place_id with a place_uuid","","Thu Sep 18 13:06:37 UTC 2025","passed","Thu Sep 18 13:06:40 UTC 2025","","Reports Subject","",""
"","3297","should show error log for bad config","","Thu Sep 18 13:00:01 UTC 2025","passed","Thu Sep 18 13:00:04 UTC 2025","","Contact details page.: Contact summary error","",""
"","1356","should create case ID","","Thu Sep 18 13:05:54 UTC 2025","passed","Thu Sep 18 13:05:56 UTC 2025","","Generating short codes","",""
"","3298","should display reports with updated breadcrumbs for offline user","","Thu Sep 18 13:05:06 UTC 2025","passed","Thu Sep 18 13:05:09 UTC 2025","","Reports tab breadcrumbs","",""
"","6039","detects duplicates when creating person - clears dupes when form updated","","Thu Sep 18 13:00:41 UTC 2025","passed","Thu Sep 18 13:00:47 UTC 2025","","Duplicate contact detection","",""
"","1906","should display only the targets sections and show the correct message when target aggregates are disabled","","Thu Sep 18 13:10:26 UTC 2025","passed","Thu Sep 18 13:10:28 UTC 2025","","Target aggregates: User with one or more places assigned: Offline user with multiple places associated","",""
"","2133","should send a message to a contact with a phone number","","Thu Sep 18 13:28:59 UTC 2025","passed","Thu Sep 18 13:29:02 UTC 2025","","Send message","",""
"","4243","should create new area","","Thu Sep 18 13:03:24 UTC 2025","passed","Thu Sep 18 13:03:29 UTC 2025","","Create new lineage structure ","",""
"","11518","should add user with multiple places with permission","","Thu Sep 18 13:00:14 UTC 2025","passed","Thu Sep 18 13:00:26 UTC 2025","","User Test Cases -> Creating Users ->","",""
"","3082","should download export file","","Thu Sep 18 13:26:52 UTC 2025","passed","Thu Sep 18 13:26:56 UTC 2025","","Export Messages","",""
"","2609","should create a report using patient_id","","Thu Sep 18 13:06:24 UTC 2025","passed","Thu Sep 18 13:06:27 UTC 2025","","Reports Subject","",""
"","2512","should have no results when searching by non-existent field value","","Thu Sep 18 13:07:19 UTC 2025","passed","Thu Sep 18 13:07:22 UTC 2025","","Reports Search: Logged in as an online user","",""
"","6044","should load multiple pages of reports","","Thu Sep 18 13:06:06 UTC 2025","passed","Thu Sep 18 13:06:12 UTC 2025","","Infinite scrolling","",""
"","9897","should handle rate limiting when polling","","Thu Sep 18 13:28:30 UTC 2025","passed","Thu Sep 18 13:28:40 UTC 2025","","RapidPro SMS Gateway: Webapp originating messages and state updates","",""
"","10716","should add a task when CHW completes a task successfully, and that task creates another task","","Thu Sep 18 13:13:15 UTC 2025","passed","Thu Sep 18 13:13:26 UTC 2025","","Tasks","",""
"","5953","should not save target document when editing counted contact","","Thu Sep 18 13:08:43 UTC 2025","passed","Thu Sep 18 13:08:48 UTC 2025","","Target accuracy","",""
"","3037","should display tasks group landing page after task completion","","Thu Sep 18 13:12:27 UTC 2025","passed","Thu Sep 18 13:12:30 UTC 2025","","Tasks group landing page: for chw","",""
"","4118","should edit district with contact_type","","Thu Sep 18 12:57:43 UTC 2025","passed","Thu Sep 18 12:57:47 UTC 2025","","Add new district tests : ","",""
"","3569","should display correct message when targets are disabled","","Thu Sep 18 12:55:53 UTC 2025","passed","Thu Sep 18 12:55:56 UTC 2025","","Targets","",""
"","1263","should shows content","","Thu Sep 18 13:27:05 UTC 2025","passed","Thu Sep 18 13:27:06 UTC 2025","","sms-gateway api: Gateway submits WT sms status updates","",""
"","661","should be able to do exact match searching by a field","","Thu Sep 18 13:04:39 UTC 2025","passed","Thu Sep 18 13:04:40 UTC 2025","","Contact Search: Logged in as an online user","",""
"","4994","should filter by date","","Thu Sep 18 13:07:46 UTC 2025","passed","Thu Sep 18 13:07:51 UTC 2025","","Reports Sidebar Filter","",""
"","6195","detects duplicates when editing a contact - navigates to duplicate contact","","Thu Sep 18 13:00:48 UTC 2025","passed","Thu Sep 18 13:00:54 UTC 2025","","Duplicate contact detection","",""
"","19303","should not show tasks when permission is disabled","","Thu Sep 18 12:58:35 UTC 2025","passed","Thu Sep 18 12:58:54 UTC 2025","","Contact details page.: Permissions to show reports and tasks","",""
"","4371","should not remove facility from breadcrumbs when offline user has many facilities associated","","Thu Sep 18 13:27:32 UTC 2025","passed","Thu Sep 18 13:27:37 UTC 2025","","Message Tab - Sender Data","",""
"","3197","should show fab when user only has can_create_places permission","","Thu Sep 18 13:02:11 UTC 2025","passed","Thu Sep 18 13:02:14 UTC 2025","","FAB actions","",""
"","5336","should display messages with breadcrumbs for online user","","Thu Sep 18 13:27:26 UTC 2025","passed","Thu Sep 18 13:27:31 UTC 2025","","Message Tab - Sender Data","",""
"","4396","should create new household","","Thu Sep 18 13:03:29 UTC 2025","passed","Thu Sep 18 13:03:33 UTC 2025","","Create new lineage structure ","",""
"","8690","should not save target document when adding report for counted contact","","Thu Sep 18 13:08:48 UTC 2025","passed","Thu Sep 18 13:08:57 UTC 2025","","Target accuracy","",""
"","76","should only create one target doc","","Thu Sep 18 13:09:10 UTC 2025","passed","Thu Sep 18 13:09:10 UTC 2025","","Target accuracy","",""
"","11326","should route to contact-detail on list item click and display contact summary target card","","Thu Sep 18 13:09:57 UTC 2025","passed","Thu Sep 18 13:10:09 UTC 2025","","Target aggregates: User with one or more places assigned: Online user with one place associated","",""
"","2403","should shows content","","Thu Sep 18 13:26:37 UTC 2025","passed","Thu Sep 18 13:26:39 UTC 2025","","Africas Talking api: Gateway submits WT sms status updates","",""
"","1893","should not call RapidPro endpoint when credentials are not set","","Thu Sep 18 13:28:03 UTC 2025","passed","Thu Sep 18 13:28:05 UTC 2025","","RapidPro SMS Gateway: Webapp originating messages and state updates","",""
"","2265","should create a report using unknown place_id","","Thu Sep 18 13:06:43 UTC 2025","passed","Thu Sep 18 13:06:45 UTC 2025","","Reports Subject","",""
"","28817","should not show reports when permission is disabled","","Thu Sep 18 12:58:06 UTC 2025","passed","Thu Sep 18 12:58:35 UTC 2025","","Contact details page.: Permissions to show reports and tasks","",""
"","3467","should not remove facility from breadcrumbs when offline user has many facilities associated","","Thu Sep 18 13:05:02 UTC 2025","passed","Thu Sep 18 13:05:05 UTC 2025","","Reports tab breadcrumbs","",""
"","3734","should filter by user associated place when the permission to default filter is enabled","","Thu Sep 18 13:08:07 UTC 2025","passed","Thu Sep 18 13:08:10 UTC 2025","","Reports Sidebar Filter","",""
"","2893","should display modal when clicking on a task from another group","","Thu Sep 18 13:12:31 UTC 2025","passed","Thu Sep 18 13:12:34 UTC 2025","","Tasks group landing page: for chw","",""
