"DESCRIPTION","DURATION IN MS","NAME","PARENT SUITE","START TIME","STATUS","STOP TIME","SUB SUITE","SUITE","TEST CLASS","TEST METHOD"
"","10314","should launch an edit contact form when edit_id is provided in content","","Mon Jun 16 12:02:40 UTC 2025","passed","Mon Jun 16 12:02:50 UTC 2025","","Tasks: contact tasks","",""
"","2332","should create a report using patient name","","Mon Jun 16 11:53:52 UTC 2025","passed","Mon Jun 16 11:53:54 UTC 2025","","Reports Subject","",""
"","3283","should show error log for bad config","","Mon Jun 16 11:47:34 UTC 2025","passed","Mon Jun 16 11:47:38 UTC 2025","","Contact details page.: Contact summary error","",""
"","4120","should not remove facility from breadcrumbs when offline user has many facilities associated","","Mon Jun 16 11:58:42 UTC 2025","passed","Mon Jun 16 11:58:46 UTC 2025","","Tasks tab breadcrumbs: for chw","",""
"","5394","should show reports and tasks when permissions are enabled","","Mon Jun 16 11:45:28 UTC 2025","passed","Mon Jun 16 11:45:33 UTC 2025","","Contact details page.: Permissions to show reports and tasks","",""
"","2232","should create a report using place_id with a shortcode","","Mon Jun 16 11:54:00 UTC 2025","passed","Mon Jun 16 11:54:02 UTC 2025","","Reports Subject","",""
"","6556","should download export file","","Mon Jun 16 11:52:58 UTC 2025","passed","Mon Jun 16 11:53:04 UTC 2025","","Export Reports","",""
"","13661","should update a contact, delete the same contact then unassign primary contact from facility","","Mon Jun 16 11:48:54 UTC 2025","passed","Mon Jun 16 11:49:08 UTC 2025","","Edit ","",""
"","2515","should return results matching the search term and then return all data when clearing search","","Mon Jun 16 11:54:28 UTC 2025","passed","Mon Jun 16 11:54:30 UTC 2025","","Reports Search","",""
"","2857","should display conversation with link and navigate to contact","","Mon Jun 16 12:04:02 UTC 2025","passed","Mon Jun 16 12:04:04 UTC 2025","","Message Tab - Sender Data","",""
"","3235","should show fab when user only has can_create_places permission","","Mon Jun 16 11:49:45 UTC 2025","passed","Mon Jun 16 11:49:48 UTC 2025","","FAB actions","",""
"","7779","should poll for state updates and consume queue","","Mon Jun 16 12:04:42 UTC 2025","passed","Mon Jun 16 12:04:50 UTC 2025","","RapidPro SMS Gateway: Webapp originating messages and state updates","",""
"","4629","should add new district with a new person","","Mon Jun 16 11:45:00 UTC 2025","passed","Mon Jun 16 11:45:04 UTC 2025","","Add new district tests : ","",""
"","4977","should not remove facility from breadcrumbs when offline user has many facilities associated","","Mon Jun 16 12:03:52 UTC 2025","passed","Mon Jun 16 12:03:57 UTC 2025","","Message Tab - Sender Data","",""
"","131","should show contact summary that has the full context for reports > 50 validate that the pregnancy card is always displayed","","Mon Jun 16 11:45:33 UTC 2025","passed","Mon Jun 16 11:45:33 UTC 2025","","Contact details page.: Permissions to show reports and tasks","",""
"","5847","should display correct message when no target found","","Mon Jun 16 11:43:14 UTC 2025","passed","Mon Jun 16 11:43:20 UTC 2025","","Targets","",""
"","1069","should have tasks","","Mon Jun 16 11:59:16 UTC 2025","passed","Mon Jun 16 11:59:17 UTC 2025","","Tasks group landing page: for chw","",""
"","9787","should handle rate limiting when polling","","Mon Jun 16 12:04:52 UTC 2025","passed","Mon Jun 16 12:05:02 UTC 2025","","RapidPro SMS Gateway: Webapp originating messages and state updates","",""
"","2248","should send a message to a raw phone number","","Mon Jun 16 12:05:16 UTC 2025","passed","Mon Jun 16 12:05:19 UTC 2025","","Send message","",""
"","1419","should set correct states from broadcast api","","Mon Jun 16 12:04:30 UTC 2025","passed","Mon Jun 16 12:04:31 UTC 2025","","RapidPro SMS Gateway: Webapp originating messages and state updates","",""
"","9127","should route to contact-detail on list item click and display contact summary target card","","Mon Jun 16 11:56:50 UTC 2025","passed","Mon Jun 16 11:56:59 UTC 2025","","Target aggregates: User with one or more places assigned: Online user with one place associated","",""
"","69","should only create one target doc","","Mon Jun 16 11:56:03 UTC 2025","passed","Mon Jun 16 11:56:03 UTC 2025","","Target accuracy","",""
"","3419","should display reports with updated breadcrumbs for offline user","","Mon Jun 16 11:52:25 UTC 2025","passed","Mon Jun 16 11:52:29 UTC 2025","","Reports tab breadcrumbs","",""
"","363","should fail with incorrect authentication","","Mon Jun 16 12:04:14 UTC 2025","passed","Mon Jun 16 12:04:14 UTC 2025","","RapidPro SMS Gateway: Webapp Terminating messages","",""
"","31971","should filter aggregates by place and period","","Mon Jun 16 11:57:17 UTC 2025","passed","Mon Jun 16 11:57:49 UTC 2025","","Target aggregates: User with one or more places assigned: Offline user with multiple places associated","",""
"","1303","should generate SMS report correctly when lacking patient_id","","Mon Jun 16 11:55:15 UTC 2025","passed","Mon Jun 16 11:55:16 UTC 2025","","Reports tab messages","",""
"","2410","should create a report using place_id with a place_uuid","","Mon Jun 16 11:53:57 UTC 2025","passed","Mon Jun 16 11:53:59 UTC 2025","","Reports Subject","",""
"","7792","should display correct due dates with taskDaysOverdue setting","","Mon Jun 16 11:58:11 UTC 2025","passed","Mon Jun 16 11:58:19 UTC 2025","","Task list due dates","",""
"","6380","should download export file","","Mon Jun 16 11:49:27 UTC 2025","passed","Mon Jun 16 11:49:33 UTC 2025","","Export Contacts ","",""
"","5937","detects duplicates when editing a contact - navigates to duplicate contact","","Mon Jun 16 11:48:21 UTC 2025","passed","Mon Jun 16 11:48:27 UTC 2025","","Duplicate contact detection","",""
"","3657","should create new person","","Mon Jun 16 11:51:04 UTC 2025","passed","Mon Jun 16 11:51:07 UTC 2025","","Create new lineage structure ","",""
"","1265","should display an error when there are aggregates but no home place","","Mon Jun 16 11:56:14 UTC 2025","passed","Mon Jun 16 11:56:15 UTC 2025","","Target aggregates: DB admin","",""
"","3440","should display correct message when targets are disabled","","Mon Jun 16 11:43:20 UTC 2025","passed","Mon Jun 16 11:43:23 UTC 2025","","Targets","",""
"","8410","should show custom places in their own list","","Mon Jun 16 11:44:41 UTC 2025","passed","Mon Jun 16 11:44:50 UTC 2025","","Creating custom places","",""
"","2488","should return results when searching by case_id","","Mon Jun 16 11:54:30 UTC 2025","passed","Mon Jun 16 11:54:33 UTC 2025","","Reports Search","",""
"","4209","should create new household","","Mon Jun 16 11:50:59 UTC 2025","passed","Mon Jun 16 11:51:03 UTC 2025","","Create new lineage structure ","",""
"","1371","should open task from the same group","","Mon Jun 16 11:59:20 UTC 2025","passed","Mon Jun 16 11:59:21 UTC 2025","","Tasks group landing page: for chw","",""
"","8269","the RHS button should show the action with custom label","","Mon Jun 16 11:44:00 UTC 2025","passed","Mon Jun 16 11:44:08 UTC 2025","","Creating custom places","",""
"","3554","should send messages to all the contacts, under a place, that have a primary phone number assigned","","Mon Jun 16 12:05:13 UTC 2025","passed","Mon Jun 16 12:05:16 UTC 2025","","Send message","",""
"","5466","should load multiple pages of contacts","","Mon Jun 16 11:50:05 UTC 2025","passed","Mon Jun 16 11:50:11 UTC 2025","","Infinite scrolling","",""
"","2285","should shows content","","Mon Jun 16 12:03:02 UTC 2025","passed","Mon Jun 16 12:03:04 UTC 2025","","Africas Talking api: Gateway submits WT sms status updates","",""
"","10827","should add user with multiple places with permission","","Mon Jun 16 11:47:48 UTC 2025","passed","Mon Jun 16 11:47:59 UTC 2025","","User Test Cases -> Creating Users ->","",""
"","2400","should create a report using missing required patient name","","Mon Jun 16 11:53:54 UTC 2025","passed","Mon Jun 16 11:53:57 UTC 2025","","Reports Subject","",""
"","1110","should reply to an existing message - raw phone number","","Mon Jun 16 12:05:21 UTC 2025","passed","Mon Jun 16 12:05:22 UTC 2025","","Send message","",""
"","2837","should delete the primary contact of health facility","","Mon Jun 16 11:51:22 UTC 2025","passed","Mon Jun 16 11:51:25 UTC 2025","","Create new lineage structure ","",""
"","6093","changes to a loaded or list report should be reflected in the UI ","","Mon Jun 16 11:54:10 UTC 2025","passed","Mon Jun 16 11:54:16 UTC 2025","","Reports Subject","",""
"","4560","does not detect duplicates when expression is disabled","","Mon Jun 16 11:48:35 UTC 2025","passed","Mon Jun 16 11:48:39 UTC 2025","","Duplicate contact detection","",""
"","5070","should filter by date","","Mon Jun 16 11:54:41 UTC 2025","passed","Mon Jun 16 11:54:46 UTC 2025","","Reports Sidebar Filter","",""
"","2489","should reply to an existing message and add a new recipient - raw phone number ","","Mon Jun 16 12:05:23 UTC 2025","passed","Mon Jun 16 12:05:26 UTC 2025","","Send message","",""
"","7889","should mute a contact using the defined mute_forms (death_report).","","Mon Jun 16 11:50:23 UTC 2025","passed","Mon Jun 16 11:50:31 UTC 2025","","Mute/Unmute contacts using a specific form - ","",""
"","1419","should show new household and new person create option","","Mon Jun 16 11:49:42 UTC 2025","passed","Mon Jun 16 11:49:44 UTC 2025","","FAB actions","",""
"","1811","should display targets from default config","","Mon Jun 16 11:43:12 UTC 2025","passed","Mon Jun 16 11:43:14 UTC 2025","","Targets","",""
"","4786","should not show page when there are no more household tasks","","Mon Jun 16 11:59:29 UTC 2025","passed","Mon Jun 16 11:59:33 UTC 2025","","Tasks group landing page: for chw","",""
"","2319","should update the states correctly from messages api","","Mon Jun 16 12:04:32 UTC 2025","passed","Mon Jun 16 12:04:34 UTC 2025","","RapidPro SMS Gateway: Webapp originating messages and state updates","",""
"","7582","should save target doc once when getting many changes through replication","","Mon Jun 16 11:55:55 UTC 2025","passed","Mon Jun 16 11:56:03 UTC 2025","","Target accuracy","",""
"","577","should display an empty list when there are no aggregates","","Mon Jun 16 11:56:13 UTC 2025","passed","Mon Jun 16 11:56:14 UTC 2025","","Target aggregates: DB admin","",""
"","752","search by NON empty string should display results with contains match and clears search","","Mon Jun 16 11:52:06 UTC 2025","passed","Mon Jun 16 11:52:07 UTC 2025","","Contact Search","",""
"","1028","should call endpoint with set credentials","","Mon Jun 16 12:04:28 UTC 2025","passed","Mon Jun 16 12:04:29 UTC 2025","","RapidPro SMS Gateway: Webapp originating messages and state updates","",""
"","1912","should display only the targets sections and show the correct message when target aggregates are disabled","","Mon Jun 16 11:57:14 UTC 2025","passed","Mon Jun 16 11:57:16 UTC 2025","","Target aggregates: User with one or more places assigned: Offline user with multiple places associated","",""
"","3267","should not display modal when clicking list task from same group","","Mon Jun 16 11:59:25 UTC 2025","passed","Mon Jun 16 11:59:29 UTC 2025","","Tasks group landing page: for chw","",""
"","2766","should open task with expression","","Mon Jun 16 11:58:52 UTC 2025","passed","Mon Jun 16 11:58:55 UTC 2025","","Tasks tab breadcrumbs: for chw","",""
"","14971","should launch an add contact form when type is provided in content","","Mon Jun 16 12:02:24 UTC 2025","passed","Mon Jun 16 12:02:39 UTC 2025","","Tasks: contact tasks","",""
"","3152","should have tasks","","Mon Jun 16 11:59:39 UTC 2025","passed","Mon Jun 16 11:59:42 UTC 2025","","Tasks group landing page: for supervisor","",""
"","56858","should not show reports when permission is disabled","","Mon Jun 16 11:45:33 UTC 2025","passed","Mon Jun 16 11:46:30 UTC 2025","","Contact details page.: Permissions to show reports and tasks","",""
"","3961","should edit district with contact_type","","Mon Jun 16 11:45:09 UTC 2025","passed","Mon Jun 16 11:45:13 UTC 2025","","Add new district tests : ","",""
"","8832","should display correct due dates with default settings","","Mon Jun 16 11:58:02 UTC 2025","passed","Mon Jun 16 11:58:11 UTC 2025","","Task list due dates","",""
"","2649","should create a report using patient_id","","Mon Jun 16 11:53:43 UTC 2025","passed","Mon Jun 16 11:53:46 UTC 2025","","Reports Subject","",""
"","415","should fail with no authentication provided","","Mon Jun 16 12:04:13 UTC 2025","passed","Mon Jun 16 12:04:13 UTC 2025","","RapidPro SMS Gateway: Webapp Terminating messages","",""
"","2170","should create a report which has an unknown sender with no phone number","","Mon Jun 16 11:54:07 UTC 2025","passed","Mon Jun 16 11:54:09 UTC 2025","","Reports Subject","",""
"","2994","should disable content","","Mon Jun 16 11:57:09 UTC 2025","passed","Mon Jun 16 11:57:12 UTC 2025","","Target aggregates: User with one or more places assigned: Offline user with multiple places associated","",""
"","5592","detects duplicates when creating top-level place - allows acknowledging","","Mon Jun 16 11:48:06 UTC 2025","passed","Mon Jun 16 11:48:12 UTC 2025","","Duplicate contact detection","",""
"","6741","should edit a name of the health facility","","Mon Jun 16 11:51:15 UTC 2025","passed","Mon Jun 16 11:51:22 UTC 2025","","Create new lineage structure ","",""
"","11216","the LHS button should show the appropriate label when multiple places exist at the current level","","Mon Jun 16 11:43:47 UTC 2025","passed","Mon Jun 16 11:43:58 UTC 2025","","Creating custom places","",""
"","8807","should display correct due dates with taskDaysOverdue setting and simple translation","","Mon Jun 16 11:58:19 UTC 2025","passed","Mon Jun 16 11:58:28 UTC 2025","","Task list due dates","",""
"","6887","should save target document when targets change","","Mon Jun 16 11:55:30 UTC 2025","passed","Mon Jun 16 11:55:36 UTC 2025","","Target accuracy","",""
"","351","should fail when message was not created","","Mon Jun 16 12:04:16 UTC 2025","passed","Mon Jun 16 12:04:16 UTC 2025","","RapidPro SMS Gateway: Webapp Terminating messages","",""
"","2264","should send a message to a contact with a phone number","","Mon Jun 16 12:05:19 UTC 2025","passed","Mon Jun 16 12:05:21 UTC 2025","","Send message","",""
"","1268","should create case ID","","Mon Jun 16 11:53:12 UTC 2025","passed","Mon Jun 16 11:53:14 UTC 2025","","Generating short codes","",""
"","3752","should select, deselect and delete only selected reports","","Mon Jun 16 11:52:37 UTC 2025","passed","Mon Jun 16 11:52:41 UTC 2025","","Bulk delete reports","",""
"","8224","should not save target document when adding report for counted contact","","Mon Jun 16 11:55:42 UTC 2025","passed","Mon Jun 16 11:55:50 UTC 2025","","Target accuracy","",""
"","3465","should display reports with breadcrumbs for online user","","Mon Jun 16 11:52:16 UTC 2025","passed","Mon Jun 16 11:52:20 UTC 2025","","Reports tab breadcrumbs","",""
"","6090","should show a popup when trying to submit a non-unmuting form against a muted contact","","Mon Jun 16 11:50:38 UTC 2025","passed","Mon Jun 16 11:50:44 UTC 2025","","Mute/Unmute contacts using a specific form - ","",""
"","7364","Should delete report","","Mon Jun 16 11:52:45 UTC 2025","passed","Mon Jun 16 11:52:53 UTC 2025","","Delete Reports","",""
"","13773","should sync and update the offline user's home place","","Mon Jun 16 11:49:08 UTC 2025","passed","Mon Jun 16 11:49:21 UTC 2025","","Edit ","",""
"","2810","should download export file","","Mon Jun 16 12:03:14 UTC 2025","passed","Mon Jun 16 12:03:17 UTC 2025","","Export Messages","",""
"","4829","can add duplicate contact that is not a sibling","","Mon Jun 16 11:48:41 UTC 2025","passed","Mon Jun 16 11:48:45 UTC 2025","","Duplicate contact detection","",""
"","5875","should display targets of current user on home place","","Mon Jun 16 11:57:01 UTC 2025","passed","Mon Jun 16 11:57:07 UTC 2025","","Target aggregates: User with one or more places assigned: Online user with one place associated","",""
"","3188","should create messages","","Mon Jun 16 12:04:17 UTC 2025","passed","Mon Jun 16 12:04:20 UTC 2025","","RapidPro SMS Gateway: Webapp Terminating messages","",""
"","4051","should edit district","","Mon Jun 16 11:45:05 UTC 2025","passed","Mon Jun 16 11:45:09 UTC 2025","","Add new district tests : ","",""
"","1443","should shows content","","Mon Jun 16 12:03:24 UTC 2025","passed","Mon Jun 16 12:03:26 UTC 2025","","sms-gateway api: Gateway submits new WT sms messages","",""
"","3562","should not remove facility from breadcrumbs when offline user has many facilities associated","","Mon Jun 16 11:52:21 UTC 2025","passed","Mon Jun 16 11:52:24 UTC 2025","","Reports tab breadcrumbs","",""
"","2498","Send SMS without patient_id and report created under person","","Mon Jun 16 12:03:35 UTC 2025","passed","Mon Jun 16 12:03:38 UTC 2025","","Link SMS to patient without passing id","",""
"","6820","should edit a person with a phone number","","Mon Jun 16 11:51:08 UTC 2025","passed","Mon Jun 16 11:51:15 UTC 2025","","Create new lineage structure ","",""
"","5661","should save target document when deleting counted contact","","Mon Jun 16 11:55:50 UTC 2025","passed","Mon Jun 16 11:55:55 UTC 2025","","Target accuracy","",""
"","3961","should display correct tasks with breadcrumbs for chw","","Mon Jun 16 11:58:47 UTC 2025","passed","Mon Jun 16 11:58:51 UTC 2025","","Tasks tab breadcrumbs: for chw","",""
"","4094","should create reports","","Mon Jun 16 12:04:21 UTC 2025","passed","Mon Jun 16 12:04:25 UTC 2025","","RapidPro SMS Gateway: Webapp Terminating messages","",""
"","3094","should keep updating until record is in final state","","Mon Jun 16 12:04:38 UTC 2025","passed","Mon Jun 16 12:04:41 UTC 2025","","RapidPro SMS Gateway: Webapp originating messages and state updates","",""
"","2324","should reply to an existing message and add a new recipient - contact with a phone number ","","Mon Jun 16 12:05:26 UTC 2025","passed","Mon Jun 16 12:05:28 UTC 2025","","Send message","",""
"","8485","the RHS button show the appropriate label when multiple places exist at the current level","","Mon Jun 16 11:44:10 UTC 2025","passed","Mon Jun 16 11:44:18 UTC 2025","","Creating custom places","",""
"","1763","should not poll messages for docs that are in pending or scheduled states or lack gateway ref ","","Mon Jun 16 12:04:36 UTC 2025","passed","Mon Jun 16 12:04:37 UTC 2025","","RapidPro SMS Gateway: Webapp originating messages and state updates","",""
"","6097","detects duplicates when creating person - clears dupes when form updated","","Mon Jun 16 11:48:13 UTC 2025","passed","Mon Jun 16 11:48:19 UTC 2025","","Duplicate contact detection","",""
"","2351","should create a report using unknown place_id","","Mon Jun 16 11:54:02 UTC 2025","passed","Mon Jun 16 11:54:04 UTC 2025","","Reports Subject","",""
"","5844","should show error message for bad config","","Mon Jun 16 11:43:24 UTC 2025","passed","Mon Jun 16 11:43:29 UTC 2025","","Targets","",""
"","1188","should shows content","","Mon Jun 16 12:03:26 UTC 2025","passed","Mon Jun 16 12:03:27 UTC 2025","","sms-gateway api: Gateway submits WT sms status updates","",""
"","8581","should show the multi person actions with the correct label","","Mon Jun 16 11:44:31 UTC 2025","passed","Mon Jun 16 11:44:39 UTC 2025","","Creating custom places","",""
"","3805","should filter by user associated place when the permission to default filter is enabled","","Mon Jun 16 11:55:02 UTC 2025","passed","Mon Jun 16 11:55:05 UTC 2025","","Reports Sidebar Filter","",""
"","4909","should display messages with breadcrumbs for online user","","Mon Jun 16 12:03:47 UTC 2025","passed","Mon Jun 16 12:03:52 UTC 2025","","Message Tab - Sender Data","",""
"","2547","should display messages with updated breadcrumbs for offline user","","Mon Jun 16 12:03:58 UTC 2025","passed","Mon Jun 16 12:04:01 UTC 2025","","Message Tab - Sender Data","",""
"","7381","should load multiple pages of reports","","Mon Jun 16 11:53:24 UTC 2025","passed","Mon Jun 16 11:53:31 UTC 2025","","Infinite scrolling","",""
"","2437","should create a report which does not have a subject","","Mon Jun 16 11:54:16 UTC 2025","passed","Mon Jun 16 11:54:19 UTC 2025","","Reports Subject","",""
"","19326","should not show tasks when permission is disabled","","Mon Jun 16 11:46:30 UTC 2025","passed","Mon Jun 16 11:46:49 UTC 2025","","Contact details page.: Permissions to show reports and tasks","",""
"","2532","should create a report using doc id","","Mon Jun 16 11:53:46 UTC 2025","passed","Mon Jun 16 11:53:49 UTC 2025","","Reports Subject","",""
"","10527","should remove task from list when CHW completes a task successfully","","Mon Jun 16 11:59:54 UTC 2025","passed","Mon Jun 16 12:00:04 UTC 2025","","Tasks","",""
"","7008","should unmute a contact using the defined unmute_forms (undo_death_report).","","Mon Jun 16 11:50:31 UTC 2025","passed","Mon Jun 16 11:50:38 UTC 2025","","Mute/Unmute contacts using a specific form - ","",""
"","3810","should display modal when clicking on a task from another group","","Mon Jun 16 11:59:21 UTC 2025","passed","Mon Jun 16 11:59:25 UTC 2025","","Tasks group landing page: for chw","",""
"","3019","should create new health center","","Mon Jun 16 11:50:51 UTC 2025","passed","Mon Jun 16 11:50:54 UTC 2025","","Create new lineage structure ","",""
"","3421","should send a message using FAB at people's tab","","Mon Jun 16 12:05:28 UTC 2025","passed","Mon Jun 16 12:05:31 UTC 2025","","Send message","",""
"","17709","should display correct data","","Mon Jun 16 11:56:30 UTC 2025","passed","Mon Jun 16 11:56:48 UTC 2025","","Target aggregates: User with one or more places assigned: Online user with one place associated","",""
"","11397","should add a task when CHW completes a task successfully, and that task creates another task","","Mon Jun 16 12:00:06 UTC 2025","passed","Mon Jun 16 12:00:17 UTC 2025","","Tasks","",""
"","325","should fail with malformed authentication","","Mon Jun 16 12:04:15 UTC 2025","passed","Mon Jun 16 12:04:15 UTC 2025","","RapidPro SMS Gateway: Webapp Terminating messages","",""
"","2199","should create a report which has an unknown sender and a known subject","","Mon Jun 16 11:54:05 UTC 2025","passed","Mon Jun 16 11:54:07 UTC 2025","","Reports Subject","",""
"","3258","should display tasks group landing page after task completion","","Mon Jun 16 11:59:17 UTC 2025","passed","Mon Jun 16 11:59:20 UTC 2025","","Tasks group landing page: for chw","",""
"","1823","should not call RapidPro endpoint when credentials are not set","","Mon Jun 16 12:04:26 UTC 2025","passed","Mon Jun 16 12:04:28 UTC 2025","","RapidPro SMS Gateway: Webapp originating messages and state updates","",""
"","694","search should clear RHS selected contact","","Mon Jun 16 11:52:07 UTC 2025","passed","Mon Jun 16 11:52:08 UTC 2025","","Contact Search","",""
"","444","should fail with no incoming key configured","","Mon Jun 16 12:04:12 UTC 2025","passed","Mon Jun 16 12:04:12 UTC 2025","","RapidPro SMS Gateway: Webapp Terminating messages","",""
"","10027","the LHS button should show the appropriate label when only one action","","Mon Jun 16 11:43:34 UTC 2025","passed","Mon Jun 16 11:43:44 UTC 2025","","Creating custom places","",""
"","56208","Should show error message for bad config","","Mon Jun 16 12:01:26 UTC 2025","passed","Mon Jun 16 12:02:23 UTC 2025","","Tasks","",""
"","9952","should create person under area should only see children","","Mon Jun 16 11:51:47 UTC 2025","passed","Mon Jun 16 11:51:57 UTC 2025","","Create Person Under Area, ","",""
"","2391","should not show page when submitting task for contact with no leaf type place in lineage","","Mon Jun 16 11:59:33 UTC 2025","passed","Mon Jun 16 11:59:36 UTC 2025","","Tasks group landing page: for chw","",""
"","2341","should show fab when user only has can_create_people permission","","Mon Jun 16 11:49:50 UTC 2025","passed","Mon Jun 16 11:49:53 UTC 2025","","FAB actions","",""
"","7137","should edit the name of the CHW area","","Mon Jun 16 11:51:25 UTC 2025","passed","Mon Jun 16 11:51:33 UTC 2025","","Create new lineage structure ","",""
"","9008","should display no data when no targets are uploaded","","Mon Jun 16 11:56:19 UTC 2025","passed","Mon Jun 16 11:56:28 UTC 2025","","Target aggregates: User with one or more places assigned: Online user with one place associated","",""
"","1243","should reply to an existing message - contact with a phone number","","Mon Jun 16 12:05:22 UTC 2025","passed","Mon Jun 16 12:05:23 UTC 2025","","Send message","",""
"","1649","should display correct tasks with breadcrumbs for supervisor","","Mon Jun 16 11:58:58 UTC 2025","passed","Mon Jun 16 11:58:59 UTC 2025","","Tasks tab breadcrumbs: for supervisor","",""
"","61156","should load multiple pages of tasks on infinite scrolling","","Mon Jun 16 12:00:18 UTC 2025","passed","Mon Jun 16 12:01:19 UTC 2025","","Tasks","",""
"","2969","should save target document on first calculation","","Mon Jun 16 11:55:27 UTC 2025","passed","Mon Jun 16 11:55:30 UTC 2025","","Target accuracy","",""
"","6049","should edit the name of the Family","","Mon Jun 16 11:51:33 UTC 2025","passed","Mon Jun 16 11:51:39 UTC 2025","","Create new lineage structure ","",""
"","2302","should create a report using unknown patient_id ","","Mon Jun 16 11:53:49 UTC 2025","passed","Mon Jun 16 11:53:52 UTC 2025","","Reports Subject","",""
"","1731","should handle old format of the rules-state-store","","Mon Jun 16 11:56:03 UTC 2025","passed","Mon Jun 16 11:56:05 UTC 2025","","Target accuracy","",""
"","1493","should not display task landing page after task completion","","Mon Jun 16 11:59:42 UTC 2025","passed","Mon Jun 16 11:59:43 UTC 2025","","Tasks group landing page: for supervisor","",""
