"DESCRIPTION","DURATION IN MS","NAME","PARENT SUITE","START TIME","STATUS","STOP TIME","SUB SUITE","SUITE","TEST CLASS","TEST METHOD"
"","86","should only create one target doc","","Thu May 29 12:24:19 UTC 2025","passed","Thu May 29 12:24:19 UTC 2025","","Target accuracy","",""
"","1154","should reply to an existing message - contact with a phone number","","Thu May 29 12:32:33 UTC 2025","passed","Thu May 29 12:32:34 UTC 2025","","Send message","",""
"","2176","should create a report using place_id with a shortcode","","Thu May 29 12:22:18 UTC 2025","passed","Thu May 29 12:22:20 UTC 2025","","Reports Subject","",""
"","1670","should not call RapidPro endpoint when credentials are not set","","Thu May 29 12:31:39 UTC 2025","passed","Thu May 29 12:31:41 UTC 2025","","RapidPro SMS Gateway: Webapp originating messages and state updates","",""
"","129","should show contact summary that has the full context for reports > 50 validate that the pregnancy card is always displayed","","Thu May 29 12:14:10 UTC 2025","passed","Thu May 29 12:14:11 UTC 2025","","Contact details page.: Permissions to show reports and tasks","",""
"","1376","should set correct states from broadcast api","","Thu May 29 12:31:43 UTC 2025","passed","Thu May 29 12:31:44 UTC 2025","","RapidPro SMS Gateway: Webapp originating messages and state updates","",""
"","61071","should load multiple pages of tasks on infinite scrolling","","Thu May 29 12:28:33 UTC 2025","passed","Thu May 29 12:29:34 UTC 2025","","Tasks","",""
"","4811","should display messages with breadcrumbs for online user","","Thu May 29 12:31:02 UTC 2025","passed","Thu May 29 12:31:06 UTC 2025","","Message Tab - Sender Data","",""
"","1015","should reply to an existing message - raw phone number","","Thu May 29 12:32:32 UTC 2025","passed","Thu May 29 12:32:33 UTC 2025","","Send message","",""
"","3405","should display reports with breadcrumbs for online user","","Thu May 29 12:20:37 UTC 2025","passed","Thu May 29 12:20:40 UTC 2025","","Reports tab breadcrumbs","",""
"","5936","should edit the name of the Family","","Thu May 29 12:19:55 UTC 2025","passed","Thu May 29 12:20:01 UTC 2025","","Create new lineage structure ","",""
"","6992","should unmute a contact using the defined unmute_forms (undo_death_report).","","Thu May 29 12:18:54 UTC 2025","passed","Thu May 29 12:19:01 UTC 2025","","Mute/Unmute contacts using a specific form - ","",""
"","4244","should add new district with a new person","","Thu May 29 12:13:39 UTC 2025","passed","Thu May 29 12:13:43 UTC 2025","","Add new district tests : ","",""
"","8990","should display correct due dates with default settings","","Thu May 29 12:26:20 UTC 2025","passed","Thu May 29 12:26:29 UTC 2025","","Task list due dates","",""
"","2980","should create new health center","","Thu May 29 12:19:14 UTC 2025","passed","Thu May 29 12:19:17 UTC 2025","","Create new lineage structure ","",""
"","6503","should download export file","","Thu May 29 12:21:17 UTC 2025","passed","Thu May 29 12:21:24 UTC 2025","","Export Reports","",""
"","311","should fail when message was not created","","Thu May 29 12:31:30 UTC 2025","passed","Thu May 29 12:31:30 UTC 2025","","RapidPro SMS Gateway: Webapp Terminating messages","",""
"","5208","should not save target document when editing counted contact","","Thu May 29 12:23:53 UTC 2025","passed","Thu May 29 12:23:58 UTC 2025","","Target accuracy","",""
"","3886","should filter by user associated place when the permission to default filter is enabled","","Thu May 29 12:23:18 UTC 2025","passed","Thu May 29 12:23:22 UTC 2025","","Reports Sidebar Filter","",""
"","1992","should send a message to a contact with a phone number","","Thu May 29 12:32:30 UTC 2025","passed","Thu May 29 12:32:32 UTC 2025","","Send message","",""
"","15139","should sync and update the offline user's home place","","Thu May 29 12:17:32 UTC 2025","passed","Thu May 29 12:17:47 UTC 2025","","Edit ","",""
"","5472","detects duplicates when creating person - clears dupes when form updated","","Thu May 29 12:16:40 UTC 2025","passed","Thu May 29 12:16:45 UTC 2025","","Duplicate contact detection","",""
"","4066","should create new area","","Thu May 29 12:19:18 UTC 2025","passed","Thu May 29 12:19:22 UTC 2025","","Create new lineage structure ","",""
"","5039","should filter by date","","Thu May 29 12:22:57 UTC 2025","passed","Thu May 29 12:23:02 UTC 2025","","Reports Sidebar Filter","",""
"","2615","should create a report using patient_id","","Thu May 29 12:22:02 UTC 2025","passed","Thu May 29 12:22:05 UTC 2025","","Reports Subject","",""
"","5586","should display correct message when no target found","","Thu May 29 12:11:56 UTC 2025","passed","Thu May 29 12:12:02 UTC 2025","","Targets","",""
"","3620","should not remove facility from breadcrumbs when offline user has many facilities associated","","Thu May 29 12:20:41 UTC 2025","passed","Thu May 29 12:20:45 UTC 2025","","Reports tab breadcrumbs","",""
"","5905","detects duplicates when editing a contact - navigates to duplicate contact","","Thu May 29 12:16:47 UTC 2025","passed","Thu May 29 12:16:52 UTC 2025","","Duplicate contact detection","",""
"","1728","should display targets from default config","","Thu May 29 12:11:54 UTC 2025","passed","Thu May 29 12:11:56 UTC 2025","","Targets","",""
"","7081","Should delete report","","Thu May 29 12:21:05 UTC 2025","passed","Thu May 29 12:21:12 UTC 2025","","Delete Reports","",""
"","10970","should add user with multiple places with permission","","Thu May 29 12:16:15 UTC 2025","passed","Thu May 29 12:16:26 UTC 2025","","User Test Cases -> Creating Users ->","",""
"","2522","should return results when searching by case_id","","Thu May 29 12:22:47 UTC 2025","passed","Thu May 29 12:22:50 UTC 2025","","Reports Search","",""
"","1378","should show new household and new person create option","","Thu May 29 12:18:07 UTC 2025","passed","Thu May 29 12:18:08 UTC 2025","","FAB actions","",""
"","2378","should open task with expression","","Thu May 29 12:27:09 UTC 2025","passed","Thu May 29 12:27:11 UTC 2025","","Tasks tab breadcrumbs: for chw","",""
"","3108","should shows content","","Thu May 29 12:30:15 UTC 2025","passed","Thu May 29 12:30:18 UTC 2025","","Africas Talking api: Gateway submits new WT sms messages","",""
"","3853","should display correct tasks with breadcrumbs for chw","","Thu May 29 12:27:04 UTC 2025","passed","Thu May 29 12:27:08 UTC 2025","","Tasks tab breadcrumbs: for chw","",""
"","6167","should display targets of current user on home place","","Thu May 29 12:25:18 UTC 2025","passed","Thu May 29 12:25:24 UTC 2025","","Target aggregates: User with one or more places assigned: Online user with one place associated","",""
"","4550","should not remove facility from breadcrumbs when offline user has many facilities associated","","Thu May 29 12:31:07 UTC 2025","passed","Thu May 29 12:31:12 UTC 2025","","Message Tab - Sender Data","",""
"","8182","the RHS button show the appropriate label when multiple places exist at the current level","","Thu May 29 12:12:51 UTC 2025","passed","Thu May 29 12:12:59 UTC 2025","","Creating custom places","",""
"","3059","should not display modal when clicking list task from same group","","Thu May 29 12:27:41 UTC 2025","passed","Thu May 29 12:27:44 UTC 2025","","Tasks group landing page: for chw","",""
"","2031","should send a message to a raw phone number","","Thu May 29 12:32:28 UTC 2025","passed","Thu May 29 12:32:30 UTC 2025","","Send message","",""
"","1105","should have tasks","","Thu May 29 12:27:32 UTC 2025","passed","Thu May 29 12:27:33 UTC 2025","","Tasks group landing page: for chw","",""
"","5297","should load multiple pages of contacts","","Thu May 29 12:18:29 UTC 2025","passed","Thu May 29 12:18:34 UTC 2025","","Infinite scrolling","",""
"","2732","should display conversation with link and navigate to contact","","Thu May 29 12:31:16 UTC 2025","passed","Thu May 29 12:31:18 UTC 2025","","Message Tab - Sender Data","",""
"","2398","should create a report using place_id with a place_uuid","","Thu May 29 12:22:15 UTC 2025","passed","Thu May 29 12:22:18 UTC 2025","","Reports Subject","",""
"","2485","Send SMS without patient_id and report created under person","","Thu May 29 12:30:50 UTC 2025","passed","Thu May 29 12:30:53 UTC 2025","","Link SMS to patient without passing id","",""
"","6947","should save target doc once when getting many changes through replication","","Thu May 29 12:24:12 UTC 2025","passed","Thu May 29 12:24:19 UTC 2025","","Target accuracy","",""
"","6241","should show a popup when trying to submit a non-unmuting form against a muted contact","","Thu May 29 12:19:01 UTC 2025","passed","Thu May 29 12:19:07 UTC 2025","","Mute/Unmute contacts using a specific form - ","",""
"","9924","the LHS button should show the appropriate label when only one action","","Thu May 29 12:12:16 UTC 2025","passed","Thu May 29 12:12:26 UTC 2025","","Creating custom places","",""
"","1686","should not poll messages for docs that are in pending or scheduled states or lack gateway ref ","","Thu May 29 12:31:48 UTC 2025","passed","Thu May 29 12:31:50 UTC 2025","","RapidPro SMS Gateway: Webapp originating messages and state updates","",""
"","1891","should handle old format of the rules-state-store","","Thu May 29 12:24:19 UTC 2025","passed","Thu May 29 12:24:21 UTC 2025","","Target accuracy","",""
"","2472","should not show page when submitting task for contact with no leaf type place in lineage","","Thu May 29 12:27:48 UTC 2025","passed","Thu May 29 12:27:51 UTC 2025","","Tasks group landing page: for chw","",""
"","3736","should create reports","","Thu May 29 12:31:35 UTC 2025","passed","Thu May 29 12:31:38 UTC 2025","","RapidPro SMS Gateway: Webapp Terminating messages","",""
"","3028","should create messages","","Thu May 29 12:31:31 UTC 2025","passed","Thu May 29 12:31:34 UTC 2025","","RapidPro SMS Gateway: Webapp Terminating messages","",""
"","32343","should filter aggregates by place and period","","Thu May 29 12:25:35 UTC 2025","passed","Thu May 29 12:26:07 UTC 2025","","Target aggregates: User with one or more places assigned: Offline user with multiple places associated","",""
"","3404","should display correct message when targets are disabled","","Thu May 29 12:12:02 UTC 2025","passed","Thu May 29 12:12:05 UTC 2025","","Targets","",""
"","12949","should update a contact, delete the same contact then unassign primary contact from facility","","Thu May 29 12:17:19 UTC 2025","passed","Thu May 29 12:17:32 UTC 2025","","Edit ","",""
"","4039","should not remove facility from breadcrumbs when offline user has many facilities associated","","Thu May 29 12:26:59 UTC 2025","passed","Thu May 29 12:27:03 UTC 2025","","Tasks tab breadcrumbs: for chw","",""
"","6460","should edit the name of the CHW area","","Thu May 29 12:19:48 UTC 2025","passed","Thu May 29 12:19:54 UTC 2025","","Create new lineage structure ","",""
"","726","search by NON empty string should display results with contains match and clears search","","Thu May 29 12:20:27 UTC 2025","passed","Thu May 29 12:20:28 UTC 2025","","Contact Search","",""
"","1212","should display an error when there are aggregates but no home place","","Thu May 29 12:24:29 UTC 2025","passed","Thu May 29 12:24:31 UTC 2025","","Target aggregates: DB admin","",""
"","3214","should send a message using FAB at people's tab","","Thu May 29 12:32:38 UTC 2025","passed","Thu May 29 12:32:42 UTC 2025","","Send message","",""
"","5240","detects duplicates from a custom duplicate expression","","Thu May 29 12:16:54 UTC 2025","passed","Thu May 29 12:16:59 UTC 2025","","Duplicate contact detection","",""
"","1390","should create case ID","","Thu May 29 12:21:32 UTC 2025","passed","Thu May 29 12:21:33 UTC 2025","","Generating short codes","",""
"","19684","should not show tasks when permission is disabled","","Thu May 29 12:14:37 UTC 2025","passed","Thu May 29 12:14:57 UTC 2025","","Contact details page.: Permissions to show reports and tasks","",""
"","2301","should return results matching the search term and then return all data when clearing search","","Thu May 29 12:22:45 UTC 2025","passed","Thu May 29 12:22:47 UTC 2025","","Reports Search","",""
"","3469","should display reports with updated breadcrumbs for offline user","","Thu May 29 12:20:46 UTC 2025","passed","Thu May 29 12:20:49 UTC 2025","","Reports tab breadcrumbs","",""
"","1329","should generate SMS report correctly when lacking patient_id","","Thu May 29 12:23:31 UTC 2025","passed","Thu May 29 12:23:33 UTC 2025","","Reports tab messages","",""
"","2328","should update the states correctly from messages api","","Thu May 29 12:31:45 UTC 2025","passed","Thu May 29 12:31:47 UTC 2025","","RapidPro SMS Gateway: Webapp originating messages and state updates","",""
"","10492","should remove task from list when CHW completes a task successfully","","Thu May 29 12:28:09 UTC 2025","passed","Thu May 29 12:28:20 UTC 2025","","Tasks","",""
"","6792","should save target document when targets change","","Thu May 29 12:23:46 UTC 2025","passed","Thu May 29 12:23:53 UTC 2025","","Target accuracy","",""
"","2551","should display messages with updated breadcrumbs for offline user","","Thu May 29 12:31:12 UTC 2025","passed","Thu May 29 12:31:15 UTC 2025","","Message Tab - Sender Data","",""
"","4452","does not detect duplicates when expression is disabled","","Thu May 29 12:17:00 UTC 2025","passed","Thu May 29 12:17:05 UTC 2025","","Duplicate contact detection","",""
"","1340","should shows content","","Thu May 29 12:30:40 UTC 2025","passed","Thu May 29 12:30:41 UTC 2025","","sms-gateway api: Gateway submits new WT sms messages","",""
"","8334","should display correct due dates with taskDaysOverdue setting and simple translation","","Thu May 29 12:26:37 UTC 2025","passed","Thu May 29 12:26:45 UTC 2025","","Task list due dates","",""
"","356","should fail with incorrect authentication","","Thu May 29 12:31:28 UTC 2025","passed","Thu May 29 12:31:29 UTC 2025","","RapidPro SMS Gateway: Webapp Terminating messages","",""
"","4101","should create new household","","Thu May 29 12:19:22 UTC 2025","passed","Thu May 29 12:19:26 UTC 2025","","Create new lineage structure ","",""
"","7856","the RHS button should show the action with custom label","","Thu May 29 12:12:41 UTC 2025","passed","Thu May 29 12:12:49 UTC 2025","","Creating custom places","",""
"","5632","should show error message for bad config","","Thu May 29 12:12:05 UTC 2025","passed","Thu May 29 12:12:11 UTC 2025","","Targets","",""
"","6591","should edit a name of the health facility","","Thu May 29 12:19:38 UTC 2025","passed","Thu May 29 12:19:44 UTC 2025","","Create new lineage structure ","",""
"","686","search should clear RHS selected contact","","Thu May 29 12:20:28 UTC 2025","passed","Thu May 29 12:20:28 UTC 2025","","Contact Search","",""
"","6168","should download export file","","Thu May 29 12:17:52 UTC 2025","passed","Thu May 29 12:17:58 UTC 2025","","Export Contacts ","",""
"","3752","should select, deselect and delete only selected reports","","Thu May 29 12:20:58 UTC 2025","passed","Thu May 29 12:21:01 UTC 2025","","Bulk delete reports","",""
"","9622","should create person under area should only see children","","Thu May 29 12:20:09 UTC 2025","passed","Thu May 29 12:20:19 UTC 2025","","Create Person Under Area, ","",""
"","3464","should filter by place","","Thu May 29 12:23:09 UTC 2025","passed","Thu May 29 12:23:12 UTC 2025","","Reports Sidebar Filter","",""
"","649","should display an empty list when there are no aggregates","","Thu May 29 12:24:28 UTC 2025","passed","Thu May 29 12:24:29 UTC 2025","","Target aggregates: DB admin","",""
"","26605","should not show reports when permission is disabled","","Thu May 29 12:14:11 UTC 2025","passed","Thu May 29 12:14:37 UTC 2025","","Contact details page.: Permissions to show reports and tasks","",""
"","2416","should create a report using doc id","","Thu May 29 12:22:05 UTC 2025","passed","Thu May 29 12:22:07 UTC 2025","","Reports Subject","",""
"","2904","should save target document on first calculation","","Thu May 29 12:23:43 UTC 2025","passed","Thu May 29 12:23:46 UTC 2025","","Target accuracy","",""
"","1187","should shows content","","Thu May 29 12:30:41 UTC 2025","passed","Thu May 29 12:30:42 UTC 2025","","sms-gateway api: Gateway submits WT sms status updates","",""
"","8609","should show the multi person actions with the correct label","","Thu May 29 12:13:11 UTC 2025","passed","Thu May 29 12:13:20 UTC 2025","","Creating custom places","",""
"","2282","should reply to an existing message and add a new recipient - contact with a phone number ","","Thu May 29 12:32:36 UTC 2025","passed","Thu May 29 12:32:38 UTC 2025","","Send message","",""
"","6910","should load multiple pages of reports","","Thu May 29 12:21:43 UTC 2025","passed","Thu May 29 12:21:50 UTC 2025","","Infinite scrolling","",""
"","374","should fail with no authentication provided","","Thu May 29 12:31:27 UTC 2025","passed","Thu May 29 12:31:27 UTC 2025","","RapidPro SMS Gateway: Webapp Terminating messages","",""
"","3923","should edit district","","Thu May 29 12:13:44 UTC 2025","passed","Thu May 29 12:13:47 UTC 2025","","Add new district tests : ","",""
"","4852","should show reports and tasks when permissions are enabled","","Thu May 29 12:14:06 UTC 2025","passed","Thu May 29 12:14:10 UTC 2025","","Contact details page.: Permissions to show reports and tasks","",""
"","2116","should create a report which has an unknown sender and a known subject","","Thu May 29 12:22:23 UTC 2025","passed","Thu May 29 12:22:25 UTC 2025","","Reports Subject","",""
"","953","should call endpoint with set credentials","","Thu May 29 12:31:41 UTC 2025","passed","Thu May 29 12:31:42 UTC 2025","","RapidPro SMS Gateway: Webapp originating messages and state updates","",""
"","3096","should keep updating until record is in final state","","Thu May 29 12:31:51 UTC 2025","passed","Thu May 29 12:31:54 UTC 2025","","RapidPro SMS Gateway: Webapp originating messages and state updates","",""
"","9591","should route to contact-detail on list item click and display contact summary target card","","Thu May 29 12:25:06 UTC 2025","passed","Thu May 29 12:25:16 UTC 2025","","Target aggregates: User with one or more places assigned: Online user with one place associated","",""
"","3580","should have tasks","","Thu May 29 12:27:54 UTC 2025","passed","Thu May 29 12:27:58 UTC 2025","","Tasks group landing page: for supervisor","",""
"","3029","should send messages to all the contacts, under a place, that have a primary phone number assigned","","Thu May 29 12:32:25 UTC 2025","passed","Thu May 29 12:32:28 UTC 2025","","Send message","",""
"","1210","should not display task landing page after task completion","","Thu May 29 12:27:58 UTC 2025","passed","Thu May 29 12:27:59 UTC 2025","","Tasks group landing page: for supervisor","",""
"","11119","the LHS button should show the appropriate label when multiple places exist at the current level","","Thu May 29 12:12:28 UTC 2025","passed","Thu May 29 12:12:39 UTC 2025","","Creating custom places","",""
"","3312","should disable content","","Thu May 29 12:25:26 UTC 2025","passed","Thu May 29 12:25:30 UTC 2025","","Target aggregates: User with one or more places assigned: Offline user with multiple places associated","",""
"","402","should fail with no incoming key configured","","Thu May 29 12:31:25 UTC 2025","passed","Thu May 29 12:31:26 UTC 2025","","RapidPro SMS Gateway: Webapp Terminating messages","",""
"","2001","should display only the targets sections and show the correct message when target aggregates are disabled","","Thu May 29 12:25:31 UTC 2025","passed","Thu May 29 12:25:33 UTC 2025","","Target aggregates: User with one or more places assigned: Offline user with multiple places associated","",""
"","3481","should create new person","","Thu May 29 12:19:27 UTC 2025","passed","Thu May 29 12:19:30 UTC 2025","","Create new lineage structure ","",""
"","7996","should not save target document when adding report for counted contact","","Thu May 29 12:23:58 UTC 2025","passed","Thu May 29 12:24:06 UTC 2025","","Target accuracy","",""
"","5506","should save target document when deleting counted contact","","Thu May 29 12:24:06 UTC 2025","passed","Thu May 29 12:24:12 UTC 2025","","Target accuracy","",""
"","2221","should create a report using unknown place_id","","Thu May 29 12:22:20 UTC 2025","passed","Thu May 29 12:22:23 UTC 2025","","Reports Subject","",""
"","6933","should edit a person with a phone number","","Thu May 29 12:19:30 UTC 2025","passed","Thu May 29 12:19:37 UTC 2025","","Create new lineage structure ","",""
"","2248","should create a report using patient name","","Thu May 29 12:22:10 UTC 2025","passed","Thu May 29 12:22:13 UTC 2025","","Reports Subject","",""
"","2179","should show fab when user only has can_create_people permission","","Thu May 29 12:18:15 UTC 2025","passed","Thu May 29 12:18:17 UTC 2025","","FAB actions","",""
"","1581","should display correct tasks with breadcrumbs for supervisor","","Thu May 29 12:27:14 UTC 2025","passed","Thu May 29 12:27:16 UTC 2025","","Tasks tab breadcrumbs: for supervisor","",""
"","2247","should create a report using unknown patient_id ","","Thu May 29 12:22:08 UTC 2025","passed","Thu May 29 12:22:10 UTC 2025","","Reports Subject","",""
"","3733","should display tasks group landing page after task completion","","Thu May 29 12:27:33 UTC 2025","passed","Thu May 29 12:27:37 UTC 2025","","Tasks group landing page: for chw","",""
"","2741","should delete the primary contact of health facility","","Thu May 29 12:19:45 UTC 2025","passed","Thu May 29 12:19:48 UTC 2025","","Create new lineage structure ","",""
"","25123","Should show error message for bad config","","Thu May 29 12:29:41 UTC 2025","passed","Thu May 29 12:30:06 UTC 2025","","Tasks","",""
"","5832","changes to a loaded or list report should be reflected in the UI ","","Thu May 29 12:22:28 UTC 2025","passed","Thu May 29 12:22:33 UTC 2025","","Reports Subject","",""
"","2517","should download export file","","Thu May 29 12:30:30 UTC 2025","passed","Thu May 29 12:30:32 UTC 2025","","Export Messages","",""
"","793","should returns list and updates state","","Thu May 29 12:30:42 UTC 2025","passed","Thu May 29 12:30:43 UTC 2025","","sms-gateway api: api returns list of pending WO messages","",""
"","309","should fail with malformed authentication","","Thu May 29 12:31:29 UTC 2025","passed","Thu May 29 12:31:29 UTC 2025","","RapidPro SMS Gateway: Webapp Terminating messages","",""
"","7834","should show custom places in their own list","","Thu May 29 12:13:22 UTC 2025","passed","Thu May 29 12:13:30 UTC 2025","","Creating custom places","",""
"","3835","should edit district with contact_type","","Thu May 29 12:13:48 UTC 2025","passed","Thu May 29 12:13:52 UTC 2025","","Add new district tests : ","",""
"","8151","should show the single add person button with the correct label","","Thu May 29 12:13:01 UTC 2025","passed","Thu May 29 12:13:09 UTC 2025","","Creating custom places","",""
"","8828","should display no data when no targets are uploaded","","Thu May 29 12:24:35 UTC 2025","passed","Thu May 29 12:24:44 UTC 2025","","Target aggregates: User with one or more places assigned: Online user with one place associated","",""
"","3109","should show fab when user only has can_create_places permission","","Thu May 29 12:18:09 UTC 2025","passed","Thu May 29 12:18:12 UTC 2025","","FAB actions","",""
"","2157","should create a report which has an unknown sender with no phone number","","Thu May 29 12:22:25 UTC 2025","passed","Thu May 29 12:22:27 UTC 2025","","Reports Subject","",""
"","9997","should add a task when CHW completes a task successfully, and that task creates another task","","Thu May 29 12:28:21 UTC 2025","passed","Thu May 29 12:28:31 UTC 2025","","Tasks","",""
"","7310","should display correct due dates with taskDaysOverdue setting","","Thu May 29 12:26:29 UTC 2025","passed","Thu May 29 12:26:36 UTC 2025","","Task list due dates","",""
"","2338","should shows content","","Thu May 29 12:30:18 UTC 2025","passed","Thu May 29 12:30:20 UTC 2025","","Africas Talking api: Gateway submits WT sms status updates","",""
"","2911","should show error log for bad config","","Thu May 29 12:16:03 UTC 2025","passed","Thu May 29 12:16:06 UTC 2025","","Contact details page.: Contact summary error","",""
"","5107","detects duplicates when creating top-level place - allows acknowledging","","Thu May 29 12:16:33 UTC 2025","passed","Thu May 29 12:16:38 UTC 2025","","Duplicate contact detection","",""
"","17829","should display correct data","","Thu May 29 12:24:46 UTC 2025","passed","Thu May 29 12:25:03 UTC 2025","","Target aggregates: User with one or more places assigned: Online user with one place associated","",""
"","1470","should open task from the same group","","Thu May 29 12:27:37 UTC 2025","passed","Thu May 29 12:27:38 UTC 2025","","Tasks group landing page: for chw","",""
"","4210","should filter by form","","Thu May 29 12:23:04 UTC 2025","passed","Thu May 29 12:23:08 UTC 2025","","Reports Sidebar Filter","",""
"","2315","should reply to an existing message and add a new recipient - raw phone number ","","Thu May 29 12:32:34 UTC 2025","passed","Thu May 29 12:32:36 UTC 2025","","Send message","",""
"","7431","should poll for state updates and consume queue","","Thu May 29 12:31:55 UTC 2025","passed","Thu May 29 12:32:02 UTC 2025","","RapidPro SMS Gateway: Webapp originating messages and state updates","",""
"","2396","should display modal when clicking on a task from another group","","Thu May 29 12:27:38 UTC 2025","passed","Thu May 29 12:27:41 UTC 2025","","Tasks group landing page: for chw","",""
"","2393","should create a report which does not have a subject","","Thu May 29 12:22:34 UTC 2025","passed","Thu May 29 12:22:36 UTC 2025","","Reports Subject","",""
