"DESCRIPTION","DURATION IN MS","NAME","PARENT SUITE","START TIME","STATUS","STOP TIME","SUB SUITE","SUITE","TEST CLASS","TEST METHOD"
"","2903","should not display modal when clicking list task from same group","","Wed Feb 05 20:40:03 UTC 2025","passed","Wed Feb 05 20:40:06 UTC 2025","","Tasks group landing page: for chw","",""
"","9157","the LHS button should show the appropriate label when only one action","","Wed Feb 05 20:24:53 UTC 2025","passed","Wed Feb 05 20:25:03 UTC 2025","","Creating custom places","",""
"","3052","should edit district","","Wed Feb 05 20:26:15 UTC 2025","passed","Wed Feb 05 20:26:18 UTC 2025","","Add new district tests : ","",""
"","7796","should show custom places in their own list","","Wed Feb 05 20:25:55 UTC 2025","passed","Wed Feb 05 20:26:03 UTC 2025","","Creating custom places","",""
"","7272","should unmute a contact using the defined unmute_forms (undo_death_report).","","Wed Feb 05 20:31:02 UTC 2025","passed","Wed Feb 05 20:31:09 UTC 2025","","Mute/Unmute contacts using a specific form - ","",""
"","1640","should not poll messages for docs that are in pending or scheduled states or lack gateway ref ","","Wed Feb 05 20:44:04 UTC 2025","passed","Wed Feb 05 20:44:06 UTC 2025","","RapidPro SMS Gateway: Webapp originating messages and state updates","",""
"","9841","should display correct due dates with default settings","","Wed Feb 05 20:38:32 UTC 2025","passed","Wed Feb 05 20:38:42 UTC 2025","","Task list due dates","",""
"","1233","should not display task landing page after task completion","","Wed Feb 05 20:40:15 UTC 2025","passed","Wed Feb 05 20:40:16 UTC 2025","","Tasks group landing page: for supervisor","",""
"","4697","should filter by date","","Wed Feb 05 20:35:13 UTC 2025","passed","Wed Feb 05 20:35:17 UTC 2025","","Reports Sidebar Filter","",""
"","2811","should display reports with breadcrumbs for online user","","Wed Feb 05 20:32:50 UTC 2025","passed","Wed Feb 05 20:32:53 UTC 2025","","Reports tab breadcrumbs","",""
"","6122","should download export file","","Wed Feb 05 20:33:33 UTC 2025","passed","Wed Feb 05 20:33:39 UTC 2025","","Export Reports","",""
"","1528","should display only the targets sections and show the correct message when target aggregates are disabled","","Wed Feb 05 20:37:52 UTC 2025","passed","Wed Feb 05 20:37:54 UTC 2025","","Target aggregates: User with one or more places assigned: Offline user with multiple places associated","",""
"","8341","should show the multi person actions with the correct label","","Wed Feb 05 20:25:45 UTC 2025","passed","Wed Feb 05 20:25:53 UTC 2025","","Creating custom places","",""
"","8184","should edit a person with a phone number","","Wed Feb 05 20:31:39 UTC 2025","passed","Wed Feb 05 20:31:47 UTC 2025","","Create new lineage structure ","",""
"","2990","should edit district with contact_type","","Wed Feb 05 20:26:18 UTC 2025","passed","Wed Feb 05 20:26:21 UTC 2025","","Add new district tests : ","",""
"","4208","should not remove facility from breadcrumbs when offline user has many facilities associated","","Wed Feb 05 20:43:22 UTC 2025","passed","Wed Feb 05 20:43:26 UTC 2025","","Message Tab - Sender Data","",""
"","6327","changes to a loaded or list report should be reflected in the UI ","","Wed Feb 05 20:34:42 UTC 2025","passed","Wed Feb 05 20:34:49 UTC 2025","","Reports Subject","",""
"","10228","should display correct due dates with taskDaysOverdue setting and simple translation","","Wed Feb 05 20:38:52 UTC 2025","passed","Wed Feb 05 20:39:02 UTC 2025","","Task list due dates","",""
"","856","should have tasks","","Wed Feb 05 20:39:52 UTC 2025","passed","Wed Feb 05 20:39:53 UTC 2025","","Tasks group landing page: for chw","",""
"","3968","should save target document on first calculation","","Wed Feb 05 20:36:06 UTC 2025","passed","Wed Feb 05 20:36:10 UTC 2025","","Target accuracy","",""
"","2899","should create a report using unknown patient_id ","","Wed Feb 05 20:34:21 UTC 2025","passed","Wed Feb 05 20:34:24 UTC 2025","","Reports Subject","",""
"","2014","should display messages with updated breadcrumbs for offline user","","Wed Feb 05 20:43:28 UTC 2025","passed","Wed Feb 05 20:43:30 UTC 2025","","Message Tab - Sender Data","",""
"","3959","should download export file","","Wed Feb 05 20:42:44 UTC 2025","passed","Wed Feb 05 20:42:48 UTC 2025","","Export Messages","",""
"","1540","should show new household and new person create option","","Wed Feb 05 20:30:16 UTC 2025","passed","Wed Feb 05 20:30:17 UTC 2025","","FAB actions","",""
"","1188","should shows content","","Wed Feb 05 20:42:56 UTC 2025","passed","Wed Feb 05 20:42:57 UTC 2025","","sms-gateway api: Gateway submits WT sms status updates","",""
"","1373","should call endpoint with set credentials","","Wed Feb 05 20:43:57 UTC 2025","passed","Wed Feb 05 20:43:58 UTC 2025","","RapidPro SMS Gateway: Webapp originating messages and state updates","",""
"","3709","should show fab when user only has can_create_places permission","","Wed Feb 05 20:30:18 UTC 2025","passed","Wed Feb 05 20:30:22 UTC 2025","","FAB actions","",""
"","114","should show contact summary that has the full context for reports > 50 validate that the pregnancy card is always displayed","","Wed Feb 05 20:26:39 UTC 2025","passed","Wed Feb 05 20:26:39 UTC 2025","","Contact details page.: Permissions to show reports and tasks","",""
"","1157","should create case ID","","Wed Feb 05 20:33:47 UTC 2025","passed","Wed Feb 05 20:33:48 UTC 2025","","Generating short codes","",""
"","2936","should create a report using doc id","","Wed Feb 05 20:34:18 UTC 2025","passed","Wed Feb 05 20:34:21 UTC 2025","","Reports Subject","",""
"","878","should returns list and updates state","","Wed Feb 05 20:42:57 UTC 2025","passed","Wed Feb 05 20:42:58 UTC 2025","","sms-gateway api: api returns list of pending WO messages","",""
"","662","should reply to an existing message - raw phone number","","Wed Feb 05 20:44:45 UTC 2025","passed","Wed Feb 05 20:44:45 UTC 2025","","Send message","",""
"","3535","should filter by place","","Wed Feb 05 20:35:27 UTC 2025","passed","Wed Feb 05 20:35:31 UTC 2025","","Reports Sidebar Filter","",""
"","1916","should have tasks","","Wed Feb 05 20:40:13 UTC 2025","passed","Wed Feb 05 20:40:15 UTC 2025","","Tasks group landing page: for supervisor","",""
"","1706","should not show page when submitting task for contact with no leaf type place in lineage","","Wed Feb 05 20:40:09 UTC 2025","passed","Wed Feb 05 20:40:11 UTC 2025","","Tasks group landing page: for chw","",""
"","1620","should display targets from default config","","Wed Feb 05 20:24:26 UTC 2025","passed","Wed Feb 05 20:24:28 UTC 2025","","Targets","",""
"","2694","should disable content","","Wed Feb 05 20:37:47 UTC 2025","passed","Wed Feb 05 20:37:49 UTC 2025","","Target aggregates: User with one or more places assigned: Offline user with multiple places associated","",""
"","9090","should handle rate limiting when polling","","Wed Feb 05 20:44:19 UTC 2025","passed","Wed Feb 05 20:44:28 UTC 2025","","RapidPro SMS Gateway: Webapp originating messages and state updates","",""
"","2834","should create a report using place_id with a shortcode","","Wed Feb 05 20:34:31 UTC 2025","passed","Wed Feb 05 20:34:34 UTC 2025","","Reports Subject","",""
"","5532","should display targets of current user on home place","","Wed Feb 05 20:37:37 UTC 2025","passed","Wed Feb 05 20:37:43 UTC 2025","","Target aggregates: User with one or more places assigned: Online user with one place associated","",""
"","361","should fail with no authentication provided","","Wed Feb 05 20:43:43 UTC 2025","passed","Wed Feb 05 20:43:44 UTC 2025","","RapidPro SMS Gateway: Webapp Terminating messages","",""
"","7837","should edit a name of the health facility","","Wed Feb 05 20:31:48 UTC 2025","passed","Wed Feb 05 20:31:55 UTC 2025","","Create new lineage structure ","",""
"","8049","should display correct message when no target found","","Wed Feb 05 20:24:28 UTC 2025","passed","Wed Feb 05 20:24:36 UTC 2025","","Targets","",""
"","3601","should delete the primary contact of health facility","","Wed Feb 05 20:31:56 UTC 2025","passed","Wed Feb 05 20:31:59 UTC 2025","","Create new lineage structure ","",""
"","2985","should create a report using unknown place_id","","Wed Feb 05 20:34:34 UTC 2025","passed","Wed Feb 05 20:34:37 UTC 2025","","Reports Subject","",""
"","3974","should select, deselect and delete only selected reports","","Wed Feb 05 20:33:13 UTC 2025","passed","Wed Feb 05 20:33:17 UTC 2025","","Bulk delete reports","",""
"","13148","should add user with multiple places with permission","","Wed Feb 05 20:29:08 UTC 2025","passed","Wed Feb 05 20:29:21 UTC 2025","","User Test Cases -> Creating Users ->","",""
"","1588","should create a report using patient name","","Wed Feb 05 20:34:25 UTC 2025","passed","Wed Feb 05 20:34:26 UTC 2025","","Reports Subject","",""
"","6643","should save target doc once when getting many changes through replication","","Wed Feb 05 20:36:35 UTC 2025","passed","Wed Feb 05 20:36:42 UTC 2025","","Target accuracy","",""
"","1513","should set correct states from broadcast api","","Wed Feb 05 20:43:58 UTC 2025","passed","Wed Feb 05 20:44:00 UTC 2025","","RapidPro SMS Gateway: Webapp originating messages and state updates","",""
"","1796","should shows content","","Wed Feb 05 20:42:54 UTC 2025","passed","Wed Feb 05 20:42:56 UTC 2025","","sms-gateway api: Gateway submits new WT sms messages","",""
"","3879","should filter by form","","Wed Feb 05 20:35:21 UTC 2025","passed","Wed Feb 05 20:35:25 UTC 2025","","Reports Sidebar Filter","",""
"","7614","should show error message for bad config","","Wed Feb 05 20:24:41 UTC 2025","passed","Wed Feb 05 20:24:49 UTC 2025","","Targets","",""
"","2948","should display tasks group landing page after task completion","","Wed Feb 05 20:39:53 UTC 2025","passed","Wed Feb 05 20:39:56 UTC 2025","","Tasks group landing page: for chw","",""
"","6830","Should delete report","","Wed Feb 05 20:33:21 UTC 2025","passed","Wed Feb 05 20:33:28 UTC 2025","","Delete Reports","",""
"","14519","should display correct data","","Wed Feb 05 20:37:07 UTC 2025","passed","Wed Feb 05 20:37:22 UTC 2025","","Target aggregates: User with one or more places assigned: Online user with one place associated","",""
"","7292","should not save target document when adding report for counted contact","","Wed Feb 05 20:36:22 UTC 2025","passed","Wed Feb 05 20:36:29 UTC 2025","","Target accuracy","",""
"","4467","should load multiple pages of contacts","","Wed Feb 05 20:30:39 UTC 2025","passed","Wed Feb 05 20:30:43 UTC 2025","","Infinite scrolling","",""
"","259","should fail with incorrect authentication","","Wed Feb 05 20:43:45 UTC 2025","passed","Wed Feb 05 20:43:45 UTC 2025","","RapidPro SMS Gateway: Webapp Terminating messages","",""
"","3028","should not remove facility from breadcrumbs when offline user has many facilities associated","","Wed Feb 05 20:32:55 UTC 2025","passed","Wed Feb 05 20:32:58 UTC 2025","","Reports tab breadcrumbs","",""
"","50087","should not show reports when permission is disabled","","Wed Feb 05 20:26:39 UTC 2025","passed","Wed Feb 05 20:27:29 UTC 2025","","Contact details page.: Permissions to show reports and tasks","",""
"","832","should reply to an existing message - contact with a phone number","","Wed Feb 05 20:44:45 UTC 2025","passed","Wed Feb 05 20:44:46 UTC 2025","","Send message","",""
"","2612","should reply to an existing message and add a new recipient - raw phone number ","","Wed Feb 05 20:44:46 UTC 2025","passed","Wed Feb 05 20:44:49 UTC 2025","","Send message","",""
"","11513","should create person under area should only see children","","Wed Feb 05 20:32:21 UTC 2025","passed","Wed Feb 05 20:32:32 UTC 2025","","Create Person Under Area, ","",""
"","31816","should load multiple pages of tasks on infinite scrolling","","Wed Feb 05 20:40:53 UTC 2025","passed","Wed Feb 05 20:41:25 UTC 2025","","Tasks","",""
"","3272","should create messages","","Wed Feb 05 20:43:47 UTC 2025","passed","Wed Feb 05 20:43:50 UTC 2025","","RapidPro SMS Gateway: Webapp Terminating messages","",""
"","528","search should clear RHS selected contact","","Wed Feb 05 20:32:41 UTC 2025","passed","Wed Feb 05 20:32:42 UTC 2025","","Contact Search","",""
"","1854","should send a message to a contact with a phone number","","Wed Feb 05 20:44:43 UTC 2025","passed","Wed Feb 05 20:44:45 UTC 2025","","Send message","",""
"","1883","should send a message to a raw phone number","","Wed Feb 05 20:44:41 UTC 2025","passed","Wed Feb 05 20:44:43 UTC 2025","","Send message","",""
"","2495","should open task from the same group","","Wed Feb 05 20:39:56 UTC 2025","passed","Wed Feb 05 20:39:58 UTC 2025","","Tasks group landing page: for chw","",""
"","6541","should poll for state updates and consume queue","","Wed Feb 05 20:44:10 UTC 2025","passed","Wed Feb 05 20:44:17 UTC 2025","","RapidPro SMS Gateway: Webapp originating messages and state updates","",""
"","2602","should shows content","","Wed Feb 05 20:42:32 UTC 2025","passed","Wed Feb 05 20:42:34 UTC 2025","","Africas Talking api: Gateway submits WT sms status updates","",""
"","4559","should display messages with breadcrumbs for online user","","Wed Feb 05 20:43:16 UTC 2025","passed","Wed Feb 05 20:43:20 UTC 2025","","Message Tab - Sender Data","",""
"","3598","should add new district with a new person","","Wed Feb 05 20:26:11 UTC 2025","passed","Wed Feb 05 20:26:14 UTC 2025","","Add new district tests : ","",""
"","1273","should display correct tasks with breadcrumbs for supervisor","","Wed Feb 05 20:39:34 UTC 2025","passed","Wed Feb 05 20:39:35 UTC 2025","","Tasks tab breadcrumbs: for supervisor","",""
"","8176","the RHS button show the appropriate label when multiple places exist at the current level","","Wed Feb 05 20:25:25 UTC 2025","passed","Wed Feb 05 20:25:34 UTC 2025","","Creating custom places","",""
"","3137","should display correct tasks with breadcrumbs for chw","","Wed Feb 05 20:39:23 UTC 2025","passed","Wed Feb 05 20:39:26 UTC 2025","","Tasks tab breadcrumbs: for chw","",""
"","4753","should show reports and tasks when permissions are enabled","","Wed Feb 05 20:26:34 UTC 2025","passed","Wed Feb 05 20:26:39 UTC 2025","","Contact details page.: Permissions to show reports and tasks","",""
"","22717","should filter aggregates by place and period","","Wed Feb 05 20:37:56 UTC 2025","passed","Wed Feb 05 20:38:19 UTC 2025","","Target aggregates: User with one or more places assigned: Offline user with multiple places associated","",""
"","1764","should handle old format of the rules-state-store","","Wed Feb 05 20:36:42 UTC 2025","passed","Wed Feb 05 20:36:44 UTC 2025","","Target accuracy","",""
"","7509","should show a popup when trying to submit a non-unmuting form against a muted contact","","Wed Feb 05 20:31:09 UTC 2025","passed","Wed Feb 05 20:31:17 UTC 2025","","Mute/Unmute contacts using a specific form - ","",""
"","3255","should create reports","","Wed Feb 05 20:43:51 UTC 2025","passed","Wed Feb 05 20:43:54 UTC 2025","","RapidPro SMS Gateway: Webapp Terminating messages","",""
"","40253","should not show tasks when permission is disabled","","Wed Feb 05 20:27:29 UTC 2025","passed","Wed Feb 05 20:28:09 UTC 2025","","Contact details page.: Permissions to show reports and tasks","",""
"","5486","should load multiple pages of reports","","Wed Feb 05 20:33:58 UTC 2025","passed","Wed Feb 05 20:34:03 UTC 2025","","Infinite scrolling","",""
"","3098","should send messages to all the contacts, under a place, that have a primary phone number assigned","","Wed Feb 05 20:44:38 UTC 2025","passed","Wed Feb 05 20:44:41 UTC 2025","","Send message","",""
"","7453","should display no data when no targets are uploaded","","Wed Feb 05 20:36:57 UTC 2025","passed","Wed Feb 05 20:37:05 UTC 2025","","Target aggregates: User with one or more places assigned: Online user with one place associated","",""
"","8534","should route to contact-detail on list item click and display contact summary target card","","Wed Feb 05 20:37:25 UTC 2025","passed","Wed Feb 05 20:37:34 UTC 2025","","Target aggregates: User with one or more places assigned: Online user with one place associated","",""
"","3134","should return results matching the search term and then return all data when clearing search","","Wed Feb 05 20:34:59 UTC 2025","passed","Wed Feb 05 20:35:02 UTC 2025","","Reports Search","",""
"","291","should fail with malformed authentication","","Wed Feb 05 20:43:45 UTC 2025","passed","Wed Feb 05 20:43:46 UTC 2025","","RapidPro SMS Gateway: Webapp Terminating messages","",""
"","3015","should create new health center","","Wed Feb 05 20:31:23 UTC 2025","passed","Wed Feb 05 20:31:26 UTC 2025","","Create new lineage structure ","",""
"","3109","should return results when searching by case_id","","Wed Feb 05 20:35:02 UTC 2025","passed","Wed Feb 05 20:35:05 UTC 2025","","Reports Search","",""
"","16388","should sync and update the offline user's home place","","Wed Feb 05 20:29:40 UTC 2025","passed","Wed Feb 05 20:29:56 UTC 2025","","Edit ","",""
"","2000","should create a report which does not have a subject","","Wed Feb 05 20:34:49 UTC 2025","passed","Wed Feb 05 20:34:51 UTC 2025","","Reports Subject","",""
"","632","should display an empty list when there are no aggregates","","Wed Feb 05 20:36:51 UTC 2025","passed","Wed Feb 05 20:36:51 UTC 2025","","Target aggregates: DB admin","",""
"","4742","should display modal when clicking on a task from another group","","Wed Feb 05 20:39:58 UTC 2025","passed","Wed Feb 05 20:40:03 UTC 2025","","Tasks group landing page: for chw","",""
"","1585","should not call RapidPro endpoint when credentials are not set","","Wed Feb 05 20:43:54 UTC 2025","passed","Wed Feb 05 20:43:56 UTC 2025","","RapidPro SMS Gateway: Webapp originating messages and state updates","",""
"","3146","should not show page when there are no more household tasks","","Wed Feb 05 20:40:06 UTC 2025","passed","Wed Feb 05 20:40:09 UTC 2025","","Tasks group landing page: for chw","",""
"","3497","should not remove facility from breadcrumbs when offline user has many facilities associated","","Wed Feb 05 20:39:17 UTC 2025","passed","Wed Feb 05 20:39:21 UTC 2025","","Tasks tab breadcrumbs: for chw","",""
"","5612","should not save target document when editing counted contact","","Wed Feb 05 20:36:16 UTC 2025","passed","Wed Feb 05 20:36:22 UTC 2025","","Target accuracy","",""
"","2319","should create a report which has an unknown sender and a known subject","","Wed Feb 05 20:34:37 UTC 2025","passed","Wed Feb 05 20:34:40 UTC 2025","","Reports Subject","",""
"","6399","should save target document when targets change","","Wed Feb 05 20:36:10 UTC 2025","passed","Wed Feb 05 20:36:16 UTC 2025","","Target accuracy","",""
"","4553","should create new area","","Wed Feb 05 20:31:27 UTC 2025","passed","Wed Feb 05 20:31:31 UTC 2025","","Create new lineage structure ","",""
"","2243","should create a report which has an unknown sender with no phone number","","Wed Feb 05 20:34:40 UTC 2025","passed","Wed Feb 05 20:34:42 UTC 2025","","Reports Subject","",""
"","2065","should reply to an existing message and add a new recipient - contact with a phone number ","","Wed Feb 05 20:44:49 UTC 2025","passed","Wed Feb 05 20:44:51 UTC 2025","","Send message","",""
"","7565","should mute a contact using the defined mute_forms (death_report).","","Wed Feb 05 20:30:54 UTC 2025","passed","Wed Feb 05 20:31:02 UTC 2025","","Mute/Unmute contacts using a specific form - ","",""
"","2799","Send SMS without patient_id and report created under person","","Wed Feb 05 20:43:05 UTC 2025","passed","Wed Feb 05 20:43:07 UTC 2025","","Link SMS to patient without passing id","",""
"","7556","should edit the name of the CHW area","","Wed Feb 05 20:31:59 UTC 2025","passed","Wed Feb 05 20:32:07 UTC 2025","","Create new lineage structure ","",""
"","297","should fail with no incoming key configured","","Wed Feb 05 20:43:43 UTC 2025","passed","Wed Feb 05 20:43:43 UTC 2025","","RapidPro SMS Gateway: Webapp Terminating messages","",""
"","2067","should create a report using missing required patient name","","Wed Feb 05 20:34:26 UTC 2025","passed","Wed Feb 05 20:34:28 UTC 2025","","Reports Subject","",""
"","6384","should save target document when deleting counted contact","","Wed Feb 05 20:36:29 UTC 2025","passed","Wed Feb 05 20:36:35 UTC 2025","","Target accuracy","",""
"","1959","should display conversation with link and navigate to contact","","Wed Feb 05 20:43:32 UTC 2025","passed","Wed Feb 05 20:43:34 UTC 2025","","Message Tab - Sender Data","",""
"","2788","should send a message using FAB at people's tab","","Wed Feb 05 20:44:51 UTC 2025","passed","Wed Feb 05 20:44:54 UTC 2025","","Send message","",""
"","3672","should filter by status","","Wed Feb 05 20:35:33 UTC 2025","passed","Wed Feb 05 20:35:37 UTC 2025","","Reports Sidebar Filter","",""
"","3244","should shows content","","Wed Feb 05 20:42:29 UTC 2025","passed","Wed Feb 05 20:42:32 UTC 2025","","Africas Talking api: Gateway submits new WT sms messages","",""
"","1521","search by NON empty string should display results with contains match and clears search","","Wed Feb 05 20:32:40 UTC 2025","passed","Wed Feb 05 20:32:41 UTC 2025","","Contact Search","",""
"","1217","should display an error when there are aggregates but no home place","","Wed Feb 05 20:36:52 UTC 2025","passed","Wed Feb 05 20:36:53 UTC 2025","","Target aggregates: DB admin","",""
"","11727","should remove task from list when CHW completes a task successfully","","Wed Feb 05 20:40:27 UTC 2025","passed","Wed Feb 05 20:40:38 UTC 2025","","Tasks","",""
"","10468","should update a contact, delete the same contact then unassign primary contact from facility","","Wed Feb 05 20:29:29 UTC 2025","passed","Wed Feb 05 20:29:40 UTC 2025","","Edit ","",""
"","9396","should display correct due dates with taskDaysOverdue setting","","Wed Feb 05 20:38:42 UTC 2025","passed","Wed Feb 05 20:38:52 UTC 2025","","Task list due dates","",""
"","2982","should display reports with updated breadcrumbs for offline user","","Wed Feb 05 20:33:01 UTC 2025","passed","Wed Feb 05 20:33:04 UTC 2025","","Reports tab breadcrumbs","",""
"","6751","should edit the name of the Family","","Wed Feb 05 20:32:07 UTC 2025","passed","Wed Feb 05 20:32:14 UTC 2025","","Create new lineage structure ","",""
"","2593","should show error log for bad config","","Wed Feb 05 20:28:57 UTC 2025","passed","Wed Feb 05 20:28:59 UTC 2025","","Contact details page.: Contact summary error","",""
"","5066","should display correct message when targets are disabled","","Wed Feb 05 20:24:36 UTC 2025","passed","Wed Feb 05 20:24:41 UTC 2025","","Targets","",""
"","2710","should show fab when user only has can_create_people permission","","Wed Feb 05 20:30:25 UTC 2025","passed","Wed Feb 05 20:30:27 UTC 2025","","FAB actions","",""
"","6122","should download export file","","Wed Feb 05 20:30:01 UTC 2025","passed","Wed Feb 05 20:30:07 UTC 2025","","Export Contacts ","",""
"","2467","should create a report using place_id with a place_uuid","","Wed Feb 05 20:34:29 UTC 2025","passed","Wed Feb 05 20:34:31 UTC 2025","","Reports Subject","",""
"","7763","should show the single add person button with the correct label","","Wed Feb 05 20:25:35 UTC 2025","passed","Wed Feb 05 20:25:43 UTC 2025","","Creating custom places","",""
"","3587","should create new person","","Wed Feb 05 20:31:36 UTC 2025","passed","Wed Feb 05 20:31:39 UTC 2025","","Create new lineage structure ","",""
"","10681","should add a task when CHW completes a task successfully, and that task creates another task","","Wed Feb 05 20:40:40 UTC 2025","passed","Wed Feb 05 20:40:51 UTC 2025","","Tasks","",""
"","2120","should open task with expression","","Wed Feb 05 20:39:28 UTC 2025","passed","Wed Feb 05 20:39:30 UTC 2025","","Tasks tab breadcrumbs: for chw","",""
"","3903","should filter by user associated place when the permission to default filter is enabled","","Wed Feb 05 20:35:39 UTC 2025","passed","Wed Feb 05 20:35:43 UTC 2025","","Reports Sidebar Filter","",""
"","2587","should update the states correctly from messages api","","Wed Feb 05 20:44:01 UTC 2025","passed","Wed Feb 05 20:44:03 UTC 2025","","RapidPro SMS Gateway: Webapp originating messages and state updates","",""
"","7706","the RHS button should show the action with custom label","","Wed Feb 05 20:25:16 UTC 2025","passed","Wed Feb 05 20:25:24 UTC 2025","","Creating custom places","",""
"","1786","should generate SMS report correctly when lacking patient_id","","Wed Feb 05 20:35:53 UTC 2025","passed","Wed Feb 05 20:35:55 UTC 2025","","Reports tab messages","",""
"","4049","should create new household","","Wed Feb 05 20:31:31 UTC 2025","passed","Wed Feb 05 20:31:35 UTC 2025","","Create new lineage structure ","",""
"","39127","Should show error message for bad config","","Wed Feb 05 20:41:41 UTC 2025","passed","Wed Feb 05 20:42:20 UTC 2025","","Tasks","",""
"","9893","the LHS button should show the appropriate label when multiple places exist at the current level","","Wed Feb 05 20:25:05 UTC 2025","passed","Wed Feb 05 20:25:15 UTC 2025","","Creating custom places","",""
"","3251","should create a report using patient_id","","Wed Feb 05 20:34:15 UTC 2025","passed","Wed Feb 05 20:34:18 UTC 2025","","Reports Subject","",""
"","3218","should keep updating until record is in final state","","Wed Feb 05 20:44:07 UTC 2025","passed","Wed Feb 05 20:44:10 UTC 2025","","RapidPro SMS Gateway: Webapp originating messages and state updates","",""
"","99","should only create one target doc","","Wed Feb 05 20:36:42 UTC 2025","passed","Wed Feb 05 20:36:42 UTC 2025","","Target accuracy","",""
"","279","should fail when message was not created","","Wed Feb 05 20:43:46 UTC 2025","passed","Wed Feb 05 20:43:46 UTC 2025","","RapidPro SMS Gateway: Webapp Terminating messages","",""
