"DESCRIPTION","DURATION IN MS","NAME","PARENT SUITE","START TIME","STATUS","STOP TIME","SUB SUITE","SUITE","TEST CLASS","TEST METHOD"
"","2324","should create a report using patient name","","Thu Jul 17 13:48:04 UTC 2025","passed","Thu Jul 17 13:48:07 UTC 2025","","Reports Subject","",""
"","7762","should unmute a contact using the defined unmute_forms (undo_death_report).","","Thu Jul 17 13:44:25 UTC 2025","passed","Thu Jul 17 13:44:33 UTC 2025","","Mute/Unmute contacts using a specific form - ","",""
"","7117","should download export file","","Thu Jul 17 13:47:06 UTC 2025","passed","Thu Jul 17 13:47:13 UTC 2025","","Export Reports","",""
"","7751","should poll for state updates and consume queue","","Thu Jul 17 13:58:40 UTC 2025","passed","Thu Jul 17 13:58:48 UTC 2025","","RapidPro SMS Gateway: Webapp originating messages and state updates","",""
"","2816","should not show page when submitting task for contact with no leaf type place in lineage","","Thu Jul 17 13:54:05 UTC 2025","passed","Thu Jul 17 13:54:08 UTC 2025","","Tasks group landing page: for chw","",""
"","3466","should show error log for bad config","","Thu Jul 17 13:41:13 UTC 2025","passed","Thu Jul 17 13:41:16 UTC 2025","","Contact details page.: Contact summary error","",""
"","2503","should create a report which does not have a subject","","Thu Jul 17 13:48:29 UTC 2025","passed","Thu Jul 17 13:48:32 UTC 2025","","Reports Subject","",""
"","2428","should create a report using missing required patient name","","Thu Jul 17 13:48:07 UTC 2025","passed","Thu Jul 17 13:48:09 UTC 2025","","Reports Subject","",""
"","14448","should launch an add contact form when type is provided in content","","Thu Jul 17 13:56:16 UTC 2025","passed","Thu Jul 17 13:56:31 UTC 2025","","Tasks: contact tasks","",""
