"DESCRIPTION","DURATION IN MS","NAME","PARENT SUITE","START TIME","STATUS","STOP TIME","SUB SUITE","SUITE","TEST CLASS","TEST METHOD"
"","9468","should not save target document when adding report for counted contact","Target accuracy","Fri Oct 24 08:07:10 UTC 2025","passed","Fri Oct 24 08:07:19 UTC 2025","","","",""
"","2398","should create a report using unknown place_id","Reports Subject","Fri Oct 24 08:05:00 UTC 2025","passed","Fri Oct 24 08:05:02 UTC 2025","","","",""
"","3327","should show fab when user only has can_create_places permission","FAB actions","Fri Oct 24 08:00:18 UTC 2025","passed","Fri Oct 24 08:00:22 UTC 2025","","","",""
"","3223","should be able to do an exact match search by a field and then return all data when clearing search","Reports Search","Fri Oct 24 08:05:33 UTC 2025","passed","Fri Oct 24 08:05:36 UTC 2025","","Logged in as an online user","",""
"","1572","should open task from the same group","Tasks group landing page","Fri Oct 24 08:11:06 UTC 2025","passed","Fri Oct 24 08:11:08 UTC 2025","","for chw","",""
"","3964","should display correct tasks with breadcrumbs for chw","Tasks tab breadcrumbs","Fri Oct 24 08:10:33 UTC 2025","passed","Fri Oct 24 08:10:37 UTC 2025","","for chw","",""
"","72613","should load multiple pages of tasks on infinite scrolling","Tasks","Fri Oct 24 08:14:05 UTC 2025","passed","Fri Oct 24 08:15:18 UTC 2025","","","",""
"","298","should fail with malformed authentication","RapidPro SMS Gateway","Fri Oct 24 08:18:02 UTC 2025","passed","Fri Oct 24 08:18:02 UTC 2025","","Webapp Terminating messages","",""
"","8183","should display targets of current user on home place","Target aggregates","Fri Oct 24 08:08:38 UTC 2025","passed","Fri Oct 24 08:08:46 UTC 2025","Online user with one place associated","User with one or more places assigned","",""
"","3093","should disable content","Target aggregates","Fri Oct 24 08:08:48 UTC 2025","passed","Fri Oct 24 08:08:51 UTC 2025","Offline user with multiple places associated","User with one or more places assigned","",""
"","10974","should update a contact, delete the same contact then unassign primary contact from facility","Edit ","Fri Oct 24 07:59:29 UTC 2025","passed","Fri Oct 24 07:59:40 UTC 2025","","","",""
"","2404","should create a report using place_id with a place_uuid","Reports Subject","Fri Oct 24 08:04:55 UTC 2025","passed","Fri Oct 24 08:04:57 UTC 2025","","","",""
"","3358","should display reports with updated breadcrumbs for offline user","Reports tab breadcrumbs","Fri Oct 24 08:03:22 UTC 2025","passed","Fri Oct 24 08:03:25 UTC 2025","","","",""
"","11653","should add user with multiple places with permission","User Test Cases -> Creating Users ->","Fri Oct 24 07:58:22 UTC 2025","passed","Fri Oct 24 07:58:34 UTC 2025","","","",""
"","927","search by NON empty string should display results which contains match and clears search","Contact Search","Fri Oct 24 08:02:58 UTC 2025","passed","Fri Oct 24 08:02:59 UTC 2025","","Logged in as an offline user","",""
"","4599","should create new household","Create new lineage structure ","Fri Oct 24 08:01:42 UTC 2025","passed","Fri Oct 24 08:01:46 UTC 2025","","","",""
"","2394","should display messages with updated breadcrumbs for offline user","Message Tab - Sender Data","Fri Oct 24 08:17:45 UTC 2025","passed","Fri Oct 24 08:17:47 UTC 2025","","","",""
"","10011","should handle rate limiting when polling","RapidPro SMS Gateway","Fri Oct 24 08:18:39 UTC 2025","passed","Fri Oct 24 08:18:49 UTC 2025","","Webapp originating messages and state updates","",""
"","3799","should display tasks group landing page after task completion","Tasks group landing page","Fri Oct 24 08:11:03 UTC 2025","passed","Fri Oct 24 08:11:06 UTC 2025","","for chw","",""
"","1767","should handle old format of the rules-state-store","Target accuracy","Fri Oct 24 08:07:33 UTC 2025","passed","Fri Oct 24 08:07:34 UTC 2025","","","",""
"","9622","should remove task from list when CHW completes a task successfully","Tasks","Fri Oct 24 08:11:44 UTC 2025","passed","Fri Oct 24 08:11:54 UTC 2025","","","",""
"","2541","Send SMS without patient_id and report created under person","Link SMS to patient without passing id","Fri Oct 24 08:17:21 UTC 2025","passed","Fri Oct 24 08:17:24 UTC 2025","","","",""
"","75","should only create one target doc","Target accuracy","Fri Oct 24 08:07:32 UTC 2025","passed","Fri Oct 24 08:07:33 UTC 2025","","","",""
"","3066","should download export file","Export Messages","Fri Oct 24 08:16:59 UTC 2025","passed","Fri Oct 24 08:17:02 UTC 2025","","","",""
"","29569","should not show reports when permission is disabled","Contact details page.","Fri Oct 24 07:56:13 UTC 2025","passed","Fri Oct 24 07:56:43 UTC 2025","","Permissions to show reports and tasks","",""
"","871","should have no results when searching by non-existent field value","Contact Search","Fri Oct 24 08:03:01 UTC 2025","passed","Fri Oct 24 08:03:02 UTC 2025","","Logged in as an offline user","",""
"","2687","should return results matching the search term and then return all data when clearing search","Reports Search","Fri Oct 24 08:05:27 UTC 2025","passed","Fri Oct 24 08:05:30 UTC 2025","","Logged in as an online user","",""
