"DESCRIPTION","DURATION IN MS","NAME","PARENT SUITE","START TIME","STATUS","STOP TIME","SUB SUITE","SUITE","TEST CLASS","TEST METHOD"
"","9514","should handle rate limiting when polling","","Thu May 29 12:32:04 UTC 2025","passed","Thu May 29 12:32:14 UTC 2025","","RapidPro SMS Gateway: Webapp originating messages and state updates","",""
"","3794","should filter by status","","Thu May 29 12:23:14 UTC 2025","passed","Thu May 29 12:23:17 UTC 2025","","Reports Sidebar Filter","",""
"","4978","can add duplicate contact that is not a sibling","","Thu May 29 12:17:06 UTC 2025","passed","Thu May 29 12:17:11 UTC 2025","","Duplicate contact detection","",""
"","7568","should mute a contact using the defined mute_forms (death_report).","","Thu May 29 12:18:46 UTC 2025","passed","Thu May 29 12:18:54 UTC 2025","","Mute/Unmute contacts using a specific form - ","",""
"","4442","should not show page when there are no more household tasks","","Thu May 29 12:27:44 UTC 2025","passed","Thu May 29 12:27:48 UTC 2025","","Tasks group landing page: for chw","",""
"","2282","should create a report using missing required patient name","","Thu May 29 12:22:13 UTC 2025","passed","Thu May 29 12:22:15 UTC 2025","","Reports Subject","",""
