"Status","Start Time","Stop Time","Duration in ms","Parent Suite","Suite","Sub Suite","Test Class","Test Method","Name","Description"
"passed","Mon Aug 26 11:53:10 UTC 2024","Mon Aug 26 11:53:12 UTC 2024","2120","","africas talking api: - gateway submits WT sms status updates","","","","- shows content",""
"passed","Mon Aug 26 11:55:06 UTC 2024","Mon Aug 26 11:55:08 UTC 2024","1747","","Send message","","","","should send a message to a raw phone number",""
"passed","Mon Aug 26 11:47:25 UTC 2024","Mon Aug 26 11:47:27 UTC 2024","2096","","Reports tab breadcrumbs","","","","should display reports with breadcrumbs for online user",""
"passed","Mon Aug 26 11:50:04 UTC 2024","Mon Aug 26 11:50:04 UTC 2024","398","","Target aggregates: DB admin","","","","should display an empty list when there are no aggregates",""
"passed","Mon Aug 26 11:52:18 UTC 2024","Mon Aug 26 11:52:23 UTC 2024","4391","","Tasks group landing page: for chw","","","","should display tasks group landing page after task completion",""
"passed","Mon Aug 26 11:41:37 UTC 2024","Mon Aug 26 11:41:45 UTC 2024","7119","","Creating custom places","","","","the RHS button should show the action with custom label",""
"passed","Mon Aug 26 11:45:15 UTC 2024","Mon Aug 26 11:45:18 UTC 2024","2494","","FAB + Actionbar: Action bar","","","","should not show new place when missing permission",""
"passed","Mon Aug 26 11:43:52 UTC 2024","Mon Aug 26 11:43:54 UTC 2024","2269","","Contact details page.: Contact summary error","","","","should show error log for bad config",""
"passed","Mon Aug 26 11:49:00 UTC 2024","Mon Aug 26 11:49:02 UTC 2024","2253","","Reports Subject","","","","should create a report using place_id with a place_uuid",""
"passed","Mon Aug 26 11:46:16 UTC 2024","Mon Aug 26 11:46:19 UTC 2024","2498","","Create new lineage structure ","","","","should create new person",""
"passed","Mon Aug 26 11:48:31 UTC 2024","Mon Aug 26 11:48:37 UTC 2024","6087","","Infinite scrolling","","","","should load multiple pages of reports",""
"passed","Mon Aug 26 11:44:57 UTC 2024","Mon Aug 26 11:45:00 UTC 2024","2912","","FAB + Actionbar: FAB","","","","should show fab when user only has can_create_places permission",""
"passed","Mon Aug 26 11:46:04 UTC 2024","Mon Aug 26 11:46:08 UTC 2024","3553","","Create new lineage structure ","","","","should create new health center",""
"passed","Mon Aug 26 11:50:31 UTC 2024","Mon Aug 26 11:50:39 UTC 2024","7850","","Target aggregates: User with one or more places assigned: Online user with one place associated","","","","should route to contact-detail on list item click and display contact summary target card",""
"passed","Mon Aug 26 11:53:54 UTC 2024","Mon Aug 26 11:53:58 UTC 2024","3613","","Message Tab - Sender Data","","","","should not remove facility from breadcrumbs when offline user has many facilities associated",""
"passed","Mon Aug 26 11:40:56 UTC 2024","Mon Aug 26 11:41:02 UTC 2024","5820","","Targets","","","","should display correct message when no target found",""
"passed","Mon Aug 26 11:49:32 UTC 2024","Mon Aug 26 11:49:34 UTC 2024","2583","","Reports Search","","","","should return results when searching by case_id",""
"passed","Mon Aug 26 11:46:57 UTC 2024","Mon Aug 26 11:47:08 UTC 2024","10477","","Create Person Under Area, ","","","","should create person under area should only see children",""
"passed","Mon Aug 26 11:48:50 UTC 2024","Mon Aug 26 11:48:53 UTC 2024","2639","","Reports Subject","","","","should create a report using doc id",""
"passed","Mon Aug 26 11:50:09 UTC 2024","Mon Aug 26 11:50:16 UTC 2024","7153","","Target aggregates: User with one or more places assigned: Online user with one place associated","","","","should display no data when no targets are uploaded",""
"passed","Mon Aug 26 11:54:19 UTC 2024","Mon Aug 26 11:54:20 UTC 2024","1549","","RapidPro SMS Gateway: Webapp originating messages and state updates","","","","should not call RapidPro endpoint when credentials are not set",""
"passed","Mon Aug 26 11:54:28 UTC 2024","Mon Aug 26 11:54:30 UTC 2024","1676","","RapidPro SMS Gateway: Webapp originating messages and state updates","","","","should not poll messages for docs that are in pending or scheduled states or lack gateway ref ",""
"passed","Mon Aug 26 11:51:53 UTC 2024","Mon Aug 26 11:51:56 UTC 2024","2698","","Tasks tab breadcrumbs: for chw","","","","should not remove facility from breadcrumbs when offline user has many facilities associated",""
"passed","Mon Aug 26 11:50:17 UTC 2024","Mon Aug 26 11:50:30 UTC 2024","12732","","Target aggregates: User with one or more places assigned: Online user with one place associated","","","","should display correct data",""
"passed","Mon Aug 26 11:46:37 UTC 2024","Mon Aug 26 11:46:44 UTC 2024","7132","","Create new lineage structure ","","","","should edit the name of the CHW area",""
"passed","Mon Aug 26 11:53:20 UTC 2024","Mon Aug 26 11:53:23 UTC 2024","3294","","Export Messages","","","","Should download export file",""
"passed","Mon Aug 26 11:50:41 UTC 2024","Mon Aug 26 11:50:43 UTC 2024","1912","","Target aggregates: User with one or more places assigned: Offline user with multiple places associated","","","","should disable content",""
"passed","Mon Aug 26 11:47:16 UTC 2024","Mon Aug 26 11:47:17 UTC 2024","557","","Contact Search","","","","search by NON empty string should display results with contains match and clears search",""
"passed","Mon Aug 26 11:48:58 UTC 2024","Mon Aug 26 11:49:00 UTC 2024","1821","","Reports Subject","","","","should create a report using missing required patient name",""
"passed","Mon Aug 26 11:42:33 UTC 2024","Mon Aug 26 11:42:36 UTC 2024","3143","","Add new district tests : ","","","","should edit district",""
"passed","Mon Aug 26 11:48:56 UTC 2024","Mon Aug 26 11:48:58 UTC 2024","1726","","Reports Subject","","","","should create a report using patient name",""
"passed","Mon Aug 26 11:51:20 UTC 2024","Mon Aug 26 11:51:27 UTC 2024","6717","","Task list due dates","","","","should display correct due dates with default settings",""
"passed","Mon Aug 26 11:49:56 UTC 2024","Mon Aug 26 11:49:58 UTC 2024","1487","","Reports tab messages","","","","should generate SMS report correctly when lacking patient_id",""
"passed","Mon Aug 26 11:50:04 UTC 2024","Mon Aug 26 11:50:06 UTC 2024","1253","","Target aggregates: DB admin","","","","should display an error when there are aggregates but no home place",""
"passed","Mon Aug 26 11:51:59 UTC 2024","Mon Aug 26 11:52:01 UTC 2024","1361","","Tasks tab breadcrumbs: for chw","","","","should open task with expression",""
"passed","Mon Aug 26 11:49:02 UTC 2024","Mon Aug 26 11:49:05 UTC 2024","2577","","Reports Subject","","","","should create a report using place_id with a shortcode",""
"passed","Mon Aug 26 11:42:36 UTC 2024","Mon Aug 26 11:42:39 UTC 2024","2846","","Add new district tests : ","","","","should edit district with contact_type",""
"passed","Mon Aug 26 11:49:29 UTC 2024","Mon Aug 26 11:49:32 UTC 2024","3039","","Reports Search","","","","should return results matching the search term and then return all data when clearing search",""
"passed","Mon Aug 26 11:46:08 UTC 2024","Mon Aug 26 11:46:12 UTC 2024","3843","","Create new lineage structure ","","","","should create new area",""
"passed","Mon Aug 26 11:55:17 UTC 2024","Mon Aug 26 11:55:19 UTC 2024","2411","","Send message","","","","should send a message using FAB at people's tab",""
"passed","Mon Aug 26 11:55:08 UTC 2024","Mon Aug 26 11:55:10 UTC 2024","2289","","Send message","","","","should send a message to a contact with a phone number",""
"passed","Mon Aug 26 11:54:25 UTC 2024","Mon Aug 26 11:54:27 UTC 2024","2493","","RapidPro SMS Gateway: Webapp originating messages and state updates","","","","should update the states correctly from messages api",""
"passed","Mon Aug 26 11:52:23 UTC 2024","Mon Aug 26 11:52:25 UTC 2024","1662","","Tasks group landing page: for chw","","","","should open task from the same group",""
"passed","Mon Aug 26 11:41:15 UTC 2024","Mon Aug 26 11:41:24 UTC 2024","8888","","Creating custom places","","","","the LHS button should show the appropriate label when only one action",""
"passed","Mon Aug 26 11:49:08 UTC 2024","Mon Aug 26 11:49:10 UTC 2024","2022","","Reports Subject","","","","should create a report which has an unknown sender and a known subject",""
"passed","Mon Aug 26 11:44:04 UTC 2024","Mon Aug 26 11:44:13 UTC 2024","9705","","User Test Cases -> Creating Users ->","","","","should add user with multiple places with permission",""
"passed","Mon Aug 26 11:49:13 UTC 2024","Mon Aug 26 11:49:18 UTC 2024","5647","","Reports Subject","","","","changes to a loaded or list report should be reflected in the UI ",""
"passed","Mon Aug 26 11:41:26 UTC 2024","Mon Aug 26 11:41:36 UTC 2024","10152","","Creating custom places","","","","the LHS button should show the appropriate label when multiple places exist at the current level",""
"passed","Mon Aug 26 11:53:39 UTC 2024","Mon Aug 26 11:53:42 UTC 2024","2344","","Link SMS to patient without passing id","","","","Send SMS without patient_id and report created under person",""
"passed","Mon Aug 26 11:42:56 UTC 2024","Mon Aug 26 11:43:01 UTC 2024","4719","","Contact details page.: Permissions to show reports and tasks","","","","should not show reports when permission is disabled",""
"passed","Mon Aug 26 11:48:47 UTC 2024","Mon Aug 26 11:48:50 UTC 2024","3077","","Reports Subject","","","","should create a report using patient_id",""
"passed","Mon Aug 26 11:53:07 UTC 2024","Mon Aug 26 11:53:10 UTC 2024","2801","","africas talking api: - gateway submits new WT sms messages","","","","- shows content",""
"passed","Mon Aug 26 11:46:25 UTC 2024","Mon Aug 26 11:46:32 UTC 2024","6543","","Create new lineage structure ","","","","should edit a name of the health facility",""
"passed","Mon Aug 26 11:45:44 UTC 2024","Mon Aug 26 11:45:49 UTC 2024","4930","","Mute/Unmute contacts using a specific form - ","","","","should mute a contact using the defined mute_forms (death_report).",""
"passed","Mon Aug 26 11:54:12 UTC 2024","Mon Aug 26 11:54:15 UTC 2024","3217","","RapidPro SMS Gateway: Webapp Terminating messages","","","","should create messages",""
"passed","Mon Aug 26 11:46:32 UTC 2024","Mon Aug 26 11:46:36 UTC 2024","4679","","Create new lineage structure ","","","","should delete the primary contact of health facility",""
"passed","Mon Aug 26 11:53:58 UTC 2024","Mon Aug 26 11:54:00 UTC 2024","1491","","Message Tab - Sender Data","","","","should display messages with updated breadcrumbs for offline user",""
"passed","Mon Aug 26 11:44:43 UTC 2024","Mon Aug 26 11:44:48 UTC 2024","4946","","Export Contacts ","","","","should download export file",""
"passed","Mon Aug 26 11:47:31 UTC 2024","Mon Aug 26 11:47:33 UTC 2024","2234","","Reports tab breadcrumbs","","","","should display reports with updated breadcrumbs for offline user",""
"passed","Mon Aug 26 11:49:46 UTC 2024","Mon Aug 26 11:49:49 UTC 2024","2910","","Reports Sidebar Filter","","","","should filter by user associated place when the permission to default filter is enabled",""
"passed","Mon Aug 26 11:47:28 UTC 2024","Mon Aug 26 11:47:30 UTC 2024","2258","","Reports tab breadcrumbs","","","","should not remove facility from breadcrumbs when offline user has many facilities associated",""
"passed","Mon Aug 26 11:54:34 UTC 2024","Mon Aug 26 11:54:42 UTC 2024","7104","","RapidPro SMS Gateway: Webapp originating messages and state updates","","","","should poll for state updates and consume queue",""
"passed","Mon Aug 26 11:42:52 UTC 2024","Mon Aug 26 11:42:56 UTC 2024","3825","","Contact details page.: Permissions to show reports and tasks","","","","should show reports and tasks when permissions are enabled",""
"passed","Mon Aug 26 11:48:20 UTC 2024","Mon Aug 26 11:48:22 UTC 2024","1658","","generating short codes","","","","create case ID",""
"passed","Mon Aug 26 11:41:05 UTC 2024","Mon Aug 26 11:41:10 UTC 2024","5487","","Targets","","","","should show error message for bad config",""
"passed","Mon Aug 26 11:41:02 UTC 2024","Mon Aug 26 11:41:05 UTC 2024","2525","","Targets","","","","should display correct message when targets are disabled",""
"passed","Mon Aug 26 11:54:21 UTC 2024","Mon Aug 26 11:54:22 UTC 2024","897","","RapidPro SMS Gateway: Webapp originating messages and state updates","","","","should call endpoint with set credentials",""
"passed","Mon Aug 26 11:42:14 UTC 2024","Mon Aug 26 11:42:21 UTC 2024","7418","","Creating custom places","","","","should show custom places in their own list",""
"passed","Mon Aug 26 11:53:49 UTC 2024","Mon Aug 26 11:53:54 UTC 2024","4636","","Message Tab - Sender Data","","","","should display messages with breadcrumbs for online user",""
"passed","Mon Aug 26 11:50:44 UTC 2024","Mon Aug 26 11:50:45 UTC 2024","920","","Target aggregates: User with one or more places assigned: Offline user with multiple places associated","","","","should display only the targets sections and show the correct message when target aggregates are disabled",""
"passed","Mon Aug 26 11:42:04 UTC 2024","Mon Aug 26 11:42:12 UTC 2024","7983","","Creating custom places","","","","should show the multi person actions with the correct label",""
"passed","Mon Aug 26 11:54:23 UTC 2024","Mon Aug 26 11:54:24 UTC 2024","1456","","RapidPro SMS Gateway: Webapp originating messages and state updates","","","","should set correct states from broadcast api",""
"passed","Mon Aug 26 11:49:10 UTC 2024","Mon Aug 26 11:49:12 UTC 2024","2040","","Reports Subject","","","","should create a report which has an unknown sender with no phone number",""
"passed","Mon Aug 26 11:48:08 UTC 2024","Mon Aug 26 11:48:13 UTC 2024","4996","","Export Reports","","","","Should download export file",""
"passed","Mon Aug 26 11:54:08 UTC 2024","Mon Aug 26 11:54:08 UTC 2024","307","","RapidPro SMS Gateway: Webapp Terminating messages","","","","should fail with no incoming key configured",""
"passed","Mon Aug 26 11:51:57 UTC 2024","Mon Aug 26 11:51:59 UTC 2024","2448","","Tasks tab breadcrumbs: for chw","","","","should display correct tasks with breadcrumbs for chw",""
"passed","Mon Aug 26 11:41:56 UTC 2024","Mon Aug 26 11:42:03 UTC 2024","7108","","Creating custom places","","","","should show the single add person button with the correct label",""
"passed","Mon Aug 26 11:52:34 UTC 2024","Mon Aug 26 11:52:38 UTC 2024","4552","","Tasks group landing page: for chw","","","","should not show page when there are no more household tasks",""
"passed","Mon Aug 26 11:54:10 UTC 2024","Mon Aug 26 11:54:10 UTC 2024","315","","RapidPro SMS Gateway: Webapp Terminating messages","","","","should fail with incorrect authentication",""
"passed","Mon Aug 26 11:47:40 UTC 2024","Mon Aug 26 11:47:44 UTC 2024","4311","","Bulk delete reports","","","","should select, deselect and delete only selected reports",""
"passed","Mon Aug 26 11:47:17 UTC 2024","Mon Aug 26 11:47:17 UTC 2024","611","","Contact Search","","","","search should clear RHS selected contact",""
"passed","Mon Aug 26 11:54:31 UTC 2024","Mon Aug 26 11:54:34 UTC 2024","2605","","RapidPro SMS Gateway: Webapp originating messages and state updates","","","","should keep updating until record is in final state",""
"passed","Mon Aug 26 11:52:30 UTC 2024","Mon Aug 26 11:52:34 UTC 2024","3486","","Tasks group landing page: for chw","","","","should not display modal when clicking list task from same group",""
"passed","Mon Aug 26 11:43:01 UTC 2024","Mon Aug 26 11:43:06 UTC 2024","5280","","Contact details page.: Permissions to show reports and tasks","","","","should not show tasks when permission is disabled",""
"passed","Mon Aug 26 11:45:49 UTC 2024","Mon Aug 26 11:45:53 UTC 2024","4251","","Mute/Unmute contacts using a specific form - ","","","","should unmute a contact using the defined unmute_forms (undo_death_report).",""
"passed","Mon Aug 26 11:53:30 UTC 2024","Mon Aug 26 11:53:31 UTC 2024","1408","","sms-gateway api: - gateway submits new WT sms messages","","","","shows content",""
"passed","Mon Aug 26 11:54:44 UTC 2024","Mon Aug 26 11:54:53 UTC 2024","9615","","RapidPro SMS Gateway: Webapp originating messages and state updates","","","","should handle rate limiting when polling",""
"passed","Mon Aug 26 11:45:53 UTC 2024","Mon Aug 26 11:45:58 UTC 2024","4372","","Mute/Unmute contacts using a specific form - ","","","","should show a popup when trying to submit a non-unmuting form against a muted contact",""
"passed","Mon Aug 26 11:52:43 UTC 2024","Mon Aug 26 11:52:45 UTC 2024","1931","","Tasks group landing page: for supervisor","","","","should have tasks",""
"passed","Mon Aug 26 11:41:46 UTC 2024","Mon Aug 26 11:41:54 UTC 2024","7362","","Creating custom places","","","","the RHS button show the appropriate label when multiple places exist at the current level",""
"passed","Mon Aug 26 11:49:42 UTC 2024","Mon Aug 26 11:49:45 UTC 2024","3173","","Reports Sidebar Filter","","","","should filter by date",""
"passed","Mon Aug 26 11:50:45 UTC 2024","Mon Aug 26 11:51:09 UTC 2024","23874","","Target aggregates: User with one or more places assigned: Offline user with multiple places associated","","","","should filter aggregates by place and period",""
"passed","Mon Aug 26 11:46:12 UTC 2024","Mon Aug 26 11:46:16 UTC 2024","4524","","Create new lineage structure ","","","","should create new household",""
"passed","Mon Aug 26 11:45:07 UTC 2024","Mon Aug 26 11:45:09 UTC 2024","2134","","FAB + Actionbar: Action bar","","","","should show new household and new person create option",""
"passed","Mon Aug 26 11:52:38 UTC 2024","Mon Aug 26 11:52:41 UTC 2024","2621","","Tasks group landing page: for chw","","","","should not show page when submitting task for contact with no leaf type place in lineage",""
"passed","Mon Aug 26 11:44:29 UTC 2024","Mon Aug 26 11:44:38 UTC 2024","9125","","Edit ","","","","should sync and update the offline user's home place",""
"passed","Mon Aug 26 11:55:10 UTC 2024","Mon Aug 26 11:55:11 UTC 2024","847","","Send message","","","","should reply to an existing message - raw phone number",""
"passed","Mon Aug 26 11:52:57 UTC 2024","Mon Aug 26 11:53:02 UTC 2024","5123","","Tasks","","","","Should show error message for bad config",""
"passed","Mon Aug 26 11:48:53 UTC 2024","Mon Aug 26 11:48:56 UTC 2024","2629","","Reports Subject","","","","should create a report using unknown patient_id ",""
"passed","Mon Aug 26 11:55:14 UTC 2024","Mon Aug 26 11:55:17 UTC 2024","2503","","Send message","","","","should reply to an existing message and add a new recipient - contact with a phone number ",""
"passed","Mon Aug 26 11:55:12 UTC 2024","Mon Aug 26 11:55:14 UTC 2024","2527","","Send message","","","","should reply to an existing message and add a new recipient - raw phone number ",""
"passed","Mon Aug 26 11:54:08 UTC 2024","Mon Aug 26 11:54:09 UTC 2024","665","","RapidPro SMS Gateway: Webapp Terminating messages","","","","should fail with no authentication provided",""
"passed","Mon Aug 26 11:45:29 UTC 2024","Mon Aug 26 11:45:33 UTC 2024","4761","","Infinite scrolling","","","","should load multiple pages of contacts",""
"passed","Mon Aug 26 11:45:11 UTC 2024","Mon Aug 26 11:45:13 UTC 2024","2316","","FAB + Actionbar: Action bar","","","","should not show new person when missing permission",""
"passed","Mon Aug 26 11:54:16 UTC 2024","Mon Aug 26 11:54:18 UTC 2024","2472","","RapidPro SMS Gateway: Webapp Terminating messages","","","","should create reports",""
"passed","Mon Aug 26 11:55:03 UTC 2024","Mon Aug 26 11:55:06 UTC 2024","2893","","Send message","","","","should send messages to all the contacts, under a place, that have a primary phone number assigned",""
"passed","Mon Aug 26 11:45:02 UTC 2024","Mon Aug 26 11:45:04 UTC 2024","2192","","FAB + Actionbar: FAB","","","","should show fab when user only has can_create_people permission",""
"passed","Mon Aug 26 11:52:03 UTC 2024","Mon Aug 26 11:52:04 UTC 2024","1011","","Tasks tab breadcrumbs: for supervisor","","","","should display correct tasks with breadcrumbs for supervisor",""
"passed","Mon Aug 26 11:46:19 UTC 2024","Mon Aug 26 11:46:25 UTC 2024","6258","","Create new lineage structure ","","","","should edit a person with a phone number",""
"passed","Mon Aug 26 11:46:44 UTC 2024","Mon Aug 26 11:46:50 UTC 2024","6068","","Create new lineage structure ","","","","should edit the name of the Family",""
"passed","Mon Aug 26 11:52:25 UTC 2024","Mon Aug 26 11:52:30 UTC 2024","5735","","Tasks group landing page: for chw","","","","should display modal when clicking on a task from another group",""
"passed","Mon Aug 26 11:44:21 UTC 2024","Mon Aug 26 11:44:29 UTC 2024","7688","","Edit ","","","","should update a contact, delete the same contact then unassign primary contact from facility",""
"passed","Mon Aug 26 11:54:11 UTC 2024","Mon Aug 26 11:54:12 UTC 2024","476","","RapidPro SMS Gateway: Webapp Terminating messages","","","","should fail when message was not created",""
"passed","Mon Aug 26 11:47:48 UTC 2024","Mon Aug 26 11:47:53 UTC 2024","5244","","Report Filter","","","","should filter by date",""
"passed","Mon Aug 26 11:51:34 UTC 2024","Mon Aug 26 11:51:41 UTC 2024","7114","","Task list due dates","","","","should display correct due dates with taskDaysOverdue setting and simple translation",""
"passed","Mon Aug 26 11:49:05 UTC 2024","Mon Aug 26 11:49:08 UTC 2024","2753","","Reports Subject","","","","should create a report using unknown place_id",""
"passed","Mon Aug 26 11:51:27 UTC 2024","Mon Aug 26 11:51:34 UTC 2024","6218","","Task list due dates","","","","should display correct due dates with taskDaysOverdue setting",""
"passed","Mon Aug 26 11:53:31 UTC 2024","Mon Aug 26 11:53:32 UTC 2024","1239","","sms-gateway api: - gateway submits WT sms status updates","","","","- shows content",""
"passed","Mon Aug 26 11:55:11 UTC 2024","Mon Aug 26 11:55:12 UTC 2024","968","","Send message","","","","should reply to an existing message - contact with a phone number",""
"passed","Mon Aug 26 11:42:29 UTC 2024","Mon Aug 26 11:42:32 UTC 2024","3456","","Add new district tests : ","","","","should add new district with a new person",""
"passed","Mon Aug 26 11:54:01 UTC 2024","Mon Aug 26 11:54:02 UTC 2024","1391","","Message Tab - Sender Data","","","","should display conversation with link and navigate to contact",""
"passed","Mon Aug 26 11:54:10 UTC 2024","Mon Aug 26 11:54:11 UTC 2024","364","","RapidPro SMS Gateway: Webapp Terminating messages","","","","should fail with malformed authentication",""
"passed","Mon Aug 26 11:44:55 UTC 2024","Mon Aug 26 11:44:57 UTC 2024","1089","","FAB + Actionbar: FAB","","","","should show new household and new person create option",""
"passed","Mon Aug 26 11:53:32 UTC 2024","Mon Aug 26 11:53:33 UTC 2024","907","","sms-gateway api: - api returns list of pending WO messages","","","","- returns list and updates state",""
"passed","Mon Aug 26 11:49:18 UTC 2024","Mon Aug 26 11:49:20 UTC 2024","1809","","Reports Subject","","","","should create a report which does not have a subject",""
"passed","Mon Aug 26 11:40:54 UTC 2024","Mon Aug 26 11:40:56 UTC 2024","1745","","Targets","","","","should display targets from default config",""
"passed","Mon Aug 26 11:47:58 UTC 2024","Mon Aug 26 11:48:04 UTC 2024","5452","","Delete Reports","","","","Should delete report",""
"passed","Mon Aug 26 11:42:56 UTC 2024","Mon Aug 26 11:42:56 UTC 2024","116","","Contact details page.: Permissions to show reports and tasks","","","","should show contact summary that has the full context for reports > 50 validate that the pregnancy card is always displayed",""
"passed","Mon Aug 26 11:52:45 UTC 2024","Mon Aug 26 11:52:48 UTC 2024","2738","","Tasks group landing page: for supervisor","","","","should not display task landing page after task completion",""
"passed","Mon Aug 26 11:52:18 UTC 2024","Mon Aug 26 11:52:18 UTC 2024","701","","Tasks group landing page: for chw","","","","should have tasks",""
