"DESCRIPTION","DURATION IN MS","NAME","PARENT SUITE","START TIME","STATUS","STOP TIME","SUB SUITE","SUITE","TEST CLASS","TEST METHOD"
"","6619","should edit a name of the health facility","Create new lineage structure ","Fri Oct 24 08:01:57 UTC 2025","passed","Fri Oct 24 08:02:04 UTC 2025","","","",""
"","5733","should save target document when deleting counted contact","Target accuracy","Fri Oct 24 08:07:19 UTC 2025","passed","Fri Oct 24 08:07:25 UTC 2025","","","",""
"","1362","should generate SMS report correctly when lacking patient_id","Reports tab messages","Fri Oct 24 08:06:41 UTC 2025","passed","Fri Oct 24 08:06:42 UTC 2025","","","",""
"","1045","should reply to an existing message - raw phone number","Send message","Fri Oct 24 08:19:19 UTC 2025","passed","Fri Oct 24 08:19:20 UTC 2025","","","",""
"","5874","detects duplicates when editing a contact - navigates to duplicate contact","Duplicate contact detection","Fri Oct 24 07:58:56 UTC 2025","passed","Fri Oct 24 07:59:01 UTC 2025","","","",""
"","892","should have unique results for when multiple fields match the same search text","Contact Search","Fri Oct 24 08:03:02 UTC 2025","passed","Fri Oct 24 08:03:02 UTC 2025","","Logged in as an offline user","",""
"","2255","should be able to do an exact match search by a field and then return all data when clearing search","Reports Search","Fri Oct 24 08:05:49 UTC 2025","passed","Fri Oct 24 08:05:51 UTC 2025","","Logged in as an offline user","",""
"","2391","should show fab when user only has can_create_people permission","FAB actions","Fri Oct 24 08:00:24 UTC 2025","passed","Fri Oct 24 08:00:26 UTC 2025","","","",""
"","3366","should save target document on first calculation","Target accuracy","Fri Oct 24 08:06:54 UTC 2025","passed","Fri Oct 24 08:06:57 UTC 2025","","","",""
"","7918","the RHS button show the appropriate label when multiple places exist at the current level","Creating custom places","Fri Oct 24 07:54:56 UTC 2025","passed","Fri Oct 24 07:55:03 UTC 2025","","","",""
"","2297","should create a report which does not have a subject","Reports Subject","Fri Oct 24 08:05:14 UTC 2025","passed","Fri Oct 24 08:05:16 UTC 2025","","","",""
"","4640","should not remove facility from breadcrumbs when offline user has many facilities associated","Message Tab - Sender Data","Fri Oct 24 08:17:39 UTC 2025","passed","Fri Oct 24 08:17:44 UTC 2025","","","",""
"","8122","should poll for state updates and consume queue","RapidPro SMS Gateway","Fri Oct 24 08:18:28 UTC 2025","passed","Fri Oct 24 08:18:36 UTC 2025","","Webapp originating messages and state updates","",""
"","1688","should display correct tasks with breadcrumbs for supervisor","Tasks tab breadcrumbs","Fri Oct 24 08:10:43 UTC 2025","passed","Fri Oct 24 08:10:44 UTC 2025","","for supervisor","",""
"","4268","should select, deselect and delete only selected reports","Bulk delete reports","Fri Oct 24 08:03:34 UTC 2025","passed","Fri Oct 24 08:03:38 UTC 2025","","","",""
"","2684","should not show page when submitting task for contact with no leaf type place in lineage","Tasks group landing page","Fri Oct 24 08:11:20 UTC 2025","passed","Fri Oct 24 08:11:22 UTC 2025","","for chw","",""
"","7574","should show the multi person actions with the correct label","Creating custom places","Fri Oct 24 07:55:15 UTC 2025","passed","Fri Oct 24 07:55:22 UTC 2025","","","",""
"","1297","should display an error when there are aggregates but no home place","Target aggregates","Fri Oct 24 08:07:44 UTC 2025","passed","Fri Oct 24 08:07:45 UTC 2025","","DB admin","",""
"","467","should fail with no authentication provided","RapidPro SMS Gateway","Fri Oct 24 08:17:59 UTC 2025","passed","Fri Oct 24 08:18:00 UTC 2025","","Webapp Terminating messages","",""
"","2443","should update the states correctly from messages api","RapidPro SMS Gateway","Fri Oct 24 08:18:18 UTC 2025","passed","Fri Oct 24 08:18:21 UTC 2025","","Webapp originating messages and state updates","",""
"","5288","detects duplicates when creating person - clears dupes when form updated","Duplicate contact detection","Fri Oct 24 07:58:49 UTC 2025","passed","Fri Oct 24 07:58:54 UTC 2025","","","",""
"","917","should have unique results for when multiple fields match the same search text","Contact Search","Fri Oct 24 08:02:54 UTC 2025","passed","Fri Oct 24 08:02:55 UTC 2025","","Logged in as an online user","",""
"","6449","should edit the name of the CHW area","Create new lineage structure ","Fri Oct 24 08:02:08 UTC 2025","passed","Fri Oct 24 08:02:14 UTC 2025","","","",""
"","7380","Should delete report","Delete Reports","Fri Oct 24 08:03:43 UTC 2025","passed","Fri Oct 24 08:03:50 UTC 2025","","","",""
"","4726","can add duplicate contact that is not a sibling","Duplicate contact detection","Fri Oct 24 07:59:16 UTC 2025","passed","Fri Oct 24 07:59:20 UTC 2025","","","",""
"","1960","should display only the targets sections and show the correct message when target aggregates are disabled","Target aggregates","Fri Oct 24 08:08:53 UTC 2025","passed","Fri Oct 24 08:08:55 UTC 2025","Offline user with multiple places associated","User with one or more places assigned","",""
"","4645","should show reports and tasks when permissions are enabled","Contact details page.","Fri Oct 24 07:56:08 UTC 2025","passed","Fri Oct 24 07:56:13 UTC 2025","","Permissions to show reports and tasks","",""
"","14358","should launch an add contact form when type is provided in content","Tasks","Fri Oct 24 08:16:06 UTC 2025","passed","Fri Oct 24 08:16:21 UTC 2025","","contact tasks","",""
"","1635","should return results when searching by case_id","Reports Search","Fri Oct 24 08:05:47 UTC 2025","passed","Fri Oct 24 08:05:49 UTC 2025","","Logged in as an offline user","",""
"","3275","should delete the primary contact of health facility","Create new lineage structure ","Fri Oct 24 08:02:04 UTC 2025","passed","Fri Oct 24 08:02:08 UTC 2025","","","",""
"","1466","should shows content","sms-gateway api","Fri Oct 24 08:17:10 UTC 2025","passed","Fri Oct 24 08:17:12 UTC 2025","","Gateway submits new WT sms messages","",""
"","4751","should create new area","Create new lineage structure ","Fri Oct 24 08:01:36 UTC 2025","passed","Fri Oct 24 08:01:41 UTC 2025","","","",""
"","6428","should download export file","Export Contacts ","Fri Oct 24 08:00:00 UTC 2025","passed","Fri Oct 24 08:00:06 UTC 2025","","","",""
"","1115","should call endpoint with set credentials","RapidPro SMS Gateway","Fri Oct 24 08:18:14 UTC 2025","passed","Fri Oct 24 08:18:15 UTC 2025","","Webapp originating messages and state updates","",""
"","2189","should have no results when searching by non-existent field value","Reports Search","Fri Oct 24 08:05:51 UTC 2025","passed","Fri Oct 24 08:05:53 UTC 2025","","Logged in as an offline user","",""
"","2155","should create a report using unknown patient_id ","Reports Subject","Fri Oct 24 08:04:47 UTC 2025","passed","Fri Oct 24 08:04:49 UTC 2025","","","",""
"","976","search by NON empty string should display results which contains match and clears search","Contact Search","Fri Oct 24 08:02:51 UTC 2025","passed","Fri Oct 24 08:02:52 UTC 2025","","Logged in as an online user","",""
"","5152","detects duplicates when creating top-level place - allows acknowledging","Duplicate contact detection","Fri Oct 24 07:58:42 UTC 2025","passed","Fri Oct 24 07:58:47 UTC 2025","","","",""
"","8390","should unmute a contact using the defined unmute_forms (undo_death_report).","Mute/Unmute contacts using a specific form - ","Fri Oct 24 08:01:09 UTC 2025","passed","Fri Oct 24 08:01:18 UTC 2025","","","",""
"","2941","should have no results when searching by non-existent field value","Reports Search","Fri Oct 24 08:05:36 UTC 2025","passed","Fri Oct 24 08:05:39 UTC 2025","","Logged in as an online user","",""
"","3784","should filter by status","Reports Sidebar Filter","Fri Oct 24 08:06:21 UTC 2025","passed","Fri Oct 24 08:06:25 UTC 2025","","","",""
"","1705","should not call RapidPro endpoint when credentials are not set","RapidPro SMS Gateway","Fri Oct 24 08:18:12 UTC 2025","passed","Fri Oct 24 08:18:14 UTC 2025","","Webapp originating messages and state updates","",""
"","2414","should create a report using patient name","Reports Subject","Fri Oct 24 08:04:50 UTC 2025","passed","Fri Oct 24 08:04:52 UTC 2025","","","",""
"","121","should show contact summary that has the full context for reports > 50 validate that the pregnancy card is always displayed","Contact details page.","Fri Oct 24 07:56:13 UTC 2025","passed","Fri Oct 24 07:56:13 UTC 2025","","Permissions to show reports and tasks","",""
"","927","should be able to do exact match searching by a field","Contact Search","Fri Oct 24 08:02:52 UTC 2025","passed","Fri Oct 24 08:02:53 UTC 2025","","Logged in as an online user","",""
"","406","should fail with incorrect authentication","RapidPro SMS Gateway","Fri Oct 24 08:18:01 UTC 2025","passed","Fri Oct 24 08:18:01 UTC 2025","","Webapp Terminating messages","",""
"","2256","should create a report using missing required patient name","Reports Subject","Fri Oct 24 08:04:52 UTC 2025","passed","Fri Oct 24 08:04:55 UTC 2025","","","",""
"","1207","should shows content","sms-gateway api","Fri Oct 24 08:17:12 UTC 2025","passed","Fri Oct 24 08:17:13 UTC 2025","","Gateway submits WT sms status updates","",""
"","765","should returns list and updates state","sms-gateway api","Fri Oct 24 08:17:13 UTC 2025","passed","Fri Oct 24 08:17:14 UTC 2025","","api returns list of pending WO messages","",""
"","6481","should edit a person with a phone number","Create new lineage structure ","Fri Oct 24 08:01:50 UTC 2025","passed","Fri Oct 24 08:01:57 UTC 2025","","","",""
"","3150","should send messages to all the contacts, under a place, that have a primary phone number assigned","Send message","Fri Oct 24 08:19:00 UTC 2025","passed","Fri Oct 24 08:19:03 UTC 2025","","","",""
"","2166","should create a report using place_id with a shortcode","Reports Subject","Fri Oct 24 08:04:58 UTC 2025","passed","Fri Oct 24 08:05:00 UTC 2025","","","",""
"","2124","should send a message to a contact with a phone number","Send message","Fri Oct 24 08:19:17 UTC 2025","passed","Fri Oct 24 08:19:19 UTC 2025","","","",""
"","7276","should save target document when targets change","Target accuracy","Fri Oct 24 08:06:57 UTC 2025","passed","Fri Oct 24 08:07:04 UTC 2025","","","",""
"","3522","should not remove facility from breadcrumbs when offline user has many facilities associated","Reports tab breadcrumbs","Fri Oct 24 08:03:17 UTC 2025","passed","Fri Oct 24 08:03:21 UTC 2025","","","",""
"","1349","should create case ID","Generating short codes","Fri Oct 24 08:04:10 UTC 2025","passed","Fri Oct 24 08:04:11 UTC 2025","","","",""
"","3658","should create reports","RapidPro SMS Gateway","Fri Oct 24 08:18:08 UTC 2025","passed","Fri Oct 24 08:18:11 UTC 2025","","Webapp Terminating messages","",""
"","2468","should create a report using doc id","Reports Subject","Fri Oct 24 08:04:44 UTC 2025","passed","Fri Oct 24 08:04:47 UTC 2025","","","",""
"","3989","should edit district","Add new district tests : ","Fri Oct 24 07:55:44 UTC 2025","passed","Fri Oct 24 07:55:48 UTC 2025","","","",""
"","3249","should update SMS statuses","Africas Talking api","Fri Oct 24 08:16:46 UTC 2025","passed","Fri Oct 24 08:16:49 UTC 2025","","Webapp submits new GT sms messages","",""
"","7557","should save target doc once when getting many changes through replication","Target accuracy","Fri Oct 24 08:07:25 UTC 2025","passed","Fri Oct 24 08:07:32 UTC 2025","","","",""
"","2102","should create a report which has an unknown sender and a known subject","Reports Subject","Fri Oct 24 08:05:03 UTC 2025","passed","Fri Oct 24 08:05:05 UTC 2025","","","",""
"","2418","should shows content","Africas Talking api","Fri Oct 24 08:16:43 UTC 2025","passed","Fri Oct 24 08:16:46 UTC 2025","","Gateway submits WT sms status updates","",""
"","2179","should reply to an existing message and add a new recipient - contact with a phone number ","Send message","Fri Oct 24 08:19:24 UTC 2025","passed","Fri Oct 24 08:19:26 UTC 2025","","","",""
"","1112","should reply to an existing message - contact with a phone number","Send message","Fri Oct 24 08:19:20 UTC 2025","passed","Fri Oct 24 08:19:21 UTC 2025","","","",""
"","2747","should keep updating until record is in final state","RapidPro SMS Gateway","Fri Oct 24 08:18:24 UTC 2025","passed","Fri Oct 24 08:18:27 UTC 2025","","Webapp originating messages and state updates","",""
"","11663","should route to contact-detail on list item click and display contact summary target card","Target aggregates","Fri Oct 24 08:08:24 UTC 2025","passed","Fri Oct 24 08:08:36 UTC 2025","Online user with one place associated","User with one or more places assigned","",""
"","48371","Should show error message for bad config","Tasks","Fri Oct 24 08:15:18 UTC 2025","passed","Fri Oct 24 08:16:06 UTC 2025","","","",""
"","7080","should show the single add person button with the correct label","Creating custom places","Fri Oct 24 07:55:06 UTC 2025","passed","Fri Oct 24 07:55:13 UTC 2025","","","",""
"","2805","should display modal when clicking on a task from another group","Tasks group landing page","Fri Oct 24 08:11:08 UTC 2025","passed","Fri Oct 24 08:11:11 UTC 2025","","for chw","",""
"","5380","should not save target document when editing counted contact","Target accuracy","Fri Oct 24 08:07:04 UTC 2025","passed","Fri Oct 24 08:07:10 UTC 2025","","","",""
"","36036","should filter aggregates by place and period","Target aggregates","Fri Oct 24 08:08:56 UTC 2025","passed","Fri Oct 24 08:09:32 UTC 2025","Offline user with multiple places associated","User with one or more places assigned","",""
"","5190","should not show page when there are no more household tasks","Tasks group landing page","Fri Oct 24 08:11:14 UTC 2025","passed","Fri Oct 24 08:11:20 UTC 2025","","for chw","",""
"","2953","should create messages","RapidPro SMS Gateway","Fri Oct 24 08:18:04 UTC 2025","passed","Fri Oct 24 08:18:07 UTC 2025","","Webapp Terminating messages","",""
"","6128","changes to a loaded or list report should be reflected in the UI ","Reports Subject","Fri Oct 24 08:05:07 UTC 2025","passed","Fri Oct 24 08:05:14 UTC 2025","","","",""
"","2773","should send a message to a raw phone number","Send message","Fri Oct 24 08:19:14 UTC 2025","passed","Fri Oct 24 08:19:17 UTC 2025","","","",""
"","5816","should show error message for bad config","Targets","Fri Oct 24 07:54:09 UTC 2025","passed","Fri Oct 24 07:54:15 UTC 2025","","","",""
"","19669","should not show tasks when permission is disabled","Contact details page.","Fri Oct 24 07:56:43 UTC 2025","passed","Fri Oct 24 07:57:02 UTC 2025","","Permissions to show reports and tasks","",""
"","4169","should display correct message when targets are disabled","Targets","Fri Oct 24 07:54:05 UTC 2025","passed","Fri Oct 24 07:54:09 UTC 2025","","","",""
"","2307","should have unique results for when multiple fields match the same search text","Reports Search","Fri Oct 24 08:05:53 UTC 2025","passed","Fri Oct 24 08:05:56 UTC 2025","","Logged in as an offline user","",""
"","8337","the RHS button should show the action with custom label","Creating custom places","Fri Oct 24 07:54:45 UTC 2025","passed","Fri Oct 24 07:54:54 UTC 2025","","","",""
"","458","should fail with no incoming key configured","RapidPro SMS Gateway","Fri Oct 24 08:17:58 UTC 2025","passed","Fri Oct 24 08:17:59 UTC 2025","","Webapp Terminating messages","",""
"","3296","should create new health center","Create new lineage structure ","Fri Oct 24 08:01:33 UTC 2025","passed","Fri Oct 24 08:01:36 UTC 2025","","","",""
"","2643","should create a report using patient_id","Reports Subject","Fri Oct 24 08:04:41 UTC 2025","passed","Fri Oct 24 08:04:44 UTC 2025","","","",""
"","2337","should reply to an existing message and add a new recipient - raw phone number ","Send message","Fri Oct 24 08:19:21 UTC 2025","passed","Fri Oct 24 08:19:24 UTC 2025","","","",""
"","3630","should not display modal when clicking list task from same group","Tasks group landing page","Fri Oct 24 08:11:11 UTC 2025","passed","Fri Oct 24 08:11:14 UTC 2025","","for chw","",""
"","2756","should display conversation with link and navigate to contact","Message Tab - Sender Data","Fri Oct 24 08:17:48 UTC 2025","passed","Fri Oct 24 08:17:51 UTC 2025","","","",""
"","812","search should clear RHS selected contact","Contact Search","Fri Oct 24 08:02:52 UTC 2025","passed","Fri Oct 24 08:02:52 UTC 2025","","Logged in as an online user","",""
"","990","should have tasks","Tasks group landing page","Fri Oct 24 08:11:02 UTC 2025","passed","Fri Oct 24 08:11:03 UTC 2025","","for chw","",""
"","4158","should filter by user associated place when the permission to default filter is enabled","Reports Sidebar Filter","Fri Oct 24 08:06:26 UTC 2025","passed","Fri Oct 24 08:06:30 UTC 2025","","","",""
"","3516","should have tasks","Tasks group landing page","Fri Oct 24 08:11:25 UTC 2025","passed","Fri Oct 24 08:11:29 UTC 2025","","for supervisor","",""
"","9166","should display correct due dates with default settings","Task list due dates","Fri Oct 24 08:09:46 UTC 2025","passed","Fri Oct 24 08:09:55 UTC 2025","","","",""
"","9578","should mute a contact using the defined mute_forms (death_report).","Mute/Unmute contacts using a specific form - ","Fri Oct 24 08:01:00 UTC 2025","passed","Fri Oct 24 08:01:09 UTC 2025","","","",""
"","5223","should display messages with breadcrumbs for online user","Message Tab - Sender Data","Fri Oct 24 08:17:33 UTC 2025","passed","Fri Oct 24 08:17:38 UTC 2025","","","",""
"","4381","should edit district with contact_type","Add new district tests : ","Fri Oct 24 07:55:49 UTC 2025","passed","Fri Oct 24 07:55:53 UTC 2025","","","",""
"","4139","should not remove facility from breadcrumbs when offline user has many facilities associated","Tasks tab breadcrumbs","Fri Oct 24 08:10:28 UTC 2025","passed","Fri Oct 24 08:10:32 UTC 2025","","for chw","",""
"","3581","should display reports with breadcrumbs for online user","Reports tab breadcrumbs","Fri Oct 24 08:03:13 UTC 2025","passed","Fri Oct 24 08:03:16 UTC 2025","","","",""
"","7215","should show custom places in their own list","Creating custom places","Fri Oct 24 07:55:24 UTC 2025","passed","Fri Oct 24 07:55:31 UTC 2025","","","",""
"","11298","should add a task when CHW completes a task successfully, and that task creates another task","Tasks","Fri Oct 24 08:11:54 UTC 2025","passed","Fri Oct 24 08:12:05 UTC 2025","","","",""
"","13950","should sync and update the offline user's home place","Edit ","Fri Oct 24 07:59:40 UTC 2025","passed","Fri Oct 24 07:59:54 UTC 2025","","","",""
"","10206","should launch an edit contact form when edit_id is provided in content","Tasks","Fri Oct 24 08:16:21 UTC 2025","passed","Fri Oct 24 08:16:31 UTC 2025","","contact tasks","",""
"","19810","should display correct data","Target aggregates","Fri Oct 24 08:08:01 UTC 2025","passed","Fri Oct 24 08:08:21 UTC 2025","Online user with one place associated","User with one or more places assigned","",""
"","6271","should display correct message when no target found","Targets","Fri Oct 24 07:53:59 UTC 2025","passed","Fri Oct 24 07:54:05 UTC 2025","","","",""
"","7022","should show a popup when trying to submit a non-unmuting form against a muted contact","Mute/Unmute contacts using a specific form - ","Fri Oct 24 08:01:18 UTC 2025","passed","Fri Oct 24 08:01:25 UTC 2025","","","",""
"","691","search should clear RHS selected contact","Contact Search","Fri Oct 24 08:02:59 UTC 2025","passed","Fri Oct 24 08:03:00 UTC 2025","","Logged in as an offline user","",""
"","4932","should filter by date","Reports Sidebar Filter","Fri Oct 24 08:06:05 UTC 2025","passed","Fri Oct 24 08:06:10 UTC 2025","","","",""
"","1503","should set correct states from broadcast api","RapidPro SMS Gateway","Fri Oct 24 08:18:16 UTC 2025","passed","Fri Oct 24 08:18:17 UTC 2025","","Webapp originating messages and state updates","",""
"","5593","should load multiple pages of contacts","Infinite scrolling","Fri Oct 24 08:00:40 UTC 2025","passed","Fri Oct 24 08:00:46 UTC 2025","","","",""
"","12778","the LHS button should show the appropriate label when multiple places exist at the current level","Creating custom places","Fri Oct 24 07:54:30 UTC 2025","passed","Fri Oct 24 07:54:43 UTC 2025","","","",""
"","4513","does not detect duplicates when expression is disabled","Duplicate contact detection","Fri Oct 24 07:59:09 UTC 2025","passed","Fri Oct 24 07:59:14 UTC 2025","","","",""
"","906","should be able to do exact match searching by a field","Contact Search","Fri Oct 24 08:03:00 UTC 2025","passed","Fri Oct 24 08:03:01 UTC 2025","","Logged in as an offline user","",""
"","2748","should return results when searching by case_id","Reports Search","Fri Oct 24 08:05:30 UTC 2025","passed","Fri Oct 24 08:05:33 UTC 2025","","Logged in as an online user","",""
"","9527","should display no data when no targets are uploaded","Target aggregates","Fri Oct 24 08:07:50 UTC 2025","passed","Fri Oct 24 08:07:59 UTC 2025","Online user with one place associated","User with one or more places assigned","",""
"","3907","should filter by form","Reports Sidebar Filter","Fri Oct 24 08:06:12 UTC 2025","passed","Fri Oct 24 08:06:16 UTC 2025","","","",""
"","7091","should load multiple pages of reports","Infinite scrolling","Fri Oct 24 08:04:22 UTC 2025","passed","Fri Oct 24 08:04:29 UTC 2025","","","",""
"","3753","should add new district with a new person","Add new district tests : ","Fri Oct 24 07:55:40 UTC 2025","passed","Fri Oct 24 07:55:44 UTC 2025","","","",""
"","1913","should return results matching the search term and then return all data when clearing search","Reports Search","Fri Oct 24 08:05:45 UTC 2025","passed","Fri Oct 24 08:05:47 UTC 2025","","Logged in as an offline user","",""
"","1445","should show new household and new person create option","FAB actions","Fri Oct 24 08:00:16 UTC 2025","passed","Fri Oct 24 08:00:17 UTC 2025","","","",""
"","2049","should create a report which has an unknown sender with no phone number","Reports Subject","Fri Oct 24 08:05:05 UTC 2025","passed","Fri Oct 24 08:05:07 UTC 2025","","","",""
"","6905","should download export file","Export Reports","Fri Oct 24 08:03:55 UTC 2025","passed","Fri Oct 24 08:04:02 UTC 2025","","","",""
"","1514","should shows content","Africas Talking api","Fri Oct 24 08:16:42 UTC 2025","passed","Fri Oct 24 08:16:43 UTC 2025","","Gateway submits new WT sms messages","",""
"","3137","should have unique results for when multiple fields match the same search text","Reports Search","Fri Oct 24 08:05:39 UTC 2025","passed","Fri Oct 24 08:05:42 UTC 2025","","Logged in as an online user","",""
"","3279","should send a message using FAB at people's tab","Send message","Fri Oct 24 08:19:26 UTC 2025","passed","Fri Oct 24 08:19:29 UTC 2025","","","",""
"","9091","should display correct due dates with taskDaysOverdue setting and simple translation","Task list due dates","Fri Oct 24 08:10:04 UTC 2025","passed","Fri Oct 24 08:10:13 UTC 2025","","","",""
"","1517","should display targets from default config","Targets","Fri Oct 24 07:53:57 UTC 2025","passed","Fri Oct 24 07:53:59 UTC 2025","","","",""
"","5740","should edit the name of the Family","Create new lineage structure ","Fri Oct 24 08:02:15 UTC 2025","passed","Fri Oct 24 08:02:21 UTC 2025","","","",""
"","336","should fail when message was not created","RapidPro SMS Gateway","Fri Oct 24 08:18:03 UTC 2025","passed","Fri Oct 24 08:18:03 UTC 2025","","Webapp Terminating messages","",""
"","607","should display an empty list when there are no aggregates","Target aggregates","Fri Oct 24 08:07:43 UTC 2025","passed","Fri Oct 24 08:07:44 UTC 2025","","DB admin","",""
"","8224","should display correct due dates with taskDaysOverdue setting","Task list due dates","Fri Oct 24 08:09:55 UTC 2025","passed","Fri Oct 24 08:10:04 UTC 2025","","","",""
"","5052","detects duplicates from a custom duplicate expression","Duplicate contact detection","Fri Oct 24 07:59:03 UTC 2025","passed","Fri Oct 24 07:59:08 UTC 2025","","","",""
"","9875","should create person under area should only see children","Create Person Under Area, ","Fri Oct 24 08:02:30 UTC 2025","passed","Fri Oct 24 08:02:40 UTC 2025","","","",""
"","3274","should create new person","Create new lineage structure ","Fri Oct 24 08:01:47 UTC 2025","passed","Fri Oct 24 08:01:50 UTC 2025","","","",""
"","1603","should not poll messages for docs that are in pending or scheduled states or lack gateway ref ","RapidPro SMS Gateway","Fri Oct 24 08:18:22 UTC 2025","passed","Fri Oct 24 08:18:23 UTC 2025","","Webapp originating messages and state updates","",""
"","3138","should show error log for bad config","Contact details page.","Fri Oct 24 07:58:09 UTC 2025","passed","Fri Oct 24 07:58:12 UTC 2025","","Contact summary error","",""
"","912","should have no results when searching by non-existent field value","Contact Search","Fri Oct 24 08:02:53 UTC 2025","passed","Fri Oct 24 08:02:54 UTC 2025","","Logged in as an online user","",""
"","1654","should not display task landing page after task completion","Tasks group landing page","Fri Oct 24 08:11:29 UTC 2025","passed","Fri Oct 24 08:11:31 UTC 2025","","for supervisor","",""
"","8213","the LHS button should show the appropriate label when only one action","Creating custom places","Fri Oct 24 07:54:20 UTC 2025","passed","Fri Oct 24 07:54:28 UTC 2025","","","",""
"","3328","should filter by place","Reports Sidebar Filter","Fri Oct 24 08:06:17 UTC 2025","passed","Fri Oct 24 08:06:20 UTC 2025","","","",""
"","2498","should open task with expression","Tasks tab breadcrumbs","Fri Oct 24 08:10:37 UTC 2025","passed","Fri Oct 24 08:10:40 UTC 2025","","for chw","",""
