"DESCRIPTION","DURATION IN MS","NAME","PARENT SUITE","START TIME","STATUS","STOP TIME","SUB SUITE","SUITE","TEST CLASS","TEST METHOD"
"","7291","should display correct due dates with taskDaysOverdue setting","","Tue Aug 05 10:19:17 UTC 2025","passed","Tue Aug 05 10:19:24 UTC 2025","","Task list due dates","",""
"","5419","detects duplicates when creating person - clears dupes when form updated","","Tue Aug 05 10:09:25 UTC 2025","passed","Tue Aug 05 10:09:30 UTC 2025","","Duplicate contact detection","",""
"","13348","should sync and update the offline user's home place","","Tue Aug 05 10:10:15 UTC 2025","passed","Tue Aug 05 10:10:29 UTC 2025","","Edit ","",""
"","2992","should create messages","","Tue Aug 05 10:24:35 UTC 2025","passed","Tue Aug 05 10:24:38 UTC 2025","","RapidPro SMS Gateway: Webapp Terminating messages","",""
"","2694","should open task with expression","","Tue Aug 05 10:19:57 UTC 2025","passed","Tue Aug 05 10:19:59 UTC 2025","","Tasks tab breadcrumbs: for chw","",""
"","6915","should unmute a contact using the defined unmute_forms (undo_death_report).","","Tue Aug 05 10:11:37 UTC 2025","passed","Tue Aug 05 10:11:44 UTC 2025","","Mute/Unmute contacts using a specific form - ","",""
"","2254","should create a report using missing required patient name","","Tue Aug 05 10:15:00 UTC 2025","passed","Tue Aug 05 10:15:02 UTC 2025","","Reports Subject","",""
"","1666","should handle old format of the rules-state-store","","Tue Aug 05 10:17:06 UTC 2025","passed","Tue Aug 05 10:17:08 UTC 2025","","Target accuracy","",""
"","4243","should not remove facility from breadcrumbs when offline user has many facilities associated","","Tue Aug 05 10:24:13 UTC 2025","passed","Tue Aug 05 10:24:17 UTC 2025","","Message Tab - Sender Data","",""
