"Status","Start Time","Stop Time","Duration in ms","Parent Suite","Suite","Sub Suite","Test Class","Test Method","Name","Description"
"passed","Wed Aug 28 00:13:18 UTC 2024","Wed Aug 28 00:13:20 UTC 2024","2652","","Tasks tab breadcrumbs: for chw","","","","should not remove facility from breadcrumbs when offline user has many facilities associated",""
"passed","Wed Aug 28 00:13:49 UTC 2024","Wed Aug 28 00:13:54 UTC 2024","5182","","Tasks group landing page: for chw","","","","should display modal when clicking on a task from another group",""
"passed","Wed Aug 28 00:07:23 UTC 2024","Wed Aug 28 00:07:28 UTC 2024","4590","","Mute/Unmute contacts using a specific form - ","","","","should mute a contact using the defined mute_forms (death_report).",""
"passed","Wed Aug 28 00:14:55 UTC 2024","Wed Aug 28 00:14:56 UTC 2024","916","","sms-gateway api: - api returns list of pending WO messages","","","","- returns list and updates state",""
"passed","Wed Aug 28 00:15:02 UTC 2024","Wed Aug 28 00:15:05 UTC 2024","2259","","Link SMS to patient without passing id","","","","Send SMS without patient_id and report created under person",""
"passed","Wed Aug 28 00:11:31 UTC 2024","Wed Aug 28 00:11:32 UTC 2024","1169","","Target aggregates: DB admin","","","","should display an error when there are aggregates but no home place",""
"passed","Wed Aug 28 00:07:31 UTC 2024","Wed Aug 28 00:07:35 UTC 2024","3749","","Mute/Unmute contacts using a specific form - ","","","","should show a popup when trying to submit a non-unmuting form against a muted contact",""
"passed","Wed Aug 28 00:15:53 UTC 2024","Wed Aug 28 00:15:55 UTC 2024","2610","","RapidPro SMS Gateway: Webapp originating messages and state updates","","","","should keep updating until record is in final state",""
"passed","Wed Aug 28 00:16:05 UTC 2024","Wed Aug 28 00:16:14 UTC 2024","9142","","RapidPro SMS Gateway: Webapp originating messages and state updates","","","","should handle rate limiting when polling",""
"passed","Wed Aug 28 00:06:46 UTC 2024","Wed Aug 28 00:06:49 UTC 2024","3013","","FAB + Actionbar: Action bar","","","","should show new household and new person create option",""
"passed","Wed Aug 28 00:13:43 UTC 2024","Wed Aug 28 00:13:47 UTC 2024","4348","","Tasks group landing page: for chw","","","","should display tasks group landing page after task completion",""
"passed","Wed Aug 28 00:14:54 UTC 2024","Wed Aug 28 00:14:55 UTC 2024","1264","","sms-gateway api: - gateway submits WT sms status updates","","","","- shows content",""
"passed","Wed Aug 28 00:06:56 UTC 2024","Wed Aug 28 00:06:58 UTC 2024","2265","","FAB + Actionbar: Action bar","","","","should not show new place when missing permission",""
"passed","Wed Aug 28 00:13:58 UTC 2024","Wed Aug 28 00:14:02 UTC 2024","4404","","Tasks group landing page: for chw","","","","should not show page when there are no more household tasks",""
"passed","Wed Aug 28 00:16:33 UTC 2024","Wed Aug 28 00:16:34 UTC 2024","1933","","Send message","","","","should reply to an existing message and add a new recipient - contact with a phone number ",""
"passed","Wed Aug 28 00:05:16 UTC 2024","Wed Aug 28 00:05:19 UTC 2024","2663","","Contact details page.: Permissions to show reports and tasks","","","","should show reports and tasks when permissions are enabled",""
"passed","Wed Aug 28 00:15:21 UTC 2024","Wed Aug 28 00:15:23 UTC 2024","1476","","Message Tab - Sender Data","","","","should display messages with updated breadcrumbs for offline user",""
"passed","Wed Aug 28 00:04:57 UTC 2024","Wed Aug 28 00:05:00 UTC 2024","2714","","Add new district tests : ","","","","should edit district",""
"passed","Wed Aug 28 00:10:57 UTC 2024","Wed Aug 28 00:11:00 UTC 2024","2883","","Reports Search","","","","should return results matching the search term and then return all data when clearing search",""
"passed","Wed Aug 28 00:11:35 UTC 2024","Wed Aug 28 00:11:42 UTC 2024","6930","","Target aggregates: User with one or more places assigned: Online user with one place associated","","","","should display no data when no targets are uploaded",""
"passed","Wed Aug 28 00:07:28 UTC 2024","Wed Aug 28 00:07:31 UTC 2024","3568","","Mute/Unmute contacts using a specific form - ","","","","should unmute a contact using the defined unmute_forms (undo_death_report).",""
"passed","Wed Aug 28 00:10:27 UTC 2024","Wed Aug 28 00:10:29 UTC 2024","1760","","Reports Subject","","","","should create a report using missing required patient name",""
"passed","Wed Aug 28 00:04:54 UTC 2024","Wed Aug 28 00:04:57 UTC 2024","3204","","Add new district tests : ","","","","should add new district with a new person",""
"passed","Wed Aug 28 00:09:50 UTC 2024","Wed Aug 28 00:09:51 UTC 2024","1502","","generating short codes","","","","create case ID",""
"passed","Wed Aug 28 00:15:56 UTC 2024","Wed Aug 28 00:16:03 UTC 2024","6770","","RapidPro SMS Gateway: Webapp originating messages and state updates","","","","should poll for state updates and consume queue",""
"passed","Wed Aug 28 00:12:08 UTC 2024","Wed Aug 28 00:12:10 UTC 2024","1106","","Target aggregates: User with one or more places assigned: Offline user with multiple places associated","","","","should display only the targets sections and show the correct message when target aggregates are disabled",""
"passed","Wed Aug 28 00:07:45 UTC 2024","Wed Aug 28 00:07:48 UTC 2024","3685","","Create new lineage structure ","","","","should create new area",""
"passed","Wed Aug 28 00:15:23 UTC 2024","Wed Aug 28 00:15:25 UTC 2024","1731","","Message Tab - Sender Data","","","","should display conversation with link and navigate to contact",""
"passed","Wed Aug 28 00:08:07 UTC 2024","Wed Aug 28 00:08:11 UTC 2024","3505","","Create new lineage structure ","","","","should delete the primary contact of health facility",""
"passed","Wed Aug 28 00:16:30 UTC 2024","Wed Aug 28 00:16:33 UTC 2024","2026","","Send message","","","","should reply to an existing message and add a new recipient - raw phone number ",""
"passed","Wed Aug 28 00:12:06 UTC 2024","Wed Aug 28 00:12:08 UTC 2024","1646","","Target aggregates: User with one or more places assigned: Offline user with multiple places associated","","","","should disable content",""
"passed","Wed Aug 28 00:07:08 UTC 2024","Wed Aug 28 00:07:13 UTC 2024","4512","","Infinite scrolling","","","","should load multiple pages of contacts",""
"passed","Wed Aug 28 00:03:25 UTC 2024","Wed Aug 28 00:03:31 UTC 2024","6074","","Targets","","","","should display correct message when no target found",""
"passed","Wed Aug 28 00:09:01 UTC 2024","Wed Aug 28 00:09:03 UTC 2024","2148","","Reports tab breadcrumbs","","","","should display reports with updated breadcrumbs for offline user",""
"passed","Wed Aug 28 00:05:47 UTC 2024","Wed Aug 28 00:05:57 UTC 2024","9125","","User Test Cases -> Creating Users ->","","","","should add user with multiple places with permission",""
"passed","Wed Aug 28 00:11:13 UTC 2024","Wed Aug 28 00:11:16 UTC 2024","2911","","Reports Sidebar Filter","","","","should filter by user associated place when the permission to default filter is enabled",""
"passed","Wed Aug 28 00:08:01 UTC 2024","Wed Aug 28 00:08:07 UTC 2024","6351","","Create new lineage structure ","","","","should edit a name of the health facility",""
"passed","Wed Aug 28 00:15:47 UTC 2024","Wed Aug 28 00:15:49 UTC 2024","2457","","RapidPro SMS Gateway: Webapp originating messages and state updates","","","","should update the states correctly from messages api",""
"passed","Wed Aug 28 00:15:30 UTC 2024","Wed Aug 28 00:15:31 UTC 2024","269","","RapidPro SMS Gateway: Webapp Terminating messages","","","","should fail with no incoming key configured",""
"passed","Wed Aug 28 00:05:19 UTC 2024","Wed Aug 28 00:05:24 UTC 2024","4955","","Contact details page.: Permissions to show reports and tasks","","","","should not show reports when permission is disabled",""
"passed","Wed Aug 28 00:16:29 UTC 2024","Wed Aug 28 00:16:30 UTC 2024","726","","Send message","","","","should reply to an existing message - raw phone number",""
"passed","Wed Aug 28 00:10:41 UTC 2024","Wed Aug 28 00:10:47 UTC 2024","5409","","Reports Subject","","","","changes to a loaded or list report should be reflected in the UI ",""
"passed","Wed Aug 28 00:14:20 UTC 2024","Wed Aug 28 00:14:26 UTC 2024","5500","","Tasks","","","","Should show error message for bad config",""
"passed","Wed Aug 28 00:08:58 UTC 2024","Wed Aug 28 00:09:01 UTC 2024","2186","","Reports tab breadcrumbs","","","","should not remove facility from breadcrumbs when offline user has many facilities associated",""
"passed","Wed Aug 28 00:15:33 UTC 2024","Wed Aug 28 00:15:33 UTC 2024","269","","RapidPro SMS Gateway: Webapp Terminating messages","","","","should fail with malformed authentication",""
"passed","Wed Aug 28 00:06:43 UTC 2024","Wed Aug 28 00:06:45 UTC 2024","1899","","FAB + Actionbar: FAB","","","","should show fab when user only has can_create_people permission",""
"passed","Wed Aug 28 00:16:23 UTC 2024","Wed Aug 28 00:16:26 UTC 2024","2856","","Send message","","","","should send messages to all the contacts, under a place, that have a primary phone number assigned",""
"passed","Wed Aug 28 00:16:27 UTC 2024","Wed Aug 28 00:16:29 UTC 2024","1749","","Send message","","","","should send a message to a contact with a phone number",""
"passed","Wed Aug 28 00:07:53 UTC 2024","Wed Aug 28 00:07:55 UTC 2024","2260","","Create new lineage structure ","","","","should create new person",""
"passed","Wed Aug 28 00:11:30 UTC 2024","Wed Aug 28 00:11:30 UTC 2024","385","","Target aggregates: DB admin","","","","should display an empty list when there are no aggregates",""
"passed","Wed Aug 28 00:06:12 UTC 2024","Wed Aug 28 00:06:20 UTC 2024","8679","","Edit ","","","","should sync and update the offline user's home place",""
"passed","Wed Aug 28 00:08:17 UTC 2024","Wed Aug 28 00:08:23 UTC 2024","6142","","Create new lineage structure ","","","","should edit the name of the Family",""
"passed","Wed Aug 28 00:11:43 UTC 2024","Wed Aug 28 00:11:56 UTC 2024","12744","","Target aggregates: User with one or more places assigned: Online user with one place associated","","","","should display correct data",""
"passed","Wed Aug 28 00:11:57 UTC 2024","Wed Aug 28 00:12:05 UTC 2024","7309","","Target aggregates: User with one or more places assigned: Online user with one place associated","","","","should route to contact-detail on list item click and display contact summary target card",""
"passed","Wed Aug 28 00:16:30 UTC 2024","Wed Aug 28 00:16:30 UTC 2024","539","","Send message","","","","should reply to an existing message - contact with a phone number",""
"passed","Wed Aug 28 00:15:12 UTC 2024","Wed Aug 28 00:15:16 UTC 2024","4456","","Message Tab - Sender Data","","","","should display messages with breadcrumbs for online user",""
"passed","Wed Aug 28 00:12:44 UTC 2024","Wed Aug 28 00:12:51 UTC 2024","6578","","Task list due dates","","","","should display correct due dates with default settings",""
"passed","Wed Aug 28 00:08:48 UTC 2024","Wed Aug 28 00:08:49 UTC 2024","531","","Contact Search","","","","search should clear RHS selected contact",""
"passed","Wed Aug 28 00:09:38 UTC 2024","Wed Aug 28 00:09:43 UTC 2024","5109","","Export Reports","","","","Should download export file",""
"passed","Wed Aug 28 00:15:43 UTC 2024","Wed Aug 28 00:15:44 UTC 2024","891","","RapidPro SMS Gateway: Webapp originating messages and state updates","","","","should call endpoint with set credentials",""
"passed","Wed Aug 28 00:08:48 UTC 2024","Wed Aug 28 00:08:48 UTC 2024","488","","Contact Search","","","","search by NON empty string should display results with contains match and clears search",""
"passed","Wed Aug 28 00:15:44 UTC 2024","Wed Aug 28 00:15:46 UTC 2024","1432","","RapidPro SMS Gateway: Webapp originating messages and state updates","","","","should set correct states from broadcast api",""
"passed","Wed Aug 28 00:10:00 UTC 2024","Wed Aug 28 00:10:07 UTC 2024","6502","","Infinite scrolling","","","","should load multiple pages of reports",""
"passed","Wed Aug 28 00:11:00 UTC 2024","Wed Aug 28 00:11:02 UTC 2024","2530","","Reports Search","","","","should return results when searching by case_id",""
"passed","Wed Aug 28 00:13:42 UTC 2024","Wed Aug 28 00:13:43 UTC 2024","687","","Tasks group landing page: for chw","","","","should have tasks",""
"passed","Wed Aug 28 00:10:32 UTC 2024","Wed Aug 28 00:10:34 UTC 2024","2521","","Reports Subject","","","","should create a report using place_id with a shortcode",""
"passed","Wed Aug 28 00:15:32 UTC 2024","Wed Aug 28 00:15:32 UTC 2024","258","","RapidPro SMS Gateway: Webapp Terminating messages","","","","should fail with incorrect authentication",""
"passed","Wed Aug 28 00:13:21 UTC 2024","Wed Aug 28 00:13:23 UTC 2024","2454","","Tasks tab breadcrumbs: for chw","","","","should display correct tasks with breadcrumbs for chw",""
"passed","Wed Aug 28 00:16:26 UTC 2024","Wed Aug 28 00:16:27 UTC 2024","1750","","Send message","","","","should send a message to a raw phone number",""
"passed","Wed Aug 28 00:12:51 UTC 2024","Wed Aug 28 00:12:57 UTC 2024","6195","","Task list due dates","","","","should display correct due dates with taskDaysOverdue setting",""
"passed","Wed Aug 28 00:14:08 UTC 2024","Wed Aug 28 00:14:11 UTC 2024","2772","","Tasks group landing page: for supervisor","","","","should not display task landing page after task completion",""
"passed","Wed Aug 28 00:05:24 UTC 2024","Wed Aug 28 00:05:29 UTC 2024","5027","","Contact details page.: Permissions to show reports and tasks","","","","should not show tasks when permission is disabled",""
"passed","Wed Aug 28 00:05:01 UTC 2024","Wed Aug 28 00:05:04 UTC 2024","3295","","Add new district tests : ","","","","should edit district with contact_type",""
"passed","Wed Aug 28 00:15:34 UTC 2024","Wed Aug 28 00:15:37 UTC 2024","2705","","RapidPro SMS Gateway: Webapp Terminating messages","","","","should create messages",""
"passed","Wed Aug 28 00:06:04 UTC 2024","Wed Aug 28 00:06:12 UTC 2024","7925","","Edit ","","","","should update a contact, delete the same contact then unassign primary contact from facility",""
"passed","Wed Aug 28 00:10:25 UTC 2024","Wed Aug 28 00:10:27 UTC 2024","1718","","Reports Subject","","","","should create a report using patient name",""
"passed","Wed Aug 28 00:10:37 UTC 2024","Wed Aug 28 00:10:39 UTC 2024","1977","","Reports Subject","","","","should create a report which has an unknown sender and a known subject",""
"passed","Wed Aug 28 00:11:23 UTC 2024","Wed Aug 28 00:11:25 UTC 2024","1449","","Reports tab messages","","","","should generate SMS report correctly when lacking patient_id",""
"passed","Wed Aug 28 00:07:41 UTC 2024","Wed Aug 28 00:07:45 UTC 2024","3278","","Create new lineage structure ","","","","should create new health center",""
"passed","Wed Aug 28 00:13:54 UTC 2024","Wed Aug 28 00:13:58 UTC 2024","3483","","Tasks group landing page: for chw","","","","should not display modal when clicking list task from same group",""
"passed","Wed Aug 28 00:10:23 UTC 2024","Wed Aug 28 00:10:25 UTC 2024","2594","","Reports Subject","","","","should create a report using unknown patient_id ",""
"passed","Wed Aug 28 00:03:31 UTC 2024","Wed Aug 28 00:03:34 UTC 2024","3017","","Targets","","","","should display correct message when targets are disabled",""
"passed","Wed Aug 28 00:15:41 UTC 2024","Wed Aug 28 00:15:42 UTC 2024","1513","","RapidPro SMS Gateway: Webapp originating messages and state updates","","","","should not call RapidPro endpoint when credentials are not set",""
"passed","Wed Aug 28 00:04:13 UTC 2024","Wed Aug 28 00:04:20 UTC 2024","7130","","Creating custom places","","","","the RHS button show the appropriate label when multiple places exist at the current level",""
"passed","Wed Aug 28 00:08:30 UTC 2024","Wed Aug 28 00:08:40 UTC 2024","9458","","Create Person Under Area, ","","","","should create person under area should only see children",""
"passed","Wed Aug 28 00:10:20 UTC 2024","Wed Aug 28 00:10:22 UTC 2024","2562","","Reports Subject","","","","should create a report using doc id",""
"passed","Wed Aug 28 00:03:23 UTC 2024","Wed Aug 28 00:03:25 UTC 2024","1777","","Targets","","","","should display targets from default config",""
"passed","Wed Aug 28 00:04:40 UTC 2024","Wed Aug 28 00:04:46 UTC 2024","6763","","Creating custom places","","","","should show custom places in their own list",""
"passed","Wed Aug 28 00:15:50 UTC 2024","Wed Aug 28 00:15:52 UTC 2024","1609","","RapidPro SMS Gateway: Webapp originating messages and state updates","","","","should not poll messages for docs that are in pending or scheduled states or lack gateway ref ",""
"passed","Wed Aug 28 00:10:34 UTC 2024","Wed Aug 28 00:10:37 UTC 2024","2710","","Reports Subject","","","","should create a report using unknown place_id",""
"passed","Wed Aug 28 00:05:37 UTC 2024","Wed Aug 28 00:05:39 UTC 2024","2304","","Contact details page.: Contact summary error","","","","should show error log for bad config",""
"passed","Wed Aug 28 00:14:31 UTC 2024","Wed Aug 28 00:14:34 UTC 2024","2931","","africas talking api: - gateway submits new WT sms messages","","","","- shows content",""
"passed","Wed Aug 28 00:04:21 UTC 2024","Wed Aug 28 00:04:29 UTC 2024","7115","","Creating custom places","","","","should show the single add person button with the correct label",""
"passed","Wed Aug 28 00:06:25 UTC 2024","Wed Aug 28 00:06:29 UTC 2024","4456","","Export Contacts ","","","","should download export file",""
"passed","Wed Aug 28 00:06:38 UTC 2024","Wed Aug 28 00:06:41 UTC 2024","2724","","FAB + Actionbar: FAB","","","","should show fab when user only has can_create_places permission",""
"passed","Wed Aug 28 00:15:34 UTC 2024","Wed Aug 28 00:15:34 UTC 2024","256","","RapidPro SMS Gateway: Webapp Terminating messages","","","","should fail when message was not created",""
"passed","Wed Aug 28 00:03:44 UTC 2024","Wed Aug 28 00:03:51 UTC 2024","6948","","Creating custom places","","","","the LHS button should show the appropriate label when only one action",""
"passed","Wed Aug 28 00:04:30 UTC 2024","Wed Aug 28 00:04:38 UTC 2024","7693","","Creating custom places","","","","should show the multi person actions with the correct label",""
"passed","Wed Aug 28 00:14:43 UTC 2024","Wed Aug 28 00:14:47 UTC 2024","3233","","Export Messages","","","","Should download export file",""
"passed","Wed Aug 28 00:09:18 UTC 2024","Wed Aug 28 00:09:24 UTC 2024","5096","","Report Filter","","","","should filter by date",""
"passed","Wed Aug 28 00:07:55 UTC 2024","Wed Aug 28 00:08:01 UTC 2024","5488","","Create new lineage structure ","","","","should edit a person with a phone number",""
"passed","Wed Aug 28 00:16:34 UTC 2024","Wed Aug 28 00:16:37 UTC 2024","2825","","Send message","","","","should send a message using FAB at people's tab",""
"passed","Wed Aug 28 00:13:27 UTC 2024","Wed Aug 28 00:13:28 UTC 2024","1042","","Tasks tab breadcrumbs: for supervisor","","","","should display correct tasks with breadcrumbs for supervisor",""
"passed","Wed Aug 28 00:12:10 UTC 2024","Wed Aug 28 00:12:34 UTC 2024","23499","","Target aggregates: User with one or more places assigned: Offline user with multiple places associated","","","","should filter aggregates by place and period",""
"passed","Wed Aug 28 00:03:53 UTC 2024","Wed Aug 28 00:04:01 UTC 2024","8109","","Creating custom places","","","","the LHS button should show the appropriate label when multiple places exist at the current level",""
"passed","Wed Aug 28 00:06:52 UTC 2024","Wed Aug 28 00:06:54 UTC 2024","2420","","FAB + Actionbar: Action bar","","","","should not show new person when missing permission",""
"passed","Wed Aug 28 00:14:02 UTC 2024","Wed Aug 28 00:14:05 UTC 2024","2547","","Tasks group landing page: for chw","","","","should not show page when submitting task for contact with no leaf type place in lineage",""
"passed","Wed Aug 28 00:10:29 UTC 2024","Wed Aug 28 00:10:31 UTC 2024","2286","","Reports Subject","","","","should create a report using place_id with a place_uuid",""
"passed","Wed Aug 28 00:15:31 UTC 2024","Wed Aug 28 00:15:32 UTC 2024","379","","RapidPro SMS Gateway: Webapp Terminating messages","","","","should fail with no authentication provided",""
"passed","Wed Aug 28 00:14:34 UTC 2024","Wed Aug 28 00:14:36 UTC 2024","2086","","africas talking api: - gateway submits WT sms status updates","","","","- shows content",""
"passed","Wed Aug 28 00:04:02 UTC 2024","Wed Aug 28 00:04:11 UTC 2024","8186","","Creating custom places","","","","the RHS button should show the action with custom label",""
"passed","Wed Aug 28 00:15:17 UTC 2024","Wed Aug 28 00:15:20 UTC 2024","3605","","Message Tab - Sender Data","","","","should not remove facility from breadcrumbs when offline user has many facilities associated",""
"passed","Wed Aug 28 00:03:34 UTC 2024","Wed Aug 28 00:03:40 UTC 2024","5414","","Targets","","","","should show error message for bad config",""
"passed","Wed Aug 28 00:07:48 UTC 2024","Wed Aug 28 00:07:53 UTC 2024","4290","","Create new lineage structure ","","","","should create new household",""
"passed","Wed Aug 28 00:10:47 UTC 2024","Wed Aug 28 00:10:48 UTC 2024","1274","","Reports Subject","","","","should create a report which does not have a subject",""
"passed","Wed Aug 28 00:09:28 UTC 2024","Wed Aug 28 00:09:33 UTC 2024","5310","","Delete Reports","","","","Should delete report",""
"passed","Wed Aug 28 00:12:57 UTC 2024","Wed Aug 28 00:13:05 UTC 2024","7078","","Task list due dates","","","","should display correct due dates with taskDaysOverdue setting and simple translation",""
"passed","Wed Aug 28 00:14:06 UTC 2024","Wed Aug 28 00:14:08 UTC 2024","1825","","Tasks group landing page: for supervisor","","","","should have tasks",""
"passed","Wed Aug 28 00:09:10 UTC 2024","Wed Aug 28 00:09:14 UTC 2024","4211","","Bulk delete reports","","","","should select, deselect and delete only selected reports",""
"passed","Wed Aug 28 00:13:47 UTC 2024","Wed Aug 28 00:13:49 UTC 2024","1677","","Tasks group landing page: for chw","","","","should open task from the same group",""
"passed","Wed Aug 28 00:08:11 UTC 2024","Wed Aug 28 00:08:17 UTC 2024","6403","","Create new lineage structure ","","","","should edit the name of the CHW area",""
"passed","Wed Aug 28 00:08:56 UTC 2024","Wed Aug 28 00:08:58 UTC 2024","1947","","Reports tab breadcrumbs","","","","should display reports with breadcrumbs for online user",""
"passed","Wed Aug 28 00:13:24 UTC 2024","Wed Aug 28 00:13:25 UTC 2024","1374","","Tasks tab breadcrumbs: for chw","","","","should open task with expression",""
"passed","Wed Aug 28 00:10:39 UTC 2024","Wed Aug 28 00:10:41 UTC 2024","1949","","Reports Subject","","","","should create a report which has an unknown sender with no phone number",""
"passed","Wed Aug 28 00:05:19 UTC 2024","Wed Aug 28 00:05:19 UTC 2024","169","","Contact details page.: Permissions to show reports and tasks","","","","should show contact summary that has the full context for reports > 50 validate that the pregnancy card is always displayed",""
"passed","Wed Aug 28 00:14:53 UTC 2024","Wed Aug 28 00:14:54 UTC 2024","1321","","sms-gateway api: - gateway submits new WT sms messages","","","","shows content",""
"passed","Wed Aug 28 00:06:36 UTC 2024","Wed Aug 28 00:06:38 UTC 2024","1178","","FAB + Actionbar: FAB","","","","should show new household and new person create option",""
"passed","Wed Aug 28 00:10:17 UTC 2024","Wed Aug 28 00:10:20 UTC 2024","2772","","Reports Subject","","","","should create a report using patient_id",""
"passed","Wed Aug 28 00:15:37 UTC 2024","Wed Aug 28 00:15:40 UTC 2024","2683","","RapidPro SMS Gateway: Webapp Terminating messages","","","","should create reports",""
"passed","Wed Aug 28 00:11:09 UTC 2024","Wed Aug 28 00:11:12 UTC 2024","2855","","Reports Sidebar Filter","","","","should filter by date",""
