"Status","Start Time","Stop Time","Duration in ms","Parent Suite","Suite","Sub Suite","Test Class","Test Method","Name","Description"
"passed","Mon Dec 02 20:21:00 UTC 2024","Mon Dec 02 20:21:01 UTC 2024","975","","Contact Search","","","","search should clear RHS selected contact",""
"passed","Mon Dec 02 20:23:22 UTC 2024","Mon Dec 02 20:23:25 UTC 2024","3029","","Reports Search","","","","should return results when searching by case_id",""
"passed","Mon Dec 02 20:18:43 UTC 2024","Mon Dec 02 20:18:46 UTC 2024","2748","","FAB actions","","","","should show fab when user only has can_create_people permission",""
"passed","Mon Dec 02 20:25:05 UTC 2024","Mon Dec 02 20:25:05 UTC 2024","64","","Target accuracy","","","","should only create one target doc",""
"passed","Mon Dec 02 20:33:17 UTC 2024","Mon Dec 02 20:33:18 UTC 2024","629","","Send message","","","","should reply to an existing message - contact with a phone number",""
"passed","Mon Dec 02 20:32:13 UTC 2024","Mon Dec 02 20:32:13 UTC 2024","267","","RapidPro SMS Gateway: Webapp Terminating messages","","","","should fail with incorrect authentication",""
"passed","Mon Dec 02 20:14:50 UTC 2024","Mon Dec 02 20:14:54 UTC 2024","3584","","Add new district tests : ","","","","should edit district",""
"passed","Mon Dec 02 20:18:38 UTC 2024","Mon Dec 02 20:18:41 UTC 2024","3050","","FAB actions","","","","should show fab when user only has can_create_places permission",""
"passed","Mon Dec 02 20:32:18 UTC 2024","Mon Dec 02 20:32:21 UTC 2024","3164","","RapidPro SMS Gateway: Webapp Terminating messages","","","","should create reports",""
"passed","Mon Dec 02 20:22:07 UTC 2024","Mon Dec 02 20:22:08 UTC 2024","1130","","Generating short codes","","","","should create case ID",""
"passed","Mon Dec 02 20:33:11 UTC 2024","Mon Dec 02 20:33:14 UTC 2024","2393","","Send message","","","","should send a message to a raw phone number",""
"passed","Mon Dec 02 20:16:06 UTC 2024","Mon Dec 02 20:16:30 UTC 2024","23883","","Contact details page.: Permissions to show reports and tasks","","","","should not show tasks when permission is disabled",""
"passed","Mon Dec 02 20:23:19 UTC 2024","Mon Dec 02 20:23:22 UTC 2024","3673","","Reports Search","","","","should return results matching the search term and then return all data when clearing search",""
"passed","Mon Dec 02 20:27:45 UTC 2024","Mon Dec 02 20:27:48 UTC 2024","3064","","Tasks tab breadcrumbs: for chw","","","","should display correct tasks with breadcrumbs for chw",""
"passed","Mon Dec 02 20:32:38 UTC 2024","Mon Dec 02 20:32:45 UTC 2024","7580","","RapidPro SMS Gateway: Webapp originating messages and state updates","","","","should poll for state updates and consume queue",""
"passed","Mon Dec 02 20:28:18 UTC 2024","Mon Dec 02 20:28:21 UTC 2024","2563","","Tasks group landing page: for chw","","","","should open task from the same group",""
"passed","Mon Dec 02 20:15:17 UTC 2024","Mon Dec 02 20:15:18 UTC 2024","115","","Contact details page.: Permissions to show reports and tasks","","","","should show contact summary that has the full context for reports > 50 validate that the pregnancy card is always displayed",""
"passed","Mon Dec 02 20:23:55 UTC 2024","Mon Dec 02 20:23:59 UTC 2024","3491","","Reports Sidebar Filter","","","","should filter by status",""
"passed","Mon Dec 02 20:26:17 UTC 2024","Mon Dec 02 20:26:41 UTC 2024","24361","","Target aggregates: User with one or more places assigned: Offline user with multiple places associated","","","","should filter aggregates by place and period",""
"passed","Mon Dec 02 20:29:16 UTC 2024","Mon Dec 02 20:29:51 UTC 2024","34518","","Tasks","","","","should load multiple pages of tasks on infinite scrolling",""
"passed","Mon Dec 02 20:25:14 UTC 2024","Mon Dec 02 20:25:15 UTC 2024","639","","Target aggregates: DB admin","","","","should display an empty list when there are no aggregates",""
"passed","Mon Dec 02 20:22:35 UTC 2024","Mon Dec 02 20:22:38 UTC 2024","2681","","Reports Subject","","","","should create a report using patient_id",""
"passed","Mon Dec 02 20:33:22 UTC 2024","Mon Dec 02 20:33:26 UTC 2024","3238","","Send message","","","","should send a message using FAB at people's tab",""
"passed","Mon Dec 02 20:31:12 UTC 2024","Mon Dec 02 20:31:16 UTC 2024","3539","","Export Messages","","","","should download export file",""
"passed","Mon Dec 02 20:22:53 UTC 2024","Mon Dec 02 20:22:56 UTC 2024","2933","","Reports Subject","","","","should create a report using unknown place_id",""
"passed","Mon Dec 02 20:17:47 UTC 2024","Mon Dec 02 20:17:58 UTC 2024","10651","","Edit ","","","","should update a contact, delete the same contact then unassign primary contact from facility",""
"passed","Mon Dec 02 20:24:32 UTC 2024","Mon Dec 02 20:24:38 UTC 2024","6400","","Target accuracy","","","","should save target document when targets change",""
"passed","Mon Dec 02 20:17:58 UTC 2024","Mon Dec 02 20:18:15 UTC 2024","17583","","Edit ","","","","should sync and update the offline user's home place",""
"passed","Mon Dec 02 20:17:28 UTC 2024","Mon Dec 02 20:17:39 UTC 2024","10731","","User Test Cases -> Creating Users ->","","","","should add user with multiple places with permission",""
"passed","Mon Dec 02 20:09:15 UTC 2024","Mon Dec 02 20:09:25 UTC 2024","9841","","Creating custom places","","","","the LHS button should show the appropriate label when multiple places exist at the current level",""
"passed","Mon Dec 02 20:33:16 UTC 2024","Mon Dec 02 20:33:17 UTC 2024","981","","Send message","","","","should reply to an existing message - raw phone number",""
"passed","Mon Dec 02 20:30:56 UTC 2024","Mon Dec 02 20:31:00 UTC 2024","3356","","Africas Talking api: Gateway submits new WT sms messages","","","","should shows content",""
"passed","Mon Dec 02 20:22:18 UTC 2024","Mon Dec 02 20:22:24 UTC 2024","6323","","Infinite scrolling","","","","should load multiple pages of reports",""
"passed","Mon Dec 02 20:22:56 UTC 2024","Mon Dec 02 20:22:59 UTC 2024","2357","","Reports Subject","","","","should create a report which has an unknown sender and a known subject",""
"passed","Mon Dec 02 20:32:22 UTC 2024","Mon Dec 02 20:32:24 UTC 2024","1655","","RapidPro SMS Gateway: Webapp originating messages and state updates","","","","should not call RapidPro endpoint when credentials are not set",""
"passed","Mon Dec 02 20:32:15 UTC 2024","Mon Dec 02 20:32:18 UTC 2024","2716","","RapidPro SMS Gateway: Webapp Terminating messages","","","","should create messages",""
"passed","Mon Dec 02 20:33:18 UTC 2024","Mon Dec 02 20:33:20 UTC 2024","2495","","Send message","","","","should reply to an existing message and add a new recipient - raw phone number ",""
"passed","Mon Dec 02 20:24:52 UTC 2024","Mon Dec 02 20:24:59 UTC 2024","7336","","Target accuracy","","","","should save target document when deleting counted contact",""
"passed","Mon Dec 02 20:28:36 UTC 2024","Mon Dec 02 20:28:38 UTC 2024","2027","","Tasks group landing page: for supervisor","","","","should have tasks",""
"passed","Mon Dec 02 20:19:29 UTC 2024","Mon Dec 02 20:19:36 UTC 2024","7198","","Mute/Unmute contacts using a specific form - ","","","","should show a popup when trying to submit a non-unmuting form against a muted contact",""
"passed","Mon Dec 02 20:22:41 UTC 2024","Mon Dec 02 20:22:43 UTC 2024","2572","","Reports Subject","","","","should create a report using unknown patient_id ",""
"passed","Mon Dec 02 20:20:14 UTC 2024","Mon Dec 02 20:20:18 UTC 2024","4060","","Create new lineage structure ","","","","should delete the primary contact of health facility",""
"passed","Mon Dec 02 20:32:24 UTC 2024","Mon Dec 02 20:32:26 UTC 2024","1413","","RapidPro SMS Gateway: Webapp originating messages and state updates","","","","should call endpoint with set credentials",""
"passed","Mon Dec 02 20:25:20 UTC 2024","Mon Dec 02 20:25:27 UTC 2024","7295","","Target aggregates: User with one or more places assigned: Online user with one place associated","","","","should display no data when no targets are uploaded",""
"passed","Mon Dec 02 20:08:53 UTC 2024","Mon Dec 02 20:09:00 UTC 2024","7038","","Targets","","","","should show error message for bad config",""
"passed","Mon Dec 02 20:21:09 UTC 2024","Mon Dec 02 20:21:12 UTC 2024","2835","","Reports tab breadcrumbs","","","","should display reports with breadcrumbs for online user",""
"passed","Mon Dec 02 20:26:55 UTC 2024","Mon Dec 02 20:27:05 UTC 2024","10298","","Task list due dates","","","","should display correct due dates with default settings",""
"passed","Mon Dec 02 20:32:47 UTC 2024","Mon Dec 02 20:32:57 UTC 2024","9980","","RapidPro SMS Gateway: Webapp originating messages and state updates","","","","should handle rate limiting when polling",""
"passed","Mon Dec 02 20:32:13 UTC 2024","Mon Dec 02 20:32:14 UTC 2024","320","","RapidPro SMS Gateway: Webapp Terminating messages","","","","should fail with malformed authentication",""
"broken","Mon Dec 02 20:11:35 UTC 2024","Mon Dec 02 20:11:35 UTC 2024","1","","Creating custom places","","","","the RHS button show the appropriate label when multiple places exist at the current level",""
"passed","Mon Dec 02 20:21:14 UTC 2024","Mon Dec 02 20:21:17 UTC 2024","3143","","Reports tab breadcrumbs","","","","should not remove facility from breadcrumbs when offline user has many facilities associated",""
"passed","Mon Dec 02 20:21:53 UTC 2024","Mon Dec 02 20:21:59 UTC 2024","6517","","Export Reports","","","","should download export file",""
"passed","Mon Dec 02 20:22:43 UTC 2024","Mon Dec 02 20:22:45 UTC 2024","2003","","Reports Subject","","","","should create a report using patient name",""
"passed","Mon Dec 02 20:31:33 UTC 2024","Mon Dec 02 20:31:36 UTC 2024","2523","","Link SMS to patient without passing id","","","","Send SMS without patient_id and report created under person",""
"passed","Mon Dec 02 20:15:18 UTC 2024","Mon Dec 02 20:16:06 UTC 2024","48904","","Contact details page.: Permissions to show reports and tasks","","","","should not show reports when permission is disabled",""
"passed","Mon Dec 02 20:26:13 UTC 2024","Mon Dec 02 20:26:14 UTC 2024","1208","","Target aggregates: User with one or more places assigned: Offline user with multiple places associated","","","","should display only the targets sections and show the correct message when target aggregates are disabled",""
"passed","Mon Dec 02 20:19:13 UTC 2024","Mon Dec 02 20:19:21 UTC 2024","7841","","Mute/Unmute contacts using a specific form - ","","","","should mute a contact using the defined mute_forms (death_report).",""
"passed","Mon Dec 02 20:27:05 UTC 2024","Mon Dec 02 20:27:15 UTC 2024","9851","","Task list due dates","","","","should display correct due dates with taskDaysOverdue setting",""
"passed","Mon Dec 02 20:33:08 UTC 2024","Mon Dec 02 20:33:11 UTC 2024","3684","","Send message","","","","should send messages to all the contacts, under a place, that have a primary phone number assigned",""
"passed","Mon Dec 02 20:17:18 UTC 2024","Mon Dec 02 20:17:20 UTC 2024","2159","","Contact details page.: Contact summary error","","","","should show error log for bad config",""
"passed","Mon Dec 02 20:32:31 UTC 2024","Mon Dec 02 20:32:33 UTC 2024","1819","","RapidPro SMS Gateway: Webapp originating messages and state updates","","","","should not poll messages for docs that are in pending or scheduled states or lack gateway ref ",""
"passed","Mon Dec 02 20:27:40 UTC 2024","Mon Dec 02 20:27:43 UTC 2024","3271","","Tasks tab breadcrumbs: for chw","","","","should not remove facility from breadcrumbs when offline user has many facilities associated",""
"passed","Mon Dec 02 20:32:11 UTC 2024","Mon Dec 02 20:32:11 UTC 2024","296","","RapidPro SMS Gateway: Webapp Terminating messages","","","","should fail with no incoming key configured",""
"passed","Mon Dec 02 20:31:26 UTC 2024","Mon Dec 02 20:31:27 UTC 2024","903","","sms-gateway api: api returns list of pending WO messages","","","","should returns list and updates state",""
"passed","Mon Dec 02 20:31:57 UTC 2024","Mon Dec 02 20:31:59 UTC 2024","2063","","Message Tab - Sender Data","","","","should display messages with updated breadcrumbs for offline user",""
"passed","Mon Dec 02 20:23:49 UTC 2024","Mon Dec 02 20:23:53 UTC 2024","3648","","Reports Sidebar Filter","","","","should filter by place",""
"passed","Mon Dec 02 20:33:14 UTC 2024","Mon Dec 02 20:33:16 UTC 2024","2383","","Send message","","","","should send a message to a contact with a phone number",""
"passed","Mon Dec 02 20:25:05 UTC 2024","Mon Dec 02 20:25:07 UTC 2024","1757","","Target accuracy","","","","should handle old format of the rules-state-store",""
"passed","Mon Dec 02 20:19:46 UTC 2024","Mon Dec 02 20:19:50 UTC 2024","4009","","Create new lineage structure ","","","","should create new area",""
"passed","Mon Dec 02 20:22:46 UTC 2024","Mon Dec 02 20:22:47 UTC 2024","1679","","Reports Subject","","","","should create a report using missing required patient name",""
"passed","Mon Dec 02 20:22:38 UTC 2024","Mon Dec 02 20:22:41 UTC 2024","2541","","Reports Subject","","","","should create a report using doc id",""
"passed","Mon Dec 02 20:26:09 UTC 2024","Mon Dec 02 20:26:11 UTC 2024","2609","","Target aggregates: User with one or more places assigned: Offline user with multiple places associated","","","","should disable content",""
"passed","Mon Dec 02 20:31:23 UTC 2024","Mon Dec 02 20:31:24 UTC 2024","1682","","sms-gateway api: Gateway submits new WT sms messages","","","","should shows content",""
"passed","Mon Dec 02 20:19:43 UTC 2024","Mon Dec 02 20:19:46 UTC 2024","3235","","Create new lineage structure ","","","","should create new health center",""
"passed","Mon Dec 02 20:28:32 UTC 2024","Mon Dec 02 20:28:33 UTC 2024","1731","","Tasks group landing page: for chw","","","","should not show page when submitting task for contact with no leaf type place in lineage",""
"passed","Mon Dec 02 20:21:33 UTC 2024","Mon Dec 02 20:21:37 UTC 2024","4086","","Bulk delete reports","","","","should select, deselect and delete only selected reports",""
"passed","Mon Dec 02 20:28:50 UTC 2024","Mon Dec 02 20:29:01 UTC 2024","11339","","Tasks","","","","should remove task from list when CHW completes a task successfully",""
"passed","Mon Dec 02 20:09:26 UTC 2024","Mon Dec 02 20:09:34 UTC 2024","7406","","Creating custom places","","","","the RHS button should show the action with custom label",""
"passed","Mon Dec 02 20:19:58 UTC 2024","Mon Dec 02 20:20:06 UTC 2024","7856","","Create new lineage structure ","","","","should edit a person with a phone number",""
"passed","Mon Dec 02 20:28:15 UTC 2024","Mon Dec 02 20:28:18 UTC 2024","3703","","Tasks group landing page: for chw","","","","should display tasks group landing page after task completion",""
"passed","Mon Dec 02 20:08:48 UTC 2024","Mon Dec 02 20:08:53 UTC 2024","5140","","Targets","","","","should display correct message when targets are disabled",""
"passed","Mon Dec 02 20:24:28 UTC 2024","Mon Dec 02 20:24:32 UTC 2024","4075","","Target accuracy","","","","should save target document on first calculation",""
"passed","Mon Dec 02 20:28:26 UTC 2024","Mon Dec 02 20:28:29 UTC 2024","2706","","Tasks group landing page: for chw","","","","should not display modal when clicking list task from same group",""
"passed","Mon Dec 02 20:28:14 UTC 2024","Mon Dec 02 20:28:15 UTC 2024","750","","Tasks group landing page: for chw","","","","should have tasks",""
"passed","Mon Dec 02 20:26:00 UTC 2024","Mon Dec 02 20:26:05 UTC 2024","5361","","Target aggregates: User with one or more places assigned: Online user with one place associated","","","","should display targets of current user on home place",""
"passed","Mon Dec 02 20:18:35 UTC 2024","Mon Dec 02 20:18:37 UTC 2024","1557","","FAB actions","","","","should show new household and new person create option",""
"passed","Mon Dec 02 20:19:21 UTC 2024","Mon Dec 02 20:19:29 UTC 2024","7465","","Mute/Unmute contacts using a specific form - ","","","","should unmute a contact using the defined unmute_forms (undo_death_report).",""
"passed","Mon Dec 02 20:24:44 UTC 2024","Mon Dec 02 20:24:52 UTC 2024","7449","","Target accuracy","","","","should not save target document when adding report for counted contact",""
"passed","Mon Dec 02 20:24:38 UTC 2024","Mon Dec 02 20:24:44 UTC 2024","5834","","Target accuracy","","","","should not save target document when editing counted contact",""
"passed","Mon Dec 02 20:23:01 UTC 2024","Mon Dec 02 20:23:08 UTC 2024","6429","","Reports Subject","","","","changes to a loaded or list report should be reflected in the UI ",""
"passed","Mon Dec 02 20:32:34 UTC 2024","Mon Dec 02 20:32:37 UTC 2024","3210","","RapidPro SMS Gateway: Webapp originating messages and state updates","","","","should keep updating until record is in final state",""
"passed","Mon Dec 02 20:24:02 UTC 2024","Mon Dec 02 20:24:05 UTC 2024","3439","","Reports Sidebar Filter","","","","should filter by user associated place when the permission to default filter is enabled",""
"passed","Mon Dec 02 20:20:59 UTC 2024","Mon Dec 02 20:21:00 UTC 2024","955","","Contact Search","","","","search by NON empty string should display results with contains match and clears search",""
"passed","Mon Dec 02 20:25:48 UTC 2024","Mon Dec 02 20:25:56 UTC 2024","8853","","Target aggregates: User with one or more places assigned: Online user with one place associated","","","","should route to contact-detail on list item click and display contact summary target card",""
"passed","Mon Dec 02 20:15:12 UTC 2024","Mon Dec 02 20:15:17 UTC 2024","5129","","Contact details page.: Permissions to show reports and tasks","","","","should show reports and tasks when permissions are enabled",""
"passed","Mon Dec 02 20:19:55 UTC 2024","Mon Dec 02 20:19:58 UTC 2024","3240","","Create new lineage structure ","","","","should create new person",""
"passed","Mon Dec 02 20:18:58 UTC 2024","Mon Dec 02 20:19:02 UTC 2024","4475","","Infinite scrolling","","","","should load multiple pages of contacts",""
"passed","Mon Dec 02 20:24:15 UTC 2024","Mon Dec 02 20:24:17 UTC 2024","1861","","Reports tab messages","","","","should generate SMS report correctly when lacking patient_id",""
"passed","Mon Dec 02 20:14:46 UTC 2024","Mon Dec 02 20:14:49 UTC 2024","3679","","Add new district tests : ","","","","should add new district with a new person",""
"passed","Mon Dec 02 20:33:20 UTC 2024","Mon Dec 02 20:33:22 UTC 2024","2390","","Send message","","","","should reply to an existing message and add a new recipient - contact with a phone number ",""
"passed","Mon Dec 02 20:32:01 UTC 2024","Mon Dec 02 20:32:03 UTC 2024","2176","","Message Tab - Sender Data","","","","should display conversation with link and navigate to contact",""
"passed","Mon Dec 02 20:25:30 UTC 2024","Mon Dec 02 20:25:44 UTC 2024","14098","","Target aggregates: User with one or more places assigned: Online user with one place associated","","","","should display correct data",""
"passed","Mon Dec 02 20:31:51 UTC 2024","Mon Dec 02 20:31:55 UTC 2024","4173","","Message Tab - Sender Data","","","","should not remove facility from breadcrumbs when offline user has many facilities associated",""
"passed","Mon Dec 02 20:25:15 UTC 2024","Mon Dec 02 20:25:16 UTC 2024","1222","","Target aggregates: DB admin","","","","should display an error when there are aggregates but no home place",""
"passed","Mon Dec 02 20:31:44 UTC 2024","Mon Dec 02 20:31:49 UTC 2024","4431","","Message Tab - Sender Data","","","","should display messages with breadcrumbs for online user",""
"passed","Mon Dec 02 20:23:42 UTC 2024","Mon Dec 02 20:23:46 UTC 2024","3885","","Reports Sidebar Filter","","","","should filter by form",""
"passed","Mon Dec 02 20:29:03 UTC 2024","Mon Dec 02 20:29:14 UTC 2024","11030","","Tasks","","","","should add a task when CHW completes a task successfully, and that task creates another task",""
"passed","Mon Dec 02 20:08:39 UTC 2024","Mon Dec 02 20:08:48 UTC 2024","8464","","Targets","","","","should display correct message when no target found",""
"passed","Mon Dec 02 20:32:12 UTC 2024","Mon Dec 02 20:32:12 UTC 2024","336","","RapidPro SMS Gateway: Webapp Terminating messages","","","","should fail with no authentication provided",""
"passed","Mon Dec 02 20:20:41 UTC 2024","Mon Dec 02 20:20:51 UTC 2024","10313","","Create Person Under Area, ","","","","should create person under area should only see children",""
"passed","Mon Dec 02 20:23:08 UTC 2024","Mon Dec 02 20:23:10 UTC 2024","2046","","Reports Subject","","","","should create a report which does not have a subject",""
"passed","Mon Dec 02 20:20:27 UTC 2024","Mon Dec 02 20:20:34 UTC 2024","6878","","Create new lineage structure ","","","","should edit the name of the Family",""
"passed","Mon Dec 02 20:32:26 UTC 2024","Mon Dec 02 20:32:27 UTC 2024","1412","","RapidPro SMS Gateway: Webapp originating messages and state updates","","","","should set correct states from broadcast api",""
"passed","Mon Dec 02 20:28:29 UTC 2024","Mon Dec 02 20:28:32 UTC 2024","2867","","Tasks group landing page: for chw","","","","should not show page when there are no more household tasks",""
"passed","Mon Dec 02 20:27:56 UTC 2024","Mon Dec 02 20:27:58 UTC 2024","1380","","Tasks tab breadcrumbs: for supervisor","","","","should display correct tasks with breadcrumbs for supervisor",""
"passed","Mon Dec 02 20:14:54 UTC 2024","Mon Dec 02 20:14:58 UTC 2024","4081","","Add new district tests : ","","","","should edit district with contact_type",""
"passed","Mon Dec 02 20:23:33 UTC 2024","Mon Dec 02 20:23:38 UTC 2024","5088","","Reports Sidebar Filter","","","","should filter by date",""
"passed","Mon Dec 02 20:08:37 UTC 2024","Mon Dec 02 20:08:39 UTC 2024","1636","","Targets","","","","should display targets from default config",""
"passed","Mon Dec 02 20:22:47 UTC 2024","Mon Dec 02 20:22:50 UTC 2024","2498","","Reports Subject","","","","should create a report using place_id with a place_uuid",""
"passed","Mon Dec 02 20:21:41 UTC 2024","Mon Dec 02 20:21:48 UTC 2024","7081","","Delete Reports","","","","Should delete report",""
"passed","Mon Dec 02 20:22:50 UTC 2024","Mon Dec 02 20:22:53 UTC 2024","2923","","Reports Subject","","","","should create a report using place_id with a shortcode",""
"passed","Mon Dec 02 20:24:59 UTC 2024","Mon Dec 02 20:25:05 UTC 2024","6194","","Target accuracy","","","","should save target doc once when getting many changes through replication",""
"passed","Mon Dec 02 20:32:14 UTC 2024","Mon Dec 02 20:32:14 UTC 2024","242","","RapidPro SMS Gateway: Webapp Terminating messages","","","","should fail when message was not created",""
"passed","Mon Dec 02 20:20:06 UTC 2024","Mon Dec 02 20:20:14 UTC 2024","7831","","Create new lineage structure ","","","","should edit a name of the health facility",""
"passed","Mon Dec 02 20:22:59 UTC 2024","Mon Dec 02 20:23:01 UTC 2024","2350","","Reports Subject","","","","should create a report which has an unknown sender with no phone number",""
"passed","Mon Dec 02 20:32:28 UTC 2024","Mon Dec 02 20:32:31 UTC 2024","2567","","RapidPro SMS Gateway: Webapp originating messages and state updates","","","","should update the states correctly from messages api",""
"passed","Mon Dec 02 20:18:20 UTC 2024","Mon Dec 02 20:18:26 UTC 2024","6043","","Export Contacts ","","","","should download export file",""
"passed","Mon Dec 02 20:28:21 UTC 2024","Mon Dec 02 20:28:26 UTC 2024","4942","","Tasks group landing page: for chw","","","","should display modal when clicking on a task from another group",""
"passed","Mon Dec 02 20:09:05 UTC 2024","Mon Dec 02 20:09:13 UTC 2024","8104","","Creating custom places","","","","the LHS button should show the appropriate label when only one action",""
"passed","Mon Dec 02 20:30:06 UTC 2024","Mon Dec 02 20:30:47 UTC 2024","41275","","Tasks","","","","Should show error message for bad config",""
"passed","Mon Dec 02 20:31:00 UTC 2024","Mon Dec 02 20:31:03 UTC 2024","2776","","Africas Talking api: Gateway submits WT sms status updates","","","","should shows content",""
"passed","Mon Dec 02 20:28:38 UTC 2024","Mon Dec 02 20:28:40 UTC 2024","1776","","Tasks group landing page: for supervisor","","","","should not display task landing page after task completion",""
"passed","Mon Dec 02 20:31:24 UTC 2024","Mon Dec 02 20:31:26 UTC 2024","1189","","sms-gateway api: Gateway submits WT sms status updates","","","","should shows content",""
"passed","Mon Dec 02 20:20:18 UTC 2024","Mon Dec 02 20:20:27 UTC 2024","8227","","Create new lineage structure ","","","","should edit the name of the CHW area",""
"passed","Mon Dec 02 20:27:15 UTC 2024","Mon Dec 02 20:27:26 UTC 2024","10515","","Task list due dates","","","","should display correct due dates with taskDaysOverdue setting and simple translation",""
"passed","Mon Dec 02 20:27:50 UTC 2024","Mon Dec 02 20:27:52 UTC 2024","2210","","Tasks tab breadcrumbs: for chw","","","","should open task with expression",""
"passed","Mon Dec 02 20:21:20 UTC 2024","Mon Dec 02 20:21:23 UTC 2024","3040","","Reports tab breadcrumbs","","","","should display reports with updated breadcrumbs for offline user",""
"passed","Mon Dec 02 20:19:50 UTC 2024","Mon Dec 02 20:19:55 UTC 2024","4509","","Create new lineage structure ","","","","should create new household",""
