"DESCRIPTION","DURATION IN MS","NAME","PARENT SUITE","START TIME","STATUS","STOP TIME","SUB SUITE","SUITE","TEST CLASS","TEST METHOD"
"","3455","should filter by place","","Mon Jun 16 11:54:53 UTC 2025","passed","Mon Jun 16 11:54:56 UTC 2025","","Reports Sidebar Filter","",""
"","3945","should create new area","","Mon Jun 16 11:50:55 UTC 2025","passed","Mon Jun 16 11:50:59 UTC 2025","","Create new lineage structure ","",""
"","793","should returns list and updates state","","Mon Jun 16 12:03:27 UTC 2025","passed","Mon Jun 16 12:03:28 UTC 2025","","sms-gateway api: api returns list of pending WO messages","",""
"","3062","should shows content","","Mon Jun 16 12:02:59 UTC 2025","passed","Mon Jun 16 12:03:02 UTC 2025","","Africas Talking api: Gateway submits new WT sms messages","",""
"","3302","should filter by status","","Mon Jun 16 11:54:57 UTC 2025","passed","Mon Jun 16 11:55:00 UTC 2025","","Reports Sidebar Filter","",""
"","5151","should not save target document when editing counted contact","","Mon Jun 16 11:55:36 UTC 2025","passed","Mon Jun 16 11:55:42 UTC 2025","","Target accuracy","",""
"","5755","detects duplicates from a custom duplicate expression","","Mon Jun 16 11:48:28 UTC 2025","passed","Mon Jun 16 11:48:34 UTC 2025","","Duplicate contact detection","",""
"","8133","should show the single add person button with the correct label","","Mon Jun 16 11:44:21 UTC 2025","passed","Mon Jun 16 11:44:29 UTC 2025","","Creating custom places","",""
"","3609","should filter by form","","Mon Jun 16 11:54:48 UTC 2025","passed","Mon Jun 16 11:54:51 UTC 2025","","Reports Sidebar Filter","",""
