"DESCRIPTION","DURATION IN MS","NAME","PARENT SUITE","START TIME","STATUS","STOP TIME","SUB SUITE","SUITE","TEST CLASS","TEST METHOD"
"","1096","should shows content","","Tue Aug 05 10:23:46 UTC 2025","passed","Tue Aug 05 10:23:47 UTC 2025","","sms-gateway api: Gateway submits WT sms status updates","",""
"","3891","should add new district with a new person","","Tue Aug 05 10:06:21 UTC 2025","passed","Tue Aug 05 10:06:25 UTC 2025","","Add new district tests : ","",""
"","3133","should send a message using FAB at people's tab","","Tue Aug 05 10:25:42 UTC 2025","passed","Tue Aug 05 10:25:45 UTC 2025","","Send message","",""
"","911","should reply to an existing message - raw phone number","","Tue Aug 05 10:25:35 UTC 2025","passed","Tue Aug 05 10:25:36 UTC 2025","","Send message","",""
"","7090","should edit the name of the CHW area","","Tue Aug 05 10:12:32 UTC 2025","passed","Tue Aug 05 10:12:39 UTC 2025","","Create new lineage structure ","",""
"","7098","should poll for state updates and consume queue","","Tue Aug 05 10:24:59 UTC 2025","passed","Tue Aug 05 10:25:06 UTC 2025","","RapidPro SMS Gateway: Webapp originating messages and state updates","",""
"","1307","should generate SMS report correctly when lacking patient_id","","Tue Aug 05 10:16:18 UTC 2025","passed","Tue Aug 05 10:16:19 UTC 2025","","Reports tab messages","",""
"","2420","should return results when searching by case_id","","Tue Aug 05 10:15:34 UTC 2025","passed","Tue Aug 05 10:15:37 UTC 2025","","Reports Search","",""
"","11363","should route to contact-detail on list item click and display contact summary target card","","Tue Aug 05 10:17:53 UTC 2025","passed","Tue Aug 05 10:18:04 UTC 2025","","Target aggregates: User with one or more places assigned: Online user with one place associated","",""
"","10117","should add a task when CHW completes a task successfully, and that task creates another task","","Tue Aug 05 10:21:07 UTC 2025","passed","Tue Aug 05 10:21:17 UTC 2025","","Tasks","",""
"","388","should fail with no incoming key configured","","Tue Aug 05 10:24:30 UTC 2025","passed","Tue Aug 05 10:24:31 UTC 2025","","RapidPro SMS Gateway: Webapp Terminating messages","",""
"","29714","should not show reports when permission is disabled","","Tue Aug 05 10:06:52 UTC 2025","passed","Tue Aug 05 10:07:22 UTC 2025","","Contact details page.: Permissions to show reports and tasks","",""
"","5289","should load multiple pages of contacts","","Tue Aug 05 10:11:12 UTC 2025","passed","Tue Aug 05 10:11:17 UTC 2025","","Infinite scrolling","",""
"","7829","the RHS button should show the action with custom label","","Tue Aug 05 10:05:23 UTC 2025","passed","Tue Aug 05 10:05:31 UTC 2025","","Creating custom places","",""
"","1597","should not display task landing page after task completion","","Tue Aug 05 10:20:45 UTC 2025","passed","Tue Aug 05 10:20:47 UTC 2025","","Tasks group landing page: for supervisor","",""
"","2300","should create a report which does not have a subject","","Tue Aug 05 10:15:21 UTC 2025","passed","Tue Aug 05 10:15:23 UTC 2025","","Reports Subject","",""
"","2858","should download export file","","Tue Aug 05 10:23:33 UTC 2025","passed","Tue Aug 05 10:23:36 UTC 2025","","Export Messages","",""
"","8108","should show the multi person actions with the correct label","","Tue Aug 05 10:05:53 UTC 2025","passed","Tue Aug 05 10:06:01 UTC 2025","","Creating custom places","",""
"","1804","should display only the targets sections and show the correct message when target aggregates are disabled","","Tue Aug 05 10:18:21 UTC 2025","passed","Tue Aug 05 10:18:23 UTC 2025","","Target aggregates: User with one or more places assigned: Offline user with multiple places associated","",""
"","1538","should display targets from default config","","Tue Aug 05 10:04:37 UTC 2025","passed","Tue Aug 05 10:04:39 UTC 2025","","Targets","",""
"","6222","should show a popup when trying to submit a non-unmuting form against a muted contact","","Tue Aug 05 10:11:44 UTC 2025","passed","Tue Aug 05 10:11:50 UTC 2025","","Mute/Unmute contacts using a specific form - ","",""
"","8371","should not save target document when adding report for counted contact","","Tue Aug 05 10:16:45 UTC 2025","passed","Tue Aug 05 10:16:54 UTC 2025","","Target accuracy","",""
"","3258","should display modal when clicking on a task from another group","","Tue Aug 05 10:20:25 UTC 2025","passed","Tue Aug 05 10:20:28 UTC 2025","","Tasks group landing page: for chw","",""
"","2458","Send SMS without patient_id and report created under person","","Tue Aug 05 10:23:55 UTC 2025","passed","Tue Aug 05 10:23:58 UTC 2025","","Link SMS to patient without passing id","",""
"","6086","should edit the name of the Family","","Tue Aug 05 10:12:39 UTC 2025","passed","Tue Aug 05 10:12:46 UTC 2025","","Create new lineage structure ","",""
"","1487","should set correct states from broadcast api","","Tue Aug 05 10:24:47 UTC 2025","passed","Tue Aug 05 10:24:49 UTC 2025","","RapidPro SMS Gateway: Webapp originating messages and state updates","",""
"","2139","should not show page when submitting task for contact with no leaf type place in lineage","","Tue Aug 05 10:20:37 UTC 2025","passed","Tue Aug 05 10:20:39 UTC 2025","","Tasks group landing page: for chw","",""
"","1352","should show new household and new person create option","","Tue Aug 05 10:10:50 UTC 2025","passed","Tue Aug 05 10:10:51 UTC 2025","","FAB actions","",""
"","2191","should create a report using patient name","","Tue Aug 05 10:14:57 UTC 2025","passed","Tue Aug 05 10:14:59 UTC 2025","","Reports Subject","",""
"","3271","should filter by place","","Tue Aug 05 10:15:56 UTC 2025","passed","Tue Aug 05 10:15:59 UTC 2025","","Reports Sidebar Filter","",""
"","7027","should download export file","","Tue Aug 05 10:14:03 UTC 2025","passed","Tue Aug 05 10:14:10 UTC 2025","","Export Reports","",""
"","2642","should delete the primary contact of health facility","","Tue Aug 05 10:12:29 UTC 2025","passed","Tue Aug 05 10:12:32 UTC 2025","","Create new lineage structure ","",""
"","8006","should mute a contact using the defined mute_forms (death_report).","","Tue Aug 05 10:11:29 UTC 2025","passed","Tue Aug 05 10:11:37 UTC 2025","","Mute/Unmute contacts using a specific form - ","",""
"","19989","Should show error message for bad config","","Tue Aug 05 10:22:22 UTC 2025","passed","Tue Aug 05 10:22:42 UTC 2025","","Tasks","",""
"","3287","should filter by status","","Tue Aug 05 10:16:01 UTC 2025","passed","Tue Aug 05 10:16:04 UTC 2025","","Reports Sidebar Filter","",""
"","1269","should open task from the same group","","Tue Aug 05 10:20:24 UTC 2025","passed","Tue Aug 05 10:20:25 UTC 2025","","Tasks group landing page: for chw","",""
"","2446","should display messages with updated breadcrumbs for offline user","","Tue Aug 05 10:24:18 UTC 2025","passed","Tue Aug 05 10:24:20 UTC 2025","","Message Tab - Sender Data","",""
"","6614","should edit a name of the health facility","","Tue Aug 05 10:12:22 UTC 2025","passed","Tue Aug 05 10:12:28 UTC 2025","","Create new lineage structure ","",""
"","7803","should show the single add person button with the correct label","","Tue Aug 05 10:05:44 UTC 2025","passed","Tue Aug 05 10:05:51 UTC 2025","","Creating custom places","",""
"","3341","should display reports with updated breadcrumbs for offline user","","Tue Aug 05 10:13:31 UTC 2025","passed","Tue Aug 05 10:13:34 UTC 2025","","Reports tab breadcrumbs","",""
"","1297","should display an error when there are aggregates but no home place","","Tue Aug 05 10:17:17 UTC 2025","passed","Tue Aug 05 10:17:18 UTC 2025","","Target aggregates: DB admin","",""
"","2933","should save target document on first calculation","","Tue Aug 05 10:16:30 UTC 2025","passed","Tue Aug 05 10:16:33 UTC 2025","","Target accuracy","",""
"","1577","should not call RapidPro endpoint when credentials are not set","","Tue Aug 05 10:24:43 UTC 2025","passed","Tue Aug 05 10:24:45 UTC 2025","","RapidPro SMS Gateway: Webapp originating messages and state updates","",""
"","5685","should display correct message when no target found","","Tue Aug 05 10:04:39 UTC 2025","passed","Tue Aug 05 10:04:45 UTC 2025","","Targets","",""
"","641","search should clear RHS selected contact","","Tue Aug 05 10:13:13 UTC 2025","passed","Tue Aug 05 10:13:13 UTC 2025","","Contact Search","",""
"","1315","should create case ID","","Tue Aug 05 10:14:19 UTC 2025","passed","Tue Aug 05 10:14:20 UTC 2025","","Generating short codes","",""
"","4163","should create new area","","Tue Aug 05 10:12:02 UTC 2025","passed","Tue Aug 05 10:12:06 UTC 2025","","Create new lineage structure ","",""
"","6741","should edit a person with a phone number","","Tue Aug 05 10:12:15 UTC 2025","passed","Tue Aug 05 10:12:21 UTC 2025","","Create new lineage structure ","",""
"","1309","should call endpoint with set credentials","","Tue Aug 05 10:24:45 UTC 2025","passed","Tue Aug 05 10:24:47 UTC 2025","","RapidPro SMS Gateway: Webapp originating messages and state updates","",""
"","8390","should display correct due dates with default settings","","Tue Aug 05 10:19:09 UTC 2025","passed","Tue Aug 05 10:19:17 UTC 2025","","Task list due dates","",""
"","3507","should not remove facility from breadcrumbs when offline user has many facilities associated","","Tue Aug 05 10:13:26 UTC 2025","passed","Tue Aug 05 10:13:30 UTC 2025","","Reports tab breadcrumbs","",""
"","4730","should display messages with breadcrumbs for online user","","Tue Aug 05 10:24:07 UTC 2025","passed","Tue Aug 05 10:24:12 UTC 2025","","Message Tab - Sender Data","",""
"","2366","should update the states correctly from messages api","","Tue Aug 05 10:24:49 UTC 2025","passed","Tue Aug 05 10:24:52 UTC 2025","","RapidPro SMS Gateway: Webapp originating messages and state updates","",""
"","1442","should shows content","","Tue Aug 05 10:23:14 UTC 2025","passed","Tue Aug 05 10:23:15 UTC 2025","","Africas Talking api: Gateway submits new WT sms messages","",""
"","9440","should handle rate limiting when polling","","Tue Aug 05 10:25:08 UTC 2025","passed","Tue Aug 05 10:25:18 UTC 2025","","RapidPro SMS Gateway: Webapp originating messages and state updates","",""
"","397","should fail with no authentication provided","","Tue Aug 05 10:24:31 UTC 2025","passed","Tue Aug 05 10:24:32 UTC 2025","","RapidPro SMS Gateway: Webapp Terminating messages","",""
"","3631","should create new person","","Tue Aug 05 10:12:11 UTC 2025","passed","Tue Aug 05 10:12:14 UTC 2025","","Create new lineage structure ","",""
"","2179","should create a report using unknown patient_id ","","Tue Aug 05 10:14:55 UTC 2025","passed","Tue Aug 05 10:14:57 UTC 2025","","Reports Subject","",""
"","4764","can add duplicate contact that is not a sibling","","Tue Aug 05 10:09:52 UTC 2025","passed","Tue Aug 05 10:09:57 UTC 2025","","Duplicate contact detection","",""
"","9346","should create person under area should only see children","","Tue Aug 05 10:12:54 UTC 2025","passed","Tue Aug 05 10:13:03 UTC 2025","","Create Person Under Area, ","",""
"","2266","should show fab when user only has can_create_people permission","","Tue Aug 05 10:10:58 UTC 2025","passed","Tue Aug 05 10:11:00 UTC 2025","","FAB actions","",""
"","3170","should have tasks","","Tue Aug 05 10:20:42 UTC 2025","passed","Tue Aug 05 10:20:45 UTC 2025","","Tasks group landing page: for supervisor","",""
"","5439","detects duplicates when creating top-level place - allows acknowledging","","Tue Aug 05 10:09:18 UTC 2025","passed","Tue Aug 05 10:09:23 UTC 2025","","Duplicate contact detection","",""
"","4842","does not detect duplicates when expression is disabled","","Tue Aug 05 10:09:46 UTC 2025","passed","Tue Aug 05 10:09:50 UTC 2025","","Duplicate contact detection","",""
"","335","should fail with incorrect authentication","","Tue Aug 05 10:24:33 UTC 2025","passed","Tue Aug 05 10:24:33 UTC 2025","","RapidPro SMS Gateway: Webapp Terminating messages","",""
"","10314","should update a contact, delete the same contact then unassign primary contact from facility","","Tue Aug 05 10:10:05 UTC 2025","passed","Tue Aug 05 10:10:15 UTC 2025","","Edit ","",""
"","808","should returns list and updates state","","Tue Aug 05 10:23:47 UTC 2025","passed","Tue Aug 05 10:23:48 UTC 2025","","sms-gateway api: api returns list of pending WO messages","",""
"","2173","should send a message to a raw phone number","","Tue Aug 05 10:25:31 UTC 2025","passed","Tue Aug 05 10:25:33 UTC 2025","","Send message","",""
"","2186","should create a report using place_id with a shortcode","","Tue Aug 05 10:15:05 UTC 2025","passed","Tue Aug 05 10:15:07 UTC 2025","","Reports Subject","",""
"","7158","Should delete report","","Tue Aug 05 10:13:51 UTC 2025","passed","Tue Aug 05 10:13:58 UTC 2025","","Delete Reports","",""
"","2570","should create a report using patient_id","","Tue Aug 05 10:14:49 UTC 2025","passed","Tue Aug 05 10:14:52 UTC 2025","","Reports Subject","",""
"","2325","should reply to an existing message and add a new recipient - raw phone number ","","Tue Aug 05 10:25:37 UTC 2025","passed","Tue Aug 05 10:25:40 UTC 2025","","Send message","",""
"","7896","should display targets of current user on home place","","Tue Aug 05 10:18:06 UTC 2025","passed","Tue Aug 05 10:18:14 UTC 2025","","Target aggregates: User with one or more places assigned: Online user with one place associated","",""
"","123","should show contact summary that has the full context for reports > 50 validate that the pregnancy card is always displayed","","Tue Aug 05 10:06:52 UTC 2025","passed","Tue Aug 05 10:06:52 UTC 2025","","Contact details page.: Permissions to show reports and tasks","",""
"","5766","should update SMS statuses","","Tue Aug 05 10:23:18 UTC 2025","passed","Tue Aug 05 10:23:23 UTC 2025","","Africas Talking api: Webapp submits new GT sms messages","",""
"","2273","should shows content","","Tue Aug 05 10:23:15 UTC 2025","passed","Tue Aug 05 10:23:18 UTC 2025","","Africas Talking api: Gateway submits WT sms status updates","",""
"","3454","should display tasks group landing page after task completion","","Tue Aug 05 10:20:20 UTC 2025","passed","Tue Aug 05 10:20:24 UTC 2025","","Tasks group landing page: for chw","",""
"","2084","should send a message to a contact with a phone number","","Tue Aug 05 10:25:33 UTC 2025","passed","Tue Aug 05 10:25:35 UTC 2025","","Send message","",""
"","3109","should send messages to all the contacts, under a place, that have a primary phone number assigned","","Tue Aug 05 10:25:28 UTC 2025","passed","Tue Aug 05 10:25:31 UTC 2025","","Send message","",""
"","2194","should reply to an existing message and add a new recipient - contact with a phone number ","","Tue Aug 05 10:25:40 UTC 2025","passed","Tue Aug 05 10:25:42 UTC 2025","","Send message","",""
"","16905","should display correct data","","Tue Aug 05 10:17:33 UTC 2025","passed","Tue Aug 05 10:17:50 UTC 2025","","Target aggregates: User with one or more places assigned: Online user with one place associated","",""
"","3931","should filter by form","","Tue Aug 05 10:15:51 UTC 2025","passed","Tue Aug 05 10:15:55 UTC 2025","","Reports Sidebar Filter","",""
"","8551","should remove task from list when CHW completes a task successfully","","Tue Aug 05 10:20:59 UTC 2025","passed","Tue Aug 05 10:21:07 UTC 2025","","Tasks","",""
"","2294","should create a report using doc id","","Tue Aug 05 10:14:52 UTC 2025","passed","Tue Aug 05 10:14:55 UTC 2025","","Reports Subject","",""
"","10159","the LHS button should show the appropriate label when multiple places exist at the current level","","Tue Aug 05 10:05:11 UTC 2025","passed","Tue Aug 05 10:05:21 UTC 2025","","Creating custom places","",""
"","1450","should display correct tasks with breadcrumbs for supervisor","","Tue Aug 05 10:20:02 UTC 2025","passed","Tue Aug 05 10:20:03 UTC 2025","","Tasks tab breadcrumbs: for supervisor","",""
"","5695","detects duplicates from a custom duplicate expression","","Tue Aug 05 10:09:39 UTC 2025","passed","Tue Aug 05 10:09:44 UTC 2025","","Duplicate contact detection","",""
"","952","should have tasks","","Tue Aug 05 10:20:19 UTC 2025","passed","Tue Aug 05 10:20:20 UTC 2025","","Tasks group landing page: for chw","",""
"","5190","should not save target document when editing counted contact","","Tue Aug 05 10:16:40 UTC 2025","passed","Tue Aug 05 10:16:45 UTC 2025","","Target accuracy","",""
"","8651","should display no data when no targets are uploaded","","Tue Aug 05 10:17:23 UTC 2025","passed","Tue Aug 05 10:17:32 UTC 2025","","Target aggregates: User with one or more places assigned: Online user with one place associated","",""
"","66","should only create one target doc","","Tue Aug 05 10:17:06 UTC 2025","passed","Tue Aug 05 10:17:06 UTC 2025","","Target accuracy","",""
"","2277","should create a report using unknown place_id","","Tue Aug 05 10:15:07 UTC 2025","passed","Tue Aug 05 10:15:10 UTC 2025","","Reports Subject","",""
"","4769","should filter by date","","Tue Aug 05 10:15:45 UTC 2025","passed","Tue Aug 05 10:15:49 UTC 2025","","Reports Sidebar Filter","",""
"","738","search by NON empty string should display results with contains match and clears search","","Tue Aug 05 10:13:12 UTC 2025","passed","Tue Aug 05 10:13:13 UTC 2025","","Contact Search","",""
"","9969","the LHS button should show the appropriate label when only one action","","Tue Aug 05 10:04:59 UTC 2025","passed","Tue Aug 05 10:05:09 UTC 2025","","Creating custom places","",""
"","3607","should create reports","","Tue Aug 05 10:24:39 UTC 2025","passed","Tue Aug 05 10:24:43 UTC 2025","","RapidPro SMS Gateway: Webapp Terminating messages","",""
"","357","should fail when message was not created","","Tue Aug 05 10:24:34 UTC 2025","passed","Tue Aug 05 10:24:35 UTC 2025","","RapidPro SMS Gateway: Webapp Terminating messages","",""
"","1115","should reply to an existing message - contact with a phone number","","Tue Aug 05 10:25:36 UTC 2025","passed","Tue Aug 05 10:25:37 UTC 2025","","Send message","",""
"","5649","should not show page when there are no more household tasks","","Tue Aug 05 10:20:31 UTC 2025","passed","Tue Aug 05 10:20:37 UTC 2025","","Tasks group landing page: for chw","",""
"","1535","should shows content","","Tue Aug 05 10:23:44 UTC 2025","passed","Tue Aug 05 10:23:46 UTC 2025","","sms-gateway api: Gateway submits new WT sms messages","",""
"","6409","should download export file","","Tue Aug 05 10:10:34 UTC 2025","passed","Tue Aug 05 10:10:40 UTC 2025","","Export Contacts ","",""
"","3301","should show error log for bad config","","Tue Aug 05 10:08:46 UTC 2025","passed","Tue Aug 05 10:08:50 UTC 2025","","Contact details page.: Contact summary error","",""
"","8590","the RHS button show the appropriate label when multiple places exist at the current level","","Tue Aug 05 10:05:33 UTC 2025","passed","Tue Aug 05 10:05:42 UTC 2025","","Creating custom places","",""
"","3335","should show fab when user only has can_create_places permission","","Tue Aug 05 10:10:52 UTC 2025","passed","Tue Aug 05 10:10:56 UTC 2025","","FAB actions","",""
"","3324","should display correct message when targets are disabled","","Tue Aug 05 10:04:45 UTC 2025","passed","Tue Aug 05 10:04:48 UTC 2025","","Targets","",""
"","3549","should display correct tasks with breadcrumbs for chw","","Tue Aug 05 10:19:52 UTC 2025","passed","Tue Aug 05 10:19:55 UTC 2025","","Tasks tab breadcrumbs: for chw","",""
"","6010","detects duplicates when editing a contact - navigates to duplicate contact","","Tue Aug 05 10:09:31 UTC 2025","passed","Tue Aug 05 10:09:37 UTC 2025","","Duplicate contact detection","",""
"","6776","should load multiple pages of reports","","Tue Aug 05 10:14:30 UTC 2025","passed","Tue Aug 05 10:14:37 UTC 2025","","Infinite scrolling","",""
"","2326","should return results matching the search term and then return all data when clearing search","","Tue Aug 05 10:15:32 UTC 2025","passed","Tue Aug 05 10:15:34 UTC 2025","","Reports Search","",""
"","3527","should display reports with breadcrumbs for online user","","Tue Aug 05 10:13:22 UTC 2025","passed","Tue Aug 05 10:13:25 UTC 2025","","Reports tab breadcrumbs","",""
"","4075","should create new household","","Tue Aug 05 10:12:06 UTC 2025","passed","Tue Aug 05 10:12:10 UTC 2025","","Create new lineage structure ","",""
"","3899","should not remove facility from breadcrumbs when offline user has many facilities associated","","Tue Aug 05 10:19:47 UTC 2025","passed","Tue Aug 05 10:19:51 UTC 2025","","Tasks tab breadcrumbs: for chw","",""
"","1697","should not poll messages for docs that are in pending or scheduled states or lack gateway ref ","","Tue Aug 05 10:24:53 UTC 2025","passed","Tue Aug 05 10:24:55 UTC 2025","","RapidPro SMS Gateway: Webapp originating messages and state updates","",""
"","5555","should show error message for bad config","","Tue Aug 05 10:04:48 UTC 2025","passed","Tue Aug 05 10:04:54 UTC 2025","","Targets","",""
"","64741","should load multiple pages of tasks on infinite scrolling","","Tue Aug 05 10:21:17 UTC 2025","passed","Tue Aug 05 10:22:22 UTC 2025","","Tasks","",""
"","9039","should launch an edit contact form when edit_id is provided in content","","Tue Aug 05 10:22:55 UTC 2025","passed","Tue Aug 05 10:23:04 UTC 2025","","Tasks: contact tasks","",""
"","31168","should filter aggregates by place and period","","Tue Aug 05 10:18:24 UTC 2025","passed","Tue Aug 05 10:18:55 UTC 2025","","Target aggregates: User with one or more places assigned: Offline user with multiple places associated","",""
"","3857","should select, deselect and delete only selected reports","","Tue Aug 05 10:13:43 UTC 2025","passed","Tue Aug 05 10:13:47 UTC 2025","","Bulk delete reports","",""
"","11040","should add user with multiple places with permission","","Tue Aug 05 10:08:59 UTC 2025","passed","Tue Aug 05 10:09:10 UTC 2025","","User Test Cases -> Creating Users ->","",""
"","296","should fail with malformed authentication","","Tue Aug 05 10:24:34 UTC 2025","passed","Tue Aug 05 10:24:34 UTC 2025","","RapidPro SMS Gateway: Webapp Terminating messages","",""
"","3451","should edit district with contact_type","","Tue Aug 05 10:06:30 UTC 2025","passed","Tue Aug 05 10:06:33 UTC 2025","","Add new district tests : ","",""
"","4984","should show reports and tasks when permissions are enabled","","Tue Aug 05 10:06:47 UTC 2025","passed","Tue Aug 05 10:06:52 UTC 2025","","Contact details page.: Permissions to show reports and tasks","",""
"","8159","should display correct due dates with taskDaysOverdue setting and simple translation","","Tue Aug 05 10:19:25 UTC 2025","passed","Tue Aug 05 10:19:33 UTC 2025","","Task list due dates","",""
"","3004","should disable content","","Tue Aug 05 10:18:16 UTC 2025","passed","Tue Aug 05 10:18:19 UTC 2025","","Target aggregates: User with one or more places assigned: Offline user with multiple places associated","",""
"","2256","should create a report using place_id with a place_uuid","","Tue Aug 05 10:15:02 UTC 2025","passed","Tue Aug 05 10:15:05 UTC 2025","","Reports Subject","",""
"","19254","should not show tasks when permission is disabled","","Tue Aug 05 10:07:22 UTC 2025","passed","Tue Aug 05 10:07:41 UTC 2025","","Contact details page.: Permissions to show reports and tasks","",""
"","3553","should edit district","","Tue Aug 05 10:06:26 UTC 2025","passed","Tue Aug 05 10:06:29 UTC 2025","","Add new district tests : ","",""
"","6035","changes to a loaded or list report should be reflected in the UI ","","Tue Aug 05 10:15:14 UTC 2025","passed","Tue Aug 05 10:15:20 UTC 2025","","Reports Subject","",""
"","2621","should display conversation with link and navigate to contact","","Tue Aug 05 10:24:21 UTC 2025","passed","Tue Aug 05 10:24:23 UTC 2025","","Message Tab - Sender Data","",""
"","7447","should save target doc once when getting many changes through replication","","Tue Aug 05 10:16:59 UTC 2025","passed","Tue Aug 05 10:17:06 UTC 2025","","Target accuracy","",""
"","2768","should not display modal when clicking list task from same group","","Tue Aug 05 10:20:28 UTC 2025","passed","Tue Aug 05 10:20:31 UTC 2025","","Tasks group landing page: for chw","",""
"","8877","should show custom places in their own list","","Tue Aug 05 10:06:04 UTC 2025","passed","Tue Aug 05 10:06:12 UTC 2025","","Creating custom places","",""
"","3836","should filter by user associated place when the permission to default filter is enabled","","Tue Aug 05 10:16:05 UTC 2025","passed","Tue Aug 05 10:16:09 UTC 2025","","Reports Sidebar Filter","",""
"","3216","should create new health center","","Tue Aug 05 10:11:58 UTC 2025","passed","Tue Aug 05 10:12:01 UTC 2025","","Create new lineage structure ","",""
"","2090","should create a report which has an unknown sender and a known subject","","Tue Aug 05 10:15:10 UTC 2025","passed","Tue Aug 05 10:15:12 UTC 2025","","Reports Subject","",""
"","621","should display an empty list when there are no aggregates","","Tue Aug 05 10:17:16 UTC 2025","passed","Tue Aug 05 10:17:17 UTC 2025","","Target aggregates: DB admin","",""
"","3097","should keep updating until record is in final state","","Tue Aug 05 10:24:56 UTC 2025","passed","Tue Aug 05 10:24:59 UTC 2025","","RapidPro SMS Gateway: Webapp originating messages and state updates","",""
"","2046","should create a report which has an unknown sender with no phone number","","Tue Aug 05 10:15:12 UTC 2025","passed","Tue Aug 05 10:15:14 UTC 2025","","Reports Subject","",""
"","6884","should save target document when targets change","","Tue Aug 05 10:16:33 UTC 2025","passed","Tue Aug 05 10:16:40 UTC 2025","","Target accuracy","",""
"","5444","should save target document when deleting counted contact","","Tue Aug 05 10:16:54 UTC 2025","passed","Tue Aug 05 10:16:59 UTC 2025","","Target accuracy","",""
"","12929","should launch an add contact form when type is provided in content","","Tue Aug 05 10:22:42 UTC 2025","passed","Tue Aug 05 10:22:55 UTC 2025","","Tasks: contact tasks","",""
