"Status","Start Time","Stop Time","Duration in ms","Parent Suite","Suite","Sub Suite","Test Class","Test Method","Name","Description"
"passed","Mon Jan 27 16:47:38 UTC 2025","Mon Jan 27 16:47:41 UTC 2025","2414","","Send message","","","","should send a message to a contact with a phone number",""
"passed","Mon Jan 27 16:42:59 UTC 2025","Mon Jan 27 16:43:10 UTC 2025","11374","","Tasks","","","","should remove task from list when CHW completes a task successfully",""
"passed","Mon Jan 27 16:46:53 UTC 2025","Mon Jan 27 16:46:55 UTC 2025","1530","","RapidPro SMS Gateway: Webapp originating messages and state updates","","","","should set correct states from broadcast api",""
"passed","Mon Jan 27 16:46:41 UTC 2025","Mon Jan 27 16:46:44 UTC 2025","3513","","RapidPro SMS Gateway: Webapp Terminating messages","","","","should create messages",""
"passed","Mon Jan 27 16:33:25 UTC 2025","Mon Jan 27 16:33:32 UTC 2025","7409","","Mute/Unmute contacts using a specific form - ","","","","should unmute a contact using the defined unmute_forms (undo_death_report).",""
"passed","Mon Jan 27 16:27:19 UTC 2025","Mon Jan 27 16:27:24 UTC 2025","4676","","Targets","","","","should display correct message when targets are disabled",""
"passed","Mon Jan 27 16:47:42 UTC 2025","Mon Jan 27 16:47:45 UTC 2025","2622","","Send message","","","","should reply to an existing message and add a new recipient - raw phone number ",""
"passed","Mon Jan 27 16:42:06 UTC 2025","Mon Jan 27 16:42:07 UTC 2025","1283","","Tasks tab breadcrumbs: for supervisor","","","","should display correct tasks with breadcrumbs for supervisor",""
"passed","Mon Jan 27 16:36:56 UTC 2025","Mon Jan 27 16:36:58 UTC 2025","2454","","Reports Subject","","","","should create a report using place_id with a place_uuid",""
"passed","Mon Jan 27 16:39:39 UTC 2025","Mon Jan 27 16:39:54 UTC 2025","14564","","Target aggregates: User with one or more places assigned: Online user with one place associated","","","","should display correct data",""
"passed","Mon Jan 27 16:37:57 UTC 2025","Mon Jan 27 16:38:00 UTC 2025","3687","","Reports Sidebar Filter","","","","should filter by place",""
"passed","Mon Jan 27 16:40:23 UTC 2025","Mon Jan 27 16:40:24 UTC 2025","1100","","Target aggregates: User with one or more places assigned: Offline user with multiple places associated","","","","should display only the targets sections and show the correct message when target aggregates are disabled",""
"passed","Mon Jan 27 16:46:26 UTC 2025","Mon Jan 27 16:46:28 UTC 2025","1948","","Message Tab - Sender Data","","","","should display conversation with link and navigate to contact",""
"passed","Mon Jan 27 16:38:59 UTC 2025","Mon Jan 27 16:39:06 UTC 2025","6646","","Target accuracy","","","","should save target document when deleting counted contact",""
"passed","Mon Jan 27 16:34:23 UTC 2025","Mon Jan 27 16:34:31 UTC 2025","7780","","Create new lineage structure ","","","","should edit the name of the CHW area",""
"passed","Mon Jan 27 16:35:05 UTC 2025","Mon Jan 27 16:35:06 UTC 2025","982","","Contact Search","","","","search by NON empty string should display results with contains match and clears search",""
"passed","Mon Jan 27 16:47:41 UTC 2025","Mon Jan 27 16:47:41 UTC 2025","672","","Send message","","","","should reply to an existing message - raw phone number",""
"passed","Mon Jan 27 16:35:39 UTC 2025","Mon Jan 27 16:35:43 UTC 2025","4287","","Bulk delete reports","","","","should select, deselect and delete only selected reports",""
"passed","Mon Jan 27 16:46:40 UTC 2025","Mon Jan 27 16:46:40 UTC 2025","349","","RapidPro SMS Gateway: Webapp Terminating messages","","","","should fail when message was not created",""
"passed","Mon Jan 27 16:43:26 UTC 2025","Mon Jan 27 16:44:01 UTC 2025","34414","","Tasks","","","","should load multiple pages of tasks on infinite scrolling",""
"passed","Mon Jan 27 16:46:16 UTC 2025","Mon Jan 27 16:46:20 UTC 2025","4164","","Message Tab - Sender Data","","","","should not remove facility from breadcrumbs when offline user has many facilities associated",""
"passed","Mon Jan 27 16:45:51 UTC 2025","Mon Jan 27 16:45:52 UTC 2025","916","","sms-gateway api: api returns list of pending WO messages","","","","should returns list and updates state",""
"passed","Mon Jan 27 16:37:27 UTC 2025","Mon Jan 27 16:37:30 UTC 2025","3285","","Reports Search","","","","should return results matching the search term and then return all data when clearing search",""
"passed","Mon Jan 27 16:45:21 UTC 2025","Mon Jan 27 16:45:25 UTC 2025","3402","","Africas Talking api: Gateway submits new WT sms messages","","","","should shows content",""
"passed","Mon Jan 27 16:46:51 UTC 2025","Mon Jan 27 16:46:53 UTC 2025","1645","","RapidPro SMS Gateway: Webapp originating messages and state updates","","","","should call endpoint with set credentials",""
"passed","Mon Jan 27 16:35:06 UTC 2025","Mon Jan 27 16:35:06 UTC 2025","565","","Contact Search","","","","search should clear RHS selected contact",""
"passed","Mon Jan 27 16:35:25 UTC 2025","Mon Jan 27 16:35:28 UTC 2025","2947","","Reports tab breadcrumbs","","","","should display reports with updated breadcrumbs for offline user",""
"passed","Mon Jan 27 16:41:48 UTC 2025","Mon Jan 27 16:41:52 UTC 2025","3491","","Tasks tab breadcrumbs: for chw","","","","should not remove facility from breadcrumbs when offline user has many facilities associated",""
"passed","Mon Jan 27 16:27:09 UTC 2025","Mon Jan 27 16:27:10 UTC 2025","1633","","Targets","","","","should display targets from default config",""
"passed","Mon Jan 27 16:29:48 UTC 2025","Mon Jan 27 16:30:33 UTC 2025","45256","","Contact details page.: Permissions to show reports and tasks","","","","should not show tasks when permission is disabled",""
"passed","Mon Jan 27 16:42:23 UTC 2025","Mon Jan 27 16:42:24 UTC 2025","771","","Tasks group landing page: for chw","","","","should have tasks",""
"passed","Mon Jan 27 16:34:18 UTC 2025","Mon Jan 27 16:34:23 UTC 2025","4597","","Create new lineage structure ","","","","should delete the primary contact of health facility",""
"passed","Mon Jan 27 16:46:37 UTC 2025","Mon Jan 27 16:46:38 UTC 2025","506","","RapidPro SMS Gateway: Webapp Terminating messages","","","","should fail with no authentication provided",""
"passed","Mon Jan 27 16:45:37 UTC 2025","Mon Jan 27 16:45:41 UTC 2025","3968","","Export Messages","","","","should download export file",""
"passed","Mon Jan 27 16:38:08 UTC 2025","Mon Jan 27 16:38:12 UTC 2025","3923","","Reports Sidebar Filter","","","","should filter by user associated place when the permission to default filter is enabled",""
"passed","Mon Jan 27 16:37:07 UTC 2025","Mon Jan 27 16:37:09 UTC 2025","2217","","Reports Subject","","","","should create a report which has an unknown sender with no phone number",""
"passed","Mon Jan 27 16:41:54 UTC 2025","Mon Jan 27 16:41:57 UTC 2025","3736","","Tasks tab breadcrumbs: for chw","","","","should display correct tasks with breadcrumbs for chw",""
"passed","Mon Jan 27 16:29:03 UTC 2025","Mon Jan 27 16:29:06 UTC 2025","3362","","Add new district tests : ","","","","should edit district with contact_type",""
"passed","Mon Jan 27 16:37:50 UTC 2025","Mon Jan 27 16:37:54 UTC 2025","3914","","Reports Sidebar Filter","","","","should filter by form",""
"passed","Mon Jan 27 16:34:31 UTC 2025","Mon Jan 27 16:34:38 UTC 2025","7787","","Create new lineage structure ","","","","should edit the name of the Family",""
"passed","Mon Jan 27 16:37:01 UTC 2025","Mon Jan 27 16:37:04 UTC 2025","3008","","Reports Subject","","","","should create a report using unknown place_id",""
"passed","Mon Jan 27 16:28:59 UTC 2025","Mon Jan 27 16:29:03 UTC 2025","3817","","Add new district tests : ","","","","should edit district",""
"passed","Mon Jan 27 16:33:32 UTC 2025","Mon Jan 27 16:33:39 UTC 2025","6675","","Mute/Unmute contacts using a specific form - ","","","","should show a popup when trying to submit a non-unmuting form against a muted contact",""
"passed","Mon Jan 27 16:42:45 UTC 2025","Mon Jan 27 16:42:47 UTC 2025","2032","","Tasks group landing page: for supervisor","","","","should have tasks",""
"passed","Mon Jan 27 16:36:24 UTC 2025","Mon Jan 27 16:36:30 UTC 2025","5732","","Infinite scrolling","","","","should load multiple pages of reports",""
"passed","Mon Jan 27 16:28:18 UTC 2025","Mon Jan 27 16:28:26 UTC 2025","7916","","Creating custom places","","","","should show the single add person button with the correct label",""
"passed","Mon Jan 27 16:35:59 UTC 2025","Mon Jan 27 16:36:06 UTC 2025","6511","","Export Reports","","","","should download export file",""
"passed","Mon Jan 27 16:36:45 UTC 2025","Mon Jan 27 16:36:47 UTC 2025","2599","","Reports Subject","","","","should create a report using doc id",""
"passed","Mon Jan 27 16:35:15 UTC 2025","Mon Jan 27 16:35:18 UTC 2025","2910","","Reports tab breadcrumbs","","","","should display reports with breadcrumbs for online user",""
"passed","Mon Jan 27 16:46:45 UTC 2025","Mon Jan 27 16:46:48 UTC 2025","3324","","RapidPro SMS Gateway: Webapp Terminating messages","","","","should create reports",""
"passed","Mon Jan 27 16:29:21 UTC 2025","Mon Jan 27 16:29:26 UTC 2025","5175","","Contact details page.: Permissions to show reports and tasks","","","","should show reports and tasks when permissions are enabled",""
"passed","Mon Jan 27 16:42:41 UTC 2025","Mon Jan 27 16:42:43 UTC 2025","1471","","Tasks group landing page: for chw","","","","should not show page when submitting task for contact with no leaf type place in lineage",""
"passed","Mon Jan 27 16:29:26 UTC 2025","Mon Jan 27 16:29:48 UTC 2025","21962","","Contact details page.: Permissions to show reports and tasks","","","","should not show reports when permission is disabled",""
"passed","Mon Jan 27 16:31:49 UTC 2025","Mon Jan 27 16:32:00 UTC 2025","11453","","Edit ","","","","should update a contact, delete the same contact then unassign primary contact from facility",""
"passed","Mon Jan 27 16:34:46 UTC 2025","Mon Jan 27 16:34:56 UTC 2025","10569","","Create Person Under Area, ","","","","should create person under area should only see children",""
"passed","Mon Jan 27 16:45:48 UTC 2025","Mon Jan 27 16:45:49 UTC 2025","1567","","sms-gateway api: Gateway submits new WT sms messages","","","","should shows content",""
"passed","Mon Jan 27 16:39:23 UTC 2025","Mon Jan 27 16:39:24 UTC 2025","1246","","Target aggregates: DB admin","","","","should display an error when there are aggregates but no home place",""
"passed","Mon Jan 27 16:35:20 UTC 2025","Mon Jan 27 16:35:23 UTC 2025","3038","","Reports tab breadcrumbs","","","","should not remove facility from breadcrumbs when offline user has many facilities associated",""
"passed","Mon Jan 27 16:38:03 UTC 2025","Mon Jan 27 16:38:06 UTC 2025","3450","","Reports Sidebar Filter","","","","should filter by status",""
"passed","Mon Jan 27 16:47:01 UTC 2025","Mon Jan 27 16:47:04 UTC 2025","3045","","RapidPro SMS Gateway: Webapp originating messages and state updates","","","","should keep updating until record is in final state",""
"passed","Mon Jan 27 16:27:36 UTC 2025","Mon Jan 27 16:27:44 UTC 2025","8200","","Creating custom places","","","","the LHS button should show the appropriate label when only one action",""
"passed","Mon Jan 27 16:27:10 UTC 2025","Mon Jan 27 16:27:19 UTC 2025","8426","","Targets","","","","should display correct message when no target found",""
"passed","Mon Jan 27 16:37:09 UTC 2025","Mon Jan 27 16:37:16 UTC 2025","6363","","Reports Subject","","","","changes to a loaded or list report should be reflected in the UI ",""
"passed","Mon Jan 27 16:28:54 UTC 2025","Mon Jan 27 16:28:58 UTC 2025","4092","","Add new district tests : ","","","","should add new district with a new person",""
"passed","Mon Jan 27 16:45:25 UTC 2025","Mon Jan 27 16:45:27 UTC 2025","2606","","Africas Talking api: Gateway submits WT sms status updates","","","","should shows content",""
"passed","Mon Jan 27 16:42:47 UTC 2025","Mon Jan 27 16:42:48 UTC 2025","1215","","Tasks group landing page: for supervisor","","","","should not display task landing page after task completion",""
"passed","Mon Jan 27 16:31:18 UTC 2025","Mon Jan 27 16:31:20 UTC 2025","2390","","Contact details page.: Contact summary error","","","","should show error log for bad config",""
"passed","Mon Jan 27 16:34:10 UTC 2025","Mon Jan 27 16:34:18 UTC 2025","8215","","Create new lineage structure ","","","","should edit a name of the health facility",""
"passed","Mon Jan 27 16:40:10 UTC 2025","Mon Jan 27 16:40:15 UTC 2025","5004","","Target aggregates: User with one or more places assigned: Online user with one place associated","","","","should display targets of current user on home place",""
"passed","Mon Jan 27 16:42:37 UTC 2025","Mon Jan 27 16:42:41 UTC 2025","4325","","Tasks group landing page: for chw","","","","should not show page when there are no more household tasks",""
"passed","Mon Jan 27 16:33:58 UTC 2025","Mon Jan 27 16:34:02 UTC 2025","3592","","Create new lineage structure ","","","","should create new person",""
"passed","Mon Jan 27 16:38:36 UTC 2025","Mon Jan 27 16:38:40 UTC 2025","3967","","Target accuracy","","","","should save target document on first calculation",""
"passed","Mon Jan 27 16:41:13 UTC 2025","Mon Jan 27 16:41:22 UTC 2025","9360","","Task list due dates","","","","should display correct due dates with taskDaysOverdue setting",""
"passed","Mon Jan 27 16:39:29 UTC 2025","Mon Jan 27 16:39:36 UTC 2025","7682","","Target aggregates: User with one or more places assigned: Online user with one place associated","","","","should display no data when no targets are uploaded",""
"passed","Mon Jan 27 16:32:00 UTC 2025","Mon Jan 27 16:32:18 UTC 2025","17617","","Edit ","","","","should sync and update the offline user's home place",""
"passed","Mon Jan 27 16:46:56 UTC 2025","Mon Jan 27 16:46:58 UTC 2025","2566","","RapidPro SMS Gateway: Webapp originating messages and state updates","","","","should update the states correctly from messages api",""
"passed","Mon Jan 27 16:39:58 UTC 2025","Mon Jan 27 16:40:07 UTC 2025","9184","","Target aggregates: User with one or more places assigned: Online user with one place associated","","","","should route to contact-detail on list item click and display contact summary target card",""
"passed","Mon Jan 27 16:47:05 UTC 2025","Mon Jan 27 16:47:11 UTC 2025","6411","","RapidPro SMS Gateway: Webapp originating messages and state updates","","","","should poll for state updates and consume queue",""
"passed","Mon Jan 27 16:37:30 UTC 2025","Mon Jan 27 16:37:33 UTC 2025","2971","","Reports Search","","","","should return results when searching by case_id",""
"passed","Mon Jan 27 16:36:14 UTC 2025","Mon Jan 27 16:36:15 UTC 2025","1194","","Generating short codes","","","","should create case ID",""
"passed","Mon Jan 27 16:40:26 UTC 2025","Mon Jan 27 16:40:49 UTC 2025","23093","","Target aggregates: User with one or more places assigned: Offline user with multiple places associated","","","","should filter aggregates by place and period",""
"passed","Mon Jan 27 16:28:38 UTC 2025","Mon Jan 27 16:28:45 UTC 2025","7601","","Creating custom places","","","","should show custom places in their own list",""
"passed","Mon Jan 27 16:42:33 UTC 2025","Mon Jan 27 16:42:37 UTC 2025","3463","","Tasks group landing page: for chw","","","","should not display modal when clicking list task from same group",""
"passed","Mon Jan 27 16:29:26 UTC 2025","Mon Jan 27 16:29:26 UTC 2025","118","","Contact details page.: Permissions to show reports and tasks","","","","should show contact summary that has the full context for reports > 50 validate that the pregnancy card is always displayed",""
"passed","Mon Jan 27 16:47:48 UTC 2025","Mon Jan 27 16:47:51 UTC 2025","3254","","Send message","","","","should send a message using FAB at people's tab",""
"passed","Mon Jan 27 16:39:22 UTC 2025","Mon Jan 27 16:39:23 UTC 2025","654","","Target aggregates: DB admin","","","","should display an empty list when there are no aggregates",""
"passed","Mon Jan 27 16:46:38 UTC 2025","Mon Jan 27 16:46:39 UTC 2025","363","","RapidPro SMS Gateway: Webapp Terminating messages","","","","should fail with incorrect authentication",""
"passed","Mon Jan 27 16:37:05 UTC 2025","Mon Jan 27 16:37:07 UTC 2025","2292","","Reports Subject","","","","should create a report which has an unknown sender and a known subject",""
"passed","Mon Jan 27 16:34:02 UTC 2025","Mon Jan 27 16:34:09 UTC 2025","7635","","Create new lineage structure ","","","","should edit a person with a phone number",""
"passed","Mon Jan 27 16:33:53 UTC 2025","Mon Jan 27 16:33:58 UTC 2025","4578","","Create new lineage structure ","","","","should create new household",""
"passed","Mon Jan 27 16:42:24 UTC 2025","Mon Jan 27 16:42:27 UTC 2025","2820","","Tasks group landing page: for chw","","","","should display tasks group landing page after task completion",""
"passed","Mon Jan 27 16:46:10 UTC 2025","Mon Jan 27 16:46:14 UTC 2025","4653","","Message Tab - Sender Data","","","","should display messages with breadcrumbs for online user",""
"passed","Mon Jan 27 16:38:40 UTC 2025","Mon Jan 27 16:38:47 UTC 2025","6817","","Target accuracy","","","","should save target document when targets change",""
"passed","Mon Jan 27 16:33:46 UTC 2025","Mon Jan 27 16:33:49 UTC 2025","3076","","Create new lineage structure ","","","","should create new health center",""
"passed","Mon Jan 27 16:32:46 UTC 2025","Mon Jan 27 16:32:49 UTC 2025","3012","","FAB actions","","","","should show fab when user only has can_create_people permission",""
"passed","Mon Jan 27 16:46:49 UTC 2025","Mon Jan 27 16:46:51 UTC 2025","1672","","RapidPro SMS Gateway: Webapp originating messages and state updates","","","","should not call RapidPro endpoint when credentials are not set",""
"passed","Mon Jan 27 16:47:13 UTC 2025","Mon Jan 27 16:47:23 UTC 2025","9705","","RapidPro SMS Gateway: Webapp originating messages and state updates","","","","should handle rate limiting when polling",""
"passed","Mon Jan 27 16:36:51 UTC 2025","Mon Jan 27 16:36:53 UTC 2025","2007","","Reports Subject","","","","should create a report using patient name",""
"passed","Mon Jan 27 16:38:22 UTC 2025","Mon Jan 27 16:38:24 UTC 2025","2086","","Reports tab messages","","","","should generate SMS report correctly when lacking patient_id",""
"passed","Mon Jan 27 16:39:06 UTC 2025","Mon Jan 27 16:39:13 UTC 2025","6714","","Target accuracy","","","","should save target doc once when getting many changes through replication",""
"passed","Mon Jan 27 16:33:49 UTC 2025","Mon Jan 27 16:33:53 UTC 2025","4284","","Create new lineage structure ","","","","should create new area",""
"passed","Mon Jan 27 16:39:13 UTC 2025","Mon Jan 27 16:39:13 UTC 2025","83","","Target accuracy","","","","should only create one target doc",""
"passed","Mon Jan 27 16:47:45 UTC 2025","Mon Jan 27 16:47:48 UTC 2025","2756","","Send message","","","","should reply to an existing message and add a new recipient - contact with a phone number ",""
"passed","Mon Jan 27 16:43:12 UTC 2025","Mon Jan 27 16:43:24 UTC 2025","11753","","Tasks","","","","should add a task when CHW completes a task successfully, and that task creates another task",""
"passed","Mon Jan 27 16:45:58 UTC 2025","Mon Jan 27 16:46:01 UTC 2025","2503","","Link SMS to patient without passing id","","","","Send SMS without patient_id and report created under person",""
"passed","Mon Jan 27 16:46:39 UTC 2025","Mon Jan 27 16:46:39 UTC 2025","353","","RapidPro SMS Gateway: Webapp Terminating messages","","","","should fail with malformed authentication",""
"passed","Mon Jan 27 16:36:58 UTC 2025","Mon Jan 27 16:37:01 UTC 2025","2885","","Reports Subject","","","","should create a report using place_id with a shortcode",""
"passed","Mon Jan 27 16:45:49 UTC 2025","Mon Jan 27 16:45:51 UTC 2025","1241","","sms-gateway api: Gateway submits WT sms status updates","","","","should shows content",""
"passed","Mon Jan 27 16:36:48 UTC 2025","Mon Jan 27 16:36:51 UTC 2025","2949","","Reports Subject","","","","should create a report using unknown patient_id ",""
"passed","Mon Jan 27 16:41:03 UTC 2025","Mon Jan 27 16:41:13 UTC 2025","10004","","Task list due dates","","","","should display correct due dates with default settings",""
"passed","Mon Jan 27 16:40:19 UTC 2025","Mon Jan 27 16:40:21 UTC 2025","2573","","Target aggregates: User with one or more places assigned: Offline user with multiple places associated","","","","should disable content",""
"passed","Mon Jan 27 16:44:16 UTC 2025","Mon Jan 27 16:45:12 UTC 2025","56426","","Tasks","","","","Should show error message for bad config",""
"passed","Mon Jan 27 16:42:00 UTC 2025","Mon Jan 27 16:42:02 UTC 2025","2521","","Tasks tab breadcrumbs: for chw","","","","should open task with expression",""
"passed","Mon Jan 27 16:28:08 UTC 2025","Mon Jan 27 16:28:16 UTC 2025","8320","","Creating custom places","","","","the RHS button show the appropriate label when multiple places exist at the current level",""
"passed","Mon Jan 27 16:47:33 UTC 2025","Mon Jan 27 16:47:36 UTC 2025","3205","","Send message","","","","should send messages to all the contacts, under a place, that have a primary phone number assigned",""
"passed","Mon Jan 27 16:38:52 UTC 2025","Mon Jan 27 16:38:59 UTC 2025","7305","","Target accuracy","","","","should not save target document when adding report for counted contact",""
"passed","Mon Jan 27 16:46:59 UTC 2025","Mon Jan 27 16:47:01 UTC 2025","1700","","RapidPro SMS Gateway: Webapp originating messages and state updates","","","","should not poll messages for docs that are in pending or scheduled states or lack gateway ref ",""
"passed","Mon Jan 27 16:35:47 UTC 2025","Mon Jan 27 16:35:54 UTC 2025","6986","","Delete Reports","","","","Should delete report",""
"passed","Mon Jan 27 16:36:41 UTC 2025","Mon Jan 27 16:36:45 UTC 2025","3282","","Reports Subject","","","","should create a report using patient_id",""
"passed","Mon Jan 27 16:32:40 UTC 2025","Mon Jan 27 16:32:43 UTC 2025","3453","","FAB actions","","","","should show fab when user only has can_create_places permission",""
"passed","Mon Jan 27 16:37:16 UTC 2025","Mon Jan 27 16:37:18 UTC 2025","1560","","Reports Subject","","","","should create a report which does not have a subject",""
"passed","Mon Jan 27 16:42:28 UTC 2025","Mon Jan 27 16:42:33 UTC 2025","5119","","Tasks group landing page: for chw","","","","should display modal when clicking on a task from another group",""
"passed","Mon Jan 27 16:46:22 UTC 2025","Mon Jan 27 16:46:24 UTC 2025","2035","","Message Tab - Sender Data","","","","should display messages with updated breadcrumbs for offline user",""
"passed","Mon Jan 27 16:27:58 UTC 2025","Mon Jan 27 16:28:06 UTC 2025","7727","","Creating custom places","","","","the RHS button should show the action with custom label",""
"passed","Mon Jan 27 16:28:28 UTC 2025","Mon Jan 27 16:28:36 UTC 2025","8309","","Creating custom places","","","","should show the multi person actions with the correct label",""
"passed","Mon Jan 27 16:36:53 UTC 2025","Mon Jan 27 16:36:55 UTC 2025","2373","","Reports Subject","","","","should create a report using missing required patient name",""
"passed","Mon Jan 27 16:47:36 UTC 2025","Mon Jan 27 16:47:38 UTC 2025","1997","","Send message","","","","should send a message to a raw phone number",""
"passed","Mon Jan 27 16:37:41 UTC 2025","Mon Jan 27 16:37:46 UTC 2025","5102","","Reports Sidebar Filter","","","","should filter by date",""
"passed","Mon Jan 27 16:27:24 UTC 2025","Mon Jan 27 16:27:32 UTC 2025","7853","","Targets","","","","should show error message for bad config",""
"passed","Mon Jan 27 16:38:47 UTC 2025","Mon Jan 27 16:38:52 UTC 2025","5586","","Target accuracy","","","","should not save target document when editing counted contact",""
"passed","Mon Jan 27 16:31:30 UTC 2025","Mon Jan 27 16:31:40 UTC 2025","10805","","User Test Cases -> Creating Users ->","","","","should add user with multiple places with permission",""
"passed","Mon Jan 27 16:39:13 UTC 2025","Mon Jan 27 16:39:15 UTC 2025","1803","","Target accuracy","","","","should handle old format of the rules-state-store",""
"passed","Mon Jan 27 16:33:01 UTC 2025","Mon Jan 27 16:33:06 UTC 2025","4630","","Infinite scrolling","","","","should load multiple pages of contacts",""
"passed","Mon Jan 27 16:33:17 UTC 2025","Mon Jan 27 16:33:25 UTC 2025","7463","","Mute/Unmute contacts using a specific form - ","","","","should mute a contact using the defined mute_forms (death_report).",""
"passed","Mon Jan 27 16:42:27 UTC 2025","Mon Jan 27 16:42:28 UTC 2025","1182","","Tasks group landing page: for chw","","","","should open task from the same group",""
"passed","Mon Jan 27 16:27:46 UTC 2025","Mon Jan 27 16:27:56 UTC 2025","10441","","Creating custom places","","","","the LHS button should show the appropriate label when multiple places exist at the current level",""
"passed","Mon Jan 27 16:47:41 UTC 2025","Mon Jan 27 16:47:42 UTC 2025","801","","Send message","","","","should reply to an existing message - contact with a phone number",""
"passed","Mon Jan 27 16:32:37 UTC 2025","Mon Jan 27 16:32:39 UTC 2025","1538","","FAB actions","","","","should show new household and new person create option",""
"passed","Mon Jan 27 16:46:36 UTC 2025","Mon Jan 27 16:46:36 UTC 2025","400","","RapidPro SMS Gateway: Webapp Terminating messages","","","","should fail with no incoming key configured",""
"passed","Mon Jan 27 16:41:22 UTC 2025","Mon Jan 27 16:41:33 UTC 2025","10666","","Task list due dates","","","","should display correct due dates with taskDaysOverdue setting and simple translation",""
"passed","Mon Jan 27 16:32:23 UTC 2025","Mon Jan 27 16:32:29 UTC 2025","6035","","Export Contacts ","","","","should download export file",""
