"Status","Start Time","Stop Time","Duration in ms","Parent Suite","Suite","Sub Suite","Test Class","Test Method","Name","Description"
"passed","Fri Nov 22 17:44:26 UTC 2024","Fri Nov 22 17:44:34 UTC 2024","7980","","Creating custom places","","","","should show the single add person button with the correct label",""
"passed","Fri Nov 22 17:51:07 UTC 2024","Fri Nov 22 17:51:11 UTC 2024","3124","","Create new lineage structure ","","","","should create new health center",""
"passed","Fri Nov 22 17:54:07 UTC 2024","Fri Nov 22 17:54:10 UTC 2024","2651","","Reports Subject","","","","should create a report using missing required patient name",""
"passed","Fri Nov 22 17:49:33 UTC 2024","Fri Nov 22 17:49:34 UTC 2024","1557","","FAB actions","","","","should show new household and new person create option",""
"passed","Fri Nov 22 18:07:16 UTC 2024","Fri Nov 22 18:07:19 UTC 2024","2577","","RapidPro SMS Gateway: Webapp originating messages and state updates","","","","should update the states correctly from messages api",""
"passed","Fri Nov 22 17:52:25 UTC 2024","Fri Nov 22 17:52:26 UTC 2024","603","","Contact Search","","","","search should clear RHS selected contact",""
"passed","Fri Nov 22 18:07:26 UTC 2024","Fri Nov 22 18:07:33 UTC 2024","6694","","RapidPro SMS Gateway: Webapp originating messages and state updates","","","","should poll for state updates and consume queue",""
"passed","Fri Nov 22 17:55:10 UTC 2024","Fri Nov 22 17:55:14 UTC 2024","3643","","Reports Sidebar Filter","","","","should filter by place",""
"passed","Fri Nov 22 17:54:55 UTC 2024","Fri Nov 22 17:55:00 UTC 2024","4994","","Reports Sidebar Filter","","","","should filter by date",""
"passed","Fri Nov 22 18:05:49 UTC 2024","Fri Nov 22 18:05:52 UTC 2024","3039","","Africas Talking api: Gateway submits new WT sms messages","","","","should shows content",""
"passed","Fri Nov 22 18:06:24 UTC 2024","Fri Nov 22 18:06:26 UTC 2024","2242","","Link SMS to patient without passing id","","","","Send SMS without patient_id and report created under person",""
"passed","Fri Nov 22 17:48:19 UTC 2024","Fri Nov 22 17:48:21 UTC 2024","2285","","Contact details page.: Contact summary error","","","","should show error log for bad config",""
"passed","Fri Nov 22 18:06:16 UTC 2024","Fri Nov 22 18:06:17 UTC 2024","919","","sms-gateway api: api returns list of pending WO messages","","","","should returns list and updates state",""
"passed","Fri Nov 22 18:01:19 UTC 2024","Fri Nov 22 18:01:23 UTC 2024","4041","","Tasks group landing page: for chw","","","","should display modal when clicking on a task from another group",""
"passed","Fri Nov 22 17:55:52 UTC 2024","Fri Nov 22 17:55:59 UTC 2024","7275","","Target accuracy","","","","should save target document when targets change",""
"passed","Fri Nov 22 18:06:15 UTC 2024","Fri Nov 22 18:06:16 UTC 2024","1256","","sms-gateway api: Gateway submits WT sms status updates","","","","should shows content",""
"passed","Fri Nov 22 17:56:40 UTC 2024","Fri Nov 22 17:56:48 UTC 2024","8455","","Target aggregates: User with one or more places assigned: Online user with one place associated","","","","should display no data when no targets are uploaded",""
"passed","Fri Nov 22 17:55:35 UTC 2024","Fri Nov 22 17:55:37 UTC 2024","2126","","Reports tab messages","","","","should generate SMS report correctly when lacking patient_id",""
"passed","Fri Nov 22 17:54:05 UTC 2024","Fri Nov 22 17:54:07 UTC 2024","2047","","Reports Subject","","","","should create a report using patient name",""
"passed","Fri Nov 22 17:51:32 UTC 2024","Fri Nov 22 17:51:40 UTC 2024","8246","","Create new lineage structure ","","","","should edit a name of the health facility",""
"passed","Fri Nov 22 17:52:38 UTC 2024","Fri Nov 22 17:52:41 UTC 2024","2803","","Reports tab breadcrumbs","","","","should not remove facility from breadcrumbs when offline user has many facilities associated",""
"passed","Fri Nov 22 17:54:00 UTC 2024","Fri Nov 22 17:54:02 UTC 2024","2679","","Reports Subject","","","","should create a report using doc id",""
"passed","Fri Nov 22 17:49:42 UTC 2024","Fri Nov 22 17:49:45 UTC 2024","3037","","FAB actions","","","","should show fab when user only has can_create_people permission",""
"passed","Fri Nov 22 18:06:34 UTC 2024","Fri Nov 22 18:06:39 UTC 2024","5004","","Message Tab - Sender Data","","","","should display messages with breadcrumbs for online user",""
"passed","Fri Nov 22 17:56:05 UTC 2024","Fri Nov 22 17:56:12 UTC 2024","7357","","Target accuracy","","","","should not save target document when adding report for counted contact",""
"passed","Fri Nov 22 18:07:22 UTC 2024","Fri Nov 22 18:07:26 UTC 2024","3555","","RapidPro SMS Gateway: Webapp originating messages and state updates","","","","should keep updating until record is in final state",""
"passed","Fri Nov 22 18:07:07 UTC 2024","Fri Nov 22 18:07:10 UTC 2024","2866","","RapidPro SMS Gateway: Webapp Terminating messages","","","","should create reports",""
"passed","Fri Nov 22 18:06:59 UTC 2024","Fri Nov 22 18:07:00 UTC 2024","344","","RapidPro SMS Gateway: Webapp Terminating messages","","","","should fail with no incoming key configured",""
"passed","Fri Nov 22 17:51:16 UTC 2024","Fri Nov 22 17:51:20 UTC 2024","4291","","Create new lineage structure ","","","","should create new household",""
"passed","Fri Nov 22 18:07:20 UTC 2024","Fri Nov 22 18:07:21 UTC 2024","1724","","RapidPro SMS Gateway: Webapp originating messages and state updates","","","","should not poll messages for docs that are in pending or scheduled states or lack gateway ref ",""
"passed","Fri Nov 22 18:08:00 UTC 2024","Fri Nov 22 18:08:02 UTC 2024","2466","","Send message","","","","should send a message to a raw phone number",""
"passed","Fri Nov 22 17:56:12 UTC 2024","Fri Nov 22 17:56:19 UTC 2024","6781","","Target accuracy","","","","should save target document when deleting counted contact",""
"passed","Fri Nov 22 17:55:16 UTC 2024","Fri Nov 22 17:55:20 UTC 2024","3513","","Reports Sidebar Filter","","","","should filter by status",""
"passed","Fri Nov 22 17:53:15 UTC 2024","Fri Nov 22 17:53:21 UTC 2024","5980","","Export Reports","","","","should download export file",""
"passed","Fri Nov 22 17:50:12 UTC 2024","Fri Nov 22 17:50:19 UTC 2024","7727","","Mute/Unmute contacts using a specific form - ","","","","should mute a contact using the defined mute_forms (death_report).",""
"passed","Fri Nov 22 17:45:30 UTC 2024","Fri Nov 22 17:45:33 UTC 2024","3311","","Contact details page.: Permissions to show reports and tasks","","","","should show reports and tasks when permissions are enabled",""
"passed","Fri Nov 22 18:04:21 UTC 2024","Fri Nov 22 18:05:39 UTC 2024","78106","","Tasks","","","","Should show error message for bad config",""
"passed","Fri Nov 22 17:58:41 UTC 2024","Fri Nov 22 17:59:16 UTC 2024","35167","","Task list due dates","","","","should display correct due dates with default settings",""
"passed","Fri Nov 22 18:08:08 UTC 2024","Fri Nov 22 18:08:11 UTC 2024","2614","","Send message","","","","should reply to an existing message and add a new recipient - contact with a phone number ",""
"passed","Fri Nov 22 17:56:19 UTC 2024","Fri Nov 22 17:56:25 UTC 2024","6410","","Target accuracy","","","","should save target doc once when getting many changes through replication",""
"passed","Fri Nov 22 18:07:00 UTC 2024","Fri Nov 22 18:07:01 UTC 2024","396","","RapidPro SMS Gateway: Webapp Terminating messages","","","","should fail with no authentication provided",""
"passed","Fri Nov 22 17:48:49 UTC 2024","Fri Nov 22 17:48:59 UTC 2024","10706","","Edit ","","","","should update a contact, delete the same contact then unassign primary contact from facility",""
"passed","Fri Nov 22 17:54:02 UTC 2024","Fri Nov 22 17:54:05 UTC 2024","2596","","Reports Subject","","","","should create a report using unknown patient_id ",""
"passed","Fri Nov 22 18:01:23 UTC 2024","Fri Nov 22 18:01:26 UTC 2024","3507","","Tasks group landing page: for chw","","","","should not display modal when clicking list task from same group",""
"passed","Fri Nov 22 17:43:07 UTC 2024","Fri Nov 22 17:43:40 UTC 2024","32885","","Targets","","","","should show error message for bad config",""
"passed","Fri Nov 22 17:52:55 UTC 2024","Fri Nov 22 17:52:59 UTC 2024","4262","","Bulk delete reports","","","","should select, deselect and delete only selected reports",""
"passed","Fri Nov 22 18:01:14 UTC 2024","Fri Nov 22 18:01:18 UTC 2024","3689","","Tasks group landing page: for chw","","","","should display tasks group landing page after task completion",""
"passed","Fri Nov 22 18:05:52 UTC 2024","Fri Nov 22 18:05:54 UTC 2024","2725","","Africas Talking api: Gateway submits WT sms status updates","","","","should shows content",""
"passed","Fri Nov 22 17:50:19 UTC 2024","Fri Nov 22 17:50:27 UTC 2024","7464","","Mute/Unmute contacts using a specific form - ","","","","should unmute a contact using the defined unmute_forms (undo_death_report).",""
"passed","Fri Nov 22 17:51:40 UTC 2024","Fri Nov 22 17:51:43 UTC 2024","3188","","Create new lineage structure ","","","","should delete the primary contact of health facility",""
"passed","Fri Nov 22 17:55:59 UTC 2024","Fri Nov 22 17:56:05 UTC 2024","5747","","Target accuracy","","","","should not save target document when editing counted contact",""
"passed","Fri Nov 22 17:52:06 UTC 2024","Fri Nov 22 17:52:16 UTC 2024","10449","","Create Person Under Area, ","","","","should create person under area should only see children",""
"passed","Fri Nov 22 17:54:16 UTC 2024","Fri Nov 22 17:54:19 UTC 2024","2645","","Reports Subject","","","","should create a report using unknown place_id",""
"passed","Fri Nov 22 17:56:35 UTC 2024","Fri Nov 22 17:56:36 UTC 2024","1292","","Target aggregates: DB admin","","","","should display an error when there are aggregates but no home place",""
"passed","Fri Nov 22 17:57:35 UTC 2024","Fri Nov 22 17:58:28 UTC 2024","52520","","Target aggregates: User with one or more places assigned: Offline user with multiple places associated","","","","should filter aggregates by place and period",""
"passed","Fri Nov 22 18:07:35 UTC 2024","Fri Nov 22 18:07:44 UTC 2024","9375","","RapidPro SMS Gateway: Webapp originating messages and state updates","","","","should handle rate limiting when polling",""
"passed","Fri Nov 22 17:55:22 UTC 2024","Fri Nov 22 17:55:26 UTC 2024","3373","","Reports Sidebar Filter","","","","should filter by user associated place when the permission to default filter is enabled",""
"passed","Fri Nov 22 17:57:32 UTC 2024","Fri Nov 22 17:57:34 UTC 2024","1081","","Target aggregates: User with one or more places assigned: Offline user with multiple places associated","","","","should display only the targets sections and show the correct message when target aggregates are disabled",""
"passed","Fri Nov 22 17:42:37 UTC 2024","Fri Nov 22 17:43:07 UTC 2024","29639","","Targets","","","","should display correct message when targets are disabled",""
"passed","Fri Nov 22 18:03:04 UTC 2024","Fri Nov 22 18:04:03 UTC 2024","58629","","Tasks","","","","should load multiple pages of tasks on infinite scrolling",""
"passed","Fri Nov 22 17:51:11 UTC 2024","Fri Nov 22 17:51:15 UTC 2024","4684","","Create new lineage structure ","","","","should create new area",""
"passed","Fri Nov 22 17:42:01 UTC 2024","Fri Nov 22 17:42:03 UTC 2024","1660","","Targets","","","","should display targets from default config",""
"passed","Fri Nov 22 17:54:45 UTC 2024","Fri Nov 22 17:54:48 UTC 2024","3101","","Reports Search","","","","should return results when searching by case_id",""
"passed","Fri Nov 22 17:57:29 UTC 2024","Fri Nov 22 17:57:31 UTC 2024","2092","","Target aggregates: User with one or more places assigned: Offline user with multiple places associated","","","","should disable content",""
"passed","Fri Nov 22 17:48:30 UTC 2024","Fri Nov 22 17:48:41 UTC 2024","10798","","User Test Cases -> Creating Users ->","","","","should add user with multiple places with permission",""
"passed","Fri Nov 22 18:07:02 UTC 2024","Fri Nov 22 18:07:02 UTC 2024","300","","RapidPro SMS Gateway: Webapp Terminating messages","","","","should fail with malformed authentication",""
"passed","Fri Nov 22 18:01:26 UTC 2024","Fri Nov 22 18:01:28 UTC 2024","2180","","Tasks group landing page: for chw","","","","should not show page when there are no more household tasks",""
"passed","Fri Nov 22 17:44:16 UTC 2024","Fri Nov 22 17:44:25 UTC 2024","9025","","Creating custom places","","","","the RHS button show the appropriate label when multiple places exist at the current level",""
"passed","Fri Nov 22 17:53:39 UTC 2024","Fri Nov 22 17:53:46 UTC 2024","6359","","Infinite scrolling","","","","should load multiple pages of reports",""
"passed","Fri Nov 22 17:54:13 UTC 2024","Fri Nov 22 17:54:16 UTC 2024","2928","","Reports Subject","","","","should create a report using place_id with a shortcode",""
"passed","Fri Nov 22 18:06:13 UTC 2024","Fri Nov 22 18:06:15 UTC 2024","1544","","sms-gateway api: Gateway submits new WT sms messages","","","","should shows content",""
"passed","Fri Nov 22 18:01:36 UTC 2024","Fri Nov 22 18:01:38 UTC 2024","1474","","Tasks group landing page: for supervisor","","","","should not display task landing page after task completion",""
"passed","Fri Nov 22 18:00:50 UTC 2024","Fri Nov 22 18:00:53 UTC 2024","2281","","Tasks tab breadcrumbs: for chw","","","","should open task with expression",""
"passed","Fri Nov 22 18:06:50 UTC 2024","Fri Nov 22 18:06:52 UTC 2024","1977","","Message Tab - Sender Data","","","","should display conversation with link and navigate to contact",""
"passed","Fri Nov 22 17:43:56 UTC 2024","Fri Nov 22 17:44:05 UTC 2024","9167","","Creating custom places","","","","the LHS button should show the appropriate label when multiple places exist at the current level",""
"passed","Fri Nov 22 17:43:45 UTC 2024","Fri Nov 22 17:43:54 UTC 2024","9402","","Creating custom places","","","","the LHS button should show the appropriate label when only one action",""
"passed","Fri Nov 22 17:45:07 UTC 2024","Fri Nov 22 17:45:10 UTC 2024","3228","","Add new district tests : ","","","","should edit district",""
"passed","Fri Nov 22 17:51:24 UTC 2024","Fri Nov 22 17:51:31 UTC 2024","7787","","Create new lineage structure ","","","","should edit a person with a phone number",""
"passed","Fri Nov 22 17:52:24 UTC 2024","Fri Nov 22 17:52:25 UTC 2024","954","","Contact Search","","","","search by NON empty string should display results with contains match and clears search",""
"passed","Fri Nov 22 18:08:05 UTC 2024","Fri Nov 22 18:08:06 UTC 2024","1183","","Send message","","","","should reply to an existing message - contact with a phone number",""
"passed","Fri Nov 22 17:52:43 UTC 2024","Fri Nov 22 17:52:46 UTC 2024","2792","","Reports tab breadcrumbs","","","","should display reports with updated breadcrumbs for offline user",""
"passed","Fri Nov 22 18:06:03 UTC 2024","Fri Nov 22 18:06:06 UTC 2024","3544","","Export Messages","","","","should download export file",""
"passed","Fri Nov 22 17:57:09 UTC 2024","Fri Nov 22 17:57:17 UTC 2024","8482","","Target aggregates: User with one or more places assigned: Online user with one place associated","","","","should route to contact-detail on list item click and display contact summary target card",""
"passed","Fri Nov 22 18:07:03 UTC 2024","Fri Nov 22 18:07:03 UTC 2024","308","","RapidPro SMS Gateway: Webapp Terminating messages","","","","should fail when message was not created",""
"passed","Fri Nov 22 18:01:48 UTC 2024","Fri Nov 22 18:02:24 UTC 2024","36779","","Tasks","","","","should remove task from list when CHW completes a task successfully",""
"passed","Fri Nov 22 17:44:07 UTC 2024","Fri Nov 22 17:44:14 UTC 2024","7430","","Creating custom places","","","","the RHS button should show the action with custom label",""
"passed","Fri Nov 22 17:53:56 UTC 2024","Fri Nov 22 17:53:59 UTC 2024","3247","","Reports Subject","","","","should create a report using patient_id",""
"passed","Fri Nov 22 17:59:51 UTC 2024","Fri Nov 22 18:00:27 UTC 2024","35806","","Task list due dates","","","","should display correct due dates with taskDaysOverdue setting and simple translation",""
"passed","Fri Nov 22 17:54:10 UTC 2024","Fri Nov 22 17:54:13 UTC 2024","2576","","Reports Subject","","","","should create a report using place_id with a place_uuid",""
"passed","Fri Nov 22 18:01:34 UTC 2024","Fri Nov 22 18:01:36 UTC 2024","2163","","Tasks group landing page: for supervisor","","","","should have tasks",""
"passed","Fri Nov 22 17:55:04 UTC 2024","Fri Nov 22 17:55:08 UTC 2024","3875","","Reports Sidebar Filter","","","","should filter by form",""
"passed","Fri Nov 22 17:56:51 UTC 2024","Fri Nov 22 17:57:06 UTC 2024","14723","","Target aggregates: User with one or more places assigned: Online user with one place associated","","","","should display correct data",""
"passed","Fri Nov 22 17:44:36 UTC 2024","Fri Nov 22 17:44:45 UTC 2024","8830","","Creating custom places","","","","should show the multi person actions with the correct label",""
"passed","Fri Nov 22 17:45:33 UTC 2024","Fri Nov 22 17:45:33 UTC 2024","113","","Contact details page.: Permissions to show reports and tasks","","","","should show contact summary that has the full context for reports > 50 validate that the pregnancy card is always displayed",""
"passed","Fri Nov 22 17:54:24 UTC 2024","Fri Nov 22 17:54:30 UTC 2024","6258","","Reports Subject","","","","changes to a loaded or list report should be reflected in the UI ",""
"passed","Fri Nov 22 17:51:20 UTC 2024","Fri Nov 22 17:51:23 UTC 2024","3343","","Create new lineage structure ","","","","should create new person",""
"passed","Fri Nov 22 18:08:06 UTC 2024","Fri Nov 22 18:08:08 UTC 2024","2241","","Send message","","","","should reply to an existing message and add a new recipient - raw phone number ",""
"passed","Fri Nov 22 18:07:13 UTC 2024","Fri Nov 22 18:07:14 UTC 2024","922","","RapidPro SMS Gateway: Webapp originating messages and state updates","","","","should call endpoint with set credentials",""
"passed","Fri Nov 22 17:54:42 UTC 2024","Fri Nov 22 17:54:45 UTC 2024","3289","","Reports Search","","","","should return results matching the search term and then return all data when clearing search",""
"passed","Fri Nov 22 17:59:16 UTC 2024","Fri Nov 22 17:59:51 UTC 2024","34948","","Task list due dates","","","","should display correct due dates with taskDaysOverdue setting",""
"passed","Fri Nov 22 17:53:29 UTC 2024","Fri Nov 22 17:53:30 UTC 2024","1191","","Generating short codes","","","","should create case ID",""
"passed","Fri Nov 22 18:01:13 UTC 2024","Fri Nov 22 18:01:14 UTC 2024","774","","Tasks group landing page: for chw","","","","should have tasks",""
"passed","Fri Nov 22 17:56:34 UTC 2024","Fri Nov 22 17:56:35 UTC 2024","488","","Target aggregates: DB admin","","","","should display an empty list when there are no aggregates",""
"passed","Fri Nov 22 17:49:57 UTC 2024","Fri Nov 22 17:50:01 UTC 2024","4485","","Infinite scrolling","","","","should load multiple pages of contacts",""
"passed","Fri Nov 22 18:00:42 UTC 2024","Fri Nov 22 18:00:45 UTC 2024","3173","","Tasks tab breadcrumbs: for chw","","","","should not remove facility from breadcrumbs when offline user has many facilities associated",""
"passed","Fri Nov 22 17:42:03 UTC 2024","Fri Nov 22 17:42:37 UTC 2024","33804","","Targets","","","","should display correct message when no target found",""
"passed","Fri Nov 22 17:49:36 UTC 2024","Fri Nov 22 17:49:39 UTC 2024","3522","","FAB actions","","","","should show fab when user only has can_create_places permission",""
"passed","Fri Nov 22 17:50:27 UTC 2024","Fri Nov 22 17:51:01 UTC 2024","33798","","Mute/Unmute contacts using a specific form - ","","","","should show a popup when trying to submit a non-unmuting form against a muted contact",""
"passed","Fri Nov 22 17:53:03 UTC 2024","Fri Nov 22 17:53:10 UTC 2024","6506","","Delete Reports","","","","Should delete report",""
"passed","Fri Nov 22 17:44:47 UTC 2024","Fri Nov 22 17:44:55 UTC 2024","7992","","Creating custom places","","","","should show custom places in their own list",""
"passed","Fri Nov 22 17:45:03 UTC 2024","Fri Nov 22 17:45:06 UTC 2024","3703","","Add new district tests : ","","","","should add new district with a new person",""
"passed","Fri Nov 22 18:07:04 UTC 2024","Fri Nov 22 18:07:06 UTC 2024","2769","","RapidPro SMS Gateway: Webapp Terminating messages","","","","should create messages",""
"passed","Fri Nov 22 17:45:33 UTC 2024","Fri Nov 22 17:46:26 UTC 2024","52839","","Contact details page.: Permissions to show reports and tasks","","","","should not show reports when permission is disabled",""
"passed","Fri Nov 22 17:52:33 UTC 2024","Fri Nov 22 17:52:36 UTC 2024","2687","","Reports tab breadcrumbs","","","","should display reports with breadcrumbs for online user",""
"passed","Fri Nov 22 17:56:25 UTC 2024","Fri Nov 22 17:56:25 UTC 2024","71","","Target accuracy","","","","should only create one target doc",""
"passed","Fri Nov 22 18:01:28 UTC 2024","Fri Nov 22 18:01:32 UTC 2024","3524","","Tasks group landing page: for chw","","","","should not show page when submitting task for contact with no leaf type place in lineage",""
"passed","Fri Nov 22 18:07:14 UTC 2024","Fri Nov 22 18:07:16 UTC 2024","1405","","RapidPro SMS Gateway: Webapp originating messages and state updates","","","","should set correct states from broadcast api",""
"passed","Fri Nov 22 18:02:26 UTC 2024","Fri Nov 22 18:03:03 UTC 2024","36822","","Tasks","","","","should add a task when CHW completes a task successfully, and that task creates another task",""
"passed","Fri Nov 22 17:45:11 UTC 2024","Fri Nov 22 17:45:15 UTC 2024","4103","","Add new district tests : ","","","","should edit district with contact_type",""
"passed","Fri Nov 22 17:46:26 UTC 2024","Fri Nov 22 17:47:29 UTC 2024","63507","","Contact details page.: Permissions to show reports and tasks","","","","should not show tasks when permission is disabled",""
"passed","Fri Nov 22 17:51:52 UTC 2024","Fri Nov 22 17:51:59 UTC 2024","7305","","Create new lineage structure ","","","","should edit the name of the Family",""
"passed","Fri Nov 22 18:07:11 UTC 2024","Fri Nov 22 18:07:12 UTC 2024","1655","","RapidPro SMS Gateway: Webapp originating messages and state updates","","","","should not call RapidPro endpoint when credentials are not set",""
"passed","Fri Nov 22 18:06:47 UTC 2024","Fri Nov 22 18:06:49 UTC 2024","1811","","Message Tab - Sender Data","","","","should display messages with updated breadcrumbs for offline user",""
"passed","Fri Nov 22 17:54:22 UTC 2024","Fri Nov 22 17:54:24 UTC 2024","2320","","Reports Subject","","","","should create a report which has an unknown sender with no phone number",""
"passed","Fri Nov 22 18:08:04 UTC 2024","Fri Nov 22 18:08:05 UTC 2024","731","","Send message","","","","should reply to an existing message - raw phone number",""
"passed","Fri Nov 22 18:01:18 UTC 2024","Fri Nov 22 18:01:19 UTC 2024","1110","","Tasks group landing page: for chw","","","","should open task from the same group",""
"passed","Fri Nov 22 18:08:11 UTC 2024","Fri Nov 22 18:08:14 UTC 2024","2968","","Send message","","","","should send a message using FAB at people's tab",""
"passed","Fri Nov 22 17:54:19 UTC 2024","Fri Nov 22 17:54:21 UTC 2024","2408","","Reports Subject","","","","should create a report which has an unknown sender and a known subject",""
"passed","Fri Nov 22 17:51:43 UTC 2024","Fri Nov 22 17:51:51 UTC 2024","8190","","Create new lineage structure ","","","","should edit the name of the CHW area",""
"passed","Fri Nov 22 18:08:02 UTC 2024","Fri Nov 22 18:08:04 UTC 2024","1933","","Send message","","","","should send a message to a contact with a phone number",""
"passed","Fri Nov 22 17:56:25 UTC 2024","Fri Nov 22 17:56:27 UTC 2024","1770","","Target accuracy","","","","should handle old format of the rules-state-store",""
"passed","Fri Nov 22 17:57:20 UTC 2024","Fri Nov 22 17:57:25 UTC 2024","5100","","Target aggregates: User with one or more places assigned: Online user with one place associated","","","","should display targets of current user on home place",""
"passed","Fri Nov 22 18:00:46 UTC 2024","Fri Nov 22 18:00:49 UTC 2024","2839","","Tasks tab breadcrumbs: for chw","","","","should display correct tasks with breadcrumbs for chw",""
"passed","Fri Nov 22 18:07:01 UTC 2024","Fri Nov 22 18:07:02 UTC 2024","342","","RapidPro SMS Gateway: Webapp Terminating messages","","","","should fail with incorrect authentication",""
"passed","Fri Nov 22 17:49:20 UTC 2024","Fri Nov 22 17:49:25 UTC 2024","5223","","Export Contacts ","","","","should download export file",""
"passed","Fri Nov 22 17:55:48 UTC 2024","Fri Nov 22 17:55:52 UTC 2024","3813","","Target accuracy","","","","should save target document on first calculation",""
"passed","Fri Nov 22 17:54:31 UTC 2024","Fri Nov 22 17:54:33 UTC 2024","2059","","Reports Subject","","","","should create a report which does not have a subject",""
"passed","Fri Nov 22 18:00:56 UTC 2024","Fri Nov 22 18:00:57 UTC 2024","1348","","Tasks tab breadcrumbs: for supervisor","","","","should display correct tasks with breadcrumbs for supervisor",""
"passed","Fri Nov 22 18:07:54 UTC 2024","Fri Nov 22 18:08:00 UTC 2024","6100","","Send message","","","","should send messages to all the contacts, under a place, that have a primary phone number assigned",""
"passed","Fri Nov 22 17:48:59 UTC 2024","Fri Nov 22 17:49:15 UTC 2024","15296","","Edit ","","","","should sync and update the offline user's home place",""
"passed","Fri Nov 22 18:06:41 UTC 2024","Fri Nov 22 18:06:45 UTC 2024","4502","","Message Tab - Sender Data","","","","should not remove facility from breadcrumbs when offline user has many facilities associated",""
