"Status","Start Time","Stop Time","Duration in ms","Parent Suite","Suite","Sub Suite","Test Class","Test Method","Name","Description"
"passed","Tue Jun 13 22:57:41 UTC 2023","Tue Jun 13 22:58:32 UTC 2023","50718","","Create user for contacts: user replace: for an offline user","","Create user for contacts: user replace: for an offline user","creates new user for the first version of a contact to sync and conflicting replacements ignored","creates new user for the first version of a contact to sync and conflicting replacements ignored",""
"passed","Tue Jun 13 22:35:38 UTC 2023","Tue Jun 13 22:35:41 UTC 2023","3495","","Login page funcionality tests: Log in","","Login page funcionality tests: Log in","should try to sign in and verify that credentials were incorrect","should try to sign in and verify that credentials were incorrect",""
"passed","Tue Jun 13 22:53:46 UTC 2023","Tue Jun 13 22:54:00 UTC 2023","14326","","Create user when adding contact","","Create user when adding contact","Does not create a new user when editing contact","Does not create a new user when editing contact",""
"passed","Tue Jun 13 22:56:21 UTC 2023","Tue Jun 13 22:57:12 UTC 2023","50511","","Create user for contacts: user replace: for an offline user","","Create user for contacts: user replace: for an offline user","creates new user from latest replace_user form data if multiple are submitted before syncing","creates new user from latest replace_user form data if multiple are submitted before syncing",""
"passed","Tue Jun 13 22:21:15 UTC 2023","Tue Jun 13 22:21:22 UTC 2023","7148","","Create new lineage structure","","Create new lineage structure","should edit the name of the CHW area","should edit the name of the CHW area",""
"passed","Tue Jun 13 22:17:31 UTC 2023","Tue Jun 13 22:17:43 UTC 2023","12622","","Creating custom places","","Creating custom places","should show the single add person button with the correct label","should show the single add person button with the correct label",""
"passed","Tue Jun 13 22:35:14 UTC 2023","Tue Jun 13 22:35:19 UTC 2023","4501","","Login page funcionality tests: Log in","","Login page funcionality tests: Log in","should log in using username and password fields","should log in using username and password fields",""
"passed","Tue Jun 13 22:39:09 UTC 2023","Tue Jun 13 22:39:11 UTC 2023","1680","","Navigation tests: Navigation functionality","","Navigation tests: Navigation functionality","should open tasks tab","should open tasks tab",""
"passed","Tue Jun 13 22:53:09 UTC 2023","Tue Jun 13 22:53:20 UTC 2023","10914","","Create user when adding contact","","Create user when adding contact","Does not create a new user when the transition is disabled","Does not create a new user when the transition is disabled",""
"passed","Tue Jun 13 22:49:40 UTC 2023","Tue Jun 13 22:49:49 UTC 2023","9304","","Target aggregates: as a user with a home place","","Target aggregates: as a user with a home place","should display no data when no targets are uploaded","should display no data when no targets are uploaded",""
"passed","Tue Jun 13 22:40:23 UTC 2023","Tue Jun 13 22:40:26 UTC 2023","3075","","Privacy policy: for an online user","","Privacy policy: for an online user","should show if the user policy changes","should show if the user policy changes",""
"passed","Tue Jun 13 22:48:09 UTC 2023","Tue Jun 13 22:48:12 UTC 2023","3008","","RapidPro SMS Gateway: Webapp originating messages and state updates","","RapidPro SMS Gateway: Webapp originating messages and state updates","should not call RapidPro endpoint when credentials are not set","should not call RapidPro endpoint when credentials are not set",""
"passed","Tue Jun 13 22:36:05 UTC 2023","Tue Jun 13 22:36:07 UTC 2023","1529","","Token login","","Token login","should display an error with incorrect url","should display an error with incorrect url",""
"passed","Tue Jun 13 22:23:34 UTC 2023","Tue Jun 13 22:23:36 UTC 2023","1935","","db-sync","","db-sync","should filter resources, service-worker, forms, translations, branding, partners docs","should filter resources, service-worker, forms, translations, branding, partners docs",""
"passed","Tue Jun 13 23:01:59 UTC 2023","Tue Jun 13 23:02:00 UTC 2023","1656","","User Test Cases ->: Invalid entries -> ","","User Test Cases ->: Invalid entries -> ","should require place and contact for restricted user","should require place and contact for restricted user",""
"passed","Tue Jun 13 23:01:54 UTC 2023","Tue Jun 13 23:01:59 UTC 2023","4666","","User Test Cases ->: Invalid entries -> ","","User Test Cases ->: Invalid entries -> ","should require username","should require username",""
"passed","Tue Jun 13 22:31:25 UTC 2023","Tue Jun 13 22:31:26 UTC 2023","809","","Pregnancy registration","","Pregnancy registration","Should verify that all tasks related with the high risk pregnancy were created","Should verify that all tasks related with the high risk pregnancy were created",""
"passed","Tue Jun 13 22:50:27 UTC 2023","Tue Jun 13 22:50:35 UTC 2023","7836","","Task list due dates","","Task list due dates","should display correct due dates with taskDaysOverdue setting","should display correct due dates with taskDaysOverdue setting",""
"passed","Tue Jun 13 22:40:02 UTC 2023","Tue Jun 13 22:40:10 UTC 2023","7237","","Privacy policy: for an online user","","Privacy policy: for an online user","should show the correct privacy policy on login","should show the correct privacy policy on login",""
"passed","Tue Jun 13 22:23:56 UTC 2023","Tue Jun 13 22:25:20 UTC 2023","84065","","initial-replication","","initial-replication","should log user in","should log user in",""
"passed","Tue Jun 13 22:17:43 UTC 2023","Tue Jun 13 22:17:56 UTC 2023","13334","","Creating custom places","","Creating custom places","should show the multi person actions with the correct label","should show the multi person actions with the correct label",""
"passed","Tue Jun 13 22:18:51 UTC 2023","Tue Jun 13 22:18:57 UTC 2023","5790","","Contact details page: Permissions to show reports and tasks","","Contact details page: Permissions to show reports and tasks","should not show tasks when permission is disabled","should not show tasks when permission is disabled",""
"passed","Tue Jun 13 23:00:00 UTC 2023","Tue Jun 13 23:00:09 UTC 2023","9376","","Testing Incorrect locale","","Testing Incorrect locale","should work with incorrect locale","should work with incorrect locale",""
"passed","Tue Jun 13 22:53:20 UTC 2023","Tue Jun 13 22:53:35 UTC 2023","15046","","Create user when adding contact","","Create user when adding contact","creates a new user when contact is added from app form","creates a new user when contact is added from app form",""
"passed","Tue Jun 13 22:38:12 UTC 2023","Tue Jun 13 22:38:13 UTC 2023","1404","","Online User: Options disabled when no items - messages, contacts, people","","Online User: Options disabled when no items - messages, contacts, people"," - Contact tab"," - Contact tab",""
"passed","Tue Jun 13 22:48:25 UTC 2023","Tue Jun 13 22:48:29 UTC 2023","4534","","RapidPro SMS Gateway: Webapp originating messages and state updates","","RapidPro SMS Gateway: Webapp originating messages and state updates","should keep updating until record is in final state","should keep updating until record is in final state",""
"passed","Tue Jun 13 22:43:19 UTC 2023","Tue Jun 13 22:43:21 UTC 2023","1872","","manifest.json","","manifest.json","works without branding doc","works without branding doc",""
"passed","Tue Jun 13 22:50:49 UTC 2023","Tue Jun 13 22:50:58 UTC 2023","8020","","Tasks tab breadcrumbs","","Tasks tab breadcrumbs","""before all"" hook for Tasks tab breadcrumbs","""before all"" hook for Tasks tab breadcrumbs",""
"passed","Tue Jun 13 22:48:01 UTC 2023","Tue Jun 13 22:48:06 UTC 2023","4313","","RapidPro SMS Gateway: Webapp Terminating messages","","RapidPro SMS Gateway: Webapp Terminating messages","should create messages","should create messages",""
"passed","Tue Jun 13 23:01:01 UTC 2023","Tue Jun 13 23:01:08 UTC 2023","7171","","Adding new language","","Adding new language","should add new translations","should add new translations",""
"passed","Tue Jun 13 22:45:12 UTC 2023","Tue Jun 13 22:45:15 UTC 2023","3377","","Reports Subject","","Reports Subject","should create a report using place_id with a shortcode","should create a report using place_id with a shortcode",""
"passed","Tue Jun 13 22:20:47 UTC 2023","Tue Jun 13 22:20:52 UTC 2023","4603","","Create new lineage structure","","Create new lineage structure","Create new household","Create new household",""
"passed","Tue Jun 13 22:48:15 UTC 2023","Tue Jun 13 22:48:17 UTC 2023","2415","","RapidPro SMS Gateway: Webapp originating messages and state updates","","RapidPro SMS Gateway: Webapp originating messages and state updates","should set correct states from broadcast api","should set correct states from broadcast api",""
"passed","Tue Jun 13 22:45:05 UTC 2023","Tue Jun 13 22:45:09 UTC 2023","3360","","Reports Subject","","Reports Subject","should create a report using missing required patient name","should create a report using missing required patient name",""
"passed","Tue Jun 13 22:47:14 UTC 2023","Tue Jun 13 22:47:15 UTC 2023","1311","","sms-gateway api: - gateway submits WT sms status updates","","sms-gateway api: - gateway submits WT sms status updates","- shows content","- shows content",""
"passed","Tue Jun 13 22:49:13 UTC 2023","Tue Jun 13 22:49:15 UTC 2023","1599","","Send message","","Send message","should reply to an existing message - contact with a phone number","should reply to an existing message - contact with a phone number",""
"passed","Tue Jun 13 22:20:55 UTC 2023","Tue Jun 13 22:21:03 UTC 2023","7462","","Create new lineage structure","","Create new lineage structure","should edit a person with a phone number","should edit a person with a phone number",""
"passed","Tue Jun 13 22:46:55 UTC 2023","Tue Jun 13 22:47:03 UTC 2023","8413","","Export Messages","","Export Messages","Should download export file","Should download export file",""
"passed","Tue Jun 13 22:18:46 UTC 2023","Tue Jun 13 22:18:51 UTC 2023","4745","","Contact details page: Permissions to show reports and tasks","","Contact details page: Permissions to show reports and tasks","should not show reports when permission is disabled","should not show reports when permission is disabled",""
"passed","Tue Jun 13 22:29:20 UTC 2023","Tue Jun 13 22:29:26 UTC 2023","6567","","Edit report with attachmnet","","Edit report with attachmnet","should save edits","should save edits",""
"passed","Tue Jun 13 22:16:49 UTC 2023","Tue Jun 13 22:17:04 UTC 2023","14264","","Creating custom places","","Creating custom places","the LHS button should show the appropriate label when multiple places exist at the current level","the LHS button should show the appropriate label when multiple places exist at the current level",""
"passed","Tue Jun 13 22:38:17 UTC 2023","Tue Jun 13 22:38:25 UTC 2023","8099","","Online User:  - Options enabled when there are items","","Online User:  - Options enabled when there are items","- Reports tab - Edit/export invisible when NON XML report selected","- Reports tab - Edit/export invisible when NON XML report selected",""
"passed","Tue Jun 13 22:49:08 UTC 2023","Tue Jun 13 22:49:12 UTC 2023","3244","","Send message","","Send message","should send a message to a contact with a phone number","should send a message to a contact with a phone number",""
"passed","Tue Jun 13 22:32:49 UTC 2023","Tue Jun 13 22:32:57 UTC 2023","7750","","Submit Photo Upload form","","Submit Photo Upload form","submit and edit (no changes)","submit and edit (no changes)",""
"passed","Tue Jun 13 22:45:19 UTC 2023","Tue Jun 13 22:45:22 UTC 2023","3185","","Reports Subject","","Reports Subject","should create a report which has an unknown sender and a known subject","should create a report which has an unknown sender and a known subject",""
"passed","Tue Jun 13 22:48:56 UTC 2023","Tue Jun 13 22:49:06 UTC 2023","10076","","Send message","","Send message","should send messages to all the contacts, under a place, that have a primary phone number assigned","should send messages to all the contacts, under a place, that have a primary phone number assigned",""
"passed","Tue Jun 13 22:22:03 UTC 2023","Tue Jun 13 22:22:05 UTC 2023","1817","","Test Contact Search Functionality","","Test Contact Search Functionality","search should clear RHS selected contact","search should clear RHS selected contact",""
"passed","Tue Jun 13 23:00:42 UTC 2023","Tue Jun 13 23:00:43 UTC 2023","999","","Bikram Sambat date display","","Bikram Sambat date display","should convert contact summary dates to bikram sambat when language is Nepali","should convert contact summary dates to bikram sambat when language is Nepali",""
"passed","Tue Jun 13 22:47:11 UTC 2023","Tue Jun 13 22:47:14 UTC 2023","2292","","sms-gateway api: - gateway submits new WT sms messages","","sms-gateway api: - gateway submits new WT sms messages","shows content","shows content",""
"passed","Tue Jun 13 22:50:12 UTC 2023","Tue Jun 13 22:50:27 UTC 2023","15224","","Task list due dates","","Task list due dates","should display correct due dates with default settings","should display correct due dates with default settings",""
"passed","Tue Jun 13 22:37:21 UTC 2023","Tue Jun 13 22:37:38 UTC 2023","17080","","- EDIT permissions disabled","","- EDIT permissions disabled"," - Contact Tab - contact selected"," - Contact Tab - contact selected",""
"passed","Tue Jun 13 22:48:29 UTC 2023","Tue Jun 13 22:48:38 UTC 2023","8361","","RapidPro SMS Gateway: Webapp originating messages and state updates","","RapidPro SMS Gateway: Webapp originating messages and state updates","should poll for state updates and consume queue","should poll for state updates and consume queue",""
"passed","Tue Jun 13 22:40:26 UTC 2023","Tue Jun 13 22:40:37 UTC 2023","10332","","Privacy policy: conflicts","","Privacy policy: conflicts","should not fail due to document conflict for new offline user","should not fail due to document conflict for new offline user",""
"passed","Tue Jun 13 22:36:08 UTC 2023","Tue Jun 13 22:36:10 UTC 2023","2318","","Token login","","Token login","should display an error when token is expired","should display an error when token is expired",""
"passed","Tue Jun 13 23:00:37 UTC 2023","Tue Jun 13 23:00:40 UTC 2023","3350","","Bikram Sambat date display","","Bikram Sambat date display","enketo xpath extension function should display correct values when Nepali is selected","enketo xpath extension function should display correct values when Nepali is selected",""
"passed","Tue Jun 13 22:23:40 UTC 2023","Tue Jun 13 22:23:43 UTC 2023","2535","","db-sync: meta db replication","","db-sync: meta db replication","should replicate meta db up","should replicate meta db up",""
"passed","Tue Jun 13 22:38:13 UTC 2023","Tue Jun 13 22:38:14 UTC 2023","1358","","Online User: Options disabled when no items - messages, contacts, people","","Online User: Options disabled when no items - messages, contacts, people","- Report tab","- Report tab",""
"passed","Tue Jun 13 22:58:51 UTC 2023","Tue Jun 13 22:59:35 UTC 2023","43549","","Create user for contacts: user replace: for an offline user","","Create user for contacts: user replace: for an offline user","does not create any new user nor does it reparent new reports when the transition fails","does not create any new user nor does it reparent new reports when the transition fails",""
"passed","Tue Jun 13 22:49:34 UTC 2023","Tue Jun 13 22:49:37 UTC 2023","3169","","Target aggregates: as a db admin","","Target aggregates: as a db admin","should display an empty list when there are no aggregates","should display an empty list when there are no aggregates",""
"passed","Tue Jun 13 22:19:41 UTC 2023","Tue Jun 13 22:20:07 UTC 2023","25906","","Mute/Unmute contacts using a specific form.","","Mute/Unmute contacts using a specific form.","Should mute a contact using the defined mute_forms (death_report).","Should mute a contact using the defined mute_forms (death_report).",""
"passed","Tue Jun 13 22:49:37 UTC 2023","Tue Jun 13 22:49:40 UTC 2023","3135","","Target aggregates: as a db admin","","Target aggregates: as a db admin","should display an error when there are aggregates but no home place","should display an error when there are aggregates but no home place",""
"passed","Tue Jun 13 22:32:37 UTC 2023","Tue Jun 13 22:32:42 UTC 2023","5590","","Submit Enketo form","","Submit Enketo form","cancelling form with no input does not trigger confirmation dialog","cancelling form with no input does not trigger confirmation dialog",""
"passed","Tue Jun 13 22:44:59 UTC 2023","Tue Jun 13 22:45:02 UTC 2023","3397","","Reports Subject","","Reports Subject","should create a report using unknown patient_id ","should create a report using unknown patient_id ",""
"passed","Tue Jun 13 22:37:39 UTC 2023","Tue Jun 13 22:37:39 UTC 2023","483","","- EDIT permissions disabled","","- EDIT permissions disabled","- Report tab - menu not displayed when xml report selected","- Report tab - menu not displayed when xml report selected",""
"passed","Tue Jun 13 22:46:35 UTC 2023","Tue Jun 13 22:46:36 UTC 2023","495","","Service worker cache","","Service worker cache","confirm fetch yields cached result","confirm fetch yields cached result",""
"passed","Tue Jun 13 22:17:04 UTC 2023","Tue Jun 13 22:17:17 UTC 2023","12807","","Creating custom places","","Creating custom places","the RHS button should show the action with custom label","the RHS button should show the action with custom label",""
"passed","Tue Jun 13 22:46:17 UTC 2023","Tue Jun 13 22:46:24 UTC 2023","6164","","Service worker cache","","Service worker cache","login page translation updates trigger login page refresh","login page translation updates trigger login page refresh",""
"passed","Tue Jun 13 22:54:45 UTC 2023","Tue Jun 13 22:55:33 UTC 2023","47967","","Create user for contacts: user replace: for an offline user","","Create user for contacts: user replace: for an offline user","creates a new user and re-parents reports when the replace_user form is submitted","creates a new user and re-parents reports when the replace_user form is submitted",""
"passed","Tue Jun 13 22:33:46 UTC 2023","Tue Jun 13 22:33:53 UTC 2023","7022","","Unauthorized form","","Unauthorized form","should display unauthorized error message in reports tab when form expression does not match","should display unauthorized error message in reports tab when form expression does not match",""
"passed","Tue Jun 13 22:44:37 UTC 2023","Tue Jun 13 22:44:42 UTC 2023","5292","","generating short codes","","generating short codes","create case ID","create case ID",""
"passed","Tue Jun 13 22:31:01 UTC 2023","Tue Jun 13 22:31:09 UTC 2023","8371","","Pregnancy Visit","","Pregnancy Visit","Submit and validate Pregnancy Visit form and keeps the report minified","Submit and validate Pregnancy Visit form and keeps the report minified",""
"passed","Tue Jun 13 22:37:50 UTC 2023","Tue Jun 13 22:37:52 UTC 2023","2572","","- permissions disabled: - export permissions disabled","","- permissions disabled: - export permissions disabled"," - Contact Tab - contact selected"," - Contact Tab - contact selected",""
"passed","Tue Jun 13 22:30:17 UTC 2023","Tue Jun 13 22:30:19 UTC 2023","1463","","Contact Delivery Form","","Contact Delivery Form","The targets page should be updated","The targets page should be updated",""
"passed","Tue Jun 13 22:51:27 UTC 2023","Tue Jun 13 22:51:31 UTC 2023","4601","","Tasks group landing page: for chw","","Tasks group landing page: for chw","should display tasks group landing page after task completion","should display tasks group landing page after task completion",""
"passed","Tue Jun 13 22:48:12 UTC 2023","Tue Jun 13 22:48:15 UTC 2023","2772","","RapidPro SMS Gateway: Webapp originating messages and state updates","","RapidPro SMS Gateway: Webapp originating messages and state updates","should call endpoint with set credentials","should call endpoint with set credentials",""
"passed","Tue Jun 13 22:44:55 UTC 2023","Tue Jun 13 22:44:59 UTC 2023","3418","","Reports Subject","","Reports Subject","should create a report using doc id","should create a report using doc id",""
"passed","Tue Jun 13 22:17:17 UTC 2023","Tue Jun 13 22:17:31 UTC 2023","13987","","Creating custom places","","Creating custom places","the RHS button show the appropriate label when multiple places exist at the current level","the RHS button show the appropriate label when multiple places exist at the current level",""
"passed","Tue Jun 13 22:49:06 UTC 2023","Tue Jun 13 22:49:08 UTC 2023","2652","","Send message","","Send message","should send a message to a raw phone number","should send a message to a raw phone number",""
"passed","Tue Jun 13 22:37:56 UTC 2023","Tue Jun 13 22:37:57 UTC 2023","1215","","- permissions disabled: - DELETE permissions disabled","","- permissions disabled: - DELETE permissions disabled","- Report Tab - option disabled when report selected","- Report Tab - option disabled when report selected",""
"passed","Tue Jun 13 22:20:43 UTC 2023","Tue Jun 13 22:20:47 UTC 2023","4804","","Create new lineage structure","","Create new lineage structure","Create new area","Create new area",""
"passed","Tue Jun 13 22:39:49 UTC 2023","Tue Jun 13 22:39:56 UTC 2023","6563","","Privacy policy: for an offline user","","Privacy policy: for an offline user","should show french policy on secondary login","should show french policy on secondary login",""
"passed","Tue Jun 13 22:40:21 UTC 2023","Tue Jun 13 22:40:23 UTC 2023","1947","","Privacy policy: for an online user","","Privacy policy: for an online user","should show if the user changes their language","should show if the user changes their language",""
"passed","Tue Jun 13 22:20:07 UTC 2023","Tue Jun 13 22:20:29 UTC 2023","22072","","Mute/Unmute contacts using a specific form.","","Mute/Unmute contacts using a specific form.","Should unmute a contact using the defined unmute_forms (undo_death_report).","Should unmute a contact using the defined unmute_forms (undo_death_report).",""
"passed","Tue Jun 13 22:38:54 UTC 2023","Tue Jun 13 22:38:56 UTC 2023","2430","","Hamburger Menu tests","","Hamburger Menu tests","should open About","should open About",""
"passed","Tue Jun 13 22:51:14 UTC 2023","Tue Jun 13 22:51:22 UTC 2023","8575","","Tasks group landing page","","Tasks group landing page","""before all"" hook for Tasks group landing page","""before all"" hook for Tasks group landing page",""
"passed","Tue Jun 13 23:01:08 UTC 2023","Tue Jun 13 23:01:18 UTC 2023","10290","","Adding new language","","Adding new language","should support deleting translations","should support deleting translations",""
"passed","Tue Jun 13 22:15:40 UTC 2023","Tue Jun 13 22:15:45 UTC 2023","4665","","Acessing the admin app","","Acessing the admin app","should redirect to login when not logged in","should redirect to login when not logged in",""
"passed","Tue Jun 13 22:52:07 UTC 2023","Tue Jun 13 22:52:27 UTC 2023","20091","","Create user when adding contact","","Create user when adding contact","Creates a new user while offline","Creates a new user while offline",""
"passed","Tue Jun 13 22:31:27 UTC 2023","Tue Jun 13 22:31:28 UTC 2023","1066","","Pregnancy registration","","Pregnancy registration","Should verify that the counters for the active pregnancies and the new pregnancies were updated.","Should verify that the counters for the active pregnancies and the new pregnancies were updated.",""
"passed","Tue Jun 13 22:20:37 UTC 2023","Tue Jun 13 22:20:43 UTC 2023","5709","","Create new lineage structure","","Create new lineage structure","Create new health center","Create new health center",""
"passed","Tue Jun 13 22:29:01 UTC 2023","Tue Jun 13 22:29:02 UTC 2023","1092","","Submit a death report","","Submit a death report","Should verify that the counter for the Deaths was updated.","Should verify that the counter for the Deaths was updated.",""
"passed","Tue Jun 13 23:00:26 UTC 2023","Tue Jun 13 23:00:37 UTC 2023","10692","","Bikram Sambat date display","","Bikram Sambat date display","enketo xpath extension function should display correct values when Nepali is not selected","enketo xpath extension function should display correct values when Nepali is not selected",""
"passed","Tue Jun 13 22:55:33 UTC 2023","Tue Jun 13 22:55:57 UTC 2023","24032","","Create user for contacts: user replace: for an offline user","","Create user for contacts: user replace: for an offline user","creates a new user when the replace_user form is submitted while online","creates a new user when the replace_user form is submitted while online",""
"passed","Tue Jun 13 22:39:21 UTC 2023","Tue Jun 13 22:39:26 UTC 2023","5156","","Navigation tests: Navigation view","","Navigation tests: Navigation view","should display tab labels, when some tabs are enabled","should display tab labels, when some tabs are enabled",""
"passed","Tue Jun 13 22:46:07 UTC 2023","Tue Jun 13 22:46:12 UTC 2023","5082","","Service worker cache","","Service worker cache","confirm initial list of cached resources","confirm initial list of cached resources",""
"passed","Tue Jun 13 22:35:06 UTC 2023","Tue Jun 13 22:35:09 UTC 2023","2993","","Login page funcionality tests: Locale","","Login page funcionality tests: Locale","should change locale to Spanish","should change locale to Spanish",""
"passed","Tue Jun 13 22:33:53 UTC 2023","Tue Jun 13 22:33:58 UTC 2023","4820","","Unauthorized form","","Unauthorized form","should display unauthorized error message in contacts tab when user does not have form permission","should display unauthorized error message in contacts tab when user does not have form permission",""
"passed","Tue Jun 13 22:31:35 UTC 2023","Tue Jun 13 22:31:37 UTC 2023","1725","","RepeatForm","","RepeatForm","""before all"" hook for RepeatForm","""before all"" hook for RepeatForm",""
