"Status","Start Time","Stop Time","Duration in ms","Parent Suite","Suite","Sub Suite","Test Class","Test Method","Name","Description"
"passed","Fri Apr 07 15:34:46 UTC 2023","Fri Apr 07 15:34:50 UTC 2023","4070","","User Test Cases ->: Invalid entries -> ","","User Test Cases ->: Invalid entries -> ","TestCase for Passwords must match","TestCase for Passwords must match",""
"passed","Fri Apr 07 15:05:57 UTC 2023","Fri Apr 07 15:05:59 UTC 2023","1779","","Contact Delivery Form","","Contact Delivery Form","The targets page should be updated","The targets page should be updated",""
"passed","Fri Apr 07 15:21:29 UTC 2023","Fri Apr 07 15:21:31 UTC 2023","1971","","sms-gateway api","","sms-gateway api","""before all"" hook for sms-gateway api","""before all"" hook for sms-gateway api",""
"passed","Fri Apr 07 15:21:02 UTC 2023","Fri Apr 07 15:21:07 UTC 2023","4234","","Service worker cache","","Service worker cache","other translation updates do not trigger a login page refresh","other translation updates do not trigger a login page refresh",""
"passed","Fri Apr 07 15:13:36 UTC 2023","Fri Apr 07 15:13:38 UTC 2023","1371","","Online User: Options disabled when no items - messages, contacts, people","","Online User: Options disabled when no items - messages, contacts, people"," - Contact tab"," - Contact tab",""
"passed","Fri Apr 07 14:58:14 UTC 2023","Fri Apr 07 14:58:24 UTC 2023","10235","","Creating custom places","","Creating custom places","the LHS add place button should show the appropriate title","the LHS add place button should show the appropriate title",""
"passed","Fri Apr 07 15:10:00 UTC 2023","Fri Apr 07 15:10:01 UTC 2023","714","","Submit an undo death report","","Submit an undo death report","Should verify that the undo death report was created","Should verify that the undo death report was created",""
"passed","Fri Apr 07 15:34:33 UTC 2023","Fri Apr 07 15:34:37 UTC 2023","4680","","User Test Cases ->: Creating Users ->","","User Test Cases ->: Creating Users ->","should add user with valid password","should add user with valid password",""
"passed","Fri Apr 07 15:23:46 UTC 2023","Fri Apr 07 15:23:57 UTC 2023","10950","","Tasks group landing page: for chw","","Tasks group landing page: for chw","should have tasks","should have tasks",""
"passed","Fri Apr 07 15:01:58 UTC 2023","Fri Apr 07 15:02:02 UTC 2023","3836","","Create new lineage structure","","Create new lineage structure","Create new area","Create new area",""
"passed","Fri Apr 07 15:33:51 UTC 2023","Fri Apr 07 15:33:52 UTC 2023","916","","Bikram Sambat date display","","Bikram Sambat date display","should convert contact summary dates to bikram sambat when language is Nepali","should convert contact summary dates to bikram sambat when language is Nepali",""
"passed","Fri Apr 07 15:05:55 UTC 2023","Fri Apr 07 15:05:56 UTC 2023","642","","Contact Delivery Form","","Contact Delivery Form","The past pregnancy card should show","The past pregnancy card should show",""
"passed","Fri Apr 07 15:18:21 UTC 2023","Fri Apr 07 15:18:32 UTC 2023","10790","","Reports tab breadcrumbs","","Reports tab breadcrumbs","should display reports with updated breadcrumbs for offline user","should display reports with updated breadcrumbs for offline user",""
"passed","Fri Apr 07 15:11:45 UTC 2023","Fri Apr 07 15:11:46 UTC 2023","1417","","More Options Menu - Offline User: all permissions enabled","","More Options Menu - Offline User: all permissions enabled"," - Contact Tab - with same facility_id"," - Contact Tab - with same facility_id",""
"passed","Fri Apr 07 15:02:31 UTC 2023","Fri Apr 07 15:02:37 UTC 2023","5793","","Create new lineage structure","","Create new lineage structure","should edit the name of the Family","should edit the name of the Family",""
"passed","Fri Apr 07 15:14:30 UTC 2023","Fri Apr 07 15:14:33 UTC 2023","3596","","Navigation tests","","Navigation tests","should open Messages tab","should open Messages tab",""
"passed","Fri Apr 07 15:26:48 UTC 2023","Fri Apr 07 15:27:19 UTC 2023","31221","","Create user when adding contact","","Create user when adding contact","creates a new user when Sentinel recovers from outage","creates a new user when Sentinel recovers from outage",""
"passed","Fri Apr 07 15:00:56 UTC 2023","Fri Apr 07 15:01:25 UTC 2023","29374","","Mute/Unmute contacts using a specific form.","","Mute/Unmute contacts using a specific form.","Should mute a contact using the defined mute_forms (death_report).","Should mute a contact using the defined mute_forms (death_report).",""
"passed","Fri Apr 07 15:03:34 UTC 2023","Fri Apr 07 15:03:36 UTC 2023","1503","","db-sync","","db-sync","should not filter deletes","should not filter deletes",""
"passed","Fri Apr 07 15:07:56 UTC 2023","Fri Apr 07 15:08:02 UTC 2023","6065","","Submit Enketo form","","Submit Enketo form","submits on reports tab","submits on reports tab",""
"passed","Fri Apr 07 15:01:25 UTC 2023","Fri Apr 07 15:01:46 UTC 2023","20394","","Mute/Unmute contacts using a specific form.","","Mute/Unmute contacts using a specific form.","Should unmute a contact using the defined unmute_forms (undo_death_report).","Should unmute a contact using the defined unmute_forms (undo_death_report).",""
"passed","Fri Apr 07 14:58:46 UTC 2023","Fri Apr 07 14:58:56 UTC 2023","9645","","Creating custom places","","Creating custom places","the RHS add place button should show the add place title","the RHS add place button should show the add place title",""
"passed","Fri Apr 07 15:14:38 UTC 2023","Fri Apr 07 15:14:40 UTC 2023","1442","","Navigation tests","","Navigation tests","should open Analytics tab","should open Analytics tab",""
"passed","Fri Apr 07 14:57:19 UTC 2023","Fri Apr 07 14:57:31 UTC 2023","12163","","Acessing the admin app","","Acessing the admin app","should show access error when accessing as an offline user","should show access error when accessing as an offline user",""
"passed","Fri Apr 07 15:11:46 UTC 2023","Fri Apr 07 15:11:48 UTC 2023","1910","","More Options Menu - Offline User: all permissions enabled","","More Options Menu - Offline User: all permissions enabled","Report tab - options enabled when sms report selected","Report tab - options enabled when sms report selected",""
"passed","Fri Apr 07 15:18:38 UTC 2023","Fri Apr 07 15:18:46 UTC 2023","7826","","Bulk delete reports","","Bulk delete reports","should select, deselect and delete only selected reports","should select, deselect and delete only selected reports",""
"passed","Fri Apr 07 15:08:05 UTC 2023","Fri Apr 07 15:08:06 UTC 2023","1496","","Submit Enketo form","","Submit Enketo form","cancelling form with input triggers confirmation dialog box","cancelling form with input triggers confirmation dialog box",""
"passed","Fri Apr 07 15:13:59 UTC 2023","Fri Apr 07 15:14:04 UTC 2023","4428","","bfcache: login page","","bfcache: login page","should redirect to the app page when session is valid","should redirect to the app page when session is valid",""
"passed","Fri Apr 07 15:10:28 UTC 2023","Fri Apr 07 15:10:32 UTC 2023","4762","","Login and logout tests","","Login and logout tests","should set correct cookies","should set correct cookies",""
"passed","Fri Apr 07 15:07:05 UTC 2023","Fri Apr 07 15:07:06 UTC 2023","959","","Pregnancy registration","","Pregnancy registration","Should verify that the counters for the active pregnancies and the new pregnancies were updated.","Should verify that the counters for the active pregnancies and the new pregnancies were updated.",""
"passed","Fri Apr 07 15:10:18 UTC 2023","Fri Apr 07 15:10:23 UTC 2023","5422","","Login and logout tests","","Login and logout tests","should show a warning before log out","should show a warning before log out",""
"passed","Fri Apr 07 15:04:39 UTC 2023","Fri Apr 07 15:04:39 UTC 2023","672","","Submit a death report","","Submit a death report","Should verify that the report related to the death was created","Should verify that the report related to the death was created",""
"passed","Fri Apr 07 15:19:59 UTC 2023","Fri Apr 07 15:20:13 UTC 2023","14394","","Reports Sidebar Filter","","Reports Sidebar Filter","should filter by date","should filter by date",""
"passed","Fri Apr 07 15:18:06 UTC 2023","Fri Apr 07 15:18:08 UTC 2023","1774","","manifest.json","","manifest.json","works without branding doc","works without branding doc",""
"passed","Fri Apr 07 15:11:44 UTC 2023","Fri Apr 07 15:11:45 UTC 2023","1363","","More Options Menu - Offline User: all permissions enabled","","More Options Menu - Offline User: all permissions enabled"," - Contact Tab - contact selected"," - Contact Tab - contact selected",""
"passed","Fri Apr 07 15:11:15 UTC 2023","Fri Apr 07 15:11:16 UTC 2023","1139","","Token login","","Token login","should display an error with incorrect url","should display an error with incorrect url",""
"passed","Fri Apr 07 15:15:22 UTC 2023","Fri Apr 07 15:15:22 UTC 2023","84","","Privacy policy: for an offline user","","Privacy policy: for an offline user","should display when navigating to the privacy policy page","should display when navigating to the privacy policy page",""
"passed","Fri Apr 07 15:10:08 UTC 2023","Fri Apr 07 15:10:12 UTC 2023","3102","","Login and logout tests","","Login and logout tests","should show locale selector on login page","should show locale selector on login page",""
"passed","Fri Apr 07 15:21:33 UTC 2023","Fri Apr 07 15:21:34 UTC 2023","1140","","sms-gateway api: - gateway submits WT sms status updates","","sms-gateway api: - gateway submits WT sms status updates","- shows content","- shows content",""
"passed","Fri Apr 07 15:33:54 UTC 2023","Fri Apr 07 15:33:57 UTC 2023","2931","","Bikram Sambat date display","","Bikram Sambat date display","SMS report shows bsAggreDate type as date field correctly","SMS report shows bsAggreDate type as date field correctly",""
"passed","Fri Apr 07 15:07:19 UTC 2023","Fri Apr 07 15:07:23 UTC 2023","4265","","RepeatForm: Repeat form with count input","","RepeatForm: Repeat form with count input","should display the initial form and its repeated content in English","should display the initial form and its repeated content in English",""
"passed","Fri Apr 07 15:22:18 UTC 2023","Fri Apr 07 15:22:39 UTC 2023","21306","","Task list due dates","","Task list due dates","should display correct due dates with default settings","should display correct due dates with default settings",""
"passed","Fri Apr 07 15:05:39 UTC 2023","Fri Apr 07 15:05:55 UTC 2023","16442","","Contact Delivery Form","","Contact Delivery Form","Complete a delivery: Process a delivery with a live child and facility birth.","Complete a delivery: Process a delivery with a live child and facility birth.",""
"passed","Fri Apr 07 15:07:04 UTC 2023","Fri Apr 07 15:07:04 UTC 2023","742","","Pregnancy registration","","Pregnancy registration","Should verify that all tasks related with the high risk pregnancy were created","Should verify that all tasks related with the high risk pregnancy were created",""
"passed","Fri Apr 07 15:16:42 UTC 2023","Fri Apr 07 15:17:58 UTC 2023","75669","","purge","","purge","purging runs on sync and startup","purging runs on sync and startup",""
"passed","Fri Apr 07 15:04:47 UTC 2023","Fri Apr 07 15:04:57 UTC 2023","10232","","Edit report with attachmnet","","Edit report with attachmnet","should remove attachment when saving","should remove attachment when saving",""
"passed","Fri Apr 07 14:58:04 UTC 2023","Fri Apr 07 14:58:09 UTC 2023","4320","","Targets","","Targets","should display correct message when targets are disabled","should display correct message when targets are disabled",""
"passed","Fri Apr 07 15:13:25 UTC 2023","Fri Apr 07 15:13:25 UTC 2023","60","","- permissions disabled","","- permissions disabled","""after all"" hook for - permissions disabled","""after all"" hook for - permissions disabled",""
"passed","Fri Apr 07 15:24:21 UTC 2023","Fri Apr 07 15:24:32 UTC 2023","11336","","Tasks group landing page: for supervisor","","Tasks group landing page: for supervisor","should have tasks","should have tasks",""
"passed","Fri Apr 07 15:29:32 UTC 2023","Fri Apr 07 15:30:14 UTC 2023","41927","","Create user for contacts: user replace: for an offline user","","Create user for contacts: user replace: for an offline user","creates new user from latest replace_user form data if multiple are submitted before syncing","creates new user from latest replace_user form data if multiple are submitted before syncing",""
"passed","Fri Apr 07 15:07:13 UTC 2023","Fri Apr 07 15:07:14 UTC 2023","1712","","RepeatForm","","RepeatForm","""before all"" hook for RepeatForm","""before all"" hook for RepeatForm",""
"passed","Fri Apr 07 15:13:49 UTC 2023","Fri Apr 07 15:13:51 UTC 2023","2012","","Online User:  - Options enabled when there are items","","Online User:  - Options enabled when there are items","- Reports tab - options enabled when XML report selected","- Reports tab - options enabled when XML report selected",""
"passed","Fri Apr 07 15:08:12 UTC 2023","Fri Apr 07 15:08:20 UTC 2023","8107","","Submit Photo Upload form","","Submit Photo Upload form","submit and edit (no changes)","submit and edit (no changes)",""
"passed","Fri Apr 07 15:33:49 UTC 2023","Fri Apr 07 15:33:51 UTC 2023","2256","","Bikram Sambat date display","","Bikram Sambat date display","should display report list dates converted to bikram sambat","should display report list dates converted to bikram sambat",""
"passed","Fri Apr 07 15:26:26 UTC 2023","Fri Apr 07 15:26:35 UTC 2023","9342","","Create user when adding contact","","Create user when adding contact","Does not create a new user when the transition fails","Does not create a new user when the transition fails",""
"passed","Fri Apr 07 15:24:17 UTC 2023","Fri Apr 07 15:24:21 UTC 2023","3287","","Tasks group landing page: for chw","","Tasks group landing page: for chw","should not show page when submitting task for contact with no leaf type place in lineage","should not show page when submitting task for contact with no leaf type place in lineage",""
"passed","Fri Apr 07 15:16:03 UTC 2023","Fri Apr 07 15:16:08 UTC 2023","4595","","Privacy policy: for an online user","","Privacy policy: for an online user","should not show on subsequent login","should not show on subsequent login",""
"passed","Fri Apr 07 15:06:05 UTC 2023","Fri Apr 07 15:06:12 UTC 2023","7802","","Pregnancy danger sign follow-up form","","Pregnancy danger sign follow-up form","Submit and validate Pregnancy danger sign follow-up form and keeps the report minified","Submit and validate Pregnancy danger sign follow-up form and keeps the report minified",""
"passed","Fri Apr 07 15:34:07 UTC 2023","Fri Apr 07 15:34:09 UTC 2023","1250","","Adding new language","","Adding new language","should be set as Default language ","should be set as Default language ",""
"passed","Fri Apr 07 15:33:11 UTC 2023","Fri Apr 07 15:33:20 UTC 2023","8904","","Testing Incorrect locale","","Testing Incorrect locale","should work with incorrect locale","should work with incorrect locale",""
"passed","Fri Apr 07 15:13:41 UTC 2023","Fri Apr 07 15:13:47 UTC 2023","5440","","Online User:  - Options enabled when there are items","","Online User:  - Options enabled when there are items","- Reports tab - Edit/export invisible when NON XML report selected","- Reports tab - Edit/export invisible when NON XML report selected",""
"passed","Fri Apr 07 15:24:04 UTC 2023","Fri Apr 07 15:24:08 UTC 2023","4231","","Tasks group landing page: for chw","","Tasks group landing page: for chw","should display modal when clicking on a task from another group","should display modal when clicking on a task from another group",""
"passed","Fri Apr 07 15:07:40 UTC 2023","Fri Apr 07 15:07:45 UTC 2023","5144","","Countdown timer widget","","Countdown timer widget","interact with timer and submit","interact with timer and submit",""
"passed","Fri Apr 07 15:28:58 UTC 2023","Fri Apr 07 15:29:32 UTC 2023","34503","","Create user for contacts: user replace: for an offline user","","Create user for contacts: user replace: for an offline user","does not assign new person as primary contact of parent place if original person was not primary","does not assign new person as primary contact of parent place if original person was not primary",""
"passed","Fri Apr 07 15:02:26 UTC 2023","Fri Apr 07 15:02:31 UTC 2023","5291","","Create new lineage structure","","Create new lineage structure","should edit the name of the CHW area","should edit the name of the CHW area",""
"passed","Fri Apr 07 15:21:14 UTC 2023","Fri Apr 07 15:21:22 UTC 2023","8653","","Export Messages","","Export Messages","Should download export file","Should download export file",""
"passed","Fri Apr 07 15:22:46 UTC 2023","Fri Apr 07 15:22:55 UTC 2023","8733","","Task list due dates","","Task list due dates","should display correct due dates with taskDaysOverdue setting and simple translation","should display correct due dates with taskDaysOverdue setting and simple translation",""
"passed","Fri Apr 07 15:04:39 UTC 2023","Fri Apr 07 15:04:40 UTC 2023","1044","","Submit a death report","","Submit a death report","Should verify that the counter for the Deaths was updated.","Should verify that the counter for the Deaths was updated.",""
"passed","Fri Apr 07 15:33:29 UTC 2023","Fri Apr 07 15:33:30 UTC 2023","897","","MessageFormat","","MessageFormat","should work with botched translations","should work with botched translations",""
"passed","Fri Apr 07 15:12:41 UTC 2023","Fri Apr 07 15:13:04 UTC 2023","23061","","- EDIT permissions disabled","","- EDIT permissions disabled"," - Contact Tab - contact selected"," - Contact Tab - contact selected",""
"passed","Fri Apr 07 15:14:21 UTC 2023","Fri Apr 07 15:14:22 UTC 2023","717","","Hamburger Menu tests","","Hamburger Menu tests","should open Report bug","should open Report bug",""
"passed","Fri Apr 07 15:21:31 UTC 2023","Fri Apr 07 15:21:33 UTC 2023","2660","","sms-gateway api: - gateway submits new WT sms messages","","sms-gateway api: - gateway submits new WT sms messages","shows content","shows content",""
"passed","Fri Apr 07 15:12:11 UTC 2023","Fri Apr 07 15:12:34 UTC 2023","23614","","- DELETE permissions disabled","","- DELETE permissions disabled"," - Contact Tab - delete contact selected"," - Contact Tab - delete contact selected",""
"passed","Fri Apr 07 15:00:19 UTC 2023","Fri Apr 07 15:00:34 UTC 2023","14951","","Edit contacts with the default config. ","","Edit contacts with the default config. ","should edit contact name","should edit contact name",""
"passed","Fri Apr 07 15:10:12 UTC 2023","Fri Apr 07 15:10:15 UTC 2023","3101","","Login and logout tests","","Login and logout tests","should change locale to French","should change locale to French",""
"passed","Fri Apr 07 15:15:34 UTC 2023","Fri Apr 07 15:15:47 UTC 2023","13117","","Privacy policy: for an offline user","","Privacy policy: for an offline user","should show french policy on secondary login","should show french policy on secondary login",""
"passed","Fri Apr 07 15:11:48 UTC 2023","Fri Apr 07 15:11:50 UTC 2023","1357","","More Options Menu - Offline User: all permissions enabled","","More Options Menu - Offline User: all permissions enabled","Report tab - options enabled when xml report selected","Report tab - options enabled when xml report selected",""
"passed","Fri Apr 07 15:09:06 UTC 2023","Fri Apr 07 15:09:06 UTC 2023","287","","Training Cards","","Training Cards","should not display completed training","should not display completed training",""
"passed","Fri Apr 07 15:06:19 UTC 2023","Fri Apr 07 15:06:30 UTC 2023","10910","","Pregnancy danger sign follow-up form","","Pregnancy danger sign follow-up form","should submit and edit Pregnancy danger sign follow-up form with changes","should submit and edit Pregnancy danger sign follow-up form with changes",""
"passed","Fri Apr 07 15:34:42 UTC 2023","Fri Apr 07 15:34:46 UTC 2023","3990","","User Test Cases ->: Invalid entries -> ","","User Test Cases ->: Invalid entries -> ","TestCase for The password is too easy to guess.","TestCase for The password is too easy to guess.",""
"passed","Fri Apr 07 15:34:09 UTC 2023","Fri Apr 07 15:34:11 UTC 2023","2374","","Adding new language","","Adding new language","should reflect in config wizard","should reflect in config wizard",""
"passed","Fri Apr 07 15:14:21 UTC 2023","Fri Apr 07 15:14:21 UTC 2023","235","","Hamburger Menu tests","","Hamburger Menu tests","should open User settings","should open User settings",""
"passed","Fri Apr 07 15:06:12 UTC 2023","Fri Apr 07 15:06:19 UTC 2023","6161","","Pregnancy danger sign follow-up form","","Pregnancy danger sign follow-up form","should submit and edit Pregnancy danger sign follow-up form (no changes)","should submit and edit Pregnancy danger sign follow-up form (no changes)",""
"passed","Fri Apr 07 15:19:12 UTC 2023","Fri Apr 07 15:19:18 UTC 2023","6112","","Delete Reports","","Delete Reports","Should delete report","Should delete report",""
"passed","Fri Apr 07 15:01:46 UTC 2023","Fri Apr 07 15:01:47 UTC 2023","961","","Mute/Unmute contacts using a specific form.","","Mute/Unmute contacts using a specific form.","Should show a popup when trying to submit a non-unmuting form against a muted contact","Should show a popup when trying to submit a non-unmuting form against a muted contact",""
"passed","Fri Apr 07 15:14:33 UTC 2023","Fri Apr 07 15:14:35 UTC 2023","1870","","Navigation tests","","Navigation tests","should open tasks tab","should open tasks tab",""
"passed","Fri Apr 07 15:16:13 UTC 2023","Fri Apr 07 15:16:15 UTC 2023","1920","","Privacy policy: for an online user","","Privacy policy: for an online user","should show if the user changes their language","should show if the user changes their language",""
"passed","Fri Apr 07 15:19:37 UTC 2023","Fri Apr 07 15:19:42 UTC 2023","5266","","generating short codes","","generating short codes","create case ID","create case ID",""
"passed","Fri Apr 07 15:08:02 UTC 2023","Fri Apr 07 15:08:04 UTC 2023","1520","","Submit Enketo form","","Submit Enketo form","allows forms with required notes to be submitted","allows forms with required notes to be submitted",""
"skipped","Fri Apr 07 15:07:50 UTC 2023","Fri Apr 07 15:07:50 UTC 2023","0","","Submit Default Delivery Report","","Submit Default Delivery Report","open, submit and edit default delivery form","open, submit and edit default delivery form",""
"passed","Fri Apr 07 15:20:31 UTC 2023","Fri Apr 07 15:20:50 UTC 2023","18753","","Service worker cache","","Service worker cache","branding updates trigger login page refresh","branding updates trigger login page refresh",""
"passed","Fri Apr 07 15:03:14 UTC 2023","Fri Apr 07 15:03:16 UTC 2023","1515","","Test Contact Search Functionality","","Test Contact Search Functionality","search should clear RHS selected contact","search should clear RHS selected contact",""
"passed","Fri Apr 07 14:57:45 UTC 2023","Fri Apr 07 14:57:57 UTC 2023","11828","","Targets","","Targets","should display targets from default config","should display targets from default config",""
"passed","Fri Apr 07 15:24:08 UTC 2023","Fri Apr 07 15:24:12 UTC 2023","3682","","Tasks group landing page: for chw","","Tasks group landing page: for chw","should not display modal when clicking list task from same group","should not display modal when clicking list task from same group",""
"passed","Fri Apr 07 14:58:56 UTC 2023","Fri Apr 07 14:59:07 UTC 2023","10876","","Creating custom places","","Creating custom places","should show the single add person button with the correct title","should show the single add person button with the correct title",""
"passed","Fri Apr 07 15:13:38 UTC 2023","Fri Apr 07 15:13:39 UTC 2023","1474","","Online User: Options disabled when no items - messages, contacts, people","","Online User: Options disabled when no items - messages, contacts, people","- Report tab","- Report tab",""
"passed","Fri Apr 07 15:27:27 UTC 2023","Fri Apr 07 15:27:38 UTC 2023","11806","","Create user for contacts: user replace","","Create user for contacts: user replace","does not create a new user when the replace_user form is submitted for online user","does not create a new user when the replace_user form is submitted for online user",""
"passed","Fri Apr 07 15:03:09 UTC 2023","Fri Apr 07 15:03:14 UTC 2023","5097","","Test Contact Search Functionality","","Test Contact Search Functionality","search by NON empty string should display results with contains match and clears search","search by NON empty string should display results with contains match and clears search",""
"passed","Fri Apr 07 14:57:04 UTC 2023","Fri Apr 07 14:57:07 UTC 2023","2691","","About page","","About page","should open the about page","should open the about page",""
"passed","Fri Apr 07 15:10:58 UTC 2023","Fri Apr 07 15:11:04 UTC 2023","5990","","should renew token","","should renew token","Refresh page multiple times and verify token gets renewed","Refresh page multiple times and verify token gets renewed",""
"passed","Fri Apr 07 15:25:35 UTC 2023","Fri Apr 07 15:25:56 UTC 2023","20665","","Create user when adding contact","","Create user when adding contact","Creates a new user when adding a person while adding a place","Creates a new user when adding a person while adding a place",""
"passed","Fri Apr 07 15:03:37 UTC 2023","Fri Apr 07 15:03:38 UTC 2023","1464","","db-sync","","db-sync","should filter locally purged docs","should filter locally purged docs",""
"passed","Fri Apr 07 15:21:07 UTC 2023","Fri Apr 07 15:21:08 UTC 2023","503","","Service worker cache","","Service worker cache","confirm fetch yields cached result","confirm fetch yields cached result",""
"passed","Fri Apr 07 15:12:34 UTC 2023","Fri Apr 07 15:12:35 UTC 2023","833","","- DELETE permissions disabled","","- DELETE permissions disabled","- Report tab - delete menu not displayed when xml report selected","- Report tab - delete menu not displayed when xml report selected",""
