"Status","Start Time","Stop Time","Duration in ms","Parent Suite","Suite","Sub Suite","Test Class","Test Method","Name","Description"
"passed","Wed May 17 06:23:48 UTC 2023","Wed May 17 06:23:59 UTC 2023","11258","","Pregnancy danger sign follow-up form","","Pregnancy danger sign follow-up form","should submit and edit Pregnancy danger sign follow-up form with changes","should submit and edit Pregnancy danger sign follow-up form with changes",""
"passed","Wed May 17 06:32:44 UTC 2023","Wed May 17 06:32:50 UTC 2023","5192","","Privacy policy: for an online user","","Privacy policy: for an online user","should show french policy on secondary login","should show french policy on secondary login",""
"passed","Wed May 17 06:42:50 UTC 2023","Wed May 17 06:43:15 UTC 2023","25251","","Create user when adding contact","","Create user when adding contact","creates a new user when Sentinel recovers from outage","creates a new user when Sentinel recovers from outage",""
"passed","Wed May 17 06:28:08 UTC 2023","Wed May 17 06:28:11 UTC 2023","2877","","Login and logout tests","","Login and logout tests","should change locale to Spanish","should change locale to Spanish",""
"passed","Wed May 17 06:12:36 UTC 2023","Wed May 17 06:12:47 UTC 2023","10651","","Creating custom places","","Creating custom places","should show custom places in their own list","should show custom places in their own list",""
"passed","Wed May 17 06:38:59 UTC 2023","Wed May 17 06:39:04 UTC 2023","4541","","Send message","","Send message","should reply to an existing message and add a new recipient - raw phone number ","should reply to an existing message and add a new recipient - raw phone number ",""
"passed","Wed May 17 06:24:06 UTC 2023","Wed May 17 06:24:14 UTC 2023","8290","","Pregnancy Visit","","Pregnancy Visit","Submit and validate Pregnancy Visit form and keeps the report minified","Submit and validate Pregnancy Visit form and keeps the report minified",""
"passed","Wed May 17 06:15:23 UTC 2023","Wed May 17 06:15:29 UTC 2023","6390","","Create new lineage structure","","Create new lineage structure","should edit a name of the health facility","should edit a name of the health facility",""
"passed","Wed May 17 06:30:39 UTC 2023","Wed May 17 06:30:41 UTC 2023","2007","","- permissions disabled: - DELETE permissions disabled","","- permissions disabled: - DELETE permissions disabled"," - Contact Tab - contact selected"," - Contact Tab - contact selected",""
"passed","Wed May 17 06:22:39 UTC 2023","Wed May 17 06:23:04 UTC 2023","24689","","Extension lib xpath function","","Extension lib xpath function","calculate average","calculate average",""
"passed","Wed May 17 06:40:59 UTC 2023","Wed May 17 06:41:02 UTC 2023","3359","","Tasks group landing page: for supervisor","","Tasks group landing page: for supervisor","should not display task landing page after task completion","should not display task landing page after task completion",""
"passed","Wed May 17 06:24:30 UTC 2023","Wed May 17 06:24:31 UTC 2023","660","","Pregnancy registration","","Pregnancy registration","Should verify that the report related the pregnancy was created","Should verify that the report related the pregnancy was created",""
"passed","Wed May 17 06:50:06 UTC 2023","Wed May 17 06:50:11 UTC 2023","4568","","User Test Cases ->: Invalid entries -> ","","User Test Cases ->: Invalid entries -> ","TestCase for Passwords must match","TestCase for Passwords must match",""
"passed","Wed May 17 06:36:10 UTC 2023","Wed May 17 06:36:12 UTC 2023","2537","","Reports Subject","","Reports Subject","should create a report using missing required patient name","should create a report using missing required patient name",""
"passed","Wed May 17 06:45:03 UTC 2023","Wed May 17 06:45:51 UTC 2023","48062","","Create user for contacts: user replace: for an offline user","","Create user for contacts: user replace: for an offline user","creates new user from latest replace_user form data if multiple are submitted before syncing","creates new user from latest replace_user form data if multiple are submitted before syncing",""
"passed","Wed May 17 06:15:12 UTC 2023","Wed May 17 06:15:16 UTC 2023","3346","","Create new lineage structure","","Create new lineage structure","Create new person","Create new person",""
"passed","Wed May 17 06:30:37 UTC 2023","Wed May 17 06:30:38 UTC 2023","1219","","- permissions disabled: - export permissions disabled","","- permissions disabled: - export permissions disabled","- Report Tab - report selected","- Report Tab - report selected",""
"passed","Wed May 17 06:31:45 UTC 2023","Wed May 17 06:31:48 UTC 2023","3274","","Navigation tests","","Navigation tests","should open Messages tab","should open Messages tab",""
"passed","Wed May 17 06:14:59 UTC 2023","Wed May 17 06:15:04 UTC 2023","5179","","Create new lineage structure","","Create new lineage structure","Create new health center","Create new health center",""
"passed","Wed May 17 06:32:10 UTC 2023","Wed May 17 06:32:11 UTC 2023","732","","Privacy policy: for an offline user","","Privacy policy: for an offline user","should not show on refresh","should not show on refresh",""
"passed","Wed May 17 06:29:14 UTC 2023","Wed May 17 06:29:15 UTC 2023","1384","","More Options Menu - Offline User: all permissions enabled","","More Options Menu - Offline User: all permissions enabled","- Contact tab - no contact selected","- Contact tab - no contact selected",""
"passed","Wed May 17 06:49:28 UTC 2023","Wed May 17 06:49:34 UTC 2023","6441","","Adding new language","","Adding new language","should add new translations","should add new translations",""
"passed","Wed May 17 06:28:11 UTC 2023","Wed May 17 06:28:16 UTC 2023","5295","","Login and logout tests","","Login and logout tests","should show a warning before log out","should show a warning before log out",""
"passed","Wed May 17 06:39:55 UTC 2023","Wed May 17 06:40:03 UTC 2023","7842","","Tasks tab breadcrumbs","","Tasks tab breadcrumbs","""before all"" hook for Tasks tab breadcrumbs","""before all"" hook for Tasks tab breadcrumbs",""
"passed","Wed May 17 06:38:41 UTC 2023","Wed May 17 06:38:51 UTC 2023","10388","","Send message","","Send message","should send messages to all the contacts, under a place, that have a primary phone number assigned","should send messages to all the contacts, under a place, that have a primary phone number assigned",""
"passed","Wed May 17 06:31:07 UTC 2023","Wed May 17 06:31:08 UTC 2023","1671","","Online User:  - Options enabled when there are items","","Online User:  - Options enabled when there are items","- Message tab","- Message tab",""
"passed","Wed May 17 06:30:00 UTC 2023","Wed May 17 06:30:00 UTC 2023","132","","- DELETE permissions disabled","","- DELETE permissions disabled","- Report tab - delete menu not displayed when sms report selected","- Report tab - delete menu not displayed when sms report selected",""
"passed","Wed May 17 06:17:42 UTC 2023","Wed May 17 06:17:43 UTC 2023","1281","","db-sync","","db-sync","should filter resources, service-worker, forms, translations, branding, partners docs","should filter resources, service-worker, forms, translations, branding, partners docs",""
"passed","Wed May 17 06:42:36 UTC 2023","Wed May 17 06:42:50 UTC 2023","13912","","Create user when adding contact","","Create user when adding contact","Does not create a new user when editing contact","Does not create a new user when editing contact",""
"passed","Wed May 17 06:49:07 UTC 2023","Wed May 17 06:49:10 UTC 2023","2046","","Bikram Sambat date display","","Bikram Sambat date display","should display report list dates converted to bikram sambat","should display report list dates converted to bikram sambat",""
"passed","Wed May 17 06:26:28 UTC 2023","Wed May 17 06:26:37 UTC 2023","8891","","Training Cards","","Training Cards","should cancel training and not save it as completed","should cancel training and not save it as completed",""
"passed","Wed May 17 06:41:44 UTC 2023","Wed May 17 06:42:00 UTC 2023","15633","","Create user when adding contact","","Create user when adding contact","Creates a new user when adding a person while adding a place","Creates a new user when adding a person while adding a place",""
"passed","Wed May 17 06:30:00 UTC 2023","Wed May 17 06:30:01 UTC 2023","884","","- DELETE permissions disabled","","- DELETE permissions disabled","- Report tab - delete menu not displayed when xml report selected","- Report tab - delete menu not displayed when xml report selected",""
"passed","Wed May 17 06:16:58 UTC 2023","Wed May 17 06:17:12 UTC 2023","13619","","Storing checkpointer on target migration","","Storing checkpointer on target migration","should not flag migration as ran if the browser was offline","should not flag migration as ran if the browser was offline",""
"passed","Wed May 17 06:45:51 UTC 2023","Wed May 17 06:46:18 UTC 2023","27349","","Create user for contacts: user replace: for an offline user","","Create user for contacts: user replace: for an offline user","creates new user when replace_user form is submitted for contact associated with multiple users","creates new user when replace_user form is submitted for contact associated with multiple users",""
"passed","Wed May 17 06:32:38 UTC 2023","Wed May 17 06:32:39 UTC 2023","912","","Privacy policy: for an online user","","Privacy policy: for an online user","should not show on refresh","should not show on refresh",""
"passed","Wed May 17 06:22:04 UTC 2023","Wed May 17 06:22:05 UTC 2023","812","","Submit a death report","","Submit a death report","Should verify that the report related to the death was created","Should verify that the report related to the death was created",""
"passed","Wed May 17 06:11:21 UTC 2023","Wed May 17 06:11:25 UTC 2023","3845","","Targets","","Targets","should display correct message when targets are disabled","should display correct message when targets are disabled",""
"passed","Wed May 17 06:40:31 UTC 2023","Wed May 17 06:40:35 UTC 2023","4343","","Tasks group landing page: for chw","","Tasks group landing page: for chw","should display tasks group landing page after task completion","should display tasks group landing page after task completion",""
"passed","Wed May 17 06:29:15 UTC 2023","Wed May 17 06:29:16 UTC 2023","1363","","More Options Menu - Offline User: all permissions enabled","","More Options Menu - Offline User: all permissions enabled"," - Contact Tab - contact selected"," - Contact Tab - contact selected",""
"passed","Wed May 17 06:12:03 UTC 2023","Wed May 17 06:12:14 UTC 2023","10981","","Creating custom places","","Creating custom places","the RHS button show the appropriate label when multiple places exist at the current level","the RHS button show the appropriate label when multiple places exist at the current level",""
"passed","Wed May 17 06:38:57 UTC 2023","Wed May 17 06:38:58 UTC 2023","1054","","Send message","","Send message","should reply to an existing message - raw phone number","should reply to an existing message - raw phone number",""
"passed","Wed May 17 06:48:43 UTC 2023","Wed May 17 06:48:47 UTC 2023","3616","","MessageFormat","","MessageFormat","should display plurals correctly","should display plurals correctly",""
"passed","Wed May 17 06:35:42 UTC 2023","Wed May 17 06:35:47 UTC 2023","4815","","generating short codes","","generating short codes","create case ID","create case ID",""
"passed","Wed May 17 06:42:25 UTC 2023","Wed May 17 06:42:36 UTC 2023","10771","","Create user when adding contact","","Create user when adding contact","Does not create a new user when the transition fails","Does not create a new user when the transition fails",""
"passed","Wed May 17 06:16:45 UTC 2023","Wed May 17 06:16:58 UTC 2023","13548","","Storing checkpointer on target migration","","Storing checkpointer on target migration","should copy existent browser checkpointer when db is not migrated","should copy existent browser checkpointer when db is not migrated",""
"passed","Wed May 17 06:24:59 UTC 2023","Wed May 17 06:25:03 UTC 2023","4334","","RepeatForm: Repeat form with select","","RepeatForm: Repeat form with select","should display the initial form and its repeated content in the default language","should display the initial form and its repeated content in the default language",""
"passed","Wed May 17 06:50:23 UTC 2023","Wed May 17 06:50:25 UTC 2023","1420","","User Test Cases ->: Invalid entries -> ","","User Test Cases ->: Invalid entries -> ","should require place and contact for restricted user","should require place and contact for restricted user",""
"skipped","Wed May 17 06:20:41 UTC 2023","Wed May 17 06:20:53 UTC 2023","12355","","Family form","","Family form","Submit Add Family form","Submit Add Family form",""
"passed","Wed May 17 06:47:26 UTC 2023","Wed May 17 06:48:08 UTC 2023","41946","","Create user for contacts: user replace: for an offline user","","Create user for contacts: user replace: for an offline user","does not create any new user nor does it reparent new reports when the transition fails","does not create any new user nor does it reparent new reports when the transition fails",""
"passed","Wed May 17 06:13:19 UTC 2023","Wed May 17 06:13:23 UTC 2023","4363","","Contact details page: Permissions to show reports and tasks","","Contact details page: Permissions to show reports and tasks","should not show reports when permission is disabled","should not show reports when permission is disabled",""
"passed","Wed May 17 06:24:41 UTC 2023","Wed May 17 06:24:46 UTC 2023","5322","","RepeatForm: Repeat form with count input","","RepeatForm: Repeat form with count input","should display the initial form and its repeated content in Nepali","should display the initial form and its repeated content in Nepali",""
"passed","Wed May 17 06:17:43 UTC 2023","Wed May 17 06:17:44 UTC 2023","1000","","db-sync","","db-sync","should filter locally purged docs","should filter locally purged docs",""
"passed","Wed May 17 06:38:22 UTC 2023","Wed May 17 06:38:31 UTC 2023","8391","","Message tab breadcrumbs","","Message tab breadcrumbs","should display messages with breadcrumbs for online user","should display messages with breadcrumbs for online user",""
"passed","Wed May 17 06:35:18 UTC 2023","Wed May 17 06:35:24 UTC 2023","5917","","Delete Reports","","Delete Reports","Should delete report","Should delete report",""
"passed","Wed May 17 06:40:45 UTC 2023","Wed May 17 06:40:51 UTC 2023","5615","","Tasks group landing page: for chw","","Tasks group landing page: for chw","should not show page when there are no more household tasks","should not show page when there are no more household tasks",""
"passed","Wed May 17 06:32:40 UTC 2023","Wed May 17 06:32:44 UTC 2023","4673","","Privacy policy: for an online user","","Privacy policy: for an online user","should not show on subsequent login","should not show on subsequent login",""
"passed","Wed May 17 06:30:38 UTC 2023","Wed May 17 06:30:39 UTC 2023","429","","- permissions disabled: - export permissions disabled","","- permissions disabled: - export permissions disabled","- Message tab","- Message tab",""
"passed","Wed May 17 06:36:07 UTC 2023","Wed May 17 06:36:10 UTC 2023","3147","","Reports Subject","","Reports Subject","should create a report using patient name","should create a report using patient name",""
"passed","Wed May 17 06:40:54 UTC 2023","Wed May 17 06:40:59 UTC 2023","4961","","Tasks group landing page: for supervisor","","Tasks group landing page: for supervisor","should have tasks","should have tasks",""
"passed","Wed May 17 06:31:23 UTC 2023","Wed May 17 06:31:25 UTC 2023","2272","","bfcache: webapp","","bfcache: webapp","should redirect to login page when session is expired","should redirect to login page when session is expired",""
"passed","Wed May 17 06:31:48 UTC 2023","Wed May 17 06:31:50 UTC 2023","1701","","Navigation tests","","Navigation tests","should open tasks tab","should open tasks tab",""
"passed","Wed May 17 06:23:31 UTC 2023","Wed May 17 06:23:42 UTC 2023","11120","","Pregnancy danger sign follow-up form","","Pregnancy danger sign follow-up form","Submit and validate Pregnancy danger sign follow-up form and keeps the report minified","Submit and validate Pregnancy danger sign follow-up form and keeps the report minified",""
"passed","Wed May 17 06:28:36 UTC 2023","Wed May 17 06:28:42 UTC 2023","5816","","should renew token","","should renew token","Refresh page multiple times and verify token gets renewed","Refresh page multiple times and verify token gets renewed",""
"passed","Wed May 17 06:37:09 UTC 2023","Wed May 17 06:37:13 UTC 2023","4613","","Service worker cache","","Service worker cache","confirm initial list of cached resources","confirm initial list of cached resources",""
"passed","Wed May 17 06:29:16 UTC 2023","Wed May 17 06:29:18 UTC 2023","1387","","More Options Menu - Offline User: all permissions enabled","","More Options Menu - Offline User: all permissions enabled"," - Contact Tab - with same facility_id"," - Contact Tab - with same facility_id",""
"passed","Wed May 17 06:29:21 UTC 2023","Wed May 17 06:29:37 UTC 2023","15543","","More Options Menu - Offline User: all permissions disabled","","More Options Menu - Offline User: all permissions disabled"," - all tabs, kebab menu not available"," - all tabs, kebab menu not available",""
"passed","Wed May 17 06:25:53 UTC 2023","Wed May 17 06:26:02 UTC 2023","8493","","Submit Photo Upload form","","Submit Photo Upload form","submit and edit (no changes)","submit and edit (no changes)",""
"passed","Wed May 17 06:14:06 UTC 2023","Wed May 17 06:14:31 UTC 2023","24527","","Mute/Unmute contacts using a specific form.","","Mute/Unmute contacts using a specific form.","Should mute a contact using the defined mute_forms (death_report).","Should mute a contact using the defined mute_forms (death_report).",""
"passed","Wed May 17 06:18:01 UTC 2023","Wed May 17 06:19:16 UTC 2023","74318","","initial-replication","","initial-replication","should log user in","should log user in",""
"passed","Wed May 17 06:50:31 UTC 2023","Wed May 17 06:50:38 UTC 2023","7577","","Bulk User Creation ->","","Bulk User Creation ->","should show an upload summary with a successful upload and a failed upload","should show an upload summary with a successful upload and a failed upload",""
"passed","Wed May 17 06:50:11 UTC 2023","Wed May 17 06:50:19 UTC 2023","8745","","User Test Cases ->: Invalid entries -> ","","User Test Cases ->: Invalid entries -> ","TestCase for required","TestCase for required",""
"passed","Wed May 17 06:31:08 UTC 2023","Wed May 17 06:31:10 UTC 2023","2070","","Online User:  - Options enabled when there are items","","Online User:  - Options enabled when there are items","- Reports tab - options enabled when XML report selected","- Reports tab - options enabled when XML report selected",""
"passed","Wed May 17 06:30:41 UTC 2023","Wed May 17 06:30:42 UTC 2023","1171","","- permissions disabled: - DELETE permissions disabled","","- permissions disabled: - DELETE permissions disabled","- Report Tab - option disabled when report selected","- Report Tab - option disabled when report selected",""
"passed","Wed May 17 06:19:16 UTC 2023","Wed May 17 06:19:51 UTC 2023","35753","","initial-replication","","initial-replication","should support ""disconnects""","should support ""disconnects""",""
"passed","Wed May 17 06:23:22 UTC 2023","Wed May 17 06:23:22 UTC 2023","619","","Contact Delivery Form","","Contact Delivery Form","The past pregnancy card should show","The past pregnancy card should show",""
"passed","Wed May 17 06:33:10 UTC 2023","Wed May 17 06:34:17 UTC 2023","66801","","purge","","purge","purging runs on sync and startup","purging runs on sync and startup",""
"passed","Wed May 17 06:40:35 UTC 2023","Wed May 17 06:40:37 UTC 2023","2287","","Tasks group landing page: for chw","","Tasks group landing page: for chw","should open task from the same group","should open task from the same group",""
"passed","Wed May 17 06:22:14 UTC 2023","Wed May 17 06:22:26 UTC 2023","12488","","Edit report with attachmnet","","Edit report with attachmnet","should remove attachment when saving","should remove attachment when saving",""
"skipped","Wed May 17 06:25:21 UTC 2023","Wed May 17 06:25:21 UTC 2023","0","","Submit Default Delivery Report","","Submit Default Delivery Report","open, submit and edit default delivery form","open, submit and edit default delivery form",""
"passed","Wed May 17 06:13:55 UTC 2023","Wed May 17 06:14:00 UTC 2023","5306","","Export Contacts","","Export Contacts","Should download export file","Should download export file",""
"passed","Wed May 17 06:43:35 UTC 2023","Wed May 17 06:44:20 UTC 2023","45023","","Create user for contacts: user replace: for an offline user","","Create user for contacts: user replace: for an offline user","creates a new user and re-parents reports when the replace_user form is submitted","creates a new user and re-parents reports when the replace_user form is submitted",""
"passed","Wed May 17 06:14:51 UTC 2023","Wed May 17 06:14:53 UTC 2023","1724","","Mute/Unmute contacts using a specific form.","","Mute/Unmute contacts using a specific form.","Should show a popup when trying to submit a non-unmuting form against a muted contact","Should show a popup when trying to submit a non-unmuting form against a muted contact",""
"passed","Wed May 17 06:40:08 UTC 2023","Wed May 17 06:40:12 UTC 2023","4300","","Tasks tab breadcrumbs: for supervisor","","Tasks tab breadcrumbs: for supervisor","should display correct tasks with breadcrumbs for supervisor","should display correct tasks with breadcrumbs for supervisor",""
"passed","Wed May 17 06:25:08 UTC 2023","Wed May 17 06:25:15 UTC 2023","6412","","Countdown timer widget","","Countdown timer widget","interact with timer and submit","interact with timer and submit",""
"passed","Wed May 17 06:30:42 UTC 2023","Wed May 17 06:30:44 UTC 2023","2034","","- permissions disabled: - EDIT permissions disabled","","- permissions disabled: - EDIT permissions disabled"," - Contact Tab - contact selected"," - Contact Tab - contact selected",""
"passed","Wed May 17 06:49:03 UTC 2023","Wed May 17 06:49:07 UTC 2023","3958","","Bikram Sambat date display","","Bikram Sambat date display","enketo xpath extension function should display correct values when Nepali is selected","enketo xpath extension function should display correct values when Nepali is selected",""
"passed","Wed May 17 06:13:23 UTC 2023","Wed May 17 06:13:28 UTC 2023","4934","","Contact details page: Permissions to show reports and tasks","","Contact details page: Permissions to show reports and tasks","should not show tasks when permission is disabled","should not show tasks when permission is disabled",""
"passed","Wed May 17 06:11:07 UTC 2023","Wed May 17 06:11:14 UTC 2023","6576","","Targets","","Targets","should display targets from default config","should display targets from default config",""
"passed","Wed May 17 06:32:17 UTC 2023","Wed May 17 06:32:24 UTC 2023","6427","","Privacy policy: for an offline user","","Privacy policy: for an offline user","should show french policy on secondary login","should show french policy on secondary login",""
"passed","Wed May 17 06:30:34 UTC 2023","Wed May 17 06:30:37 UTC 2023","2592","","- permissions disabled: - export permissions disabled","","- permissions disabled: - export permissions disabled"," - Contact Tab - contact selected"," - Contact Tab - contact selected",""
"passed","Wed May 17 06:39:19 UTC 2023","Wed May 17 06:39:33 UTC 2023","14359","","Task list due dates","","Task list due dates","should display correct due dates with default settings","should display correct due dates with default settings",""
"passed","Wed May 17 06:11:30 UTC 2023","Wed May 17 06:11:41 UTC 2023","10264","","Creating custom places","","Creating custom places","the LHS button should show the appropriate label when only one action","the LHS button should show the appropriate label when only one action",""
"passed","Wed May 17 06:49:57 UTC 2023","Wed May 17 06:50:02 UTC 2023","4700","","User Test Cases ->: Invalid entries -> ","","User Test Cases ->: Invalid entries -> ","TestCase for The password must be at least 8 characters long.","TestCase for The password must be at least 8 characters long.",""
"passed","Wed May 17 06:31:37 UTC 2023","Wed May 17 06:31:39 UTC 2023","2286","","Hamburger Menu tests","","Hamburger Menu tests","should open Configuration app","should open Configuration app",""
"passed","Wed May 17 06:16:20 UTC 2023","Wed May 17 06:16:22 UTC 2023","1923","","Test Contact Search Functionality","","Test Contact Search Functionality","search should clear RHS selected contact","search should clear RHS selected contact",""
"passed","Wed May 17 06:32:11 UTC 2023","Wed May 17 06:32:17 UTC 2023","6158","","Privacy policy: for an offline user","","Privacy policy: for an offline user","should not show on subsequent login","should not show on subsequent login",""
"passed","Wed May 17 06:25:27 UTC 2023","Wed May 17 06:25:34 UTC 2023","6933","","Submit Enketo form","","Submit Enketo form","submits on reports tab","submits on reports tab",""
"passed","Wed May 17 06:31:36 UTC 2023","Wed May 17 06:31:36 UTC 2023","265","","Hamburger Menu tests","","Hamburger Menu tests","should open User settings","should open User settings",""
"passed","Wed May 17 06:32:39 UTC 2023","Wed May 17 06:32:40 UTC 2023","694","","Privacy policy: for an online user","","Privacy policy: for an online user","should display when navigating to the privacy policy page","should display when navigating to the privacy policy page",""
"passed","Wed May 17 06:17:12 UTC 2023","Wed May 17 06:17:27 UTC 2023","14945","","Storing checkpointer on target migration","","Storing checkpointer on target migration","should re-upload docs when the server rolls back","should re-upload docs when the server rolls back",""
