"Status","Start Time","Stop Time","Duration in ms","Parent Suite","Suite","Sub Suite","Test Class","Test Method","Name","Description"
"passed","Tue Jun 13 22:46:45 UTC 2023","Tue Jun 13 22:46:48 UTC 2023","2773","","africas talking api: - gateway submits WT sms status updates","","africas talking api: - gateway submits WT sms status updates","- shows content","- shows content",""
"passed","Tue Jun 13 22:43:27 UTC 2023","Tue Jun 13 22:43:33 UTC 2023","6182","","Reports tab breadcrumbs","","Reports tab breadcrumbs","should display reports with breadcrumbs for online user","should display reports with breadcrumbs for online user",""
"passed","Tue Jun 13 22:15:28 UTC 2023","Tue Jun 13 22:15:31 UTC 2023","3107","","About page","","About page","should open the about page","should open the about page",""
"passed","Tue Jun 13 22:49:15 UTC 2023","Tue Jun 13 22:49:19 UTC 2023","4617","","Send message","","Send message","should reply to an existing message and add a new recipient - raw phone number ","should reply to an existing message and add a new recipient - raw phone number ",""
"passed","Tue Jun 13 22:35:59 UTC 2023","Tue Jun 13 22:36:04 UTC 2023","4720","","Token login","","Token login","should redirect the user to the app if already logged in","should redirect the user to the app if already logged in",""
"passed","Tue Jun 13 22:46:12 UTC 2023","Tue Jun 13 22:46:17 UTC 2023","5677","","Service worker cache","","Service worker cache","branding updates trigger login page refresh","branding updates trigger login page refresh",""
"passed","Tue Jun 13 23:01:36 UTC 2023","Tue Jun 13 23:01:41 UTC 2023","4682","","User Test Cases ->: Invalid entries -> ","","User Test Cases ->: Invalid entries -> ","TestCase for The password is too easy to guess.","TestCase for The password is too easy to guess.",""
"passed","Tue Jun 13 22:40:42 UTC 2023","Tue Jun 13 22:41:56 UTC 2023","73973","","purge","","purge","purging runs on sync and startup","purging runs on sync and startup",""
"passed","Tue Jun 13 22:38:57 UTC 2023","Tue Jun 13 22:39:00 UTC 2023","2807","","Hamburger Menu tests","","Hamburger Menu tests","should open Configuration app","should open Configuration app",""
"passed","Tue Jun 13 22:15:54 UTC 2023","Tue Jun 13 22:16:02 UTC 2023","8236","","Acessing the admin app","","Acessing the admin app","should allow admins to access the page","should allow admins to access the page",""
"passed","Tue Jun 13 22:59:41 UTC 2023","Tue Jun 13 22:59:53 UTC 2023","12771","","Enabling/disabling languages","","Enabling/disabling languages","should disable a language and enable another","should disable a language and enable another",""
"passed","Tue Jun 13 22:44:12 UTC 2023","Tue Jun 13 22:44:18 UTC 2023","6088","","Delete Reports","","Delete Reports","Should delete report","Should delete report",""
"passed","Tue Jun 13 22:23:24 UTC 2023","Tue Jun 13 22:23:32 UTC 2023","8616","","db-sync","","db-sync","should not filter allowed docs","should not filter allowed docs",""
"passed","Tue Jun 13 22:34:52 UTC 2023","Tue Jun 13 22:34:53 UTC 2023","737","","Submit an undo death report","","Submit an undo death report","Should verify that the undo death report was created","Should verify that the undo death report was created",""
"passed","Tue Jun 13 22:19:15 UTC 2023","Tue Jun 13 22:19:20 UTC 2023","4539","","Edit contacts with the default config. ","","Edit contacts with the default config. ","should remove the primary contact from the clinic when the contact is deleted","should remove the primary contact from the clinic when the contact is deleted",""
"passed","Tue Jun 13 22:19:04 UTC 2023","Tue Jun 13 22:19:15 UTC 2023","11326","","Edit contacts with the default config. ","","Edit contacts with the default config. ","should edit contact name","should edit contact name",""
"passed","Tue Jun 13 22:33:24 UTC 2023","Tue Jun 13 22:33:33 UTC 2023","8998","","Training Cards","","Training Cards","should cancel training and not save it as completed","should cancel training and not save it as completed",""
"passed","Tue Jun 13 22:33:14 UTC 2023","Tue Jun 13 22:33:18 UTC 2023","4420","","Submit Z-Score form","","Submit Z-Score form","saves z-score values","saves z-score values",""
"passed","Tue Jun 13 22:31:56 UTC 2023","Tue Jun 13 22:32:00 UTC 2023","3985","","RepeatForm: Repeat form with select","","RepeatForm: Repeat form with select","should display the initial form and its repeated content in the default language","should display the initial form and its repeated content in the default language",""
"passed","Tue Jun 13 22:32:57 UTC 2023","Tue Jun 13 22:33:01 UTC 2023","4315","","Submit Photo Upload form","","Submit Photo Upload form","submit and edit (with changes)","submit and edit (with changes)",""
"passed","Tue Jun 13 22:32:30 UTC 2023","Tue Jun 13 22:32:37 UTC 2023","6610","","Submit Enketo form","","Submit Enketo form","allows forms with required notes to be submitted","allows forms with required notes to be submitted",""
"passed","Tue Jun 13 22:38:45 UTC 2023","Tue Jun 13 22:38:47 UTC 2023","2553","","bfcache: admin app","","bfcache: admin app","should redirect to login page when session is expired","should redirect to login page when session is expired",""
"passed","Tue Jun 13 22:27:16 UTC 2023","Tue Jun 13 22:29:00 UTC 2023","103662","","Submit a death report","","Submit a death report","Should submit a death report","Should submit a death report",""
"passed","Tue Jun 13 22:46:42 UTC 2023","Tue Jun 13 22:46:45 UTC 2023","3521","","africas talking api: - gateway submits new WT sms messages","","africas talking api: - gateway submits new WT sms messages","- shows content","- shows content",""
"passed","Tue Jun 13 22:48:06 UTC 2023","Tue Jun 13 22:48:09 UTC 2023","3389","","RapidPro SMS Gateway: Webapp Terminating messages","","RapidPro SMS Gateway: Webapp Terminating messages","should create reports","should create reports",""
"passed","Tue Jun 13 22:35:48 UTC 2023","Tue Jun 13 22:35:53 UTC 2023","5626","","should renew token","","should renew token","Refresh page multiple times and verify token gets renewed","Refresh page multiple times and verify token gets renewed",""
"passed","Tue Jun 13 22:31:46 UTC 2023","Tue Jun 13 22:31:51 UTC 2023","4941","","RepeatForm: Repeat form with repeat button","","RepeatForm: Repeat form with repeat button","should display the initial form and its repeated content in Swahili","should display the initial form and its repeated content in Swahili",""
"passed","Tue Jun 13 22:19:27 UTC 2023","Tue Jun 13 22:19:34 UTC 2023","6031","","Export Contacts","","Export Contacts","Should download export file","Should download export file",""
"passed","Tue Jun 13 22:18:38 UTC 2023","Tue Jun 13 22:18:46 UTC 2023","8170","","Contact details page: Permissions to show reports and tasks","","Contact details page: Permissions to show reports and tasks","should show reports and tasks when permissions are enabled","should show reports and tasks when permissions are enabled",""
"passed","Tue Jun 13 22:23:38 UTC 2023","Tue Jun 13 22:23:40 UTC 2023","2754","","db-sync","","db-sync","should filter ddocs","should filter ddocs",""
"passed","Tue Jun 13 22:30:25 UTC 2023","Tue Jun 13 22:30:36 UTC 2023","11169","","Pregnancy danger sign follow-up form","","Pregnancy danger sign follow-up form","Submit and validate Pregnancy danger sign follow-up form and keeps the report minified","Submit and validate Pregnancy danger sign follow-up form and keeps the report minified",""
"passed","Tue Jun 13 22:23:01 UTC 2023","Tue Jun 13 22:23:17 UTC 2023","16093","","Storing checkpointer on target migration","","Storing checkpointer on target migration","should re-upload docs when the server rolls back","should re-upload docs when the server rolls back",""
"passed","Tue Jun 13 22:41:56 UTC 2023","Tue Jun 13 22:43:12 UTC 2023","76046","","purge","","purge","purging runs when using chtScriptApi","purging runs when using chtScriptApi",""
"passed","Tue Jun 13 22:31:42 UTC 2023","Tue Jun 13 22:31:46 UTC 2023","4008","","RepeatForm: Repeat form with count input","","RepeatForm: Repeat form with count input","should display the initial form and its repeated content in English","should display the initial form and its repeated content in English",""
"passed","Tue Jun 13 23:00:44 UTC 2023","Tue Jun 13 23:00:47 UTC 2023","3035","","Bikram Sambat date display","","Bikram Sambat date display","SMS report shows bsAggreDate type as date field correctly","SMS report shows bsAggreDate type as date field correctly",""
"passed","Tue Jun 13 23:02:21 UTC 2023","Tue Jun 13 23:02:29 UTC 2023","8197","","Create user meta db : ","","Create user meta db : ","should allow a new user to read/write from meta db","should allow a new user to read/write from meta db",""
"passed","Tue Jun 13 22:35:09 UTC 2023","Tue Jun 13 22:35:14 UTC 2023","5154","","Login page funcionality tests: Log out","","Login page funcionality tests: Log out","should show a warning before log out","should show a warning before log out",""
"passed","Tue Jun 13 22:51:57 UTC 2023","Tue Jun 13 22:52:00 UTC 2023","3354","","Tasks group landing page: for supervisor","","Tasks group landing page: for supervisor","should not display task landing page after task completion","should not display task landing page after task completion",""
"skipped","Tue Jun 13 22:32:17 UTC 2023","Tue Jun 13 22:32:17 UTC 2023","0","","Submit Default Delivery Report","","Submit Default Delivery Report","open, submit and edit default delivery form","open, submit and edit default delivery form",""
"passed","Tue Jun 13 22:29:00 UTC 2023","Tue Jun 13 22:29:01 UTC 2023","707","","Submit a death report","","Submit a death report","Should verify that the report related to the death was created","Should verify that the report related to the death was created",""
"passed","Tue Jun 13 22:43:58 UTC 2023","Tue Jun 13 22:44:06 UTC 2023","7982","","Report Filter","","Report Filter","should filter by date","should filter by date",""
"passed","Tue Jun 13 22:48:38 UTC 2023","Tue Jun 13 22:48:49 UTC 2023","11610","","RapidPro SMS Gateway: Webapp originating messages and state updates","","RapidPro SMS Gateway: Webapp originating messages and state updates","should handle rate limiting when polling","should handle rate limiting when polling",""
"passed","Tue Jun 13 22:21:36 UTC 2023","Tue Jun 13 22:21:51 UTC 2023","15431","","Create Person Under Area","","Create Person Under Area","create person under area should only see children","create person under area should only see children",""
"passed","Tue Jun 13 22:36:10 UTC 2023","Tue Jun 13 22:36:13 UTC 2023","3435","","Token login","","Token login","should log the user in when token is correct","should log the user in when token is correct",""
"passed","Tue Jun 13 22:37:57 UTC 2023","Tue Jun 13 22:38:00 UTC 2023","2144","","- permissions disabled: - EDIT permissions disabled","","- permissions disabled: - EDIT permissions disabled"," - Contact Tab - contact selected"," - Contact Tab - contact selected",""
"passed","Tue Jun 13 22:35:28 UTC 2023","Tue Jun 13 22:35:31 UTC 2023","3035","","Login page funcionality tests: Log in","","Login page funcionality tests: Log in","should have a title","should have a title",""
"passed","Tue Jun 13 22:16:18 UTC 2023","Tue Jun 13 22:16:26 UTC 2023","8380","","Targets","","Targets","should display correct message when no target found","should display correct message when no target found",""
"passed","Tue Jun 13 22:36:50 UTC 2023","Tue Jun 13 22:36:51 UTC 2023","42","","More Options Menu - Offline User","","More Options Menu - Offline User","""after all"" hook for More Options Menu - Offline User","""after all"" hook for More Options Menu - Offline User",""
"passed","Tue Jun 13 22:45:09 UTC 2023","Tue Jun 13 22:45:12 UTC 2023","3319","","Reports Subject","","Reports Subject","should create a report using place_id with a place_uuid","should create a report using place_id with a place_uuid",""
"passed","Tue Jun 13 22:35:19 UTC 2023","Tue Jun 13 22:35:23 UTC 2023","4624","","Login page funcionality tests: Log in","","Login page funcionality tests: Log in","should set correct cookies","should set correct cookies",""
"passed","Tue Jun 13 22:22:45 UTC 2023","Tue Jun 13 22:23:01 UTC 2023","15630","","Storing checkpointer on target migration","","Storing checkpointer on target migration","should not flag migration as ran if the browser was offline","should not flag migration as ran if the browser was offline",""
"passed","Tue Jun 13 22:36:31 UTC 2023","Tue Jun 13 22:36:33 UTC 2023","2020","","More Options Menu - Offline User: all permissions enabled","","More Options Menu - Offline User: all permissions enabled","Report tab - options enabled when sms report selected","Report tab - options enabled when sms report selected",""
"passed","Tue Jun 13 22:30:03 UTC 2023","Tue Jun 13 22:30:15 UTC 2023","12350","","Contact Delivery Form","","Contact Delivery Form","Complete a delivery: Process a delivery with a live child and facility birth.","Complete a delivery: Process a delivery with a live child and facility birth.",""
"passed","Tue Jun 13 22:21:22 UTC 2023","Tue Jun 13 22:21:29 UTC 2023","6565","","Create new lineage structure","","Create new lineage structure","should edit the name of the Family","should edit the name of the Family",""
"passed","Tue Jun 13 22:45:52 UTC 2023","Tue Jun 13 22:46:00 UTC 2023","7941","","Reports Sidebar Filter","","Reports Sidebar Filter","should filter by date","should filter by date",""
"passed","Tue Jun 13 22:54:00 UTC 2023","Tue Jun 13 22:54:25 UTC 2023","24864","","Create user when adding contact","","Create user when adding contact","creates a new user when Sentinel recovers from outage","creates a new user when Sentinel recovers from outage",""
"passed","Tue Jun 13 22:58:32 UTC 2023","Tue Jun 13 22:58:51 UTC 2023","19522","","Create user for contacts: user replace: for an offline user","","Create user for contacts: user replace: for an offline user","does not create a new user or re-parent reports when the transition is disabled","does not create a new user or re-parent reports when the transition is disabled",""
"passed","Tue Jun 13 22:31:26 UTC 2023","Tue Jun 13 22:31:27 UTC 2023","691","","Pregnancy registration","","Pregnancy registration","Should verify that the report related the pregnancy was created","Should verify that the report related the pregnancy was created",""
"passed","Tue Jun 13 22:36:33 UTC 2023","Tue Jun 13 22:36:34 UTC 2023","1402","","More Options Menu - Offline User: all permissions enabled","","More Options Menu - Offline User: all permissions enabled","Report tab - options enabled when xml report selected","Report tab - options enabled when xml report selected",""
"passed","Tue Jun 13 22:21:03 UTC 2023","Tue Jun 13 22:21:10 UTC 2023","6975","","Create new lineage structure","","Create new lineage structure","should edit a name of the health facility","should edit a name of the health facility",""
"passed","Tue Jun 13 22:21:58 UTC 2023","Tue Jun 13 22:22:03 UTC 2023","5235","","Test Contact Search Functionality","","Test Contact Search Functionality","search by NON empty string should display results with contains match and clears search","search by NON empty string should display results with contains match and clears search",""
"passed","Tue Jun 13 22:36:34 UTC 2023","Tue Jun 13 22:36:50 UTC 2023","16005","","More Options Menu - Offline User: all permissions disabled","","More Options Menu - Offline User: all permissions disabled"," - all tabs, kebab menu not available"," - all tabs, kebab menu not available",""
"passed","Tue Jun 13 22:47:43 UTC 2023","Tue Jun 13 22:47:47 UTC 2023","3806","","Message tab breadcrumbs","","Message tab breadcrumbs","should display messages with updated breadcrumbs for offline user","should display messages with updated breadcrumbs for offline user",""
"passed","Tue Jun 13 22:35:03 UTC 2023","Tue Jun 13 22:35:06 UTC 2023","2940","","Login page funcionality tests: Locale","","Login page funcionality tests: Locale","should change locale to French","should change locale to French",""
"passed","Tue Jun 13 22:47:35 UTC 2023","Tue Jun 13 22:47:43 UTC 2023","8738","","Message tab breadcrumbs","","Message tab breadcrumbs","should display messages with breadcrumbs for online user","should display messages with breadcrumbs for online user",""
"passed","Tue Jun 13 23:01:00 UTC 2023","Tue Jun 13 23:01:01 UTC 2023","1226","","Adding new language","","Adding new language","should be set as Default language ","should be set as Default language ",""
"passed","Tue Jun 13 22:37:45 UTC 2023","Tue Jun 13 22:37:50 UTC 2023","4646","","- permissions disabled","","- permissions disabled","""before all"" hook for - permissions disabled","""before all"" hook for - permissions disabled",""
"passed","Tue Jun 13 22:32:42 UTC 2023","Tue Jun 13 22:32:44 UTC 2023","1565","","Submit Enketo form","","Submit Enketo form","cancelling form with input triggers confirmation dialog box","cancelling form with input triggers confirmation dialog box",""
"passed","Tue Jun 13 22:32:05 UTC 2023","Tue Jun 13 22:32:12 UTC 2023","6164","","Countdown timer widget","","Countdown timer widget","interact with timer and submit","interact with timer and submit",""
"passed","Tue Jun 13 22:15:45 UTC 2023","Tue Jun 13 22:15:54 UTC 2023","8853","","Acessing the admin app","","Acessing the admin app","should show access error when accessing as an offline user","should show access error when accessing as an offline user",""
"passed","Tue Jun 13 22:47:58 UTC 2023","Tue Jun 13 22:47:59 UTC 2023","1185","","RapidPro SMS Gateway: Webapp Terminating messages","","RapidPro SMS Gateway: Webapp Terminating messages","should fail with incorrect authentication","should fail with incorrect authentication",""
"passed","Tue Jun 13 22:22:30 UTC 2023","Tue Jun 13 22:22:45 UTC 2023","15200","","Storing checkpointer on target migration","","Storing checkpointer on target migration","should copy existent browser checkpointer when db is not migrated","should copy existent browser checkpointer when db is not migrated",""
"passed","Tue Jun 13 22:47:59 UTC 2023","Tue Jun 13 22:48:00 UTC 2023","1382","","RapidPro SMS Gateway: Webapp Terminating messages","","RapidPro SMS Gateway: Webapp Terminating messages","should fail with malformed authentication","should fail with malformed authentication",""
"passed","Tue Jun 13 22:50:58 UTC 2023","Tue Jun 13 22:51:03 UTC 2023","5056","","Tasks tab breadcrumbs: for chw","","Tasks tab breadcrumbs: for chw","should display correct tasks with breadcrumbs for chw","should display correct tasks with breadcrumbs for chw",""
"passed","Tue Jun 13 22:39:42 UTC 2023","Tue Jun 13 22:39:43 UTC 2023","706","","Privacy policy: for an offline user","","Privacy policy: for an offline user","should not show on refresh","should not show on refresh",""
"passed","Tue Jun 13 22:25:20 UTC 2023","Tue Jun 13 22:26:01 UTC 2023","40826","","initial-replication","","initial-replication","should support ""disconnects""","should support ""disconnects""",""
"passed","Tue Jun 13 22:36:25 UTC 2023","Tue Jun 13 22:36:26 UTC 2023","1840","","More Options Menu - Offline User: all permissions enabled","","More Options Menu - Offline User: all permissions enabled","- Message tab","- Message tab",""
"passed","Tue Jun 13 22:34:53 UTC 2023","Tue Jun 13 22:34:54 UTC 2023","1268","","Submit an undo death report","","Submit an undo death report","Should verify that the counter for the Deaths was set to 0.","Should verify that the counter for the Deaths was set to 0.",""
"passed","Tue Jun 13 22:47:23 UTC 2023","Tue Jun 13 22:47:28 UTC 2023","5681","","Link SMS to patient without passing id","","Link SMS to patient without passing id","Send SMS without patient_id and report created under person","Send SMS without patient_id and report created under person",""
"passed","Tue Jun 13 22:38:01 UTC 2023","Tue Jun 13 22:38:01 UTC 2023","40","","- permissions disabled","","- permissions disabled","""after all"" hook for - permissions disabled","""after all"" hook for - permissions disabled",""
"passed","Tue Jun 13 22:43:21 UTC 2023","Tue Jun 13 22:43:21 UTC 2023","711","","manifest.json","","manifest.json","works with custom branding doc","works with custom branding doc",""
"passed","Tue Jun 13 23:01:45 UTC 2023","Tue Jun 13 23:01:54 UTC 2023","8869","","User Test Cases ->: Invalid entries -> ","","User Test Cases ->: Invalid entries -> ","TestCase for required","TestCase for required",""
"passed","Tue Jun 13 22:51:48 UTC 2023","Tue Jun 13 22:51:51 UTC 2023","3623","","Tasks group landing page: for chw","","Tasks group landing page: for chw","should not show page when submitting task for contact with no leaf type place in lineage","should not show page when submitting task for contact with no leaf type place in lineage",""
"passed","Tue Jun 13 22:51:34 UTC 2023","Tue Jun 13 22:51:38 UTC 2023","4373","","Tasks group landing page: for chw","","Tasks group landing page: for chw","should display modal when clicking on a task from another group","should display modal when clicking on a task from another group",""
"passed","Tue Jun 13 22:36:30 UTC 2023","Tue Jun 13 22:36:31 UTC 2023","1352","","More Options Menu - Offline User: all permissions enabled","","More Options Menu - Offline User: all permissions enabled"," - Contact Tab - with same facility_id"," - Contact Tab - with same facility_id",""
"passed","Tue Jun 13 22:47:54 UTC 2023","Tue Jun 13 22:47:54 UTC 2023","1","","RapidPro SMS Gateway","","RapidPro SMS Gateway","""before all"" hook for RapidPro SMS Gateway","""before all"" hook for RapidPro SMS Gateway",""
"passed","Tue Jun 13 23:01:24 UTC 2023","Tue Jun 13 23:01:27 UTC 2023","2591","","User Test Cases ->","","User Test Cases ->","""before all"" hook for User Test Cases ->","""before all"" hook for User Test Cases ->",""
"passed","Tue Jun 13 22:40:11 UTC 2023","Tue Jun 13 22:40:11 UTC 2023","644","","Privacy policy: for an online user","","Privacy policy: for an online user","should display when navigating to the privacy policy page","should display when navigating to the privacy policy page",""
"passed","Tue Jun 13 22:35:35 UTC 2023","Tue Jun 13 22:35:38 UTC 2023","2973","","Login page funcionality tests: Log in","","Login page funcionality tests: Log in","should try to sign in with blank auth and verify that credentials were incorrect","should try to sign in with blank auth and verify that credentials were incorrect",""
"passed","Tue Jun 13 22:33:07 UTC 2023","Tue Jun 13 22:33:14 UTC 2023","6841","","Submit Z-Score form","","Submit Z-Score form","Autofills zscore fields with correct values","Autofills zscore fields with correct values",""
"passed","Tue Jun 13 22:35:00 UTC 2023","Tue Jun 13 22:35:03 UTC 2023","3032","","Login page funcionality tests: Locale","","Login page funcionality tests: Locale","should show locale selector on login page","should show locale selector on login page",""
"passed","Tue Jun 13 22:30:15 UTC 2023","Tue Jun 13 22:30:16 UTC 2023","654","","Contact Delivery Form","","Contact Delivery Form","The past pregnancy card should show","The past pregnancy card should show",""
"passed","Tue Jun 13 22:22:13 UTC 2023","Tue Jun 13 22:22:30 UTC 2023","17364","","Storing checkpointer on target migration","","Storing checkpointer on target migration","should store replication checkpointers on target and source","should store replication checkpointers on target and source",""
"passed","Tue Jun 13 22:45:25 UTC 2023","Tue Jun 13 22:45:31 UTC 2023","6374","","Reports Subject","","Reports Subject","changes to a loaded or list report should be reflected in the UI ","changes to a loaded or list report should be reflected in the UI ",""
"passed","Tue Jun 13 22:39:32 UTC 2023","Tue Jun 13 22:39:42 UTC 2023","10403","","Privacy policy: for an offline user","","Privacy policy: for an offline user","should show the correct privacy policy on login","should show the correct privacy policy on login",""
"passed","Tue Jun 13 22:16:37 UTC 2023","Tue Jun 13 22:16:49 UTC 2023","12355","","Creating custom places","","Creating custom places","the LHS button should show the appropriate label when only one action","the LHS button should show the appropriate label when only one action",""
"passed","Tue Jun 13 22:20:52 UTC 2023","Tue Jun 13 22:20:55 UTC 2023","3373","","Create new lineage structure","","Create new lineage structure","Create new person","Create new person",""
"passed","Tue Jun 13 22:40:11 UTC 2023","Tue Jun 13 22:40:16 UTC 2023","4725","","Privacy policy: for an online user","","Privacy policy: for an online user","should not show on subsequent login","should not show on subsequent login",""
"passed","Tue Jun 13 22:36:04 UTC 2023","Tue Jun 13 22:36:05 UTC 2023","842","","Token login","","Token login","should display an error when token login is disabled","should display an error when token login is disabled",""
"passed","Tue Jun 13 22:36:26 UTC 2023","Tue Jun 13 22:36:28 UTC 2023","1939","","More Options Menu - Offline User: all permissions enabled","","More Options Menu - Offline User: all permissions enabled","- Contact tab - no contact selected","- Contact tab - no contact selected",""
"passed","Tue Jun 13 23:00:19 UTC 2023","Tue Jun 13 23:00:19 UTC 2023","905","","MessageFormat","","MessageFormat","should work with botched translations","should work with botched translations",""
"passed","Tue Jun 13 22:49:12 UTC 2023","Tue Jun 13 22:49:13 UTC 2023","1238","","Send message","","Send message","should reply to an existing message - raw phone number","should reply to an existing message - raw phone number",""
