"Status","Start Time","Stop Time","Duration in ms","Parent Suite","Suite","Sub Suite","Test Class","Test Method","Name","Description"
"passed","Mon Feb 06 20:50:04 UTC 2023","Mon Feb 06 20:50:10 UTC 2023","6127","","Submit Enketo form","","Submit Enketo form","submits on reports tab","submits on reports tab",""
"passed","Mon Feb 06 20:38:31 UTC 2023","Mon Feb 06 20:39:18 UTC 2023","46773","","Create user for contacts: for an offline user","","Create user for contacts: for an offline user","creates new user for the first version of a contact to sync and conflicting replacements ignored","creates new user for the first version of a contact to sync and conflicting replacements ignored",""
"passed","Mon Feb 06 20:50:13 UTC 2023","Mon Feb 06 20:50:14 UTC 2023","1458","","Submit Enketo form","","Submit Enketo form","cancelling form with input triggers confirmation dialog box","cancelling form with input triggers confirmation dialog box",""
"passed","Mon Feb 06 21:07:29 UTC 2023","Mon Feb 06 21:07:31 UTC 2023","2622","","sms-gateway api: - gateway submits new WT sms messages","","sms-gateway api: - gateway submits new WT sms messages","shows content","shows content",""
"passed","Mon Feb 06 21:07:38 UTC 2023","Mon Feb 06 21:07:44 UTC 2023","5604","","Link SMS to patient without passing id","","Link SMS to patient without passing id","Send SMS without patient_id and report created under person","Send SMS without patient_id and report created under person",""
"passed","Mon Feb 06 21:11:10 UTC 2023","Mon Feb 06 21:11:13 UTC 2023","2710","","Adding new language","","Adding new language","should reflect in config wizard","should reflect in config wizard",""
"passed","Mon Feb 06 21:11:21 UTC 2023","Mon Feb 06 21:11:23 UTC 2023","2370","","User Test Cases ->","","User Test Cases ->","""before all"" hook for User Test Cases ->","""before all"" hook for User Test Cases ->",""
"passed","Mon Feb 06 20:35:50 UTC 2023","Mon Feb 06 20:36:26 UTC 2023","35914","","Create user for contacts: for an offline user","","Create user for contacts: for an offline user","creates a new user and re-parents reports when the replace_user form is submitted","creates a new user and re-parents reports when the replace_user form is submitted",""
"passed","Mon Feb 06 20:43:22 UTC 2023","Mon Feb 06 20:43:42 UTC 2023","19737","","Mute/Unmute contacts using a specific form.","","Mute/Unmute contacts using a specific form.","Should unmute a contact using the defined unmute_forms (undo_death_report).","Should unmute a contact using the defined unmute_forms (undo_death_report).",""
"passed","Mon Feb 06 20:46:45 UTC 2023","Mon Feb 06 20:46:51 UTC 2023","6507","","Edit report with attachmnet","","Edit report with attachmnet","should save edits","should save edits",""
"passed","Mon Feb 06 20:47:14 UTC 2023","Mon Feb 06 20:47:15 UTC 2023","1291","","Contact Delivery Form","","Contact Delivery Form","The targets page should be updated","The targets page should be updated",""
"passed","Mon Feb 06 20:37:20 UTC 2023","Mon Feb 06 20:37:54 UTC 2023","33784","","Create user for contacts: for an offline user","","Create user for contacts: for an offline user","creates new user from latest replace_user form data if multiple are submitted before syncing","creates new user from latest replace_user form data if multiple are submitted before syncing",""
"passed","Mon Feb 06 20:41:28 UTC 2023","Mon Feb 06 20:41:33 UTC 2023","4911","","Add new district tests : ","","Add new district tests : ","should add new district with a new person","should add new district with a new person",""
"passed","Mon Feb 06 21:10:22 UTC 2023","Mon Feb 06 21:10:25 UTC 2023","3164","","Tasks group landing page: for supervisor","","Tasks group landing page: for supervisor","should not display task landing page after task completion","should not display task landing page after task completion",""
"passed","Mon Feb 06 20:54:47 UTC 2023","Mon Feb 06 20:54:48 UTC 2023","622","","Privacy policy: for an online user","","Privacy policy: for an online user","should display when navigating to the privacy policy page","should display when navigating to the privacy policy page",""
"broken","Mon Feb 06 21:00:28 UTC 2023","Mon Feb 06 21:02:02 UTC 2023","94100","","Service worker cache","","Service worker cache","login page translation updates trigger login page refresh","login page translation updates trigger login page refresh",""
"passed","Mon Feb 06 20:41:44 UTC 2023","Mon Feb 06 20:41:57 UTC 2023","12322","","Contact details page: Permissions to show reports and tasks","","Contact details page: Permissions to show reports and tasks","should show reports and tasks when permissions are enabled","should show reports and tasks when permissions are enabled",""
"passed","Mon Feb 06 20:41:33 UTC 2023","Mon Feb 06 20:41:36 UTC 2023","3376","","Add new district tests : ","","Add new district tests : ","should edit district","should edit district",""
"passed","Mon Feb 06 20:50:18 UTC 2023","Mon Feb 06 20:50:27 UTC 2023","8089","","Submit Photo Upload form","","Submit Photo Upload form","submit and edit (no changes)","submit and edit (no changes)",""
"passed","Mon Feb 06 20:53:12 UTC 2023","Mon Feb 06 20:53:13 UTC 2023","736","","Hamburger Menu tests","","Hamburger Menu tests","should open User settings","should open User settings",""
"passed","Mon Feb 06 21:11:09 UTC 2023","Mon Feb 06 21:11:10 UTC 2023","1270","","Adding new language","","Adding new language","should be set as Default language ","should be set as Default language ",""
"passed","Mon Feb 06 20:57:49 UTC 2023","Mon Feb 06 20:57:55 UTC 2023","5863","","Export Reports","","Export Reports","Should download export file","Should download export file",""
"passed","Mon Feb 06 20:53:25 UTC 2023","Mon Feb 06 20:53:27 UTC 2023","1506","","Navigation tests","","Navigation tests","should open Reports or History tab","should open Reports or History tab",""
"passed","Mon Feb 06 20:50:35 UTC 2023","Mon Feb 06 20:50:41 UTC 2023","6392","","Submit Z-Score form","","Submit Z-Score form","Autofills zscore fields with correct values","Autofills zscore fields with correct values",""
"passed","Mon Feb 06 20:53:20 UTC 2023","Mon Feb 06 20:53:23 UTC 2023","3410","","Navigation tests","","Navigation tests","should open Messages tab","should open Messages tab",""
"passed","Mon Feb 06 20:53:00 UTC 2023","Mon Feb 06 20:53:03 UTC 2023","2644","","bfcache: admin app","","bfcache: admin app","should redirect to login page when session is expired","should redirect to login page when session is expired",""
"passed","Mon Feb 06 21:10:54 UTC 2023","Mon Feb 06 21:10:55 UTC 2023","955","","Bikram Sambat date display","","Bikram Sambat date display","should convert contact summary dates to bikram sambat when language is Nepali","should convert contact summary dates to bikram sambat when language is Nepali",""
"passed","Mon Feb 06 20:52:02 UTC 2023","Mon Feb 06 20:52:21 UTC 2023","18917","","Login and logout tests","","Login and logout tests","should display the ""session expired"" modal and redirect to login page","should display the ""session expired"" modal and redirect to login page",""
"passed","Mon Feb 06 20:50:41 UTC 2023","Mon Feb 06 20:50:45 UTC 2023","4258","","Submit Z-Score form","","Submit Z-Score form","saves z-score values","saves z-score values",""
"passed","Mon Feb 06 20:36:26 UTC 2023","Mon Feb 06 20:36:54 UTC 2023","27372","","Create user for contacts: for an offline user","","Create user for contacts: for an offline user","creates a new user when the replace_user form is submitted while online","creates a new user when the replace_user form is submitted while online",""
"passed","Mon Feb 06 21:09:54 UTC 2023","Mon Feb 06 21:09:58 UTC 2023","4204","","Tasks group landing page: for chw","","Tasks group landing page: for chw","should display modal when clicking on a task from another group","should display modal when clicking on a task from another group",""
"passed","Mon Feb 06 20:53:28 UTC 2023","Mon Feb 06 20:53:30 UTC 2023","1422","","Navigation tests","","Navigation tests","should open Analytics tab","should open Analytics tab",""
"passed","Mon Feb 06 20:46:28 UTC 2023","Mon Feb 06 20:46:28 UTC 2023","665","","Submit a death report","","Submit a death report","Should verify that the report related to the death was created","Should verify that the report related to the death was created",""
"passed","Mon Feb 06 21:08:13 UTC 2023","Mon Feb 06 21:08:34 UTC 2023","20995","","Task list due dates","","Task list due dates","should display correct due dates with default settings","should display correct due dates with default settings",""
"passed","Mon Feb 06 20:56:40 UTC 2023","Mon Feb 06 20:56:41 UTC 2023","981","","manifest.json","","manifest.json","works with custom branding doc","works with custom branding doc",""
"passed","Mon Feb 06 20:51:39 UTC 2023","Mon Feb 06 20:51:39 UTC 2023","901","","Submit an undo death report","","Submit an undo death report","Should verify that the counter for the Deaths was set to 0.","Should verify that the counter for the Deaths was set to 0.",""
"passed","Mon Feb 06 20:34:37 UTC 2023","Mon Feb 06 20:34:39 UTC 2023","2688","","About page","","About page","should open the about page","should open the about page",""
"passed","Mon Feb 06 20:54:40 UTC 2023","Mon Feb 06 20:54:46 UTC 2023","6313","","Privacy policy: for an online user","","Privacy policy: for an online user","should show the correct privacy policy on login","should show the correct privacy policy on login",""
"passed","Mon Feb 06 21:11:39 UTC 2023","Mon Feb 06 21:11:43 UTC 2023","4712","","User Test Cases ->: Invalid entries -> ","","User Test Cases ->: Invalid entries -> ","TestCase for Passwords must match","TestCase for Passwords must match",""
"passed","Mon Feb 06 20:43:48 UTC 2023","Mon Feb 06 20:43:52 UTC 2023","4668","","Create new lineage structure","","Create new lineage structure","Create new health center","Create new health center",""
"passed","Mon Feb 06 21:11:43 UTC 2023","Mon Feb 06 21:11:53 UTC 2023","9699","","User Test Cases ->: Invalid entries -> ","","User Test Cases ->: Invalid entries -> ","TestCase for required","TestCase for required",""
"passed","Mon Feb 06 20:52:44 UTC 2023","Mon Feb 06 20:52:46 UTC 2023","1659","","Token login","","Token login","should display an error when token is expired","should display an error when token is expired",""
"passed","Mon Feb 06 20:53:23 UTC 2023","Mon Feb 06 20:53:25 UTC 2023","1863","","Navigation tests","","Navigation tests","should open tasks tab","should open tasks tab",""
"passed","Mon Feb 06 20:47:27 UTC 2023","Mon Feb 06 20:47:33 UTC 2023","6312","","Pregnancy danger sign follow-up form","","Pregnancy danger sign follow-up form","should submit and edit Pregnancy danger sign follow-up form (no changes)","should submit and edit Pregnancy danger sign follow-up form (no changes)",""
"passed","Mon Feb 06 21:10:56 UTC 2023","Mon Feb 06 21:10:59 UTC 2023","2955","","Bikram Sambat date display","","Bikram Sambat date display","SMS report shows bsAggreDate type as date field correctly","SMS report shows bsAggreDate type as date field correctly",""
"passed","Mon Feb 06 20:35:00 UTC 2023","Mon Feb 06 20:35:07 UTC 2023","6782","","Acessing the admin app","","Acessing the admin app","should allow admins to access the page","should allow admins to access the page",""
"passed","Mon Feb 06 21:10:34 UTC 2023","Mon Feb 06 21:10:35 UTC 2023","898","","MessageFormat","","MessageFormat","should work with botched translations","should work with botched translations",""
"passed","Mon Feb 06 21:11:28 UTC 2023","Mon Feb 06 21:11:33 UTC 2023","4882","","User Test Cases ->: Invalid entries -> ","","User Test Cases ->: Invalid entries -> ","TestCase for The password must be at least 8 characters long.","TestCase for The password must be at least 8 characters long.",""
"passed","Mon Feb 06 20:51:44 UTC 2023","Mon Feb 06 20:51:46 UTC 2023","2082","","Login and logout tests","","Login and logout tests","should show locale selector on login page","should show locale selector on login page",""
"passed","Mon Feb 06 20:53:13 UTC 2023","Mon Feb 06 20:53:16 UTC 2023","2314","","Hamburger Menu tests","","Hamburger Menu tests","should open Configuration app","should open Configuration app",""
"passed","Mon Feb 06 20:52:37 UTC 2023","Mon Feb 06 20:52:41 UTC 2023","4482","","Token login","","Token login","should redirect the user to the app if already logged in","should redirect the user to the app if already logged in",""
"passed","Mon Feb 06 20:51:38 UTC 2023","Mon Feb 06 20:51:39 UTC 2023","684","","Submit an undo death report","","Submit an undo death report","Should verify that the undo death report was created","Should verify that the undo death report was created",""
"failed","Mon Feb 06 21:06:37 UTC 2023","Mon Feb 06 21:07:08 UTC 2023","31068","","Service worker cache","","Service worker cache","confirm fetch yields cached result","confirm fetch yields cached result",""
"passed","Mon Feb 06 20:56:38 UTC 2023","Mon Feb 06 20:56:40 UTC 2023","1893","","manifest.json","","manifest.json","works without branding doc","works without branding doc",""
"passed","Mon Feb 06 20:44:37 UTC 2023","Mon Feb 06 20:44:57 UTC 2023","19778","","Create Person Under Area","","Create Person Under Area","create person under area should only see children","create person under area should only see children",""
"passed","Mon Feb 06 21:10:48 UTC 2023","Mon Feb 06 21:10:52 UTC 2023","3393","","Bikram Sambat date display","","Bikram Sambat date display","enketo xpath extension function should display correct values when Nepali is selected","enketo xpath extension function should display correct values when Nepali is selected",""
"passed","Mon Feb 06 20:54:08 UTC 2023","Mon Feb 06 20:54:09 UTC 2023","91","","Privacy policy: for an offline user","","Privacy policy: for an offline user","should display when navigating to the privacy policy page","should display when navigating to the privacy policy page",""
"passed","Mon Feb 06 20:57:38 UTC 2023","Mon Feb 06 20:57:44 UTC 2023","6126","","Delete Reports","","Delete Reports","Should delete report","Should delete report",""
"passed","Mon Feb 06 20:34:46 UTC 2023","Mon Feb 06 20:34:49 UTC 2023","2849","","Acessing the admin app","","Acessing the admin app","should redirect to login when not logged in","should redirect to login when not logged in",""
"passed","Mon Feb 06 20:54:08 UTC 2023","Mon Feb 06 20:54:08 UTC 2023","727","","Privacy policy: for an offline user","","Privacy policy: for an offline user","should not show on refresh","should not show on refresh",""
"passed","Mon Feb 06 20:51:48 UTC 2023","Mon Feb 06 20:51:50 UTC 2023","2024","","Login and logout tests","","Login and logout tests","should change locale to Spanish","should change locale to Spanish",""
"broken","Mon Feb 06 21:05:06 UTC 2023","Mon Feb 06 21:06:37 UTC 2023","91236","","Service worker cache","","Service worker cache","should load the page while offline","should load the page while offline",""
"passed","Mon Feb 06 20:40:43 UTC 2023","Mon Feb 06 20:40:53 UTC 2023","9367","","Creating custom places","","Creating custom places","the RHS add place button should show the add place title","the RHS add place button should show the add place title",""
"passed","Mon Feb 06 20:35:30 UTC 2023","Mon Feb 06 20:35:34 UTC 2023","3883","","Targets","","Targets","should display correct message when targets are disabled","should display correct message when targets are disabled",""
"passed","Mon Feb 06 20:42:52 UTC 2023","Mon Feb 06 20:43:22 UTC 2023","30120","","Mute/Unmute contacts using a specific form.","","Mute/Unmute contacts using a specific form.","Should mute a contact using the defined mute_forms (death_report).","Should mute a contact using the defined mute_forms (death_report).",""
"passed","Mon Feb 06 20:54:09 UTC 2023","Mon Feb 06 20:54:20 UTC 2023","11733","","Privacy policy: for an offline user","","Privacy policy: for an offline user","should not show on subsequent login","should not show on subsequent login",""
"passed","Mon Feb 06 21:11:03 UTC 2023","Mon Feb 06 21:11:09 UTC 2023","5209","","Adding new language","","Adding new language","should show in enabled language list","should show in enabled language list",""
"passed","Mon Feb 06 21:08:54 UTC 2023","Mon Feb 06 21:09:01 UTC 2023","7088","","Tasks tab breadcrumbs","","Tasks tab breadcrumbs","""before all"" hook for Tasks tab breadcrumbs","""before all"" hook for Tasks tab breadcrumbs",""
"passed","Mon Feb 06 21:07:31 UTC 2023","Mon Feb 06 21:07:32 UTC 2023","1045","","sms-gateway api: - gateway submits WT sms status updates","","sms-gateway api: - gateway submits WT sms status updates","- shows content","- shows content",""
"passed","Mon Feb 06 20:48:22 UTC 2023","Mon Feb 06 20:48:23 UTC 2023","1003","","Pregnancy registration","","Pregnancy registration","Should verify that the counters for the active pregnancies and the new pregnancies were updated.","Should verify that the counters for the active pregnancies and the new pregnancies were updated.",""
"passed","Mon Feb 06 20:47:20 UTC 2023","Mon Feb 06 20:47:27 UTC 2023","7300","","Pregnancy danger sign follow-up form","","Pregnancy danger sign follow-up form","Submit and validate Pregnancy danger sign follow-up form and keeps the report minified","Submit and validate Pregnancy danger sign follow-up form and keeps the report minified",""
"passed","Mon Feb 06 20:48:28 UTC 2023","Mon Feb 06 20:48:30 UTC 2023","1687","","RepeatForm","","RepeatForm","""before all"" hook for RepeatForm","""before all"" hook for RepeatForm",""
"passed","Mon Feb 06 20:48:54 UTC 2023","Mon Feb 06 20:48:59 UTC 2023","5490","","Countdown timer widget","","Countdown timer widget","interact with timer and submit","interact with timer and submit",""
"passed","Mon Feb 06 20:44:03 UTC 2023","Mon Feb 06 20:44:09 UTC 2023","6357","","Create new lineage structure","","Create new lineage structure","should edit a person with a phone number","should edit a person with a phone number",""
"passed","Mon Feb 06 20:45:29 UTC 2023","Mon Feb 06 20:45:31 UTC 2023","1008","","db-sync","","db-sync","should filter locally purged docs","should filter locally purged docs",""
"passed","Mon Feb 06 20:35:38 UTC 2023","Mon Feb 06 20:35:50 UTC 2023","12105","","Create user for contacts","","Create user for contacts","does not create a new user when the replace_user form is submitted for online user","does not create a new user when the replace_user form is submitted for online user",""
"passed","Mon Feb 06 20:53:41 UTC 2023","Mon Feb 06 20:53:47 UTC 2023","6458","","Guided tour","","Guided tour","run guided tour and change tab => should close the tour","run guided tour and change tab => should close the tour",""
"passed","Mon Feb 06 20:46:34 UTC 2023","Mon Feb 06 20:46:45 UTC 2023","10278","","Edit report with attachmnet","","Edit report with attachmnet","should remove attachment when saving","should remove attachment when saving",""
"passed","Mon Feb 06 20:44:15 UTC 2023","Mon Feb 06 20:44:20 UTC 2023","4550","","Create new lineage structure","","Create new lineage structure","should delete the primary contact of health facility","should delete the primary contact of health facility",""
"passed","Mon Feb 06 21:10:52 UTC 2023","Mon Feb 06 21:10:54 UTC 2023","1942","","Bikram Sambat date display","","Bikram Sambat date display","should display report list dates converted to bikram sambat","should display report list dates converted to bikram sambat",""
"passed","Mon Feb 06 21:10:30 UTC 2023","Mon Feb 06 21:10:34 UTC 2023","3645","","MessageFormat","","MessageFormat","should display plurals correctly","should display plurals correctly",""
"passed","Mon Feb 06 20:37:54 UTC 2023","Mon Feb 06 20:38:31 UTC 2023","36827","","Create user for contacts: for an offline user","","Create user for contacts: for an offline user","creates new user when replace_user form is submitted for contact associated with multiple users","creates new user when replace_user form is submitted for contact associated with multiple users",""
"passed","Mon Feb 06 21:07:27 UTC 2023","Mon Feb 06 21:07:29 UTC 2023","2005","","sms-gateway api","","sms-gateway api","""before all"" hook for sms-gateway api","""before all"" hook for sms-gateway api",""
"passed","Mon Feb 06 20:53:07 UTC 2023","Mon Feb 06 20:53:10 UTC 2023","2990","","Hamburger Menu tests","","Hamburger Menu tests","should open Configuration wizard","should open Configuration wizard",""
"passed","Mon Feb 06 20:52:42 UTC 2023","Mon Feb 06 20:52:43 UTC 2023","1126","","Token login","","Token login","should display an error with incorrect url","should display an error with incorrect url",""
"passed","Mon Feb 06 20:51:46 UTC 2023","Mon Feb 06 20:51:48 UTC 2023","2070","","Login and logout tests","","Login and logout tests","should change locale to French","should change locale to French",""
"passed","Mon Feb 06 20:50:10 UTC 2023","Mon Feb 06 20:50:12 UTC 2023","1535","","Submit Enketo form","","Submit Enketo form","allows forms with required notes to be submitted","allows forms with required notes to be submitted",""
"passed","Mon Feb 06 20:54:48 UTC 2023","Mon Feb 06 20:54:52 UTC 2023","3792","","Privacy policy: for an online user","","Privacy policy: for an online user","should not show on subsequent login","should not show on subsequent login",""
"passed","Mon Feb 06 20:40:33 UTC 2023","Mon Feb 06 20:40:43 UTC 2023","10171","","Creating custom places","","Creating custom places","the RHS add place button should show the custom title","the RHS add place button should show the custom title",""
"passed","Mon Feb 06 20:40:11 UTC 2023","Mon Feb 06 20:40:22 UTC 2023","10322","","Creating custom places","","Creating custom places","the LHS add place button should show the appropriate title","the LHS add place button should show the appropriate title",""
"passed","Mon Feb 06 20:54:56 UTC 2023","Mon Feb 06 20:54:58 UTC 2023","2232","","Privacy policy: for an online user","","Privacy policy: for an online user","should show if the user changes their language","should show if the user changes their language",""
"passed","Mon Feb 06 20:45:59 UTC 2023","Mon Feb 06 20:46:28 UTC 2023","29019","","Submit a death report","","Submit a death report","Should submit a death report","Should submit a death report",""
"passed","Mon Feb 06 21:10:55 UTC 2023","Mon Feb 06 21:10:56 UTC 2023","1514","","Bikram Sambat date display","","Bikram Sambat date display","SMS report shows bsDate type as date field correctly","SMS report shows bsDate type as date field correctly",""
"passed","Mon Feb 06 20:50:50 UTC 2023","Mon Feb 06 20:51:38 UTC 2023","48349","","Submit an undo death report","","Submit an undo death report","Should submit an undo death report","Should submit an undo death report",""
"passed","Mon Feb 06 20:52:26 UTC 2023","Mon Feb 06 20:52:32 UTC 2023","6191","","should renew token","","should renew token","Refresh page multiple times and verify token gets renewed","Refresh page multiple times and verify token gets renewed",""
"passed","Mon Feb 06 20:49:33 UTC 2023","Mon Feb 06 20:49:59 UTC 2023","26425","","Submit Default Delivery Report","","Submit Default Delivery Report","open, submit and edit default delivery form","open, submit and edit default delivery form",""
"passed","Mon Feb 06 20:55:01 UTC 2023","Mon Feb 06 20:55:18 UTC 2023","16786","","Privacy policy: conflicts","","Privacy policy: conflicts","should not fail due to document conflict for new offline user","should not fail due to document conflict for new offline user",""
"passed","Mon Feb 06 21:10:07 UTC 2023","Mon Feb 06 21:10:10 UTC 2023","3111","","Tasks group landing page: for chw","","Tasks group landing page: for chw","should not show page when submitting task for contact with no leaf type place in lineage","should not show page when submitting task for contact with no leaf type place in lineage",""
"passed","Mon Feb 06 21:07:13 UTC 2023","Mon Feb 06 21:07:22 UTC 2023","8852","","Export Messages","","Export Messages","Should download export file","Should download export file",""
