"Status","Start Time","Stop Time","Duration in ms","Parent Suite","Suite","Sub Suite","Test Class","Test Method","Name","Description"
"passed","Tue Jun 13 22:39:16 UTC 2023","Tue Jun 13 22:39:21 UTC 2023","4898","","Navigation tests: Navigation view","","Navigation tests: Navigation view","should display tab labels, when all tabs are enabled","should display tab labels, when all tabs are enabled",""
"passed","Tue Jun 13 22:45:31 UTC 2023","Tue Jun 13 22:45:34 UTC 2023","2943","","Reports Subject","","Reports Subject","should create a report which does not have a subject","should create a report which does not have a subject",""
"passed","Tue Jun 13 22:52:27 UTC 2023","Tue Jun 13 22:52:52 UTC 2023","24565","","Create user when adding contact","","Create user when adding contact","creates a new user while online","creates a new user while online",""
"passed","Tue Jun 13 22:51:38 UTC 2023","Tue Jun 13 22:51:42 UTC 2023","3773","","Tasks group landing page: for chw","","Tasks group landing page: for chw","should not display modal when clicking list task from same group","should not display modal when clicking list task from same group",""
"passed","Tue Jun 13 22:48:00 UTC 2023","Tue Jun 13 22:48:01 UTC 2023","1019","","RapidPro SMS Gateway: Webapp Terminating messages","","RapidPro SMS Gateway: Webapp Terminating messages","should fail when message was not created","should fail when message was not created",""
"passed","Tue Jun 13 22:45:22 UTC 2023","Tue Jun 13 22:45:25 UTC 2023","2993","","Reports Subject","","Reports Subject","should create a report which has an unknown sender with no phone number","should create a report which has an unknown sender with no phone number",""
"passed","Tue Jun 13 22:39:14 UTC 2023","Tue Jun 13 22:39:16 UTC 2023","2264","","Navigation tests: Navigation functionality","","Navigation tests: Navigation functionality","should open Analytics tab","should open Analytics tab",""
"passed","Tue Jun 13 22:39:43 UTC 2023","Tue Jun 13 22:39:43 UTC 2023","97","","Privacy policy: for an offline user","","Privacy policy: for an offline user","should display when navigating to the privacy policy page","should display when navigating to the privacy policy page",""
