"Status","Start Time","Stop Time","Duration in ms","Parent Suite","Suite","Sub Suite","Test Class","Test Method","Name","Description"
"passed","Wed May 17 06:30:24 UTC 2023","Wed May 17 06:30:24 UTC 2023","447","","- EDIT permissions disabled","","- EDIT permissions disabled","- Report tab - menu not displayed when xml report selected","- Report tab - menu not displayed when xml report selected",""
"passed","Wed May 17 06:17:33 UTC 2023","Wed May 17 06:17:40 UTC 2023","7548","","db-sync","","db-sync","should not filter allowed docs","should not filter allowed docs",""
"passed","Wed May 17 06:14:31 UTC 2023","Wed May 17 06:14:51 UTC 2023","20609","","Mute/Unmute contacts using a specific form.","","Mute/Unmute contacts using a specific form.","Should unmute a contact using the defined unmute_forms (undo_death_report).","Should unmute a contact using the defined unmute_forms (undo_death_report).",""
"passed","Wed May 17 06:50:45 UTC 2023","Wed May 17 06:50:53 UTC 2023","8678","","Create user meta db : ","","Create user meta db : ","should allow a new user to read/write from meta db","should allow a new user to read/write from meta db",""
"passed","Wed May 17 06:49:10 UTC 2023","Wed May 17 06:49:12 UTC 2023","1624","","Bikram Sambat date display","","Bikram Sambat date display","SMS report shows bsDate type as date field correctly","SMS report shows bsDate type as date field correctly",""
"passed","Wed May 17 06:32:50 UTC 2023","Wed May 17 06:32:51 UTC 2023","1872","","Privacy policy: for an online user","","Privacy policy: for an online user","should show if the user changes their language","should show if the user changes their language",""
"passed","Wed May 17 06:26:50 UTC 2023","Wed May 17 06:26:56 UTC 2023","6713","","Unauthorized form","","Unauthorized form","should display unauthorized error message in reports tab when form expression does not match","should display unauthorized error message in reports tab when form expression does not match",""
"passed","Wed May 17 06:44:41 UTC 2023","Wed May 17 06:45:03 UTC 2023","21593","","Create user for contacts: user replace: for an offline user","","Create user for contacts: user replace: for an offline user","does not assign new person as primary contact of parent place if original person was not primary","does not assign new person as primary contact of parent place if original person was not primary",""
"passed","Wed May 17 06:38:53 UTC 2023","Wed May 17 06:38:57 UTC 2023","3219","","Send message","","Send message","should send a message to a contact with a phone number","should send a message to a contact with a phone number",""
"passed","Wed May 17 06:17:49 UTC 2023","Wed May 17 06:17:54 UTC 2023","5261","","db-sync: meta db replication","","db-sync: meta db replication","should replicate meta db down","should replicate meta db down",""
"passed","Wed May 17 06:36:00 UTC 2023","Wed May 17 06:36:03 UTC 2023","3432","","Reports Subject","","Reports Subject","should create a report using doc id","should create a report using doc id",""
"passed","Wed May 17 06:34:28 UTC 2023","Wed May 17 06:34:28 UTC 2023","617","","manifest.json","","manifest.json","works with custom branding doc","works with custom branding doc",""
"passed","Wed May 17 06:15:16 UTC 2023","Wed May 17 06:15:23 UTC 2023","7022","","Create new lineage structure","","Create new lineage structure","should edit a person with a phone number","should edit a person with a phone number",""
"passed","Wed May 17 06:34:25 UTC 2023","Wed May 17 06:34:28 UTC 2023","2227","","manifest.json","","manifest.json","works without branding doc","works without branding doc",""
"passed","Wed May 17 06:37:43 UTC 2023","Wed May 17 06:37:51 UTC 2023","8683","","Export Messages","","Export Messages","Should download export file","Should download export file",""
"passed","Wed May 17 06:30:44 UTC 2023","Wed May 17 06:30:45 UTC 2023","1096","","- permissions disabled: - EDIT permissions disabled","","- permissions disabled: - EDIT permissions disabled","- Report Tab - option disabled when report selected","- Report Tab - option disabled when report selected",""
"passed","Wed May 17 06:42:10 UTC 2023","Wed May 17 06:42:25 UTC 2023","15219","","Create user when adding contact","","Create user when adding contact","creates a new user when contact is added from app form","creates a new user when contact is added from app form",""
"passed","Wed May 17 06:41:29 UTC 2023","Wed May 17 06:41:44 UTC 2023","14930","","Create user when adding contact","","Create user when adding contact","creates a new user while online","creates a new user while online",""
"passed","Wed May 17 06:13:34 UTC 2023","Wed May 17 06:13:44 UTC 2023","10016","","Edit contacts with the default config. ","","Edit contacts with the default config. ","should edit contact name","should edit contact name",""
"passed","Wed May 17 06:24:20 UTC 2023","Wed May 17 06:24:30 UTC 2023","10140","","Pregnancy registration","","Pregnancy registration","Should submit a new pregnancy","Should submit a new pregnancy",""
"passed","Wed May 17 06:27:54 UTC 2023","Wed May 17 06:27:55 UTC 2023","1120","","Submit an undo death report","","Submit an undo death report","Should verify that the counter for the Deaths was set to 0.","Should verify that the counter for the Deaths was set to 0.",""
"passed","Wed May 17 06:40:51 UTC 2023","Wed May 17 06:40:54 UTC 2023","3376","","Tasks group landing page: for chw","","Tasks group landing page: for chw","should not show page when submitting task for contact with no leaf type place in lineage","should not show page when submitting task for contact with no leaf type place in lineage",""
"passed","Wed May 17 06:31:10 UTC 2023","Wed May 17 06:31:13 UTC 2023","2262","","Online User:  - Options enabled when there are items","","Online User:  - Options enabled when there are items"," - Contact Tab  - contact selected"," - Contact Tab  - contact selected",""
"passed","Wed May 17 06:36:34 UTC 2023","Wed May 17 06:36:37 UTC 2023","3163","","Reports Subject","","Reports Subject","should create a report which does not have a subject","should create a report which does not have a subject",""
"passed","Wed May 17 06:11:41 UTC 2023","Wed May 17 06:11:52 UTC 2023","11660","","Creating custom places","","Creating custom places","the LHS button should show the appropriate label when multiple places exist at the current level","the LHS button should show the appropriate label when multiple places exist at the current level",""
"passed","Wed May 17 06:32:24 UTC 2023","Wed May 17 06:32:25 UTC 2023","1442","","Privacy policy: for an offline user","","Privacy policy: for an offline user","should show if the user changes their language","should show if the user changes their language",""
"passed","Wed May 17 06:34:40 UTC 2023","Wed May 17 06:34:44 UTC 2023","4217","","Reports tab breadcrumbs","","Reports tab breadcrumbs","should display reports with updated breadcrumbs for offline user","should display reports with updated breadcrumbs for offline user",""
"passed","Wed May 17 06:32:25 UTC 2023","Wed May 17 06:32:31 UTC 2023","5380","","Privacy policy: for an offline user","","Privacy policy: for an offline user","should show if the user policy changes","should show if the user policy changes",""
"passed","Wed May 17 06:39:33 UTC 2023","Wed May 17 06:39:41 UTC 2023","7356","","Task list due dates","","Task list due dates","should display correct due dates with taskDaysOverdue setting","should display correct due dates with taskDaysOverdue setting",""
"passed","Wed May 17 06:13:02 UTC 2023","Wed May 17 06:13:05 UTC 2023","3671","","Add new district tests : ","","Add new district tests : ","should edit district with contact_type","should edit district with contact_type",""
"passed","Wed May 17 06:43:23 UTC 2023","Wed May 17 06:43:35 UTC 2023","12451","","Create user for contacts: user replace","","Create user for contacts: user replace","does not create a new user when the replace_user form is submitted for online user","does not create a new user when the replace_user form is submitted for online user",""
"passed","Wed May 17 06:22:26 UTC 2023","Wed May 17 06:22:33 UTC 2023","6894","","Edit report with attachmnet","","Edit report with attachmnet","should save edits","should save edits",""
"passed","Wed May 17 06:32:51 UTC 2023","Wed May 17 06:32:54 UTC 2023","2960","","Privacy policy: for an online user","","Privacy policy: for an online user","should show if the user policy changes","should show if the user policy changes",""
"passed","Wed May 17 06:31:33 UTC 2023","Wed May 17 06:31:36 UTC 2023","2439","","Hamburger Menu tests","","Hamburger Menu tests","should open About","should open About",""
"passed","Wed May 17 06:28:48 UTC 2023","Wed May 17 06:28:52 UTC 2023","4636","","Token login","","Token login","should redirect the user to the app if already logged in","should redirect the user to the app if already logged in",""
"passed","Wed May 17 06:32:00 UTC 2023","Wed May 17 06:32:10 UTC 2023","10236","","Privacy policy: for an offline user","","Privacy policy: for an offline user","should show the correct privacy policy on login","should show the correct privacy policy on login",""
"passed","Wed May 17 06:40:37 UTC 2023","Wed May 17 06:40:42 UTC 2023","4305","","Tasks group landing page: for chw","","Tasks group landing page: for chw","should display modal when clicking on a task from another group","should display modal when clicking on a task from another group",""
"passed","Wed May 17 06:37:25 UTC 2023","Wed May 17 06:37:30 UTC 2023","5643","","Service worker cache","","Service worker cache","adding new languages triggers login page refresh","adding new languages triggers login page refresh",""
"passed","Wed May 17 06:47:07 UTC 2023","Wed May 17 06:47:26 UTC 2023","19255","","Create user for contacts: user replace: for an offline user","","Create user for contacts: user replace: for an offline user","does not create a new user or re-parent reports when the transition is disabled","does not create a new user or re-parent reports when the transition is disabled",""
"passed","Wed May 17 06:17:44 UTC 2023","Wed May 17 06:17:47 UTC 2023","2436","","db-sync","","db-sync","should filter ddocs","should filter ddocs",""
"passed","Wed May 17 06:36:16 UTC 2023","Wed May 17 06:36:19 UTC 2023","3012","","Reports Subject","","Reports Subject","should create a report using place_id with a shortcode","should create a report using place_id with a shortcode",""
"passed","Wed May 17 06:16:15 UTC 2023","Wed May 17 06:16:20 UTC 2023","5059","","Test Contact Search Functionality","","Test Contact Search Functionality","search by NON empty string should display results with contains match and clears search","search by NON empty string should display results with contains match and clears search",""
"passed","Wed May 17 06:26:56 UTC 2023","Wed May 17 06:27:00 UTC 2023","3985","","Unauthorized form","","Unauthorized form","should display unauthorized error message in contacts tab when user does not have form permission","should display unauthorized error message in contacts tab when user does not have form permission",""
"passed","Wed May 17 06:30:24 UTC 2023","Wed May 17 06:30:24 UTC 2023","163","","- EDIT permissions disabled","","- EDIT permissions disabled","- Report tab - menu not displayed when sms report selected","- Report tab - menu not displayed when sms report selected",""
"passed","Wed May 17 06:49:50 UTC 2023","Wed May 17 06:49:53 UTC 2023","2461","","User Test Cases ->","","User Test Cases ->","""before all"" hook for User Test Cases ->","""before all"" hook for User Test Cases ->",""
"passed","Wed May 17 06:12:52 UTC 2023","Wed May 17 06:12:57 UTC 2023","5125","","Add new district tests : ","","Add new district tests : ","should add new district with a new person","should add new district with a new person",""
"passed","Wed May 17 06:40:03 UTC 2023","Wed May 17 06:40:08 UTC 2023","4885","","Tasks tab breadcrumbs: for chw","","Tasks tab breadcrumbs: for chw","should display correct tasks with breadcrumbs for chw","should display correct tasks with breadcrumbs for chw",""
"passed","Wed May 17 06:49:12 UTC 2023","Wed May 17 06:49:15 UTC 2023","2961","","Bikram Sambat date display","","Bikram Sambat date display","SMS report shows bsAggreDate type as date field correctly","SMS report shows bsAggreDate type as date field correctly",""
"passed","Wed May 17 06:38:02 UTC 2023","Wed May 17 06:38:03 UTC 2023","1112","","sms-gateway api: - gateway submits WT sms status updates","","sms-gateway api: - gateway submits WT sms status updates","- shows content","- shows content",""
"passed","Wed May 17 06:37:36 UTC 2023","Wed May 17 06:37:37 UTC 2023","464","","Service worker cache","","Service worker cache","confirm fetch yields cached result","confirm fetch yields cached result",""
"skipped","Wed May 17 06:25:21 UTC 2023","Wed May 17 06:25:21 UTC 2023","0","","Submit Default Delivery Report","","Submit Default Delivery Report","open, submit and edit (no changes) default delivery form","open, submit and edit (no changes) default delivery form",""
"passed","Wed May 17 06:10:42 UTC 2023","Wed May 17 06:10:46 UTC 2023","3938","","Acessing the admin app","","Acessing the admin app","should redirect to login when not logged in","should redirect to login when not logged in",""
"passed","Wed May 17 06:36:22 UTC 2023","Wed May 17 06:36:25 UTC 2023","2864","","Reports Subject","","Reports Subject","should create a report which has an unknown sender and a known subject","should create a report which has an unknown sender and a known subject",""
"passed","Wed May 17 06:23:23 UTC 2023","Wed May 17 06:23:25 UTC 2023","1752","","Contact Delivery Form","","Contact Delivery Form","The targets page should be updated","The targets page should be updated",""
"passed","Wed May 17 06:41:09 UTC 2023","Wed May 17 06:41:29 UTC 2023","19998","","Create user when adding contact","","Create user when adding contact","Creates a new user while offline","Creates a new user while offline",""
"passed","Wed May 17 06:34:50 UTC 2023","Wed May 17 06:34:58 UTC 2023","7491","","Bulk delete reports","","Bulk delete reports","should select, deselect and delete only selected reports","should select, deselect and delete only selected reports",""
"passed","Wed May 17 06:28:16 UTC 2023","Wed May 17 06:28:20 UTC 2023","4615","","Login and logout tests","","Login and logout tests","should log in using username and password fields","should log in using username and password fields",""
"passed","Wed May 17 06:24:50 UTC 2023","Wed May 17 06:24:54 UTC 2023","3717","","RepeatForm: Repeat form with repeat button","","RepeatForm: Repeat form with repeat button","should display the initial form and its repeated content in Swahili","should display the initial form and its repeated content in Swahili",""
"passed","Wed May 17 06:29:07 UTC 2023","Wed May 17 06:29:12 UTC 2023","5392","","More Options Menu - Offline User","","More Options Menu - Offline User","""before all"" hook for More Options Menu - Offline User","""before all"" hook for More Options Menu - Offline User",""
"passed","Wed May 17 06:40:42 UTC 2023","Wed May 17 06:40:45 UTC 2023","3578","","Tasks group landing page: for chw","","Tasks group landing page: for chw","should not display modal when clicking list task from same group","should not display modal when clicking list task from same group",""
"passed","Wed May 17 06:26:18 UTC 2023","Wed May 17 06:26:23 UTC 2023","4663","","Submit Z-Score form","","Submit Z-Score form","saves z-score values","saves z-score values",""
"passed","Wed May 17 06:15:34 UTC 2023","Wed May 17 06:15:41 UTC 2023","6841","","Create new lineage structure","","Create new lineage structure","should edit the name of the CHW area","should edit the name of the CHW area",""
"passed","Wed May 17 06:36:12 UTC 2023","Wed May 17 06:36:16 UTC 2023","3284","","Reports Subject","","Reports Subject","should create a report using place_id with a place_uuid","should create a report using place_id with a place_uuid",""
"passed","Wed May 17 06:30:51 UTC 2023","Wed May 17 06:30:56 UTC 2023","4747","","Online User: Options disabled when no items - messages, contacts, people","","Online User: Options disabled when no items - messages, contacts, people","- Message tab","- Message tab",""
"passed","Wed May 17 06:13:12 UTC 2023","Wed May 17 06:13:19 UTC 2023","7045","","Contact details page: Permissions to show reports and tasks","","Contact details page: Permissions to show reports and tasks","should show reports and tasks when permissions are enabled","should show reports and tasks when permissions are enabled",""
"passed","Wed May 17 06:10:32 UTC 2023","Wed May 17 06:10:34 UTC 2023","2495","","About page","","About page","should open the about page","should open the about page",""
"passed","Wed May 17 06:49:10 UTC 2023","Wed May 17 06:49:10 UTC 2023","939","","Bikram Sambat date display","","Bikram Sambat date display","should convert contact summary dates to bikram sambat when language is Nepali","should convert contact summary dates to bikram sambat when language is Nepali",""
"passed","Wed May 17 06:12:25 UTC 2023","Wed May 17 06:12:36 UTC 2023","10658","","Creating custom places","","Creating custom places","should show the multi person actions with the correct label","should show the multi person actions with the correct label",""
"passed","Wed May 17 06:11:52 UTC 2023","Wed May 17 06:12:03 UTC 2023","10863","","Creating custom places","","Creating custom places","the RHS button should show the action with custom label","the RHS button should show the action with custom label",""
"passed","Wed May 17 06:31:19 UTC 2023","Wed May 17 06:31:23 UTC 2023","4036","","bfcache: login page","","bfcache: login page","should redirect to the app page when session is valid","should redirect to the app page when session is valid",""
"passed","Wed May 17 06:40:27 UTC 2023","Wed May 17 06:40:31 UTC 2023","4008","","Tasks group landing page: for chw","","Tasks group landing page: for chw","should have tasks","should have tasks",""
"passed","Wed May 17 06:35:30 UTC 2023","Wed May 17 06:35:36 UTC 2023","5628","","Export Reports","","Export Reports","Should download export file","Should download export file",""
"passed","Wed May 17 06:26:37 UTC 2023","Wed May 17 06:26:40 UTC 2023","3121","","Training Cards","","Training Cards","should display training after it was canceled and the training doc was updated","should display training after it was canceled and the training doc was updated",""
"passed","Wed May 17 06:48:14 UTC 2023","Wed May 17 06:48:24 UTC 2023","9827","","Enabling/disabling languages","","Enabling/disabling languages","should disable a language and enable another","should disable a language and enable another",""
"passed","Wed May 17 06:36:03 UTC 2023","Wed May 17 06:36:07 UTC 2023","3364","","Reports Subject","","Reports Subject","should create a report using unknown patient_id ","should create a report using unknown patient_id ",""
"passed","Wed May 17 06:15:54 UTC 2023","Wed May 17 06:16:08 UTC 2023","14848","","Create Person Under Area","","Create Person Under Area","create person under area should only see children","create person under area should only see children",""
"passed","Wed May 17 06:48:47 UTC 2023","Wed May 17 06:48:48 UTC 2023","884","","MessageFormat","","MessageFormat","should work with botched translations","should work with botched translations",""
"passed","Wed May 17 06:30:56 UTC 2023","Wed May 17 06:30:57 UTC 2023","1438","","Online User: Options disabled when no items - messages, contacts, people","","Online User: Options disabled when no items - messages, contacts, people"," - Contact tab"," - Contact tab",""
"passed","Wed May 17 06:28:02 UTC 2023","Wed May 17 06:28:05 UTC 2023","3035","","Login and logout tests","","Login and logout tests","should show locale selector on login page","should show locale selector on login page",""
"passed","Wed May 17 06:23:42 UTC 2023","Wed May 17 06:23:48 UTC 2023","6117","","Pregnancy danger sign follow-up form","","Pregnancy danger sign follow-up form","should submit and edit Pregnancy danger sign follow-up form (no changes)","should submit and edit Pregnancy danger sign follow-up form (no changes)",""
"passed","Wed May 17 06:15:29 UTC 2023","Wed May 17 06:15:34 UTC 2023","5121","","Create new lineage structure","","Create new lineage structure","should delete the primary contact of health facility","should delete the primary contact of health facility",""
"passed","Wed May 17 06:25:34 UTC 2023","Wed May 17 06:25:40 UTC 2023","6164","","Submit Enketo form","","Submit Enketo form","allows forms with required notes to be submitted","allows forms with required notes to be submitted",""
"passed","Wed May 17 06:31:36 UTC 2023","Wed May 17 06:31:37 UTC 2023","728","","Hamburger Menu tests","","Hamburger Menu tests","should open Report bug","should open Report bug",""
"passed","Wed May 17 06:28:56 UTC 2023","Wed May 17 06:28:58 UTC 2023","2218","","Token login","","Token login","should display an error when token is expired","should display an error when token is expired",""
"passed","Wed May 17 06:49:34 UTC 2023","Wed May 17 06:49:45 UTC 2023","10719","","Adding new language","","Adding new language","should support deleting translations","should support deleting translations",""
"passed","Wed May 17 06:22:05 UTC 2023","Wed May 17 06:22:06 UTC 2023","1233","","Submit a death report","","Submit a death report","Should verify that the counter for the Deaths was updated.","Should verify that the counter for the Deaths was updated.",""
"passed","Wed May 17 06:27:00 UTC 2023","Wed May 17 06:27:04 UTC 2023","3770","","Unauthorized form","","Unauthorized form","should not display unauthorized error message in contacts tab when user has the form permission","should not display unauthorized error message in contacts tab when user has the form permission",""
"passed","Wed May 17 06:29:42 UTC 2023","Wed May 17 06:30:00 UTC 2023","17160","","- DELETE permissions disabled","","- DELETE permissions disabled"," - Contact Tab - delete contact selected"," - Contact Tab - delete contact selected",""
"passed","Wed May 17 06:10:46 UTC 2023","Wed May 17 06:10:54 UTC 2023","7646","","Acessing the admin app","","Acessing the admin app","should show access error when accessing as an offline user","should show access error when accessing as an offline user",""
"passed","Wed May 17 06:37:59 UTC 2023","Wed May 17 06:38:02 UTC 2023","2526","","sms-gateway api: - gateway submits new WT sms messages","","sms-gateway api: - gateway submits new WT sms messages","shows content","shows content",""
"passed","Wed May 17 06:32:11 UTC 2023","Wed May 17 06:32:11 UTC 2023","94","","Privacy policy: for an offline user","","Privacy policy: for an offline user","should display when navigating to the privacy policy page","should display when navigating to the privacy policy page",""
"passed","Wed May 17 06:30:57 UTC 2023","Wed May 17 06:30:58 UTC 2023","1192","","Online User: Options disabled when no items - messages, contacts, people","","Online User: Options disabled when no items - messages, contacts, people","- Report tab","- Report tab",""
"passed","Wed May 17 06:10:54 UTC 2023","Wed May 17 06:11:01 UTC 2023","7188","","Acessing the admin app","","Acessing the admin app","should allow admins to access the page","should allow admins to access the page",""
"passed","Wed May 17 06:28:53 UTC 2023","Wed May 17 06:28:54 UTC 2023","1192","","Token login","","Token login","should display an error with incorrect url","should display an error with incorrect url",""
"passed","Wed May 17 06:38:31 UTC 2023","Wed May 17 06:38:34 UTC 2023","3713","","Message tab breadcrumbs","","Message tab breadcrumbs","should display messages with updated breadcrumbs for offline user","should display messages with updated breadcrumbs for offline user",""
"passed","Wed May 17 06:43:21 UTC 2023","Wed May 17 06:43:23 UTC 2023","1677","","Create user for contacts","","Create user for contacts","""before all"" hook for Create user for contacts","""before all"" hook for Create user for contacts",""
"passed","Wed May 17 06:28:20 UTC 2023","Wed May 17 06:28:25 UTC 2023","4602","","Login and logout tests","","Login and logout tests","should set correct cookies","should set correct cookies",""
"passed","Wed May 17 06:38:51 UTC 2023","Wed May 17 06:38:53 UTC 2023","2515","","Send message","","Send message","should send a message to a raw phone number","should send a message to a raw phone number",""
"passed","Wed May 17 06:12:57 UTC 2023","Wed May 17 06:13:02 UTC 2023","4296","","Add new district tests : ","","Add new district tests : ","should edit district","should edit district",""
"passed","Wed May 17 06:13:44 UTC 2023","Wed May 17 06:13:48 UTC 2023","4356","","Edit contacts with the default config. ","","Edit contacts with the default config. ","should remove the primary contact from the clinic when the contact is deleted","should remove the primary contact from the clinic when the contact is deleted",""
"passed","Wed May 17 06:37:30 UTC 2023","Wed May 17 06:37:36 UTC 2023","5188","","Service worker cache","","Service worker cache","other translation updates do not trigger a login page refresh","other translation updates do not trigger a login page refresh",""
"passed","Wed May 17 06:50:02 UTC 2023","Wed May 17 06:50:06 UTC 2023","3966","","User Test Cases ->: Invalid entries -> ","","User Test Cases ->: Invalid entries -> ","TestCase for The password is too easy to guess.","TestCase for The password is too easy to guess.",""
"passed","Wed May 17 06:16:29 UTC 2023","Wed May 17 06:16:45 UTC 2023","15845","","Storing checkpointer on target migration","","Storing checkpointer on target migration","should store replication checkpointers on target and source","should store replication checkpointers on target and source",""
