"Status","Start Time","Stop Time","Duration in ms","Parent Suite","Suite","Sub Suite","Test Class","Test Method","Name","Description"
"passed","Thu May 11 04:39:10 UTC 2023","Thu May 11 04:39:34 UTC 2023","23412","","- DELETE permissions disabled","","- DELETE permissions disabled"," - Contact Tab - delete contact selected"," - Contact Tab - delete contact selected",""
"passed","Thu May 11 04:23:58 UTC 2023","Thu May 11 04:24:02 UTC 2023","3497","","Add new district tests : ","","Add new district tests : ","should edit district","should edit district",""
"passed","Thu May 11 04:37:08 UTC 2023","Thu May 11 04:37:11 UTC 2023","3404","","Login and logout tests","","Login and logout tests","should change locale to Spanish","should change locale to Spanish",""
"passed","Thu May 11 04:38:13 UTC 2023","Thu May 11 04:38:15 UTC 2023","1596","","Token login","","Token login","should display an error when accessing with random strings","should display an error when accessing with random strings",""
"passed","Thu May 11 04:46:53 UTC 2023","Thu May 11 04:46:59 UTC 2023","5611","","generating short codes","","generating short codes","create case ID","create case ID",""
"passed","Thu May 11 04:47:26 UTC 2023","Thu May 11 04:47:29 UTC 2023","3486","","Reports Subject","","Reports Subject","should create a report using place_id with a place_uuid","should create a report using place_id with a place_uuid",""
"passed","Thu May 11 05:05:39 UTC 2023","Thu May 11 05:05:41 UTC 2023","1490","","User Test Cases ->: Invalid entries -> ","","User Test Cases ->: Invalid entries -> ","should require place and contact for restricted user","should require place and contact for restricted user",""
"passed","Thu May 11 04:50:11 UTC 2023","Thu May 11 04:50:13 UTC 2023","1990","","sms-gateway api","","sms-gateway api","""before all"" hook for sms-gateway api","""before all"" hook for sms-gateway api",""
"passed","Thu May 11 05:03:54 UTC 2023","Thu May 11 05:03:58 UTC 2023","3626","","MessageFormat","","MessageFormat","should display plurals correctly","should display plurals correctly",""
"passed","Thu May 11 05:05:09 UTC 2023","Thu May 11 05:05:13 UTC 2023","4771","","User Test Cases ->: Creating Users ->","","User Test Cases ->: Creating Users ->","should add user with valid password","should add user with valid password",""
"passed","Thu May 11 04:22:35 UTC 2023","Thu May 11 04:22:48 UTC 2023","12692","","Creating custom places","","Creating custom places","the LHS button should show the appropriate label when multiple places exist at the current level","the LHS button should show the appropriate label when multiple places exist at the current level",""
"passed","Thu May 11 04:40:20 UTC 2023","Thu May 11 04:40:21 UTC 2023","462","","- permissions disabled: - export permissions disabled","","- permissions disabled: - export permissions disabled","- Message tab","- Message tab",""
"passed","Thu May 11 04:24:47 UTC 2023","Thu May 11 04:25:01 UTC 2023","14021","","Edit contacts with the default config. ","","Edit contacts with the default config. ","should edit contact name","should edit contact name",""
"passed","Thu May 11 04:26:37 UTC 2023","Thu May 11 04:26:40 UTC 2023","3375","","Create new lineage structure","","Create new lineage structure","Create new person","Create new person",""
"passed","Thu May 11 04:47:59 UTC 2023","Thu May 11 04:48:04 UTC 2023","5913","","Test Reports Search Functionality","","Test Reports Search Functionality","search by NON empty string should display results with contains match and then clears","search by NON empty string should display results with contains match and then clears",""
"passed","Thu May 11 04:34:00 UTC 2023","Thu May 11 04:34:04 UTC 2023","4437","","RepeatForm: Repeat form with select","","RepeatForm: Repeat form with select","should display the initial form and its repeated content in the default language","should display the initial form and its repeated content in the default language",""
"passed","Thu May 11 04:38:12 UTC 2023","Thu May 11 04:38:12 UTC 2023","706","","Token login","","Token login","should display an error when token login is disabled","should display an error when token login is disabled",""
"passed","Thu May 11 04:55:06 UTC 2023","Thu May 11 04:55:29 UTC 2023","22403","","Create user when adding contact","","Create user when adding contact","creates a new user when contact is added from app form","creates a new user when contact is added from app form",""
"passed","Thu May 11 04:41:42 UTC 2023","Thu May 11 04:41:44 UTC 2023","1652","","Navigation tests","","Navigation tests","should open Reports or History tab","should open Reports or History tab",""
"passed","Thu May 11 04:53:35 UTC 2023","Thu May 11 04:54:09 UTC 2023","33892","","Create user when adding contact","","Create user when adding contact","Creates a new user while offline","Creates a new user while offline",""
"passed","Thu May 11 04:23:53 UTC 2023","Thu May 11 04:23:58 UTC 2023","5314","","Add new district tests : ","","Add new district tests : ","should add new district with a new person","should add new district with a new person",""
"passed","Thu May 11 04:35:05 UTC 2023","Thu May 11 04:35:09 UTC 2023","4695","","Submit Photo Upload form","","Submit Photo Upload form","submit and edit (with changes)","submit and edit (with changes)",""
"passed","Thu May 11 04:29:45 UTC 2023","Thu May 11 04:29:46 UTC 2023","1516","","db-sync","","db-sync","should filter locally purged docs","should filter locally purged docs",""
"passed","Thu May 11 05:03:58 UTC 2023","Thu May 11 05:03:59 UTC 2023","945","","MessageFormat","","MessageFormat","should work with botched translations","should work with botched translations",""
"passed","Thu May 11 04:54:09 UTC 2023","Thu May 11 04:54:31 UTC 2023","22359","","Create user when adding contact","","Create user when adding contact","creates a new user while online","creates a new user while online",""
"passed","Thu May 11 04:35:33 UTC 2023","Thu May 11 04:35:48 UTC 2023","15255","","Training Cards","","Training Cards","should cancel training and not save it as completed","should cancel training and not save it as completed",""
"passed","Thu May 11 04:56:49 UTC 2023","Thu May 11 04:57:50 UTC 2023","60842","","Create user for contacts: user replace: for an offline user","","Create user for contacts: user replace: for an offline user","creates a new user and re-parents reports when the replace_user form is submitted","creates a new user and re-parents reports when the replace_user form is submitted",""
"passed","Thu May 11 04:38:47 UTC 2023","Thu May 11 04:38:48 UTC 2023","1383","","More Options Menu - Offline User: all permissions enabled","","More Options Menu - Offline User: all permissions enabled","Report tab - options enabled when xml report selected","Report tab - options enabled when xml report selected",""
"passed","Thu May 11 04:47:42 UTC 2023","Thu May 11 04:47:48 UTC 2023","6437","","Reports Subject","","Reports Subject","changes to a loaded or list report should be reflected in the UI ","changes to a loaded or list report should be reflected in the UI ",""
"passed","Thu May 11 04:40:42 UTC 2023","Thu May 11 04:40:45 UTC 2023","3211","","Online User:  - Contact tab - user has no contact ","","Online User:  - Contact tab - user has no contact "," - no contact selected"," - no contact selected",""
"passed","Thu May 11 04:39:41 UTC 2023","Thu May 11 04:40:05 UTC 2023","23170","","- EDIT permissions disabled","","- EDIT permissions disabled"," - Contact Tab - contact selected"," - Contact Tab - contact selected",""
"passed","Thu May 11 04:43:24 UTC 2023","Thu May 11 04:43:27 UTC 2023","3207","","Privacy policy: for an online user","","Privacy policy: for an online user","should show if the user policy changes","should show if the user policy changes",""
"passed","Thu May 11 04:38:17 UTC 2023","Thu May 11 04:38:21 UTC 2023","3536","","Token login","","Token login","should log the user in when token is correct","should log the user in when token is correct",""
"passed","Thu May 11 04:21:24 UTC 2023","Thu May 11 04:21:28 UTC 2023","4026","","Acessing the admin app","","Acessing the admin app","should redirect to login when not logged in","should redirect to login when not logged in",""
"skipped","Thu May 11 04:34:22 UTC 2023","Thu May 11 04:34:22 UTC 2023","0","","Submit Default Delivery Report","","Submit Default Delivery Report","open, submit and edit (no changes) default delivery form","open, submit and edit (no changes) default delivery form",""
"passed","Thu May 11 04:40:54 UTC 2023","Thu May 11 04:40:56 UTC 2023","2327","","Online User:  - Options enabled when there are items","","Online User:  - Options enabled when there are items","- Reports tab - options enabled when XML report selected","- Reports tab - options enabled when XML report selected",""
"passed","Thu May 11 04:47:48 UTC 2023","Thu May 11 04:47:52 UTC 2023","3474","","Reports Subject","","Reports Subject","should create a report which does not have a subject","should create a report which does not have a subject",""
"passed","Thu May 11 04:40:26 UTC 2023","Thu May 11 04:40:27 UTC 2023","1089","","- permissions disabled: - EDIT permissions disabled","","- permissions disabled: - EDIT permissions disabled","- Report Tab - option disabled when report selected","- Report Tab - option disabled when report selected",""
"passed","Thu May 11 04:47:16 UTC 2023","Thu May 11 04:47:20 UTC 2023","3669","","Reports Subject","","Reports Subject","should create a report using unknown patient_id ","should create a report using unknown patient_id ",""
"passed","Thu May 11 04:21:40 UTC 2023","Thu May 11 04:21:48 UTC 2023","8312","","Acessing the admin app","","Acessing the admin app","should allow admins to access the page","should allow admins to access the page",""
"passed","Thu May 11 04:51:49 UTC 2023","Thu May 11 04:51:58 UTC 2023","8745","","Tasks tab breadcrumbs","","Tasks tab breadcrumbs","""before all"" hook for Tasks tab breadcrumbs","""before all"" hook for Tasks tab breadcrumbs",""
"passed","Thu May 11 04:52:59 UTC 2023","Thu May 11 04:53:03 UTC 2023","3681","","Tasks group landing page: for chw","","Tasks group landing page: for chw","should not display modal when clicking list task from same group","should not display modal when clicking list task from same group",""
"passed","Thu May 11 04:24:23 UTC 2023","Thu May 11 04:24:35 UTC 2023","11492","","Contact details page: Permissions to show reports and tasks","","Contact details page: Permissions to show reports and tasks","should not show reports when permission is disabled","should not show reports when permission is disabled",""
"passed","Thu May 11 04:29:49 UTC 2023","Thu May 11 04:29:51 UTC 2023","2353","","db-sync: meta db replication","","db-sync: meta db replication","should replicate meta db up","should replicate meta db up",""
"passed","Thu May 11 04:41:40 UTC 2023","Thu May 11 04:41:42 UTC 2023","1882","","Navigation tests","","Navigation tests","should open tasks tab","should open tasks tab",""
"passed","Thu May 11 04:38:43 UTC 2023","Thu May 11 04:38:45 UTC 2023","1392","","More Options Menu - Offline User: all permissions enabled","","More Options Menu - Offline User: all permissions enabled"," - Contact Tab - with same facility_id"," - Contact Tab - with same facility_id",""
"passed","Thu May 11 04:32:12 UTC 2023","Thu May 11 04:32:12 UTC 2023","661","","Contact Delivery Form","","Contact Delivery Form","The past pregnancy card should show","The past pregnancy card should show",""
"passed","Thu May 11 04:51:58 UTC 2023","Thu May 11 04:52:10 UTC 2023","12076","","Tasks tab breadcrumbs: for chw","","Tasks tab breadcrumbs: for chw","should display correct tasks with breadcrumbs for chw","should display correct tasks with breadcrumbs for chw",""
"passed","Thu May 11 04:40:34 UTC 2023","Thu May 11 04:40:39 UTC 2023","5080","","Online User: Options disabled when no items - messages, contacts, people","","Online User: Options disabled when no items - messages, contacts, people","- Message tab","- Message tab",""
"passed","Thu May 11 04:25:54 UTC 2023","Thu May 11 04:26:14 UTC 2023","19758","","Mute/Unmute contacts using a specific form.","","Mute/Unmute contacts using a specific form.","Should unmute a contact using the defined unmute_forms (undo_death_report).","Should unmute a contact using the defined unmute_forms (undo_death_report).",""
"passed","Thu May 11 04:50:38 UTC 2023","Thu May 11 04:50:46 UTC 2023","8408","","Message tab breadcrumbs","","Message tab breadcrumbs","should display messages with breadcrumbs for online user","should display messages with breadcrumbs for online user",""
"skipped","Thu May 11 04:34:22 UTC 2023","Thu May 11 04:34:22 UTC 2023","0","","Submit Default Delivery Report","","Submit Default Delivery Report","open, submit and edit default delivery form","open, submit and edit default delivery form",""
"passed","Thu May 11 04:54:31 UTC 2023","Thu May 11 04:54:54 UTC 2023","23011","","Create user when adding contact","","Create user when adding contact","Creates a new user when adding a person while adding a place","Creates a new user when adding a person while adding a place",""
"passed","Thu May 11 04:52:52 UTC 2023","Thu May 11 04:52:55 UTC 2023","2297","","Tasks group landing page: for chw","","Tasks group landing page: for chw","should open task from the same group","should open task from the same group",""
"passed","Thu May 11 04:43:27 UTC 2023","Thu May 11 04:43:45 UTC 2023","17298","","Privacy policy: conflicts","","Privacy policy: conflicts","should not fail due to document conflict for new offline user","should not fail due to document conflict for new offline user",""
"passed","Thu May 11 04:24:02 UTC 2023","Thu May 11 04:24:05 UTC 2023","3436","","Add new district tests : ","","Add new district tests : ","should edit district with contact_type","should edit district with contact_type",""
"passed","Thu May 11 04:38:27 UTC 2023","Thu May 11 04:38:39 UTC 2023","11519","","More Options Menu - Offline User","","More Options Menu - Offline User","""before all"" hook for More Options Menu - Offline User","""before all"" hook for More Options Menu - Offline User",""
"passed","Thu May 11 04:41:58 UTC 2023","Thu May 11 04:42:05 UTC 2023","6732","","Guided tour","","Guided tour","run guided tour and change tab => should close the tour","run guided tour and change tab => should close the tour",""
"passed","Thu May 11 05:04:39 UTC 2023","Thu May 11 05:04:42 UTC 2023","2331","","Adding new language","","Adding new language","should reflect in config wizard","should reflect in config wizard",""
"passed","Thu May 11 04:38:48 UTC 2023","Thu May 11 04:39:04 UTC 2023","15710","","More Options Menu - Offline User: all permissions disabled","","More Options Menu - Offline User: all permissions disabled"," - all tabs, kebab menu not available"," - all tabs, kebab menu not available",""
"passed","Thu May 11 04:26:14 UTC 2023","Thu May 11 04:26:16 UTC 2023","1610","","Mute/Unmute contacts using a specific form.","","Mute/Unmute contacts using a specific form.","Should show a popup when trying to submit a non-unmuting form against a muted contact","Should show a popup when trying to submit a non-unmuting form against a muted contact",""
