"Status","Start Time","Stop Time","Duration in ms","Parent Suite","Suite","Sub Suite","Test Class","Test Method","Name","Description"
"passed","Mon Feb 06 21:58:38 UTC 2023","Mon Feb 06 21:58:41 UTC 2023","2773","","MessageFormat","","MessageFormat","should display plurals correctly","should display plurals correctly",""
"passed","Mon Feb 06 21:50:35 UTC 2023","Mon Feb 06 21:50:39 UTC 2023","3516","","Privacy policy: for an online user","","Privacy policy: for an online user","should show if the user policy changes","should show if the user policy changes",""
"passed","Mon Feb 06 21:44:33 UTC 2023","Mon Feb 06 21:45:01 UTC 2023","28106","","Submit Default Delivery Report","","Submit Default Delivery Report","open, submit and edit (no changes) default delivery form","open, submit and edit (no changes) default delivery form",""
"passed","Mon Feb 06 21:40:59 UTC 2023","Mon Feb 06 21:41:01 UTC 2023","2246","","db-sync: meta db replication","","db-sync: meta db replication","should replicate meta db up","should replicate meta db up",""
"passed","Mon Feb 06 21:54:14 UTC 2023","Mon Feb 06 21:54:28 UTC 2023","14093","","Reports Sidebar Filter","","Reports Sidebar Filter","should filter by date","should filter by date",""
"passed","Mon Feb 06 21:58:30 UTC 2023","Mon Feb 06 21:58:33 UTC 2023","3030","","Tasks group landing page: for supervisor","","Tasks group landing page: for supervisor","should not display task landing page after task completion","should not display task landing page after task completion",""
"passed","Mon Feb 06 21:41:54 UTC 2023","Mon Feb 06 21:41:55 UTC 2023","989","","Submit a death report","","Submit a death report","Should verify that the counter for the Deaths was updated.","Should verify that the counter for the Deaths was updated.",""
"passed","Mon Feb 06 21:36:59 UTC 2023","Mon Feb 06 21:37:02 UTC 2023","3332","","Add new district tests : ","","Add new district tests : ","should edit district with contact_type","should edit district with contact_type",""
"passed","Mon Feb 06 21:45:38 UTC 2023","Mon Feb 06 21:45:39 UTC 2023","1455","","Submit Enketo form","","Submit Enketo form","allows forms with required notes to be submitted","allows forms with required notes to be submitted",""
"passed","Mon Feb 06 21:56:13 UTC 2023","Mon Feb 06 21:56:23 UTC 2023","10031","","Message tab breadcrumbs","","Message tab breadcrumbs","should display messages with updated breadcrumbs for offline user","should display messages with updated breadcrumbs for offline user",""
"passed","Mon Feb 06 21:33:51 UTC 2023","Mon Feb 06 21:34:40 UTC 2023","49233","","Create user for contacts: for an offline user","","Create user for contacts: for an offline user","creates new user for the first version of a contact to sync and conflicting replacements ignored","creates new user for the first version of a contact to sync and conflicting replacements ignored",""
"passed","Mon Feb 06 21:50:33 UTC 2023","Mon Feb 06 21:50:35 UTC 2023","2419","","Privacy policy: for an online user","","Privacy policy: for an online user","should show if the user changes their language","should show if the user changes their language",""
"passed","Mon Feb 06 21:48:18 UTC 2023","Mon Feb 06 21:48:23 UTC 2023","4436","","bfcache: login page","","bfcache: login page","should redirect to the app page when session is valid","should redirect to the app page when session is valid",""
"passed","Mon Feb 06 21:29:59 UTC 2023","Mon Feb 06 21:30:01 UTC 2023","2316","","About page","","About page","should display partners","should display partners",""
"passed","Mon Feb 06 21:58:41 UTC 2023","Mon Feb 06 21:58:41 UTC 2023","863","","MessageFormat","","MessageFormat","should work with botched translations","should work with botched translations",""
"passed","Mon Feb 06 21:48:01 UTC 2023","Mon Feb 06 21:48:05 UTC 2023","4545","","Token login","","Token login","should redirect the user to the app if already logged in","should redirect the user to the app if already logged in",""
"passed","Mon Feb 06 21:36:05 UTC 2023","Mon Feb 06 21:36:14 UTC 2023","9400","","Creating custom places","","Creating custom places","the RHS add place button should show the add place title","the RHS add place button should show the add place title",""
"passed","Mon Feb 06 21:45:32 UTC 2023","Mon Feb 06 21:45:38 UTC 2023","6001","","Submit Enketo form","","Submit Enketo form","submits on reports tab","submits on reports tab",""
"passed","Mon Feb 06 21:58:19 UTC 2023","Mon Feb 06 21:58:30 UTC 2023","10919","","Tasks group landing page: for supervisor","","Tasks group landing page: for supervisor","should have tasks","should have tasks",""
"passed","Mon Feb 06 21:55:26 UTC 2023","Mon Feb 06 21:55:34 UTC 2023","8173","","Export Messages","","Export Messages","Should download export file","Should download export file",""
"passed","Mon Feb 06 21:42:41 UTC 2023","Mon Feb 06 21:42:43 UTC 2023","1737","","Contact Delivery Form","","Contact Delivery Form","The targets page should be updated","The targets page should be updated",""
"passed","Mon Feb 06 21:48:23 UTC 2023","Mon Feb 06 21:48:26 UTC 2023","2631","","bfcache: webapp","","bfcache: webapp","should redirect to login page when session is expired","should redirect to login page when session is expired",""
"passed","Mon Feb 06 21:41:01 UTC 2023","Mon Feb 06 21:41:06 UTC 2023","4946","","db-sync: meta db replication","","db-sync: meta db replication","should replicate meta db down","should replicate meta db down",""
"passed","Mon Feb 06 21:45:40 UTC 2023","Mon Feb 06 21:45:41 UTC 2023","1435","","Submit Enketo form","","Submit Enketo form","cancelling form with input triggers confirmation dialog box","cancelling form with input triggers confirmation dialog box",""
"passed","Mon Feb 06 21:43:01 UTC 2023","Mon Feb 06 21:43:12 UTC 2023","11303","","Pregnancy danger sign follow-up form","","Pregnancy danger sign follow-up form","should submit and edit Pregnancy danger sign follow-up form with changes","should submit and edit Pregnancy danger sign follow-up form with changes",""
"passed","Mon Feb 06 21:53:30 UTC 2023","Mon Feb 06 21:53:37 UTC 2023","6865","","Delete Reports","","Delete Reports","Should delete report","Should delete report",""
"passed","Mon Feb 06 21:30:56 UTC 2023","Mon Feb 06 21:31:08 UTC 2023","12322","","Create user for contacts","","Create user for contacts","does not create a new user when the replace_user form is submitted for online user","does not create a new user when the replace_user form is submitted for online user",""
"passed","Mon Feb 06 21:53:42 UTC 2023","Mon Feb 06 21:53:49 UTC 2023","6576","","Export Reports","","Export Reports","Should download export file","Should download export file",""
"passed","Mon Feb 06 21:31:08 UTC 2023","Mon Feb 06 21:31:45 UTC 2023","36823","","Create user for contacts: for an offline user","","Create user for contacts: for an offline user","creates a new user and re-parents reports when the replace_user form is submitted","creates a new user and re-parents reports when the replace_user form is submitted",""
"passed","Mon Feb 06 21:52:40 UTC 2023","Mon Feb 06 21:52:50 UTC 2023","10360","","Reports tab breadcrumbs","","Reports tab breadcrumbs","should display reports with updated breadcrumbs for offline user","should display reports with updated breadcrumbs for offline user",""
"passed","Mon Feb 06 21:55:53 UTC 2023","Mon Feb 06 21:55:59 UTC 2023","5679","","Link SMS to patient without passing id","","Link SMS to patient without passing id","Send SMS without patient_id and report created under person","Send SMS without patient_id and report created under person",""
"passed","Mon Feb 06 21:42:00 UTC 2023","Mon Feb 06 21:42:11 UTC 2023","10772","","Edit report with attachmnet","","Edit report with attachmnet","should remove attachment when saving","should remove attachment when saving",""
"passed","Mon Feb 06 21:40:56 UTC 2023","Mon Feb 06 21:40:59 UTC 2023","2713","","db-sync","","db-sync","should filter ddocs","should filter ddocs",""
"passed","Mon Feb 06 21:59:37 UTC 2023","Mon Feb 06 21:59:42 UTC 2023","5050","","User Test Cases ->: Invalid entries -> ","","User Test Cases ->: Invalid entries -> ","TestCase for The password is too easy to guess.","TestCase for The password is too easy to guess.",""
"passed","Mon Feb 06 21:30:05 UTC 2023","Mon Feb 06 21:30:08 UTC 2023","2871","","Acessing the admin app","","Acessing the admin app","should redirect to login when not logged in","should redirect to login when not logged in",""
"passed","Mon Feb 06 21:35:55 UTC 2023","Mon Feb 06 21:36:05 UTC 2023","10069","","Creating custom places","","Creating custom places","the RHS add place button should show the custom title","the RHS add place button should show the custom title",""
"passed","Mon Feb 06 21:40:27 UTC 2023","Mon Feb 06 21:40:32 UTC 2023","5151","","Test Contact Search Functionality","","Test Contact Search Functionality","search by NON empty string should display results with contains match and clears search","search by NON empty string should display results with contains match and clears search",""
"passed","Mon Feb 06 21:30:30 UTC 2023","Mon Feb 06 21:30:42 UTC 2023","11081","","Targets","","Targets","should display targets from default config","should display targets from default config",""
"passed","Mon Feb 06 21:48:11 UTC 2023","Mon Feb 06 21:48:15 UTC 2023","3641","","Token login","","Token login","should log the user in when token is correct","should log the user in when token is correct",""
"passed","Mon Feb 06 21:50:09 UTC 2023","Mon Feb 06 21:50:15 UTC 2023","6172","","Privacy policy: for an offline user","","Privacy policy: for an offline user","should show if the user policy changes","should show if the user policy changes",""
"passed","Mon Feb 06 21:53:54 UTC 2023","Mon Feb 06 21:53:59 UTC 2023","5249","","generating short codes","","generating short codes","create case ID","create case ID",""
"passed","Mon Feb 06 21:39:05 UTC 2023","Mon Feb 06 21:39:06 UTC 2023","1091","","Mute/Unmute contacts using a specific form.","","Mute/Unmute contacts using a specific form.","Should show a popup when trying to submit a non-unmuting form against a muted contact","Should show a popup when trying to submit a non-unmuting form against a muted contact",""
"passed","Mon Feb 06 21:48:40 UTC 2023","Mon Feb 06 21:48:42 UTC 2023","2364","","Hamburger Menu tests","","Hamburger Menu tests","should open Configuration app","should open Configuration app",""
"passed","Mon Feb 06 21:47:51 UTC 2023","Mon Feb 06 21:47:56 UTC 2023","5663","","should renew token","","should renew token","Refresh page multiple times and verify token gets renewed","Refresh page multiple times and verify token gets renewed",""
"passed","Mon Feb 06 21:50:39 UTC 2023","Mon Feb 06 21:50:58 UTC 2023","18804","","Privacy policy: conflicts","","Privacy policy: conflicts","should not fail due to document conflict for new offline user","should not fail due to document conflict for new offline user",""
"passed","Mon Feb 06 21:48:39 UTC 2023","Mon Feb 06 21:48:40 UTC 2023","729","","Hamburger Menu tests","","Hamburger Menu tests","should open Report bug","should open Report bug",""
"passed","Mon Feb 06 21:45:01 UTC 2023","Mon Feb 06 21:45:27 UTC 2023","25728","","Submit Default Delivery Report","","Submit Default Delivery Report","open, submit and edit default delivery form","open, submit and edit default delivery form",""
"passed","Mon Feb 06 21:39:16 UTC 2023","Mon Feb 06 21:39:19 UTC 2023","3379","","Create new lineage structure","","Create new lineage structure","Create new area","Create new area",""
"passed","Mon Feb 06 21:48:26 UTC 2023","Mon Feb 06 21:48:29 UTC 2023","3069","","bfcache: admin app","","bfcache: admin app","should redirect to login page when session is expired","should redirect to login page when session is expired",""
"passed","Mon Feb 06 21:59:57 UTC 2023","Mon Feb 06 22:00:01 UTC 2023","4534","","User Test Cases ->: Invalid entries -> ","","User Test Cases ->: Invalid entries -> ","should require username","should require username",""
"passed","Mon Feb 06 21:49:54 UTC 2023","Mon Feb 06 21:50:07 UTC 2023","13135","","Privacy policy: for an offline user","","Privacy policy: for an offline user","should show french policy on secondary login","should show french policy on secondary login",""
"passed","Mon Feb 06 22:00:19 UTC 2023","Mon Feb 06 22:00:26 UTC 2023","7225","","Create user meta db : ","","Create user meta db : ","should allow a new user to read/write from meta db","should allow a new user to read/write from meta db",""
"passed","Mon Feb 06 21:59:16 UTC 2023","Mon Feb 06 21:59:21 UTC 2023","4646","","Adding new language","","Adding new language","should add new translations","should add new translations",""
"passed","Mon Feb 06 21:44:23 UTC 2023","Mon Feb 06 21:44:29 UTC 2023","5729","","Countdown timer widget","","Countdown timer widget","interact with timer and submit","interact with timer and submit",""
"passed","Mon Feb 06 21:59:13 UTC 2023","Mon Feb 06 21:59:14 UTC 2023","1204","","Adding new language","","Adding new language","should be set as Default language ","should be set as Default language ",""
"passed","Mon Feb 06 21:40:32 UTC 2023","Mon Feb 06 21:40:34 UTC 2023","1747","","Test Contact Search Functionality","","Test Contact Search Functionality","search should clear RHS selected contact","search should clear RHS selected contact",""
"passed","Mon Feb 06 21:44:00 UTC 2023","Mon Feb 06 21:44:04 UTC 2023","4477","","RepeatForm: Repeat form with count input","","RepeatForm: Repeat form with count input","should display the initial form and its repeated content in Nepali","should display the initial form and its repeated content in Nepali",""
"passed","Mon Feb 06 21:46:08 UTC 2023","Mon Feb 06 21:46:12 UTC 2023","4121","","Submit Z-Score form","","Submit Z-Score form","saves z-score values","saves z-score values",""
"passed","Mon Feb 06 21:44:11 UTC 2023","Mon Feb 06 21:44:15 UTC 2023","3873","","RepeatForm: Repeat form with repeat button","","RepeatForm: Repeat form with repeat button","should display the initial form and its repeated content in English","should display the initial form and its repeated content in English",""
"passed","Mon Feb 06 21:50:23 UTC 2023","Mon Feb 06 21:50:24 UTC 2023","687","","Privacy policy: for an online user","","Privacy policy: for an online user","should display when navigating to the privacy policy page","should display when navigating to the privacy policy page",""
"passed","Mon Feb 06 21:57:16 UTC 2023","Mon Feb 06 21:57:28 UTC 2023","11250","","Tasks tab breadcrumbs: for chw","","Tasks tab breadcrumbs: for chw","should display correct tasks with breadcrumbs for chw","should display correct tasks with breadcrumbs for chw",""
"passed","Mon Feb 06 21:39:44 UTC 2023","Mon Feb 06 21:39:50 UTC 2023","5741","","Create new lineage structure","","Create new lineage structure","should edit the name of the CHW area","should edit the name of the CHW area",""
"passed","Mon Feb 06 21:50:15 UTC 2023","Mon Feb 06 21:50:22 UTC 2023","7335","","Privacy policy: for an online user","","Privacy policy: for an online user","should show the correct privacy policy on login","should show the correct privacy policy on login",""
"passed","Mon Feb 06 21:55:05 UTC 2023","Mon Feb 06 21:55:11 UTC 2023","6024","","Service worker cache","","Service worker cache","login page translation updates trigger login page refresh","login page translation updates trigger login page refresh",""
"passed","Mon Feb 06 21:30:42 UTC 2023","Mon Feb 06 21:30:48 UTC 2023","6500","","Targets","","Targets","should display correct message when no target found","should display correct message when no target found",""
"passed","Mon Feb 06 21:50:24 UTC 2023","Mon Feb 06 21:50:28 UTC 2023","4132","","Privacy policy: for an online user","","Privacy policy: for an online user","should not show on subsequent login","should not show on subsequent login",""
"passed","Mon Feb 06 21:37:40 UTC 2023","Mon Feb 06 21:37:54 UTC 2023","14194","","Edit contacts with the default config. ","","Edit contacts with the default config. ","should edit contact name","should edit contact name",""
"passed","Mon Feb 06 21:36:51 UTC 2023","Mon Feb 06 21:36:55 UTC 2023","4821","","Add new district tests : ","","Add new district tests : ","should add new district with a new person","should add new district with a new person",""
"passed","Mon Feb 06 21:48:47 UTC 2023","Mon Feb 06 21:48:50 UTC 2023","3461","","Navigation tests","","Navigation tests","should open Messages tab","should open Messages tab",""
"passed","Mon Feb 06 21:38:15 UTC 2023","Mon Feb 06 21:38:46 UTC 2023","30956","","Mute/Unmute contacts using a specific form.","","Mute/Unmute contacts using a specific form.","Should mute a contact using the defined mute_forms (death_report).","Should mute a contact using the defined mute_forms (death_report).",""
"passed","Mon Feb 06 21:48:52 UTC 2023","Mon Feb 06 21:48:54 UTC 2023","1593","","Navigation tests","","Navigation tests","should open Reports or History tab","should open Reports or History tab",""
"passed","Mon Feb 06 21:30:19 UTC 2023","Mon Feb 06 21:30:25 UTC 2023","6346","","Acessing the admin app","","Acessing the admin app","should allow admins to access the page","should allow admins to access the page",""
"passed","Mon Feb 06 21:54:46 UTC 2023","Mon Feb 06 21:55:05 UTC 2023","19391","","Service worker cache","","Service worker cache","branding updates trigger login page refresh","branding updates trigger login page refresh",""
"passed","Mon Feb 06 21:57:58 UTC 2023","Mon Feb 06 21:58:01 UTC 2023","3640","","Tasks group landing page: for chw","","Tasks group landing page: for chw","should display tasks group landing page after task completion","should display tasks group landing page after task completion",""
"passed","Mon Feb 06 21:48:34 UTC 2023","Mon Feb 06 21:48:37 UTC 2023","3737","","Hamburger Menu tests","","Hamburger Menu tests","should open Configuration wizard","should open Configuration wizard",""
"passed","Mon Feb 06 21:54:33 UTC 2023","Mon Feb 06 21:54:46 UTC 2023","12301","","Service worker cache","","Service worker cache","confirm initial list of cached resources","confirm initial list of cached resources",""
"passed","Mon Feb 06 21:56:04 UTC 2023","Mon Feb 06 21:56:13 UTC 2023","8938","","Message tab breadcrumbs","","Message tab breadcrumbs","should display messages with breadcrumbs for online user","should display messages with breadcrumbs for online user",""
"passed","Mon Feb 06 21:59:00 UTC 2023","Mon Feb 06 21:59:01 UTC 2023","1510","","Bikram Sambat date display","","Bikram Sambat date display","SMS report shows bsDate type as date field correctly","SMS report shows bsDate type as date field correctly",""
"passed","Mon Feb 06 21:34:57 UTC 2023","Mon Feb 06 21:35:29 UTC 2023","31936","","Create user for contacts: for an offline user","","Create user for contacts: for an offline user","does not create any new user nor does it reparent new reports when the transition fails","does not create any new user nor does it reparent new reports when the transition fails",""
"passed","Mon Feb 06 21:59:14 UTC 2023","Mon Feb 06 21:59:16 UTC 2023","2486","","Adding new language","","Adding new language","should reflect in config wizard","should reflect in config wizard",""
"passed","Mon Feb 06 21:42:40 UTC 2023","Mon Feb 06 21:42:41 UTC 2023","806","","Contact Delivery Form","","Contact Delivery Form","The child registered during birth should be created and should display the proper information","The child registered during birth should be created and should display the proper information",""
"passed","Mon Feb 06 21:57:48 UTC 2023","Mon Feb 06 21:57:58 UTC 2023","9340","","Tasks group landing page: for chw","","Tasks group landing page: for chw","should have tasks","should have tasks",""
"passed","Mon Feb 06 21:58:11 UTC 2023","Mon Feb 06 21:58:16 UTC 2023","4917","","Tasks group landing page: for chw","","Tasks group landing page: for chw","should not show page when there are no more household tasks","should not show page when there are no more household tasks",""
"passed","Mon Feb 06 21:52:29 UTC 2023","Mon Feb 06 21:52:29 UTC 2023","607","","manifest.json","","manifest.json","works with custom branding doc","works with custom branding doc",""
"passed","Mon Feb 06 21:46:16 UTC 2023","Mon Feb 06 21:47:03 UTC 2023","47626","","Submit an undo death report","","Submit an undo death report","Should submit an undo death report","Should submit an undo death report",""
"failed","Mon Feb 06 21:43:45 UTC 2023","Mon Feb 06 21:43:51 UTC 2023","5286","","Pregnancy registration","","Pregnancy registration","Should verify that all tasks related with the high risk pregnancy were created","Should verify that all tasks related with the high risk pregnancy were created",""
"passed","Mon Feb 06 21:32:12 UTC 2023","Mon Feb 06 21:32:39 UTC 2023","26903","","Create user for contacts: for an offline user","","Create user for contacts: for an offline user","does not assign new person as primary contact of parent place if original person was not primary","does not assign new person as primary contact of parent place if original person was not primary",""
"passed","Mon Feb 06 21:47:16 UTC 2023","Mon Feb 06 21:47:20 UTC 2023","4214","","Login and logout tests","","Login and logout tests","should show a warning before log out","should show a warning before log out",""
"passed","Mon Feb 06 21:30:08 UTC 2023","Mon Feb 06 21:30:19 UTC 2023","10710","","Acessing the admin app","","Acessing the admin app","should show access error when accessing as an offline user","should show access error when accessing as an offline user",""
"passed","Mon Feb 06 21:47:03 UTC 2023","Mon Feb 06 21:47:04 UTC 2023","655","","Submit an undo death report","","Submit an undo death report","Should verify that the undo death report was created","Should verify that the undo death report was created",""
"passed","Mon Feb 06 21:40:52 UTC 2023","Mon Feb 06 21:40:53 UTC 2023","1481","","db-sync","","db-sync","should not filter deletes","should not filter deletes",""
"passed","Mon Feb 06 21:46:02 UTC 2023","Mon Feb 06 21:46:08 UTC 2023","6079","","Submit Z-Score form","","Submit Z-Score form","Autofills zscore fields with correct values","Autofills zscore fields with correct values",""
"passed","Mon Feb 06 21:40:53 UTC 2023","Mon Feb 06 21:40:55 UTC 2023","1232","","db-sync","","db-sync","should filter resources, service-worker, forms, translations, branding, partners docs","should filter resources, service-worker, forms, translations, branding, partners docs",""
"passed","Mon Feb 06 21:49:21 UTC 2023","Mon Feb 06 21:49:39 UTC 2023","17791","","Privacy policy: for an offline user","","Privacy policy: for an offline user","should show the correct privacy policy on login","should show the correct privacy policy on login",""
"passed","Mon Feb 06 21:47:14 UTC 2023","Mon Feb 06 21:47:16 UTC 2023","1952","","Login and logout tests","","Login and logout tests","should change locale to Spanish","should change locale to Spanish",""
"passed","Mon Feb 06 21:45:39 UTC 2023","Mon Feb 06 21:45:40 UTC 2023","890","","Submit Enketo form","","Submit Enketo form","cancelling form with no input does not trigger confirmation dialog","cancelling form with no input does not trigger confirmation dialog",""
"passed","Mon Feb 06 21:42:47 UTC 2023","Mon Feb 06 21:42:55 UTC 2023","7875","","Pregnancy danger sign follow-up form","","Pregnancy danger sign follow-up form","Submit and validate Pregnancy danger sign follow-up form and keeps the report minified","Submit and validate Pregnancy danger sign follow-up form and keeps the report minified",""
"passed","Mon Feb 06 21:57:28 UTC 2023","Mon Feb 06 21:57:37 UTC 2023","9107","","Tasks tab breadcrumbs: for supervisor","","Tasks tab breadcrumbs: for supervisor","should display correct tasks with breadcrumbs for supervisor","should display correct tasks with breadcrumbs for supervisor",""
"passed","Mon Feb 06 21:36:55 UTC 2023","Mon Feb 06 21:36:59 UTC 2023","3345","","Add new district tests : ","","Add new district tests : ","should edit district","should edit district",""
"passed","Mon Feb 06 21:58:46 UTC 2023","Mon Feb 06 21:58:54 UTC 2023","8290","","Bikram Sambat date display","","Bikram Sambat date display","enketo xpath extension function should display correct values when Nepali is not selected","enketo xpath extension function should display correct values when Nepali is not selected",""
"passed","Mon Feb 06 21:48:54 UTC 2023","Mon Feb 06 21:48:56 UTC 2023","1605","","Navigation tests","","Navigation tests","should open Contacts or Peoples tab","should open Contacts or Peoples tab",""
"passed","Mon Feb 06 21:51:02 UTC 2023","Mon Feb 06 21:52:20 UTC 2023","77579","","purge","","purge","purging runs on sync and startup","purging runs on sync and startup",""
"passed","Mon Feb 06 21:35:33 UTC 2023","Mon Feb 06 21:35:44 UTC 2023","10332","","Creating custom places","","Creating custom places","the LHS add place button should show the appropriate title","the LHS add place button should show the appropriate title",""
"passed","Mon Feb 06 21:55:41 UTC 2023","Mon Feb 06 21:55:43 UTC 2023","2825","","sms-gateway api: - gateway submits new WT sms messages","","sms-gateway api: - gateway submits new WT sms messages","shows content","shows content",""
"passed","Mon Feb 06 21:41:53 UTC 2023","Mon Feb 06 21:41:54 UTC 2023","673","","Submit a death report","","Submit a death report","Should verify that the report related to the death was created","Should verify that the report related to the death was created",""
"passed","Mon Feb 06 21:58:08 UTC 2023","Mon Feb 06 21:58:11 UTC 2023","3501","","Tasks group landing page: for chw","","Tasks group landing page: for chw","should not display modal when clicking list task from same group","should not display modal when clicking list task from same group",""
