"Status","Start Time","Stop Time","Duration in ms","Parent Suite","Suite","Sub Suite","Test Class","Test Method","Name","Description"
"failed","Mon Feb 06 20:48:16 UTC 2023","Mon Feb 06 20:48:21 UTC 2023","4929","","Pregnancy registration","","Pregnancy registration","Should verify that all tasks related with the high risk pregnancy were created","Should verify that all tasks related with the high risk pregnancy were created",""
"passed","Mon Feb 06 20:45:13 UTC 2023","Mon Feb 06 20:45:26 UTC 2023","13574","","db-sync","","db-sync","should not filter allowed docs","should not filter allowed docs",""
"passed","Mon Feb 06 20:45:45 UTC 2023","Mon Feb 06 20:45:55 UTC 2023","9657","","Family form","","Family form","Submit Add Family form","Submit Add Family form",""
"passed","Mon Feb 06 20:56:52 UTC 2023","Mon Feb 06 20:57:02 UTC 2023","10634","","Reports tab breadcrumbs","","Reports tab breadcrumbs","should display reports with updated breadcrumbs for offline user","should display reports with updated breadcrumbs for offline user",""
"passed","Mon Feb 06 20:48:35 UTC 2023","Mon Feb 06 20:48:39 UTC 2023","4068","","RepeatForm: Repeat form with count input","","RepeatForm: Repeat form with count input","should display the initial form and its repeated content in English","should display the initial form and its repeated content in English",""
"passed","Mon Feb 06 20:36:54 UTC 2023","Mon Feb 06 20:37:20 UTC 2023","26792","","Create user for contacts: for an offline user","","Create user for contacts: for an offline user","does not assign new person as primary contact of parent place if original person was not primary","does not assign new person as primary contact of parent place if original person was not primary",""
"passed","Mon Feb 06 20:47:49 UTC 2023","Mon Feb 06 20:47:57 UTC 2023","7810","","Pregnancy Visit","","Pregnancy Visit","Submit and validate Pregnancy Visit form and keeps the report minified","Submit and validate Pregnancy Visit form and keeps the report minified",""
"passed","Mon Feb 06 21:10:10 UTC 2023","Mon Feb 06 21:10:22 UTC 2023","11734","","Tasks group landing page: for supervisor","","Tasks group landing page: for supervisor","should have tasks","should have tasks",""
"passed","Mon Feb 06 20:54:33 UTC 2023","Mon Feb 06 20:54:35 UTC 2023","1734","","Privacy policy: for an offline user","","Privacy policy: for an offline user","should show if the user changes their language","should show if the user changes their language",""
"passed","Mon Feb 06 20:57:19 UTC 2023","Mon Feb 06 20:57:34 UTC 2023","14562","","Report Filter","","Report Filter","should filter by date","should filter by date",""
"passed","Mon Feb 06 20:44:09 UTC 2023","Mon Feb 06 20:44:15 UTC 2023","6168","","Create new lineage structure","","Create new lineage structure","should edit a name of the health facility","should edit a name of the health facility",""
"passed","Mon Feb 06 21:12:05 UTC 2023","Mon Feb 06 21:12:13 UTC 2023","7659","","Bulk User Creation ->","","Bulk User Creation ->","should show an upload summary with a successful upload and a failed upload","should show an upload summary with a successful upload and a failed upload",""
"passed","Mon Feb 06 20:58:00 UTC 2023","Mon Feb 06 20:58:05 UTC 2023","5292","","generating short codes","","generating short codes","create case ID","create case ID",""
"broken","Mon Feb 06 20:58:51 UTC 2023","Mon Feb 06 21:00:28 UTC 2023","96129","","Service worker cache","","Service worker cache","branding updates trigger login page refresh","branding updates trigger login page refresh",""
"broken","Mon Feb 06 21:02:02 UTC 2023","Mon Feb 06 21:03:35 UTC 2023","93499","","Service worker cache","","Service worker cache","adding new languages triggers login page refresh","adding new languages triggers login page refresh",""
"passed","Mon Feb 06 20:52:43 UTC 2023","Mon Feb 06 20:52:44 UTC 2023","1033","","Token login","","Token login","should display an error when accessing with random strings","should display an error when accessing with random strings",""
"passed","Mon Feb 06 21:12:17 UTC 2023","Mon Feb 06 21:12:25 UTC 2023","8007","","Create user meta db : ","","Create user meta db : ","should allow a new user to read/write from meta db","should allow a new user to read/write from meta db",""
"passed","Mon Feb 06 20:51:59 UTC 2023","Mon Feb 06 20:52:02 UTC 2023","3855","","Login and logout tests","","Login and logout tests","should set correct cookies","should set correct cookies",""
"passed","Mon Feb 06 20:53:34 UTC 2023","Mon Feb 06 20:53:41 UTC 2023","6789","","Guided tour","","Guided tour","run and end guided tour => should close the tour","run and end guided tour => should close the tour",""
"passed","Mon Feb 06 20:42:18 UTC 2023","Mon Feb 06 20:42:32 UTC 2023","14545","","Edit contacts with the default config. ","","Edit contacts with the default config. ","should edit contact name","should edit contact name",""
"passed","Mon Feb 06 20:53:52 UTC 2023","Mon Feb 06 20:54:08 UTC 2023","15880","","Privacy policy: for an offline user","","Privacy policy: for an offline user","should show the correct privacy policy on login","should show the correct privacy policy on login",""
"passed","Mon Feb 06 21:11:23 UTC 2023","Mon Feb 06 21:11:28 UTC 2023","5526","","User Test Cases ->: Creating Users ->","","User Test Cases ->: Creating Users ->","should add user with valid password","should add user with valid password",""
"passed","Mon Feb 06 20:47:33 UTC 2023","Mon Feb 06 20:47:45 UTC 2023","11466","","Pregnancy danger sign follow-up form","","Pregnancy danger sign follow-up form","should submit and edit Pregnancy danger sign follow-up form with changes","should submit and edit Pregnancy danger sign follow-up form with changes",""
"passed","Mon Feb 06 20:48:42 UTC 2023","Mon Feb 06 20:48:46 UTC 2023","3487","","RepeatForm: Repeat form with repeat button","","RepeatForm: Repeat form with repeat button","should display the initial form and its repeated content in English","should display the initial form and its repeated content in English",""
"passed","Mon Feb 06 20:55:23 UTC 2023","Mon Feb 06 20:56:31 UTC 2023","68392","","purge","","purge","purging runs on sync and startup","purging runs on sync and startup",""
"passed","Mon Feb 06 21:08:34 UTC 2023","Mon Feb 06 21:08:42 UTC 2023","7340","","Task list due dates","","Task list due dates","should display correct due dates with taskDaysOverdue setting","should display correct due dates with taskDaysOverdue setting",""
"passed","Mon Feb 06 21:08:42 UTC 2023","Mon Feb 06 21:08:49 UTC 2023","7681","","Task list due dates","","Task list due dates","should display correct due dates with taskDaysOverdue setting and simple translation","should display correct due dates with taskDaysOverdue setting and simple translation",""
"passed","Mon Feb 06 20:53:10 UTC 2023","Mon Feb 06 20:53:12 UTC 2023","1761","","Hamburger Menu tests","","Hamburger Menu tests","should open About","should open About",""
"passed","Mon Feb 06 20:45:28 UTC 2023","Mon Feb 06 20:45:29 UTC 2023","1255","","db-sync","","db-sync","should filter resources, service-worker, forms, translations, branding, partners docs","should filter resources, service-worker, forms, translations, branding, partners docs",""
"passed","Mon Feb 06 20:43:56 UTC 2023","Mon Feb 06 20:44:00 UTC 2023","3729","","Create new lineage structure","","Create new lineage structure","Create new household","Create new household",""
"passed","Mon Feb 06 20:46:28 UTC 2023","Mon Feb 06 20:46:30 UTC 2023","1038","","Submit a death report","","Submit a death report","Should verify that the counter for the Deaths was updated.","Should verify that the counter for the Deaths was updated.",""
"passed","Mon Feb 06 21:11:53 UTC 2023","Mon Feb 06 21:11:58 UTC 2023","5165","","User Test Cases ->: Invalid entries -> ","","User Test Cases ->: Invalid entries -> ","should require username","should require username",""
"passed","Mon Feb 06 20:51:55 UTC 2023","Mon Feb 06 20:51:59 UTC 2023","3551","","Login and logout tests","","Login and logout tests","should log in using username and password fields","should log in using username and password fields",""
"passed","Mon Feb 06 20:41:03 UTC 2023","Mon Feb 06 20:41:13 UTC 2023","10188","","Creating custom places","","Creating custom places","should show the multi add person button with the correct title","should show the multi add person button with the correct title",""
"passed","Mon Feb 06 20:52:54 UTC 2023","Mon Feb 06 20:52:58 UTC 2023","4230","","bfcache: login page","","bfcache: login page","should redirect to the app page when session is valid","should redirect to the app page when session is valid",""
"passed","Mon Feb 06 20:46:56 UTC 2023","Mon Feb 06 20:47:12 UTC 2023","16595","","Contact Delivery Form","","Contact Delivery Form","Complete a delivery: Process a delivery with a live child and facility birth.","Complete a delivery: Process a delivery with a live child and facility birth.",""
"passed","Mon Feb 06 21:11:13 UTC 2023","Mon Feb 06 21:11:17 UTC 2023","3992","","Adding new language","","Adding new language","should add new translations","should add new translations",""
"passed","Mon Feb 06 20:45:02 UTC 2023","Mon Feb 06 20:45:06 UTC 2023","4405","","Test Contact Search Functionality","","Test Contact Search Functionality","search by NON empty string should display results with contains match and clears search","search by NON empty string should display results with contains match and clears search",""
"passed","Mon Feb 06 20:48:46 UTC 2023","Mon Feb 06 20:48:49 UTC 2023","3707","","RepeatForm: Repeat form with select","","RepeatForm: Repeat form with select","should display the initial form and its repeated content in the default language","should display the initial form and its repeated content in the default language",""
"passed","Mon Feb 06 20:51:50 UTC 2023","Mon Feb 06 20:51:55 UTC 2023","4575","","Login and logout tests","","Login and logout tests","should show a warning before log out","should show a warning before log out",""
"passed","Mon Feb 06 20:54:58 UTC 2023","Mon Feb 06 20:55:01 UTC 2023","3130","","Privacy policy: for an online user","","Privacy policy: for an online user","should show if the user policy changes","should show if the user policy changes",""
"passed","Mon Feb 06 21:09:51 UTC 2023","Mon Feb 06 21:09:54 UTC 2023","2278","","Tasks group landing page: for chw","","Tasks group landing page: for chw","should open task from the same group","should open task from the same group",""
"passed","Mon Feb 06 20:45:35 UTC 2023","Mon Feb 06 20:45:40 UTC 2023","5155","","db-sync: meta db replication","","db-sync: meta db replication","should replicate meta db down","should replicate meta db down",""
"passed","Mon Feb 06 20:35:12 UTC 2023","Mon Feb 06 20:35:24 UTC 2023","11718","","Targets","","Targets","should display targets from default config","should display targets from default config",""
"passed","Mon Feb 06 20:50:12 UTC 2023","Mon Feb 06 20:50:13 UTC 2023","917","","Submit Enketo form","","Submit Enketo form","cancelling form with no input does not trigger confirmation dialog","cancelling form with no input does not trigger confirmation dialog",""
"passed","Mon Feb 06 20:48:01 UTC 2023","Mon Feb 06 20:48:16 UTC 2023","14985","","Pregnancy registration","","Pregnancy registration","Should submit a new pregnancy","Should submit a new pregnancy",""
"passed","Mon Feb 06 20:48:21 UTC 2023","Mon Feb 06 20:48:22 UTC 2023","650","","Pregnancy registration","","Pregnancy registration","Should verify that the report related the pregnancy was created","Should verify that the report related the pregnancy was created",""
"passed","Mon Feb 06 20:41:36 UTC 2023","Mon Feb 06 20:41:39 UTC 2023","3368","","Add new district tests : ","","Add new district tests : ","should edit district with contact_type","should edit district with contact_type",""
"passed","Mon Feb 06 20:34:49 UTC 2023","Mon Feb 06 20:35:00 UTC 2023","11114","","Acessing the admin app","","Acessing the admin app","should show access error when accessing as an offline user","should show access error when accessing as an offline user",""
"passed","Mon Feb 06 20:45:26 UTC 2023","Mon Feb 06 20:45:28 UTC 2023","1968","","db-sync","","db-sync","should not filter deletes","should not filter deletes",""
"passed","Mon Feb 06 21:09:12 UTC 2023","Mon Feb 06 21:09:24 UTC 2023","11114","","Tasks tab breadcrumbs: for supervisor","","Tasks tab breadcrumbs: for supervisor","should display correct tasks with breadcrumbs for supervisor","should display correct tasks with breadcrumbs for supervisor",""
"passed","Mon Feb 06 20:58:10 UTC 2023","Mon Feb 06 20:58:15 UTC 2023","5448","","Test Reports Search Functionality","","Test Reports Search Functionality","search by NON empty string should display results with contains match and then clears","search by NON empty string should display results with contains match and then clears",""
"passed","Mon Feb 06 20:58:39 UTC 2023","Mon Feb 06 20:58:51 UTC 2023","12215","","Service worker cache","","Service worker cache","confirm initial list of cached resources","confirm initial list of cached resources",""
"passed","Mon Feb 06 20:53:27 UTC 2023","Mon Feb 06 20:53:28 UTC 2023","1554","","Navigation tests","","Navigation tests","should open Contacts or Peoples tab","should open Contacts or Peoples tab",""
"passed","Mon Feb 06 20:43:52 UTC 2023","Mon Feb 06 20:43:56 UTC 2023","3799","","Create new lineage structure","","Create new lineage structure","Create new area","Create new area",""
"passed","Mon Feb 06 20:40:22 UTC 2023","Mon Feb 06 20:40:33 UTC 2023","11619","","Creating custom places","","Creating custom places","the LHS add place button should read add place when multiple places exist at the current level","the LHS add place button should read add place when multiple places exist at the current level",""
"passed","Mon Feb 06 20:40:53 UTC 2023","Mon Feb 06 20:41:03 UTC 2023","9897","","Creating custom places","","Creating custom places","should show the single add person button with the correct title","should show the single add person button with the correct title",""
"passed","Mon Feb 06 21:09:01 UTC 2023","Mon Feb 06 21:09:12 UTC 2023","11228","","Tasks tab breadcrumbs: for chw","","Tasks tab breadcrumbs: for chw","should display correct tasks with breadcrumbs for chw","should display correct tasks with breadcrumbs for chw",""
"passed","Mon Feb 06 20:52:58 UTC 2023","Mon Feb 06 20:53:00 UTC 2023","2302","","bfcache: webapp","","bfcache: webapp","should redirect to login page when session is expired","should redirect to login page when session is expired",""
"passed","Mon Feb 06 20:52:46 UTC 2023","Mon Feb 06 20:52:50 UTC 2023","3808","","Token login","","Token login","should log the user in when token is correct","should log the user in when token is correct",""
"passed","Mon Feb 06 20:49:03 UTC 2023","Mon Feb 06 20:49:33 UTC 2023","29542","","Submit Default Delivery Report","","Submit Default Delivery Report","open, submit and edit (no changes) default delivery form","open, submit and edit (no changes) default delivery form",""
"passed","Mon Feb 06 20:54:46 UTC 2023","Mon Feb 06 20:54:47 UTC 2023","958","","Privacy policy: for an online user","","Privacy policy: for an online user","should not show on refresh","should not show on refresh",""
"passed","Mon Feb 06 20:45:33 UTC 2023","Mon Feb 06 20:45:35 UTC 2023","2345","","db-sync: meta db replication","","db-sync: meta db replication","should replicate meta db up","should replicate meta db up",""
"passed","Mon Feb 06 21:09:36 UTC 2023","Mon Feb 06 21:09:47 UTC 2023","11349","","Tasks group landing page: for chw","","Tasks group landing page: for chw","should have tasks","should have tasks",""
"passed","Mon Feb 06 20:42:32 UTC 2023","Mon Feb 06 20:42:37 UTC 2023","5160","","Edit contacts with the default config. ","","Edit contacts with the default config. ","should remove the primary contact from the clinic when the contact is deleted","should remove the primary contact from the clinic when the contact is deleted",""
"passed","Mon Feb 06 21:10:01 UTC 2023","Mon Feb 06 21:10:07 UTC 2023","5484","","Tasks group landing page: for chw","","Tasks group landing page: for chw","should not show page when there are no more household tasks","should not show page when there are no more household tasks",""
"passed","Mon Feb 06 20:34:39 UTC 2023","Mon Feb 06 20:34:42 UTC 2023","2419","","About page","","About page","should display partners","should display partners",""
"passed","Mon Feb 06 20:44:26 UTC 2023","Mon Feb 06 20:44:32 UTC 2023","6294","","Create new lineage structure","","Create new lineage structure","should edit the name of the Family","should edit the name of the Family",""
"passed","Mon Feb 06 20:50:27 UTC 2023","Mon Feb 06 20:50:31 UTC 2023","4061","","Submit Photo Upload form","","Submit Photo Upload form","submit and edit (with changes)","submit and edit (with changes)",""
"passed","Mon Feb 06 21:11:33 UTC 2023","Mon Feb 06 21:11:39 UTC 2023","5238","","User Test Cases ->: Invalid entries -> ","","User Test Cases ->: Invalid entries -> ","TestCase for The password is too easy to guess.","TestCase for The password is too easy to guess.",""
"passed","Mon Feb 06 20:58:20 UTC 2023","Mon Feb 06 20:58:34 UTC 2023","13967","","Reports Sidebar Filter","","Reports Sidebar Filter","should filter by date","should filter by date",""
"passed","Mon Feb 06 20:42:08 UTC 2023","Mon Feb 06 20:42:13 UTC 2023","4958","","Contact details page: Permissions to show reports and tasks","","Contact details page: Permissions to show reports and tasks","should not show tasks when permission is disabled","should not show tasks when permission is disabled",""
"passed","Mon Feb 06 20:56:46 UTC 2023","Mon Feb 06 20:56:52 UTC 2023","6171","","Reports tab breadcrumbs","","Reports tab breadcrumbs","should display reports with breadcrumbs for online user","should display reports with breadcrumbs for online user",""
"passed","Mon Feb 06 20:48:30 UTC 2023","Mon Feb 06 20:48:35 UTC 2023","4516","","RepeatForm: Repeat form with count input","","RepeatForm: Repeat form with count input","should display the initial form and its repeated content in Nepali","should display the initial form and its repeated content in Nepali",""
"passed","Mon Feb 06 20:44:00 UTC 2023","Mon Feb 06 20:44:03 UTC 2023","2820","","Create new lineage structure","","Create new lineage structure","Create new person","Create new person",""
"passed","Mon Feb 06 21:07:32 UTC 2023","Mon Feb 06 21:07:34 UTC 2023","1331","","sms-gateway api: - api returns list of pending WO messages","","sms-gateway api: - api returns list of pending WO messages","- returns list and updates state","- returns list and updates state",""
"passed","Mon Feb 06 21:10:40 UTC 2023","Mon Feb 06 21:10:48 UTC 2023","8714","","Bikram Sambat date display","","Bikram Sambat date display","enketo xpath extension function should display correct values when Nepali is not selected","enketo xpath extension function should display correct values when Nepali is not selected",""
"passed","Mon Feb 06 20:45:31 UTC 2023","Mon Feb 06 20:45:33 UTC 2023","2188","","db-sync","","db-sync","should filter ddocs","should filter ddocs",""
"passed","Mon Feb 06 20:39:35 UTC 2023","Mon Feb 06 20:40:07 UTC 2023","32206","","Create user for contacts: for an offline user","","Create user for contacts: for an offline user","does not create any new user nor does it reparent new reports when the transition fails","does not create any new user nor does it reparent new reports when the transition fails",""
"passed","Mon Feb 06 21:09:28 UTC 2023","Mon Feb 06 21:09:36 UTC 2023","7519","","Tasks group landing page","","Tasks group landing page","""before all"" hook for Tasks group landing page","""before all"" hook for Tasks group landing page",""
"passed","Mon Feb 06 21:07:58 UTC 2023","Mon Feb 06 21:08:08 UTC 2023","10485","","Message tab breadcrumbs","","Message tab breadcrumbs","should display messages with updated breadcrumbs for offline user","should display messages with updated breadcrumbs for offline user",""
"passed","Mon Feb 06 21:09:47 UTC 2023","Mon Feb 06 21:09:51 UTC 2023","4047","","Tasks group landing page: for chw","","Tasks group landing page: for chw","should display tasks group landing page after task completion","should display tasks group landing page after task completion",""
"passed","Mon Feb 06 21:07:49 UTC 2023","Mon Feb 06 21:07:58 UTC 2023","8775","","Message tab breadcrumbs","","Message tab breadcrumbs","should display messages with breadcrumbs for online user","should display messages with breadcrumbs for online user",""
"passed","Mon Feb 06 20:54:52 UTC 2023","Mon Feb 06 20:54:56 UTC 2023","4354","","Privacy policy: for an online user","","Privacy policy: for an online user","should show french policy on secondary login","should show french policy on secondary login",""
"passed","Mon Feb 06 20:44:20 UTC 2023","Mon Feb 06 20:44:26 UTC 2023","5966","","Create new lineage structure","","Create new lineage structure","should edit the name of the CHW area","should edit the name of the CHW area",""
"passed","Mon Feb 06 20:45:06 UTC 2023","Mon Feb 06 20:45:08 UTC 2023","1775","","Test Contact Search Functionality","","Test Contact Search Functionality","search should clear RHS selected contact","search should clear RHS selected contact",""
"passed","Mon Feb 06 20:39:18 UTC 2023","Mon Feb 06 20:39:35 UTC 2023","16913","","Create user for contacts: for an offline user","","Create user for contacts: for an offline user","does not create a new user or re-parent reports when the transition is disabled","does not create a new user or re-parent reports when the transition is disabled",""
"passed","Mon Feb 06 20:41:57 UTC 2023","Mon Feb 06 20:42:08 UTC 2023","11500","","Contact details page: Permissions to show reports and tasks","","Contact details page: Permissions to show reports and tasks","should not show reports when permission is disabled","should not show reports when permission is disabled",""
"passed","Mon Feb 06 21:09:58 UTC 2023","Mon Feb 06 21:10:01 UTC 2023","3642","","Tasks group landing page: for chw","","Tasks group landing page: for chw","should not display modal when clicking list task from same group","should not display modal when clicking list task from same group",""
"passed","Mon Feb 06 20:53:13 UTC 2023","Mon Feb 06 20:53:13 UTC 2023","739","","Hamburger Menu tests","","Hamburger Menu tests","should open Report bug","should open Report bug",""
"passed","Mon Feb 06 20:43:42 UTC 2023","Mon Feb 06 20:43:43 UTC 2023","961","","Mute/Unmute contacts using a specific form.","","Mute/Unmute contacts using a specific form.","Should show a popup when trying to submit a non-unmuting form against a muted contact","Should show a popup when trying to submit a non-unmuting form against a muted contact",""
"passed","Mon Feb 06 20:47:12 UTC 2023","Mon Feb 06 20:47:13 UTC 2023","685","","Contact Delivery Form","","Contact Delivery Form","The past pregnancy card should show","The past pregnancy card should show",""
"passed","Mon Feb 06 20:35:24 UTC 2023","Mon Feb 06 20:35:30 UTC 2023","6532","","Targets","","Targets","should display correct message when no target found","should display correct message when no target found",""
"passed","Mon Feb 06 20:41:13 UTC 2023","Mon Feb 06 20:41:23 UTC 2023","10129","","Creating custom places","","Creating custom places","should show custom places in their own list","should show custom places in their own list",""
"passed","Mon Feb 06 20:42:42 UTC 2023","Mon Feb 06 20:42:47 UTC 2023","5461","","Export Contacts","","Export Contacts","Should download export file","Should download export file",""
"passed","Mon Feb 06 20:57:07 UTC 2023","Mon Feb 06 20:57:14 UTC 2023","6952","","Bulk delete reports","","Bulk delete reports","should select, deselect and delete only selected reports","should select, deselect and delete only selected reports",""
"passed","Mon Feb 06 20:54:20 UTC 2023","Mon Feb 06 20:54:33 UTC 2023","12537","","Privacy policy: for an offline user","","Privacy policy: for an offline user","should show french policy on secondary login","should show french policy on secondary login",""
"broken","Mon Feb 06 21:03:35 UTC 2023","Mon Feb 06 21:05:06 UTC 2023","90913","","Service worker cache","","Service worker cache","other translation updates do not trigger a login page refresh","other translation updates do not trigger a login page refresh",""
"passed","Mon Feb 06 20:52:41 UTC 2023","Mon Feb 06 20:52:42 UTC 2023","701","","Token login","","Token login","should display an error when token login is disabled","should display an error when token login is disabled",""
"passed","Mon Feb 06 20:47:13 UTC 2023","Mon Feb 06 20:47:14 UTC 2023","1234","","Contact Delivery Form","","Contact Delivery Form","The child registered during birth should be created and should display the proper information","The child registered during birth should be created and should display the proper information",""
"passed","Mon Feb 06 21:11:58 UTC 2023","Mon Feb 06 21:12:00 UTC 2023","1588","","User Test Cases ->: Invalid entries -> ","","User Test Cases ->: Invalid entries -> ","should require place and contact for restricted user","should require place and contact for restricted user",""
"passed","Mon Feb 06 20:48:39 UTC 2023","Mon Feb 06 20:48:42 UTC 2023","3600","","RepeatForm: Repeat form with repeat button","","RepeatForm: Repeat form with repeat button","should display the initial form and its repeated content in Swahili","should display the initial form and its repeated content in Swahili",""
"passed","Mon Feb 06 20:54:35 UTC 2023","Mon Feb 06 20:54:40 UTC 2023","5270","","Privacy policy: for an offline user","","Privacy policy: for an offline user","should show if the user policy changes","should show if the user policy changes",""
