"Status","Start Time","Stop Time","Duration in ms","Parent Suite","Suite","Sub Suite","Test Class","Test Method","Name","Description"
"passed","Mon Feb 06 21:39:11 UTC 2023","Mon Feb 06 21:39:16 UTC 2023","5213","","Create new lineage structure","","Create new lineage structure","Create new health center","Create new health center",""
"passed","Mon Feb 06 21:31:45 UTC 2023","Mon Feb 06 21:32:12 UTC 2023","26794","","Create user for contacts: for an offline user","","Create user for contacts: for an offline user","creates a new user when the replace_user form is submitted while online","creates a new user when the replace_user form is submitted while online",""
"passed","Mon Feb 06 21:44:08 UTC 2023","Mon Feb 06 21:44:11 UTC 2023","3379","","RepeatForm: Repeat form with repeat button","","RepeatForm: Repeat form with repeat button","should display the initial form and its repeated content in Swahili","should display the initial form and its repeated content in Swahili",""
"passed","Mon Feb 06 21:58:59 UTC 2023","Mon Feb 06 21:59:00 UTC 2023","874","","Bikram Sambat date display","","Bikram Sambat date display","should convert contact summary dates to bikram sambat when language is Nepali","should convert contact summary dates to bikram sambat when language is Nepali",""
"passed","Mon Feb 06 21:29:56 UTC 2023","Mon Feb 06 21:29:59 UTC 2023","2794","","About page","","About page","should open the about page","should open the about page",""
"passed","Mon Feb 06 21:53:08 UTC 2023","Mon Feb 06 21:53:25 UTC 2023","16443","","Report Filter","","Report Filter","should filter by date","should filter by date",""
"passed","Mon Feb 06 21:59:42 UTC 2023","Mon Feb 06 21:59:47 UTC 2023","4532","","User Test Cases ->: Invalid entries -> ","","User Test Cases ->: Invalid entries -> ","TestCase for Passwords must match","TestCase for Passwords must match",""
"passed","Mon Feb 06 21:43:17 UTC 2023","Mon Feb 06 21:43:25 UTC 2023","8079","","Pregnancy Visit","","Pregnancy Visit","Submit and validate Pregnancy Visit form and keeps the report minified","Submit and validate Pregnancy Visit form and keeps the report minified",""
"passed","Mon Feb 06 21:59:32 UTC 2023","Mon Feb 06 21:59:37 UTC 2023","5282","","User Test Cases ->: Invalid entries -> ","","User Test Cases ->: Invalid entries -> ","TestCase for The password must be at least 8 characters long.","TestCase for The password must be at least 8 characters long.",""
"passed","Mon Feb 06 21:52:55 UTC 2023","Mon Feb 06 21:53:04 UTC 2023","8038","","Bulk delete reports","","Bulk delete reports","should select, deselect and delete only selected reports","should select, deselect and delete only selected reports",""
"passed","Mon Feb 06 21:49:02 UTC 2023","Mon Feb 06 21:49:09 UTC 2023","7240","","Guided tour","","Guided tour","run and end guided tour => should close the tour","run and end guided tour => should close the tour",""
"passed","Mon Feb 06 21:41:25 UTC 2023","Mon Feb 06 21:41:53 UTC 2023","28765","","Submit a death report","","Submit a death report","Should submit a death report","Should submit a death report",""
"passed","Mon Feb 06 21:55:43 UTC 2023","Mon Feb 06 21:55:44 UTC 2023","1002","","sms-gateway api: - gateway submits WT sms status updates","","sms-gateway api: - gateway submits WT sms status updates","- shows content","- shows content",""
"passed","Mon Feb 06 21:52:27 UTC 2023","Mon Feb 06 21:52:29 UTC 2023","1792","","manifest.json","","manifest.json","works without branding doc","works without branding doc",""
"passed","Mon Feb 06 21:55:20 UTC 2023","Mon Feb 06 21:55:21 UTC 2023","768","","Service worker cache","","Service worker cache","should load the page while offline","should load the page while offline",""
"passed","Mon Feb 06 21:44:15 UTC 2023","Mon Feb 06 21:44:19 UTC 2023","3871","","RepeatForm: Repeat form with select","","RepeatForm: Repeat form with select","should display the initial form and its repeated content in the default language","should display the initial form and its repeated content in the default language",""
"passed","Mon Feb 06 21:54:04 UTC 2023","Mon Feb 06 21:54:09 UTC 2023","5353","","Test Reports Search Functionality","","Test Reports Search Functionality","search by NON empty string should display results with contains match and then clears","search by NON empty string should display results with contains match and then clears",""
"passed","Mon Feb 06 21:47:10 UTC 2023","Mon Feb 06 21:47:12 UTC 2023","2021","","Login and logout tests","","Login and logout tests","should show locale selector on login page","should show locale selector on login page",""
"passed","Mon Feb 06 21:49:39 UTC 2023","Mon Feb 06 21:49:40 UTC 2023","1101","","Privacy policy: for an offline user","","Privacy policy: for an offline user","should not show on refresh","should not show on refresh",""
"passed","Mon Feb 06 21:57:09 UTC 2023","Mon Feb 06 21:57:16 UTC 2023","6954","","Tasks tab breadcrumbs","","Tasks tab breadcrumbs","""before all"" hook for Tasks tab breadcrumbs","""before all"" hook for Tasks tab breadcrumbs",""
"passed","Mon Feb 06 21:52:34 UTC 2023","Mon Feb 06 21:52:40 UTC 2023","5909","","Reports tab breadcrumbs","","Reports tab breadcrumbs","should display reports with breadcrumbs for online user","should display reports with breadcrumbs for online user",""
"passed","Mon Feb 06 21:39:19 UTC 2023","Mon Feb 06 21:39:23 UTC 2023","3878","","Create new lineage structure","","Create new lineage structure","Create new household","Create new household",""
"passed","Mon Feb 06 21:59:24 UTC 2023","Mon Feb 06 21:59:27 UTC 2023","2202","","User Test Cases ->","","User Test Cases ->","""before all"" hook for User Test Cases ->","""before all"" hook for User Test Cases ->",""
"passed","Mon Feb 06 21:58:54 UTC 2023","Mon Feb 06 21:58:57 UTC 2023","3133","","Bikram Sambat date display","","Bikram Sambat date display","enketo xpath extension function should display correct values when Nepali is selected","enketo xpath extension function should display correct values when Nepali is selected",""
"passed","Mon Feb 06 21:36:35 UTC 2023","Mon Feb 06 21:36:46 UTC 2023","10704","","Creating custom places","","Creating custom places","should show custom places in their own list","should show custom places in their own list",""
"passed","Mon Feb 06 21:55:21 UTC 2023","Mon Feb 06 21:55:22 UTC 2023","417","","Service worker cache","","Service worker cache","confirm fetch yields cached result","confirm fetch yields cached result",""
"passed","Mon Feb 06 21:56:57 UTC 2023","Mon Feb 06 21:57:04 UTC 2023","7761","","Task list due dates","","Task list due dates","should display correct due dates with taskDaysOverdue setting and simple translation","should display correct due dates with taskDaysOverdue setting and simple translation",""
"passed","Mon Feb 06 21:39:50 UTC 2023","Mon Feb 06 21:39:56 UTC 2023","6339","","Create new lineage structure","","Create new lineage structure","should edit the name of the Family","should edit the name of the Family",""
"passed","Mon Feb 06 21:55:11 UTC 2023","Mon Feb 06 21:55:17 UTC 2023","5817","","Service worker cache","","Service worker cache","adding new languages triggers login page refresh","adding new languages triggers login page refresh",""
"passed","Mon Feb 06 21:34:40 UTC 2023","Mon Feb 06 21:34:57 UTC 2023","16750","","Create user for contacts: for an offline user","","Create user for contacts: for an offline user","does not create a new user or re-parent reports when the transition is disabled","does not create a new user or re-parent reports when the transition is disabled",""
"passed","Mon Feb 06 22:00:09 UTC 2023","Mon Feb 06 22:00:15 UTC 2023","6242","","Bulk User Creation ->","","Bulk User Creation ->","should show an upload summary with a successful upload and a failed upload","should show an upload summary with a successful upload and a failed upload",""
"passed","Mon Feb 06 21:47:20 UTC 2023","Mon Feb 06 21:47:24 UTC 2023","3690","","Login and logout tests","","Login and logout tests","should log in using username and password fields","should log in using username and password fields",""
"passed","Mon Feb 06 21:59:47 UTC 2023","Mon Feb 06 21:59:57 UTC 2023","9966","","User Test Cases ->: Invalid entries -> ","","User Test Cases ->: Invalid entries -> ","TestCase for required","TestCase for required",""
"passed","Mon Feb 06 21:36:14 UTC 2023","Mon Feb 06 21:36:25 UTC 2023","10587","","Creating custom places","","Creating custom places","should show the single add person button with the correct title","should show the single add person button with the correct title",""
"passed","Mon Feb 06 21:38:46 UTC 2023","Mon Feb 06 21:39:05 UTC 2023","19285","","Mute/Unmute contacts using a specific form.","","Mute/Unmute contacts using a specific form.","Should unmute a contact using the defined unmute_forms (undo_death_report).","Should unmute a contact using the defined unmute_forms (undo_death_report).",""
"passed","Mon Feb 06 21:41:11 UTC 2023","Mon Feb 06 21:41:20 UTC 2023","9397","","Family form","","Family form","Submit Add Family form","Submit Add Family form",""
"passed","Mon Feb 06 21:42:11 UTC 2023","Mon Feb 06 21:42:17 UTC 2023","6448","","Edit report with attachmnet","","Edit report with attachmnet","should save edits","should save edits",""
"passed","Mon Feb 06 21:43:58 UTC 2023","Mon Feb 06 21:44:00 UTC 2023","1792","","RepeatForm","","RepeatForm","""before all"" hook for RepeatForm","""before all"" hook for RepeatForm",""
"passed","Mon Feb 06 21:48:05 UTC 2023","Mon Feb 06 21:48:06 UTC 2023","751","","Token login","","Token login","should display an error when token login is disabled","should display an error when token login is disabled",""
"passed","Mon Feb 06 21:44:04 UTC 2023","Mon Feb 06 21:44:08 UTC 2023","3576","","RepeatForm: Repeat form with count input","","RepeatForm: Repeat form with count input","should display the initial form and its repeated content in English","should display the initial form and its repeated content in English",""
"passed","Mon Feb 06 21:57:41 UTC 2023","Mon Feb 06 21:57:48 UTC 2023","7122","","Tasks group landing page","","Tasks group landing page","""before all"" hook for Tasks group landing page","""before all"" hook for Tasks group landing page",""
"passed","Mon Feb 06 21:42:39 UTC 2023","Mon Feb 06 21:42:40 UTC 2023","610","","Contact Delivery Form","","Contact Delivery Form","The past pregnancy card should show","The past pregnancy card should show",""
"passed","Mon Feb 06 21:48:50 UTC 2023","Mon Feb 06 21:48:52 UTC 2023","1962","","Navigation tests","","Navigation tests","should open tasks tab","should open tasks tab",""
"passed","Mon Feb 06 21:39:26 UTC 2023","Mon Feb 06 21:39:33 UTC 2023","6525","","Create new lineage structure","","Create new lineage structure","should edit a person with a phone number","should edit a person with a phone number",""
"passed","Mon Feb 06 21:38:04 UTC 2023","Mon Feb 06 21:38:10 UTC 2023","5675","","Export Contacts","","Export Contacts","Should download export file","Should download export file",""
"passed","Mon Feb 06 21:50:28 UTC 2023","Mon Feb 06 21:50:33 UTC 2023","4795","","Privacy policy: for an online user","","Privacy policy: for an online user","should show french policy on secondary login","should show french policy on secondary login",""
"passed","Mon Feb 06 21:37:07 UTC 2023","Mon Feb 06 21:37:19 UTC 2023","11900","","Contact details page: Permissions to show reports and tasks","","Contact details page: Permissions to show reports and tasks","should show reports and tasks when permissions are enabled","should show reports and tasks when permissions are enabled",""
"passed","Mon Feb 06 21:37:54 UTC 2023","Mon Feb 06 21:37:59 UTC 2023","4631","","Edit contacts with the default config. ","","Edit contacts with the default config. ","should remove the primary contact from the clinic when the contact is deleted","should remove the primary contact from the clinic when the contact is deleted",""
"passed","Mon Feb 06 22:00:01 UTC 2023","Mon Feb 06 22:00:04 UTC 2023","2787","","User Test Cases ->: Invalid entries -> ","","User Test Cases ->: Invalid entries -> ","should require place and contact for restricted user","should require place and contact for restricted user",""
"passed","Mon Feb 06 21:47:27 UTC 2023","Mon Feb 06 21:47:46 UTC 2023","18716","","Login and logout tests","","Login and logout tests","should display the ""session expired"" modal and redirect to login page","should display the ""session expired"" modal and redirect to login page",""
"passed","Mon Feb 06 21:47:24 UTC 2023","Mon Feb 06 21:47:27 UTC 2023","3587","","Login and logout tests","","Login and logout tests","should set correct cookies","should set correct cookies",""
"passed","Mon Feb 06 21:55:39 UTC 2023","Mon Feb 06 21:55:41 UTC 2023","1771","","sms-gateway api","","sms-gateway api","""before all"" hook for sms-gateway api","""before all"" hook for sms-gateway api",""
"passed","Mon Feb 06 21:58:57 UTC 2023","Mon Feb 06 21:58:59 UTC 2023","1641","","Bikram Sambat date display","","Bikram Sambat date display","should display report list dates converted to bikram sambat","should display report list dates converted to bikram sambat",""
"passed","Mon Feb 06 21:35:44 UTC 2023","Mon Feb 06 21:35:55 UTC 2023","11288","","Creating custom places","","Creating custom places","the LHS add place button should read add place when multiple places exist at the current level","the LHS add place button should read add place when multiple places exist at the current level",""
"passed","Mon Feb 06 21:45:46 UTC 2023","Mon Feb 06 21:45:54 UTC 2023","8066","","Submit Photo Upload form","","Submit Photo Upload form","submit and edit (no changes)","submit and edit (no changes)",""
"passed","Mon Feb 06 21:37:30 UTC 2023","Mon Feb 06 21:37:35 UTC 2023","4951","","Contact details page: Permissions to show reports and tasks","","Contact details page: Permissions to show reports and tasks","should not show tasks when permission is disabled","should not show tasks when permission is disabled",""
"passed","Mon Feb 06 21:42:55 UTC 2023","Mon Feb 06 21:43:01 UTC 2023","6118","","Pregnancy danger sign follow-up form","","Pregnancy danger sign follow-up form","should submit and edit Pregnancy danger sign follow-up form (no changes)","should submit and edit Pregnancy danger sign follow-up form (no changes)",""
"passed","Mon Feb 06 21:43:51 UTC 2023","Mon Feb 06 21:43:52 UTC 2023","931","","Pregnancy registration","","Pregnancy registration","Should verify that the counters for the active pregnancies and the new pregnancies were updated.","Should verify that the counters for the active pregnancies and the new pregnancies were updated.",""
"passed","Mon Feb 06 21:39:39 UTC 2023","Mon Feb 06 21:39:44 UTC 2023","4964","","Create new lineage structure","","Create new lineage structure","should delete the primary contact of health facility","should delete the primary contact of health facility",""
"passed","Mon Feb 06 21:59:08 UTC 2023","Mon Feb 06 21:59:13 UTC 2023","4752","","Adding new language","","Adding new language","should show in enabled language list","should show in enabled language list",""
"passed","Mon Feb 06 21:37:19 UTC 2023","Mon Feb 06 21:37:30 UTC 2023","11424","","Contact details page: Permissions to show reports and tasks","","Contact details page: Permissions to show reports and tasks","should not show reports when permission is disabled","should not show reports when permission is disabled",""
"passed","Mon Feb 06 21:49:09 UTC 2023","Mon Feb 06 21:49:16 UTC 2023","6796","","Guided tour","","Guided tour","run guided tour and change tab => should close the tour","run guided tour and change tab => should close the tour",""
"passed","Mon Feb 06 21:50:07 UTC 2023","Mon Feb 06 21:50:09 UTC 2023","1552","","Privacy policy: for an offline user","","Privacy policy: for an offline user","should show if the user changes their language","should show if the user changes their language",""
"passed","Mon Feb 06 21:43:51 UTC 2023","Mon Feb 06 21:43:51 UTC 2023","668","","Pregnancy registration","","Pregnancy registration","Should verify that the report related the pregnancy was created","Should verify that the report related the pregnancy was created",""
"failed","Mon Feb 06 21:55:44 UTC 2023","Mon Feb 06 21:55:49 UTC 2023","4078","","sms-gateway api: - api returns list of pending WO messages","","sms-gateway api: - api returns list of pending WO messages","- returns list and updates state","- returns list and updates state",""
"passed","Mon Feb 06 21:39:33 UTC 2023","Mon Feb 06 21:39:39 UTC 2023","6209","","Create new lineage structure","","Create new lineage structure","should edit a name of the health facility","should edit a name of the health facility",""
"passed","Mon Feb 06 21:47:04 UTC 2023","Mon Feb 06 21:47:05 UTC 2023","975","","Submit an undo death report","","Submit an undo death report","Should verify that the counter for the Deaths was set to 0.","Should verify that the counter for the Deaths was set to 0.",""
"passed","Mon Feb 06 21:32:39 UTC 2023","Mon Feb 06 21:33:13 UTC 2023","34220","","Create user for contacts: for an offline user","","Create user for contacts: for an offline user","creates new user from latest replace_user form data if multiple are submitted before syncing","creates new user from latest replace_user form data if multiple are submitted before syncing",""
"passed","Mon Feb 06 21:45:54 UTC 2023","Mon Feb 06 21:45:58 UTC 2023","3933","","Submit Photo Upload form","","Submit Photo Upload form","submit and edit (with changes)","submit and edit (with changes)",""
"passed","Mon Feb 06 21:42:22 UTC 2023","Mon Feb 06 21:42:39 UTC 2023","17778","","Contact Delivery Form","","Contact Delivery Form","Complete a delivery: Process a delivery with a live child and facility birth.","Complete a delivery: Process a delivery with a live child and facility birth.",""
"passed","Mon Feb 06 21:48:56 UTC 2023","Mon Feb 06 21:48:57 UTC 2023","1600","","Navigation tests","","Navigation tests","should open Analytics tab","should open Analytics tab",""
"passed","Mon Feb 06 21:33:13 UTC 2023","Mon Feb 06 21:33:51 UTC 2023","37931","","Create user for contacts: for an offline user","","Create user for contacts: for an offline user","creates new user when replace_user form is submitted for contact associated with multiple users","creates new user when replace_user form is submitted for contact associated with multiple users",""
"passed","Mon Feb 06 21:59:27 UTC 2023","Mon Feb 06 21:59:32 UTC 2023","5129","","User Test Cases ->: Creating Users ->","","User Test Cases ->: Creating Users ->","should add user with valid password","should add user with valid password",""
"passed","Mon Feb 06 21:48:37 UTC 2023","Mon Feb 06 21:48:39 UTC 2023","1742","","Hamburger Menu tests","","Hamburger Menu tests","should open About","should open About",""
"passed","Mon Feb 06 21:39:23 UTC 2023","Mon Feb 06 21:39:26 UTC 2023","3079","","Create new lineage structure","","Create new lineage structure","Create new person","Create new person",""
"passed","Mon Feb 06 21:56:28 UTC 2023","Mon Feb 06 21:56:49 UTC 2023","20983","","Task list due dates","","Task list due dates","should display correct due dates with default settings","should display correct due dates with default settings",""
"passed","Mon Feb 06 21:58:01 UTC 2023","Mon Feb 06 21:58:04 UTC 2023","2182","","Tasks group landing page: for chw","","Tasks group landing page: for chw","should open task from the same group","should open task from the same group",""
"passed","Mon Feb 06 21:48:06 UTC 2023","Mon Feb 06 21:48:07 UTC 2023","1160","","Token login","","Token login","should display an error with incorrect url","should display an error with incorrect url",""
"passed","Mon Feb 06 21:48:09 UTC 2023","Mon Feb 06 21:48:11 UTC 2023","2171","","Token login","","Token login","should display an error when token is expired","should display an error when token is expired",""
"passed","Mon Feb 06 21:59:01 UTC 2023","Mon Feb 06 21:59:04 UTC 2023","2685","","Bikram Sambat date display","","Bikram Sambat date display","SMS report shows bsAggreDate type as date field correctly","SMS report shows bsAggreDate type as date field correctly",""
"passed","Mon Feb 06 21:58:16 UTC 2023","Mon Feb 06 21:58:19 UTC 2023","2913","","Tasks group landing page: for chw","","Tasks group landing page: for chw","should not show page when submitting task for contact with no leaf type place in lineage","should not show page when submitting task for contact with no leaf type place in lineage",""
"passed","Mon Feb 06 21:40:39 UTC 2023","Mon Feb 06 21:40:52 UTC 2023","12834","","db-sync","","db-sync","should not filter allowed docs","should not filter allowed docs",""
"passed","Mon Feb 06 21:49:40 UTC 2023","Mon Feb 06 21:49:54 UTC 2023","13627","","Privacy policy: for an offline user","","Privacy policy: for an offline user","should not show on subsequent login","should not show on subsequent login",""
"passed","Mon Feb 06 21:30:48 UTC 2023","Mon Feb 06 21:30:52 UTC 2023","3898","","Targets","","Targets","should display correct message when targets are disabled","should display correct message when targets are disabled",""
"passed","Mon Feb 06 21:56:49 UTC 2023","Mon Feb 06 21:56:57 UTC 2023","7447","","Task list due dates","","Task list due dates","should display correct due dates with taskDaysOverdue setting","should display correct due dates with taskDaysOverdue setting",""
"passed","Mon Feb 06 21:36:25 UTC 2023","Mon Feb 06 21:36:35 UTC 2023","10320","","Creating custom places","","Creating custom places","should show the multi add person button with the correct title","should show the multi add person button with the correct title",""
"passed","Mon Feb 06 21:40:01 UTC 2023","Mon Feb 06 21:40:22 UTC 2023","20915","","Create Person Under Area","","Create Person Under Area","create person under area should only see children","create person under area should only see children",""
"passed","Mon Feb 06 21:49:40 UTC 2023","Mon Feb 06 21:49:40 UTC 2023","636","","Privacy policy: for an offline user","","Privacy policy: for an offline user","should display when navigating to the privacy policy page","should display when navigating to the privacy policy page",""
"passed","Mon Feb 06 21:43:30 UTC 2023","Mon Feb 06 21:43:45 UTC 2023","15775","","Pregnancy registration","","Pregnancy registration","Should submit a new pregnancy","Should submit a new pregnancy",""
"passed","Mon Feb 06 21:47:12 UTC 2023","Mon Feb 06 21:47:14 UTC 2023","2059","","Login and logout tests","","Login and logout tests","should change locale to French","should change locale to French",""
"passed","Mon Feb 06 21:58:04 UTC 2023","Mon Feb 06 21:58:08 UTC 2023","4077","","Tasks group landing page: for chw","","Tasks group landing page: for chw","should display modal when clicking on a task from another group","should display modal when clicking on a task from another group",""
"passed","Mon Feb 06 21:50:22 UTC 2023","Mon Feb 06 21:50:23 UTC 2023","1061","","Privacy policy: for an online user","","Privacy policy: for an online user","should not show on refresh","should not show on refresh",""
"passed","Mon Feb 06 21:55:17 UTC 2023","Mon Feb 06 21:55:20 UTC 2023","3365","","Service worker cache","","Service worker cache","other translation updates do not trigger a login page refresh","other translation updates do not trigger a login page refresh",""
"passed","Mon Feb 06 21:40:55 UTC 2023","Mon Feb 06 21:40:56 UTC 2023","1491","","db-sync","","db-sync","should filter locally purged docs","should filter locally purged docs",""
"passed","Mon Feb 06 21:48:07 UTC 2023","Mon Feb 06 21:48:09 UTC 2023","1451","","Token login","","Token login","should display an error when accessing with random strings","should display an error when accessing with random strings",""
"passed","Mon Feb 06 21:48:39 UTC 2023","Mon Feb 06 21:48:39 UTC 2023","194","","Hamburger Menu tests","","Hamburger Menu tests","should open User settings","should open User settings",""
