"Status","Start Time","Stop Time","Duration in ms","Parent Suite","Suite","Sub Suite","Test Class","Test Method","Name","Description"
"passed","Tue Feb 21 00:20:37 UTC 2023","Tue Feb 21 00:20:47 UTC 2023","10029","","Message tab breadcrumbs","","Message tab breadcrumbs","should display messages with updated breadcrumbs for offline user","should display messages with updated breadcrumbs for offline user",""
"passed","Tue Feb 21 00:10:40 UTC 2023","Tue Feb 21 00:10:42 UTC 2023","1920","","More Options Menu - Offline User: all permissions enabled","","More Options Menu - Offline User: all permissions enabled","Report tab - options enabled when sms report selected","Report tab - options enabled when sms report selected",""
"passed","Tue Feb 21 00:22:58 UTC 2023","Tue Feb 21 00:23:10 UTC 2023","12019","","Tasks group landing page: for supervisor","","Tasks group landing page: for supervisor","should have tasks","should have tasks",""
"passed","Mon Feb 20 23:50:28 UTC 2023","Mon Feb 20 23:50:30 UTC 2023","2479","","About page","","About page","should display partners","should display partners",""
"passed","Tue Feb 21 00:22:55 UTC 2023","Tue Feb 21 00:22:58 UTC 2023","3094","","Tasks group landing page: for chw","","Tasks group landing page: for chw","should not show page when submitting task for contact with no leaf type place in lineage","should not show page when submitting task for contact with no leaf type place in lineage",""
"passed","Mon Feb 20 23:59:57 UTC 2023","Tue Feb 21 00:00:01 UTC 2023","3886","","Create new lineage structure","","Create new lineage structure","Create new household","Create new household",""
"passed","Tue Feb 21 00:02:39 UTC 2023","Tue Feb 21 00:02:40 UTC 2023","905","","Submit a death report","","Submit a death report","Should verify that the counter for the Deaths was updated.","Should verify that the counter for the Deaths was updated.",""
"passed","Tue Feb 21 00:16:48 UTC 2023","Tue Feb 21 00:16:54 UTC 2023","5561","","Reports tab breadcrumbs","","Reports tab breadcrumbs","should display reports with breadcrumbs for online user","should display reports with breadcrumbs for online user",""
"passed","Tue Feb 21 00:23:23 UTC 2023","Tue Feb 21 00:23:24 UTC 2023","934","","MessageFormat","","MessageFormat","should work with botched translations","should work with botched translations",""
"passed","Tue Feb 21 00:04:59 UTC 2023","Tue Feb 21 00:05:03 UTC 2023","3518","","RepeatForm: Repeat form with select","","RepeatForm: Repeat form with select","should display the initial form and its repeated content in the default language","should display the initial form and its repeated content in the default language",""
"passed","Tue Feb 21 00:12:37 UTC 2023","Tue Feb 21 00:12:37 UTC 2023","348","","Online User:  - Options enabled when there are items","","Online User:  - Options enabled when there are items","- Message tab","- Message tab",""
"passed","Tue Feb 21 00:18:20 UTC 2023","Tue Feb 21 00:18:26 UTC 2023","6030","","Test Reports Search Functionality","","Test Reports Search Functionality","search by NON empty string should display results with contains match and then clears","search by NON empty string should display results with contains match and then clears",""
"passed","Mon Feb 20 23:57:17 UTC 2023","Mon Feb 20 23:57:27 UTC 2023","10202","","Creating custom places","","Creating custom places","should show custom places in their own list","should show custom places in their own list",""
"passed","Tue Feb 21 00:03:34 UTC 2023","Tue Feb 21 00:03:41 UTC 2023","7241","","Pregnancy danger sign follow-up form","","Pregnancy danger sign follow-up form","Submit and validate Pregnancy danger sign follow-up form and keeps the report minified","Submit and validate Pregnancy danger sign follow-up form and keeps the report minified",""
"passed","Tue Feb 21 00:10:35 UTC 2023","Tue Feb 21 00:10:36 UTC 2023","1612","","More Options Menu - Offline User: all permissions enabled","","More Options Menu - Offline User: all permissions enabled","- Message tab","- Message tab",""
"passed","Mon Feb 20 23:52:27 UTC 2023","Mon Feb 20 23:52:55 UTC 2023","27480","","Create user for contacts: for an offline user","","Create user for contacts: for an offline user","creates a new user when the replace_user form is submitted while online","creates a new user when the replace_user form is submitted while online",""
"passed","Tue Feb 21 00:04:52 UTC 2023","Tue Feb 21 00:04:55 UTC 2023","3566","","RepeatForm: Repeat form with repeat button","","RepeatForm: Repeat form with repeat button","should display the initial form and its repeated content in Swahili","should display the initial form and its repeated content in Swahili",""
"passed","Tue Feb 21 00:01:19 UTC 2023","Tue Feb 21 00:01:32 UTC 2023","13077","","db-sync","","db-sync","should not filter allowed docs","should not filter allowed docs",""
"passed","Tue Feb 21 00:18:53 UTC 2023","Tue Feb 21 00:19:05 UTC 2023","12376","","Service worker cache","","Service worker cache","confirm initial list of cached resources","confirm initial list of cached resources",""
"passed","Tue Feb 21 00:10:13 UTC 2023","Tue Feb 21 00:10:14 UTC 2023","1544","","Token login","","Token login","should display an error when token is expired","should display an error when token is expired",""
"passed","Tue Feb 21 00:19:42 UTC 2023","Tue Feb 21 00:19:42 UTC 2023","473","","Service worker cache","","Service worker cache","confirm fetch yields cached result","confirm fetch yields cached result",""
"passed","Tue Feb 21 00:21:58 UTC 2023","Tue Feb 21 00:22:09 UTC 2023","11036","","Tasks tab breadcrumbs: for supervisor","","Tasks tab breadcrumbs: for supervisor","should display correct tasks with breadcrumbs for supervisor","should display correct tasks with breadcrumbs for supervisor",""
"passed","Tue Feb 21 00:12:15 UTC 2023","Tue Feb 21 00:12:17 UTC 2023","2075","","- permissions disabled: - EDIT permissions disabled","","- permissions disabled: - EDIT permissions disabled"," - Contact Tab - contact selected"," - Contact Tab - contact selected",""
"passed","Tue Feb 21 00:12:18 UTC 2023","Tue Feb 21 00:12:18 UTC 2023","83","","- permissions disabled","","- permissions disabled","""after all"" hook for - permissions disabled","""after all"" hook for - permissions disabled",""
"passed","Mon Feb 20 23:50:52 UTC 2023","Mon Feb 20 23:51:01 UTC 2023","8199","","Acessing the admin app","","Acessing the admin app","should allow admins to access the page","should allow admins to access the page",""
"passed","Tue Feb 21 00:20:03 UTC 2023","Tue Feb 21 00:20:05 UTC 2023","1921","","sms-gateway api","","sms-gateway api","""before all"" hook for sms-gateway api","""before all"" hook for sms-gateway api",""
"passed","Tue Feb 21 00:16:54 UTC 2023","Tue Feb 21 00:17:04 UTC 2023","10630","","Reports tab breadcrumbs","","Reports tab breadcrumbs","should display reports with updated breadcrumbs for offline user","should display reports with updated breadcrumbs for offline user",""
"passed","Tue Feb 21 00:17:57 UTC 2023","Tue Feb 21 00:18:03 UTC 2023","5986","","Export Reports","","Export Reports","Should download export file","Should download export file",""
