"Status","Start Time","Stop Time","Duration in ms","Parent Suite","Suite","Sub Suite","Test Class","Test Method","Name","Description"
"passed","Tue Feb 21 00:22:49 UTC 2023","Tue Feb 21 00:22:55 UTC 2023","5609","","Tasks group landing page: for chw","","Tasks group landing page: for chw","should not show page when there are no more household tasks","should not show page when there are no more household tasks",""
"passed","Tue Feb 21 00:14:46 UTC 2023","Tue Feb 21 00:14:47 UTC 2023","1128","","Privacy policy: for an online user","","Privacy policy: for an online user","should not show on refresh","should not show on refresh",""
"passed","Tue Feb 21 00:17:24 UTC 2023","Tue Feb 21 00:17:38 UTC 2023","13973","","Report Filter","","Report Filter","should filter by date","should filter by date",""
"passed","Tue Feb 21 00:19:11 UTC 2023","Tue Feb 21 00:19:17 UTC 2023","6158","","Service worker cache","","Service worker cache","login page translation updates trigger login page refresh","login page translation updates trigger login page refresh",""
"passed","Mon Feb 20 23:58:01 UTC 2023","Mon Feb 20 23:58:05 UTC 2023","4254","","Contact details page: Permissions to show reports and tasks","","Contact details page: Permissions to show reports and tasks","should not show reports when permission is disabled","should not show reports when permission is disabled",""
"passed","Tue Feb 21 00:04:17 UTC 2023","Tue Feb 21 00:04:32 UTC 2023","14868","","Pregnancy registration","","Pregnancy registration","Should submit a new pregnancy","Should submit a new pregnancy",""
"passed","Mon Feb 20 23:59:21 UTC 2023","Mon Feb 20 23:59:41 UTC 2023","20576","","Mute/Unmute contacts using a specific form.","","Mute/Unmute contacts using a specific form.","Should unmute a contact using the defined unmute_forms (undo_death_report).","Should unmute a contact using the defined unmute_forms (undo_death_report).",""
"passed","Tue Feb 21 00:00:10 UTC 2023","Tue Feb 21 00:00:16 UTC 2023","6056","","Create new lineage structure","","Create new lineage structure","should edit a name of the health facility","should edit a name of the health facility",""
"passed","Tue Feb 21 00:04:43 UTC 2023","Tue Feb 21 00:04:48 UTC 2023","4498","","RepeatForm: Repeat form with count input","","RepeatForm: Repeat form with count input","should display the initial form and its repeated content in Nepali","should display the initial form and its repeated content in Nepali",""
"passed","Tue Feb 21 00:04:34 UTC 2023","Tue Feb 21 00:04:35 UTC 2023","1012","","Pregnancy registration","","Pregnancy registration","Should verify that the counters for the active pregnancies and the new pregnancies were updated.","Should verify that the counters for the active pregnancies and the new pregnancies were updated.",""
"passed","Tue Feb 21 00:04:32 UTC 2023","Tue Feb 21 00:04:33 UTC 2023","735","","Pregnancy registration","","Pregnancy registration","Should verify that all tasks related with the high risk pregnancy were created","Should verify that all tasks related with the high risk pregnancy were created",""
"passed","Tue Feb 21 00:04:41 UTC 2023","Tue Feb 21 00:04:43 UTC 2023","1703","","RepeatForm","","RepeatForm","""before all"" hook for RepeatForm","""before all"" hook for RepeatForm",""
"passed","Mon Feb 20 23:58:05 UTC 2023","Mon Feb 20 23:58:10 UTC 2023","5241","","Contact details page: Permissions to show reports and tasks","","Contact details page: Permissions to show reports and tasks","should not show tasks when permission is disabled","should not show tasks when permission is disabled",""
"passed","Tue Feb 21 00:13:22 UTC 2023","Tue Feb 21 00:13:23 UTC 2023","1388","","Navigation tests","","Navigation tests","should open Analytics tab","should open Analytics tab",""
"passed","Tue Feb 21 00:14:04 UTC 2023","Tue Feb 21 00:14:05 UTC 2023","740","","Privacy policy: for an offline user","","Privacy policy: for an offline user","should not show on refresh","should not show on refresh",""
"passed","Tue Feb 21 00:12:04 UTC 2023","Tue Feb 21 00:12:08 UTC 2023","4100","","- permissions disabled","","- permissions disabled","""before all"" hook for - permissions disabled","""before all"" hook for - permissions disabled",""
"passed","Tue Feb 21 00:02:46 UTC 2023","Tue Feb 21 00:02:57 UTC 2023","10095","","Edit report with attachmnet","","Edit report with attachmnet","should remove attachment when saving","should remove attachment when saving",""
"passed","Tue Feb 21 00:23:56 UTC 2023","Tue Feb 21 00:24:02 UTC 2023","5795","","Adding new language","","Adding new language","should show in enabled language list","should show in enabled language list",""
"passed","Tue Feb 21 00:03:41 UTC 2023","Tue Feb 21 00:03:47 UTC 2023","6154","","Pregnancy danger sign follow-up form","","Pregnancy danger sign follow-up form","should submit and edit Pregnancy danger sign follow-up form (no changes)","should submit and edit Pregnancy danger sign follow-up form (no changes)",""
"passed","Tue Feb 21 00:01:33 UTC 2023","Tue Feb 21 00:01:35 UTC 2023","1836","","db-sync","","db-sync","should filter resources, service-worker, forms, translations, branding, partners docs","should filter resources, service-worker, forms, translations, branding, partners docs",""
"passed","Tue Feb 21 00:12:32 UTC 2023","Tue Feb 21 00:12:33 UTC 2023","982","","Online User:  - Contact tab - user has no contact ","","Online User:  - Contact tab - user has no contact "," - no contact selected"," - no contact selected",""
"passed","Tue Feb 21 00:09:22 UTC 2023","Tue Feb 21 00:09:27 UTC 2023","4929","","Login and logout tests","","Login and logout tests","should set correct cookies","should set correct cookies",""
"passed","Tue Feb 21 00:14:38 UTC 2023","Tue Feb 21 00:14:46 UTC 2023","7481","","Privacy policy: for an online user","","Privacy policy: for an online user","should show the correct privacy policy on login","should show the correct privacy policy on login",""
"passed","Tue Feb 21 00:11:34 UTC 2023","Tue Feb 21 00:11:57 UTC 2023","22902","","- EDIT permissions disabled","","- EDIT permissions disabled"," - Contact Tab - contact selected"," - Contact Tab - contact selected",""
"passed","Tue Feb 21 00:01:32 UTC 2023","Tue Feb 21 00:01:33 UTC 2023","1507","","db-sync","","db-sync","should not filter deletes","should not filter deletes",""
"passed","Tue Feb 21 00:15:25 UTC 2023","Tue Feb 21 00:16:31 UTC 2023","66093","","purge","","purge","purging runs on sync and startup","purging runs on sync and startup",""
"passed","Tue Feb 21 00:12:24 UTC 2023","Tue Feb 21 00:12:29 UTC 2023","4866","","Online User: Options disabled when no items - messages, contacts, people","","Online User: Options disabled when no items - messages, contacts, people","- Message tab","- Message tab",""
"passed","Tue Feb 21 00:14:30 UTC 2023","Tue Feb 21 00:14:32 UTC 2023","1554","","Privacy policy: for an offline user","","Privacy policy: for an offline user","should show if the user changes their language","should show if the user changes their language",""
"passed","Tue Feb 21 00:13:00 UTC 2023","Tue Feb 21 00:13:03 UTC 2023","2958","","Hamburger Menu tests","","Hamburger Menu tests","should open Configuration wizard","should open Configuration wizard",""
"passed","Tue Feb 21 00:24:10 UTC 2023","Tue Feb 21 00:24:21 UTC 2023","11049","","Adding new language","","Adding new language","should support deleting translations","should support deleting translations",""
"passed","Tue Feb 21 00:13:21 UTC 2023","Tue Feb 21 00:13:22 UTC 2023","1503","","Navigation tests","","Navigation tests","should open Contacts or Peoples tab","should open Contacts or Peoples tab",""
"passed","Tue Feb 21 00:22:23 UTC 2023","Tue Feb 21 00:22:35 UTC 2023","11434","","Tasks group landing page: for chw","","Tasks group landing page: for chw","should have tasks","should have tasks",""
"passed","Mon Feb 20 23:57:33 UTC 2023","Mon Feb 20 23:57:37 UTC 2023","4559","","Add new district tests : ","","Add new district tests : ","should add new district with a new person","should add new district with a new person",""
"passed","Tue Feb 21 00:03:47 UTC 2023","Tue Feb 21 00:03:58 UTC 2023","11015","","Pregnancy danger sign follow-up form","","Pregnancy danger sign follow-up form","should submit and edit Pregnancy danger sign follow-up form with changes","should submit and edit Pregnancy danger sign follow-up form with changes",""
"passed","Tue Feb 21 00:12:45 UTC 2023","Tue Feb 21 00:12:49 UTC 2023","4228","","bfcache: login page","","bfcache: login page","should redirect to the app page when session is valid","should redirect to the app page when session is valid",""
"passed","Tue Feb 21 00:24:47 UTC 2023","Tue Feb 21 00:24:55 UTC 2023","8090","","User Test Cases ->: Invalid entries -> ","","User Test Cases ->: Invalid entries -> ","TestCase for required","TestCase for required",""
"passed","Tue Feb 21 00:07:57 UTC 2023","Tue Feb 21 00:08:01 UTC 2023","4250","","Submit Z-Score form","","Submit Z-Score form","saves z-score values","saves z-score values",""
"broken","Tue Feb 21 00:05:49 UTC 2023","Tue Feb 21 00:07:12 UTC 2023","83355","","Submit Default Delivery Report","","Submit Default Delivery Report","open, submit and edit default delivery form","open, submit and edit default delivery form",""
"passed","Tue Feb 21 00:12:14 UTC 2023","Tue Feb 21 00:12:15 UTC 2023","1120","","- permissions disabled: - DELETE permissions disabled","","- permissions disabled: - DELETE permissions disabled","- Report Tab - option disabled when report selected","- Report Tab - option disabled when report selected",""
"passed","Tue Feb 21 00:03:26 UTC 2023","Tue Feb 21 00:03:28 UTC 2023","1673","","Contact Delivery Form","","Contact Delivery Form","The targets page should be updated","The targets page should be updated",""
"passed","Tue Feb 21 00:09:03 UTC 2023","Tue Feb 21 00:09:06 UTC 2023","3024","","Login and logout tests","","Login and logout tests","should show locale selector on login page","should show locale selector on login page",""
"passed","Tue Feb 21 00:12:08 UTC 2023","Tue Feb 21 00:12:10 UTC 2023","2617","","- permissions disabled: - export permissions disabled","","- permissions disabled: - export permissions disabled"," - Contact Tab - contact selected"," - Contact Tab - contact selected",""
"passed","Tue Feb 21 00:20:08 UTC 2023","Tue Feb 21 00:20:09 UTC 2023","1153","","sms-gateway api: - gateway submits WT sms status updates","","sms-gateway api: - gateway submits WT sms status updates","- shows content","- shows content",""
"passed","Tue Feb 21 00:17:11 UTC 2023","Tue Feb 21 00:17:18 UTC 2023","7738","","Bulk delete reports","","Bulk delete reports","should select, deselect and delete only selected reports","should select, deselect and delete only selected reports",""
"passed","Tue Feb 21 00:13:17 UTC 2023","Tue Feb 21 00:13:19 UTC 2023","1796","","Navigation tests","","Navigation tests","should open tasks tab","should open tasks tab",""
"passed","Tue Feb 21 00:12:10 UTC 2023","Tue Feb 21 00:12:12 UTC 2023","1237","","- permissions disabled: - export permissions disabled","","- permissions disabled: - export permissions disabled","- Report Tab - report selected","- Report Tab - report selected",""
"passed","Mon Feb 20 23:50:36 UTC 2023","Mon Feb 20 23:50:40 UTC 2023","3966","","Acessing the admin app","","Acessing the admin app","should redirect to login when not logged in","should redirect to login when not logged in",""
"passed","Mon Feb 20 23:57:08 UTC 2023","Mon Feb 20 23:57:17 UTC 2023","9186","","Creating custom places","","Creating custom places","should show the multi add person button with the correct title","should show the multi add person button with the correct title",""
"passed","Tue Feb 21 00:09:12 UTC 2023","Tue Feb 21 00:09:17 UTC 2023","5472","","Login and logout tests","","Login and logout tests","should show a warning before log out","should show a warning before log out",""
"passed","Tue Feb 21 00:01:42 UTC 2023","Tue Feb 21 00:01:47 UTC 2023","5332","","db-sync: meta db replication","","db-sync: meta db replication","should replicate meta db down","should replicate meta db down",""
"passed","Tue Feb 21 00:11:28 UTC 2023","Tue Feb 21 00:11:29 UTC 2023","850","","- DELETE permissions disabled","","- DELETE permissions disabled","- Report tab - delete menu not displayed when xml report selected","- Report tab - delete menu not displayed when xml report selected",""
"passed","Mon Feb 20 23:51:37 UTC 2023","Mon Feb 20 23:51:50 UTC 2023","13616","","Create user for contacts","","Create user for contacts","does not create a new user when the replace_user form is submitted for online user","does not create a new user when the replace_user form is submitted for online user",""
"passed","Tue Feb 21 00:07:51 UTC 2023","Tue Feb 21 00:07:57 UTC 2023","5798","","Submit Z-Score form","","Submit Z-Score form","Autofills zscore fields with correct values","Autofills zscore fields with correct values",""
"passed","Mon Feb 20 23:56:28 UTC 2023","Mon Feb 20 23:56:39 UTC 2023","10940","","Creating custom places","","Creating custom places","the LHS add place button should read add place when multiple places exist at the current level","the LHS add place button should read add place when multiple places exist at the current level",""
"passed","Tue Feb 21 00:10:23 UTC 2023","Tue Feb 21 00:10:35 UTC 2023","11378","","More Options Menu - Offline User","","More Options Menu - Offline User","""before all"" hook for More Options Menu - Offline User","""before all"" hook for More Options Menu - Offline User",""
"passed","Tue Feb 21 00:20:05 UTC 2023","Tue Feb 21 00:20:08 UTC 2023","2733","","sms-gateway api: - gateway submits new WT sms messages","","sms-gateway api: - gateway submits new WT sms messages","shows content","shows content",""
"passed","Tue Feb 21 00:25:21 UTC 2023","Tue Feb 21 00:25:29 UTC 2023","8319","","Create user meta db : ","","Create user meta db : ","should allow a new user to read/write from meta db","should allow a new user to read/write from meta db",""
"passed","Tue Feb 21 00:24:29 UTC 2023","Tue Feb 21 00:24:34 UTC 2023","5120","","User Test Cases ->: Creating Users ->","","User Test Cases ->: Creating Users ->","should add user with valid password","should add user with valid password",""
"passed","Tue Feb 21 00:14:05 UTC 2023","Tue Feb 21 00:14:18 UTC 2023","12271","","Privacy policy: for an offline user","","Privacy policy: for an offline user","should not show on subsequent login","should not show on subsequent login",""
"passed","Tue Feb 21 00:20:09 UTC 2023","Tue Feb 21 00:20:10 UTC 2023","921","","sms-gateway api: - api returns list of pending WO messages","","sms-gateway api: - api returns list of pending WO messages","- returns list and updates state","- returns list and updates state",""
"passed","Tue Feb 21 00:20:54 UTC 2023","Tue Feb 21 00:21:15 UTC 2023","21672","","Task list due dates","","Task list due dates","should display correct due dates with default settings","should display correct due dates with default settings",""
"passed","Tue Feb 21 00:22:39 UTC 2023","Tue Feb 21 00:22:41 UTC 2023","2276","","Tasks group landing page: for chw","","Tasks group landing page: for chw","should open task from the same group","should open task from the same group",""
"passed","Tue Feb 21 00:14:18 UTC 2023","Tue Feb 21 00:14:30 UTC 2023","12582","","Privacy policy: for an offline user","","Privacy policy: for an offline user","should show french policy on secondary login","should show french policy on secondary login",""
"passed","Tue Feb 21 00:19:48 UTC 2023","Tue Feb 21 00:19:57 UTC 2023","8784","","Export Messages","","Export Messages","Should download export file","Should download export file",""
"passed","Tue Feb 21 00:17:44 UTC 2023","Tue Feb 21 00:17:50 UTC 2023","6160","","Delete Reports","","Delete Reports","Should delete report","Should delete report",""
"passed","Tue Feb 21 00:14:47 UTC 2023","Tue Feb 21 00:14:52 UTC 2023","4747","","Privacy policy: for an online user","","Privacy policy: for an online user","should not show on subsequent login","should not show on subsequent login",""
"passed","Mon Feb 20 23:56:58 UTC 2023","Mon Feb 20 23:57:08 UTC 2023","9669","","Creating custom places","","Creating custom places","should show the single add person button with the correct title","should show the single add person button with the correct title",""
"passed","Tue Feb 21 00:13:05 UTC 2023","Tue Feb 21 00:13:06 UTC 2023","737","","Hamburger Menu tests","","Hamburger Menu tests","should open Report bug","should open Report bug",""
"passed","Mon Feb 20 23:51:27 UTC 2023","Mon Feb 20 23:51:31 UTC 2023","4315","","Targets","","Targets","should display correct message when targets are disabled","should display correct message when targets are disabled",""
"passed","Tue Feb 21 00:10:10 UTC 2023","Tue Feb 21 00:10:10 UTC 2023","688","","Token login","","Token login","should display an error when token login is disabled","should display an error when token login is disabled",""
"passed","Tue Feb 21 00:04:48 UTC 2023","Tue Feb 21 00:04:52 UTC 2023","3937","","RepeatForm: Repeat form with count input","","RepeatForm: Repeat form with count input","should display the initial form and its repeated content in English","should display the initial form and its repeated content in English",""
"passed","Mon Feb 20 23:50:40 UTC 2023","Mon Feb 20 23:50:52 UTC 2023","12442","","Acessing the admin app","","Acessing the admin app","should show access error when accessing as an offline user","should show access error when accessing as an offline user",""
"passed","Tue Feb 21 00:13:19 UTC 2023","Tue Feb 21 00:13:21 UTC 2023","1526","","Navigation tests","","Navigation tests","should open Reports or History tab","should open Reports or History tab",""
"passed","Tue Feb 21 00:13:48 UTC 2023","Tue Feb 21 00:14:04 UTC 2023","16930","","Privacy policy: for an offline user","","Privacy policy: for an offline user","should show the correct privacy policy on login","should show the correct privacy policy on login",""
"passed","Tue Feb 21 00:23:20 UTC 2023","Tue Feb 21 00:23:23 UTC 2023","3435","","MessageFormat","","MessageFormat","should display plurals correctly","should display plurals correctly",""
"passed","Mon Feb 20 23:50:25 UTC 2023","Mon Feb 20 23:50:28 UTC 2023","2629","","About page","","About page","should open the about page","should open the about page",""
"passed","Mon Feb 20 23:58:30 UTC 2023","Mon Feb 20 23:58:34 UTC 2023","4614","","Edit contacts with the default config. ","","Edit contacts with the default config. ","should remove the primary contact from the clinic when the contact is deleted","should remove the primary contact from the clinic when the contact is deleted",""
"passed","Tue Feb 21 00:00:04 UTC 2023","Tue Feb 21 00:00:10 UTC 2023","6251","","Create new lineage structure","","Create new lineage structure","should edit a person with a phone number","should edit a person with a phone number",""
"passed","Tue Feb 21 00:10:14 UTC 2023","Tue Feb 21 00:10:18 UTC 2023","3598","","Token login","","Token login","should log the user in when token is correct","should log the user in when token is correct",""
"passed","Tue Feb 21 00:21:46 UTC 2023","Tue Feb 21 00:21:58 UTC 2023","11745","","Tasks tab breadcrumbs: for chw","","Tasks tab breadcrumbs: for chw","should display correct tasks with breadcrumbs for chw","should display correct tasks with breadcrumbs for chw",""
"passed","Tue Feb 21 00:18:09 UTC 2023","Tue Feb 21 00:18:14 UTC 2023","5181","","generating short codes","","generating short codes","create case ID","create case ID",""
"passed","Mon Feb 20 23:53:56 UTC 2023","Mon Feb 20 23:54:33 UTC 2023","36315","","Create user for contacts: for an offline user","","Create user for contacts: for an offline user","creates new user when replace_user form is submitted for contact associated with multiple users","creates new user when replace_user form is submitted for contact associated with multiple users",""
"passed","Tue Feb 21 00:11:57 UTC 2023","Tue Feb 21 00:11:58 UTC 2023","374","","- EDIT permissions disabled","","- EDIT permissions disabled","- Report tab - menu not displayed when xml report selected","- Report tab - menu not displayed when xml report selected",""
"passed","Tue Feb 21 00:12:12 UTC 2023","Tue Feb 21 00:12:12 UTC 2023","463","","- permissions disabled: - export permissions disabled","","- permissions disabled: - export permissions disabled","- Message tab","- Message tab",""
"passed","Tue Feb 21 00:20:16 UTC 2023","Tue Feb 21 00:20:22 UTC 2023","5887","","Link SMS to patient without passing id","","Link SMS to patient without passing id","Send SMS without patient_id and report created under person","Send SMS without patient_id and report created under person",""
"passed","Tue Feb 21 00:24:43 UTC 2023","Tue Feb 21 00:24:47 UTC 2023","3777","","User Test Cases ->: Invalid entries -> ","","User Test Cases ->: Invalid entries -> ","TestCase for Passwords must match","TestCase for Passwords must match",""
"passed","Tue Feb 21 00:20:28 UTC 2023","Tue Feb 21 00:20:37 UTC 2023","8665","","Message tab breadcrumbs","","Message tab breadcrumbs","should display messages with breadcrumbs for online user","should display messages with breadcrumbs for online user",""
"passed","Mon Feb 20 23:59:41 UTC 2023","Mon Feb 20 23:59:42 UTC 2023","953","","Mute/Unmute contacts using a specific form.","","Mute/Unmute contacts using a specific form.","Should show a popup when trying to submit a non-unmuting form against a muted contact","Should show a popup when trying to submit a non-unmuting form against a muted contact",""
"passed","Tue Feb 21 00:00:27 UTC 2023","Tue Feb 21 00:00:33 UTC 2023","5849","","Create new lineage structure","","Create new lineage structure","should edit the name of the Family","should edit the name of the Family",""
"passed","Tue Feb 21 00:07:18 UTC 2023","Tue Feb 21 00:07:24 UTC 2023","6176","","Submit Enketo form","","Submit Enketo form","submits on reports tab","submits on reports tab",""
"passed","Tue Feb 21 00:10:05 UTC 2023","Tue Feb 21 00:10:10 UTC 2023","4519","","Token login","","Token login","should redirect the user to the app if already logged in","should redirect the user to the app if already logged in",""
"passed","Tue Feb 21 00:19:05 UTC 2023","Tue Feb 21 00:19:11 UTC 2023","5608","","Service worker cache","","Service worker cache","branding updates trigger login page refresh","branding updates trigger login page refresh",""
"passed","Tue Feb 21 00:07:33 UTC 2023","Tue Feb 21 00:07:41 UTC 2023","7705","","Submit Photo Upload form","","Submit Photo Upload form","submit and edit (no changes)","submit and edit (no changes)",""
"passed","Tue Feb 21 00:08:06 UTC 2023","Tue Feb 21 00:08:55 UTC 2023","48298","","Submit an undo death report","","Submit an undo death report","Should submit an undo death report","Should submit an undo death report",""
"passed","Tue Feb 21 00:21:15 UTC 2023","Tue Feb 21 00:21:23 UTC 2023","7549","","Task list due dates","","Task list due dates","should display correct due dates with taskDaysOverdue setting","should display correct due dates with taskDaysOverdue setting",""
"passed","Tue Feb 21 00:24:26 UTC 2023","Tue Feb 21 00:24:29 UTC 2023","2821","","User Test Cases ->","","User Test Cases ->","""before all"" hook for User Test Cases ->","""before all"" hook for User Test Cases ->",""
"passed","Mon Feb 20 23:52:55 UTC 2023","Mon Feb 20 23:53:22 UTC 2023","27768","","Create user for contacts: for an offline user","","Create user for contacts: for an offline user","does not assign new person as primary contact of parent place if original person was not primary","does not assign new person as primary contact of parent place if original person was not primary",""
"passed","Tue Feb 21 00:13:06 UTC 2023","Tue Feb 21 00:13:08 UTC 2023","2416","","Hamburger Menu tests","","Hamburger Menu tests","should open Configuration app","should open Configuration app",""
"passed","Tue Feb 21 00:00:01 UTC 2023","Tue Feb 21 00:00:04 UTC 2023","3251","","Create new lineage structure","","Create new lineage structure","Create new person","Create new person",""
"passed","Tue Feb 21 00:25:08 UTC 2023","Tue Feb 21 00:25:15 UTC 2023","6867","","Bulk User Creation ->","","Bulk User Creation ->","should show an upload summary with a successful upload and a failed upload","should show an upload summary with a successful upload and a failed upload",""
"passed","Tue Feb 21 00:23:31 UTC 2023","Tue Feb 21 00:23:40 UTC 2023","9752","","Bikram Sambat date display","","Bikram Sambat date display","enketo xpath extension function should display correct values when Nepali is not selected","enketo xpath extension function should display correct values when Nepali is not selected",""
"passed","Tue Feb 21 00:19:17 UTC 2023","Tue Feb 21 00:19:37 UTC 2023","19374","","Service worker cache","","Service worker cache","adding new languages triggers login page refresh","adding new languages triggers login page refresh",""
"passed","Tue Feb 21 00:23:44 UTC 2023","Tue Feb 21 00:23:46 UTC 2023","1860","","Bikram Sambat date display","","Bikram Sambat date display","should display report list dates converted to bikram sambat","should display report list dates converted to bikram sambat",""
"passed","Tue Feb 21 00:22:35 UTC 2023","Tue Feb 21 00:22:39 UTC 2023","4378","","Tasks group landing page: for chw","","Tasks group landing page: for chw","should display tasks group landing page after task completion","should display tasks group landing page after task completion",""
"passed","Tue Feb 21 00:12:17 UTC 2023","Tue Feb 21 00:12:18 UTC 2023","1076","","- permissions disabled: - EDIT permissions disabled","","- permissions disabled: - EDIT permissions disabled","- Report Tab - option disabled when report selected","- Report Tab - option disabled when report selected",""
