"Status","Start Time","Stop Time","Duration in ms","Parent Suite","Suite","Sub Suite","Test Class","Test Method","Name","Description"
"passed","Fri Apr 07 14:59:07 UTC 2023","Fri Apr 07 14:59:17 UTC 2023","10051","","Creating custom places","","Creating custom places","should show the multi add person button with the correct title","should show the multi add person button with the correct title",""
"passed","Fri Apr 07 15:07:14 UTC 2023","Fri Apr 07 15:07:19 UTC 2023","4557","","RepeatForm: Repeat form with count input","","RepeatForm: Repeat form with count input","should display the initial form and its repeated content in Nepali","should display the initial form and its repeated content in Nepali",""
"passed","Fri Apr 07 15:04:57 UTC 2023","Fri Apr 07 15:05:03 UTC 2023","6475","","Edit report with attachmnet","","Edit report with attachmnet","should save edits","should save edits",""
"passed","Fri Apr 07 15:23:38 UTC 2023","Fri Apr 07 15:23:46 UTC 2023","8636","","Tasks group landing page","","Tasks group landing page","""before all"" hook for Tasks group landing page","""before all"" hook for Tasks group landing page",""
"passed","Fri Apr 07 15:34:37 UTC 2023","Fri Apr 07 15:34:42 UTC 2023","4241","","User Test Cases ->: Invalid entries -> ","","User Test Cases ->: Invalid entries -> ","TestCase for The password must be at least 8 characters long.","TestCase for The password must be at least 8 characters long.",""
"passed","Fri Apr 07 15:11:10 UTC 2023","Fri Apr 07 15:11:15 UTC 2023","4619","","Token login","","Token login","should redirect the user to the app if already logged in","should redirect the user to the app if already logged in",""
"passed","Fri Apr 07 15:23:57 UTC 2023","Fri Apr 07 15:24:02 UTC 2023","4174","","Tasks group landing page: for chw","","Tasks group landing page: for chw","should display tasks group landing page after task completion","should display tasks group landing page after task completion",""
"passed","Fri Apr 07 15:03:41 UTC 2023","Fri Apr 07 15:03:43 UTC 2023","2159","","db-sync: meta db replication","","db-sync: meta db replication","should replicate meta db up","should replicate meta db up",""
"passed","Fri Apr 07 15:35:10 UTC 2023","Fri Apr 07 15:35:18 UTC 2023","7566","","Bulk User Creation ->","","Bulk User Creation ->","should show an upload summary with a successful upload and a failed upload","should show an upload summary with a successful upload and a failed upload",""
"passed","Fri Apr 07 15:13:15 UTC 2023","Fri Apr 07 15:13:17 UTC 2023","2574","","- permissions disabled: - export permissions disabled","","- permissions disabled: - export permissions disabled"," - Contact Tab - contact selected"," - Contact Tab - contact selected",""
"passed","Fri Apr 07 15:27:38 UTC 2023","Fri Apr 07 15:28:23 UTC 2023","44507","","Create user for contacts: user replace: for an offline user","","Create user for contacts: user replace: for an offline user","creates a new user and re-parents reports when the replace_user form is submitted","creates a new user and re-parents reports when the replace_user form is submitted",""
"passed","Fri Apr 07 15:04:09 UTC 2023","Fri Apr 07 15:04:39 UTC 2023","29691","","Submit a death report","","Submit a death report","Should submit a death report","Should submit a death report",""
"passed","Fri Apr 07 15:14:04 UTC 2023","Fri Apr 07 15:14:06 UTC 2023","2354","","bfcache: webapp","","bfcache: webapp","should redirect to login page when session is expired","should redirect to login page when session is expired",""
"passed","Fri Apr 07 15:10:15 UTC 2023","Fri Apr 07 15:10:18 UTC 2023","2934","","Login and logout tests","","Login and logout tests","should change locale to Spanish","should change locale to Spanish",""
"passed","Fri Apr 07 15:13:17 UTC 2023","Fri Apr 07 15:13:19 UTC 2023","1278","","- permissions disabled: - export permissions disabled","","- permissions disabled: - export permissions disabled","- Report Tab - report selected","- Report Tab - report selected",""
"passed","Fri Apr 07 15:07:27 UTC 2023","Fri Apr 07 15:07:31 UTC 2023","3579","","RepeatForm: Repeat form with repeat button","","RepeatForm: Repeat form with repeat button","should display the initial form and its repeated content in English","should display the initial form and its repeated content in English",""
"skipped","Fri Apr 07 15:07:50 UTC 2023","Fri Apr 07 15:07:50 UTC 2023","0","","Submit Default Delivery Report","","Submit Default Delivery Report","open, submit and edit (no changes) default delivery form","open, submit and edit (no changes) default delivery form",""
"passed","Fri Apr 07 15:15:49 UTC 2023","Fri Apr 07 15:15:54 UTC 2023","4971","","Privacy policy: for an offline user","","Privacy policy: for an offline user","should show if the user policy changes","should show if the user policy changes",""
"passed","Fri Apr 07 15:14:16 UTC 2023","Fri Apr 07 15:14:19 UTC 2023","3080","","Hamburger Menu tests","","Hamburger Menu tests","should open Configuration wizard","should open Configuration wizard",""
"passed","Fri Apr 07 15:13:19 UTC 2023","Fri Apr 07 15:13:19 UTC 2023","477","","- permissions disabled: - export permissions disabled","","- permissions disabled: - export permissions disabled","- Message tab","- Message tab",""
"passed","Fri Apr 07 15:34:11 UTC 2023","Fri Apr 07 15:34:15 UTC 2023","4195","","Adding new language","","Adding new language","should add new translations","should add new translations",""
"passed","Fri Apr 07 15:21:53 UTC 2023","Fri Apr 07 15:22:02 UTC 2023","8591","","Message tab breadcrumbs","","Message tab breadcrumbs","should display messages with breadcrumbs for online user","should display messages with breadcrumbs for online user",""
"passed","Fri Apr 07 15:24:12 UTC 2023","Fri Apr 07 15:24:17 UTC 2023","5589","","Tasks group landing page: for chw","","Tasks group landing page: for chw","should not show page when there are no more household tasks","should not show page when there are no more household tasks",""
"passed","Fri Apr 07 15:11:18 UTC 2023","Fri Apr 07 15:11:20 UTC 2023","2165","","Token login","","Token login","should display an error when token is expired","should display an error when token is expired",""
"passed","Fri Apr 07 15:06:49 UTC 2023","Fri Apr 07 15:07:04 UTC 2023","14779","","Pregnancy registration","","Pregnancy registration","Should submit a new pregnancy","Should submit a new pregnancy",""
"passed","Fri Apr 07 15:08:29 UTC 2023","Fri Apr 07 15:08:35 UTC 2023","5810","","Submit Z-Score form","","Submit Z-Score form","Autofills zscore fields with correct values","Autofills zscore fields with correct values",""
"passed","Fri Apr 07 15:05:56 UTC 2023","Fri Apr 07 15:05:57 UTC 2023","1292","","Contact Delivery Form","","Contact Delivery Form","The child registered during birth should be created and should display the proper information","The child registered during birth should be created and should display the proper information",""
"passed","Fri Apr 07 15:14:52 UTC 2023","Fri Apr 07 15:14:59 UTC 2023","6447","","Guided tour","","Guided tour","run guided tour and change tab => should close the tour","run guided tour and change tab => should close the tour",""
"passed","Fri Apr 07 15:08:04 UTC 2023","Fri Apr 07 15:08:05 UTC 2023","895","","Submit Enketo form","","Submit Enketo form","cancelling form with no input does not trigger confirmation dialog","cancelling form with no input does not trigger confirmation dialog",""
"passed","Fri Apr 07 15:22:39 UTC 2023","Fri Apr 07 15:22:46 UTC 2023","7410","","Task list due dates","","Task list due dates","should display correct due dates with taskDaysOverdue setting","should display correct due dates with taskDaysOverdue setting",""
"passed","Fri Apr 07 15:03:38 UTC 2023","Fri Apr 07 15:03:41 UTC 2023","2611","","db-sync","","db-sync","should filter ddocs","should filter ddocs",""
"passed","Fri Apr 07 15:23:10 UTC 2023","Fri Apr 07 15:23:21 UTC 2023","11223","","Tasks tab breadcrumbs: for chw","","Tasks tab breadcrumbs: for chw","should display correct tasks with breadcrumbs for chw","should display correct tasks with breadcrumbs for chw",""
"passed","Fri Apr 07 15:10:23 UTC 2023","Fri Apr 07 15:10:28 UTC 2023","4673","","Login and logout tests","","Login and logout tests","should log in using username and password fields","should log in using username and password fields",""
"passed","Fri Apr 07 15:11:16 UTC 2023","Fri Apr 07 15:11:18 UTC 2023","1762","","Token login","","Token login","should display an error when accessing with random strings","should display an error when accessing with random strings",""
"passed","Fri Apr 07 14:59:33 UTC 2023","Fri Apr 07 14:59:38 UTC 2023","4991","","Add new district tests : ","","Add new district tests : ","should add new district with a new person","should add new district with a new person",""
"passed","Fri Apr 07 15:01:52 UTC 2023","Fri Apr 07 15:01:58 UTC 2023","5361","","Create new lineage structure","","Create new lineage structure","Create new health center","Create new health center",""
"passed","Fri Apr 07 15:16:18 UTC 2023","Fri Apr 07 15:16:36 UTC 2023","18055","","Privacy policy: conflicts","","Privacy policy: conflicts","should not fail due to document conflict for new offline user","should not fail due to document conflict for new offline user",""
"passed","Fri Apr 07 15:13:11 UTC 2023","Fri Apr 07 15:13:15 UTC 2023","4134","","- permissions disabled","","- permissions disabled","""before all"" hook for - permissions disabled","""before all"" hook for - permissions disabled",""
"passed","Fri Apr 07 15:34:50 UTC 2023","Fri Apr 07 15:34:58 UTC 2023","8428","","User Test Cases ->: Invalid entries -> ","","User Test Cases ->: Invalid entries -> ","TestCase for required","TestCase for required",""
"passed","Fri Apr 07 15:08:20 UTC 2023","Fri Apr 07 15:08:24 UTC 2023","4404","","Submit Photo Upload form","","Submit Photo Upload form","submit and edit (with changes)","submit and edit (with changes)",""
"passed","Fri Apr 07 14:58:36 UTC 2023","Fri Apr 07 14:58:46 UTC 2023","9756","","Creating custom places","","Creating custom places","the RHS add place button should show the custom title","the RHS add place button should show the custom title",""
"passed","Fri Apr 07 15:15:21 UTC 2023","Fri Apr 07 15:15:22 UTC 2023","721","","Privacy policy: for an offline user","","Privacy policy: for an offline user","should not show on refresh","should not show on refresh",""
"passed","Fri Apr 07 15:00:08 UTC 2023","Fri Apr 07 15:00:13 UTC 2023","5792","","Contact details page: Permissions to show reports and tasks","","Contact details page: Permissions to show reports and tasks","should not show tasks when permission is disabled","should not show tasks when permission is disabled",""
"passed","Fri Apr 07 14:59:51 UTC 2023","Fri Apr 07 15:00:03 UTC 2023","11760","","Contact details page: Permissions to show reports and tasks","","Contact details page: Permissions to show reports and tasks","should show reports and tasks when permissions are enabled","should show reports and tasks when permissions are enabled",""
