"Status","Start Time","Stop Time","Duration in ms","Parent Suite","Suite","Sub Suite","Test Class","Test Method","Name","Description"
"passed","Thu May 11 04:45:28 UTC 2023","Thu May 11 04:45:34 UTC 2023","5998","","Reports tab breadcrumbs","","Reports tab breadcrumbs","should display reports with breadcrumbs for online user","should display reports with breadcrumbs for online user",""
"passed","Thu May 11 04:53:12 UTC 2023","Thu May 11 04:53:24 UTC 2023","11668","","Tasks group landing page: for supervisor","","Tasks group landing page: for supervisor","should have tasks","should have tasks",""
"passed","Thu May 11 04:31:09 UTC 2023","Thu May 11 04:31:16 UTC 2023","6918","","Edit report with attachmnet","","Edit report with attachmnet","should save edits","should save edits",""
"passed","Thu May 11 04:33:41 UTC 2023","Thu May 11 04:33:47 UTC 2023","6053","","RepeatForm: Repeat form with count input","","RepeatForm: Repeat form with count input","should display the initial form and its repeated content in Nepali","should display the initial form and its repeated content in Nepali",""
"passed","Thu May 11 04:41:24 UTC 2023","Thu May 11 04:41:26 UTC 2023","1945","","Hamburger Menu tests","","Hamburger Menu tests","should open About","should open About",""
"passed","Thu May 11 04:38:12 UTC 2023","Thu May 11 04:38:13 UTC 2023","1225","","Token login","","Token login","should display an error with incorrect url","should display an error with incorrect url",""
"passed","Thu May 11 04:46:40 UTC 2023","Thu May 11 04:46:46 UTC 2023","6032","","Export Reports","","Export Reports","Should download export file","Should download export file",""
"passed","Thu May 11 04:21:55 UTC 2023","Thu May 11 04:22:07 UTC 2023","11768","","Targets","","Targets","should display targets from default config","should display targets from default config",""
"passed","Thu May 11 04:32:57 UTC 2023","Thu May 11 04:33:06 UTC 2023","8695","","Pregnancy Visit","","Pregnancy Visit","Submit and validate Pregnancy Visit form and keeps the report minified","Submit and validate Pregnancy Visit form and keeps the report minified",""
"passed","Thu May 11 04:34:47 UTC 2023","Thu May 11 04:34:49 UTC 2023","1547","","Submit Enketo form","","Submit Enketo form","cancelling form with input triggers confirmation dialog box","cancelling form with input triggers confirmation dialog box",""
"passed","Thu May 11 04:49:02 UTC 2023","Thu May 11 04:49:22 UTC 2023","19284","","Service worker cache","","Service worker cache","login page translation updates trigger login page refresh","login page translation updates trigger login page refresh",""
"passed","Thu May 11 04:50:13 UTC 2023","Thu May 11 04:50:15 UTC 2023","2782","","sms-gateway api: - gateway submits new WT sms messages","","sms-gateway api: - gateway submits new WT sms messages","shows content","shows content",""
"passed","Thu May 11 04:27:19 UTC 2023","Thu May 11 04:27:40 UTC 2023","21425","","Create Person Under Area","","Create Person Under Area","create person under area should only see children","create person under area should only see children",""
"passed","Thu May 11 04:30:03 UTC 2023","Thu May 11 04:30:13 UTC 2023","9739","","Family form","","Family form","Submit Add Family form","Submit Add Family form",""
"passed","Thu May 11 04:40:39 UTC 2023","Thu May 11 04:40:40 UTC 2023","1344","","Online User: Options disabled when no items - messages, contacts, people","","Online User: Options disabled when no items - messages, contacts, people"," - Contact tab"," - Contact tab",""
"passed","Thu May 11 05:05:06 UTC 2023","Thu May 11 05:05:09 UTC 2023","2485","","User Test Cases ->","","User Test Cases ->","""before all"" hook for User Test Cases ->","""before all"" hook for User Test Cases ->",""
"passed","Thu May 11 04:33:51 UTC 2023","Thu May 11 04:33:56 UTC 2023","4499","","RepeatForm: Repeat form with repeat button","","RepeatForm: Repeat form with repeat button","should display the initial form and its repeated content in Swahili","should display the initial form and its repeated content in Swahili",""
"passed","Thu May 11 04:26:32 UTC 2023","Thu May 11 04:26:37 UTC 2023","4464","","Create new lineage structure","","Create new lineage structure","Create new household","Create new household",""
"passed","Thu May 11 04:40:16 UTC 2023","Thu May 11 04:40:19 UTC 2023","2769","","- permissions disabled: - export permissions disabled","","- permissions disabled: - export permissions disabled"," - Contact Tab - contact selected"," - Contact Tab - contact selected",""
"passed","Thu May 11 04:56:34 UTC 2023","Thu May 11 04:56:36 UTC 2023","1936","","Create user for contacts","","Create user for contacts","""before all"" hook for Create user for contacts","""before all"" hook for Create user for contacts",""
"passed","Thu May 11 04:31:53 UTC 2023","Thu May 11 04:32:12 UTC 2023","18210","","Contact Delivery Form","","Contact Delivery Form","Complete a delivery: Process a delivery with a live child and facility birth.","Complete a delivery: Process a delivery with a live child and facility birth.",""
"passed","Thu May 11 04:50:15 UTC 2023","Thu May 11 04:50:17 UTC 2023","1244","","sms-gateway api: - gateway submits WT sms status updates","","sms-gateway api: - gateway submits WT sms status updates","- shows content","- shows content",""
"passed","Thu May 11 04:29:01 UTC 2023","Thu May 11 04:29:21 UTC 2023","19992","","Storing checkpointer on target migration","","Storing checkpointer on target migration","should re-upload docs when the server rolls back","should re-upload docs when the server rolls back",""
"passed","Thu May 11 04:50:46 UTC 2023","Thu May 11 04:50:56 UTC 2023","9553","","Message tab breadcrumbs","","Message tab breadcrumbs","should display messages with updated breadcrumbs for offline user","should display messages with updated breadcrumbs for offline user",""
"passed","Thu May 11 04:56:36 UTC 2023","Thu May 11 04:56:49 UTC 2023","13379","","Create user for contacts: user replace","","Create user for contacts: user replace","does not create a new user when the replace_user form is submitted for online user","does not create a new user when the replace_user form is submitted for online user",""
"passed","Thu May 11 04:33:28 UTC 2023","Thu May 11 04:33:29 UTC 2023","1140","","Pregnancy registration","","Pregnancy registration","Should verify that all tasks related with the high risk pregnancy were created","Should verify that all tasks related with the high risk pregnancy were created",""
"passed","Thu May 11 04:28:02 UTC 2023","Thu May 11 04:28:25 UTC 2023","22242","","Storing checkpointer on target migration","","Storing checkpointer on target migration","should store replication checkpointers on target and source","should store replication checkpointers on target and source",""
"passed","Thu May 11 04:32:14 UTC 2023","Thu May 11 04:32:15 UTC 2023","1427","","Contact Delivery Form","","Contact Delivery Form","The targets page should be updated","The targets page should be updated",""
"passed","Thu May 11 04:47:05 UTC 2023","Thu May 11 04:47:13 UTC 2023","7383","","Reports Subject","","Reports Subject","should create a report using patient_id","should create a report using patient_id",""
"passed","Thu May 11 04:45:34 UTC 2023","Thu May 11 04:45:44 UTC 2023","10182","","Reports tab breadcrumbs","","Reports tab breadcrumbs","should display reports with updated breadcrumbs for offline user","should display reports with updated breadcrumbs for offline user",""
"passed","Thu May 11 04:28:25 UTC 2023","Thu May 11 04:28:43 UTC 2023","18116","","Storing checkpointer on target migration","","Storing checkpointer on target migration","should copy existent browser checkpointer when db is not migrated","should copy existent browser checkpointer when db is not migrated",""
"passed","Thu May 11 05:05:35 UTC 2023","Thu May 11 05:05:39 UTC 2023","4044","","User Test Cases ->: Invalid entries -> ","","User Test Cases ->: Invalid entries -> ","should require username","should require username",""
"passed","Thu May 11 04:30:19 UTC 2023","Thu May 11 04:30:48 UTC 2023","28572","","Submit a death report","","Submit a death report","Should submit a death report","Should submit a death report",""
"passed","Thu May 11 04:59:02 UTC 2023","Thu May 11 05:00:07 UTC 2023","64523","","Create user for contacts: user replace: for an offline user","","Create user for contacts: user replace: for an offline user","creates new user from latest replace_user form data if multiple are submitted before syncing","creates new user from latest replace_user form data if multiple are submitted before syncing",""
"passed","Thu May 11 04:47:36 UTC 2023","Thu May 11 04:47:39 UTC 2023","2975","","Reports Subject","","Reports Subject","should create a report which has an unknown sender and a known subject","should create a report which has an unknown sender and a known subject",""
"passed","Thu May 11 04:47:13 UTC 2023","Thu May 11 04:47:16 UTC 2023","3444","","Reports Subject","","Reports Subject","should create a report using doc id","should create a report using doc id",""
"passed","Thu May 11 04:29:43 UTC 2023","Thu May 11 04:29:45 UTC 2023","1420","","db-sync","","db-sync","should filter resources, service-worker, forms, translations, branding, partners docs","should filter resources, service-worker, forms, translations, branding, partners docs",""
"passed","Thu May 11 04:23:35 UTC 2023","Thu May 11 04:23:46 UTC 2023","11077","","Creating custom places","","Creating custom places","should show custom places in their own list","should show custom places in their own list",""
"passed","Thu May 11 04:50:17 UTC 2023","Thu May 11 04:50:18 UTC 2023","1520","","sms-gateway api: - api returns list of pending WO messages","","sms-gateway api: - api returns list of pending WO messages","- returns list and updates state","- returns list and updates state",""
"passed","Thu May 11 04:30:48 UTC 2023","Thu May 11 04:30:48 UTC 2023","721","","Submit a death report","","Submit a death report","Should verify that the report related to the death was created","Should verify that the report related to the death was created",""
"passed","Thu May 11 04:41:53 UTC 2023","Thu May 11 04:41:58 UTC 2023","5330","","Guided tour","","Guided tour","run and end guided tour => should close the tour","run and end guided tour => should close the tour",""
"passed","Thu May 11 04:33:47 UTC 2023","Thu May 11 04:33:51 UTC 2023","4056","","RepeatForm: Repeat form with count input","","RepeatForm: Repeat form with count input","should display the initial form and its repeated content in English","should display the initial form and its repeated content in English",""
"passed","Thu May 11 05:00:59 UTC 2023","Thu May 11 05:02:10 UTC 2023","71556","","Create user for contacts: user replace: for an offline user","","Create user for contacts: user replace: for an offline user","creates new user for the first version of a contact to sync and conflicting replacements ignored","creates new user for the first version of a contact to sync and conflicting replacements ignored",""
"passed","Thu May 11 04:25:01 UTC 2023","Thu May 11 04:25:06 UTC 2023","4862","","Edit contacts with the default config. ","","Edit contacts with the default config. ","should remove the primary contact from the clinic when the contact is deleted","should remove the primary contact from the clinic when the contact is deleted",""
"passed","Thu May 11 04:35:48 UTC 2023","Thu May 11 04:35:52 UTC 2023","3684","","Training Cards","","Training Cards","should display training after it was canceled and the training doc was updated","should display training after it was canceled and the training doc was updated",""
"passed","Thu May 11 04:46:06 UTC 2023","Thu May 11 04:46:20 UTC 2023","14147","","Report Filter","","Report Filter","should filter by date","should filter by date",""
"passed","Thu May 11 05:05:22 UTC 2023","Thu May 11 05:05:26 UTC 2023","4154","","User Test Cases ->: Invalid entries -> ","","User Test Cases ->: Invalid entries -> ","TestCase for Passwords must match","TestCase for Passwords must match",""
"passed","Thu May 11 04:45:51 UTC 2023","Thu May 11 04:45:59 UTC 2023","8131","","Bulk delete reports","","Bulk delete reports","should select, deselect and delete only selected reports","should select, deselect and delete only selected reports",""
"passed","Thu May 11 04:23:23 UTC 2023","Thu May 11 04:23:35 UTC 2023","11952","","Creating custom places","","Creating custom places","should show the multi person actions with the correct label","should show the multi person actions with the correct label",""
"passed","Thu May 11 04:41:37 UTC 2023","Thu May 11 04:41:40 UTC 2023","3663","","Navigation tests","","Navigation tests","should open Messages tab","should open Messages tab",""
"passed","Thu May 11 04:26:22 UTC 2023","Thu May 11 04:26:28 UTC 2023","5464","","Create new lineage structure","","Create new lineage structure","Create new health center","Create new health center",""
"passed","Thu May 11 04:40:56 UTC 2023","Thu May 11 04:40:58 UTC 2023","2356","","Online User:  - Options enabled when there are items","","Online User:  - Options enabled when there are items"," - Contact Tab  - contact selected"," - Contact Tab  - contact selected",""
"passed","Thu May 11 04:33:56 UTC 2023","Thu May 11 04:34:00 UTC 2023","3970","","RepeatForm: Repeat form with repeat button","","RepeatForm: Repeat form with repeat button","should display the initial form and its repeated content in English","should display the initial form and its repeated content in English",""
"passed","Thu May 11 04:49:22 UTC 2023","Thu May 11 04:49:41 UTC 2023","19626","","Service worker cache","","Service worker cache","adding new languages triggers login page refresh","adding new languages triggers login page refresh",""
"passed","Thu May 11 04:41:12 UTC 2023","Thu May 11 04:41:15 UTC 2023","2661","","bfcache: admin app","","bfcache: admin app","should redirect to login page when session is expired","should redirect to login page when session is expired",""
"passed","Thu May 11 04:42:11 UTC 2023","Thu May 11 04:42:28 UTC 2023","16621","","Privacy policy: for an offline user","","Privacy policy: for an offline user","should show the correct privacy policy on login","should show the correct privacy policy on login",""
"passed","Thu May 11 04:38:15 UTC 2023","Thu May 11 04:38:17 UTC 2023","2435","","Token login","","Token login","should display an error when token is expired","should display an error when token is expired",""
"passed","Thu May 11 05:02:37 UTC 2023","Thu May 11 05:03:33 UTC 2023","55931","","Create user for contacts: user replace: for an offline user","","Create user for contacts: user replace: for an offline user","does not create any new user nor does it reparent new reports when the transition fails","does not create any new user nor does it reparent new reports when the transition fails",""
"passed","Thu May 11 04:39:34 UTC 2023","Thu May 11 04:39:35 UTC 2023","903","","- DELETE permissions disabled","","- DELETE permissions disabled","- Report tab - delete menu not displayed when xml report selected","- Report tab - delete menu not displayed when xml report selected",""
"passed","Thu May 11 04:38:40 UTC 2023","Thu May 11 04:38:42 UTC 2023","1528","","More Options Menu - Offline User: all permissions enabled","","More Options Menu - Offline User: all permissions enabled","- Contact tab - no contact selected","- Contact tab - no contact selected",""
"passed","Thu May 11 04:21:12 UTC 2023","Thu May 11 04:21:15 UTC 2023","2802","","About page","","About page","should open the about page","should open the about page",""
"passed","Thu May 11 04:42:56 UTC 2023","Thu May 11 04:43:02 UTC 2023","5867","","Privacy policy: for an offline user","","Privacy policy: for an offline user","should show if the user policy changes","should show if the user policy changes",""
"passed","Thu May 11 04:48:32 UTC 2023","Thu May 11 04:48:43 UTC 2023","11748","","Service worker cache","","Service worker cache","confirm initial list of cached resources","confirm initial list of cached resources",""
"passed","Thu May 11 05:03:39 UTC 2023","Thu May 11 05:03:48 UTC 2023","8878","","Testing Incorrect locale","","Testing Incorrect locale","should work with incorrect locale","should work with incorrect locale",""
"passed","Thu May 11 05:04:49 UTC 2023","Thu May 11 05:05:00 UTC 2023","11231","","Adding new language","","Adding new language","should support deleting translations","should support deleting translations",""
"passed","Thu May 11 04:27:47 UTC 2023","Thu May 11 04:27:53 UTC 2023","5554","","Test Contact Search Functionality","","Test Contact Search Functionality","search by NON empty string should display results with contains match and clears search","search by NON empty string should display results with contains match and clears search",""
"passed","Thu May 11 04:42:42 UTC 2023","Thu May 11 04:42:55 UTC 2023","12888","","Privacy policy: for an offline user","","Privacy policy: for an offline user","should show french policy on secondary login","should show french policy on secondary login",""
"passed","Thu May 11 04:41:44 UTC 2023","Thu May 11 04:41:45 UTC 2023","1547","","Navigation tests","","Navigation tests","should open Contacts or Peoples tab","should open Contacts or Peoples tab",""
"passed","Thu May 11 04:34:10 UTC 2023","Thu May 11 04:34:17 UTC 2023","6579","","Countdown timer widget","","Countdown timer widget","interact with timer and submit","interact with timer and submit",""
"passed","Thu May 11 04:22:14 UTC 2023","Thu May 11 04:22:18 UTC 2023","3993","","Targets","","Targets","should display correct message when targets are disabled","should display correct message when targets are disabled",""
"passed","Thu May 11 04:40:05 UTC 2023","Thu May 11 04:40:05 UTC 2023","428","","- EDIT permissions disabled","","- EDIT permissions disabled","- Report tab - menu not displayed when xml report selected","- Report tab - menu not displayed when xml report selected",""
"passed","Thu May 11 04:43:10 UTC 2023","Thu May 11 04:43:11 UTC 2023","1080","","Privacy policy: for an online user","","Privacy policy: for an online user","should not show on refresh","should not show on refresh",""
"passed","Thu May 11 04:47:39 UTC 2023","Thu May 11 04:47:42 UTC 2023","2944","","Reports Subject","","Reports Subject","should create a report which has an unknown sender with no phone number","should create a report which has an unknown sender with no phone number",""
"passed","Thu May 11 04:38:06 UTC 2023","Thu May 11 04:38:12 UTC 2023","5049","","Token login","","Token login","should redirect the user to the app if already logged in","should redirect the user to the app if already logged in",""
"passed","Thu May 11 04:53:08 UTC 2023","Thu May 11 04:53:12 UTC 2023","3742","","Tasks group landing page: for chw","","Tasks group landing page: for chw","should not show page when submitting task for contact with no leaf type place in lineage","should not show page when submitting task for contact with no leaf type place in lineage",""
"passed","Thu May 11 04:49:47 UTC 2023","Thu May 11 04:49:47 UTC 2023","549","","Service worker cache","","Service worker cache","confirm fetch yields cached result","confirm fetch yields cached result",""
"passed","Thu May 11 04:40:52 UTC 2023","Thu May 11 04:40:54 UTC 2023","1754","","Online User:  - Options enabled when there are items","","Online User:  - Options enabled when there are items","- Message tab","- Message tab",""
"passed","Thu May 11 04:35:55 UTC 2023","Thu May 11 04:35:56 UTC 2023","381","","Training Cards","","Training Cards","should not display completed training","should not display completed training",""
"passed","Thu May 11 04:35:52 UTC 2023","Thu May 11 04:35:55 UTC 2023","3331","","Training Cards","","Training Cards","should display training after reload and complete training","should display training after reload and complete training",""
"passed","Thu May 11 04:22:07 UTC 2023","Thu May 11 04:22:14 UTC 2023","7436","","Targets","","Targets","should display correct message when no target found","should display correct message when no target found",""
"passed","Thu May 11 04:40:19 UTC 2023","Thu May 11 04:40:20 UTC 2023","1255","","- permissions disabled: - export permissions disabled","","- permissions disabled: - export permissions disabled","- Report Tab - report selected","- Report Tab - report selected",""
"passed","Thu May 11 04:33:39 UTC 2023","Thu May 11 04:33:41 UTC 2023","1909","","RepeatForm","","RepeatForm","""before all"" hook for RepeatForm","""before all"" hook for RepeatForm",""
"passed","Thu May 11 04:49:41 UTC 2023","Thu May 11 04:49:46 UTC 2023","4658","","Service worker cache","","Service worker cache","other translation updates do not trigger a login page refresh","other translation updates do not trigger a login page refresh",""
"passed","Thu May 11 04:40:21 UTC 2023","Thu May 11 04:40:23 UTC 2023","2057","","- permissions disabled: - DELETE permissions disabled","","- permissions disabled: - DELETE permissions disabled"," - Contact Tab - contact selected"," - Contact Tab - contact selected",""
"passed","Thu May 11 04:34:41 UTC 2023","Thu May 11 04:34:47 UTC 2023","6196","","Submit Enketo form","","Submit Enketo form","cancelling form with no input does not trigger confirmation dialog","cancelling form with no input does not trigger confirmation dialog",""
"passed","Thu May 11 04:52:48 UTC 2023","Thu May 11 04:52:52 UTC 2023","4655","","Tasks group landing page: for chw","","Tasks group landing page: for chw","should display tasks group landing page after task completion","should display tasks group landing page after task completion",""
"passed","Thu May 11 04:26:28 UTC 2023","Thu May 11 04:26:32 UTC 2023","4562","","Create new lineage structure","","Create new lineage structure","Create new area","Create new area",""
"passed","Thu May 11 04:23:00 UTC 2023","Thu May 11 04:23:12 UTC 2023","11752","","Creating custom places","","Creating custom places","the RHS button show the appropriate label when multiple places exist at the current level","the RHS button show the appropriate label when multiple places exist at the current level",""
"passed","Thu May 11 04:55:55 UTC 2023","Thu May 11 04:56:28 UTC 2023","32439","","Create user when adding contact","","Create user when adding contact","creates a new user when Sentinel recovers from outage","creates a new user when Sentinel recovers from outage",""
"passed","Thu May 11 04:58:26 UTC 2023","Thu May 11 04:59:02 UTC 2023","35888","","Create user for contacts: user replace: for an offline user","","Create user for contacts: user replace: for an offline user","does not assign new person as primary contact of parent place if original person was not primary","does not assign new person as primary contact of parent place if original person was not primary",""
"passed","Thu May 11 04:43:11 UTC 2023","Thu May 11 04:43:12 UTC 2023","653","","Privacy policy: for an online user","","Privacy policy: for an online user","should display when navigating to the privacy policy page","should display when navigating to the privacy policy page",""
"passed","Thu May 11 04:43:02 UTC 2023","Thu May 11 04:43:10 UTC 2023","7839","","Privacy policy: for an online user","","Privacy policy: for an online user","should show the correct privacy policy on login","should show the correct privacy policy on login",""
"passed","Thu May 11 04:32:39 UTC 2023","Thu May 11 04:32:50 UTC 2023","11492","","Pregnancy danger sign follow-up form","","Pregnancy danger sign follow-up form","should submit and edit Pregnancy danger sign follow-up form with changes","should submit and edit Pregnancy danger sign follow-up form with changes",""
"passed","Thu May 11 04:41:21 UTC 2023","Thu May 11 04:41:24 UTC 2023","3113","","Hamburger Menu tests","","Hamburger Menu tests","should open Configuration wizard","should open Configuration wizard",""
"passed","Thu May 11 04:41:28 UTC 2023","Thu May 11 04:41:30 UTC 2023","2200","","Hamburger Menu tests","","Hamburger Menu tests","should open Configuration app","should open Configuration app",""
"passed","Thu May 11 04:23:12 UTC 2023","Thu May 11 04:23:23 UTC 2023","11866","","Creating custom places","","Creating custom places","should show the single add person button with the correct label","should show the single add person button with the correct label",""
"passed","Thu May 11 04:35:22 UTC 2023","Thu May 11 04:35:27 UTC 2023","4340","","Submit Z-Score form","","Submit Z-Score form","saves z-score values","saves z-score values",""
"passed","Thu May 11 04:50:25 UTC 2023","Thu May 11 04:50:31 UTC 2023","5934","","Link SMS to patient without passing id","","Link SMS to patient without passing id","Send SMS without patient_id and report created under person","Send SMS without patient_id and report created under person",""
"passed","Thu May 11 04:53:03 UTC 2023","Thu May 11 04:53:08 UTC 2023","5645","","Tasks group landing page: for chw","","Tasks group landing page: for chw","should not show page when there are no more household tasks","should not show page when there are no more household tasks",""
"passed","Thu May 11 04:37:22 UTC 2023","Thu May 11 04:37:27 UTC 2023","5074","","Login and logout tests","","Login and logout tests","should set correct cookies","should set correct cookies",""
"passed","Thu May 11 04:43:51 UTC 2023","Thu May 11 04:45:09 UTC 2023","77822","","purge","","purge","purging runs on sync and startup","purging runs on sync and startup",""
"passed","Thu May 11 04:37:17 UTC 2023","Thu May 11 04:37:22 UTC 2023","5060","","Login and logout tests","","Login and logout tests","should log in using username and password fields","should log in using username and password fields",""
