"Status","Start Time","Stop Time","Duration in ms","Parent Suite","Suite","Sub Suite","Test Class","Test Method","Name","Description"
"passed","Wed May 17 06:15:08 UTC 2023","Wed May 17 06:15:12 UTC 2023","4320","","Create new lineage structure","","Create new lineage structure","Create new household","Create new household",""
"passed","Wed May 17 06:48:54 UTC 2023","Wed May 17 06:49:03 UTC 2023","9448","","Bikram Sambat date display","","Bikram Sambat date display","enketo xpath extension function should display correct values when Nepali is not selected","enketo xpath extension function should display correct values when Nepali is not selected",""
"passed","Wed May 17 06:30:58 UTC 2023","Wed May 17 06:31:01 UTC 2023","2568","","Online User:  - Contact tab - user has no contact ","","Online User:  - Contact tab - user has no contact "," - no contact selected"," - no contact selected",""
"passed","Wed May 17 06:26:40 UTC 2023","Wed May 17 06:26:43 UTC 2023","3172","","Training Cards","","Training Cards","should display training after reload and complete training","should display training after reload and complete training",""
"passed","Wed May 17 06:31:52 UTC 2023","Wed May 17 06:31:53 UTC 2023","1371","","Navigation tests","","Navigation tests","should open Contacts or Peoples tab","should open Contacts or Peoples tab",""
"passed","Wed May 17 06:24:39 UTC 2023","Wed May 17 06:24:41 UTC 2023","1763","","RepeatForm","","RepeatForm","""before all"" hook for RepeatForm","""before all"" hook for RepeatForm",""
"passed","Wed May 17 06:49:26 UTC 2023","Wed May 17 06:49:28 UTC 2023","1251","","Adding new language","","Adding new language","should be set as Default language ","should be set as Default language ",""
"passed","Wed May 17 06:28:25 UTC 2023","Wed May 17 06:28:30 UTC 2023","5016","","Login and logout tests","","Login and logout tests","should display the ""session expired"" modal and redirect to login page","should display the ""session expired"" modal and redirect to login page",""
"passed","Wed May 17 06:30:06 UTC 2023","Wed May 17 06:30:24 UTC 2023","17104","","- EDIT permissions disabled","","- EDIT permissions disabled"," - Contact Tab - contact selected"," - Contact Tab - contact selected",""
"passed","Wed May 17 06:21:00 UTC 2023","Wed May 17 06:22:04 UTC 2023","64182","","Submit a death report","","Submit a death report","Should submit a death report","Should submit a death report",""
"passed","Wed May 17 06:26:02 UTC 2023","Wed May 17 06:26:06 UTC 2023","4475","","Submit Photo Upload form","","Submit Photo Upload form","submit and edit (with changes)","submit and edit (with changes)",""
"passed","Wed May 17 06:50:19 UTC 2023","Wed May 17 06:50:23 UTC 2023","3985","","User Test Cases ->: Invalid entries -> ","","User Test Cases ->: Invalid entries -> ","should require username","should require username",""
"passed","Wed May 17 06:36:19 UTC 2023","Wed May 17 06:36:22 UTC 2023","3076","","Reports Subject","","Reports Subject","should create a report using unknown place_id","should create a report using unknown place_id",""
"passed","Wed May 17 06:17:47 UTC 2023","Wed May 17 06:17:49 UTC 2023","2470","","db-sync: meta db replication","","db-sync: meta db replication","should replicate meta db up","should replicate meta db up",""
"passed","Wed May 17 06:24:30 UTC 2023","Wed May 17 06:24:30 UTC 2023","743","","Pregnancy registration","","Pregnancy registration","Should verify that all tasks related with the high risk pregnancy were created","Should verify that all tasks related with the high risk pregnancy were created",""
"passed","Wed May 17 06:29:12 UTC 2023","Wed May 17 06:29:14 UTC 2023","1586","","More Options Menu - Offline User: all permissions enabled","","More Options Menu - Offline User: all permissions enabled","- Message tab","- Message tab",""
"passed","Wed May 17 06:10:34 UTC 2023","Wed May 17 06:10:36 UTC 2023","2299","","About page","","About page","should display partners","should display partners",""
"passed","Wed May 17 06:23:22 UTC 2023","Wed May 17 06:23:23 UTC 2023","1251","","Contact Delivery Form","","Contact Delivery Form","The child registered during birth should be created and should display the proper information","The child registered during birth should be created and should display the proper information",""
"passed","Wed May 17 06:24:46 UTC 2023","Wed May 17 06:24:50 UTC 2023","4023","","RepeatForm: Repeat form with count input","","RepeatForm: Repeat form with count input","should display the initial form and its repeated content in English","should display the initial form and its repeated content in English",""
"passed","Wed May 17 06:37:19 UTC 2023","Wed May 17 06:37:25 UTC 2023","5958","","Service worker cache","","Service worker cache","login page translation updates trigger login page refresh","login page translation updates trigger login page refresh",""
"passed","Wed May 17 06:37:36 UTC 2023","Wed May 17 06:37:36 UTC 2023","799","","Service worker cache","","Service worker cache","should load the page while offline","should load the page while offline",""
"passed","Wed May 17 06:28:52 UTC 2023","Wed May 17 06:28:53 UTC 2023","718","","Token login","","Token login","should display an error when token login is disabled","should display an error when token login is disabled",""
"passed","Wed May 17 06:36:43 UTC 2023","Wed May 17 06:36:48 UTC 2023","5556","","Test Reports Search Functionality","","Test Reports Search Functionality","search by NON empty string should display results with contains match and then clears","search by NON empty string should display results with contains match and then clears",""
"passed","Wed May 17 06:37:13 UTC 2023","Wed May 17 06:37:19 UTC 2023","5632","","Service worker cache","","Service worker cache","branding updates trigger login page refresh","branding updates trigger login page refresh",""
"passed","Wed May 17 06:35:04 UTC 2023","Wed May 17 06:35:12 UTC 2023","7815","","Report Filter","","Report Filter","should filter by date","should filter by date",""
"passed","Wed May 17 06:12:14 UTC 2023","Wed May 17 06:12:25 UTC 2023","11189","","Creating custom places","","Creating custom places","should show the single add person button with the correct label","should show the single add person button with the correct label",""
"passed","Wed May 17 06:23:10 UTC 2023","Wed May 17 06:23:22 UTC 2023","11995","","Contact Delivery Form","","Contact Delivery Form","Complete a delivery: Process a delivery with a live child and facility birth.","Complete a delivery: Process a delivery with a live child and facility birth.",""
"passed","Wed May 17 06:32:31 UTC 2023","Wed May 17 06:32:38 UTC 2023","7519","","Privacy policy: for an online user","","Privacy policy: for an online user","should show the correct privacy policy on login","should show the correct privacy policy on login",""
"passed","Wed May 17 06:38:58 UTC 2023","Wed May 17 06:38:59 UTC 2023","1505","","Send message","","Send message","should reply to an existing message - contact with a phone number","should reply to an existing message - contact with a phone number",""
"passed","Wed May 17 06:15:04 UTC 2023","Wed May 17 06:15:08 UTC 2023","3929","","Create new lineage structure","","Create new lineage structure","Create new area","Create new area",""
"passed","Wed May 17 06:39:04 UTC 2023","Wed May 17 06:39:08 UTC 2023","4619","","Send message","","Send message","should reply to an existing message and add a new recipient - contact with a phone number ","should reply to an existing message and add a new recipient - contact with a phone number ",""
"passed","Wed May 17 06:26:43 UTC 2023","Wed May 17 06:26:44 UTC 2023","313","","Training Cards","","Training Cards","should not display completed training","should not display completed training",""
"passed","Wed May 17 06:31:25 UTC 2023","Wed May 17 06:31:28 UTC 2023","2432","","bfcache: admin app","","bfcache: admin app","should redirect to login page when session is expired","should redirect to login page when session is expired",""
"passed","Wed May 17 06:26:12 UTC 2023","Wed May 17 06:26:18 UTC 2023","6030","","Submit Z-Score form","","Submit Z-Score form","Autofills zscore fields with correct values","Autofills zscore fields with correct values",""
"passed","Wed May 17 06:30:30 UTC 2023","Wed May 17 06:30:34 UTC 2023","4311","","- permissions disabled","","- permissions disabled","""before all"" hook for - permissions disabled","""before all"" hook for - permissions disabled",""
"passed","Wed May 17 06:25:46 UTC 2023","Wed May 17 06:25:48 UTC 2023","1940","","Submit Enketo form","","Submit Enketo form","cancelling form with input triggers confirmation dialog box","cancelling form with input triggers confirmation dialog box",""
"passed","Wed May 17 06:27:10 UTC 2023","Wed May 17 06:27:54 UTC 2023","43751","","Submit an undo death report","","Submit an undo death report","Should submit an undo death report","Should submit an undo death report",""
"passed","Wed May 17 06:31:53 UTC 2023","Wed May 17 06:31:54 UTC 2023","1356","","Navigation tests","","Navigation tests","should open Analytics tab","should open Analytics tab",""
"passed","Wed May 17 06:11:14 UTC 2023","Wed May 17 06:11:21 UTC 2023","7203","","Targets","","Targets","should display correct message when no target found","should display correct message when no target found",""
"passed","Wed May 17 06:28:58 UTC 2023","Wed May 17 06:29:01 UTC 2023","3448","","Token login","","Token login","should log the user in when token is correct","should log the user in when token is correct",""
"passed","Wed May 17 06:36:28 UTC 2023","Wed May 17 06:36:34 UTC 2023","6139","","Reports Subject","","Reports Subject","changes to a loaded or list report should be reflected in the UI ","changes to a loaded or list report should be reflected in the UI ",""
"passed","Wed May 17 06:49:53 UTC 2023","Wed May 17 06:49:57 UTC 2023","4688","","User Test Cases ->: Creating Users ->","","User Test Cases ->: Creating Users ->","should add user with valid password","should add user with valid password",""
"passed","Wed May 17 06:24:54 UTC 2023","Wed May 17 06:24:59 UTC 2023","4758","","RepeatForm: Repeat form with repeat button","","RepeatForm: Repeat form with repeat button","should display the initial form and its repeated content in English","should display the initial form and its repeated content in English",""
"passed","Wed May 17 06:27:54 UTC 2023","Wed May 17 06:27:54 UTC 2023","685","","Submit an undo death report","","Submit an undo death report","Should verify that the undo death report was created","Should verify that the undo death report was created",""
"passed","Wed May 17 06:17:40 UTC 2023","Wed May 17 06:17:42 UTC 2023","1743","","db-sync","","db-sync","should not filter deletes","should not filter deletes",""
"passed","Wed May 17 06:30:45 UTC 2023","Wed May 17 06:30:45 UTC 2023","42","","- permissions disabled","","- permissions disabled","""after all"" hook for - permissions disabled","""after all"" hook for - permissions disabled",""
"passed","Wed May 17 06:40:18 UTC 2023","Wed May 17 06:40:27 UTC 2023","8368","","Tasks group landing page","","Tasks group landing page","""before all"" hook for Tasks group landing page","""before all"" hook for Tasks group landing page",""
"passed","Wed May 17 06:36:25 UTC 2023","Wed May 17 06:36:28 UTC 2023","3015","","Reports Subject","","Reports Subject","should create a report which has an unknown sender with no phone number","should create a report which has an unknown sender with no phone number",""
"passed","Wed May 17 06:35:53 UTC 2023","Wed May 17 06:36:00 UTC 2023","7013","","Reports Subject","","Reports Subject","should create a report using patient_id","should create a report using patient_id",""
"passed","Wed May 17 06:38:03 UTC 2023","Wed May 17 06:38:05 UTC 2023","1534","","sms-gateway api: - api returns list of pending WO messages","","sms-gateway api: - api returns list of pending WO messages","- returns list and updates state","- returns list and updates state",""
"passed","Wed May 17 06:44:20 UTC 2023","Wed May 17 06:44:41 UTC 2023","21155","","Create user for contacts: user replace: for an offline user","","Create user for contacts: user replace: for an offline user","creates a new user when the replace_user form is submitted while online","creates a new user when the replace_user form is submitted while online",""
"passed","Wed May 17 06:37:58 UTC 2023","Wed May 17 06:37:59 UTC 2023","1796","","sms-gateway api","","sms-gateway api","""before all"" hook for sms-gateway api","""before all"" hook for sms-gateway api",""
"passed","Wed May 17 06:36:55 UTC 2023","Wed May 17 06:37:03 UTC 2023","7763","","Reports Sidebar Filter","","Reports Sidebar Filter","should filter by date","should filter by date",""
"passed","Wed May 17 06:46:18 UTC 2023","Wed May 17 06:47:07 UTC 2023","48577","","Create user for contacts: user replace: for an offline user","","Create user for contacts: user replace: for an offline user","creates new user for the first version of a contact to sync and conflicting replacements ignored","creates new user for the first version of a contact to sync and conflicting replacements ignored",""
"passed","Wed May 17 06:42:00 UTC 2023","Wed May 17 06:42:10 UTC 2023","10299","","Create user when adding contact","","Create user when adding contact","Does not create a new user when the transition is disabled","Does not create a new user when the transition is disabled",""
"passed","Wed May 17 06:39:08 UTC 2023","Wed May 17 06:39:12 UTC 2023","3413","","Send message","","Send message","should send a message using FAB at people's tab","should send a message using FAB at people's tab",""
"passed","Wed May 17 06:39:41 UTC 2023","Wed May 17 06:39:49 UTC 2023","7942","","Task list due dates","","Task list due dates","should display correct due dates with taskDaysOverdue setting and simple translation","should display correct due dates with taskDaysOverdue setting and simple translation",""
"passed","Wed May 17 06:29:18 UTC 2023","Wed May 17 06:29:20 UTC 2023","1923","","More Options Menu - Offline User: all permissions enabled","","More Options Menu - Offline User: all permissions enabled","Report tab - options enabled when sms report selected","Report tab - options enabled when sms report selected",""
"passed","Wed May 17 06:25:40 UTC 2023","Wed May 17 06:25:46 UTC 2023","5905","","Submit Enketo form","","Submit Enketo form","cancelling form with no input does not trigger confirmation dialog","cancelling form with no input does not trigger confirmation dialog",""
"passed","Wed May 17 06:15:41 UTC 2023","Wed May 17 06:15:47 UTC 2023","6266","","Create new lineage structure","","Create new lineage structure","should edit the name of the Family","should edit the name of the Family",""
"passed","Wed May 17 06:32:54 UTC 2023","Wed May 17 06:33:05 UTC 2023","10157","","Privacy policy: conflicts","","Privacy policy: conflicts","should not fail due to document conflict for new offline user","should not fail due to document conflict for new offline user",""
"passed","Wed May 17 06:28:05 UTC 2023","Wed May 17 06:28:08 UTC 2023","3003","","Login and logout tests","","Login and logout tests","should change locale to French","should change locale to French",""
"passed","Wed May 17 06:31:01 UTC 2023","Wed May 17 06:31:07 UTC 2023","5465","","Online User:  - Options enabled when there are items","","Online User:  - Options enabled when there are items","- Reports tab - Edit/export invisible when NON XML report selected","- Reports tab - Edit/export invisible when NON XML report selected",""
"passed","Wed May 17 06:28:54 UTC 2023","Wed May 17 06:28:56 UTC 2023","1465","","Token login","","Token login","should display an error when accessing with random strings","should display an error when accessing with random strings",""
"passed","Wed May 17 06:49:21 UTC 2023","Wed May 17 06:49:26 UTC 2023","5836","","Adding new language","","Adding new language","should show in enabled language list","should show in enabled language list",""
"passed","Wed May 17 06:29:20 UTC 2023","Wed May 17 06:29:21 UTC 2023","1395","","More Options Menu - Offline User: all permissions enabled","","More Options Menu - Offline User: all permissions enabled","Report tab - options enabled when xml report selected","Report tab - options enabled when xml report selected",""
"passed","Wed May 17 06:31:50 UTC 2023","Wed May 17 06:31:52 UTC 2023","1586","","Navigation tests","","Navigation tests","should open Reports or History tab","should open Reports or History tab",""
"passed","Wed May 17 06:48:29 UTC 2023","Wed May 17 06:48:38 UTC 2023","8910","","Testing Incorrect locale","","Testing Incorrect locale","should work with incorrect locale","should work with incorrect locale",""
"passed","Wed May 17 06:29:37 UTC 2023","Wed May 17 06:29:37 UTC 2023","47","","More Options Menu - Offline User","","More Options Menu - Offline User","""after all"" hook for More Options Menu - Offline User","""after all"" hook for More Options Menu - Offline User",""
"passed","Wed May 17 06:24:31 UTC 2023","Wed May 17 06:24:32 UTC 2023","922","","Pregnancy registration","","Pregnancy registration","Should verify that the counters for the active pregnancies and the new pregnancies were updated.","Should verify that the counters for the active pregnancies and the new pregnancies were updated.",""
"passed","Wed May 17 06:34:34 UTC 2023","Wed May 17 06:34:40 UTC 2023","5928","","Reports tab breadcrumbs","","Reports tab breadcrumbs","should display reports with breadcrumbs for online user","should display reports with breadcrumbs for online user",""
"passed","Wed May 17 06:38:10 UTC 2023","Wed May 17 06:38:16 UTC 2023","5662","","Link SMS to patient without passing id","","Link SMS to patient without passing id","Send SMS without patient_id and report created under person","Send SMS without patient_id and report created under person",""
