"Status","Start Time","Stop Time","Duration in ms","Parent Suite","Suite","Sub Suite","Test Class","Test Method","Name","Description"
"passed","Tue Jun 13 22:54:31 UTC 2023","Tue Jun 13 22:54:33 UTC 2023","1729","","Create user for contacts","","Create user for contacts","""before all"" hook for Create user for contacts","""before all"" hook for Create user for contacts",""
"passed","Tue Jun 13 22:35:31 UTC 2023","Tue Jun 13 22:35:35 UTC 2023","3497","","Login page funcionality tests: Log in","","Login page funcionality tests: Log in","should try to sign in with blank password and verify that credentials were incorrect","should try to sign in with blank password and verify that credentials were incorrect",""
"passed","Tue Jun 13 22:31:51 UTC 2023","Tue Jun 13 22:31:56 UTC 2023","4707","","RepeatForm: Repeat form with repeat button","","RepeatForm: Repeat form with repeat button","should display the initial form and its repeated content in English","should display the initial form and its repeated content in English",""
"passed","Tue Jun 13 22:31:37 UTC 2023","Tue Jun 13 22:31:42 UTC 2023","5386","","RepeatForm: Repeat form with count input","","RepeatForm: Repeat form with count input","should display the initial form and its repeated content in Nepali","should display the initial form and its repeated content in Nepali",""
"passed","Tue Jun 13 22:51:42 UTC 2023","Tue Jun 13 22:51:48 UTC 2023","5881","","Tasks group landing page: for chw","","Tasks group landing page: for chw","should not show page when there are no more household tasks","should not show page when there are no more household tasks",""
"skipped","Tue Jun 13 22:32:17 UTC 2023","Tue Jun 13 22:32:17 UTC 2023","0","","Submit Default Delivery Report","","Submit Default Delivery Report","open, submit and edit (no changes) default delivery form","open, submit and edit (no changes) default delivery form",""
"passed","Tue Jun 13 22:39:11 UTC 2023","Tue Jun 13 22:39:12 UTC 2023","1449","","Navigation tests: Navigation functionality","","Navigation tests: Navigation functionality","should open Reports or History tab","should open Reports or History tab",""
"passed","Tue Jun 13 22:37:52 UTC 2023","Tue Jun 13 22:37:54 UTC 2023","1299","","- permissions disabled: - export permissions disabled","","- permissions disabled: - export permissions disabled","- Report Tab - report selected","- Report Tab - report selected",""
"passed","Tue Jun 13 22:18:23 UTC 2023","Tue Jun 13 22:18:26 UTC 2023","3712","","Add new district tests : ","","Add new district tests : ","should edit district","should edit district",""
"passed","Tue Jun 13 22:23:32 UTC 2023","Tue Jun 13 22:23:34 UTC 2023","1649","","db-sync","","db-sync","should not filter deletes","should not filter deletes",""
"passed","Tue Jun 13 22:37:54 UTC 2023","Tue Jun 13 22:37:56 UTC 2023","2077","","- permissions disabled: - DELETE permissions disabled","","- permissions disabled: - DELETE permissions disabled"," - Contact Tab - contact selected"," - Contact Tab - contact selected",""
"passed","Tue Jun 13 22:38:29 UTC 2023","Tue Jun 13 22:38:31 UTC 2023","2185","","Online User:  - Options enabled when there are items","","Online User:  - Options enabled when there are items"," - Contact Tab  - contact selected"," - Contact Tab  - contact selected",""
"passed","Tue Jun 13 23:02:07 UTC 2023","Tue Jun 13 23:02:14 UTC 2023","7416","","Bulk User Creation ->","","Bulk User Creation ->","should show an upload summary with a successful upload and a failed upload","should show an upload summary with a successful upload and a failed upload",""
"passed","Tue Jun 13 22:29:09 UTC 2023","Tue Jun 13 22:29:20 UTC 2023","10942","","Edit report with attachmnet","","Edit report with attachmnet","should remove attachment when saving","should remove attachment when saving",""
"passed","Tue Jun 13 22:36:19 UTC 2023","Tue Jun 13 22:36:25 UTC 2023","5503","","More Options Menu - Offline User","","More Options Menu - Offline User","""before all"" hook for More Options Menu - Offline User","""before all"" hook for More Options Menu - Offline User",""
"passed","Tue Jun 13 22:40:10 UTC 2023","Tue Jun 13 22:40:11 UTC 2023","920","","Privacy policy: for an online user","","Privacy policy: for an online user","should not show on refresh","should not show on refresh",""
"passed","Tue Jun 13 23:00:40 UTC 2023","Tue Jun 13 23:00:42 UTC 2023","1726","","Bikram Sambat date display","","Bikram Sambat date display","should display report list dates converted to bikram sambat","should display report list dates converted to bikram sambat",""
"passed","Tue Jun 13 22:37:54 UTC 2023","Tue Jun 13 22:37:54 UTC 2023","476","","- permissions disabled: - export permissions disabled","","- permissions disabled: - export permissions disabled","- Message tab","- Message tab",""
"passed","Tue Jun 13 22:44:25 UTC 2023","Tue Jun 13 22:44:30 UTC 2023","5801","","Export Reports","","Export Reports","Should download export file","Should download export file",""
"passed","Tue Jun 13 22:38:37 UTC 2023","Tue Jun 13 22:38:42 UTC 2023","4238","","bfcache: login page","","bfcache: login page","should redirect to the app page when session is valid","should redirect to the app page when session is valid",""
"passed","Tue Jun 13 22:51:22 UTC 2023","Tue Jun 13 22:51:27 UTC 2023","4526","","Tasks group landing page: for chw","","Tasks group landing page: for chw","should have tasks","should have tasks",""
"passed","Tue Jun 13 22:46:24 UTC 2023","Tue Jun 13 22:46:29 UTC 2023","5797","","Service worker cache","","Service worker cache","adding new languages triggers login page refresh","adding new languages triggers login page refresh",""
"passed","Tue Jun 13 22:33:39 UTC 2023","Tue Jun 13 22:33:40 UTC 2023","298","","Training Cards","","Training Cards","should not display completed training","should not display completed training",""
"passed","Tue Jun 13 22:38:56 UTC 2023","Tue Jun 13 22:38:56 UTC 2023","281","","Hamburger Menu tests","","Hamburger Menu tests","should open User settings","should open User settings",""
"passed","Tue Jun 13 22:29:32 UTC 2023","Tue Jun 13 22:29:57 UTC 2023","25302","","Extension lib xpath function","","Extension lib xpath function","calculate average","calculate average",""
"passed","Tue Jun 13 22:46:42 UTC 2023","Tue Jun 13 22:46:42 UTC 2023","139","","africas talking api","","africas talking api","""before all"" hook for africas talking api","""before all"" hook for africas talking api",""
"passed","Tue Jun 13 22:55:57 UTC 2023","Tue Jun 13 22:56:21 UTC 2023","24100","","Create user for contacts: user replace: for an offline user","","Create user for contacts: user replace: for an offline user","does not assign new person as primary contact of parent place if original person was not primary","does not assign new person as primary contact of parent place if original person was not primary",""
"passed","Tue Jun 13 22:47:54 UTC 2023","Tue Jun 13 22:47:57 UTC 2023","2255","","RapidPro SMS Gateway: Webapp Terminating messages","","RapidPro SMS Gateway: Webapp Terminating messages","should fail with no incoming key configured","should fail with no incoming key configured",""
"passed","Tue Jun 13 22:51:31 UTC 2023","Tue Jun 13 22:51:34 UTC 2023","2306","","Tasks group landing page: for chw","","Tasks group landing page: for chw","should open task from the same group","should open task from the same group",""
"passed","Tue Jun 13 22:52:52 UTC 2023","Tue Jun 13 22:53:09 UTC 2023","17177","","Create user when adding contact","","Create user when adding contact","Creates a new user when adding a person while adding a place","Creates a new user when adding a person while adding a place",""
"passed","Tue Jun 13 22:18:26 UTC 2023","Tue Jun 13 22:18:30 UTC 2023","4109","","Add new district tests : ","","Add new district tests : ","should edit district with contact_type","should edit district with contact_type",""
"passed","Tue Jun 13 22:37:15 UTC 2023","Tue Jun 13 22:37:15 UTC 2023","878","","- DELETE permissions disabled","","- DELETE permissions disabled","- Report tab - delete menu not displayed when xml report selected","- Report tab - delete menu not displayed when xml report selected",""
"passed","Tue Jun 13 23:01:32 UTC 2023","Tue Jun 13 23:01:36 UTC 2023","4418","","User Test Cases ->: Invalid entries -> ","","User Test Cases ->: Invalid entries -> ","TestCase for The password must be at least 8 characters long.","TestCase for The password must be at least 8 characters long.",""
"passed","Tue Jun 13 22:39:57 UTC 2023","Tue Jun 13 22:40:02 UTC 2023","5122","","Privacy policy: for an offline user","","Privacy policy: for an offline user","should show if the user policy changes","should show if the user policy changes",""
"passed","Tue Jun 13 22:15:31 UTC 2023","Tue Jun 13 22:15:34 UTC 2023","2910","","About page","","About page","should display partners","should display partners",""
"passed","Tue Jun 13 22:36:28 UTC 2023","Tue Jun 13 22:36:30 UTC 2023","1366","","More Options Menu - Offline User: all permissions enabled","","More Options Menu - Offline User: all permissions enabled"," - Contact Tab - contact selected"," - Contact Tab - contact selected",""
"passed","Tue Jun 13 22:45:15 UTC 2023","Tue Jun 13 22:45:19 UTC 2023","3390","","Reports Subject","","Reports Subject","should create a report using unknown place_id","should create a report using unknown place_id",""
"passed","Tue Jun 13 22:33:36 UTC 2023","Tue Jun 13 22:33:39 UTC 2023","3252","","Training Cards","","Training Cards","should display training after reload and complete training","should display training after reload and complete training",""
"passed","Tue Jun 13 22:16:10 UTC 2023","Tue Jun 13 22:16:18 UTC 2023","7903","","Targets","","Targets","should display targets from default config","should display targets from default config",""
"passed","Tue Jun 13 22:35:23 UTC 2023","Tue Jun 13 22:35:28 UTC 2023","4966","","Login page funcionality tests: Log in","","Login page funcionality tests: Log in","should display the ""session expired"" modal and redirect to login page","should display the ""session expired"" modal and redirect to login page",""
"passed","Tue Jun 13 23:00:53 UTC 2023","Tue Jun 13 23:01:00 UTC 2023","6520","","Adding new language","","Adding new language","should show in enabled language list","should show in enabled language list",""
"passed","Tue Jun 13 22:47:57 UTC 2023","Tue Jun 13 22:47:58 UTC 2023","1124","","RapidPro SMS Gateway: Webapp Terminating messages","","RapidPro SMS Gateway: Webapp Terminating messages","should fail with no authentication provided","should fail with no authentication provided",""
"passed","Tue Jun 13 22:16:26 UTC 2023","Tue Jun 13 22:16:30 UTC 2023","4316","","Targets","","Targets","should display correct message when targets are disabled","should display correct message when targets are disabled",""
"passed","Tue Jun 13 22:30:16 UTC 2023","Tue Jun 13 22:30:17 UTC 2023","1269","","Contact Delivery Form","","Contact Delivery Form","The child registered during birth should be created and should display the proper information","The child registered during birth should be created and should display the proper information",""
"passed","Tue Jun 13 22:18:17 UTC 2023","Tue Jun 13 22:18:23 UTC 2023","6096","","Add new district tests : ","","Add new district tests : ","should add new district with a new person","should add new district with a new person",""
"passed","Tue Jun 13 22:38:27 UTC 2023","Tue Jun 13 22:38:29 UTC 2023","2076","","Online User:  - Options enabled when there are items","","Online User:  - Options enabled when there are items","- Reports tab - options enabled when XML report selected","- Reports tab - options enabled when XML report selected",""
"passed","Tue Jun 13 22:46:34 UTC 2023","Tue Jun 13 22:46:35 UTC 2023","809","","Service worker cache","","Service worker cache","should load the page while offline","should load the page while offline",""
"passed","Tue Jun 13 22:33:58 UTC 2023","Tue Jun 13 22:34:02 UTC 2023","4405","","Unauthorized form","","Unauthorized form","should not display unauthorized error message in contacts tab when user has the form permission","should not display unauthorized error message in contacts tab when user has the form permission",""
"passed","Tue Jun 13 22:48:21 UTC 2023","Tue Jun 13 22:48:25 UTC 2023","3189","","RapidPro SMS Gateway: Webapp originating messages and state updates","","RapidPro SMS Gateway: Webapp originating messages and state updates","should not poll messages for docs that are in pending or scheduled states or lack gateway ref ","should not poll messages for docs that are in pending or scheduled states or lack gateway ref ",""
"passed","Tue Jun 13 22:44:48 UTC 2023","Tue Jun 13 22:44:55 UTC 2023","7024","","Reports Subject","","Reports Subject","should create a report using patient_id","should create a report using patient_id",""
"passed","Tue Jun 13 22:51:51 UTC 2023","Tue Jun 13 22:51:57 UTC 2023","5444","","Tasks group landing page: for supervisor","","Tasks group landing page: for supervisor","should have tasks","should have tasks",""
"passed","Tue Jun 13 22:39:56 UTC 2023","Tue Jun 13 22:39:57 UTC 2023","1486","","Privacy policy: for an offline user","","Privacy policy: for an offline user","should show if the user changes their language","should show if the user changes their language",""
"skipped","Tue Jun 13 22:26:54 UTC 2023","Tue Jun 13 22:27:09 UTC 2023","14577","","Family form","","Family form","Submit Add Family form","Submit Add Family form",""
"passed","Tue Jun 13 22:37:14 UTC 2023","Tue Jun 13 22:37:15 UTC 2023","138","","- DELETE permissions disabled","","- DELETE permissions disabled","- Report tab - delete menu not displayed when sms report selected","- Report tab - delete menu not displayed when sms report selected",""
"passed","Tue Jun 13 22:30:43 UTC 2023","Tue Jun 13 22:30:54 UTC 2023","11513","","Pregnancy danger sign follow-up form","","Pregnancy danger sign follow-up form","should submit and edit Pregnancy danger sign follow-up form with changes","should submit and edit Pregnancy danger sign follow-up form with changes",""
"passed","Tue Jun 13 23:00:43 UTC 2023","Tue Jun 13 23:00:44 UTC 2023","1332","","Bikram Sambat date display","","Bikram Sambat date display","SMS report shows bsDate type as date field correctly","SMS report shows bsDate type as date field correctly",""
"passed","Tue Jun 13 23:00:15 UTC 2023","Tue Jun 13 23:00:19 UTC 2023","3820","","MessageFormat","","MessageFormat","should display plurals correctly","should display plurals correctly",""
"passed","Tue Jun 13 22:49:58 UTC 2023","Tue Jun 13 22:50:05 UTC 2023","6872","","Target aggregates: as a user with a home place","","Target aggregates: as a user with a home place","should route to contact-detail on list item click and display contact summary target card","should route to contact-detail on list item click and display contact summary target card",""
"passed","Tue Jun 13 22:38:15 UTC 2023","Tue Jun 13 22:38:17 UTC 2023","2395","","Online User:  - Contact tab - user has no contact ","","Online User:  - Contact tab - user has no contact "," - no contact selected"," - no contact selected",""
"passed","Tue Jun 13 22:49:24 UTC 2023","Tue Jun 13 22:49:27 UTC 2023","3349","","Send message","","Send message","should send a message using FAB at people's tab","should send a message using FAB at people's tab",""
"passed","Tue Jun 13 22:48:49 UTC 2023","Tue Jun 13 22:48:49 UTC 2023","13","","RapidPro SMS Gateway","","RapidPro SMS Gateway","""after all"" hook for RapidPro SMS Gateway","""after all"" hook for RapidPro SMS Gateway",""
"passed","Tue Jun 13 22:34:08 UTC 2023","Tue Jun 13 22:34:52 UTC 2023","43887","","Submit an undo death report","","Submit an undo death report","Should submit an undo death report","Should submit an undo death report",""
"passed","Tue Jun 13 22:23:36 UTC 2023","Tue Jun 13 22:23:38 UTC 2023","1594","","db-sync","","db-sync","should filter locally purged docs","should filter locally purged docs",""
"passed","Tue Jun 13 22:32:23 UTC 2023","Tue Jun 13 22:32:30 UTC 2023","6617","","Submit Enketo form","","Submit Enketo form","submits on reports tab","submits on reports tab",""
"passed","Tue Jun 13 22:39:43 UTC 2023","Tue Jun 13 22:39:49 UTC 2023","6057","","Privacy policy: for an offline user","","Privacy policy: for an offline user","should not show on subsequent login","should not show on subsequent login",""
"passed","Tue Jun 13 22:33:33 UTC 2023","Tue Jun 13 22:33:36 UTC 2023","3148","","Training Cards","","Training Cards","should display training after it was canceled and the training doc was updated","should display training after it was canceled and the training doc was updated",""
"passed","Tue Jun 13 22:38:25 UTC 2023","Tue Jun 13 22:38:27 UTC 2023","1427","","Online User:  - Options enabled when there are items","","Online User:  - Options enabled when there are items","- Message tab","- Message tab",""
"passed","Tue Jun 13 22:50:35 UTC 2023","Tue Jun 13 22:50:43 UTC 2023","8223","","Task list due dates","","Task list due dates","should display correct due dates with taskDaysOverdue setting and simple translation","should display correct due dates with taskDaysOverdue setting and simple translation",""
"passed","Tue Jun 13 22:51:03 UTC 2023","Tue Jun 13 22:51:07 UTC 2023","4665","","Tasks tab breadcrumbs: for supervisor","","Tasks tab breadcrumbs: for supervisor","should display correct tasks with breadcrumbs for supervisor","should display correct tasks with breadcrumbs for supervisor",""
"passed","Tue Jun 13 22:48:17 UTC 2023","Tue Jun 13 22:48:21 UTC 2023","4097","","RapidPro SMS Gateway: Webapp originating messages and state updates","","RapidPro SMS Gateway: Webapp originating messages and state updates","should update the states correctly from messages api","should update the states correctly from messages api",""
"passed","Tue Jun 13 23:01:41 UTC 2023","Tue Jun 13 23:01:45 UTC 2023","4313","","User Test Cases ->: Invalid entries -> ","","User Test Cases ->: Invalid entries -> ","TestCase for Passwords must match","TestCase for Passwords must match",""
"passed","Tue Jun 13 22:31:14 UTC 2023","Tue Jun 13 22:31:25 UTC 2023","10548","","Pregnancy registration","","Pregnancy registration","Should submit a new pregnancy","Should submit a new pregnancy",""
"passed","Tue Jun 13 22:45:40 UTC 2023","Tue Jun 13 22:45:46 UTC 2023","5264","","Test Reports Search Functionality","","Test Reports Search Functionality","search by NON empty string should display results with contains match and then clears","search by NON empty string should display results with contains match and then clears",""
"passed","Tue Jun 13 22:36:57 UTC 2023","Tue Jun 13 22:37:14 UTC 2023","17646","","- DELETE permissions disabled","","- DELETE permissions disabled"," - Contact Tab - delete contact selected"," - Contact Tab - delete contact selected",""
"passed","Tue Jun 13 22:47:15 UTC 2023","Tue Jun 13 22:47:17 UTC 2023","1451","","sms-gateway api: - api returns list of pending WO messages","","sms-gateway api: - api returns list of pending WO messages","- returns list and updates state","- returns list and updates state",""
"passed","Tue Jun 13 22:46:29 UTC 2023","Tue Jun 13 22:46:34 UTC 2023","4998","","Service worker cache","","Service worker cache","other translation updates do not trigger a login page refresh","other translation updates do not trigger a login page refresh",""
"passed","Tue Jun 13 22:20:29 UTC 2023","Tue Jun 13 22:20:31 UTC 2023","1393","","Mute/Unmute contacts using a specific form.","","Mute/Unmute contacts using a specific form.","Should show a popup when trying to submit a non-unmuting form against a muted contact","Should show a popup when trying to submit a non-unmuting form against a muted contact",""
"passed","Tue Jun 13 22:39:06 UTC 2023","Tue Jun 13 22:39:09 UTC 2023","3274","","Navigation tests: Navigation functionality","","Navigation tests: Navigation functionality","should open Messages tab","should open Messages tab",""
"passed","Tue Jun 13 22:47:10 UTC 2023","Tue Jun 13 22:47:11 UTC 2023","1828","","sms-gateway api","","sms-gateway api","""before all"" hook for sms-gateway api","""before all"" hook for sms-gateway api",""
"passed","Tue Jun 13 23:01:27 UTC 2023","Tue Jun 13 23:01:32 UTC 2023","4897","","User Test Cases ->: Creating Users ->","","User Test Cases ->: Creating Users ->","should add user with valid password","should add user with valid password",""
"passed","Tue Jun 13 22:49:19 UTC 2023","Tue Jun 13 22:49:24 UTC 2023","4669","","Send message","","Send message","should reply to an existing message and add a new recipient - contact with a phone number ","should reply to an existing message and add a new recipient - contact with a phone number ",""
"passed","Tue Jun 13 22:53:35 UTC 2023","Tue Jun 13 22:53:46 UTC 2023","10937","","Create user when adding contact","","Create user when adding contact","Does not create a new user when the transition fails","Does not create a new user when the transition fails",""
"passed","Tue Jun 13 22:45:02 UTC 2023","Tue Jun 13 22:45:05 UTC 2023","3107","","Reports Subject","","Reports Subject","should create a report using patient name","should create a report using patient name",""
"passed","Tue Jun 13 22:43:44 UTC 2023","Tue Jun 13 22:43:51 UTC 2023","7239","","Bulk delete reports","","Bulk delete reports","should select, deselect and delete only selected reports","should select, deselect and delete only selected reports",""
"passed","Tue Jun 13 22:37:38 UTC 2023","Tue Jun 13 22:37:39 UTC 2023","144","","- EDIT permissions disabled","","- EDIT permissions disabled","- Report tab - menu not displayed when sms report selected","- Report tab - menu not displayed when sms report selected",""
"passed","Tue Jun 13 22:57:12 UTC 2023","Tue Jun 13 22:57:41 UTC 2023","29013","","Create user for contacts: user replace: for an offline user","","Create user for contacts: user replace: for an offline user","creates new user when replace_user form is submitted for contact associated with multiple users","creates new user when replace_user form is submitted for contact associated with multiple users",""
"passed","Tue Jun 13 22:17:56 UTC 2023","Tue Jun 13 22:18:09 UTC 2023","12956","","Creating custom places","","Creating custom places","should show custom places in their own list","should show custom places in their own list",""
"passed","Tue Jun 13 22:38:07 UTC 2023","Tue Jun 13 22:38:12 UTC 2023","4732","","Online User: Options disabled when no items - messages, contacts, people","","Online User: Options disabled when no items - messages, contacts, people","- Message tab","- Message tab",""
"passed","Tue Jun 13 22:49:49 UTC 2023","Tue Jun 13 22:49:58 UTC 2023","8595","","Target aggregates: as a user with a home place","","Target aggregates: as a user with a home place","should display correct data","should display correct data",""
"passed","Tue Jun 13 22:38:00 UTC 2023","Tue Jun 13 22:38:01 UTC 2023","1163","","- permissions disabled: - EDIT permissions disabled","","- permissions disabled: - EDIT permissions disabled","- Report Tab - option disabled when report selected","- Report Tab - option disabled when report selected",""
"passed","Tue Jun 13 22:30:36 UTC 2023","Tue Jun 13 22:30:43 UTC 2023","6770","","Pregnancy danger sign follow-up form","","Pregnancy danger sign follow-up form","should submit and edit Pregnancy danger sign follow-up form (no changes)","should submit and edit Pregnancy danger sign follow-up form (no changes)",""
"passed","Tue Jun 13 22:40:16 UTC 2023","Tue Jun 13 22:40:21 UTC 2023","5168","","Privacy policy: for an online user","","Privacy policy: for an online user","should show french policy on secondary login","should show french policy on secondary login",""
"passed","Tue Jun 13 22:21:10 UTC 2023","Tue Jun 13 22:21:15 UTC 2023","5168","","Create new lineage structure","","Create new lineage structure","should delete the primary contact of health facility","should delete the primary contact of health facility",""
"passed","Tue Jun 13 22:39:12 UTC 2023","Tue Jun 13 22:39:14 UTC 2023","1533","","Navigation tests: Navigation functionality","","Navigation tests: Navigation functionality","should open Contacts or Peoples tab","should open Contacts or Peoples tab",""
"passed","Tue Jun 13 22:23:43 UTC 2023","Tue Jun 13 22:23:49 UTC 2023","5607","","db-sync: meta db replication","","db-sync: meta db replication","should replicate meta db down","should replicate meta db down",""
"passed","Tue Jun 13 22:54:33 UTC 2023","Tue Jun 13 22:54:45 UTC 2023","12660","","Create user for contacts: user replace","","Create user for contacts: user replace","does not create a new user when the replace_user form is submitted for online user","does not create a new user when the replace_user form is submitted for online user",""
"passed","Tue Jun 13 22:36:07 UTC 2023","Tue Jun 13 22:36:08 UTC 2023","1166","","Token login","","Token login","should display an error when accessing with random strings","should display an error when accessing with random strings",""
"passed","Tue Jun 13 22:43:33 UTC 2023","Tue Jun 13 22:43:38 UTC 2023","4433","","Reports tab breadcrumbs","","Reports tab breadcrumbs","should display reports with updated breadcrumbs for offline user","should display reports with updated breadcrumbs for offline user",""
"passed","Tue Jun 13 22:38:42 UTC 2023","Tue Jun 13 22:38:45 UTC 2023","3198","","bfcache: webapp","","bfcache: webapp","should redirect to login page when session is expired","should redirect to login page when session is expired",""
"passed","Tue Jun 13 22:38:56 UTC 2023","Tue Jun 13 22:38:57 UTC 2023","829","","Hamburger Menu tests","","Hamburger Menu tests","should open Report bug","should open Report bug",""
