"Status","Start Time","Stop Time","Duration in ms","Parent Suite","Suite","Sub Suite","Test Class","Test Method","Name","Description"
"passed","Tue Feb 21 00:16:42 UTC 2023","Tue Feb 21 00:16:42 UTC 2023","598","","manifest.json","","manifest.json","works with custom branding doc","works with custom branding doc",""
"passed","Mon Feb 20 23:55:21 UTC 2023","Mon Feb 20 23:55:39 UTC 2023","17987","","Create user for contacts: for an offline user","","Create user for contacts: for an offline user","does not create a new user or re-parent reports when the transition is disabled","does not create a new user or re-parent reports when the transition is disabled",""
"passed","Tue Feb 21 00:12:49 UTC 2023","Tue Feb 21 00:12:51 UTC 2023","2319","","bfcache: webapp","","bfcache: webapp","should redirect to login page when session is expired","should redirect to login page when session is expired",""
"passed","Tue Feb 21 00:11:04 UTC 2023","Tue Feb 21 00:11:28 UTC 2023","23101","","- DELETE permissions disabled","","- DELETE permissions disabled"," - Contact Tab - delete contact selected"," - Contact Tab - delete contact selected",""
"passed","Tue Feb 21 00:14:47 UTC 2023","Tue Feb 21 00:14:47 UTC 2023","595","","Privacy policy: for an online user","","Privacy policy: for an online user","should display when navigating to the privacy policy page","should display when navigating to the privacy policy page",""
"passed","Tue Feb 21 00:04:33 UTC 2023","Tue Feb 21 00:04:34 UTC 2023","657","","Pregnancy registration","","Pregnancy registration","Should verify that the report related the pregnancy was created","Should verify that the report related the pregnancy was created",""
"passed","Tue Feb 21 00:10:42 UTC 2023","Tue Feb 21 00:10:44 UTC 2023","1347","","More Options Menu - Offline User: all permissions enabled","","More Options Menu - Offline User: all permissions enabled","Report tab - options enabled when xml report selected","Report tab - options enabled when xml report selected",""
"passed","Tue Feb 21 00:09:27 UTC 2023","Tue Feb 21 00:09:47 UTC 2023","20435","","Login and logout tests","","Login and logout tests","should display the ""session expired"" modal and redirect to login page","should display the ""session expired"" modal and redirect to login page",""
"passed","Tue Feb 21 00:23:10 UTC 2023","Tue Feb 21 00:23:13 UTC 2023","3168","","Tasks group landing page: for supervisor","","Tasks group landing page: for supervisor","should not display task landing page after task completion","should not display task landing page after task completion",""
"passed","Mon Feb 20 23:53:22 UTC 2023","Mon Feb 20 23:53:56 UTC 2023","34040","","Create user for contacts: for an offline user","","Create user for contacts: for an offline user","creates new user from latest replace_user form data if multiple are submitted before syncing","creates new user from latest replace_user form data if multiple are submitted before syncing",""
"passed","Mon Feb 20 23:59:48 UTC 2023","Mon Feb 20 23:59:53 UTC 2023","4991","","Create new lineage structure","","Create new lineage structure","Create new health center","Create new health center",""
"passed","Tue Feb 21 00:22:41 UTC 2023","Tue Feb 21 00:22:46 UTC 2023","4262","","Tasks group landing page: for chw","","Tasks group landing page: for chw","should display modal when clicking on a task from another group","should display modal when clicking on a task from another group",""
"passed","Tue Feb 21 00:24:03 UTC 2023","Tue Feb 21 00:24:06 UTC 2023","2318","","Adding new language","","Adding new language","should reflect in config wizard","should reflect in config wizard",""
"passed","Tue Feb 21 00:23:48 UTC 2023","Tue Feb 21 00:23:51 UTC 2023","2826","","Bikram Sambat date display","","Bikram Sambat date display","SMS report shows bsAggreDate type as date field correctly","SMS report shows bsAggreDate type as date field correctly",""
"passed","Mon Feb 20 23:57:40 UTC 2023","Mon Feb 20 23:57:44 UTC 2023","3514","","Add new district tests : ","","Add new district tests : ","should edit district with contact_type","should edit district with contact_type",""
"passed","Tue Feb 21 00:22:46 UTC 2023","Tue Feb 21 00:22:49 UTC 2023","3584","","Tasks group landing page: for chw","","Tasks group landing page: for chw","should not display modal when clicking list task from same group","should not display modal when clicking list task from same group",""
"passed","Tue Feb 21 00:07:26 UTC 2023","Tue Feb 21 00:07:27 UTC 2023","910","","Submit Enketo form","","Submit Enketo form","cancelling form with no input does not trigger confirmation dialog","cancelling form with no input does not trigger confirmation dialog",""
"passed","Tue Feb 21 00:13:14 UTC 2023","Tue Feb 21 00:13:17 UTC 2023","3411","","Navigation tests","","Navigation tests","should open Messages tab","should open Messages tab",""
"passed","Tue Feb 21 00:03:09 UTC 2023","Tue Feb 21 00:03:25 UTC 2023","16310","","Contact Delivery Form","","Contact Delivery Form","Complete a delivery: Process a delivery with a live child and facility birth.","Complete a delivery: Process a delivery with a live child and facility birth.",""
"passed","Mon Feb 20 23:58:40 UTC 2023","Mon Feb 20 23:58:46 UTC 2023","5337","","Export Contacts","","Export Contacts","Should download export file","Should download export file",""
"passed","Tue Feb 21 00:21:38 UTC 2023","Tue Feb 21 00:21:46 UTC 2023","8068","","Tasks tab breadcrumbs","","Tasks tab breadcrumbs","""before all"" hook for Tasks tab breadcrumbs","""before all"" hook for Tasks tab breadcrumbs",""
"passed","Mon Feb 20 23:59:53 UTC 2023","Mon Feb 20 23:59:57 UTC 2023","3882","","Create new lineage structure","","Create new lineage structure","Create new area","Create new area",""
"passed","Tue Feb 21 00:18:32 UTC 2023","Tue Feb 21 00:18:47 UTC 2023","14578","","Reports Sidebar Filter","","Reports Sidebar Filter","should filter by date","should filter by date",""
"passed","Tue Feb 21 00:13:03 UTC 2023","Tue Feb 21 00:13:05 UTC 2023","1838","","Hamburger Menu tests","","Hamburger Menu tests","should open About","should open About",""
"passed","Tue Feb 21 00:10:38 UTC 2023","Tue Feb 21 00:10:39 UTC 2023","1368","","More Options Menu - Offline User: all permissions enabled","","More Options Menu - Offline User: all permissions enabled"," - Contact Tab - contact selected"," - Contact Tab - contact selected",""
"passed","Tue Feb 21 00:00:16 UTC 2023","Tue Feb 21 00:00:21 UTC 2023","4926","","Create new lineage structure","","Create new lineage structure","should delete the primary contact of health facility","should delete the primary contact of health facility",""
"passed","Tue Feb 21 00:09:53 UTC 2023","Tue Feb 21 00:09:59 UTC 2023","5817","","should renew token","","should renew token","Refresh page multiple times and verify token gets renewed","Refresh page multiple times and verify token gets renewed",""
"passed","Tue Feb 21 00:12:31 UTC 2023","Tue Feb 21 00:12:32 UTC 2023","1329","","Online User: Options disabled when no items - messages, contacts, people","","Online User: Options disabled when no items - messages, contacts, people","- Report tab","- Report tab",""
"passed","Tue Feb 21 00:12:12 UTC 2023","Tue Feb 21 00:12:14 UTC 2023","2126","","- permissions disabled: - DELETE permissions disabled","","- permissions disabled: - DELETE permissions disabled"," - Contact Tab - contact selected"," - Contact Tab - contact selected",""
"passed","Tue Feb 21 00:24:34 UTC 2023","Tue Feb 21 00:24:39 UTC 2023","4258","","User Test Cases ->: Invalid entries -> ","","User Test Cases ->: Invalid entries -> ","TestCase for The password must be at least 8 characters long.","TestCase for The password must be at least 8 characters long.",""
"passed","Tue Feb 21 00:21:23 UTC 2023","Tue Feb 21 00:21:31 UTC 2023","8437","","Task list due dates","","Task list due dates","should display correct due dates with taskDaysOverdue setting and simple translation","should display correct due dates with taskDaysOverdue setting and simple translation",""
"passed","Tue Feb 21 00:11:28 UTC 2023","Tue Feb 21 00:11:28 UTC 2023","142","","- DELETE permissions disabled","","- DELETE permissions disabled","- Report tab - delete menu not displayed when sms report selected","- Report tab - delete menu not displayed when sms report selected",""
"passed","Mon Feb 20 23:54:33 UTC 2023","Mon Feb 20 23:55:21 UTC 2023","48517","","Create user for contacts: for an offline user","","Create user for contacts: for an offline user","creates new user for the first version of a contact to sync and conflicting replacements ignored","creates new user for the first version of a contact to sync and conflicting replacements ignored",""
"passed","Tue Feb 21 00:10:36 UTC 2023","Tue Feb 21 00:10:38 UTC 2023","1421","","More Options Menu - Offline User: all permissions enabled","","More Options Menu - Offline User: all permissions enabled","- Contact tab - no contact selected","- Contact tab - no contact selected",""
"passed","Mon Feb 20 23:56:18 UTC 2023","Mon Feb 20 23:56:28 UTC 2023","9683","","Creating custom places","","Creating custom places","the LHS add place button should show the appropriate title","the LHS add place button should show the appropriate title",""
"passed","Mon Feb 20 23:58:16 UTC 2023","Mon Feb 20 23:58:30 UTC 2023","13878","","Edit contacts with the default config. ","","Edit contacts with the default config. ","should edit contact name","should edit contact name",""
"passed","Tue Feb 21 00:01:37 UTC 2023","Tue Feb 21 00:01:40 UTC 2023","3102","","db-sync","","db-sync","should filter ddocs","should filter ddocs",""
"passed","Tue Feb 21 00:25:00 UTC 2023","Tue Feb 21 00:25:02 UTC 2023","1761","","User Test Cases ->: Invalid entries -> ","","User Test Cases ->: Invalid entries -> ","should require place and contact for restricted user","should require place and contact for restricted user",""
"passed","Mon Feb 20 23:56:48 UTC 2023","Mon Feb 20 23:56:58 UTC 2023","9876","","Creating custom places","","Creating custom places","the RHS add place button should show the add place title","the RHS add place button should show the add place title",""
"passed","Tue Feb 21 00:14:05 UTC 2023","Tue Feb 21 00:14:05 UTC 2023","85","","Privacy policy: for an offline user","","Privacy policy: for an offline user","should display when navigating to the privacy policy page","should display when navigating to the privacy policy page",""
"passed","Tue Feb 21 00:12:37 UTC 2023","Tue Feb 21 00:12:38 UTC 2023","675","","Online User:  - Options enabled when there are items","","Online User:  - Options enabled when there are items","- Reports tab - options enabled when XML report selected","- Reports tab - options enabled when XML report selected",""
"passed","Tue Feb 21 00:07:24 UTC 2023","Tue Feb 21 00:07:26 UTC 2023","1458","","Submit Enketo form","","Submit Enketo form","allows forms with required notes to be submitted","allows forms with required notes to be submitted",""
"passed","Tue Feb 21 00:02:08 UTC 2023","Tue Feb 21 00:02:39 UTC 2023","30198","","Submit a death report","","Submit a death report","Should submit a death report","Should submit a death report",""
"passed","Tue Feb 21 00:09:17 UTC 2023","Tue Feb 21 00:09:22 UTC 2023","4693","","Login and logout tests","","Login and logout tests","should log in using username and password fields","should log in using username and password fields",""
"passed","Tue Feb 21 00:10:39 UTC 2023","Tue Feb 21 00:10:40 UTC 2023","1397","","More Options Menu - Offline User: all permissions enabled","","More Options Menu - Offline User: all permissions enabled"," - Contact Tab - with same facility_id"," - Contact Tab - with same facility_id",""
"passed","Tue Feb 21 00:10:10 UTC 2023","Tue Feb 21 00:10:11 UTC 2023","1186","","Token login","","Token login","should display an error with incorrect url","should display an error with incorrect url",""
"passed","Mon Feb 20 23:55:39 UTC 2023","Mon Feb 20 23:56:13 UTC 2023","33409","","Create user for contacts: for an offline user","","Create user for contacts: for an offline user","does not create any new user nor does it reparent new reports when the transition fails","does not create any new user nor does it reparent new reports when the transition fails",""
"passed","Tue Feb 21 00:24:02 UTC 2023","Tue Feb 21 00:24:03 UTC 2023","1225","","Adding new language","","Adding new language","should be set as Default language ","should be set as Default language ",""
"passed","Tue Feb 21 00:01:53 UTC 2023","Tue Feb 21 00:02:03 UTC 2023","9514","","Family form","","Family form","Submit Add Family form","Submit Add Family form",""
"passed","Tue Feb 21 00:23:46 UTC 2023","Tue Feb 21 00:23:48 UTC 2023","1551","","Bikram Sambat date display","","Bikram Sambat date display","SMS report shows bsDate type as date field correctly","SMS report shows bsDate type as date field correctly",""
"passed","Tue Feb 21 00:03:25 UTC 2023","Tue Feb 21 00:03:26 UTC 2023","658","","Contact Delivery Form","","Contact Delivery Form","The past pregnancy card should show","The past pregnancy card should show",""
"passed","Tue Feb 21 00:15:00 UTC 2023","Tue Feb 21 00:15:03 UTC 2023","2925","","Privacy policy: for an online user","","Privacy policy: for an online user","should show if the user policy changes","should show if the user policy changes",""
"passed","Mon Feb 20 23:57:37 UTC 2023","Mon Feb 20 23:57:40 UTC 2023","3307","","Add new district tests : ","","Add new district tests : ","should edit district","should edit district",""
"passed","Tue Feb 21 00:19:37 UTC 2023","Tue Feb 21 00:19:41 UTC 2023","4186","","Service worker cache","","Service worker cache","other translation updates do not trigger a login page refresh","other translation updates do not trigger a login page refresh",""
"passed","Tue Feb 21 00:05:19 UTC 2023","Tue Feb 21 00:05:49 UTC 2023","29536","","Submit Default Delivery Report","","Submit Default Delivery Report","open, submit and edit (no changes) default delivery form","open, submit and edit (no changes) default delivery form",""
"passed","Tue Feb 21 00:12:29 UTC 2023","Tue Feb 21 00:12:31 UTC 2023","1396","","Online User: Options disabled when no items - messages, contacts, people","","Online User: Options disabled when no items - messages, contacts, people"," - Contact tab"," - Contact tab",""
"passed","Tue Feb 21 00:01:40 UTC 2023","Tue Feb 21 00:01:42 UTC 2023","2249","","db-sync: meta db replication","","db-sync: meta db replication","should replicate meta db up","should replicate meta db up",""
"passed","Mon Feb 20 23:51:50 UTC 2023","Mon Feb 20 23:52:27 UTC 2023","36848","","Create user for contacts: for an offline user","","Create user for contacts: for an offline user","creates a new user and re-parents reports when the replace_user form is submitted","creates a new user and re-parents reports when the replace_user form is submitted",""
"passed","Tue Feb 21 00:07:41 UTC 2023","Tue Feb 21 00:07:45 UTC 2023","4067","","Submit Photo Upload form","","Submit Photo Upload form","submit and edit (with changes)","submit and edit (with changes)",""
"passed","Tue Feb 21 00:12:38 UTC 2023","Tue Feb 21 00:12:39 UTC 2023","660","","Online User:  - Options enabled when there are items","","Online User:  - Options enabled when there are items"," - Contact Tab  - contact selected"," - Contact Tab  - contact selected",""
"passed","Mon Feb 20 23:56:39 UTC 2023","Mon Feb 20 23:56:48 UTC 2023","9308","","Creating custom places","","Creating custom places","the RHS add place button should show the custom title","the RHS add place button should show the custom title",""
"passed","Tue Feb 21 00:24:06 UTC 2023","Tue Feb 21 00:24:10 UTC 2023","4219","","Adding new language","","Adding new language","should add new translations","should add new translations",""
"passed","Tue Feb 21 00:07:27 UTC 2023","Tue Feb 21 00:07:28 UTC 2023","1417","","Submit Enketo form","","Submit Enketo form","cancelling form with input triggers confirmation dialog box","cancelling form with input triggers confirmation dialog box",""
"passed","Tue Feb 21 00:01:35 UTC 2023","Tue Feb 21 00:01:37 UTC 2023","1478","","db-sync","","db-sync","should filter locally purged docs","should filter locally purged docs",""
"passed","Tue Feb 21 00:02:57 UTC 2023","Tue Feb 21 00:03:03 UTC 2023","6423","","Edit report with attachmnet","","Edit report with attachmnet","should save edits","should save edits",""
"passed","Tue Feb 21 00:10:59 UTC 2023","Tue Feb 21 00:10:59 UTC 2023","36","","More Options Menu - Offline User","","More Options Menu - Offline User","""after all"" hook for More Options Menu - Offline User","""after all"" hook for More Options Menu - Offline User",""
"passed","Tue Feb 21 00:12:51 UTC 2023","Tue Feb 21 00:12:54 UTC 2023","2749","","bfcache: admin app","","bfcache: admin app","should redirect to login page when session is expired","should redirect to login page when session is expired",""
"passed","Tue Feb 21 00:23:46 UTC 2023","Tue Feb 21 00:23:46 UTC 2023","955","","Bikram Sambat date display","","Bikram Sambat date display","should convert contact summary dates to bikram sambat when language is Nepali","should convert contact summary dates to bikram sambat when language is Nepali",""
"passed","Tue Feb 21 00:04:04 UTC 2023","Tue Feb 21 00:04:12 UTC 2023","7654","","Pregnancy Visit","","Pregnancy Visit","Submit and validate Pregnancy Visit form and keeps the report minified","Submit and validate Pregnancy Visit form and keeps the report minified",""
"passed","Tue Feb 21 00:09:09 UTC 2023","Tue Feb 21 00:09:12 UTC 2023","2912","","Login and logout tests","","Login and logout tests","should change locale to Spanish","should change locale to Spanish",""
"passed","Tue Feb 21 00:24:39 UTC 2023","Tue Feb 21 00:24:43 UTC 2023","4624","","User Test Cases ->: Invalid entries -> ","","User Test Cases ->: Invalid entries -> ","TestCase for The password is too easy to guess.","TestCase for The password is too easy to guess.",""
"passed","Tue Feb 21 00:00:21 UTC 2023","Tue Feb 21 00:00:27 UTC 2023","5726","","Create new lineage structure","","Create new lineage structure","should edit the name of the CHW area","should edit the name of the CHW area",""
"passed","Tue Feb 21 00:14:58 UTC 2023","Tue Feb 21 00:15:00 UTC 2023","2211","","Privacy policy: for an online user","","Privacy policy: for an online user","should show if the user changes their language","should show if the user changes their language",""
"passed","Tue Feb 21 00:05:08 UTC 2023","Tue Feb 21 00:05:13 UTC 2023","5468","","Countdown timer widget","","Countdown timer widget","interact with timer and submit","interact with timer and submit",""
"passed","Tue Feb 21 00:15:03 UTC 2023","Tue Feb 21 00:15:20 UTC 2023","16819","","Privacy policy: conflicts","","Privacy policy: conflicts","should not fail due to document conflict for new offline user","should not fail due to document conflict for new offline user",""
"passed","Tue Feb 21 00:03:26 UTC 2023","Tue Feb 21 00:03:26 UTC 2023","771","","Contact Delivery Form","","Contact Delivery Form","The child registered during birth should be created and should display the proper information","The child registered during birth should be created and should display the proper information",""
"passed","Tue Feb 21 00:01:06 UTC 2023","Tue Feb 21 00:01:11 UTC 2023","5194","","Test Contact Search Functionality","","Test Contact Search Functionality","search by NON empty string should display results with contains match and clears search","search by NON empty string should display results with contains match and clears search",""
"passed","Tue Feb 21 00:09:06 UTC 2023","Tue Feb 21 00:09:09 UTC 2023","3121","","Login and logout tests","","Login and logout tests","should change locale to French","should change locale to French",""
"passed","Tue Feb 21 00:08:55 UTC 2023","Tue Feb 21 00:08:56 UTC 2023","904","","Submit an undo death report","","Submit an undo death report","Should verify that the counter for the Deaths was set to 0.","Should verify that the counter for the Deaths was set to 0.",""
"passed","Tue Feb 21 00:16:40 UTC 2023","Tue Feb 21 00:16:42 UTC 2023","1784","","manifest.json","","manifest.json","works without branding doc","works without branding doc",""
"passed","Tue Feb 21 00:24:55 UTC 2023","Tue Feb 21 00:25:00 UTC 2023","4624","","User Test Cases ->: Invalid entries -> ","","User Test Cases ->: Invalid entries -> ","should require username","should require username",""
"passed","Mon Feb 20 23:51:08 UTC 2023","Mon Feb 20 23:51:20 UTC 2023","11881","","Targets","","Targets","should display targets from default config","should display targets from default config",""
"passed","Tue Feb 21 00:10:11 UTC 2023","Tue Feb 21 00:10:13 UTC 2023","1087","","Token login","","Token login","should display an error when accessing with random strings","should display an error when accessing with random strings",""
"passed","Tue Feb 21 00:04:55 UTC 2023","Tue Feb 21 00:04:59 UTC 2023","3928","","RepeatForm: Repeat form with repeat button","","RepeatForm: Repeat form with repeat button","should display the initial form and its repeated content in English","should display the initial form and its repeated content in English",""
"passed","Tue Feb 21 00:00:39 UTC 2023","Tue Feb 21 00:01:00 UTC 2023","20661","","Create Person Under Area","","Create Person Under Area","create person under area should only see children","create person under area should only see children",""
"passed","Tue Feb 21 00:13:35 UTC 2023","Tue Feb 21 00:13:42 UTC 2023","6518","","Guided tour","","Guided tour","run guided tour and change tab => should close the tour","run guided tour and change tab => should close the tour",""
"passed","Tue Feb 21 00:14:52 UTC 2023","Tue Feb 21 00:14:58 UTC 2023","5397","","Privacy policy: for an online user","","Privacy policy: for an online user","should show french policy on secondary login","should show french policy on secondary login",""
"passed","Tue Feb 21 00:23:40 UTC 2023","Tue Feb 21 00:23:44 UTC 2023","3313","","Bikram Sambat date display","","Bikram Sambat date display","enketo xpath extension function should display correct values when Nepali is selected","enketo xpath extension function should display correct values when Nepali is selected",""
"passed","Tue Feb 21 00:11:57 UTC 2023","Tue Feb 21 00:11:57 UTC 2023","149","","- EDIT permissions disabled","","- EDIT permissions disabled","- Report tab - menu not displayed when sms report selected","- Report tab - menu not displayed when sms report selected",""
"passed","Mon Feb 20 23:58:52 UTC 2023","Mon Feb 20 23:59:21 UTC 2023","28805","","Mute/Unmute contacts using a specific form.","","Mute/Unmute contacts using a specific form.","Should mute a contact using the defined mute_forms (death_report).","Should mute a contact using the defined mute_forms (death_report).",""
"passed","Mon Feb 20 23:51:20 UTC 2023","Mon Feb 20 23:51:27 UTC 2023","7075","","Targets","","Targets","should display correct message when no target found","should display correct message when no target found",""
"passed","Tue Feb 21 00:08:55 UTC 2023","Tue Feb 21 00:08:55 UTC 2023","753","","Submit an undo death report","","Submit an undo death report","Should verify that the undo death report was created","Should verify that the undo death report was created",""
"passed","Tue Feb 21 00:12:33 UTC 2023","Tue Feb 21 00:12:37 UTC 2023","3899","","Online User:  - Options enabled when there are items","","Online User:  - Options enabled when there are items","- Reports tab - Edit/export invisible when NON XML report selected","- Reports tab - Edit/export invisible when NON XML report selected",""
"passed","Tue Feb 21 00:13:29 UTC 2023","Tue Feb 21 00:13:35 UTC 2023","6226","","Guided tour","","Guided tour","run and end guided tour => should close the tour","run and end guided tour => should close the tour",""
"passed","Tue Feb 21 00:02:39 UTC 2023","Tue Feb 21 00:02:39 UTC 2023","738","","Submit a death report","","Submit a death report","Should verify that the report related to the death was created","Should verify that the report related to the death was created",""
"passed","Mon Feb 20 23:57:50 UTC 2023","Mon Feb 20 23:58:01 UTC 2023","10849","","Contact details page: Permissions to show reports and tasks","","Contact details page: Permissions to show reports and tasks","should show reports and tasks when permissions are enabled","should show reports and tasks when permissions are enabled",""
"passed","Tue Feb 21 00:10:44 UTC 2023","Tue Feb 21 00:10:59 UTC 2023","15024","","More Options Menu - Offline User: all permissions disabled","","More Options Menu - Offline User: all permissions disabled"," - all tabs, kebab menu not available"," - all tabs, kebab menu not available",""
"passed","Tue Feb 21 00:22:15 UTC 2023","Tue Feb 21 00:22:23 UTC 2023","8245","","Tasks group landing page","","Tasks group landing page","""before all"" hook for Tasks group landing page","""before all"" hook for Tasks group landing page",""
"passed","Tue Feb 21 00:19:41 UTC 2023","Tue Feb 21 00:19:42 UTC 2023","839","","Service worker cache","","Service worker cache","should load the page while offline","should load the page while offline",""
"passed","Tue Feb 21 00:01:11 UTC 2023","Tue Feb 21 00:01:13 UTC 2023","1867","","Test Contact Search Functionality","","Test Contact Search Functionality","search should clear RHS selected contact","search should clear RHS selected contact",""
"passed","Tue Feb 21 00:13:05 UTC 2023","Tue Feb 21 00:13:05 UTC 2023","220","","Hamburger Menu tests","","Hamburger Menu tests","should open User settings","should open User settings",""
"passed","Tue Feb 21 00:14:32 UTC 2023","Tue Feb 21 00:14:38 UTC 2023","6509","","Privacy policy: for an offline user","","Privacy policy: for an offline user","should show if the user policy changes","should show if the user policy changes",""
